Title,Video ID,Channel,Published At,URL,Description,Video Length
DO THIS in The Morning For Better Sleep!,kZAsOod4DeA,TARIX HealthFit Advice,2025-03-23T15:24:42Z,https://www.youtube.com/watch?v=kZAsOod4DeA,sleep #sleephygiene #shorts #healthtips #insomnia #improvesleep #bettersleep You woke up tired and sleep deprived?,
3 Simple Sleep Hygiene Tips to Help You Sleep Better Tonight!,aWEHz6LtHT0,Branches of Hope,2025-01-21T17:00:01Z,https://www.youtube.com/watch?v=aWEHz6LtHT0,Ready for better sleep? Follow these 3 simple sleep hygiene tips! Check out our blog for more tips and download your FREE ...,
Practice Good Sleep Hygiene | #InnerPeace #HappyLife #StayPositive #StressFree #DailyMotivation,sho2yqIIiaw,Heart Podcaster,2025-03-04T14:58:35Z,https://www.youtube.com/watch?v=sho2yqIIiaw,"""Guides and Motivations to live a Peaceful and Happy Life"" Unlock the Secrets to a Peaceful & Happy Life! #InnerPeace ...",
The Terrifying Truth About Sleep Paralysis 💤😱 #SleepParalysis #SleepHygiene #SleepDisorders,QHrulXVoC2Q,WowFact,2025-03-31T15:09:28Z,https://www.youtube.com/watch?v=QHrulXVoC2Q,Did you know that nearly 8% of people experience sleep paralysis at least once? It's a strange state between dreams and reality ...,
Sleep Hygiene Session for Seniors,YKRj6f9n6PY,The Smiling Souls,2025-01-31T10:12:27Z,https://www.youtube.com/watch?v=YKRj6f9n6PY,Say goodbye to sleepless nights! Our Sleep Hygiene session will help you improve your sleep quality and feel more energised.,
One of the biggest SLEEP Disruptors!!️#sleephealth #sleephygiene #bluelightblockingglasses #sleeptips,VNlmEpz-Bo8,The Bio Bliss,2025-02-23T22:27:04Z,https://www.youtube.com/watch?v=VNlmEpz-Bo8,,
"""Better Sleep Tips 💤 | Dr. Pallabi Sahu on Sleep Hygiene #Shorts""",isAedgQAOXw,Dr Pallabi Sahu - Psychiatrist ,2025-02-10T14:32:51Z,https://www.youtube.com/watch?v=isAedgQAOXw,"Struggling with poor sleep? Dr. Pallabi Sahu, a leading psychiatrist, shares essential Sleep Hygiene Tips to help you sleep ...",
Sleep Hygiene ft. Maddie Sansom | Optimum Joy,_0LFZPOgxcc,Optimum Joy Clinical Counseling,2025-01-28T22:09:26Z,https://www.youtube.com/watch?v=_0LFZPOgxcc,Sleep hygiene isn't just about bedtime routines—it's about creating a lifestyle that supports restorative rest. From limiting screen ...,
"Sleep Hygiene | Conquer Movement Physical Therapy | Wilmington, NC",wHCa39OkPdA,Conquer Movement PT,2025-03-18T18:53:31Z,https://www.youtube.com/watch?v=wHCa39OkPdA,"Additional Info: At Conquer Movement Physical Therapy, we're redefining the standard of care. Our state-of-the-art facility ...",
Quick Tips for Better Sleep Hygiene,iYgFEW9NEJo,Fit Level 99,2025-03-23T11:01:21Z,https://www.youtube.com/watch?v=iYgFEW9NEJo,Discover simple tips to improve your sleep hygiene and enjoy restful nights. #SleepHygiene #BetterSleep #HealthyHabits.,
Fix Your Sleep Now! 💤 3 Hacks for Better Rest & Recovery #recovery #sleephacks #sleep #vitalhustle,q__1e6DqgzQ,VitalHustle,2025-02-02T22:58:38Z,https://www.youtube.com/watch?v=q__1e6DqgzQ,"Struggling to get quality sleep? 🛏️ In this video, we share the top 3 sleep hacks to improve your sleep hygiene and enhance ...",
Why Sleep Hygiene is a COMPLETE Waste of Time for Insomnia!,i6_igzjcLkY,Insomnia Recovery & Sleep Coaching,2025-02-17T06:00:29Z,https://www.youtube.com/watch?v=i6_igzjcLkY,Sleep hygiene for insomnia is one of the most commonly recommended solutions—but here's the truth: It won't cure your insomnia ...,
What Is Sleep Hygiene?,oMlnNMK03bs,Sleep Will Come,2025-03-26T13:01:16Z,https://www.youtube.com/watch?v=oMlnNMK03bs,What Is Sleep Hygiene? More sleep information and a free Sleep Debt Calculator can be found on https://SleepWillCome.com To ...,
The Rewards Of Sleep Hygiene,GAU_646ogDE,"Dr. Hanz, MD",2025-03-11T01:00:11Z,https://www.youtube.com/watch?v=GAU_646ogDE,The Rewards Of Sleep Hygiene #shorts #sleep #wellness #sleephygiene #betterhealth #glowingskin #productivity #healthytips ...,
#bnclinic19 #drrafatjamal #peadiatrics #bestclinicinkolkata  #sleephygiene #childhealth #parkcircus,aS1yV5RjJdw,BN Clinic 19,2025-03-24T11:14:23Z,https://www.youtube.com/watch?v=aS1yV5RjJdw,,
SLEEP HYGIENE #BetterSleep #WellnessTips #HealthyHabits #SelfCare #selfimprovement #viralshort,VQWoIuyLtxI,SEE 3RU YOU With Maahi Singh,2025-01-18T14:38:00Z,https://www.youtube.com/watch?v=VQWoIuyLtxI,"""Good sleep is the secret to a happier, healthier you! Set consistent routines, unplug before bed, and create a calming space for ...",
5 Proven Tips for Better Sleep Hygiene  Sleep Like a Baby!,azQeoB7Jt3g,Putting Health First,2025-02-08T08:56:10Z,https://www.youtube.com/watch?v=azQeoB7Jt3g,"Struggling with sleep? Discover our top 5 tips to maintain sleep hygiene and transform your nightly routine! In this video, we dive ...",
Secrets to DEEP Sleep Every Night! 🌙 #healthyliving #sleep #bettersleep #wellness #health,V5ENCyRpHt4,Muscle Mysteries,2025-03-09T21:00:28Z,https://www.youtube.com/watch?v=V5ENCyRpHt4,Struggling with sleep? Discover effective strategies to improve our nightly rest and wake up refreshed. This video dives into the ...,
Mastering Sleep Hygiene,bEkplaybUCI,What The Doctor Says,2025-03-04T10:30:29Z,https://www.youtube.com/watch?v=bEkplaybUCI,Unlock the secret to restful nights! Discover sleep hygiene tips to boost well-being and mental clarity. #SleepWell #Health ...,
Sleep: The Secret to a Sharp Brain!,TfA2I9noM9c,Carlos Zambrano Bowen,2025-02-28T22:02:26Z,https://www.youtube.com/watch?v=TfA2I9noM9c,"Discover the vital role of sleep in optimizing brain function! Learn how sleep impacts memory, focus, and decision-making.",
Top 10 Secret to Better Sleep! #sleephygiene  #sleeptips #wellness   #mentalhealth  #healthyliving,gS1JBe9eXXQ,Strum-Mona,2025-03-11T21:04:00Z,https://www.youtube.com/watch?v=gS1JBe9eXXQ,,
"Sleep is not a luxury, it's the necessity#Sleep day#sleep hygiene#sleephealth",47M-RGT7JR8,IAmTheBestMom Winging Aspiration,2025-03-14T10:42:41Z,https://www.youtube.com/watch?v=47M-RGT7JR8,,
How to Sleep Better: Sleep Hygiene Tips for Restful Nights  #mentalwellness  #recoveryjourney,LreZpqQ_7Jk,The Recovery Village Drug and Alcohol Rehab,2025-03-13T16:00:20Z,https://www.youtube.com/watch?v=LreZpqQ_7Jk,Improving your sleep quality can help you focus on your addiction or mental health recovery journey. From setting a consistent ...,
How to practice a proper sleep hygiene.,FbFwjzu6MPY,BLIS BRANDING SOLUTIONS,2025-01-16T12:29:59Z,https://www.youtube.com/watch?v=FbFwjzu6MPY,Book a consultation today! Follow for more reels ✓ Doctor Syam @drsyamkrishnaps @doctor_syam DM for online ...,
Sleep Hygiene: Best Practices to Improve Your Sleep Quality!,pIS61WR2q1w,The Disease Vlog,2025-03-24T21:00:46Z,https://www.youtube.com/watch?v=pIS61WR2q1w,"Struggling with poor sleep, insomnia, or constant fatigue? Your sleep hygiene might be the problem! Good sleep is essential for ...",
Is Sleep Hygiene ⚡ the Key to Unlocking Your Potential? 🌙,kfZkSH3EAfA,Modern Endocrine,2025-02-27T01:57:24Z,https://www.youtube.com/watch?v=kfZkSH3EAfA,"In this video, we explore the importance of prioritizing sleep hygiene. Making mindful choices about your rest habits can ...",
Sleep Myths You Need to Stop Believing! #shorts #sleep #healthtips,VSGC3GIJCyA,Everyday Wonders,2025-03-19T12:49:09Z,https://www.youtube.com/watch?v=VSGC3GIJCyA,Struggling with sleep? These 7 surprising sleep facts might change your bedtime routine! ⏳ 4 hours of sleep = productivity ...,
Sleep Hygiene: Unlock Your Full Potential!,dlhZYEZAsTA,Carlos Zambrano Bowen,2025-02-27T21:57:35Z,https://www.youtube.com/watch?v=dlhZYEZAsTA,Discover the secrets to unlocking your full potential with improved sleep hygiene! Join sleep expert Carlos Zambrano as we ...,
The Benefits of Sleep Hygiene for Wellness,LU45scxoU_I,HealthandWellnessPlus ,2025-03-02T01:00:19Z,https://www.youtube.com/watch?v=LU45scxoU_I,"Exploring sleep hygiene's impact on health, covering practices for improving sleep quality and life quality. #SleepHygiene ...",
Healthy Habits: Transform Your Nights with Better Sleep Hygiene #HealthyHabits #Shorts,SPVcSOU9eYs,Healthy Habits,2025-01-20T18:31:04Z,https://www.youtube.com/watch?v=SPVcSOU9eYs,"Unlock the secrets to restful nights with Healthy Habits: Transform Your Nights with Better Sleep Hygiene. In this video, we explore ...",
What is sleep hygiene? #mentalhealth #psychology #mindfulness #wellness #healthcare #sleephygiene,QYKBHwhmAe4,Fund Mental Healthcare,2025-03-21T00:43:30Z,https://www.youtube.com/watch?v=QYKBHwhmAe4,"Sleep hygiene involves creating consistent routines and habits that encourage restful sleep. According to the Sleep Foundation, ...",
Mindful Sleep Hygiene,rLpmZ02iFF8,Buddha's Flute Tones - Topic,2025-03-27T23:02:08Z,https://www.youtube.com/watch?v=rLpmZ02iFF8,Provided to YouTube by eMuzyka Mindful Sleep Hygiene · Buddha's Flute Tones Zen Oasis Frequencies ℗ 2025 Silgoa Music ...,
What makes a routine better for me? These! #bcba #goodsleep #sleephygiene #ceu #webinar,8K6USWC6DSY,Gabrielle Carmody | BCBA LBA CBSS,2025-01-18T02:53:28Z,https://www.youtube.com/watch?v=8K6USWC6DSY,,
Unlocking the Secrets of Sleep#SleepHealth #SleepHygiene #Wellness #MentalHealth #REM,TiApj3_n2Tk,DiscoveryDiaries,2025-03-29T02:00:17Z,https://www.youtube.com/watch?v=TiApj3_n2Tk,"Explore the vital role of sleep in health, uncovering facts about sleep cycles, REM sleep, and tips for better sleep hygiene.",
Your Body LOVES this Sleep Hack👌#sleephealth #scienceofsleep #sleephygiene #sleepregularity #health,0z_kP3TWq6U,The Bio Bliss,2025-03-09T21:24:44Z,https://www.youtube.com/watch?v=0z_kP3TWq6U,,
Sleep Hygiene Preview,sZ_4cvCwBIY,Hamilton Health & Wellness ,2025-02-05T15:45:10Z,https://www.youtube.com/watch?v=sZ_4cvCwBIY,"Discover the secrets to better sleep in our upcoming YouTube podcast! Dive deep into expert tips, science-backed strategies, and ...",
The Secret to Better Sleep? A Simple Bedtime Routine! | Dr. Manning - Gibbs,qJzei7PIuEI,Dr. Manning-Gibbs,2025-02-10T14:10:54Z,https://www.youtube.com/watch?v=qJzei7PIuEI,One of the best ways to improve sleep and reduce stress is by creating a consistent bedtime routine. But what does that actually ...,
Sleep Reminder #doomscrolling #healthyhabits #fitnessmotivation #gymmotivation #sleephygiene,QNW6dQJswGI,DJKeegels,2025-02-16T03:00:21Z,https://www.youtube.com/watch?v=QNW6dQJswGI,fitnessjourney #healthyhabits #gymmotivation #fitnessjourney #fitnessgoals #doomscrolling #procrastination #sleephygiene ...,
Sleep Hygiene💤 Dr.Antonious.SMD Pulmonary Medicine #doctor#consultant #lourdesclinic,G0z5ndoNqrI,Lourdesclinic,2025-01-13T12:03:12Z,https://www.youtube.com/watch?v=G0z5ndoNqrI,,
Sleep Like THIS for Maximum Muscle Growth! (Sleep Hygiene),xRULJSjVOlI,Aykay Fitness,2025-03-05T06:05:19Z,https://www.youtube.com/watch?v=xRULJSjVOlI,Are you ruining your gains while you sleep? Most people focus on workouts & nutrition but ignore one of the biggest factors for ...,
"Effects, Fascinating Facts And Uses Of REM Sleep !!!",wIf6v-3FZK0,Curious Classroom ,2025-02-03T20:35:00Z,https://www.youtube.com/watch?v=wIf6v-3FZK0,"Ever wondered what happens during REM sleep? In this video, we'll dive into the fascinating world of REM sleep, exploring its ...",
"World Sleep Day Recap 💤 | NUS Bazaar Highlights, Sleep Health & Wellness Event at NUS 2025 ✨",GuBo0G8AcuQ,EnergiaRev22,2025-03-13T14:47:52Z,https://www.youtube.com/watch?v=GuBo0G8AcuQ,"We had an unforgettable time at the World Sleep Day celebration at the NUS Bazaar, held at the Frontier Canteen, NUS Science ...",
Sleep and Dementia Link #sleep #mentalhealth #shorts,yyOuYE0RIUQ,Charmaine’s Show,2025-01-10T16:01:04Z,https://www.youtube.com/watch?v=yyOuYE0RIUQ,A recent study reveals a concerning connection between poor sleep and dementia development. Dive into the science as we ...,
Day 306 Sleep Hygiene   Incorporating Gentle Yoga Before Bed,xNDyADAp5co,Comprehensive Healing Solutions & CHS Foundation,2025-01-19T17:15:41Z,https://www.youtube.com/watch?v=xNDyADAp5co,Day 306: Sleep Hygiene - Incorporating Gentle Yoga Before Bed Daily Tip: Gentle yoga stretches before bed prepare your body ...,
Sleep paralysis? Here’s how to prevent it! #SleepTips #Shorts #anxiety #sleepwellness #sleephygiene,vR8Ry712f18,Resilient Heart,2025-02-19T14:00:51Z,https://www.youtube.com/watch?v=vR8Ry712f18,,
What is Sleep Hygiene? | Tips for Better Sleep & Health| Bhopal Hospital,VX1qWNu7yUM,The County Hospital and Research Centre,2025-03-17T07:05:35Z,https://www.youtube.com/watch?v=VX1qWNu7yUM,"What is Sleep Hygiene? Learn how to improve your sleep quality with simple and effective tips! In this video, we'll cover: ...",
How to fall back to sleep? #bettersleepbetterlife #sleephygiene,qL2VWKBGZU0,RolandOng,2025-02-20T07:55:14Z,https://www.youtube.com/watch?v=qL2VWKBGZU0,,
6 Sleep Hygiene Habits You Must Know,w1uCYQNp-Ig,Lets Care All,2025-03-07T09:42:47Z,https://www.youtube.com/watch?v=w1uCYQNp-Ig,"Good sleep is essential for overall health and well-being, yet many struggle with poor sleep quality. Practiced proper sleep ...",
Sweet Dreams | Sleep Hygiene Subliminal,NFRNEmdO7_E,Aviary Audios,2025-01-04T14:44:08Z,https://www.youtube.com/watch?v=NFRNEmdO7_E,"Hello there! I'm Vi! Welcome to the Sweet Dreams subliminal! This audio will help you attain your desired nighttime routine, ...",
Caffeine Curfew: Stop Evening Coffee For Better Sleep!,FTnGBtLVvd8,Elite Biohacker,2025-02-15T13:58:36Z,https://www.youtube.com/watch?v=FTnGBtLVvd8,Discover the perfect caffeine curfew for a great night's sleep! We explore why avoiding late-day caffeine is crucial for healthy sleep ...,
Local expert emphasizes sleep hygiene for kids,t-BrcblFer4,News-Press NOW,2025-03-11T05:00:44Z,https://www.youtube.com/watch?v=t-BrcblFer4,Read more: https://newspressnow.com.,
Did you know? The science of sleep! #facts #sleep #science,UVjKMwyLfOs,MadaboutSHORTZ,2025-03-06T00:32:58Z,https://www.youtube.com/watch?v=UVjKMwyLfOs,,
Sleep Hygiene Tips #facts #doctor #health #tips #motivation #awareness #heart #kidney #liver,p1DtkHzdznA,Dr Amey Narkhede's VIR Clinic,2025-01-17T03:49:55Z,https://www.youtube.com/watch?v=p1DtkHzdznA,Here are some sleep hygiene tips to help you improve your sleep quality: 1. Stick to a Consistent Sleep Schedule Wake up and go ...,
Sleep Hygiene and Digital Detox,YIFS2NZQGRA,Love Begins At Home,2025-01-15T16:28:29Z,https://www.youtube.com/watch?v=YIFS2NZQGRA,Quality sleep is the foundation of good health. ✓ Set a consistent sleep schedule. Power down devices 30 minutes before bed.,
When you sleep late night so what happens #healthyhabits #safetips #sleephygiene,-5iF_nUdnMY,Entertainment with Muhammad and Mahid,2025-01-28T05:55:08Z,https://www.youtube.com/watch?v=-5iF_nUdnMY,,
Sleep Hygiene on WLTX,0UxXq1zHRb8,Lexington Medical Center,2025-03-26T12:49:04Z,https://www.youtube.com/watch?v=0UxXq1zHRb8,"Sarah Cottingham, MD, with Lexington Family Practice Forest Acres sat down with WLTX News 19 to discuss sleep hygiene, ...",
Purpose and meaning is necessary for sleep 🙏,I-K_4RgZWDA,Daniel King,2025-03-04T00:56:59Z,https://www.youtube.com/watch?v=I-K_4RgZWDA,"Purpose and meaning is necessary for sleep This is a clip from my course on ""Purpose & Sleep"" in my sleep support ...",
How Sleep Can Help Your Child Recover from Concussions,kWWTxMf0W-8,Powers Pediarics - Primary Care in Orlando!,2025-03-22T13:34:30Z,https://www.youtube.com/watch?v=kWWTxMf0W-8,"Want your child to bounce back from a concussion? Sleep is key! In this video, we'll explore how good, consistent sleep can ...",
Effective Sleep Hygiene Practices! #shorts #sleep,NW69DbGt6e4,Nature's Serenity,2025-02-15T01:46:10Z,https://www.youtube.com/watch?v=NW69DbGt6e4,,
😴 Why Netflix is Ruining Your Sleep! (Fix Your Sleep Hygiene),D2c1wwACBSg,Nuu3 Nutrition,2025-01-31T19:45:00Z,https://www.youtube.com/watch?v=D2c1wwACBSg,"Falling asleep to Netflix? Great for cliffhangers, TERRIBLE for your REM cycles. If you're struggling with poor sleep, ...",
Guiding Children in Developing Healthy Sleep Hygiene,wpaCe1So-7A,Milky Parent: Your Guide to Raising Happy Kids,2025-03-08T01:01:00Z,https://www.youtube.com/watch?v=wpaCe1So-7A,"Explore the importance of sleep hygiene in children and discover strategies for fostering restful sleep habits through routines, ...",
Ultimate Guide to Sleep Hygiene: Science-Backed Tips for Better Rest,E4vBiyZ34OM,Johnson Thomas,2025-01-04T21:12:44Z,https://www.youtube.com/watch?v=E4vBiyZ34OM,"Struggling with poor sleep? In this 2-minute video, you'll learn science-backed sleep hygiene tips that can help you fall asleep ...",
Today’s Challenge:  Practice good sleep hygiene. #SleepWell #Sleep #SanDiego #RealEstate,oyEXP-rIF5M,Today's Challenge,2025-02-16T02:43:42Z,https://www.youtube.com/watch?v=oyEXP-rIF5M,,
The Dangers of Sleep Deprivation #shortvideo #sleep #health,PZjjfgv5HBU,Next Info,2025-01-15T15:45:02Z,https://www.youtube.com/watch?v=PZjjfgv5HBU,"Sleep is essential for your health, but what happens when you don't get enough? In this short video, discover the surprising ...",
Insomnia – When Sleep Won’t Come,RoIfFWYVMto,Medical Factoids,2025-02-24T02:00:28Z,https://www.youtube.com/watch?v=RoIfFWYVMto,"Trouble falling asleep or staying asleep? This short explores insomnia, a common sleep disorder characterized by difficulty falling ...",
Effective techniques for better sleep#sleeptips #sleephygiene #bettersleep #sleepwell,L5hU6ziLVFg,DailyBeauty,2025-03-28T12:44:36Z,https://www.youtube.com/watch?v=L5hU6ziLVFg,Learn how to improve your sleep.#sleeptips #sleephygiene #bettersleep #sleepwell #healthylifestyle.,
Is sleep deprivation basically brain damage? #neuroscience #sleepscience #sleep #health,Q3ggMWtpF00,The Wellbeing Guy,2025-03-28T11:46:00Z,https://www.youtube.com/watch?v=Q3ggMWtpF00,,
Sleep Hygiene - Give this a go #Sleep #insomnia #calm #meditation #mentalhealth #chronicpain,xvN1Ze8AnSM,The Calm Potential,2025-02-19T04:09:12Z,https://www.youtube.com/watch?v=xvN1Ze8AnSM,Give this a go. Set parameters for mobile phone use. This will help you understand how addicted to stimulation you are and why ...,
🎁 Day 10: Effortless Sleep Checklist – Start Prioritising Rest in 2025,LA6ep3EgAmg,Shari Ware,2025-01-02T23:33:34Z,https://www.youtube.com/watch?v=LA6ep3EgAmg,"On the 10th Day of Christmas, it's time to prioritise rest with Effortless Sleep: 5 Simple Steps for Better Sleep Hygiene Tonight!",
The Value of Sleep Hygiene for Mental Health,gKMalIUIB4w,Thrive & Insight,2025-02-16T01:00:40Z,https://www.youtube.com/watch?v=gKMalIUIB4w,"Exploring sleep hygiene as a practical mental health strategy, with insights from Dr. Karen and personal experiences shared by ...",
Beat Insomnia: Master Your Sleep Schedule!,Y02rxLLDRl0,Thomas Thomsen,2025-02-20T19:46:59Z,https://www.youtube.com/watch?v=Y02rxLLDRl0,Unlock the secret to a perfect night's sleep! Learn how light exposure impacts your sleep cycle and establish a consistent sleep ...,
What Is Sleep Hygiene,EKz8EOLq7zU,SleekExplains ,2025-01-29T23:03:34Z,https://www.youtube.com/watch?v=EKz8EOLq7zU,"In this video, we dive into the best sleep hygiene practices to help you learn how to sleep better and faster, answering your ...",
Effective Sleep Hygiene Practices #shorts,X6I2ubRRXA0,Nature's Serenity,2025-02-13T06:34:46Z,https://www.youtube.com/watch?v=X6I2ubRRXA0,In this video you will get a run down on the 5 most important sleep practices you should already have in your daily living! #health ...,
Bedtime Tips for Better Sleep !#sleep #sleepquality #sleephygiene  #health #facts  #goodsleep,r8a8Xxm0uP4,Mindful health,2025-01-01T12:50:04Z,https://www.youtube.com/watch?v=r8a8Xxm0uP4,Pre-Sleep Routine (30-60 minutes before bed) 1. Dim the lights: Darkness signals the brain to produce melatonin. 2. Take a warm ...,
Sleep Hygiene: Ayurveda's Daily Rituals #sleephygiene #ayurveda  #bettersleep  #herbalremedies,fAofF8cCnKM,"Dr. Shivani Gupta, Ayurveda + Inflammation Expert",2025-01-30T12:45:04Z,https://www.youtube.com/watch?v=fAofF8cCnKM,"To learn more about Dr. Shivani Gupta, connect with her on: https://www.facebook.com/groups/theinflammationsolution/ ...",
Sleep Hygiene Tips 💤 | Dr. Pallabi Sahu on Better Sleep #Shorts,scLRiR6sTX0,Dr Pallabi Sahu - Psychiatrist ,2025-02-10T14:42:38Z,https://www.youtube.com/watch?v=scLRiR6sTX0,"Tired of sleepless nights? Dr. Pallabi Sahu, a leading psychiatrist, shares Sleep Hygiene Tips to help you sleep better and ...",
7 Simple Tips for Better Sleep Hygiene,FOOm64Z1hAc,Unlock Your Best Self Today,2025-01-21T09:05:50Z,https://www.youtube.com/watch?v=FOOm64Z1hAc,"Struggling to get a good night's sleep? Discover seven simple, evidence-based tips to improve your sleep hygiene and wake up ...",
Track your sleep. Check in with your doctor. #selfcare #stressrelief,Iqc4yUbZbC0,Wellness for you with Toni,2025-03-02T14:05:27Z,https://www.youtube.com/watch?v=Iqc4yUbZbC0,"Today on day 2 we are discussing the importance of tracking sleep! In today's fast-paced world, especially for first responders, ...",
The Transformative Power of Sleep Hygiene,iglQ5NZqffk,Health Manifest ,2025-03-29T00:00:39Z,https://www.youtube.com/watch?v=iglQ5NZqffk,"Explore the profound impact of sleep hygiene on mental wellbeing, promoting healthier sleep patterns and improved mental ...",
#love #sleepwellness #sleephygiene #musiccover #optimalsleep,uAqTPChM3wk,Ike Tobe,2025-01-01T21:34:12Z,https://www.youtube.com/watch?v=uAqTPChM3wk,,
Enhancing Sleep Quality Through Hygiene#sleep #wellbeing #healthylifestyle #sleepquality#shorts,phITmda24Gs,Nature Plus,2025-01-28T12:09:05Z,https://www.youtube.com/watch?v=phITmda24Gs,Enhancing Sleep Quality : This guide outlines essential sleep hygiene practices to improve sleep quality and overall well-being.,
The Rejuvinating Principle: Sleep #sleep #sleephygiene #sleeproutine #rejuvenating #hormones,moMA8fmHkB8,High Caliber Life,2025-02-02T04:39:56Z,https://www.youtube.com/watch?v=moMA8fmHkB8,,
😴 SLEEP HYGIENE 😴 #brainhealth #doctorlife #sleephygiene  #healthcare,Yzajstk4mtk,NeuroCurious,2025-02-04T19:33:23Z,https://www.youtube.com/watch?v=Yzajstk4mtk,Did you know about sleep hygiene? #lovesleeping #guide #meditation #doctorguide #instagramreels #goodsleephabits ...,
Sleep Will Damage Your Brain #sleep #sleeping #sleepdeprivationeffects #insomnia #brain #brainmemory,LEfoLcwh-rA,Kaliiim,2025-02-14T17:01:53Z,https://www.youtube.com/watch?v=LEfoLcwh-rA,"Sleep plays a crucial role in memory consolidation, helping the brain process and store information effectively. During different ...",
#beautiful place #virelsound #sleephygiene #flooding #pleasevirel #travel #nature,oqwp3JwZHbc,Video Venture vloger,2025-02-18T12:53:13Z,https://www.youtube.com/watch?v=oqwp3JwZHbc,,
The Impact of Sleep Meditation on Psychological Well-being,jvymmlfb0Yc,Mental Mosaic,2025-02-25T01:00:45Z,https://www.youtube.com/watch?v=jvymmlfb0Yc,The script explores how sleep meditation enhances psychological well-being by improving sleep quality and promoting emotional ...,
Stop Waking Up Tired! Try These 5 Sleep Hacks #sleephygiene #busylifestyle,fUfRrEjHuhM,Kieran - Vibesfitness,2025-01-30T00:56:56Z,https://www.youtube.com/watch?v=fUfRrEjHuhM,,
Is Deep Sleep the Secret to Better Health? 🌙✨,Gc3Al7OAjDQ,Modern Endocrine,2025-01-28T14:00:24Z,https://www.youtube.com/watch?v=Gc3Al7OAjDQ,"In this video, we explore the importance of deep sleep for reducing inflammation and boosting energy levels. Discover our sleep ...",
Sleep Hygiene: Top 7 Tips for Better Sleep - How to Get 8 Hours of Rest Every Night #sleepissues,xEGPnCmu2z4,Chill Bytes,2025-01-09T14:11:38Z,https://www.youtube.com/watch?v=xEGPnCmu2z4,,
Sleep Fast: 5 Hacks for Better Sleep Tonight,LK5JS15RvrA,Spirituality ,2025-01-26T17:30:06Z,https://www.youtube.com/watch?v=LK5JS15RvrA,Struggling to fall asleep? These 3 QUICK sleep hygiene hacks will help you drift off in no time! Learn simple tips to optimize your ...,
Boost Your Sleep Hygiene for Better Heal #SleepHygiene #MentalHealth #BetterSleep #HealthTips #Sleep,VDjW5L6v7YU,Health Studio,2025-01-06T19:25:54Z,https://www.youtube.com/watch?v=VDjW5L6v7YU,"Transform your nights and boost your sleep hygiene for better health! In this fast-paced YouTube Shorts video, we dive into why ...",
Improve Your Sleep Hygiene For Enhanced Muscle Recovery,wJnwQYtlQDU,The One Percent Fight Club,2025-03-05T23:33:00Z,https://www.youtube.com/watch?v=wJnwQYtlQDU,"Subscribe for Daily Motivation, Workout of the Day, and Evening Recovery Tips #OPFC.",
Sleep Hygiene 101: How to Improve Your Sleep & Reduce Back Pain,0wVLDnfYEaE,Pain Free Lives,2025-03-05T22:44:11Z,https://www.youtube.com/watch?v=0wVLDnfYEaE,"Getting quality sleep isn't just about how long you sleep—it's about how well you sleep. In this video, Dr. Mohammad Aalai of ...",
Improve your sleep quality tonight#sleeptips #sleephacks #bettersleep #sleephygiene,kLDXOhDz92I,Wwew Weery,2025-03-06T01:45:04Z,https://www.youtube.com/watch?v=kLDXOhDz92I,Learn how to improve your sleep quality.#sleeptips #sleephacks #bettersleep #sleephygiene #healthylifestyle.,
9 Night Hygiene Habits for Glowing Skin and Better Sleep,LnKI-GOohl8,Healthy Life,2025-01-21T12:21:11Z,https://www.youtube.com/watch?v=LnKI-GOohl8,Description:** Unlock the secret to radiant skin and rejuvenating sleep with our comprehensive guide on 9 nighttime hygiene ...,
Sleep hygiene--Role of sleep in maintaining health,FA49f7_QQk8,Holistic Health & Wellness,2025-01-02T23:03:50Z,https://www.youtube.com/watch?v=FA49f7_QQk8,"If u want a detailed video on this topic,comment in comment box & like the video. #shorts #youtubeshorts ##shortvideo #short ...",
