Title,Video ID,Channel,Published At,URL,Description,Video Length,Views,Likes,Comments
Celery juice on the ⏰ #shorts #celeryjuice #juice #health #wellness,s10nYDWHVas,Homemade Juice and More!,2025-01-17T11:34:16Z,https://www.youtube.com/watch?v=s10nYDWHVas,,8,,,
Healthy sip series: part 1 celery juice #healthydrink #immunitybooster #antiinflammatory pinned 👇,qI6dAw1lAGU,RuchiRaaga,2025-01-16T12:58:01Z,https://www.youtube.com/watch?v=qI6dAw1lAGU,,26,,,
#Celery Juice #healthy,dDvdH6z7vBc,cooktyuber caderon,2025-01-15T23:32:36Z,https://www.youtube.com/watch?v=dDvdH6z7vBc,,29,,,
Celery juice #asmr #healthy #fresh #youtubeshorts #youtubeshort,lMq09i1D4DM,Miram Majid Pk,2025-01-15T23:08:30Z,https://www.youtube.com/watch?v=lMq09i1D4DM,asmrsounds #asmrvideo #ytshorts #ytshortsvideo.,12,,,
5 key benefits of celery juice for your health💚,8E5x9vNqDXs,Anastasia_energy,2025-01-15T19:07:24Z,https://www.youtube.com/watch?v=8E5x9vNqDXs,CeleryJuiceBenefits #HealthyLifestyle #DetoxYourBody #skinhealth #boostimmunity #naturalhealing #antiinflammatoryfoods ...,22,,,
Celery juice for morning boost,zjsZIAvO9rQ,SydneyWalkAlong,2025-01-15T02:12:42Z,https://www.youtube.com/watch?v=zjsZIAvO9rQ,,60,,,
The Power of Celery Juice -I tried the Medical Mediums 3-6-9 cleanse #heavymetaldetox,8Mrq_XVmYW0,The Queen Of Smoothies,2025-01-14T08:15:00Z,https://www.youtube.com/watch?v=8Mrq_XVmYW0,"I tried the ""Medical Medium"" 3-6-9 Cleanse and did my shopping at Lidl! Watch to see what I bought, how I prepped, and my ...",44,,,
Best PLANT juice for strong bones and MUSCLE | CELERY juice Heals Everything,ubUObsi7hgk,Mannys Fitness Fortress,2025-01-14T02:51:53Z,https://www.youtube.com/watch?v=ubUObsi7hgk,Best plant juice for strong bones and muscles | CELERY juice Heals Everything #healthyfood #organic #nutrition.,47,,,
How I Lost 25 LBS with Celery Juice 🥒🔥,bRrx09SwHXc,Josh The Derelict,2025-01-14T02:11:41Z,https://www.youtube.com/watch?v=bRrx09SwHXc,Most people have already given up on their New Years Resolutions- have you? I've always kept my health journey private... until ...,11,,,
Celery Juice  Kidney Health & Arthritis Prevention,iDG9nL9BSYQ,thefoodbeautifullife,2025-01-13T16:27:07Z,https://www.youtube.com/watch?v=iDG9nL9BSYQ,Did you know celery juice can support kidney health and help prevent uric acid buildup? This natural remedy works to break ...,28,,,
Daily Celery Juice. #Juicer #CeleryJuice #CeleryJuiceBenefits #HealthierChoices #SareFoods,2pZu8WztMvc,Sare_Flow,2025-01-13T04:31:48Z,https://www.youtube.com/watch?v=2pZu8WztMvc,,61,,,
Celery Juice Benefits: Hydration & Gut Health Made Simple! #guthealth #celery,Lec5DCeNkwY,Gliim Lava,2025-01-12T15:53:25Z,https://www.youtube.com/watch?v=Lec5DCeNkwY,,34,,,
Cucumber and Celery juice. So refreshing. I take one shot a day. I will be trying different recipes.,hpPbgoHJuDo,Lydia Lifestyle ,2025-01-10T03:32:06Z,https://www.youtube.com/watch?v=hpPbgoHJuDo,,40,,,
#bloodorange #honeydew #pineapple #cucumber #lemon #celery #Juice #juicing #ginger #juicerecipes,EA8Ki4grFBs,Willow Winds Home & Garden ,2025-01-09T05:00:16Z,https://www.youtube.com/watch?v=EA8Ki4grFBs,,19,,,
The truth about celery juice! #celeryjuice #medicalmedium,20PzxaqgPGc,The Vlogging Truth,2025-01-08T00:01:08Z,https://www.youtube.com/watch?v=20PzxaqgPGc,,49,,,
"Green Celery Juice | Quick, Easy, and Tasty",ziGsyw9_BWc,Life With Tia,2025-01-07T13:02:58Z,https://www.youtube.com/watch?v=ziGsyw9_BWc,,52,,,
What Happens If You Drink Celery Juice for 7 Days,mdjEEgCEhdU,VitalFuse,2025-01-06T01:00:29Z,https://www.youtube.com/watch?v=mdjEEgCEhdU,"Curious about the celery juice craze? In this video, we explore what happens if you drink celery juice for 7 days. Discover the truth ...",126,,,
Juicing to live #celery juice,v7L9WE0KOAA,Hope Evans,2025-01-05T23:55:20Z,https://www.youtube.com/watch?v=v7L9WE0KOAA,,11,,,
Celery juice l amla l #healthy juice shorts#youtubeshorts #ytshorts,mi5lwy8cWBM,Radha1970,2025-01-05T04:54:15Z,https://www.youtube.com/watch?v=mi5lwy8cWBM,,26,,,
Let's make celery juice before breakfast/just your breakfast #shorts #juicing #celeryjuice  #celery,36ybvZejzNM,Malou Baril,2025-01-04T20:47:55Z,https://www.youtube.com/watch?v=36ybvZejzNM,,61,,,
What happen if man frink celery juice everyday?#fruit #health #shorts,tRW54JxSQDU,Fit For You- FFY,2025-01-04T12:30:51Z,https://www.youtube.com/watch?v=tRW54JxSQDU,,29,,,
Juice Generation Celery Juice,S2bwbMb9kYA,Bianca Brookes,2025-01-04T03:59:57Z,https://www.youtube.com/watch?v=S2bwbMb9kYA,,11,,,
Cleansing celery juice | #juicing for #health,tf5PQT3fmms,Green Box Gardener,2025-01-03T12:01:14Z,https://www.youtube.com/watch?v=tf5PQT3fmms,,41,,,
"Pineapple green apples, cucumber lemon celery juice#juicing#fruit#veggies#shorts#youtubeshorts",K0VpIL9372c,Food for Life with Lucy ,2025-01-03T05:07:00Z,https://www.youtube.com/watch?v=K0VpIL9372c,,61,,,
Celery Juice #healthy #nosugar  #yummy #musttry #drink #juice  #organic #easy #shorts #youtubeshorts,GZECfwZX-kc,Cook or Look ,2025-01-02T19:15:00Z,https://www.youtube.com/watch?v=GZECfwZX-kc,"Celery Juice Recipe Wash 1 bunch of celery thoroughly and cut off the base and tips. If using a juicer, feed the stalks through and ...",27,,,
#fy #fypviral #explorewithmsbelle #foodshorts #juice #celeryjuice #celery #healthyfood #love,W8c31Jzx2D4,Explore with Ms. Belle,2025-01-01T21:00:17Z,https://www.youtube.com/watch?v=W8c31Jzx2D4,,49,,,
Benifits of drinking Celery Juice,jDj7L_74SBw,RandomBrilliance,2025-03-19T20:39:17Z,https://www.youtube.com/watch?v=jDj7L_74SBw,CELERY JUICE: The Green Drink That's Changing Lives? | Health Benefits Explained Discover why celery juice has become a ...,91,,,
Making Celery Juice in the Hurom H70-FT vs the Omega MM1500,uDc9AxIX3mQ,Naturally Rawsome,2025-03-17T15:14:50Z,https://www.youtube.com/watch?v=uDc9AxIX3mQ,In this video im juicing equal amounts of celery with the Hurom H70-FT and the Omega MM1500 ao you can decide which juicer ...,128,,,
🥕 Kuvings AUTO10 Plus Juicer: ABC Celery Juice Recipe,YS1hKDrpnhs,Kuvings USA,2025-03-14T13:00:48Z,https://www.youtube.com/watch?v=YS1hKDrpnhs,"Juicing with the Kuvings Hands-Free Slow Juicer AUTO10 Plus saves you time from chopping, prepping, and feeding your ...",104,,,
Celery Juice | Keeping it simple for maximum impact,KHgFQvwJ_QA,The Unretired Reporter,2025-03-11T07:27:40Z,https://www.youtube.com/watch?v=KHgFQvwJ_QA,It's the drink that looks like it tastes... the aroma of grass clippings is the not the first hint of the flavour that hits more than once.,204,,,
#helathy #celeryjuice #trending #glowingskin #juice #tips #viralshort #trending #foryou #celeryjuice,xMTJT3axPcY,Divya USA vlogs ,2025-02-07T05:07:12Z,https://www.youtube.com/watch?v=xMTJT3axPcY,,43,,,
Healthy Celery juice early in the morning 🌄,_Nb_uhuhpyk,Life is beautiful ,2025-02-05T17:20:31Z,https://www.youtube.com/watch?v=_Nb_uhuhpyk,,22,,,
Cold Pressed Celery Juice in Nama J2 Juicer Code RIANE55 #healthylifestyle #juicewrld #health,kV8lD2z3nqU,her healthy style,2025-01-09T23:40:52Z,https://www.youtube.com/watch?v=kV8lD2z3nqU,I attribute 100% celery juice to making one of the biggest impacts on my gut health when I was healing from a range of symptoms.,18,,,
ABC Juice: To Drink or Not to Drink | Dr Pal #health #tips #shorts,rO20sdD-q_o,Dr Pal,2025-02-20T12:30:07Z,https://www.youtube.com/watch?v=rO20sdD-q_o,"ABC juice is a fiber heist! Better to eat than drink but if you can't eat, some fiber is better than none. So drink up ! #healthtips ...",58,,,
Simple Green Juice #onestopchop,dJffssTyVIw,OneStopChop,2025-03-06T22:18:01Z,https://www.youtube.com/watch?v=dJffssTyVIw,Green Detox Juice Recipe Join the family and cook with me! Find more delicious recipes here: https://onestopchopllc.com ...,60,,,
🍠Cold Pressed Sweet Potato Carrot Juice Nama J2 code RIANE55 #healthylifestyle #health #juicewrld,jCWaSBmnp6k,her healthy style,2025-01-18T15:51:53Z,https://www.youtube.com/watch?v=jCWaSBmnp6k,"Did you know you can juice raw sweet potatoes? They are actually really delicious juiced too. Mixing them with carrots, apples, ...",20,,,
Try These Secret Health Drinks #healthy #motivation #selfimprovement #healthy,F_Ga1EwB_yk,Living The EudaLife,2025-01-28T17:22:00Z,https://www.youtube.com/watch?v=F_Ga1EwB_yk,,23,,,
Cold Pressed Liver Cleansing Juice Nama J3 Juicer Discount Code RIANE55 #health #healthylifestyle,CbC1JEAE8bE,her healthy style,2025-01-03T23:14:20Z,https://www.youtube.com/watch?v=CbC1JEAE8bE,"Brussels Sprouts are high in Vitamin C for boosting immune and skin health, high in Vitamin K for healthy blood and bone support, ...",18,,,
Cold Pressed Green Juice For Gut Health Nama J2 Juicer code RIANE55 #healthylifestyle #juicewrld,JjNL3sbwm54,her healthy style,2025-01-11T15:47:44Z,https://www.youtube.com/watch?v=JjNL3sbwm54,"A green chlorophyll packed juice to increase energy, detoxify, improve digestion, and nourish the cells. I love adding a mix of ...",24,,,
🍎 Kuvings AUTO10 Plus Slow Juicer: ABC Celery Recipe,BCA2Pp7xHTs,Kuvings USA,2025-03-27T13:55:51Z,https://www.youtube.com/watch?v=BCA2Pp7xHTs,Watch the full connected video! Recipe 3 beets 2 apples 2 carrots 2 stalks of celery @juicefeaster Shop AUTO10 Plus linked ...,53,,,
Glowing skin juice🍹🥬 #shorts #glowingskin #aesthetic #fypviralシ,_fQUWdGtFHY,Aesthetic core,2025-02-26T13:17:20Z,https://www.youtube.com/watch?v=_fQUWdGtFHY,,21,,,
"Green makes you Clean (Celery, Ginger & Lemon Juice)#shorts #celeryjuice #healthydrinks",3cv6cGXY9Ds,The Cooking Chronicle,2025-01-25T10:30:04Z,https://www.youtube.com/watch?v=3cv6cGXY9Ds,"Celery juice is a powerhouse of essential nutrients. It's rich in vitamins A, C, and K, as well as folate and potassium.",35,,,
Make celery juice with me! 💚🥬🥒🌱🍏,YHv09tiMYUo,Marjorie Lewis,2025-01-13T03:38:35Z,https://www.youtube.com/watch?v=YHv09tiMYUo,,43,,,
Which One Is Your Favourite? 🤔 | Healthy Juices,ZuaZGPf1KVE,HealthHeaven ,2025-02-05T13:32:11Z,https://www.youtube.com/watch?v=ZuaZGPf1KVE,Which One Is Your Favourite? | Healthy Juices #health #shorts #youtubeshorts.,16,,,
New Year New Me Healthy Recipes: Celery Juice #celeryjuice,ZnNj70UObG0,Milky Plant ,2025-01-09T08:30:13Z,https://www.youtube.com/watch?v=ZnNj70UObG0,Ingredients: * 1 stalk of celery * 1/4 or 30mls of an apple (for sweetness) Procedure: 1. Add celery and apple to your Milky Plant ...,22,,,
Freshly chopped celery #celery #vegetables #farming #agriculture #celeryjuice #shorts a,Q5YKvHTtbT0,"Miley

",2025-02-06T12:59:26Z,https://www.youtube.com/watch?v=Q5YKvHTtbT0,,,,,
CELERY APPLE JUICE #shorts #shortsfeed #shortvideo,0vvhRROuK9g,TESS Lifestyle Vlog,2025-02-08T12:54:12Z,https://www.youtube.com/watch?v=0vvhRROuK9g,,24,,,
You Won't Believe The Benefits Of Celery Juice #DetoxNaturally #GutHealth #DrinkYourGreens,TErEBPMW108,Human Garage TV,2025-03-05T14:00:53Z,https://www.youtube.com/watch?v=TErEBPMW108,"Celery juice! Did you know when you take celery juice first thing in the AM on an empty stomach, it's a natural antibiotic, ...",38,,,
Celery to be chopped and grown in 2025 #celery#vegetables #celeryjuice #farming #shorts,bKsLQlwqBDs,"Miley

",2025-02-03T04:34:23Z,https://www.youtube.com/watch?v=bKsLQlwqBDs,,,,,
post holiday cleanse. 🍍🥒🍋 #celeryjuicechallenge #celeryjuice #detoxjuice #healthylifestyle,PrRFG4Gp4BQ,Plant Mother,2025-01-15T19:46:40Z,https://www.youtube.com/watch?v=PrRFG4Gp4BQ,,40,,,
Celery juice or Tomato juice? #shorts #quiz #food,u0Y06Ge6BoE,Pick Kick VN,2025-03-06T17:02:49Z,https://www.youtube.com/watch?v=u0Y06Ge6BoE,Celery juice or Tomato juice? #shorts #quiz #food.,32,,,
For a glowier skin ✨ #glowingskin #healthylifestyle #celeryjuice #lifestyle #healthyrecipes,aDidqvZOrKM,Lori Polat H.,2025-03-01T14:34:33Z,https://www.youtube.com/watch?v=aDidqvZOrKM,,25,,,
RESET WITH ME: CELERY JUICE,g2xrPZLaMio,Frankly Gifted ,2025-02-23T19:14:16Z,https://www.youtube.com/watch?v=g2xrPZLaMio,"This juice removes inflammation from the body,you will want to try it out.",36,,,
Homemade Celery Ginger shots #gingershot #juicing #juicingrecipes #wellnessshots #gingerjuice,jvqz6_PTmH0,Living Well by Nicki,2025-03-12T15:24:49Z,https://www.youtube.com/watch?v=jvqz6_PTmH0,,46,,,
How to make celery juice #recipe#juicingforhealth  https://youtu.be/Kz8zTrxLYNA?si=-O4UEGkjQLrJO171,38ReLZhfMQw,Bintghade Recipes ,2025-01-21T07:00:02Z,https://www.youtube.com/watch?v=38ReLZhfMQw,,15,,,
Celery juice..it’s been a while.,nMskRKwqSNc,Lauren Hefez,2025-01-26T14:06:00Z,https://www.youtube.com/watch?v=nMskRKwqSNc,juice #celery #mom #afternoon #juicing #celeryjuice #greenjuicerecipe.,40,,,
Green Juice using the #namawell J2 Juicer #greenjuice #greenjuicerecipe #juicingrecipes,ldUD-6m_4nM,"Nicole L. Cammack, Ph.D.",2025-03-04T19:00:37Z,https://www.youtube.com/watch?v=ldUD-6m_4nM,This juice stays in constant rotation for me. Celery + Pears + Pineapple = YUMMY!! #greenjuice #juicing #juicingrecipes ...,35,,,
Celery juice for clear skin 🥒,K47j3Dt6rkY,Ionela Șoltoian,2025-02-11T18:11:09Z,https://www.youtube.com/watch?v=K47j3Dt6rkY,,16,,,
Carrot/ orange/ ginger juice ✅#health #juicing #wellness #shorts,bi5mkMJ0XAI,karina,2025-03-12T12:06:47Z,https://www.youtube.com/watch?v=bi5mkMJ0XAI,,16,,,
Carrot/ orange/ ginger juice ✅#health #juicing #wellness #shorts,bi5mkMJ0XAI,karina,2025-03-12T12:06:47Z,https://www.youtube.com/watch?v=bi5mkMJ0XAI,,16,,,
Is celery juice worth the hype?,OnObXyOvG_s,WorthIt,2025-03-02T17:45:00Z,https://www.youtube.com/watch?v=OnObXyOvG_s,The hype behind celery juice explained #fok.,15,,,
I made some tuna salad with celery. Before the remaining goes bad I juice it! #celeryjuice #juicing,8nVrLrZK3aM,Samples of Us,2025-01-23T03:44:42Z,https://www.youtube.com/watch?v=8nVrLrZK3aM,,18,,,
Miracle juice recipe|Morning Drink|🥕beet-celery-🥒Rich in Nutrients|High Fiber|Really amazing#food,Aavb03Mr8U4,Roja's Garden Vibes,2025-02-14T01:54:12Z,https://www.youtube.com/watch?v=Aavb03Mr8U4,Ingredients: 3 carrots 4 ribs of celery 2 small cucumber 1/2beetroot 1/8 lemon 1/2 inchGinger Thanks for watching! Please do stay ...,50,,,
"The Secret To Healthy, Glowing Skin From Within🌱✨ #glowingskin #healthyskin #healthy #celeryjuice",NZ0N7FCRv60,Sierra Lane Victoria,2025-03-21T22:39:30Z,https://www.youtube.com/watch?v=NZ0N7FCRv60,I can't preach this enough celery juice has sooo many benefits! Drink 16 ounces a day on an empty stomach if you can.,25,,,
Celery Juice on an Empty Stomach?,_pVtj8j5L8U,Marefat,2025-02-01T17:04:12Z,https://www.youtube.com/watch?v=_pVtj8j5L8U,,11,,,
Celery juice isn’t for everyone. Here’s why.,rSCsDA1OSys,Dr. Alex Heyne - Acupuncture and Chinese Medicine,2025-02-07T15:01:15Z,https://www.youtube.com/watch?v=rSCsDA1OSys,Check out his free guide: 4 healing practices that can add years to your life with Traditional Chinese Medicine ...,66,,,
#forglowingskin #celeryjuice #skinbrightening #celery,P9SSTd1LLrc,Shalinisahu,2025-03-13T11:03:24Z,https://www.youtube.com/watch?v=P9SSTd1LLrc,,52,,,
Celery Juice Benefits #celeryjuice,H7hoQ4s0Iko,LittleJoyEats,2025-03-18T05:49:48Z,https://www.youtube.com/watch?v=H7hoQ4s0Iko,"Celery, Pineapple, and Cucumber Juice: Benefits Overview Enjoy a refreshing blend of celery, pineapple, and cucumber juice ...",25,,,
Shalini passi's morning beetroot juice 🥤#beetrootjuice #healthydiet #ghazala 's lyf,V7kEEhbiNyc,Ghazala's lyf☁️🌷,2025-03-01T13:22:11Z,https://www.youtube.com/watch?v=V7kEEhbiNyc,,20,,,
Celery Juice 🚫 🥑 #TruthNotTrends #BalancedHealth,UuNjrJnjXUU,Fida Hammoud,2025-02-24T08:43:06Z,https://www.youtube.com/watch?v=UuNjrJnjXUU,,53,,,
Juice With Me | Celery Juice #juicing #celeryjuice #clearskin,lNOYF2DPPS4,Sierra Davon,2025-03-04T14:29:40Z,https://www.youtube.com/watch?v=lNOYF2DPPS4,,15,,,
"10 Powerful Juice Recipes for Health: Boost Energy, Immunity & More!",syByZaWEMZg,Elemental Glow,2025-01-22T17:02:04Z,https://www.youtube.com/watch?v=syByZaWEMZg,"Discover 10 amazing juice recipes that target specific health issues like fatigue, weak immunity, joint pain, poor digestion, hair ...",36,,,
What Drinking Celery Juice Will Do To Your Body #healthtips #facts #nutritionfacts #shorts,t4VLGGKqUtM,MINUTE HEALTH TIPS,2025-01-22T14:01:05Z,https://www.youtube.com/watch?v=t4VLGGKqUtM,https://linktr.ee/minutehealthtips Disclaimer: The information provided on this channel is for educational and informational ...,31,,,
The Anti-Inflammatory Benefits of Celery Juice,zOMNRtkvlu0,Nutriknow,2025-03-28T00:00:49Z,https://www.youtube.com/watch?v=zOMNRtkvlu0,Explore the anti-inflammatory benefits of celery juice and its impact on body health. #CeleryJuice #HealthTips #AntiInflammatory ...,41,,,
Day 5/30days of healthy eating//celery juice/broccoli pappu#youtubeshorts #shorts #ytshorts #food,kH8tJp8q5UA,SumaSatwik diaries,2025-01-12T14:52:24Z,https://www.youtube.com/watch?v=kH8tJp8q5UA,Day 5/30days of healthy eating//celery juice/broccoli pappu#youtubeshorts #shorts #ytshorts #food.,181,,,
Celery is beneficial high antioxidants.  #freshjuice #vegetablejuice #greenjuice #celeryjuice,69z4nO1bIf0,Gorgeous portia ,2025-03-13T16:28:04Z,https://www.youtube.com/watch?v=69z4nO1bIf0,,56,,,
Surprising Health Benefits of Celery!,5GOuDW9sDHQ,Revive and Thrive,2025-03-14T00:23:11Z,https://www.youtube.com/watch?v=5GOuDW9sDHQ,Top Health Benefits of Celery: ✔️ Supports Digestion – Rich in fiber & antioxidants to promote gut health & reduce bloating ...,50,,,
"pineapple, cucumber, celery, ginger, ￼fresh juice ￼. #freshjuice #fypyoutubeshorts #fyp",mnHB6eHAXDs,Omozekitchen,2025-01-22T14:21:40Z,https://www.youtube.com/watch?v=mnHB6eHAXDs,,59,,,
Revitalize Your Body with This Refreshing Celery Green Juice! 💚🥒,nmIUmCc24OE,JuiceNext,2025-02-07T11:12:49Z,https://www.youtube.com/watch?v=nmIUmCc24OE,"Revitalize Your Body with This Refreshing Celery Green Juice! Fuel your day with this hydrating, nutrient-packed blend of ...",12,,,
🥒Your Liver will Thank You for this🍋💚 #wellnessshots #celeryjuice #healthyliving #asmrsound #gut,Am8hcuXE8Ts,Its Ro’s Life,2025-03-30T03:04:55Z,https://www.youtube.com/watch?v=Am8hcuXE8Ts,,48,,,
Celery juice heals 💚 #celeryjuice #healing #holistichealth #medicalmedium,SJvUDhCtfVM,Caitlin Marie,2025-02-23T13:18:39Z,https://www.youtube.com/watch?v=SJvUDhCtfVM,,15,,,
"Apples , Cucumbers, Ginger , Celery, Cilantro , Lemon , Kiwi ,Chia Seeds & Pineapple  #detox",kD9ngnq_Pvk,AlexP,2025-01-27T04:00:50Z,https://www.youtube.com/watch?v=kD9ngnq_Pvk,,20,,,
Celery juice prep #ASMR 🥒🤍#ASMRvideo #ASMRsounds #CeleryJuice,VYxf-lGZYWQ,Ana Kiseliova,2025-03-13T16:19:29Z,https://www.youtube.com/watch?v=VYxf-lGZYWQ,"I keep it pure—no mixing, no extras. Just freshly squeezed celery juice on an empty stomach for max benefits. If you don't have ...",,,,
What Happens If You Drink Celery & Apple Juice for 14 Days? Shocking Results,1T-K5VYExwA,Body BoostHQ,2025-02-08T16:23:53Z,https://www.youtube.com/watch?v=1T-K5VYExwA,"What happens if you drink celery & apple juice for 14 days? This powerful combination is packed with vitamins, antioxidants, and ...",27,,,
saw a few celery haters sipping on this 🌝 #celeryjuice #cocktail #recipe,dssAnw-C0JU,Kim Boshoven,2025-03-03T08:11:32Z,https://www.youtube.com/watch?v=dssAnw-C0JU,,52,,,
CUCUMBER AND CELERY 🧃 #fyp #shorts #greenjuice #green #viral #juicing #celeryjuice #cucumberjuice,LNTT7dqvKEI,Jennifer Pinard,2025-01-28T13:09:35Z,https://www.youtube.com/watch?v=LNTT7dqvKEI,,33,,,
"Refreshing Cucumber, Celery, & Apple juice",rcRRatrYS9w,Juice The Earth,2025-01-10T19:05:05Z,https://www.youtube.com/watch?v=rcRRatrYS9w,"Green Juice Detox Recipe | Refreshing Cucumber, Celery & Apples. Looking for a refreshing and healthy green juice recipe?",42,,,
"This week’s juice🤍 celery,lemon, pineapple, cayenne pepper, ginger #juicing #health #juicerecipe",JKzroBNgsk4,k,2025-02-09T01:21:41Z,https://www.youtube.com/watch?v=JKzroBNgsk4,,32,,,
"GREEN JUICE : Cucumber,  Apple, Celery,  Ginger, Mint # Fresh juice # juice recipe",3bATOdhLc2A,Changayees Kitchen,2025-02-04T03:40:11Z,https://www.youtube.com/watch?v=3bATOdhLc2A,greenjuice #detox #healthy #juice #juicing #healthylifestyle #vegan #freshjuice #juicecleanse #healthyjuice #coldpressedjuice ...,17,,,
"Candy fresh juice mix of celery, cucumber, ginger, and cabbage.  #juice #fypyoutubeshorts ￼",i2yPJF3KuYY,Omozekitchen,2025-03-05T13:43:50Z,https://www.youtube.com/watch?v=i2yPJF3KuYY,,33,,,
Get a man that'll drink celery juice with you 😂 #celeryjuice #healthy #marriage #marriedlife,qdrwPYTJRz4,Rachel Burns,2025-02-03T00:13:17Z,https://www.youtube.com/watch?v=qdrwPYTJRz4,,45,,,
Pov: your friend makes healthy smoothies #smootie #cooking #healthy #home ❤️ #celeryjuice,ETlFTKDg4Ss,JERMTV,2025-01-08T15:17:23Z,https://www.youtube.com/watch?v=ETlFTKDg4Ss,,27,,,
Carrot lemon celery pineapple juice#healthydrink#fruit#veggies#shorts#youtubeshorts,M8NgxDE70Oc,Food for Life with Lucy ,2025-01-30T04:49:14Z,https://www.youtube.com/watch?v=M8NgxDE70Oc,,61,,,
Celery Juice Recipe for weight loss and Detox #celeryjuice #healthydrink #weightloss #viralshorts,6EQ4JK5EaOc,Junior Joyride,2025-03-18T15:11:00Z,https://www.youtube.com/watch?v=6EQ4JK5EaOc,"Curious about the Celery Juice Craze? I tried drinking celery juice for a week, and the results surprised me! In this short video,I'll ...",36,,,
starting the day off in the right way 🌱🥤 #celeryjuice #toddlerlife #morningroutine #juicing #toddler,CGf17NKssGA,Lucy,2025-03-20T09:47:16Z,https://www.youtube.com/watch?v=CGf17NKssGA,,15,,,
Juice recipes for weight loss #cleanse #recipe #irisetouch,Zmuz3sJ1vXY,iRiseTouch Eats,2025-01-08T14:41:47Z,https://www.youtube.com/watch?v=Zmuz3sJ1vXY,,61,,,
Juice for glowing skin and healthy hair! Quick and Easy Recipe #namaj2juicer #juice #healthyhair,7Rthhq7QKPc,Glow with Amy,2025-02-26T01:41:41Z,https://www.youtube.com/watch?v=7Rthhq7QKPc,"Juicing is amazing for your health, but it doesn't have to break the bank! In this video, I'm sharing smart grocery shopping tips to ...",20,,,
Cucumber celery Juice | Detox Drink | Glowing skin,DCmdZGxYsDA, Heena Food N Travel Stories,2025-01-13T13:21:42Z,https://www.youtube.com/watch?v=DCmdZGxYsDA,detoxjuices#cucumberceleryjuice#weightloss#glowingskin.,39,,,
Celery juice Day 2 #shorts #juicing #juicingcelery,oJ9dl6FTQbM,Micah Althea,2025-03-19T16:52:39Z,https://www.youtube.com/watch?v=oJ9dl6FTQbM,,21,,,
Green detoxifying celery juice 🍏🍋🥬 #detoxjuice #greenapples #youtubeshorts  #shorts #uk #india,MCUJXrcUP1c,Yaminireddy_UK vlogs,2025-01-08T04:04:46Z,https://www.youtube.com/watch?v=MCUJXrcUP1c,,52,,,
#celeryjuice #rawturmeric #healthylifestyle #healthyfood,_rW6p51NUXU,Love_the_Life2023,2025-02-16T20:35:46Z,https://www.youtube.com/watch?v=_rW6p51NUXU,,10,,,
Celery spinach cucumber- cold press juice-Kuving’s B1700 #celeryjuice #spinach #detoxjuice #cucumber,OLbjBcnrLg0,Mayur Nath Reddy,2025-03-22T06:05:11Z,https://www.youtube.com/watch?v=OLbjBcnrLg0,"Ingredients Celery, spinach, cucumber, amla. Kuving's b1700 is struggling to separate pulp extract and push it separately.",44,,,
Glow from the inside out with this fresh and hydrating green juice! 💚,2KbP-hNw0ks,Farah Najam ,2025-02-16T06:11:01Z,https://www.youtube.com/watch?v=2KbP-hNw0ks,"A powerhouse mix of celery, pineapple, green apples, cucumbers, and pears, this juice is packed with vitamins, fiber, and natural ...",29,,,
5 Amazing Benefits of Celery Juice! From glowing skin to better digestion!,afEy3nozBeo,Natural Health Vibes,2025-01-12T04:47:09Z,https://www.youtube.com/watch?v=afEy3nozBeo,"1. Rich in Nutrients and Antioxidants Celery juice is packed with vitamins (A, C, and K), minerals (potassium, magnesium, and ...",58,,,
A celery juice a day keeps the Doctor away? 😃 cheers! #celery #celeryjuice #medicalmedium medicalmed,Z25Rz7_8_bo,Olivera Marija,2025-01-11T22:59:14Z,https://www.youtube.com/watch?v=Z25Rz7_8_bo,"a celery juice a day, keeps the Doctor away? Rich in Nutrients: High in vitamins (A, C, K), potassium, and folate.",6,,,
Doing anything for clear skin🫶🏻 #skincare #celeryjuice #glassskin #koreanskincare,hqeVb_WGOtE,Bthka,2025-02-12T21:37:37Z,https://www.youtube.com/watch?v=hqeVb_WGOtE,,16,550,10,1
Start your day right: #hotgirlwalk #celeryjuice,23YfaZZaS38,Alex Martinez,2025-02-22T20:30:00Z,https://www.youtube.com/watch?v=23YfaZZaS38,"Start your day right: #hotgirlwalk, #celeryjuice & #lemonwater #fok.",17,,,
Because glowing skin always comes from the inside #glowingskinjuice #celeryjuice #coldpressedjuice,jTaQdUL00Gs,Shruti’s Look Book,2025-03-27T19:41:18Z,https://www.youtube.com/watch?v=jTaQdUL00Gs,,21,,,
Make our celery juice with us,7wNLlqdgZsM,willycafeinc,2025-03-24T16:39:13Z,https://www.youtube.com/watch?v=7wNLlqdgZsM,Make our celery juice with us! This process is always done in house to ensure you are getting the freshest organic juice delivered ...,14,,,
green juice for immunity & gut health #celeryjuice #greenjuice #guthealth #stopmotion #holistic,JUyzGwwFEK0,ceej ,2025-01-16T16:52:42Z,https://www.youtube.com/watch?v=JUyzGwwFEK0,,35,,,
Super drink😍 #healthy #juice #apple #greenapple #carrot #ginger #celery #tefal,cdp8ach-CTQ,TWK3655,2025-02-25T11:13:28Z,https://www.youtube.com/watch?v=cdp8ach-CTQ,,50,,,
"Celery juice benefits are LEGIT! Less bloating, better digestion, clear skin & more energy. Try it",dNwE7xoZ0U4,Juice Alchemy,2025-03-04T03:30:13Z,https://www.youtube.com/watch?v=dNwE7xoZ0U4,,47,,,
Boost your day with perfect green juice! #juicing #greenjuice #celery #healthy,0zlbtTmTzCU,Kai Souza Carvalho,2025-02-14T01:45:00Z,https://www.youtube.com/watch?v=0zlbtTmTzCU,Refreshing green juice recipe for health & glow! #juicing #greenjuice #celeryjuice #healthyfood.,19,,,
#celeryjuice #health #skincare,WZWyIOKqiOo,Christi.8,2025-03-23T14:31:54Z,https://www.youtube.com/watch?v=WZWyIOKqiOo,,16,,,
