Title,Video ID,Channel,Published At,URL,Description,Video Length,Views,Likes,Comments
Cure PCOD | Conceive Naturally | Boost Fertility | Improve Digestion | Cure Constipation #yoga,Wl2atSaZ3Og,Shreyasi Bag ,2025-02-23T12:09:30Z,https://www.youtube.com/watch?v=Wl2atSaZ3Og,Many Problems One Solution! Explore the scientifically - backed benifits of Yoga! #fertilityyoga #pcodawareness ...,9,,,
6 Simple Tips to Prevent Urine Infection I Natural Remedies for UTI. #shorts,zFFUahPRwaE,Kidney Doctor Vinod,2025-01-22T14:36:56Z,https://www.youtube.com/watch?v=zFFUahPRwaE,6 Simple Tips to Prevent Urine Infection I Natural Remedies for UTI. #shorts Struggling with frequent urine infections? Don't worry!,60,,,
Remove Fat From Your Liver Naturally,KKw1m7VjyWg,Dr. Eric Berg DC,2025-02-24T10:00:22Z,https://www.youtube.com/watch?v=KKw1m7VjyWg,"If you have fatty liver, your body is struggling to detox and burn fat effectively. The good news? You can help flush out liver fat ...",39,,,
Lower Cholesterol Naturally!,-i4tH5hvxSU,Dr. Berg Shorts,2025-01-24T13:00:01Z,https://www.youtube.com/watch?v=-i4tH5hvxSU,"Are you looking for effective ways to lower cholesterol and improve heart health? In this video, we'll reveal 6 natural remedies ...",28,,,
5 Tips for  Clean and Healthy Liver in Telugu || Dr. Deepthi kareti,Wp3S09ZF4rM,Dr. Deepthi Kareti,2025-01-24T01:30:15Z,https://www.youtube.com/watch?v=Wp3S09ZF4rM,How do you flush out your liver? What foods help detoxify the liver? Some great foods to help cleanse and support liver function ...,42,,,
How to Increase Hemoglobin Naturally? #shivangidesai #ytshorts #hemoglobinboost #anemiaawareness,B3rrQKS9fBY,Fit Bharat,2025-01-18T14:00:09Z,https://www.youtube.com/watch?v=B3rrQKS9fBY,Beat Hemoglobin-Deficiency Anemia Naturally! Did you know that 57% of women and 67% of children in India are anemic?,60,,,
Best anti-inflammatory drink is here??? #shortsfeed,GZkEfJV_V78,Healthy With Ravneet Bhalla,2025-01-15T05:10:00Z,https://www.youtube.com/watch?v=GZkEfJV_V78,Best anti-inflammatory drink is here??? #shortsfeed **The Importance of an Anti-Inflammatory Diet** Chronic inflammation is ...,15,,,
Grow Back Gums in 3 to 6 Months,BWIQgfr7sdc,Dr. Ellie Phillips,2025-01-10T17:00:11Z,https://www.youtube.com/watch?v=BWIQgfr7sdc,"In this video, Dr. Ellie Phillips explains what to do and STOP doing to grow back gums that are receding in as little as 3 to 6 ...",46,,,
Lower Blood Sugar Naturally ! #shorts #marathi #diabetes @drmanasimehendaledhamankar Marathi Podcast,XzcMxqBLMN4,Sarva Kaahi,2025-01-19T07:30:12Z,https://www.youtube.com/watch?v=XzcMxqBLMN4,Dr. Manasi Mehendale Dhamankar (@drmanasimehendaledhamankar) shares a remarkable holistic healing story of a diabetes ...,52,,,
"Instant Relief from Cold, Cough, Asthma & Wheezing | Natural Healing Therapy | Rubbing Therapy",rGkvNQAcPmc,YOGA SHAKTI,2025-01-27T13:01:08Z,https://www.youtube.com/watch?v=rGkvNQAcPmc,"Discover the ancient, natural rubbing therapy that helps cure cough, cold, asthma, wheezing, and bronchitis effectively.",60,,,
"Dr. Manish Aacharya's 💡 Remedies for Constipation, Gas & Stomach Issues! 🌿💪 | Must-Try Tips! #shorts",_m7ol79w9eI,The Kitchen Muse,2025-01-17T05:55:00Z,https://www.youtube.com/watch?v=_m7ol79w9eI,"Dr. Manish Aacharya's Remedies for Constipation, Gas & Stomach Issues! | Must-Try Tips! #shorts #short #food #recipe ...",25,,,
Natural Remedy for Vitiligo | Babchi Oil for Vitiligo | Kayakalp Global,Lk9gwW34Gbs,Kayakalp Global ,2025-01-31T14:40:05Z,https://www.youtube.com/watch?v=Lk9gwW34Gbs,Join WhatsApp Vitiligo Community! Latest Treatments & Real Feedback https://bit.ly/vitiligocommunity Book An Appointment ...,51,,,
Diabetes cure naturally,X-cTBW81QLA,sugunala siri,2025-03-10T16:42:58Z,https://www.youtube.com/watch?v=X-cTBW81QLA,,60,,,
Natural Diabetes Control Drink| Easy Recipe with Insulin Plant Leaves| Manage Blood Sugar Naturally,A8LWZy-bYlA,The Yoga Institute,2025-01-15T12:30:20Z,https://www.youtube.com/watch?v=A8LWZy-bYlA,Control diabetes naturally with this powerful drink! Hansaji shares an easy-to-make recipe that helps regulate blood sugar levels ...,225,,,
Instant Relief from Low Blood Pressure | Powerful Acupressure Therapy for Hypotension,vyhcLJc-WwE,YOGA SHAKTI,2025-02-03T12:01:14Z,https://www.youtube.com/watch?v=vyhcLJc-WwE,"Are you feeling dizzy, weak, or tired due to low blood pressure (hypotension)? Don't worry! In this video, I'll show you a simple yet ...",30,,,
"Ultimate Stomach Healing Trick | Cure Gas, Indigestion & Gut Pain Naturally | Yoga Shakti",LOahxpNRheQ,YOGA SHAKTI,2025-03-31T12:00:27Z,https://www.youtube.com/watch?v=LOahxpNRheQ,"Struggling with gas, bloating, acidity, or indigestion? Your gut health affects your overall well-being, including brain function and ...",36,,,
"Instant Relief from Cold, Cough, Bronchitis & Wheezing with Rubbing Therapy | Natural Healing",ecaGm33KlS8,YOGA SHAKTI,2025-01-10T12:00:57Z,https://www.youtube.com/watch?v=ecaGm33KlS8,"In this video, discover the incredible power of Rubbing Therapy to naturally cure cold, cough, bronchitis, and wheezing.",54,,,
How to cure skin disease naturally? - Dr Rajalakshmi #shorts #shortvideo #cosmohealth,orGt3AY5SWA,Cosmo Health,2025-03-07T09:20:00Z,https://www.youtube.com/watch?v=orGt3AY5SWA,காயகற்பம் #KayakalpaHerbalSecret #kayakalpamtamil How to cure skin disease naturally? - Dr Rajalakshmi #shorts ...,53,,,
తలనొప్పి వేగంగా తగ్గించే ఇంటి చిట్కాలు | #drcalmssanjeevani #headache #ytshorts #healthtips #tips,lKk28NRPe94,Dr Calm's Sanjeevani,2025-01-15T14:38:21Z,https://www.youtube.com/watch?v=lKk28NRPe94,"HeadacheRelief #HomeRemedies #NaturalHealing #WellnessTips #QuickRelief #drcalmssanjeevani #shorts #healthtips ""Say ...",53,,,
How to Reduce Fever Temperature Quickly | Safe Fever Relief #shorts #fever #fevertreatment,e8ibB3SJ-Jo,Socialpost Healthcare,2025-01-04T11:30:32Z,https://www.youtube.com/watch?v=e8ibB3SJ-Jo,How to Reduce Fever Temperature Quickly | Safe Fever Relief | 3 Easy and Safe Ways to Break a Fever Fast | 3 Natural Ways to ...,48,,,
Easy Home Remedy For PCOD | Cure PCOD Naturally at Home | PCOD/PCOS का इलाज | PCOS Ka Ghar Par Ilaj,bXCdjRpZWeA,Ask Health Guru,2025-03-31T04:32:34Z,https://www.youtube.com/watch?v=bXCdjRpZWeA,"In this video, Dr. Kanchan Sharma talks about how many doctors prescribe hormonal pills and advise weight loss for PCOD ...",77,,,
9 Effective Baby Eczema Home Remedies | Remedies for Baby Eczema | Remedies For Eczema In Babies,jfKTiFgOzjA,FirstCry Parenting,2025-02-04T15:30:27Z,https://www.youtube.com/watch?v=jfKTiFgOzjA,"Is your baby struggling with eczema? Dry, itchy, and irritated skin can be tough for little ones—and heartbreaking for parents.",57,,,
How To Cure Piles And Fissure Naturally At Home In Telugu | Dr Abhilash Nali #piles #fissure #shorts,UQXGgKdRWyw,Dr Abhilash Nali,2025-01-13T06:00:29Z,https://www.youtube.com/watch?v=UQXGgKdRWyw,How To Cure Piles And Fissure Naturally At Home In Telugu | Dr Abhilash Nali #piles #fissure #shorts #drabhilash #pilescure ...,47,,,
"This is the Key to Restoring Kidney Health Naturally, Says Barbara O’Neill",9F9lHa7cv-g,Living Springs Retreat,2025-02-04T23:45:00Z,https://www.youtube.com/watch?v=9F9lHa7cv-g,"Herbs for the Service of Man: Barbara O'Neill references Psalm 104:14, highlighting the belief that natural remedies may play a ...",59,,,
🌿✨ Women's Health & Natural Healing at Dr. Subhash Ayurvedic Hospital! 🏥💖,Bp7i9sn5ybk,Dr. Subhash Ayurvedic and General Hospital ,2025-02-19T10:03:50Z,https://www.youtube.com/watch?v=Bp7i9sn5ybk,"Welcome to Dr. Subhash Ayurvedic and General Hospital, Junagadh!✨ Hello everyone! I am Dr. Jalpa Nandaniya, Medical ...",85,,,
🔥 How to Deal with Hot Flashes Naturally | Osteopathy for Hormonal Imbalance & Sciatica Treatment,lZw3uTlsUWI,Madurai Osteopathy Clinic,2025-03-14T11:01:08Z,https://www.youtube.com/watch?v=lZw3uTlsUWI,How to Deal with Hot Flashes Naturally | Osteopathy for Hormonal Imbalance & Sciatica Treatment | Madurai Osteopathy Clinic ...,57,,,
How to Use Comfrey and Castor Oil to Heal Tendons Naturally,xTcsI6KNaII,Living Springs Retreat,2025-01-18T20:45:03Z,https://www.youtube.com/watch?v=xTcsI6KNaII,"Barbara O'Neill explains how to support healing naturally with castor oil compresses and comfrey, a herb known for its ability to ...",58,,,
How to Cure Knee Pain & Swelling Naturally – No Surgery Needed! @DrSandeepSinghofficial,FSOZQgi5puQ,Dr Sandeep Singh,2025-03-27T11:14:05Z,https://www.youtube.com/watch?v=FSOZQgi5puQ,How to Cure Knee Pain & Swelling Naturally – No Surgery Needed! @DrSandeepSinghofficial Are you struggling with knee pain ...,50,,,
The Instant Relief From migraine or headache naturally. #shorts #naturalhealing,hls8e7OLbug,YOGA SHAKTI,2025-01-14T12:01:02Z,https://www.youtube.com/watch?v=hls8e7OLbug,MigraineRelief #HeadacheCure #NaturalHealing Struggling with migraines or headaches? Discover instant relief through ...,46,,,
Top 2 ways to naturally cure Lyme disease,sIp7XGzt3gA,Dr. Josh Axe,2025-03-15T17:01:03Z,https://www.youtube.com/watch?v=sIp7XGzt3gA,SUBSCRIBE FOR MORE: https://www.youtube.com/c/DrJoshAxe?sub_confirmation=1 -------------------- ➕ CONNECT WITH DR.,40,,,
Natural Tips to flush out KIDNEY STONE Quickly| #Kidneystone treatment-Dr.Santhosh Kumar Akkinapelli,nf4ouLvj0yE,Doctors' Circle World's Largest Health Platform,2025-01-30T03:33:31Z,https://www.youtube.com/watch?v=nf4ouLvj0yE,Subscribe to https://www.youtube.com/@doctors-circle - World's Largest Health Platform ...,57,,,
Can I cure my veins naturally?,B2fVBYIji0g,Spider and Varicose Vein Treatment Center,2025-02-07T22:39:22Z,https://www.youtube.com/watch?v=B2fVBYIji0g,"Quick fixes might be fast, but they're not the real answer. ✨ Venous insufficiency needs proper treatment, and our experts are ...",51,,,
Top 5 Foods for Healthy Lungs – Breathe Easier Naturally!,Gd9-op5I1mU,Boost by Nature,2025-01-12T16:30:05Z,https://www.youtube.com/watch?v=Gd9-op5I1mU,Want to support your lungs and breathe easier? Discover the top 5 most beneficial foods for lung health and respiratory function.,35,,,
Treat Varicose Veins Naturally with Reckeweg R42 | Homeopathic Guide,3de5EUOc2tk,Sunny Health Capsule,2025-01-12T12:30:04Z,https://www.youtube.com/watch?v=3de5EUOc2tk,Treat Varicose Veins Naturally with Reckeweg R42 | Homeopathic Guide Reckeweg R42 Varicose veins treatment Natural ...,16,,,
"""Mood Swings & Headaches? Osteopathy Can Help! 💆‍♂️ | Natural Healing Tips""",XR2cyrohDJk,Madurai Osteopathy Clinic,2025-03-29T11:00:46Z,https://www.youtube.com/watch?v=XR2cyrohDJk,"""Mood Swings & Headaches? Osteopathy Can Help! ‍♂️ | Natural Healing Tips"" | Madurai Osteopathy Clinic Struggling with ...",54,,,
9 Powerful Herbs to Naturally Relieve Arthritis Pain at Home! 🌿💪,zemoq-bzALY,Medical Centric,2025-02-12T17:01:13Z,https://www.youtube.com/watch?v=zemoq-bzALY,Medical Centric Recommended : (Affiliate Links) Thermometer ➝ https://amzn.to/48etrFS Blood pressure machine ...,233,,,
The Best Natural Remedy for Burns | Dr. Janine,tu5F7ai2KQY,"Dr. Janine Bowring, ND",2025-01-01T04:05:56Z,https://www.youtube.com/watch?v=tu5F7ai2KQY,The Best Natural Remedy for Burns | Dr. Janine Discover the revolutionary natural cure for burns that has been hiding in plain ...,103,,,
Top Tips for Skin Allergy and Itching || Natural Skin Allergy Treatment #shorts #skincaretips,wVjYc69VkOY,Socialpost Healthcare,2025-01-17T11:30:46Z,https://www.youtube.com/watch?v=wVjYc69VkOY,Top Tips for Skin Allergy and Itching | Natural Skin Allergy Treatment | Socialpost Healthcare #skincare #skincaretips #allergy ...,50,,,
Chronic Inflammation 🔥 Top Strategies to Reduce Inflammation Naturally #RegenerativeMedicine,oIsHhdAtgU0,Chicago Arthritis,2025-01-05T00:00:29Z,https://www.youtube.com/watch?v=oIsHhdAtgU0,Chronic Inflammation Top Strategies to Reduce Inflammation Naturally #RegenerativeMedicine #ChicagoArthritis ...,40,,,
Cure Hiccups Naturally: Proven Home Remedies,8NVAk-ZVFbI,Medindia Videos,2025-02-22T05:46:05Z,https://www.youtube.com/watch?v=8NVAk-ZVFbI,Ever been interrupted by a persistent case of hiccups during an important meeting? We've all been there. Try these home ...,27,,,
Beat cavities & gum issues naturally! #cavities #gingivitis #probiotic,yIgBII2udXc,Howard Lee,2025-03-03T22:00:39Z,https://www.youtube.com/watch?v=yIgBII2udXc,Beat cavities & gum issues: cure & care tips #cavities #gingivitis #probiotic #gum #teeth #rootcanal.,44,,,
How to Cure Kidney Disease Naturally at Home - Guru Zahid Irfan,3tqHisMIwdY,Channel Diabetes,2025-01-25T13:00:07Z,https://www.youtube.com/watch?v=3tqHisMIwdY,"گُردوں کی بیماری کا آسان اور سستا علاج کیا ہے؟ جانیے اس معلوماتی ویڈیو میں Kidney diseases can affect anyone, but the good ...",225,,,
Lower Your Blood Pressure NATURALLY with Dr Murtaza!,xIi1mVcxA0c,DR. Murtaza,2025-01-31T12:09:06Z,https://www.youtube.com/watch?v=xIi1mVcxA0c,Lower Your Blood Pressure NATURALLY with Dr Murtaza! Are you tired of relying on medication to control your blood pressure?,48,,,
How to Regrow Receding Gums naturally | Regrow Gums | Periodontal Disease | Regrow Teeth,_BH_I647U-g,Dr Wahid Bux Bozdar,2025-01-15T09:47:53Z,https://www.youtube.com/watch?v=_BH_I647U-g,"How to Regrow Receding Gums naturally | Regrowth Gums | Periodontal Disease #dentist #teeth #dentistry ""Discover the ultimate ...",15,,,
How to Get Rid of Yeast Infection Naturally? #shorts,ia_-ofFZvaw,IAFA Ayurveda,2025-02-22T12:40:13Z,https://www.youtube.com/watch?v=ia_-ofFZvaw,How to Get Rid of Yeast Infection Naturally? A yeast infection is caused by an overgrowth of Candida fungus. Treating it quickly ...,42,,,
Do Natural Remedies Work for Spider Veins? | Home Remedies to Treat Spider Veins,Ierf_i_nQ28,Spider and Varicose Vein Treatment Center,2025-02-14T21:15:49Z,https://www.youtube.com/watch?v=Ierf_i_nQ28,"Many people look for a natural treatment for spider veins on legs, but do these remedies really work? Dr. Caroline Novak, a ...",134,,,
Best Natural Antibiotics for Tooth Infection Pain | Safe Remedies for Relief,8TVZLLl-Y_I,World Of Dentistry,2025-01-31T18:37:25Z,https://www.youtube.com/watch?v=8TVZLLl-Y_I,Best Natural Antibiotics for Tooth Infection Pain | Safe Remedies for Relief | World Of Dentistry Best Natural Antibiotics for Tooth ...,196,,,
Fight Inflammation Naturally with Turmeric. #healthyliving #turmeric,7O5P4saN0Dw,Health Wealth Safe,2025-01-16T08:35:00Z,https://www.youtube.com/watch?v=7O5P4saN0Dw,,26,,,
Fight Inflammation Naturally with Turmeric. #healthyliving #turmeric,7O5P4saN0Dw,Health Wealth Safe,2025-01-16T08:35:00Z,https://www.youtube.com/watch?v=7O5P4saN0Dw,,26,,,
How to Heal Varicose Ulcers Naturally: Simple Home Care | Dr. Ashank bansal,nsmoHIEQETM,Dr. Ashank Bansal - Vascular Surgeon,2025-01-24T11:30:37Z,https://www.youtube.com/watch?v=nsmoHIEQETM,This video explores natural home remedies and lifestyle changes to help manage and potentially heal varicose ulcers.,226,,,
3-Day Flu Diet: No Medicine Needed! | Dr. Biswaroop Roy Chowdhury’s Natural Flu Cure #gogreeninfo,7A-k4SWMY1M,Go Green,2025-01-30T08:36:21Z,https://www.youtube.com/watch?v=7A-k4SWMY1M,3-Day Flu Diet: No Medicine Needed! | Dr. Biswaroop Roy Chowdhury's Natural Flu Cure Say goodbye to flu and influenza ...,,,,
🌿 Ulcerative Colitis? Heal Intestinal Ulcers Naturally with Piccha Basti! 💡,FudT7wO-ob0,Yukti Herbs,2025-02-15T07:50:50Z,https://www.youtube.com/watch?v=FudT7wO-ob0,"If you use oral gels for mouth ulcers or herbal gargles for throat sores, imagine how effective it would be if a healing herbal ...",60,,,
Reckeweg R40 A Natural Remedy for Managing Diabetes | Reckeweg R40,ut1uAFN_Cvw,Sunny Health Capsule,2025-01-10T12:30:52Z,https://www.youtube.com/watch?v=ut1uAFN_Cvw,Reckeweg R40 A Natural Remedy for Managing Diabetes | Reckeweg R40 Reckeweg R40 Diabetes homeopathy Natural ...,16,,,
7 Superfoods to Stop Chronic Pain & Inflammation!,HMne15qkVBU,Dr. Joseph Jacobs DPT,2025-03-14T04:00:06Z,https://www.youtube.com/watch?v=HMne15qkVBU,FREE Consultation: https://advancedsofttissuerelease.com/free-pain-relief-consultation-session-with-health-coach/ ✓ Treat Your ...,184,,,
Amazing Formula to Cure Winters Pain Naturally Without Medicine or Surgery #surgerytips #sunodigital,wPSJsZljYYo,Suno Podcast Health,2025-02-04T07:00:29Z,https://www.youtube.com/watch?v=wPSJsZljYYo,Amazing Formula to Cure Winters Pain Naturally Without Medicine or Surgery #surgerytips #sunodigital Welcome to the Suno ...,37,,,
Reverse or Cure Diabetes Naturally,gCkp15FgpbQ,Dr Anirban Chakraborty Diabetes & Obesity Reversal,2025-01-11T01:05:27Z,https://www.youtube.com/watch?v=gCkp15FgpbQ,,99,,,
Transform Your Health: Cure Metabolic Disease Naturally,RSJRcK86ZmM,"Evan P Nadler MD, MBA",2025-02-10T14:00:29Z,https://www.youtube.com/watch?v=RSJRcK86ZmM,"Transform Your Health: Cure Metabolic Disease Naturally @obesityexplained Watch The Video & Don't Forget to Like, ...",22,,,
CURE Gastritis NATURALLY in 2025#shorts #youtubeshorts #gastreatment,n4ySzPL4GgQ,Brain Gyan Facts,2025-01-04T03:42:29Z,https://www.youtube.com/watch?v=n4ySzPL4GgQ,CURE Gastritis NATURALLY in 2025 Description: Do you often feel bloated and uneasy? This video uncovers the best home ...,48,,,
"""Can You Cure Myopia Naturally? The Truth Revealed!"" by Dr. Devipriya BNYS #myopia #bnys #trichy",MqfcDgJ8gDc,knaymc Hospital,2025-03-23T03:58:18Z,https://www.youtube.com/watch?v=MqfcDgJ8gDc,,49,,,
How To Cure Sinusitis Naturally Without Surgery In Telugu | Medi9 Homeopathy & Ayurveda #shorts #yt,g_1UQD89SKk,Medi9 Homeopathy & Ayurveda - IMS,2025-02-16T08:30:13Z,https://www.youtube.com/watch?v=g_1UQD89SKk,How To Cure Sinusitis Naturally Without Surgery In Telugu | Medi9 Homeopathy & Ayurveda #shorts #yt #sinusitis #sinus ...,89,,,
Amazing Formula to Cure Winters Pain Naturally Without Medicine or Surgery #surgerytips #sunodigital,YmOLhY8rN3k,Suno Digital,2025-01-14T08:00:23Z,https://www.youtube.com/watch?v=YmOLhY8rN3k,Amazing Formula to Cure Winters Pain Naturally Without Medicine or Surgery #surgerytips #sunodigital Suno Digital is a dynamic ...,37,,,
Amazing Formula to Cure Winters Pain Naturally Without Medicine or Surgery #surgerytips #sunodigital,kJQlfcp2qrI,Suno Digital Cuts,2025-01-14T08:00:37Z,https://www.youtube.com/watch?v=kJQlfcp2qrI,Amazing Formula to Cure Winters Pain Naturally Without Medicine or Surgery #surgerytips #sunodigital.,37,,,
Amazing Formula to Cure Winters Pain Naturally Without Medicine or Surgery #surgerytips #sunodigital,7Ies4MMdkgk,Suno Podcast Health,2025-01-14T07:00:06Z,https://www.youtube.com/watch?v=7Ies4MMdkgk,Amazing Formula to Cure Winters Pain Naturally Without Medicine or Surgery #surgerytips #sunodigital Welcome to the Suno ...,37,,,
Reckeweg R37 Colic Treatment Naturally | Benefits of Reckeweg R37,5-A2QRbkALM,Sunny Health Capsule,2025-01-07T12:30:04Z,https://www.youtube.com/watch?v=5-A2QRbkALM,Reckeweg R37 Colic Treatment Naturally | Benefits of Reckeweg R37 Reckeweg R37 Colic treatment naturally Homeopathic ...,16,,,
How to Cure Depression & Sleep Issues Naturally at Home | Vedic Upchar | Anil Bansal | #shorts,dhMhcKeFAdY,Vedic Upchar,2025-03-13T09:30:17Z,https://www.youtube.com/watch?v=dhMhcKeFAdY,How to Cure Depression & Sleep Issues Naturally at Home | Vedic Upchar | Anil Bansal | #shorts Are you struggling with ...,40,,,
Cranberry Cure Prevent UTIs & Boost Heart Health Naturally!,s1X4qp2Ec-s,Botanify,2025-03-13T00:15:07Z,https://www.youtube.com/watch?v=s1X4qp2Ec-s,Cranberry Cure: Prevent UTIs & Boost Heart Health Naturally! Tired of dealing with UTIs or concerned about heart disease?,60,,,
Ringworm Treatment at Home in Tamil | Home Remedies for Ringworm Cure | Natural Solution - INTAMIZH,IsIx5kEafWo,Intamizh,2025-03-12T16:31:06Z,https://www.youtube.com/watch?v=IsIx5kEafWo,Ringworm Treatment at Home in Tamil | Home Remedies for Ringworm Cure | Natural Solution - INTAMIZH Are you struggling ...,187,,,
"""CURE DIARRHOEA NATURALLY! Siddha's Powerful Remedy to Stop Diarrhoea Fast"" #loosemotion",pB4jG9UKZyo,Chella Siddha Clinic,2025-01-26T04:45:04Z,https://www.youtube.com/watch?v=pB4jG9UKZyo,For appointments ; https://wa.me/message/4ZAMUJMSVDBJN1 #DiarrhoeaRelief #SiddhaRemedy #NaturalCure #InstantRelief ...,31,,,
D | how to cure kidney disease naturally |  #shorts,sNWxjoygcvs,Snpkart,2025-01-07T14:39:47Z,https://www.youtube.com/watch?v=sNWxjoygcvs,Welcome to SNP World. We have cured more than lakhs of diseases with Sembavala Panam. It is 100% natural and no side ...,29,,,
Cure Toenail Fungus Naturally | Powerful Home Remedy | Panchayu,nrjqnNeMznM,PanchAyu,2025-02-28T16:01:02Z,https://www.youtube.com/watch?v=nrjqnNeMznM,"Toenail fungal infections can be frustrating, causing discoloration, thickening, and even separation from the nail bed. Instead of ...",214,,,
Cure Insomnia & Beat Depression Naturally! | Vedic Upchar | Anil Bansal | #sleep #depression #shorts,HN2086RzW1o,Vedic Upchar,2025-03-19T09:30:08Z,https://www.youtube.com/watch?v=HN2086RzW1o,Cure Insomnia & Beat Depression Naturally! | Vedic Upchar | Anil Bansal | #sleep #depression #shorts Are you struggling with ...,29,,,
Natural Treatment: Cure Your Miserable Condition,z5orFUTzPec,Dr. Vikki Petersen,2025-02-11T17:30:13Z,https://www.youtube.com/watch?v=z5orFUTzPec,"Discover natural treatment options for a better life! We share inspiring advice and hope, showing you how treatable your condition ...",16,,,
Meet the Tribal Healer Treating 117 Diseases Naturally | Hari Pangi’s Story,kGzAsCvIP8E,VideoVolunteers,2025-03-21T15:30:16Z,https://www.youtube.com/watch?v=kGzAsCvIP8E,"In the remote village of Tentuliguda, nestled within the Semiliguda block of Koraput district, Tribal Vaidya Hari Pangi is keeping an ...",229,,,
Balance Cholesterol Naturally: The Key to a Healthy Heart!,HoeF2tXla7s,Natural Healing Center,2025-03-31T18:45:01Z,https://www.youtube.com/watch?v=HoeF2tXla7s,"Cholesterol isn't the enemy—it's all about the type of cholesterol! HDL (good cholesterol) supports heart health, while oxidized ...",138,,,
How to cure diabetes naturally | Best treatment to reduce blood sugar and control diabetes | #shorts,ZaR3P1ozdQw,Snpkart,2025-03-12T11:34:10Z,https://www.youtube.com/watch?v=ZaR3P1ozdQw,Welcome to SNP World. We have cured more than lakhs of diseases with Sembavala Panam. It is 100% natural and no side ...,58,,,
"CURE NATURALLY - SPONDYLITIS, SLIP DISC sciatica, Sacroilitis, Knee Pain, Back pain , ACHILES heel",ZnQn2jnT6Ys,HEALING HANDS & TRUE HEALTH CARE,2025-02-22T15:34:05Z,https://www.youtube.com/watch?v=ZnQn2jnT6Ys,Ranchi aur Bokaro mein.... Crop tractor neurotherapy advance acupressure physiotherapy patali therapy cupping therapy ...,17,,,
How To Cure Vertigo Naturally With Herbal Remedies !!,8tQlxbRTtSY,Healthy Life,2025-02-05T02:09:18Z,https://www.youtube.com/watch?v=8tQlxbRTtSY,How To Cure Vertigo Naturally With Herbal Remedies !! Please Enable Subtitles In Your Language In ⚙️ Settings ❗ Remember ...,212,,,
How to cure PCOS & PCOD naturally #shortsviral,HeiBTE-QHhQ,The Satyaa Show | An Odia Podcast,2025-01-15T18:57:45Z,https://www.youtube.com/watch?v=HeiBTE-QHhQ,How to cure PCOS & PCOD #shortsviral.,61,,,
How to cure Lipoma Naturally at Home  #homeremedies #lipoma #shorts #viralshorsts,o0MWzn2fss8,Health Coach Pankaj  स्वास्थ ही जीवन है ,2025-01-06T12:02:00Z,https://www.youtube.com/watch?v=o0MWzn2fss8,,49,,,
Top 5 Vitamins to Cure Arthritis Joint Pain Naturally,9wNzKDDBbgI,My Vital Life,2025-01-01T12:31:31Z,https://www.youtube.com/watch?v=9wNzKDDBbgI,FREE guide link: https://app.leadcreator.ai/stop-letting-arthritis-control-your-life Learn more about Biodynamix: ...,169,,,
Ayurvedic Cure for Sinusitis / How to Treat Sinusitis Naturally / Sinusitis Treatment in Ayurveda,gY9CbiIneUw,Om Holistic Centre,2025-02-17T13:06:58Z,https://www.youtube.com/watch?v=gY9CbiIneUw,Ayurvedic Cure for Sinusitis / How to Treat Sinusitis Naturally / Sinusitis Treatment in Ayurveda @DrHarshaBhorhari Ayurvedic ...,51,,,
Best detox to cure thyroid disease naturally || weight loss detox drink #dtyamini,8CAP5NMdEbQ,Dt YAMINI CHANDRA KALER,2025-02-05T14:51:56Z,https://www.youtube.com/watch?v=8CAP5NMdEbQ,thyroid #weightloss #diet #tips #weightlosstips #hypothyroid #cure #ayurveda #dietitian #newshorts #shorts #youtubeshorts.,11,,,
Top Iron-Rich Foods to Cure Anemia Naturally! 🩸🥦 | Boost Your Hemoglobin Fast! 🚀 #AnemiaCure,WX8XUIjD2pY,Dr Ayesha Naveed,2025-01-29T15:09:18Z,https://www.youtube.com/watch?v=WX8XUIjD2pY,Top Iron-Rich Foods to Cure Anemia Naturally! | Boost Your Hemoglobin Fast! #AnemiaCure #IronRichFoods.,34,,,
How to Cure Cold and Cough Fast in Winter | Naturally,m5RVwYShxgQ,Suman HITFIT,2025-01-11T03:30:31Z,https://www.youtube.com/watch?v=m5RVwYShxgQ,"Winter season can bring more than just chilly weather—it often means dealing with cold and cough. In this video, we share natural ...",175,,,
How to Cure Depression & Sleep Issues Naturally at Home | Vedic Upchar | Anil Bansal | #shorts,7ffFdXJk56w,Anil Bansal,2025-03-13T11:30:05Z,https://www.youtube.com/watch?v=7ffFdXJk56w,How to Cure Depression & Sleep Issues Naturally at Home | Vedic Upchar | Anil Bansal | #shorts Are you struggling with ...,40,,,
Cure Diabetes Naturally – No Medicine Needed | #shorts #facts,P1ZyNoGG5_U,Dr. Raja Shad,2025-03-19T17:58:09Z,https://www.youtube.com/watch?v=P1ZyNoGG5_U,"Diabetes is NOT a disease! It's a lifestyle problem that can be reversed naturally. Stop consuming sugar and added sugars, eat ...",110,,,
