Title,Video ID,Channel,Published At,URL,Description,Video Length
CREATE Your Perfect Healthy Juice Blend! # shorts #viral,JXP1CSYczaM,Biswajit mini vlog,2025-02-03T09:44:18Z,https://www.youtube.com/watch?v=JXP1CSYczaM,"CREATE Your Perfect Healthy Juice Blend! # shorts #viral #food #rannamake #recipe #minivlog green juice, juice cleanse, juicing ...",
#healthylifestyle #GreenGoodness.  #healthyfruitjuice #JuiceCleanse #HealthyLiving,QpoNAoY_i5A,Juicing with Jacy,2025-02-20T00:44:52Z,https://www.youtube.com/watch?v=QpoNAoY_i5A,,
How to drink a frooti juice #frooti #juice #shorts,yXCXTH_NfxI,AKASH ANEJA,2025-02-26T14:48:32Z,https://www.youtube.com/watch?v=yXCXTH_NfxI,Instagram Pls Follow Me On Instagram For My Vlogs Related Updates | https://www.instagram.com/food_4_vlogs/ juice drink juice ...,
Juice for gut health,MN5N0ZiYNko,Cold Pressed Christie,2025-03-08T21:03:22Z,https://www.youtube.com/watch?v=MN5N0ZiYNko,Get $55 off the Nama J2 Juicer Use code CHRISTIE10 This is the link to buy the J2: ...,
7 Juices for Heart Health #JuiceCleanse #HeartHealth #shorts,YyiJileBVqo,Health and Well-Being,2025-03-26T01:00:22Z,https://www.youtube.com/watch?v=YyiJileBVqo,"Discover 7 delicious juices that naturally boost your heart health, reduce cholesterol, lower blood pressure, and enhance overall ...",
Cucumber Green Juice #coldpressedjuice #juicecleanse #juicefast #juicerecipe,wkDP0WuLUsw,McNultys Make Juice,2025-03-04T20:42:04Z,https://www.youtube.com/watch?v=wkDP0WuLUsw,Follow us on social: https://www.tiktok.com/@mcnultymakesjuice https://www.tiktok.com/@jessmcnulty ...,
Best detox drink #rohitasweety #detoxdrink #morningdrink #detoxjuice #weightlossjuice,ZHtChCmcl5s,Rohitasweety,2025-03-16T16:25:26Z,https://www.youtube.com/watch?v=ZHtChCmcl5s,"juice cleanse, detox, detox water, weight loss drink, detox water for weight loss, detox water recipe, morning detox, detox recipe, ...",
Going on a JUICE CLEANSE again?,BILqjeGocqg,CoachCallumAngus,2025-01-23T13:32:56Z,https://www.youtube.com/watch?v=BILqjeGocqg,,
#weightloss #digestivehealth #juicecleanse #juice #healthylifestyle #healtyjuice #juicecleanse,eXJXoNQsXsE,Juicing with Jacy,2025-02-23T20:03:55Z,https://www.youtube.com/watch?v=eXJXoNQsXsE,,
Day 2 of my 3 day juice cleanse🍒🤍 #shortsfeed,30RAg0ulbZ8,Cecilys Natural,2025-02-11T22:52:48Z,https://www.youtube.com/watch?v=30RAg0ulbZ8,,
How to “detox” in the comments #shorts #detox #juicecleanse,tTuyuOAUpXg,Sally Hand,2025-03-04T06:37:28Z,https://www.youtube.com/watch?v=tTuyuOAUpXg,,
Day 6 juice cleanse! #juicecleanse #rawfooddiet #juicedetox #rawveganlifestyle,QfiyB3g7pY8,The Raw Food Glow,2025-01-07T21:35:10Z,https://www.youtube.com/watch?v=QfiyB3g7pY8,,
Should you do a juice cleanse? #health #fitness #nutrition,MGwJYo4J_uY,Nicole Rockey,2025-01-30T21:41:20Z,https://www.youtube.com/watch?v=MGwJYo4J_uY,,
#healthylifestyle  #inflammation #juice#cleanse #detoxjuice,wt8UCifziNU,Juicing with Jacy,2025-02-23T17:03:21Z,https://www.youtube.com/watch?v=wt8UCifziNU,,
Tired? Bloated? FIX BOTH With This Amazing Juice! #greenjuice #healthylivingtips #juicecleanse,4cFy2IRuZ48,Melanated Mindfulness,2025-01-29T01:35:00Z,https://www.youtube.com/watch?v=4cFy2IRuZ48,Feeling out of sync? Let's groove into wellness with this vibrant green juice inspired by Groove Theory's smooth vibes! Packed ...,
Day 4/30 Juice Cleanse try my recipe!! Super delicious 😋 #juicerecipe,qYFIynkHQzE,Ashley G - Glo and Grow Lifestyle,2025-01-02T20:22:00Z,https://www.youtube.com/watch?v=qYFIynkHQzE,,
Dont Do a Juice Cleanse #burnfat #juicecleanse,yV9NIVpCQdE,Justin Schollard,2025-02-15T01:00:53Z,https://www.youtube.com/watch?v=yV9NIVpCQdE,Dont Do a Juice Cleanse #burnfat #juicecleanse SEO DESCRIPTION HASHTAGS Watch Next: ...,
Get Amazing Health benefits by beets & keera Juice every morning #trending #ytshorts #short #beets,Gs-WWb8uLtQ,Tales of Good Health,2025-02-08T03:32:52Z,https://www.youtube.com/watch?v=Gs-WWb8uLtQ,Get Amazing Health benefits by beets & keera Juice every morning #trending #ytshorts #short #beets Welcome to Tales of ...,
#detox #healthylifestyle #juicecleanse #juicerecipes #newyear2025,c4F_2jN6Vug,Goddess ,2025-01-04T01:08:17Z,https://www.youtube.com/watch?v=c4F_2jN6Vug,,
Detox your body naturally at home/ Detox Juice | Cleanse your body of toxins #juicecleanse,df0vVRpZQuA,Chef Ricardo Cooking,2025-03-03T14:47:25Z,https://www.youtube.com/watch?v=df0vVRpZQuA,Detox your body naturally at home/ Detox Juice | Cleanse your body of toxins #juicecleanse healthier you!,
#DetoxJuice#SmoothieRecipes#HealthyDrinks#JuiceCleanse#FreshJuices#JuicingForHealth#HomemadeJuice,VTS0MIeja_Q,skammyjuice,2025-02-21T20:11:40Z,https://www.youtube.com/watch?v=VTS0MIeja_Q,"Welcome to Skyummyjuice! Your ultimate destination for refreshing, delicious, and healthy drink creations. From energizing ...",
Juice Cleanse: Starts  Feb.24th,uKCwmqmHiOw,Body by Zewdi,2025-02-18T11:14:16Z,https://www.youtube.com/watch?v=uKCwmqmHiOw,,
First 3 Day Juice Cleanse🍍🍏🥕🌱 #health #wellness #juicecleanse #juicing #trending #viralvideo,80quwGhUBeA,Sidney Chanel,2025-03-07T02:18:19Z,https://www.youtube.com/watch?v=80quwGhUBeA,,
Feel the glow with these juice recipes ✨🫶 #juicecleanse #juicedetox #juicerecipe,sDpITx-rlfc,Ashley G - Glo and Grow Lifestyle,2025-01-13T03:55:56Z,https://www.youtube.com/watch?v=sDpITx-rlfc,,
Are we juicing ? Get ready for the 7 day cleanse. Drop a 💚 #juicecleanse #juicedetox #rawvegan,9xmYoelG_H0,LaLa •The High Vibe Coach • Energy,2025-03-14T17:52:31Z,https://www.youtube.com/watch?v=9xmYoelG_H0,"JUICING FOR WEIGHT LOSS & DETOX! Want to burn fat, boost energy, and cleanse your body naturally? This juice recipe is ...",
Day 3 Of My 21 Day Anti-Inflammatory Juice Detox #antiinflammatory #juicewrld,N5U8aBsg8Os,Inflammation Help,2025-03-07T19:05:53Z,https://www.youtube.com/watch?v=N5U8aBsg8Os,It's day 3 of my 21 day super-charged anti-inflammatory juice detox cleanse! Red Cabbage Juice: 1 medium red cabbage ...,
#DetoxJuice#SmoothieRecipes#HealthyDrinks#JuiceCleanse#FreshJuices#JuicingForHealth#HomemadeJuice,Ca30NiQMqZE,skammyjuice,2025-02-22T12:23:05Z,https://www.youtube.com/watch?v=Ca30NiQMqZE,"Welcome to Skyummyjuice! Your ultimate destination for refreshing, delicious, and healthy drink creations. From energizing ...",
Green machine #juicecleanse #fitness #healthy #highirieyoga #peaceirieyoga #fyp #explorepage #viral,wR6qSG62wdM,irie singleton,2025-03-18T07:09:16Z,https://www.youtube.com/watch?v=wR6qSG62wdM,,
Is it a fast or a juice cleanse? Either way I’m in.,jOcZzBQHMC8,Alexander Fruit,2025-01-19T21:11:33Z,https://www.youtube.com/watch?v=jOcZzBQHMC8,Is it a fast or a juice cleanse? Either way I'm in.,
Raw Juice Shots - Defend - Sunshine Station NC #juiceshots #rawjuice #juicecleanse,kxvkZ87QMQg,Sunshine Station NC,2025-01-23T17:03:33Z,https://www.youtube.com/watch?v=kxvkZ87QMQg,"DEFEND YOUR WELLNESS ✨ Meet our green raw juice: DEFEND — a vibrant blend of green apple, celery, and spinach, ...",
Planofix |Bayer Planofix|Bayer PlanofixTechnical#juicecleanse  Plant growth regulator @EnvesatyamAg,k8Roh3dieS4,EnvesatyamAg,2025-01-03T16:43:30Z,https://www.youtube.com/watch?v=k8Roh3dieS4,Planofix |Bayer Planofix |Bayer PlanofixTechnical |Planofix Plant growth regulator @EnvesatyamAg Prevents natural shedding of ...,
Beetroot Carrot and Ginger Juice will cleanse and nourishes your body #detoxjuice #beetrootjuice,_eychyADTls,Naija Mum In Australia,2025-03-09T04:04:45Z,https://www.youtube.com/watch?v=_eychyADTls,"This beetroot, carrot, apple, and ginger juice are so good with lots of health benefit. if you are looking for additional ways to boost ...",
Day 1 Of My 21-Day Anti-Inflammatory Juice Detox! #antiinflammatory #juicewrld,2bIIpCcMf3U,Inflammation Help,2025-03-04T20:48:19Z,https://www.youtube.com/watch?v=2bIIpCcMf3U,"Broccoli Bliss Juice - day one of a 21 day super-charged anti-inflammatory juice cleanse! Reduce inflammation, and bonus, ...",
ABC juice |🔥Amla Beetroot Carrot Juice | abc juice recipe | weight loss | diet juice | smoothie |,IZQA4GKl7Cs,Rasoi Mummy Ni ♥ ,2025-01-10T01:30:16Z,https://www.youtube.com/watch?v=IZQA4GKl7Cs,ABC juice |  Amla Beetroot Carrot Juice | abc juice recipe | weight loss | diet juice | smoothie | @rasoimummyni #abcjuice #juice ...,
Such a great juice for glowy skin! #juicerecipe  #glowyskin #inflammation #bloating #flattummy,qhY-CdNTToU,Ashley G - Glo and Grow Lifestyle,2025-01-23T06:18:05Z,https://www.youtube.com/watch?v=qhY-CdNTToU,,
Cold Pressed Juice!! #coldpressed #healthy #tasty #vegan #juice,MJmrfH-FZaY,Vlogs By Lekha,2025-02-04T09:11:48Z,https://www.youtube.com/watch?v=MJmrfH-FZaY,Cold pressed Juice!! cold pressed juice cleanse cold pressed juice at home cold pressed juicer vs normal juicer cold pressed ...,
Day 3 of my 3 day juice cleanse🍒🤍 #shortsfeed,YGPMwklWLi0,Cecilys Natural,2025-02-13T00:03:39Z,https://www.youtube.com/watch?v=YGPMwklWLi0,,
"Pineapple Aloe Vera Juice Cleanse - Bloating, Colon Cleanse, Digestive Health, Detox #healthyjuice",I8SqyjFwilY,Tina Blends,2025-03-24T15:23:45Z,https://www.youtube.com/watch?v=I8SqyjFwilY,Pineapple Aloe Vera Juice Recipe: 4 inches fresh aloe vera gel (remove skin and rinse) 1 pineapple 1 lime 1 inch ginger Yield 36 ...,
Juice cleanses? Overrated or underrated? Steph says nah! 🍏 Thoughts? #juicecleanse #healthyhabits,KSkHlkCS3wQ,Sisterhood Tea Party Podcast,2025-03-31T12:33:17Z,https://www.youtube.com/watch?v=KSkHlkCS3wQ,,
Period/PMS Juice🩸#juice #juicing #pms #periods #pcos #pcosfood #cramps #healthy,KVn0PZnzLLk,Therealsiyah,2025-02-05T00:43:42Z,https://www.youtube.com/watch?v=KVn0PZnzLLk,healthyeating #healthyrecipes #fasting #lifestyle #whatiateinaday #pcos #pcosfood #pcosfitness #periods #period #vegan ...,
BEET ROOT JUICE #shorts #beetroot,aOdpIKGu794,Techie Tadka,2025-03-11T16:22:13Z,https://www.youtube.com/watch?v=aOdpIKGu794,"Beetroot detox drink for glowing skin & healthy hair beet root juice, beet juice, fresh beetroot juice, detox beetroot juice, healthy ...",
Day 4 of the juice cleanse #fypシ゚ #2025 #juicer #cleanse #holistichealth,ou_hfHpcX0g,Riss Mc,2025-01-30T23:21:29Z,https://www.youtube.com/watch?v=ou_hfHpcX0g,,
"Cilantro Detox Green Juice - Fight Inflammation, Boost Immunity, Rich In Antioxidant, Juice Cleanse",-tLt9dH_ipA,Tina Blends,2025-03-29T14:19:51Z,https://www.youtube.com/watch?v=-tLt9dH_ipA,Cilantro Detox Juice Recipe: 1 cup cilantro 5 stalks celery 1 cucumber 3 green apples 1 lemon 1 inch ginger #detoxjuice ...,
DELICIOUS Papaya Juice for BEGINNERS Made EASY! #fruit #juicing #recipe #cleanse #health #shorts,B1CoBiGMmTY,Nicole Ojo,2025-01-22T22:27:14Z,https://www.youtube.com/watch?v=B1CoBiGMmTY,,
How I Transformed My Body with a Juice Cleanse | Weight Loss & Wellness Journey,BICSm5RMHzA,Ms. Wright ,2025-01-19T16:06:40Z,https://www.youtube.com/watch?v=BICSm5RMHzA,"I want to share my journey to holistic healing. I started by taking herbs, juicing, and eating only fruits and vegetables. I knew it was ...",
Preparing for A Juice Cleanse!,yjsRhw-gCK0,Meechie Solitude,2025-01-12T20:00:05Z,https://www.youtube.com/watch?v=yjsRhw-gCK0,,
#rawfountainjuice #juicecleanse #juicedetox,JJvYi_hTmy8,Sweet Verdict ,2025-03-17T21:22:52Z,https://www.youtube.com/watch?v=JJvYi_hTmy8,rawfountainjuice #juicecleanse #juicedetox #postpartumweightlossjourney #momscandohardthings #fok.,
Vitamin C shots #juicerecipe #juicingtutorials #juicecleanse #juicing #shots #juicingrecipes #foryou,jDApMPnMGps,Therealza,2025-03-16T19:31:53Z,https://www.youtube.com/watch?v=jDApMPnMGps,,
Papaya Collagen Juice ✨ #juicecleanse #juicing #juicingrecipes #weightloss #healthy #papaya,Unljg0RTQB4,Bbygirllnaii,2025-03-14T10:31:00Z,https://www.youtube.com/watch?v=Unljg0RTQB4,,
"5 Day Juice Cleanse!  3 Kiwis, 1/2 Bunch of Spinach, 4 Celery Stalks #fypシ゚ #juicecleanse",LKd6Y0TxIr8,Riss Mc,2025-01-28T00:25:23Z,https://www.youtube.com/watch?v=LKd6Y0TxIr8,,
Juice for the week: Orange Power 🍊🥕🧡 #Juicing #JuiceCleanse #Juices #FreshPressJuice #juicerecipe,ibjm0yWZyGo,Olga Teresa de Jesus,2025-02-24T02:04:31Z,https://www.youtube.com/watch?v=ibjm0yWZyGo,,
Ditch the coffee! ☕🚫 Try these 3 powerful morning juices for natural energy! ⚡🍏🔥,DF55nJtTkhc,Lynn Nessa,2025-03-24T14:33:09Z,https://www.youtube.com/watch?v=DF55nJtTkhc,DITCH THE COFFEE!! ☕   Start your day with natural energy and detox power instead! These 3 POWERFUL juices will fuel your ...,
The Gift Of Juicing #freshjuice #freshvegetables #juicecleanse #naturaldetox #guthealth,_xgsu31MUq0,Rose Fitness,2025-02-19T23:08:06Z,https://www.youtube.com/watch?v=_xgsu31MUq0,,
Your discipline will be tested on a juice cleanse.... But the glow at the end is worth it.,BX1VHdLMbow,The Protein Bar,2025-03-28T01:49:21Z,https://www.youtube.com/watch?v=BX1VHdLMbow,,
✅ Day 1: Starting My Juice Fast! Only Fruits & Vegetables – How Long Can I Go?,fTjIAWjnqW0,Simply Hanessa,2025-02-19T03:00:57Z,https://www.youtube.com/watch?v=fTjIAWjnqW0,Starting My Juice Fast! Only Fruits & Vegetables – How Long Can I Go? | Simply Hanessa I'm starting a juice fast ...,
Day 1 of this 21 day juice cleanse! #ladytrucker #cleanse #juicing #trucker #cdl,-5phJ4v0Knk,Dekaily Davis,2025-01-24T01:50:33Z,https://www.youtube.com/watch?v=-5phJ4v0Knk,,
Day 3 Juice Cleanse #fypシ゚ #2025 #juicing #holistichealth #fyp #newyoutuber,Sz4J6od4eJ8,Riss Mc,2025-01-29T23:34:19Z,https://www.youtube.com/watch?v=Sz4J6od4eJ8,,
Natures Prebiotic Juice #juicerecipe #guthealth #healthyrecipes #juicecleanse,gNXG6A1Je5M,JP Thomas,2025-01-18T11:00:52Z,https://www.youtube.com/watch?v=gNXG6A1Je5M,,
This is my favorite drink I ever created #juicecleanse #30daychallenge #juice#greenjuice #cleanjuice,v2OAS9fhxes,VeganBae ,2025-01-15T21:09:23Z,https://www.youtube.com/watch?v=v2OAS9fhxes,,
Glow Green Juice: Your Daily Detox Elixir #GlowJuice  #DetoxDrink #JuiceCleanse #GutHealth #SkinGlow,bVC7nCpDBZU,Missja4you,2025-03-12T14:37:58Z,https://www.youtube.com/watch?v=bVC7nCpDBZU,"If you've been looking for a refreshing way to glow from the inside out, THIS is it! Celery – Detox and hydrate Green Apple ...",
#detox #greenjuice #healthylifestyle #juicecleanse #juicerecipes #newyear2025,tLz_MvxqE2M,Goddess ,2025-01-03T22:31:51Z,https://www.youtube.com/watch?v=tLz_MvxqE2M,,
#shorts #health #diet #fasting #juicecleanse #life#wellness,8wmEfq55XXE,Conscious Ti,2025-01-14T17:45:46Z,https://www.youtube.com/watch?v=8wmEfq55XXE,,
"3-Day Juice Fast: Reset, Rejuvenate & Glow Naturally!",1fu9F6tIIOE,Shweta Honagudi,2025-02-16T13:30:01Z,https://www.youtube.com/watch?v=1fu9F6tIIOE,"Ready for a total body reset? Try this 3-day juice fast! A juice cleanse helps your body detox, heal, and thrive! Here's how: ...",
Must Try Green Juice 🍏🥬🫒🍸 for Body Cleanse  #shorts #youtubeshorts #youtube #guthealth#detox#juice,z6Nm5bjOMYA,One Scoop Party,2025-01-22T05:19:38Z,https://www.youtube.com/watch?v=z6Nm5bjOMYA,Must Try Green Juice for body Detox and improve Gut Health Ingredients 1. Green Apple -1 2. Amla -1 3. Mint Leaves ...,
Day 2 Winter Reset Challenge. #fypシ゚ #fyp #cleanse #juice #2025 #newyoutuber,VjUqh5dIlAw,Riss Mc,2025-01-29T00:11:45Z,https://www.youtube.com/watch?v=VjUqh5dIlAw,,
Tricep and bicep curls #gymmotivation  #gymlife    #juicecleanse,eLXH7s7iUd0,Isaac Semwanga,2025-01-16T12:38:53Z,https://www.youtube.com/watch?v=eLXH7s7iUd0,gymmotivation #gymlife #juicecleanse Get a free WHOOP 4.0 and one month free when you join with my link: ...,
Just another Green Juice recipe #h302 #greenjuice #cleanse,O5dPjh0sB3E,The Earthly Reset,2025-01-15T10:06:59Z,https://www.youtube.com/watch?v=O5dPjh0sB3E,,
The Ultimate Detox Juice Recipe! 🍏🥒 #shorts #detox,ILyB3fz1edM,Claribel,2025-03-25T01:29:08Z,https://www.youtube.com/watch?v=ILyB3fz1edM,"The Ultimate Detox Juice Recipe! Boost Your Health Naturally!"" This detox juice is simple yet powerful! Packed with natural ...",
You Won't Believe What This Beetroot-Carrot Juice Does to Your Body! #health #juice,cJ6TBXsNS9w,noadiah health ,2025-02-28T08:10:57Z,https://www.youtube.com/watch?v=cJ6TBXsNS9w,"Experience the ultimate refreshment with our Beetroot Carrot Juice video, featuring a Beetroot Carrot Juice Recipe that delivers a ...",
ABC Juice #healthyfood #cure #juicecleanse #shortsfeed,01k_GXcbKZo,IslandPotCreation,2025-02-24T00:37:07Z,https://www.youtube.com/watch?v=01k_GXcbKZo,,
"giving my digestive system a break    Juice day, juicecleanse #detox #wellness #selfcare",nk5zgelJMfQ,fitmealmentors,2025-03-18T10:22:59Z,https://www.youtube.com/watch?v=nk5zgelJMfQ,,
#DetoxJuice#SmoothieRecipes#HealthyDrinks#JuiceCleanse#FreshJuices#JuicingForHealth#HomemadeJuice,hTGd5yYAR7w,skammyjuice,2025-01-23T17:21:38Z,https://www.youtube.com/watch?v=hTGd5yYAR7w,"Welcome to Skyummyjuice! Your ultimate destination for refreshing, delicious, and healthy drink creations. From energizing ...",
"#Saftkur #Juice #Cleanse #Detox, #Fasting #Fasten #Coldpressed #Reset",Wz9ryYFK4jo,Frank Juice GmbH,2025-03-17T12:31:58Z,https://www.youtube.com/watch?v=Wz9ryYFK4jo,,
Try my cranberry pomegranate juice recipe!! #juicingforhealth #juicingrecipes #juicecleanse,hoAPvYKWCrU,Chantel Jones Bigby,2025-01-02T21:45:42Z,https://www.youtube.com/watch?v=hoAPvYKWCrU,Juicing has been life changing for me on my wellness juice!! Try one of my favorite recipes- Cranberry Pom Juice. Made with ...,
Easy Watermelon Juice 🧃  #juice #watermelonjuice #shorts,a_Mk2CBCIK0,JSR  KITCHEN  VLOG,2025-03-09T22:03:43Z,https://www.youtube.com/watch?v=a_Mk2CBCIK0,"Easy Watermelon Juice Refresh your day with a quick and easy watermelon juice recipe! Perfect for hot summer days, this fruit ...",
"Green Detox Smoothie: Celery, Cucumber, Apple & Ginger # #subscribe #smoothie #shorts",iEoD2cVxzXo,Watch&Drink,2025-01-23T14:43:02Z,https://www.youtube.com/watch?v=iEoD2cVxzXo,"Looking for a quick and delicious way to boost your energy and stay healthy? This green detox juice combines celery, cucumber, ...",
Day 4 Of My 21 Day Anti-Inflammatory Juice Detox #juicewrld #antiinflammatory #inflammation  #juicer,_Mlcxj-6HE8,Inflammation Help,2025-03-07T22:33:41Z,https://www.youtube.com/watch?v=_Mlcxj-6HE8,"It's day 4 of my 21-day anti-inflammatory detox, and I'm making a delicious Basil Chard Refresher! Ingredients: 1 cup basil 2 ...",
You know you dead wrong! #fitnessgoals #JuiceCleanse #moneygoals #newyeargoals,hKoY2T7-j4c,The Protein Bar,2025-01-02T00:27:09Z,https://www.youtube.com/watch?v=hKoY2T7-j4c,,
Best Juice Cleanse for Weight Loss #coldpressedjuice #weighloss #detoxjuice #detox #juicecleanse,3MJaQnb65Ow,Green Press Inc.,2025-03-05T16:14:04Z,https://www.youtube.com/watch?v=3MJaQnb65Ow,"When you're looking to start looking and feeling your greatest, Green Press is here to help! What you put in your body dictates ...",
Day 9 Of My 21 Day Anti-Inflammatory Juice Detox #antiinflammatory #juice #inflammation #juicewrld,HUl9_X-SMSE,Inflammation Help,2025-03-12T23:00:11Z,https://www.youtube.com/watch?v=HUl9_X-SMSE,"Day 9 already and we're making my favourite juice, the Fennel Mint Delight! I hope you enjoy it as much as I do! ✓ 1 large ...",
Another beautiful days = a body cleansing juice 🌱 #juicecleanse #glowingskin #flattummy,-Mk1yoG5_i8,Ashley G - Glo and Grow Lifestyle,2025-01-20T02:58:21Z,https://www.youtube.com/watch?v=-Mk1yoG5_i8,,
It’s 7 AM on a Tuesday! 💪🏼🌿 #morningroutine #wheatgrassbenefits #juicecleanse #glowup,XogIRmJstys,Mrs Bennett,2025-03-18T13:44:50Z,https://www.youtube.com/watch?v=XogIRmJstys,,
"baby’s first juice cleanse 🥤new year, new challenges! how do y’all feel about juice cleanses?? 👁️",FCTiHItK1oo,Eryka Lenise,2025-01-06T04:49:40Z,https://www.youtube.com/watch?v=FCTiHItK1oo,,
Detox Juice Recipes: Boost Your Energy with Beetroot Juice                     #food  #cook #recipe,Rdy5qwSvBzY,Solely recipes,2025-02-26T11:11:11Z,https://www.youtube.com/watch?v=Rdy5qwSvBzY,"Feeling sluggish? Try these detox juice recipes, featuring the powerful beetroot juice, to boost your energy and refresh your body!",
Full Juice Cleanse Day 4,03Gl_XLz0CA,DiabeticDad Man,2025-01-29T17:00:01Z,https://www.youtube.com/watch?v=03Gl_XLz0CA,Day 4 of my juice diet to reverse my Type 2 Diabetes Going strong today! We're getting close to a week in and I'm still feeling great ...,
Eat Clean. Stay Juicy #music #juicer #juicecleanse #greenjuice #fypシ゚ #fy #newyoutuber,E1bgIofaHIU,Riss Mc,2025-02-12T23:42:24Z,https://www.youtube.com/watch?v=E1bgIofaHIU,,
🥒🍍 #juice #fruit #health #healthy #cleanse #motivation #youtubeshorts #youtube #fyp,TXhstG2DVBI,Mishel Ncube,2025-03-04T21:01:06Z,https://www.youtube.com/watch?v=TXhstG2DVBI,,
Finally tried it.. Dr. Yaki Awakened Cleans Juice #cleanse #juicecleanse  #juice #50andfit,uhYjrbxyWog,Mrs. Danita,2025-02-27T17:11:56Z,https://www.youtube.com/watch?v=uhYjrbxyWog,,
#DetoxJuice#SmoothieRecipes#HealthyDrinks#JuiceCleanse#FreshJuices#JuicingForHealth#HomemadeJuice,b4g0Yd61bBo,skammyjuice,2025-02-08T18:02:43Z,https://www.youtube.com/watch?v=b4g0Yd61bBo,"Welcome to Skyummyjuice! Your ultimate destination for refreshing, delicious, and healthy drink creations. From energizing ...",
This Juice Cleanse Sent Me to the ER... WTF?!,UTdSmpf_0Hs,Everything Fiction,2025-03-06T01:30:26Z,https://www.youtube.com/watch?v=UTdSmpf_0Hs,This Juice Cleanse Sent Me to the ER... WTF?!,
Locked into a 21 day juice cleanse. I’ve been asked why? To prove to myself that I can! 💪🏾#health,qUKqSMm-IxY,Sorcha M. Brown,2025-01-02T22:24:16Z,https://www.youtube.com/watch?v=qUKqSMm-IxY,,
Heart Beet Juice  #juicecleanse #juice #juicedetox,7ZCgq-sykC8,MindJoyWithin,2025-03-24T17:00:15Z,https://www.youtube.com/watch?v=7ZCgq-sykC8,"Beets and cucumbers are both nutritious vegetables that, when juiced together, create a refreshing drink packed with health ...",
Heathy&Tasty - Vegetable Juice in just 5 mins 😋,hHmWIuWdS0E,TastyBitesWithRajji,2025-03-27T14:14:02Z,https://www.youtube.com/watch?v=hHmWIuWdS0E,"Ingredients   Freshly cut celery Beetroot Cucumber Carrot Spinach Ginger Orange/ Apple {healthy juice, food blogger, veggie ...",
Power Detox Juice:-Immunity aur Glow ka Ultimate Booster #healthydrink #shortvideo #viralvideo #food,6TPn2HlQzTc,Kavita_ki_rasoi,2025-02-12T10:05:51Z,https://www.youtube.com/watch?v=6TPn2HlQzTc,Hey! Did you know to make a healthy Power Detox Juice:-Immunity aur Glow ka Ultimate Booster #healthydrink #shortvideo ...,
✅ Day 5: Juice Fast for Weight Loss? Here’s What the Scale Says!,LGuRZjGRUeI,Simply Hanessa,2025-02-22T02:36:49Z,https://www.youtube.com/watch?v=LGuRZjGRUeI,Recipe: Total three 64 ouch jug 3 pineapples 2 bunch celery 2 lemon 3 ginger 8 kiwi 4 bell pepper 2 bags carrot 2 bunch of kale 1 ...,
productive morning vlog with a juice cleanse 🥒 #cookwithme #grwm #dayinmylife,XL3UBPTYjpU,raylene piera,2025-02-06T00:48:11Z,https://www.youtube.com/watch?v=XL3UBPTYjpU,,
#morningroutine #whatieatinaday #juicecleanse #antiinflammatory #bloating #weightloss #glowingskin,KO58ETc6vok,The Loud South Indian girl,2025-01-09T19:53:07Z,https://www.youtube.com/watch?v=KO58ETc6vok,Ginger turmeric shots.,
healthy detox juice (part-2) |Dr.Karanam Parinithi #detoxjuice #turmeric #shortstelugu  #shorts,OQp1LbQ6Nl4,Diet and Slim by Pari,2025-01-26T04:45:02Z,https://www.youtube.com/watch?v=OQp1LbQ6Nl4,in this video Dr.Karanam Parinithi will be explaining about healthy detox drink made of amla turmeric and ginger #detoxjuice ...,
Day 6/30 Juice Cleanse! So simple yet very powerful juice 💪 #juice recipe #juicecleanse,a8u3ZxACpIQ,Ashley G - Glo and Grow Lifestyle,2025-01-04T23:38:33Z,https://www.youtube.com/watch?v=a8u3ZxACpIQ,,
doing a juice cleanse this week! #asmr  #juicer  #juicerecipe  #juicerecipes  #tiktokshopfinds,RFynn_fxW-c,Rebecca ,2025-03-26T15:33:12Z,https://www.youtube.com/watch?v=RFynn_fxW-c,,
#detox #healthylifestyle #juicecleanse #juicerecipes #greenjuice #newyear2025 #yahki #narasmith,xH5jOoMHUb4,Goddess ,2025-01-04T01:30:46Z,https://www.youtube.com/watch?v=xH5jOoMHUb4,,
Try this juice for glowy skin ✨ #glowingskin #juicecleanse #juicerecipe,J2F9ZdTh5rk,Ashley G - Glo and Grow Lifestyle,2025-01-21T03:25:47Z,https://www.youtube.com/watch?v=J2F9ZdTh5rk,,
"Happy Morning! Cleanse and refresh with this Kale,Apple and Lemon juice !",Hn754ffsfYU,Padmeh,2025-01-18T08:55:28Z,https://www.youtube.com/watch?v=Hn754ffsfYU,,
Must try juice! Watch for recipe! 🌱 drink up and feel the Glo ✨ #gloandgrowlifestyle #juicecleanse,trZMTojSOps,Ashley G - Glo and Grow Lifestyle,2025-01-18T05:40:01Z,https://www.youtube.com/watch?v=trZMTojSOps,,
Juice cleanse for breakfast 🍎🍊         #juicer #juicecleanse #juicing #breakfast #drinks #healthy,0Zw3cK0KlSQ,Sophia Soong,2025-02-01T23:56:47Z,https://www.youtube.com/watch?v=0Zw3cK0KlSQ,,
Juice cleanse myth! Debunking again! #mythsdebunked #cleanse #juice #health,2y6v3q3STag,Biohacking world,2025-02-15T18:59:55Z,https://www.youtube.com/watch?v=2y6v3q3STag,,
Day 8 Of My 21 Day Anti-Inflammatory Juice Detox  #antiinflammatory  #juicewrld #veganrecipes,Z_fDgzP_9C0,Inflammation Help,2025-03-11T23:00:26Z,https://www.youtube.com/watch?v=Z_fDgzP_9C0,"Day 8 brings another refreshing juice, the Parsley Bok Choy Juice! Stay focused on results and feeling better each and every day!",
Heal your eyesight naturally! #vegan #juicing #juicedetox #juicecleanse,LStyU2-PgJE,Olivia Hertzog,2025-03-14T17:17:10Z,https://www.youtube.com/watch?v=LStyU2-PgJE,Do you need a stronger prescription? Or do you need more beta carotene? Juice recipe: 15 mandarin oranges 1lb of carrots ...,
#juicerecipes #juice #juicecleanse #cleanjuice #cleaneating #veganlifestlye #vegan#healthylifestyle,mS0EQiuwFyQ,VeganBae ,2025-01-31T19:33:12Z,https://www.youtube.com/watch?v=mS0EQiuwFyQ,,
