Title,Video ID,Channel,Published At,URL,Description,Video Length
Benefits of lemon water for digestion and hydration #health #healthtips #lemon,czkIauO2-dg,TopRatedProducts,2025-03-14T16:56:43Z,https://www.youtube.com/watch?v=czkIauO2-dg,Benefits of lemon water for digestion and hydration.,
Incredible Benefits of Lemon water and Turmeric #health #healthtips #wellness #healing,ghUL8DaPlQE,Health-in-a-Flash,2025-02-24T19:10:26Z,https://www.youtube.com/watch?v=ghUL8DaPlQE,,
Lemon Water Boosts Immunity and Aids Digestion,xO25J-HSgh0,BrainDance,2025-03-17T16:02:38Z,https://www.youtube.com/watch?v=xO25J-HSgh0,"Drinking lemon water is an easy way to strengthen the immune system and improve digestion. Rich in vitamin C and antioxidants, ...",
Hyper Realistic lemon water nd glass Art #views #viralreels#viralshort#viralshorts#trendingshorts,dNNCUhNgjEw,Artist Ankit P Joshi,2025-02-17T16:09:03Z,https://www.youtube.com/watch?v=dNNCUhNgjEw,views #viralreels#viralshort#viralshorts#trendingshorts#shortsviral#trending #trendingreels #trendingsong ...,
Surprising Health Benefits of Lemon Water !,uC0z_5XmuAM,Evergreen Essence,2025-02-25T19:30:05Z,https://www.youtube.com/watch?v=uC0z_5XmuAM,Lemon Water Benefits You Can't Miss! Lemon water is a refreshing drink that can improve your health in so many ways!,
Why Lemon Water is a Celebrity Secret? 🍋✨”,MdVytjib8h8,Well Natural Health,2025-01-28T17:09:03Z,https://www.youtube.com/watch?v=MdVytjib8h8,"Have you ever wondered why lemon water is the ultimate health trend? Celebrities, fitness gurus, and everyone in between can't ...",
Lemon Water Side Effects For Vastu in Business Environment | Aroma Vastu | Dr. Kunwar Sawhney,NOGlEsjvv8c,Aroma Vastu,2025-01-22T12:40:54Z,https://www.youtube.com/watch?v=NOGlEsjvv8c,Lemon water side effects for vastu in business environment | Aroma Vastu | Dr. Kunwar Sawhney | Vastu Tips :: Order Now ...,
lemon 🍋tree #music #musician #sound #jazz #viralshort #lemon #lemontree #lemonwater #millionviews,YCjIEh_rfKs,cute girl vlog,2025-03-05T04:06:16Z,https://www.youtube.com/watch?v=YCjIEh_rfKs,lemon tree #music #musician #sound #jazz #viralshort #lemon #lemontree #lemonwater #millionviews.,
The Amazing Effects of Drinking Lemon Water!,maopRWfwYeY,Healthy Heart,2025-02-12T16:01:00Z,https://www.youtube.com/watch?v=maopRWfwYeY,"Ever wonder how lemon water could transform your day? From boosting hydration to supplying vitamin C, it's a quick and ...",
lemon water benefits | weight loss lemon water | Wk8/10-Day5(40) #shorts,5ny0NacPb1w,Fitness Content By Rohan,2025-03-22T13:58:31Z,https://www.youtube.com/watch?v=5ny0NacPb1w,lemon water benefits | weight loss lemon water | Wk8/10-Day5(40) #shorts weight loss lemon water in the morning weight loss ...,
"Lemon water Benefits: How to make Refreshing Lemon water for Skin, Digestion & More!",iTvEPphUhTM,Juice & Foods,2025-03-21T11:45:04Z,https://www.youtube.com/watch?v=iTvEPphUhTM,"Lemon water Benefits: How to Make Refreshing Lemon Water Welcome back to my channel! In today's video, I'm sharing how to ...",
Unlock Wellness! Warm Lemon Water 🍋 vs. Apple Cider Vinegar 🥤 – Which Aids Digestion More?,1_dXsX6gKqE,Wellness Shortcut,2025-02-25T14:30:01Z,https://www.youtube.com/watch?v=1_dXsX6gKqE,Unlock Wellness! ✨ Warm lemon water vs. apple cider vinegar—what's better for digestion? Find out which one supports your ...,
✨chia seed lemon water 🍋🥤#shorts #shortvideo #shortsfeed #lemon #lemonjuice #lemonwater #cooking,dNL_BBZwubw,@nickincook,2025-03-27T04:06:51Z,https://www.youtube.com/watch?v=dNL_BBZwubw,,
#coffee #lemon #water #tea #latteart,EsvoUl83Y-o,SOKROS-KH,2025-03-05T03:33:27Z,https://www.youtube.com/watch?v=EsvoUl83Y-o,,
We are drinking lemon water for 14 days join us for free ! #friendsoftheearth #water #shorts #detoxd,13ug6s12gb4,Healthy Side,2025-01-30T11:41:09Z,https://www.youtube.com/watch?v=13ug6s12gb4,We are drinking lemon water for 14 days join us for free ! #friendsoftheearth #water #shortsvideo Join this channel to get access to ...,
🌿🍋Summer Drink : mint and lemon water 🍸#notjustanengineerofficial #summerdrink,9spWJ9d9S_s,NotJustAnEngineerOfficial,2025-02-17T12:00:22Z,https://www.youtube.com/watch?v=9spWJ9d9S_s,,
"Start your day with a glass of lemon water! 🍋💧 Boost immunity, aid digestion #HealthyLiving",0akEbkCjN9o,Swad Sangam,2025-03-24T03:16:25Z,https://www.youtube.com/watch?v=0akEbkCjN9o,Health Benefits of Lemon Water with honey Lemon water is a simple yet powerful drink that can boost your health in many ways: ...,
Why Lemon Water is Your Morning Game-Changer! #LemonWater #HealthyHabits #MorningRoutine #Hydration,yM8aDFP08xY,Healthy Pathways,2025-02-22T16:01:06Z,https://www.youtube.com/watch?v=yM8aDFP08xY,,
Lemon water and benefits!#gym #shorts #fitlife  # fitness # lemon #glowing skin.,Nonto8GvKXo,SUPREME FITNESS,2025-01-28T17:51:43Z,https://www.youtube.com/watch?v=Nonto8GvKXo,,
Lemon water yummy #shorts #lemon #water,eZKgSyUaUKU,New Mummy's World,2025-02-21T16:00:59Z,https://www.youtube.com/watch?v=eZKgSyUaUKU,,
Why i drink water with lemon 🍋 #skincare #lemon #lemonwater  #chloe,OYYykrsE4tE,Chloeischoi,2025-01-16T17:00:33Z,https://www.youtube.com/watch?v=OYYykrsE4tE,,
Lemon water Morning routine #relaxingmusic #lemon #water,4eccEA3TNWw,Chibueze A.,2025-01-30T05:55:41Z,https://www.youtube.com/watch?v=4eccEA3TNWw,"Himalayan salt is a natural source of essential minerals like sodium, potassium, magnesium, and calcium that are needed to keep ...",
What Happens When You Drink Lemon Water At Night,SHRDAL9shLM,Live Healthy Life,2025-01-27T09:45:04Z,https://www.youtube.com/watch?v=SHRDAL9shLM,"Disclaimer: Always consult with a healthcare professional before starting any new health regimen, especially if you have ...",
How to make lemon water l Nimbu Pani,qfmvqJ4HUaY,Swaad by kuni ,2025-03-04T07:41:14Z,https://www.youtube.com/watch?v=qfmvqJ4HUaY,Perfect Lemon Water Ingredients:- Lemon Chilled Water Sugar powder Jeera Powder Lemon juice Black salt Salt Mint leaves ...,
Chia & Lemon Water 🍋💧 | Morning Detox for Weight Loss & Digestion #chiaseeds #shorts #healthy,TGwcCojstQI,In my 20's,2025-02-16T05:15:13Z,https://www.youtube.com/watch?v=TGwcCojstQI,"Start your day with Chia & Lemon Water, a refreshing detox drink that boosts metabolism, aids digestion, and supports weight loss ...",
Lemon water mistakes #lemon #lemonwatermistakes ##lemonwaterbenefits #healthyliving #lemonade,sOZ0EAprnCQ,Nourish 'N' Thrive,2025-01-15T15:54:07Z,https://www.youtube.com/watch?v=sOZ0EAprnCQ,"Do you know the lemon water mistakes you must avoid? While lemon water is a fantastic way to boost your health, some ...",
Lemon Water #vitaminc #antioxidants #collagen #reduceinflammation #vlogs  #lemonwaterbenefits,ExD89nXvCy8,Rock Just Living,2025-02-24T17:57:16Z,https://www.youtube.com/watch?v=ExD89nXvCy8,,
Turmeric and lemon water #nutritiontips #nutritionfacts #juice #nutritionsecrets #turmeric #water,Zh2OQdcl0cQ,Nutritional Hacks,2025-02-13T01:23:32Z,https://www.youtube.com/watch?v=Zh2OQdcl0cQ,,
Coconut lemon water. #drinkrecipe#shorts#ytshorts #recipe#viralshort #summerdrink,hmcVzoLn4zE,Tribal Khana Khazana ,2025-03-18T04:08:19Z,https://www.youtube.com/watch?v=hmcVzoLn4zE,Coconut lemon water. #drinkrecipe#shorts#ytshorts #recipe#viralshort #summerdrink.,
Benefits of Drinking Lemon Water,wisXjk24xT4,Rich Farms,2025-02-04T10:50:23Z,https://www.youtube.com/watch?v=wisXjk24xT4,8 Benefits of Drinking Lemon Water in the morning Benefits of Drinking Lemon water daily Drinking Lemon water daily offers ...,
Lemon Water: Healthy Habit or Hidden Danger? 🍋⚠️,EE_U9Cx6kQg,Know Your Body Zen ,2025-01-05T12:30:19Z,https://www.youtube.com/watch?v=EE_U9Cx6kQg,Discover the truth about drinking lemon water on an empty stomach in our latest video! ✨ While this popular morning ritual is ...,
"#Morning recovery reset: Lemon water, incline walk, 50°F plunge. #fitness #fitnessmotivation",qkUDx8Ih03g,HelloMichella,2025-02-18T07:28:16Z,https://www.youtube.com/watch?v=qkUDx8Ih03g,,
Day 1 Of Vegan Fitness Routine | Hot Lemon Water | Nitt Fit,u_cYb2qF1Lk,Nitt Fit,2025-01-16T04:05:08Z,https://www.youtube.com/watch?v=u_cYb2qF1Lk,"In this video, I'm kickstarting my fitness routine with a refreshing and detoxifying glass of hot lemon water . Watch as I share my ...",
best morning drink  chia seed ☕ ☕ lemon water,whHy6p-dDOM,Latabisht21 ,2025-03-28T10:45:08Z,https://www.youtube.com/watch?v=whHy6p-dDOM,,
Boost Nutrient Absorption: The Power of Lemon Water,J53GntuIlNk,"Vibrant, Healthy and Fit",2025-01-28T06:02:30Z,https://www.youtube.com/watch?v=J53GntuIlNk,"Discover how lemon water enhances the absorption of essential nutrients, especially non-heme iron. We'll explain the science ...",
I am obsesssd with these little powerful Super H2O lemon water packets! Hydration nation here I,o4sUj3x_mcI,Kelly Ann Gorman,2025-02-23T17:05:46Z,https://www.youtube.com/watch?v=o4sUj3x_mcI,I am obsesssd with these little powerful Super H2O lemon water packets! Hydration nation here I come! #creatorsearchinsights ...,
Start Your Day with Lemon Water & Salt for Better Hydration! 🍋💧,GAXZz3S6SVg,"Health, Wealth & Happiness Hub",2025-01-15T23:14:54Z,https://www.youtube.com/watch?v=GAXZz3S6SVg,Did you know a simple glass of lemon water with a pinch of salt can boost your hydration and improve digestion? It's the perfect ...,
Benefits of lemon water in the morning for skin| benefits of drinking lemon water #shorts  #skin,qkjB7pb51GY,Wellness with Suvarna,2025-03-10T16:14:00Z,https://www.youtube.com/watch?v=qkjB7pb51GY,"Benefits of lemon water in the morning for skin| benefits of drinking lemon water #shorts #skin Your Queries: health, lemon water, ...",
Unlock the Amazing Benefits of Fresh Lemon Water,NJfg4oacpXQ,"Vibrant, Healthy and Fit",2025-01-29T06:00:30Z,https://www.youtube.com/watch?v=NJfg4oacpXQ,"Discover the truth about lemon water! We highlight the nutritional superiority of fresh lemons, the risks of overconsumption, and ...",
Healthy drink#greentea #honey#lemon#water#healthydrink#skincare #healthylifestyle #subscribe,fdVCnYXahnw,Priyanka Verma,2025-02-06T07:01:28Z,https://www.youtube.com/watch?v=fdVCnYXahnw,,
"""Lemon Water for Glowing Skin? #shorts #health",c8W8f_xfuKY,LifeLine,2025-03-14T02:52:46Z,https://www.youtube.com/watch?v=c8W8f_xfuKY,"Lemon water is known for its amazing health benefits, but does it really work? I tried drinking it every morning for 7 days, and the ...",
Celtic sea salt lemon water concoction for hydration and a slight detox.   #fypシ #healthylifestyle,IY4BLntCVlw,Tay's Holistic Hustle,2025-03-17T14:34:08Z,https://www.youtube.com/watch?v=IY4BLntCVlw,,
"""Unlock the Health Benefits of Lemon Water: Why You Should Start Drinking It Every Morning!""#immune",JfnXbutD8-U,@POWER KHATU WALE KI 🙏🏻,2025-02-22T10:30:47Z,https://www.youtube.com/watch?v=JfnXbutD8-U,"Description:**""Discover the incredible health benefits of adding lemon to your water! In this video, we explore how lemon water ...",
Empire victor by Khadlaj and Lemon Water by Tru Fragrances #middleeastfragrance #fragrance #perfume,tDi67s0oUJw,Gen Bel,2025-01-16T02:53:53Z,https://www.youtube.com/watch?v=tDi67s0oUJw,,
Shocking Benefits of Drinking Lemon Water Every Morning,okYGPbPsPJ8,envilush,2025-01-25T13:15:05Z,https://www.youtube.com/watch?v=okYGPbPsPJ8,Shocking Benefits of Drinking Lemon Water Every Morning drink warm water with lemon juice every morning Did You Know ...,
Positives and Negatives of Drinking Lemon Water in the Morning 🍋,Y3PX1Ss22QA,Wholesome Life Diaries,2025-01-20T19:22:04Z,https://www.youtube.com/watch?v=Y3PX1Ss22QA,"Starting your day with lemon water is a popular health trend, but is it all good for you? In this video, we explore the benefits and ...",
Upon Waking Cleanse:Lemon water:Make 64oz for the day and evening. Start with 32oz:Set timer 30 min.,Ph1lqB5TjEo,Shirley Itza Chan,2025-03-02T01:30:21Z,https://www.youtube.com/watch?v=Ph1lqB5TjEo,,
"Glow Up with Lemon & Cucumber Water: Refresh, Hydrate, Thrive #lemon #skincare #shorts",2JxP_ck33UQ,LifeLine,2025-03-27T16:00:05Z,https://www.youtube.com/watch?v=2JxP_ck33UQ,"cucumber #lemon #drinks #health #healthyfood #youtubeshorts 1. “Glow Up with Lemon & Cucumber Water: Refresh, Hydrate, ...",
Mojito❤️😍#mojito #drinks #colddrink#summerdrink #lemonwater #sprite#shorts #shortvideo #song #water,zbsnMWSZRhY,All In One@Rathaan.b,2025-03-31T14:51:31Z,https://www.youtube.com/watch?v=zbsnMWSZRhY,,
Lemon Water: Your Natural Allergy Relief Solution!,GATzn3SevDQ,"Vibrant, Healthy and Fit",2025-02-03T06:00:25Z,https://www.youtube.com/watch?v=GATzn3SevDQ,Discover how lemon water can ease seasonal allergies with its natural antihistamine properties. We explore its benefits in ...,
Day 1: Drink one glass of #lemon water #everyday #challenge #healthyyears #healthyliving,OwxODROT50I,Hangout With Kim,2025-02-11T10:35:50Z,https://www.youtube.com/watch?v=OwxODROT50I,"Hi, I'm Kim Originally from The South Of Vietnam, I am now exploring life in France, and since I have had a chance to live in ...",
Mocktail #lemon water #shortsvideo viral video,F-_-P_YMAww,Indian Foodie boy,2025-03-16T13:31:55Z,https://www.youtube.com/watch?v=F-_-P_YMAww,,
Lemon Water  Weight Loss Myths Busted!  #healthylifestyle,XnfnvAgjSzg,Fitness Boost Pro,2025-02-12T15:51:30Z,https://www.youtube.com/watch?v=XnfnvAgjSzg,Lemon Water Weight Loss Myths Busted! #healthylifestyle.,
My recipe lemon 🍋 water #lemon #lemonwaterbenefits #lemonjuice #lemonwater #song #love #viralshort,X1pFpG3vjpA,cute girl vlog,2025-02-24T13:31:38Z,https://www.youtube.com/watch?v=X1pFpG3vjpA,My recipe lemon water #lemon #lemonwaterbenefits #lemonjuice #lemonwater #song #love #viralshort #views.,
What Happens When You Drink Lemon Water #shorts #lemonwater #health #immunityboost #lemonbenefits,_fumC5yshqE,Fact Flix,2025-03-07T23:00:26Z,https://www.youtube.com/watch?v=_fumC5yshqE,What Happens When You Drink Lemon Water #shorts #lemonwaterbenefits #health #immunityboost #lemonbenefits #lemon ...,
#lemon honey water healthy tasty drink#trending #shortvideo,TUKJQSMrZpM,@Alisha videos,2025-01-23T07:31:06Z,https://www.youtube.com/watch?v=TUKJQSMrZpM,trending healthy morning lemon water / weight loss drink / lemon with honey add water bowl and drink/ morning diet/ lemon fat ...,
"Honey lemon water with chia seeds, summer drink #youtube #shorts #reel #shortvideo",-kchrUEx4MA,krishna kitchen,2025-03-25T05:51:00Z,https://www.youtube.com/watch?v=-kchrUEx4MA,,
Lemon water with honey & apple cider vinegar,jR8ZYEE7WxI,Marlan’are,2025-02-25T02:45:59Z,https://www.youtube.com/watch?v=jR8ZYEE7WxI,,
Can Lemon Water Detox 🍋 Improve Our Breath and body odor?,59CEBCd7kkE,Meet Dr. Gyimah,2025-03-12T21:01:29Z,https://www.youtube.com/watch?v=59CEBCd7kkE,"In this video, we explore the benefits of a lemon water detox lasting 24 to 72 hours. Learn how managing stress impacts digestion ...",
Boost your morning with this lemon and grapefruit water #lemonwater #grapefruits #mint.,QiTwQsaHyLo,Chana Zie's Twist,2025-01-25T14:22:38Z,https://www.youtube.com/watch?v=QiTwQsaHyLo,,
Lemon water benefits #health #drink #lemon #water #shorts,EVXZOduzVlg,Beautifit,2025-03-26T23:00:11Z,https://www.youtube.com/watch?v=EVXZOduzVlg,,
Blueternate add to lemon water equals purple water #shorts #blueflower #lemon .,ovH-R7WeivY,RandomVids,2025-02-04T13:21:36Z,https://www.youtube.com/watch?v=ovH-R7WeivY,,
Benefits of having lemon water daily for 14days #health #diet #lemon #water r,9Bidwd8eaeM,HEALTH IS WEALTH,2025-01-05T02:24:59Z,https://www.youtube.com/watch?v=9Bidwd8eaeM,Description: The Amazing Benefits of Drinking Lemon Water Daily for 14 Days Have you ever wondered how a simple glass of ...,
APPLE CIDER VINEGAR AND LEMON WATER IN THE MORNING FOR WEIGHTLOSS,myXHjoW94Do,Lunga Xulu,2025-02-05T07:30:23Z,https://www.youtube.com/watch?v=myXHjoW94Do,I take apple cider vinegar and lemon water in the morning in order to reduce belly fat.,
Avoid lemon water if you suffer from these  4 health conditions,sjIlgQxRaVc,Prodiv delly,2025-01-26T02:34:39Z,https://www.youtube.com/watch?v=sjIlgQxRaVc,"Avoid lemon water if you suffer from these 4 health conditions! In this video, discover the surprising reasons why lemon might not ...",
Can you drink lemon water while fasting?,0dVjxY-kxds,Emma | Your Fasting Coach,2025-02-27T20:00:00Z,https://www.youtube.com/watch?v=0dVjxY-kxds,Can you have lemon in your water while fasting? #fastingforweightloss #intermittentdiet #fasting #fastingforhealth #omad ...,
Drink LEMON WATER Every Day Part B   #healthtips #easynutrition #facts,x2-BDo4XtPU,MINUTE HEALTH TIPS,2025-03-25T14:01:09Z,https://www.youtube.com/watch?v=x2-BDo4XtPU,https://linktr.ee/minutehealthtips Disclaimer: The information provided on this channel is for educational and informational ...,
Benefits of drinking fat burning Lemon Water in the morning 🍋🔥 #lemonwater #fatloss,zX0Vsm3YE1k,Dougie Doge,2025-02-26T11:02:31Z,https://www.youtube.com/watch?v=zX0Vsm3YE1k,,
Chia Seeds & Lemon Water: The Ultimate Health Duo!,HcCPpZ-MdLg,Sheetal Kumar Niranjan,2025-01-12T23:20:27Z,https://www.youtube.com/watch?v=HcCPpZ-MdLg,Discover the incredible health benefits of combining chia seeds and lemon water in this vibrant 2-minute video! From boosting ...,
This method makes your lemon water ready in two minutes | Asmat's food kitchen,Xrp1LHceFSg,Asmat's Food Kitchen ,2025-03-01T09:20:55Z,https://www.youtube.com/watch?v=Xrp1LHceFSg,beefkorma #chickenshamikebab #cooking #food #indianfood #recipe #shamikababrecipe #easyrecipe #howtomakeshamikabab ...,
Myth Drinking lemon water on an empty stomach makes you lose weight #shorts,zrWLvVjHn78,Healthy News Articles,2025-03-18T16:04:41Z,https://www.youtube.com/watch?v=zrWLvVjHn78,Myth Drinking lemon water on an empty stomach makes you lose weight.,
Lemon water good for health 💪😊😊,AzrsA_SxWbE,Lekshu@nandu,2025-03-20T08:06:38Z,https://www.youtube.com/watch?v=AzrsA_SxWbE,,
Improve Digestion with Lemon Water! 🍋💧 #wellness #health #facts,VEzEQm5WYYk,Good Vibes All Day,2025-02-02T12:00:28Z,https://www.youtube.com/watch?v=VEzEQm5WYYk,"Lemon water stimulates digestive enzymes... Subscribe to stay inspired with fresh insights, motivation stories, and personal ...",
"Can You Lose Weight Just by Drinking Lemon Water?"" – Debunking weight loss myths.",BfiUvp3l3Y4,Dr UZMA AZAM,2025-01-31T04:28:38Z,https://www.youtube.com/watch?v=BfiUvp3l3Y4,lemon water affects on weight loss effects of lemon water on weight loss lemon water weight loss how does drinking lemon water ...,
Drinking Warm Lemon Water Every Morning Helps Detoxify #shorts #lemonwater #lemonwaterbenefits,yN6hGDwsL_g,Sunset Beauty Health,2025-03-03T20:00:41Z,https://www.youtube.com/watch?v=yN6hGDwsL_g,Drinking Warm Lemon Water Every Morning Helps Detoxify #shorts #lemonwater #lemonwaterbenefits #morningdetox.,
Drink LEMON Water For 40 DAYS? #healthtips #shorts,lNld9o9MkHs,The Mindhunters,2025-03-01T12:30:49Z,https://www.youtube.com/watch?v=lNld9o9MkHs,What happens when you drink lemon water every day for 40 days? Get ready to discover the surprising benefits that science ...,
Morning Lemon Water to Clear Acne,5PMs7upPX3U,"Dr. Alyssa DeSena, ND | Holistic Acne Healing",2025-01-24T12:45:00Z,https://www.youtube.com/watch?v=5PMs7upPX3U,"Just waking up, but I wanted to share a few reasons why you should incorporate lemon water into your mornings Dr. Alyssa's Most ...",
Lemon Water Benefits #lemonwater #healthtips,a-axSF8Nv7A,Vijayharsha Boga,2025-01-21T15:24:05Z,https://www.youtube.com/watch?v=a-axSF8Nv7A,,
Never Drink Lemon Water for These Health Reasons: Fatal Mistakes to Avoid! ⚠️🍋”,HDDKtOyrwag,What The Doctor Says,2025-01-07T08:00:06Z,https://www.youtube.com/watch?v=HDDKtOyrwag,"In this video, we'll reveal why you should never drink lemon water for certain health reasons. Learn the fatal mistakes to avoid ...",
नींबू पानी पीने के बेमिसाल फायदे। Amazing benefits of drinking lemon water.,l_0HsyddkWY,Nafis Ms,2025-03-17T15:45:16Z,https://www.youtube.com/watch?v=l_0HsyddkWY,"नींबू पानी पीने के बेमिसाल फायदे। #Amazing benefits of drinking lemon water. weight gain, mota ...",
"""Shocking Truth: Can Lemon Water & Juices Really Melt Fat?""",Ym0ZWGFQTLc,HOty MAma,2025-01-12T05:33:16Z,https://www.youtube.com/watch?v=Ym0ZWGFQTLc,"""Shocking Truth: Can Lemon Water & Juices Really Melt Fat?"" Lemon water, detox juices, and ""quick-fix"" weight loss tips—do they ...",
Benefits Of Drinking Lemon Water Every Morning | LEMON WATER HEALTH BENEFITS,uipQSzb3DxQ,BloomByBeepee,2025-01-20T05:15:27Z,https://www.youtube.com/watch?v=uipQSzb3DxQ,Find out why it's essential for your health to drink lemon water every morning! This simplest practice has numerous ...,
Lemon water #cool water #tasty #subscribe #,4qPcrE1yBh0,MJ vlogs (universe of nijus ).,2025-02-23T14:22:58Z,https://www.youtube.com/watch?v=4qPcrE1yBh0,,
Boost Your Immunity with Simple Lemon Water,YN7p0eB2C14,"Vibrant, Healthy and Fit",2025-02-05T06:02:36Z,https://www.youtube.com/watch?v=YN7p0eB2C14,"Discover the power of lemon water in enhancing your immune system! Packed with vitamin C and antioxidants, this delicious drink ...",
"Lemon Water, nimbu pani - Garam Mizaj - #hotdrink #draffanqaiser #expose",ZM7vpsAysfM,IBN-E-TABEEB - Herbal Clinic ( Dawakhana ),2025-01-13T10:00:41Z,https://www.youtube.com/watch?v=ZM7vpsAysfM,Video Disclaimer The content of this video is intended for informational and educational purposes only. The views expressed are ...,
Kickstart Your Day: The Lemon Water Secret! 🍋✨ (Easy + Quick Health Hack) #healthtips #healthy,78oQGQ69yEQ,Sierra Lane Victoria,2025-03-05T23:33:32Z,https://www.youtube.com/watch?v=78oQGQ69yEQ,,
Lemon Water | The BEST Fatburner Drink |Gunjanshouts | weightloss |,QzNuu1ILh4I,Home kitchen easy,2025-02-11T13:30:16Z,https://www.youtube.com/watch?v=QzNuu1ILh4I,Want to lose weight fast and feel great? This lemon water fat burner recipe is just what you need! Not only does it help ...,
"Warm lemon water -#healthydrink,#warm water with a lemon,#motivation,#inspiration,#warmwater",PtvYtWwF2Os,SK,2025-01-10T05:00:18Z,https://www.youtube.com/watch?v=PtvYtWwF2Os,Like &Subscribe @SK25_10 Channel #warmlemonwater #healthydrink #trending #viral #lemondrink #motivation #inspiration.,
Why you should drink Warm Lemon Water #healthylifestyle #shorts #viralvideo #viralshorts,XtuX0G6ofpw,Zoby Zone,2025-02-16T16:00:37Z,https://www.youtube.com/watch?v=XtuX0G6ofpw,,
Why You Should Drink Warm Lemon Water #healthtips,CNsMFneVsqo,Purely Nourished Lifestyle,2025-01-25T02:03:39Z,https://www.youtube.com/watch?v=CNsMFneVsqo,"Are you ready to transform your mornings? In this video, we dive deep into the incredible benefits of drinking warm lemon water ...",
mocktail #lemon water #mojito #cold drink enjoy summer drink,0I6-QDOC-7o,Punjabi Tadka cooking  7006,2025-03-22T10:58:33Z,https://www.youtube.com/watch?v=0I6-QDOC-7o,,
Lemon water Benefits,ekmJ2MzLH_Y,Dietitian Priyanka,2025-03-22T07:04:02Z,https://www.youtube.com/watch?v=ekmJ2MzLH_Y,"Kickstart your day with a refreshing glass of lemon water! It hydrates, boosts energy, supports glowing skin, and promotes ...",
Flush Toxins: Start Your Day with Lemon Water,NDOxuSq5Yz8,Meet Dr. Gyimah,2025-03-12T01:04:25Z,https://www.youtube.com/watch?v=NDOxuSq5Yz8,"Discover how warm lemon water can boost your health by flushing out toxins, reducing bad body and mouth odors. Hydrate ...",
Day start from lemon water #minivlog #hariyanahood #music,yBwPWKpn1ro,Jha ji fitness Vlog,2025-03-24T02:49:48Z,https://www.youtube.com/watch?v=yBwPWKpn1ro,,
I Tried Drinking Lemon Water Every Day for a Month,5OOZtBIlp3A,Keep It Tight Sisters,2025-03-26T03:02:26Z,https://www.youtube.com/watch?v=5OOZtBIlp3A,"Your liver works overnight to gather toxins, and drinking lemon water in the morning helps flush them out naturally. It supports ...",
Lemon water effect on our body.#trendingreels #Mahakumbh2025 #naturalremedies #kumbh #digestion,bjmWS42AeKA,One Minute Show,2025-02-11T02:34:00Z,https://www.youtube.com/watch?v=bjmWS42AeKA,Lemon water effect on our body. नींबू पानी पीने से क्या होगा। #trendingreelsvideo #Mahakumbh2025 ...,
Lemon Water Benefits #video #shorts #facts,WJKHi_mhToI,Preeti Vlogs,2025-01-07T09:46:35Z,https://www.youtube.com/watch?v=WJKHi_mhToI,,
"""Lemon Water: Your Morning Health Elixir""",DOLtABNydQo,Daniel Vasin ,2025-01-08T04:32:34Z,https://www.youtube.com/watch?v=DOLtABNydQo,"""Unlock the secret to a healthier, more vibrant morning with lemon water! Our latest video reveals the incredible benefits of this ...",
Morning Magic: Warm Lemon Water Benefits! #skincare,jL7lg_Tyvq0,Just Relax Now,2025-03-29T00:56:47Z,https://www.youtube.com/watch?v=jL7lg_Tyvq0,Curious about the warm lemon water hype? I drank it every morning for 2 weeks straight and here's what I noticed! This simple ...,
Day 20 Challenge Drinking Lemon Water. #challenge #detox #girl #love #laugh #live #letsplay #healthy,QmW5ULJR_vM,Hangout With Kim,2025-03-02T14:22:46Z,https://www.youtube.com/watch?v=QmW5ULJR_vM,"Hi, I'm Kim Originally from The South Of Vietnam, I am now exploring life in France, and since I have had a chance to live in ...",
#lemon water #break your stonesp,bE6-ML8iuOw,Nutrition Unlocked ,2025-01-15T08:08:20Z,https://www.youtube.com/watch?v=bE6-ML8iuOw,"Lemon water has several benefits for your health. Here are some of the key ones: 1. Hydration: It helps keep you hydrated, ...",
