Title,Video ID,Channel,Published At,URL,Description,Video Length,Views,Likes,Comments
Carnivore Diet 60 day challenge day 3. Follow my journey #carnivorediet #meatheals,iYYqhkucvvA,Living In Tennessee,2025-01-10T06:14:28Z,https://www.youtube.com/watch?v=iYYqhkucvvA,,39,518,7,0
Can You Believe This Carnivore Diet,x0V0mM0nQxg,Big Man Alaska,2025-01-24T02:57:32Z,https://www.youtube.com/watch?v=x0V0mM0nQxg,I'm Big John and started my weight loss journey in May of 2023 with a process of fasting practices that gave me some fantastic ...,58,500,117,23
Day 30 of 100 miles 100 days on the #carnivorediet  #carnivorejourney #carnivore #weightloss #run,6MzjcnBIrTY,Coach Crim,2025-01-16T00:39:19Z,https://www.youtube.com/watch?v=6MzjcnBIrTY,,40,501,25,1
DAY - 11 PORKIVORE - EGGS - KETOVORE - CARNIVORE #diet #food #carnivorediet #cooking,dMEGn4oY0_s,EXTINCTNATTY,2025-01-12T04:24:27Z,https://www.youtube.com/watch?v=dMEGn4oY0_s,,5,514,0,3
Day 29 Carnivore Diet: Beef & Eggs for the Win! 🥩🥚🔥” #carnivorediet #carnivore #beef&eggs,-dTRVrI-OyI,Jeremy Rexx Reid,2025-01-31T03:00:22Z,https://www.youtube.com/watch?v=-dTRVrI-OyI,"29 days in, and the carnivore diet keeps delivering! My go-to meal? Beef and eggs—simple, delicious, and packed with ...",9,491,12,7
Day 63 on the CARNIVORE DIET 🥓🍖🥩,jxkZhTOVhnQ,Alex Murphy,2025-03-08T19:39:36Z,https://www.youtube.com/watch?v=jxkZhTOVhnQ,carnivore #diet #carnivorediet #mukbang.,199,498,21,3
How I Stop Snacking on The Carnivore Diet,43uUbSmt474,Big Man Alaska,2025-01-29T04:30:33Z,https://www.youtube.com/watch?v=43uUbSmt474,Kershaw 12 inch fillet knife: https://amzn.to/3PNjes6 I'm Big John and started my weight loss journey in May of 2023 with a ...,35,583,82,12
What are some other mistakes we should avoid in the Carnivore Diet? 🥩,41fI4GAPLvo,Jordi,2025-01-26T02:00:03Z,https://www.youtube.com/watch?v=41fI4GAPLvo,"If you're feeling run down, have headaches or not seeing the results you want on the Carnivore Diet then hear this. You could be ...",52,478,19,2
Breaking the fast w/ the🐶 #food #diet #nutrition #animalbased #carnivore #carnivorediet #wholefoods,znnoBLUCmtE,Carter Lucido,2025-01-20T18:03:09Z,https://www.youtube.com/watch?v=znnoBLUCmtE,,27,472,9,0
Carnivore day 6 #carnivore #diet #healthy #weightloss #meal #turkey #egg,QWMdmsLXEa4,Trucker Tom,2025-01-06T19:58:10Z,https://www.youtube.com/watch?v=QWMdmsLXEa4,,8,474,14,0
DAY 3/30 CARNIVORE DIET/ DEADLIFTS #shorts #deadlift #carnivorediet #diet #nutrition #cutweight,kN9hEXJpAhY,Sean Fitzpatrick,2025-01-08T20:28:21Z,https://www.youtube.com/watch?v=kN9hEXJpAhY,,60,472,9,0
DAY 28 CARNIVORE - ALMOST DONE - LITERALLY BACON EGGS AND SAUSAGE - #CARNIVORE #DIET #CALORIES,o0zger2Psf4,EXTINCTNATTY,2025-01-28T17:15:31Z,https://www.youtube.com/watch?v=o0zger2Psf4,,15,500,12,0
AIR FRYER IS AMAZING!!! #carnivore #diet #airfryer #viralvideo #shorts,TyPBCsYy0vU,Jordan Melby Vlogs,2025-01-04T06:38:16Z,https://www.youtube.com/watch?v=TyPBCsYy0vU,,22,,,
Carnivore Diet Lifestyle Day 7,RXPgQ6ePXLs,Jonpaul Baran,2025-01-02T09:28:13Z,https://www.youtube.com/watch?v=RXPgQ6ePXLs,You can't go wrong with eating 2x T-bone steaks in the day. #carnivore #carnivorediet #animalbased #food #diet #weightloss !,56,461,11,4
Day 23 #carnivore #diet #keto #food #pancakes #cooking #sausage #recipe #nocarbs #fyp #foryou,rghGBOK4680,Kelly Kim,2025-01-24T22:24:32Z,https://www.youtube.com/watch?v=rghGBOK4680,,52,496,19,5
Day 6 Carnivore Diet Dinner 🥩🍳 #carnivorejourney #carnivorediet #weightloss #carnivore #meateater,w1tH3p8JG1I,Lalos Gets Fit 💪🏽,2025-01-13T01:20:58Z,https://www.youtube.com/watch?v=w1tH3p8JG1I,,9,465,16,0
Day 18 lunch carnivore diet #fypage #carnivore #fypシ゚ #diet #fypyoutube #carnivorediet #fyp,2lUZ_YmoAg4,Carnivorous Pickleballer,2025-02-14T18:12:37Z,https://www.youtube.com/watch?v=2lUZ_YmoAg4,,36,457,10,0
My Lunch after a gym workout #pov #lunch #carnivore #diet #meta #metarayban #GymLife #getfit,vYtfBEFfMPI,Cez Visuals ,2025-03-08T18:36:24Z,https://www.youtube.com/watch?v=vYtfBEFfMPI,,60,457,9,0
What I Bought On The Carnivore Diet,hNDSvbLmOeM,Big Man Alaska,2025-02-01T23:15:18Z,https://www.youtube.com/watch?v=hNDSvbLmOeM,Kershaw 12 inch fillet knife: https://amzn.to/3PNjes6 I'm Big John and started my weight loss journey in May of 2023 with a ...,63,484,52,5
7.2lbs lighter in Nashville-Carnivore Diet 🌟🥩,rRNRTkLWTm8,Ro Selvey,2025-02-23T20:00:27Z,https://www.youtube.com/watch?v=rRNRTkLWTm8,Join me on this exciting Nashville adventure as we embrace the carnivore diet! #CarnivoreDiet #NashvilleAdventures ...,31,452,8,6
Carnivore diet shopping! #shipping #keto #carnivore,2eGKoGGcYRc,Mary Healthy lifestyle,2025-01-27T00:10:31Z,https://www.youtube.com/watch?v=2eGKoGGcYRc,,49,486,5,0
Carnivore Diet Made Me Sing Again #carnivore #carnivorediet #properhumandiet,UyddEvYzGSs,Norse Carnivore,2025-03-03T17:39:01Z,https://www.youtube.com/watch?v=UyddEvYzGSs,CHALLENGE TO MYSELF: Get more comfortable with singing in front of others! You're the lucky ones who get to be my audience.,33,461,0,0
How I Reversed Autoimmune Issues with the Carnivore Diet,eXvyPXMrj28,Phil Escott,2025-01-18T13:48:42Z,https://www.youtube.com/watch?v=eXvyPXMrj28,"https://philescott.substack.com All other links including personal consultations, The Big Fat Challenge, online courses, books, Red ...",60,502,62,6
Carnivore Diet? #carnivore #carnivorediet #nutrition #nutritionfacts,XT-fyHsH7mo,Catch Ups In My Kitchen,2025-01-25T09:00:38Z,https://www.youtube.com/watch?v=XT-fyHsH7mo,Thoughts on the carnivore diet? #diet #healthandwellness #eating.,35,449,7,0
Meat and Bacon meatballs. #carnivorediet #carnivore #omad #omaddiet #healthy #diabetes,17y8LBfnmpU,Jeremy Rexx Reid,2025-01-15T13:15:43Z,https://www.youtube.com/watch?v=17y8LBfnmpU,,17,454,4,0
Day 1 of Carnivore Diet #healthylifestyle #diet#holistichealth#healthyeating#carnivore#foodie#growth,Z5OKXfIoa5o,Raining Zi,2025-02-03T18:54:01Z,https://www.youtube.com/watch?v=Z5OKXfIoa5o,,31,442,14,7
Tonight's Carnivore Diet Meal,e6aNSpp13kg,Big Man Alaska,2025-01-31T02:58:19Z,https://www.youtube.com/watch?v=e6aNSpp13kg,Kershaw 12 inch fillet knife: https://amzn.to/3PNjes6 I'm Big John and started my weight loss journey in May of 2023 with a ...,58,457,61,16
Carnivore Diet: Unlock Your Muscle Gains!,f3gwRXoREPU,Transform Fit,2025-02-17T23:00:28Z,https://www.youtube.com/watch?v=f3gwRXoREPU,"Ever wonder why you're not gaining muscle? In this video, we dive into the carnivore diet and explore its benefits—like high ...",41,446,14,0
DAY 22 CARNIVORE DIET DINNER #fypage #food #carnivore #carnivorediet #fypシ゚ #fyp #weightlossjourney,ybMvgFpseUM,Carnivorous Pickleballer,2025-02-19T20:36:03Z,https://www.youtube.com/watch?v=ybMvgFpseUM,,16,437,17,0
Day 38 Carnivore Diet Weekly Shop Cost,_ccbq6deCiw,Jordi,2025-01-09T05:00:23Z,https://www.youtube.com/watch?v=_ccbq6deCiw,"Wondering how much it costs 1 week on the carnivore diet? Wonder no more! This was for two people on the carnivore diet, ...",24,437,3,2
Carnivore Diet,sUlvpB5FdQs,Jon Begue Peak Performance Collective!,2025-01-09T18:14:09Z,https://www.youtube.com/watch?v=sUlvpB5FdQs,"Can you survive—and thrive—on a diet of only meat, fish, and animal products? The Carnivore Diet is one of today's most ...",53,432,13,0
Carnivore Diet Day 47- Chicken Thighs #food #weightloss #carnivorediet #carnivore #dietplan #dieting,4B-3IqfTFXk,Eddie_Gets_Fit,2025-02-16T23:57:23Z,https://www.youtube.com/watch?v=4B-3IqfTFXk,,16,467,8,0
Consistency is key on the carnivore diet #carnivore #carnivorediet,fNyM-AEzXQ4,Papa Foody ,2025-01-19T17:44:26Z,https://www.youtube.com/watch?v=fNyM-AEzXQ4,,52,435,14,2
Is The Carnivore Diet a Passing Fad?,suCH56KoOgI,Norse Carnivore,2025-03-08T20:08:18Z,https://www.youtube.com/watch?v=suCH56KoOgI,"Is the carnivore diet just a passing fad? Watch me blast this argument out of existence, using my meat-powered brain! Did you ...",20,,,
DAY 6/30 CARNIVORE DIET| 23 HR FAST| #shorts #carnivorediet #food #ketodiet #diet #cooking,w5svPoBfpcs,Sean Fitzpatrick,2025-01-11T22:50:36Z,https://www.youtube.com/watch?v=w5svPoBfpcs,DAY 6/30.,15,431,10,4
Carnivore diet in five slides #carnivore #usashorts #carnivorediet,sa8arc0qVco,Emily ,2025-01-23T17:09:24Z,https://www.youtube.com/watch?v=sa8arc0qVco,,35,429,11,0
Day 9 of the #CarnivoreDiet & I’m Down 9.3lbs ⬇️ #weightloss #carnivore #weightlossjourney #diet,RIGZ5YJz2-M,Lalos Gets Fit 💪🏽,2025-01-15T22:54:43Z,https://www.youtube.com/watch?v=RIGZ5YJz2-M,,45,423,21,0
Exploring the Carnivore Diet Pros & Cons #discovery #subscribe #like #suggestion#carnivore  #diet,Y-ZEhBjElwY,Mhortshorts,2025-01-07T15:00:43Z,https://www.youtube.com/watch?v=Y-ZEhBjElwY,Subscribe for more videos! Exploring the Carnivore Diet Pros & Cons #discovery #subscribe #like #suggestion#carnivore #diet.,39,420,6,2
Carnivore diet fact vs fiction #carnivorediet #carnivore #porkbelly #budgetmeals  #weightloss,Q9rImltLWEU,RibeyeRevolution,2025-02-26T03:56:58Z,https://www.youtube.com/watch?v=Q9rImltLWEU,,45,,,
Day 29 carnivore diet dinner #carnivorediet #carnivores #weightlossdiet #weightloss #fyp #fypage,ugB7F6vt39U,Carnivorous Pickleballer,2025-02-26T02:52:22Z,https://www.youtube.com/watch?v=ugB7F6vt39U,,18,,,
It‘s like this 24/7 #carnivore #diet #meat #eggs #strength,QrBhFdn0cp8,Healthinsight,2025-02-15T22:05:55Z,https://www.youtube.com/watch?v=QrBhFdn0cp8,,12,415,11,0
Tuna Patties and Turkey bacon Sandwich. #carnivore #carnivorediet #carnivorerecipes #type2diabetes,vygqp5Ql-uw,The Carnivore Rexx,2025-03-28T12:37:23Z,https://www.youtube.com/watch?v=vygqp5Ql-uw,,45,424,6,0
Chickens in- time for dinner!              # CARNIVORE DIET,CwAdNgdsHRo,Tom Gibertson,2025-02-14T04:57:17Z,https://www.youtube.com/watch?v=CwAdNgdsHRo,"Had this tonight & last nite, sirloin for late lunch, bacon & farm fresh eggs this morning Ez & Delicious but not only that there's so ...",56,,,
Gaining Weight on Carnivore Diet?,trm2wfVUJDU,Marcus Sidhu (N1Fitness),2025-03-05T14:30:17Z,https://www.youtube.com/watch?v=trm2wfVUJDU,COACHING - http://www.n1fitness.com/coaching INSTAGRAM - https://www.instagram.com/n1fitness/ TIKTOK ...,177,,,
"Health 360 With Sneha Mordani: Carnivore Diet, Social Media Trend Raises Health Concerns",RPyXewKx8kc,India Today,2025-01-04T08:00:18Z,https://www.youtube.com/watch?v=RPyXewKx8kc,"The carnivore diet, a trend popularised by social media influencers, consists solely of animal products. While proponents claim ...",160,,,
"The Carnivore Diet with Anthony Chaffee, MD",T_N8WU5snu8,Karl Sterling,2025-03-18T04:40:27Z,https://www.youtube.com/watch?v=T_N8WU5snu8,Dr. Anthony Chaffee talks about benefits of the Carnivore Diet.,49,1272,41,1
Are You Doing the Carnivore Diet Wrong? 🥩,kQQE_Ny7Yn0,Michael Kummer,2025-01-22T21:42:55Z,https://www.youtube.com/watch?v=kQQE_Ny7Yn0,,47,,,
Caveman day4 #carnivorediet #diet #whatieatinaday #uk #wieiad #meatlovers #carnivore #foodtube #eat,Sfl7dLXrhmU,Ellis Maton,2025-02-28T15:45:09Z,https://www.youtube.com/watch?v=Sfl7dLXrhmU,,40,392,7,0
Carnivore Diet Dinner,9FjKLJHcTNU,Big Man Alaska,2025-01-13T02:55:37Z,https://www.youtube.com/watch?v=9FjKLJHcTNU,I'm Big John and started my weight loss journey in May of 2023 with a process of fasting practices that gave me some fantastic ...,51,,,
Why I Follow a Carnivore Diet,-LBBS6ffgKc,Marcus Sidhu (N1Fitness),2025-02-05T00:00:58Z,https://www.youtube.com/watch?v=-LBBS6ffgKc,COACHING - http://www.n1fitness.com/coaching INSTAGRAM - https://www.instagram.com/n1fitness/ TIKTOK ...,48,,,
Carnivore Diet! #carnivore #beef #carnivorediet #meat #meatlovers,pUM-kJYyE9w,Naomi Living Naturally,2025-02-10T15:31:59Z,https://www.youtube.com/watch?v=pUM-kJYyE9w,,31,,,
7 Day Of Carnivore Diet,N9HTj3pe8jI,MeatPowered,2025-01-19T01:55:05Z,https://www.youtube.com/watch?v=N9HTj3pe8jI,,46,493,0,0
Air fryer carnivore! #carnivore #carnivorediet #committedcarnivore #airfryer,Uj2Pu-MUKGU,Committed Carnivore,2025-03-31T20:24:30Z,https://www.youtube.com/watch?v=Uj2Pu-MUKGU,,20,1520,7,0
What Oil To Cook With? Day 14 Of The Carnivore Diet! Butter? Tallow? Ghee? Olive Oil? Coconut Oil?,tCgpNQZhhy4,MeatPowered,2025-01-26T20:22:14Z,https://www.youtube.com/watch?v=tCgpNQZhhy4,,57,,,
The truth about how the carnivore diet affects your gut microbiome,WDRtJA0lZT0,Carrie Drinkwine,2025-02-26T14:41:41Z,https://www.youtube.com/watch?v=WDRtJA0lZT0,The truth about how the carnivore diet affects your gut microbiome and why fiber is essential for long-term digestive health.,69,421,10,4
My Carnivore Diet,WHvCs9cNNgw,Big Man Alaska,2025-01-23T02:43:43Z,https://www.youtube.com/watch?v=WHvCs9cNNgw,I'm Big John and started my weight loss journey in May of 2023 with a process of fasting practices that gave me some fantastic ...,42,,,
There is NOTHING normal about the Carnivore Diet,AxMXqlZ5h_E,Carnivore Cutie - Phumi,2025-03-17T05:15:01Z,https://www.youtube.com/watch?v=AxMXqlZ5h_E,,43,,,
"Carnivore Diet Chaffles and Burgers, #carnivore #carnivorediet #chaffles",i3A_KPa-yuk,Chew On This,2025-02-05T12:37:22Z,https://www.youtube.com/watch?v=i3A_KPa-yuk,Carnivore diet weight loss. Discover how to make easy carnivore chaffles with just a few simple ingredients! Perfect for anyone ...,,,,
Tonight's Carnivore Diet Meal,4d3ntXO9xR0,Big Man Alaska,2025-01-21T02:19:51Z,https://www.youtube.com/watch?v=4d3ntXO9xR0,I'm Big John and started my weight loss journey in May of 2023 with a process of fasting practices that gave me some fantastic ...,33,,,
What I eat a day on the carnivore diet #carnivorediet #carnivore #lowcarbdiet #gastricsurgery,ZdHq_VIf60s,LeahGenae,2025-01-21T21:30:12Z,https://www.youtube.com/watch?v=ZdHq_VIf60s,191 days of and I'm still thriving! I don't track macros.,41,331,12,2
Join our Carnivore Reset Challenge! Carnivore Diet,ZKeRAe71vZM,Ro Selvey,2025-02-21T20:00:31Z,https://www.youtube.com/watch?v=ZKeRAe71vZM,Join our supportive community and embark on a weight loss journey! We're approaching our one-year milestone and starting ...,35,323,14,2
Finding snacks on the go for the carnivore diet. #carnivore #carnivorediet #reversingtype2diabetes,vt5_81SmQgE,The Carnivore Rexx,2025-03-10T12:06:21Z,https://www.youtube.com/watch?v=vt5_81SmQgE,,11,,,
Day 16 Of The Carnivore Diet — Can I Eat Protein Powder On The Carnivore Diet?,uK9NH3wWaE4,MeatPowered,2025-01-28T21:49:52Z,https://www.youtube.com/watch?v=uK9NH3wWaE4,,50,461,0,0
Day 38 #carnivorediet this is #lunch 🍳 #carnivorejourney #food #carnivore,cHtxCUt1w6c,Coach Crim,2025-01-12T21:45:48Z,https://www.youtube.com/watch?v=cHtxCUt1w6c,,58,,,
Carnivore Diet vs. Keto Diet #diet #diettips #dietplan #weightlosstips,YkG6wDvDM80,BioDesign Men's Clinic,2025-02-25T15:00:50Z,https://www.youtube.com/watch?v=YkG6wDvDM80,Not sure which diet is right for you? Let's dive into two popular diets- Keto vs. Carnivore  ⬇️ Both diets serve different ...,41,,,
Do it Anyway!!!! #pov #gym #motivation #gymtok #carnivore #diet #disipline,O70XzsVZUrw,Cez Visuals ,2025-03-10T20:02:31Z,https://www.youtube.com/watch?v=O70XzsVZUrw,,15,,,
Day 20 Of The Carnivore Diet — Electrolytes??? What Do I Need?,1-9hIBOf9Kc,MeatPowered,2025-02-01T21:37:06Z,https://www.youtube.com/watch?v=1-9hIBOf9Kc,,52,,,
Carnivore Diet Month 2 Day 8 #weightloss #food #carnivorejourney #carnivorediet #carnivore #diet,DE5XK7Z66w4,Eddie_Gets_Fit,2025-02-09T00:24:56Z,https://www.youtube.com/watch?v=DE5XK7Z66w4,,19,,,
Can You Eat Honey on a Carnivore Diet?,pd4K6oGXZgE,Carnivore Style,2025-03-17T07:05:40Z,https://www.youtube.com/watch?v=pd4K6oGXZgE,"Can you eat honey on a carnivore diet—or is it a sugar-loaded mistake? Some say it is nature's perfect fuel, while others claim it ...",108,1434,8,0
Day 26 of The Carnivore Diet - Can KIDS Do It???,yFOuivzia_8,MeatPowered,2025-02-06T19:15:09Z,https://www.youtube.com/watch?v=yFOuivzia_8,,53,,,
✨One year ago I decided to try the carnivore diet #health #food  #carnivore #mentalhealth #life,-E2PYRJ0GQM,Kyndall’s Carnivore Channel,2025-03-25T15:25:37Z,https://www.youtube.com/watch?v=-E2PYRJ0GQM,One year on the CARNIVORE DIET   Happy CARniversary to me ♥️ I cannot believe how much my life has changed over the ...,24,,,
Carnivore Diet Myths Busted: What You Need to Know!,lUs2YWUqEsA,MzFlex4Real,2025-02-15T04:01:15Z,https://www.youtube.com/watch?v=lUs2YWUqEsA,"In this eye-opening video, we bust the top 8 myths surrounding the Carnivore Diet! Join us as we dissect common misconceptions ...",161,,,
Weight Loss Made Simple #healthy #carnivorediet,mxgJWMR5s58,Big Man Alaska,2025-03-19T17:18:48Z,https://www.youtube.com/watch?v=mxgJWMR5s58,Join the Carnivore community: Share your favorite carnivore diet recipes and shopping finds in the comments below! My new ...,58,,,
Day 19 Of Carnivore - What Can I Drink On The Carnivore Diet?,PaXx5EjTR2E,MeatPowered,2025-02-01T00:10:59Z,https://www.youtube.com/watch?v=PaXx5EjTR2E,,57,316,0,0
Day 4 of Carnivore Diet #healthylifestyle#holistichealth#healthyeating#gym #foodie#growth#carnivore,6rNQG2xilGE,Raining Zi,2025-02-08T19:52:27Z,https://www.youtube.com/watch?v=6rNQG2xilGE,,17,,,
Who else is on the carnivore diet?? #carnivore #diet #health #fitness #help #advice,Cj4yIAx8Cgg,Culper Outdoors,2025-01-28T18:39:59Z,https://www.youtube.com/watch?v=Cj4yIAx8Cgg,,21,,,
Day 37 #carnivorediet this is a check in #carnivorejourney #carnivore #weightloss,yYukszzlCKA,Coach Crim,2025-01-11T19:49:06Z,https://www.youtube.com/watch?v=yYukszzlCKA,,57,,,
Carnivore Diet & Fruit,De8q6cgUW7I,"Oh, The Things We'll Make!",2025-03-11T22:00:09Z,https://www.youtube.com/watch?v=De8q6cgUW7I,"Fruit on a carnivore diet? Some, like Dr. Paul Saladino, say fruit wants to be eaten, while leaves, stems & seeds are loaded with ...",70,,,
5’ carnivore lunch! Delicious every time. #carnivore #carnivorediet #keto #ketodiet #healthyeating,Ln7FpCnGhdg,Vida Goes Carnivore,2025-02-11T10:26:11Z,https://www.youtube.com/watch?v=Ln7FpCnGhdg,,47,,,
🥩 How the Carnivore Diet Transforms Health!,lnJB2f_iUNI,Dr. Jess Bilger,2025-03-16T11:01:59Z,https://www.youtube.com/watch?v=lnJB2f_iUNI,"The Carnivore Diet is helping people heal from autoimmune diseases, gut issues, and metabolic disorders. From PCOS and ...",54,,,
Weight loss nightmare! Carnivore Diet,Sae7_sOCmbY,Ro Selvey,2025-03-19T20:00:12Z,https://www.youtube.com/watch?v=Sae7_sOCmbY,Witness my emotional journey as I confront unexpected weight gain and the challenges of maintaining my fitness goals. Follow my ...,35,,,
Day 4 - Carnivore Diet! (Meal plans and guides on our website),9dG_HOA50fA,MeatPowered,2025-01-17T04:04:50Z,https://www.youtube.com/watch?v=9dG_HOA50fA,,58,,,
"A ""Proper Human Diet"" is carnivore-centric, but not necessarily *strict* #carnivore - #carnivorediet",e8GR7l8YfSE,Carnivore Talk,2025-03-06T20:13:16Z,https://www.youtube.com/watch?v=e8GR7l8YfSE,My philosophy is in harmony with Dr. Ken Berry's PHD (Proper Human Diet) spectrum. Where depending on your DNA you could ...,45,,,
How Carnivore Diet Can Make Leaky Gut WORSE if you do this.,Tt4ziQrmSK4,Heal Your Gut Guy,2025-03-08T17:04:30Z,https://www.youtube.com/watch?v=Tt4ziQrmSK4,Get 1st Day of My 13-Day Protocol For FREE: https://www.healyourgutguy.com/get-free-1st-day-13-day-protocol How Carnivore ...,57,,,
CARNIVORE DIET! Breaking My Fast: Liver & Sardines!,oLsd_-xDGpY,JusJrdn,2025-01-03T01:55:25Z,https://www.youtube.com/watch?v=oLsd_-xDGpY,Carnivore Diet: 4lbs Weight Loss in 8 HOURS! https://youtu.be/sQ3FPWn1JCE #Weightloss #diet #Fasting #Carnivore ...,38,235,10,0
The Anti-Aging effects of Carnivore diet & Breath work,sqDIOOAXvDA,DC Rebuilding,2025-03-31T03:37:31Z,https://www.youtube.com/watch?v=sqDIOOAXvDA,"Could breath work and the carnivore diet be the secret to staying youthful? In this video, we explore how deep breathing boosts ...",217,,,
Day 5 - Carnivore Diet!!! Yesss,c59WWgWpWdk,MeatPowered,2025-01-17T20:50:36Z,https://www.youtube.com/watch?v=c59WWgWpWdk,,50,251,0,1
Carnivore! Is it a DIET? or a LIFESTYLE?  #carnivore #carnivorediet #carnivorelifestyle #diet,e7xGV5cSHm8,Carnivore Talk,2025-02-19T20:10:39Z,https://www.youtube.com/watch?v=e7xGV5cSHm8,"We talked about the carnivore lifestyle, or carnivore way of eating. I try to be careful how I use the word diet, because I don't like ...",35,,,
#godisgood#week1#carnivorediet#carnivore#diet#weightloss#motivation#weightlossjourney#fyp#fy#,yewoTKjE1q0,Johan Team carnivore ,2025-01-16T21:08:54Z,https://www.youtube.com/watch?v=yewoTKjE1q0,,64,,,
Carnivore diet! #yogurtlover #carnivore #carnivorediet #food,EkwPygUW8U0,Kid Carnivore,2025-02-20T06:33:54Z,https://www.youtube.com/watch?v=EkwPygUW8U0,"Love yogurt and living in phuket? Try Dee yogurt today free delivery all over the island, all natural, no sugar added homemade ...",48,,,
Meal Prepping on Carnivore Diet so Simple,k7Ie6fPGrqs, Broken Carnivore ,2025-02-14T11:38:34Z,https://www.youtube.com/watch?v=k7Ie6fPGrqs,carnivore #carnivorediet ##carnivorelife Think is so complicated to meal prep on the carnivore diet. Here is a simple meal prep I ...,41,,,
Unlock Your Health:  Overcoming Insulin Resistance with Carnivore Diet,pBGcs_1Z3GQ, Carnivore Coach Lisa Pickart,2025-03-31T17:08:28Z,https://www.youtube.com/watch?v=pBGcs_1Z3GQ,mahadevstatus #mahakal #mahadev #LiveWithoutRegret #WomenEmpowerment #LifeBack #Transformation #CoachLisa ...,27,,,
Exploring the Carnivore Diet: Heart Health Uncovered,X-5rKi8d2TY,Functionised,2025-01-23T23:07:27Z,https://www.youtube.com/watch?v=X-5rKi8d2TY,Discover how the carnivore diet is revolutionizing heart health! New research reveals its potential to combat heart disease and ...,41,,,
Part 1 of Reasons to try the Carnivore Diet! #carnivorediet #carnivore #health,1qr9GO-Zs6c,Mission Carnivore,2025-02-24T15:00:03Z,https://www.youtube.com/watch?v=1qr9GO-Zs6c,Thanks for watching! Check out our website: www.realmissionketo.com Instagram: @missioncarnivore.,61,,,
Day 2 #carnivore #diet #food #breakfast #journey #2025,g9JSc2Myu3w,Kelly Kim,2025-01-03T15:33:47Z,https://www.youtube.com/watch?v=g9JSc2Myu3w,,16,,,
Carnivore Diet day 50 McDonalds— #food #weightloss #carnivorediet #dietplan #diet #carnivore,LrMv5XX_ANo,Eddie_Gets_Fit,2025-02-20T00:05:13Z,https://www.youtube.com/watch?v=LrMv5XX_ANo,,16,,,
Day 1 on my carnivore diet #carnivore #diet #newyear #food #journey #2025,QzfpgqbgtCA,Kelly Kim,2025-01-02T18:29:15Z,https://www.youtube.com/watch?v=QzfpgqbgtCA,,60,,,
Day 30 #carnivore #diet #keto #fyp #foryou #shorts #food #spam #eggs #recipe #explorepage #카니보어,4oPKaAezzuM,Kelly Kim,2025-02-03T22:30:03Z,https://www.youtube.com/watch?v=4oPKaAezzuM,,23,,,
Get it! 💪🏻 #carnivorediet #healthyeating #carnivore #wellnessjourney #meatheals,K2pMTEgj6ZQ,Carnivore Granny,2025-03-23T13:37:09Z,https://www.youtube.com/watch?v=K2pMTEgj6ZQ,,46,,,
Carnivore Diet. Celebrating World Carnivore Month! January 2025. #carnivore #carnivorediet #shorts,HKA3Fjjkp2g,Carnivore Strong Mom,2025-01-02T05:48:52Z,https://www.youtube.com/watch?v=HKA3Fjjkp2g,Carnivore Diet. Celebrating World Carnivore Month! January 2025. The Carnivore Diet has changed my life. I'm 641 Days eating ...,12,,,
