Title,Video ID,Channel,Published At,URL,Description,Video Length,Views,Likes,Comments
#sweating #health #nutrition #mint #apples #bananas #balancednutrition #NADplus #temperaturecontrol,xAiUM8KtGek,JackieNambus,2025-01-27T22:30:15Z,https://www.youtube.com/watch?v=xAiUM8KtGek,,21,,,
Marrowlife 100c/o Balanced nutrition product,fegiGnpBTyI,AB King biotech,2025-01-27T12:38:24Z,https://www.youtube.com/watch?v=fegiGnpBTyI,,52,27,13,1
Homemade Cat Food Recipes: A Beginner's Guide to Balanced Nutrition,vngLUTiTyqg,The Pet Product Guru,2025-01-25T17:21:59Z,https://www.youtube.com/watch?v=vngLUTiTyqg,Free Assets & Community➜ https://tinyurl.com/atiatayia1 ...,153,12,0,0
"Fuel your body, feed your soul! 🍎🌱 Balanced nutrition is the key to a healthier, happier you.""",cWPfG1ax4rM,Health and fitness ,2025-01-25T14:14:43Z,https://www.youtube.com/watch?v=cWPfG1ax4rM,,58,1,0,0
"""Healthy habits, balanced nutrition, and Herbalife: the trio for success."" #nutrition #herbal",SaCcPI7eaok,Herbal life educator,2025-01-25T00:03:09Z,https://www.youtube.com/watch?v=SaCcPI7eaok,,31,5,2,0
Supplements and Balanced Nutrition | Food City® Dietitian's Tips,EBis7m3pQq0,Food City®,2025-01-24T05:00:23Z,https://www.youtube.com/watch?v=EBis7m3pQq0,Taking time to evaluate health and wellness status is a great way to start the new year. One key consideration is aiming to eat a ...,207,101,3,0
Balanced Nutrition,7Di_JloinJU,Anthony Whitelaw,2025-01-23T16:35:42Z,https://www.youtube.com/watch?v=7Di_JloinJU,,11,72,0,0
Complete and Balanced Nutrition from real ingredients! 💡😻👍,DThkDZm96mo,Sniffly Pet,2025-01-21T06:17:37Z,https://www.youtube.com/watch?v=DThkDZm96mo,Complete and Balanced Nutrition from real ingredients! #foryou #fyp #foryoupage #SnifflyMY #kucing #kucingtiktok ...,26,295,9,0
Multivitamins: The Cheat Code for Balanced Nutrition!,6EjL1rdSaz0,Nuu3 Nutrition,2025-01-19T19:00:06Z,https://www.youtube.com/watch?v=6EjL1rdSaz0,"Taking a multivitamin isn't cheating—it's like unlocking a cheat code for balanced nutrition! With essential vitamins and minerals, ...",9,7,0,0
Balanced Nutrition for Fish 🐠 | TetraMin Flakes 🌿,ixz6qAj9sCY,The Pet Product Guru,2025-01-17T11:01:03Z,https://www.youtube.com/watch?v=ixz6qAj9sCY,"Keep your tropical fish thriving with TetraMin Flake Food! This nutritionally balanced formula supports health, color, and vitality ...",21,99,0,0
The basics of balanced nutrition: What does your body really need?#viralvideo #trending #food,GSVzHrWpB2A,Reva Tales,2025-01-15T21:30:01Z,https://www.youtube.com/watch?v=GSVzHrWpB2A,,48,32,13,2
#HbA1c Reduced with 7 kg weight Loss BP controlled with Balanced #Nutrition and Home-made meals only,7jGX86u3yms,Dietitian Priyanka,2025-01-14T15:42:48Z,https://www.youtube.com/watch?v=7jGX86u3yms,"Meet Mr. Rajjapa from Switzerland. When Mr. Rajjapa first approached us, he was nervous and unsure about starting a diet plan ...",69,729,85,0
Life After Gallbladder Removal  #BalancedNutrition #BodyCare #EnergyAndWellness #HealthTips,qkv8ewvCRmw,Lara Baakliny ~ International Keto Expert,2025-01-13T15:18:12Z,https://www.youtube.com/watch?v=qkv8ewvCRmw,,50,515,18,0
Diet & Meditation|Achieve Complete Wellness Through Balanced Nutrition|Sreevarsha R Nutritionist,TX8Rwo5APEQ,sreevarsha nutritionist,2025-01-11T17:31:42Z,https://www.youtube.com/watch?v=TX8Rwo5APEQ,Diet & Meditation|Achieve Complete Wellness Through Balanced Nutrition| Sreevarsha R Nutritionist Condact Details ...,39,9,2,0
Your Guide to Balanced Nutrition – Check Profile! 🍎🌟 #nutritiontips #dietplan #fitnessfood #foodmenu,D04IUJa1Wd8,NutritionNook,2025-01-11T14:00:34Z,https://www.youtube.com/watch?v=D04IUJa1Wd8,Check Profile!,13,0,0,0
Balanced Nutrition for Optimal Brain and Body Performance | Health Thrive,_0tQBY92PqU,Health Thrive,2025-01-10T01:00:24Z,https://www.youtube.com/watch?v=_0tQBY92PqU,Want to boost both your brain and body performance? Learn how balanced nutrition can help you feel your best and achieve your ...,49,6,0,0
Feel Your Best Every Day: Balanced Nutrition & Wellness Tips | Dr. Tahia Tasmin,w652uZWYFhI,DEAR DIET,2025-01-09T04:11:17Z,https://www.youtube.com/watch?v=w652uZWYFhI,"At DEAR DIET, we prioritize your overall well-being by focusing on balanced nutrition and hydration tailored to your unique needs.",78,13,0,0
"Fuel the body with balanced nutrition, keep moving, nourish our mind, and elevate our spirit.",Y5r9WqgxU9c,Lovely Dee,2025-01-05T18:47:58Z,https://www.youtube.com/watch?v=Y5r9WqgxU9c,,4,366,14,0
Vegitarian balanced nutrition food items..#food #nutrition  #viralshort #shorts #shortvideo #,0Kio3R1cnAc,Souji kambala,2025-01-04T10:06:09Z,https://www.youtube.com/watch?v=0Kio3R1cnAc,,20,97,8,0
The Importance of Balanced Nutrition for Seniors,C-CryUN4TFo,Bhcguide City Directory,2025-01-03T22:02:45Z,https://www.youtube.com/watch?v=C-CryUN4TFo,Discover why balanced nutrition is vital for seniors and share your favorite healthy recipes! #shorts #healthyeating #nutrition ...,49,647,111,0
What is Balanced Nutrition? #health #lifestyle,IcVEzT4WfCQ,NutraVibeX,2025-01-03T05:30:48Z,https://www.youtube.com/watch?v=IcVEzT4WfCQ,,44,513,10,3
Importance of a Healthy Diet || Transform Your Life with Balanced Nutrition #shorts,2FHk6YBuNmw,Health clinic ,2025-01-02T13:43:36Z,https://www.youtube.com/watch?v=2FHk6YBuNmw,Importance of a Healthy Diet || Transform Your Life with Balanced Nutrition #shorts Description: Discover the undeniable need for ...,42,280,6,0
"Benefits of nourishing pills: balanced nutrition, good digestion and absorption, not picky eater",SEqK35y16nc,MeoMeo Channel,2025-01-02T12:26:10Z,https://www.youtube.com/watch?v=SEqK35y16nc,"Benefits of nourishing pills: balanced nutrition, good digestion and absorption, not picky eater.",19,,,
Balanced nutrition and consistency are the pillars of true fitness | #gym #newyear2025 #motivation,b1F8CY6_PmI,RiteBite Max Protein TV,2025-01-01T08:49:18Z,https://www.youtube.com/watch?v=b1F8CY6_PmI,"Indian foods are rich in carbohydrates but often lack sufficient protein, which is one of the reasons obesity is so common in our ...",75,37,2,0
BEST FOOD COMBOS... #fitness #studioghibli #ghibli #nutrition #health #food,pE5umvL_CEQ,Vinay Jaisinghani,2025-03-29T13:56:59Z,https://www.youtube.com/watch?v=pE5umvL_CEQ,"nutrition, dark chocolate, vitamin c, oat meal, ghibli image, ghibli trend, chatgpt ghibli trend, healthy food combos, ...",24,139699,5342,37
Create a Balanced Nutrition Plan,cjYBS7Vn3t4,LAM CLINIC,2025-02-03T00:03:55Z,https://www.youtube.com/watch?v=cjYBS7Vn3t4,"Fuel your body the right way! No extreme diets—just balanced, nutrient-packed meals to keep you energized. Plan ahead, stay ...",39,48,5,0
You will ALWAYS eat Balanced after watching this... #fitness #food #nutrition #health #protein,1hc1jcEgdMo,Vinay Jaisinghani,2025-02-28T12:17:16Z,https://www.youtube.com/watch?v=1hc1jcEgdMo,"First things first - Follow me for more simple tips. Now lets talk about how to eat Balanced, ALWAYS ⏺️ Protein :- Worry about ...",18,4138189,159753,291
PediaSure - clinically shown to support faster growth (^1),cZAQQvZ_cHo,PediaSure Australia,2025-01-20T01:08:13Z,https://www.youtube.com/watch?v=cZAQQvZ_cHo,"Did you know that PediaSure is clinically shown to support faster growth (^1) in kids? PediaSure is complete, balanced nutrition, ...",31,1721501,8,0
Balanced Food Pairing | Right way of Plating Meals #fitness #nutrition #food #healthy,mscnucKeEpg,Vinay Jaisinghani,2025-02-14T12:34:33Z,https://www.youtube.com/watch?v=mscnucKeEpg,1. Paneer Sabji with Rice 2. Sautéed Beans and Mushroom for micros and fiber 3. Curd for good gut health and improved ...,18,1311454,51197,63
Nutrition can seem overwhelming sometimes so here is a simple way to structure your meals 🥗🍓,9BBY72CGtXc,Olivia May,2025-02-18T09:10:17Z,https://www.youtube.com/watch?v=9BBY72CGtXc,,11,1639709,48998,373
Diet and Cancer | Dr. Jamal A. Khan #cancer #healthylifestyle #drjamalkhan,Gn_W7CFPJ64,Health Wealth & Lifestyle ,2025-01-15T09:13:34Z,https://www.youtube.com/watch?v=Gn_W7CFPJ64,The Right Diet For Cancer Patients - Debunking Myths Did you know that overly restrictive diets can harm cancer patients rather ...,60,869487,30737,126
Fruits सही खा रहे हो या गलती कर रहे हो?,xaaMfHyws3o,Cardiac Second Opinion,2025-02-17T10:50:19Z,https://www.youtube.com/watch?v=xaaMfHyws3o,"Did you know that drinking fruit juice might not be as healthy as you think? Most people believe that fruit juice = good health, but ...",31,361090,7640,75
The 90/10 Rule: Unlock The Secret To A Balanced Diet 🍎🍫,j2e07NpQdeI,Healthy Emmie,2025-02-10T14:49:45Z,https://www.youtube.com/watch?v=j2e07NpQdeI,,32,184595,13512,105
Comment The Best Protein Bar,Ruy06hncUaw,The Supple Strength,2025-01-10T14:46:02Z,https://www.youtube.com/watch?v=Ruy06hncUaw,"proteinbars #snacks #musclebuilding In this video, we will look at how soy milk is made to get protein from it. Fitness Essentials: ...",55,98947,2753,104
Don't Humans Need A BALANCED DIET?,222IJcgq_fg,KenDBerryMD,2025-03-12T06:00:30Z,https://www.youtube.com/watch?v=222IJcgq_fg,Don't Humans Need A BALANCED DIET?,34,47990,5007,188
A well-balanced plate fuels your body & keeps you full longer. 💪🥗 #diet #fitness #nutrition,PXPkPOXUdCc,FITTR,2025-02-05T12:30:31Z,https://www.youtube.com/watch?v=PXPkPOXUdCc,,11,26475,782,7
"Lala Has A Glass Of Milk After A Meal, Balanced Nutrition And Happy #爱小Monkey #Cute Pet Becomes...",N5XL1k_RZ4c,Yuwen Chenzhou,2025-03-01T19:45:31Z,https://www.youtube.com/watch?v=N5XL1k_RZ4c,,19,23693,0,32
Pariksha Pe Charcha on balanced Nutrition: Food Fueling Mind & Body for Success,VacG5LPFhh0,Narendra Modi,2025-02-13T05:30:21Z,https://www.youtube.com/watch?v=VacG5LPFhh0,"Struggling with exam stress? Don't worry! Nutrition experts Rujuta Diwekar, Foodpharmer (Revant Himatsingka) and Shonali ...",108,21727,1251,82
The Power of Natural Remedies for PCOD | Indian Weight Loss Diet by Richa,IGz2REgnVn0,Indian Weight Loss Diet by Richa,2025-01-04T04:30:08Z,https://www.youtube.com/watch?v=IGz2REgnVn0,The Power of Natural Remedies for PCOD | Indian Weight Loss Diet by Richa Priyanka's incredible journey is proof that natural ...,78,21066,857,4
How Much Should You Eat for Balanced Nutrition? 🧬🥗🍽️,dAVyWq017gc,Ryan Fernando,2025-02-22T11:15:05Z,https://www.youtube.com/watch?v=dAVyWq017gc,"Call or message 9256363925 for a diet plan To get a proper balanced nutritional plan, please fill out this form and my team will ...",63,21342,1167,5
Are you following an extreme approach?#motivation #weightloss #balancednutrition,nfe5nLDjsvo,MyHealthBuddy,2025-02-09T07:45:36Z,https://www.youtube.com/watch?v=nfe5nLDjsvo,,60,16785,826,18
Balanced Diet 🍗 #gym #gymhumor #mealprep #gymbro  #nutrition #protein #funnyshorts #viralvideo,ik0CH_MzXss,Paul Smith,2025-02-07T19:18:30Z,https://www.youtube.com/watch?v=ik0CH_MzXss,,6,3011,42,3
Balanced Lunch box series #nutrition  #healthyfood  #healthyeating  #balancedmeals  #balanceddiet,OfzNCnP-8_o,Learning Lens,2025-03-12T12:45:18Z,https://www.youtube.com/watch?v=OfzNCnP-8_o,"This is a balanced Meal box with Carbohydrates, proteins, healthy fats, and vitamins. It provides long lasting energy and helps to ...",41,2851,48,0
Balanced lunch box series #nutrition #healthyfood #healthyeating #balancedmeal #balanceddiet,0VGZucCzzPg,Learning Lens,2025-03-11T12:27:38Z,https://www.youtube.com/watch?v=0VGZucCzzPg,This Meal offers a great mix of macronutrients and micronutrients. white rice : provides quick energy with easily digestible ...,34,2338,50,0
Advanced Intermittent Fasting – Gut Reset & Anti-Inflammatory Program,xVnuN_OnvlQ,Balance Nutrition,2025-01-13T11:45:45Z,https://www.youtube.com/watch?v=xVnuN_OnvlQ,"The Reform Intermittent Anti-inflammatory Program addresses inflammation using a scientifically-backed approach, researched ...",64,2053,23,1
Balanced LOW CARB protocol in the comments 👇 #keto #nutrition #healthyfood #lowcarb,NfcpPFBqmjE,Anna - Nutritionist in Nikolife,2025-01-07T18:57:53Z,https://www.youtube.com/watch?v=NfcpPFBqmjE,,6,1900,10,1
What I eat in a day consists of balanced nutrition and coffee of course ☕️🧚🏼,1A0KO7GFSHM,Maya🎀,2025-02-01T00:00:05Z,https://www.youtube.com/watch?v=1A0KO7GFSHM,,17,1899,51,1
PM Modi Discusses Balanced Diet & Nutrition With Students At Sunder Nursery | ‘Pariksha Pe Charcha’,lzV0iFLNIaQ,Hindustan Times,2025-02-10T08:00:33Z,https://www.youtube.com/watch?v=lzV0iFLNIaQ,Prime Minister Narendra Modi conducted the eighth edition of 'Pariksha Pe Charcha' at Sunder Nursery in New Delhi. This annual ...,111,1940,33,2
Balanced meal exposed #shortsfeed,LUyF8GsF22M,Healthy With Ravneet Bhalla,2025-01-26T10:40:00Z,https://www.youtube.com/watch?v=LUyF8GsF22M,Balanced meal exposed #shortsfeed.,13,1661,24,2
Ready to feel refreshed and balanced? Check out these Vital Source Feminine Balance Gummies,0a3nflLUcm0,Sandra's Favorite Finds,2025-01-03T03:04:49Z,https://www.youtube.com/watch?v=0a3nflLUcm0,Ready to feel refreshed and balanced? Check out these Vital Source Feminine Balance Gummies. pH Balanced #phbalance ...,21,3275,31,2
a balanced WIEIAD 🫶🏼🍽️ #whatieatinaday #food #foodie #fitness #nutrition #workout #protein,FH9FiPPnL1A,STRONG BY SIM,2025-01-03T06:21:49Z,https://www.youtube.com/watch?v=FH9FiPPnL1A,,45,1259,75,2
Balanced lunch box series #lunchbox #balanceddiet #balancedmeals #nutrition #childrenfood,AHoueK0CYio,Learning Lens,2025-03-13T12:30:15Z,https://www.youtube.com/watch?v=AHoueK0CYio,"this meal box is a Great mix of Carbohydrates , Protein, Healthy Fats, Probiotics and Fiber. Zeera rice provides quick energy ...",37,1247,33,0
"Myfoodie Nutrition Forest has a balanced combination of meat and vegetables, good palatability a",6paAu5rJE6Q,TiMi TV,2025-01-26T23:40:57Z,https://www.youtube.com/watch?v=6paAu5rJE6Q,"Myfoodie Nutrition Forest has a balanced combination of meat and vegetables, good palatability a.",20,1145,14,0
Biotin Laddu 😋fresh batch preparation enhances Balanced nutrition & supplements for Hair Growth 🤩,ttPfICQdqZs,Anbu Magal,2025-01-26T04:00:39Z,https://www.youtube.com/watch?v=ttPfICQdqZs,,36,994,26,0
Dog’s 🦮 Diet Missing These Essentials❓ Balanced Dog Nutrition❗️,fLed-WejvL4,Dogs Your Friends Forever,2025-02-15T16:00:32Z,https://www.youtube.com/watch?v=fLed-WejvL4,,44,905,67,0
Nutrient Spotlight: What Most People Get Wrong About Supplements,CsIaps-Ofsc,Tata 1mg,2025-01-06T15:30:04Z,https://www.youtube.com/watch?v=CsIaps-Ofsc,"Are supplements really the magic solution they claim to be, or is there more to the story? In this video, we explore the truth behind ...",80,895,35,0
balanced diet chart #balanceddiet #diet #shorts #shortsfeed #nutrition #diettips #dieting #food,HF_0wXjap5Q,Medical Biochemistry For Medical Students,2025-01-17T13:01:29Z,https://www.youtube.com/watch?v=HF_0wXjap5Q,balanced diet chart #balanceddiet #diet #shorts #shortsfeed #nutrition #diettips #dieting #food.,7,21298,84,0
Horlicks Strength plus : Balanced Nutrition for Strength #horlicks #amazon #unboxing #flipcart,2ugwjgCk-cw,Sudhir chaurasia,2025-02-05T12:18:05Z,https://www.youtube.com/watch?v=2ugwjgCk-cw,,49,1923,15,0
Lazy Dinner Idea #mealidea #food #nutrition #healthy #balanced #fitness #goals #typeonediabetes,jOF8-mtfk78,Olivia Grace,2025-01-11T12:24:24Z,https://www.youtube.com/watch?v=jOF8-mtfk78,,63,725,36,0
Can’t we just stop scaremongering and eat a balanced diet? #nutrition #food #calories #macros,FQQJPdIeQc8,Tom Routly,2025-02-24T11:49:50Z,https://www.youtube.com/watch?v=FQQJPdIeQc8,,22,692,12,0
Balanced nutrition through a combination of meat and vegetables.❤️❤️❤️ #cat #cute #pets #luckycat,L8Zo-ukWbGI,Lucky🐱,2025-02-28T15:20:52Z,https://www.youtube.com/watch?v=L8Zo-ukWbGI,,13,667,145,11
"#PERSEPHONE Milk black rice bird's nest porridge, Rich and balanced nutrition",Htn19MLy7uo,安娴姐姐一家在美国,2025-03-05T02:46:56Z,https://www.youtube.com/watch?v=Htn19MLy7uo,,20,782,0,3
Top 3 Balanced Meal that people hate but very much helpful in balancing nutirition | Ms Shruthi,sIbk3zf2_G8,Be Well Hospitals,2025-03-29T18:28:20Z,https://www.youtube.com/watch?v=sIbk3zf2_G8,"To book an appointment, call us +91 9698 300 300 or Visit - https://www.bewellhospitals.in/​​ WATCH MORE ON YOUTUBE: ...",58,785,18,0
Healthy Living Starts with a Balanced Diet #Nutrition #Wellness #healhyeatingtips #balanceddiet,92H4IRE8lQA,Healthy Recipes By Yuvaap,2025-02-14T06:00:06Z,https://www.youtube.com/watch?v=92H4IRE8lQA,"Your plate is your health's blueprint—balance it right, and your body will thrive! 🍽️ Here's how you can divide your plate into 4 ...",110,932,52,5
"Myfoodie Nutrition Forest has a balanced combination of meat and vegetables, good palatability a",PnyEKaQ5EQE,TiMi TV,2025-01-02T02:29:30Z,https://www.youtube.com/watch?v=PnyEKaQ5EQE,"Myfoodie Nutrition Forest has a balanced combination of meat and vegetables, good palatability a.",20,549,12,0
"Achieving fitness involves a balanced approach that includes exercise, nutrition & mental well-being",6X4ekqajeK0,WELLNESS ERA  (Dr.Khushpal Arya),2025-01-18T03:56:22Z,https://www.youtube.com/watch?v=6X4ekqajeK0,"Achieving fitness involves a balanced approach that includes exercise, nutrition, and mental well-being. Here's a comprehensive ...",16,569,20,1
"Is Your Training Balanced? Strength, Endurance, Nutrition & Recovery! #healthylifestyle #fitness",52-jaiorCLw,Robin,2025-02-25T08:28:02Z,https://www.youtube.com/watch?v=52-jaiorCLw,,7,568,11,0
The Importance of Balanced Nutrition and Vitamin D Supplementation #VitaminD #Supplementation,7N6zmhXjPvc,Ashlytomy Physio,2025-02-08T13:34:04Z,https://www.youtube.com/watch?v=7N6zmhXjPvc,,76,537,5,0
Balanced plates: a nutrition student’s love language 🥗❤️#nutritioneducation #viral,7BaEqBTQDyY,Semo Nutrition,2025-01-21T22:01:50Z,https://www.youtube.com/watch?v=7BaEqBTQDyY,,8,534,21,1
What does a Balanced Diet Mean for your Doggo | Dog Nutrition Tip | #doghealth #pets,7idupN_RC0U,Pawdify,2025-01-06T02:25:30Z,https://www.youtube.com/watch?v=7idupN_RC0U,,34,549,12,0
Why Balanced Eating Matters #fitness #nutrition #food,cGgUwOUNN24,PT Business Academy,2025-02-21T10:30:17Z,https://www.youtube.com/watch?v=cGgUwOUNN24,It would be nice if we could get along and eat what we wanted.,14,533,15,0
NATURE'S LIQUID GOLD: JUICES THAT REVITALIZE YOUR BODY. #JuiceLife #HealthyLiving #BalancedNutrition,6beMdzdC0Ow,Dorelle Health & Wellness,2025-02-15T02:30:04Z,https://www.youtube.com/watch?v=6beMdzdC0Ow,"DorelleHealthWellness Discover the vibrant world of rejuvenating juices in ""Nature's Liquid Gold: Juices That Revitalize Your ...",42,524,19,2
Myfoodie Nutrition Forest has a balanced combination of meat and vegetables. Picky eaters who do,vRlMg4bscvk,TiMi TV,2025-01-05T23:56:20Z,https://www.youtube.com/watch?v=vRlMg4bscvk,Myfoodie Nutrition Forest has a balanced combination of meat and vegetables. Picky eaters who do.,19,522,13,0
Mastering Nutrition:  Balanced Diet Tips for Athletes #performance,4-xJQWGSunE,Balance Living,2025-01-11T23:45:57Z,https://www.youtube.com/watch?v=4-xJQWGSunE,"Are you an athlete, health enthusiast, or someone managing blood sugar levels looking to optimize your performance and overall ...",50,521,6,1
Balanced Iftar Nutrition #viralshorts,9_wUASGrLwo,Healthybite,2025-03-18T22:02:48Z,https://www.youtube.com/watch?v=9_wUASGrLwo,"Maintain optimal nutrition at Iftar with a well-balanced meal plan for fasting success Watch more videos, to know the power of ...",10,521,0,0
Daily mindful nutrition for balanced living #mindfulnutrition,tLVKvhr-qzA,PantryPlusGadgets,2025-03-30T21:02:39Z,https://www.youtube.com/watch?v=tLVKvhr-qzA,Daily mindful nutrition for balanced living #mindfulnutrition#fok#liftweights.,54,618,18,1
Can Elderberry Help Balance Your Sugar Levels? – Life Extension,MR0d8AEfSDo,Life Extension Wellness,2025-02-05T18:00:27Z,https://www.youtube.com/watch?v=MR0d8AEfSDo,Looking for a simple way to help keep your sugar levels balanced? Elderberry juice might just be what you need. Dr. Mike and Dr.,40,522,7,0
What is a balanced diet? #health #nutrition #weightloss #abs #diet #exercise,olra2jtWu3g,Cerebellum,2025-01-07T12:59:32Z,https://www.youtube.com/watch?v=olra2jtWu3g,,40,508,6,0
Balanced Whole Food Diet✅ #keto #ketodiet #diet #nutrition #explore #explorepage,G1Ycn5mPPdA,Hayden Barnes,2025-01-30T19:52:14Z,https://www.youtube.com/watch?v=G1Ycn5mPPdA,,4,503,4,1
#soakingnuts #wellness #balanced #lifestyle #nutrition #vitamins #tips #coach,FcB5ald-Es8,Neelam Sharma,2025-03-03T02:10:12Z,https://www.youtube.com/watch?v=FcB5ald-Es8,,36,503,3,0
Stick with a well-balanced diet #lefeeds #horsemanship #feed,8_m7hHkMbGk,Lyssy & Eckel,2025-01-30T12:04:22Z,https://www.youtube.com/watch?v=8_m7hHkMbGk,Stick with a well-balanced diet #lefeeds #horsemanship #feed.,20,525,26,0
Healthy Balanced Breakfast 😍 #nutrition#fitness#shorts#weightloss#greekyogurt#highprotein#pbfit,ChMXb_OJZWY,Kapil Patel Fitness,2025-03-01T20:02:33Z,https://www.youtube.com/watch?v=ChMXb_OJZWY,,37,461,7,0
The Perfect Balanced Snack 😋 #nutrition#fitness#weightloss#healthyfood#protein#shorts,hwqIpCTPKtU,Kapil Patel Fitness,2025-02-27T16:43:37Z,https://www.youtube.com/watch?v=hwqIpCTPKtU,,32,463,11,0
Turning instant ramen into a nutritionally balanced meal (Pt I) #nutrition #cooking #healthyeating,ZKBYWe8z_NI,"Hannah Cai, MS, RD",2025-02-17T13:23:53Z,https://www.youtube.com/watch?v=ZKBYWe8z_NI,Like this content? Hannah is a pediatric dietitian who cares about equipping families with knowledge and strategies to support ...,90,459,22,1
Meal Prep Vegan Breakfast Burritos w/ a nutritionist #veganrecipes #balancednutrition #highprotein,Zhda6pCJbBk,georgia broderick,2025-02-17T23:37:30Z,https://www.youtube.com/watch?v=Zhda6pCJbBk,,57,464,19,0
Discover the Secrets to a Balanced Diet! #BalancedDiet #HealthTips #Nutrition,woTc4yC9PpE,Fitness Freak,2025-01-15T14:30:28Z,https://www.youtube.com/watch?v=woTc4yC9PpE,cassey ho cassey ho abs cassey ho stretches cassey ho arms cassey ho workout cassey ho cardio cassey ho arm workout cassey ...,21,,,
"Work hard, stay balanced: fitness & nutrition tips for a stronger you #fitness",Wd6bnAUlf5g,Joe Mill 2025,2025-03-13T18:45:35Z,https://www.youtube.com/watch?v=Wd6bnAUlf5g,"Work hard, stay balanced: your guide to fitness & nutrition #fitness #workout #fitmom #almost40.",6,444,6,0
Strength goals with balanced nutrition #lifting #3mealsaday,mgzKKykeS9o,Joseph Morrow,2025-02-15T03:45:03Z,https://www.youtube.com/watch?v=mgzKKykeS9o,Lifting routine & diet plan: fuel your day with 3 meals #lifting #diet #fok.,14,449,3,2
What I Ate Today as a Latina Nutrition Coach! | Healthy & Balanced Meals,sm0bYprhsZE,lean Latina habits,2025-03-24T01:00:40Z,https://www.youtube.com/watch?v=sm0bYprhsZE,What I Ate Today as a Latina Nutrition Coach! | Healthy & Balanced Meals Learn More : https://linktr.ee/kat_loyatraining Curious ...,9,454,11,0
Fuel your body right with this balanced maintenance meal! #HealthyEating,hpjf4XN9o2o,DanielinMotion,2025-03-23T03:06:11Z,https://www.youtube.com/watch?v=hpjf4XN9o2o,HealthyEating #Macros #MealPrep #FitnessFuel #Nutrition #BalancedMeals #Healthylifestyle #DietTips.,105,441,14,2
Delicious apple nachos for balanced nutrition #applenachos,vhtzT_qvvjc,PantryPlusGadgets,2025-03-20T07:08:26Z,https://www.youtube.com/watch?v=vhtzT_qvvjc,Apple nachos for balanced nutrition & protein #applenachos #balancednutrition #proteiniskey #fok.,69,443,9,0
Best FOODS for Balanced Hormones! #hormonehealth #hormonebalance #nutrition,xqFCpGSkF3g,Grace Functional Nutrition,2025-02-23T17:21:03Z,https://www.youtube.com/watch?v=xqFCpGSkF3g,"These are the BEST foods to help balance your hormones for easier periods, more energy, clearer skin, and a more balanced ...",10,440,8,1
A bad diet and making a decision for change,pymwyHm4vII,Sam Majors,2025-03-21T03:57:05Z,https://www.youtube.com/watch?v=pymwyHm4vII,"""Achieve your ideal weight with practical tips, expert advice, and sustainable strategies. Discover effective workout routines, ...",62,430,12,0
I call it balanced nutrition,5zXCT1h28Vk,Makedonskaya Live,2025-01-27T10:30:02Z,https://www.youtube.com/watch?v=5zXCT1h28Vk,My socials:* Instagram: https://www.instagram.com/amakedonskayaa/?hl=en Tik Tok: ...,9,425,27,1
"Myfoodie Nutrition Forest has a balanced combination of meat and vegetables, good palatability a",WFF3Ot-x81g,TiMi TV,2025-02-13T04:37:54Z,https://www.youtube.com/watch?v=WFF3Ot-x81g,"Myfoodie Nutrition Forest has a balanced combination of meat and vegetables, good palatability a.",6,418,9,0
#hormonebalance #womenshealth #nutritiontips #healthyhormones  #balancednutrition #guthealth,qzVLLBbjs8M,Katya's Healthy,2025-03-31T07:15:02Z,https://www.youtube.com/watch?v=qzVLLBbjs8M,,22,1218,8,0
"Focusing on nutrition, not diets: a journey to balanced health #fok",CF4hIjVzgY0,ThreadedGlam,2025-03-02T00:30:09Z,https://www.youtube.com/watch?v=CF4hIjVzgY0,Focusing on nutrition over dieting #mounjaro #weightloss #pcos #insulinresistance #fok.,52,418,1,0
Example of a balanced diet #fitness #explore #diet #workout #nutrition #gym #2025,uEQ4lmyBPe0,Sweat With Mj ,2025-01-08T14:06:39Z,https://www.youtube.com/watch?v=uEQ4lmyBPe0,,10,414,6,1
#whatieatinaday #nutritionistlife #healthymeals #balancednutrition #healthyeating #mealideas,Ry4oYZWuKus,Jordice about beauty,2025-01-27T18:11:00Z,https://www.youtube.com/watch?v=Ry4oYZWuKus,,41,412,11,0
why this diet is ruining your progress? #UnhealthyFoodRelationship #balancednutrition,unsvsmzKGpc,Alberto Neri,2025-01-13T17:15:05Z,https://www.youtube.com/watch?v=unsvsmzKGpc,Restrictive diets fail: 1. Slow metabolism. 2. Unsustainable. 3. Bad food relationship. Focus on balance. Subscribe for diet tips!,,,,
