Title,Video ID,Channel,Published At,URL,Description,Video Length
✅ Allopathy Vs Homeopathy? #marathipodcast #shortvideo #shrimantstudio,4T1n5k3t_Sc,Shrimant Studio,2025-03-16T06:30:01Z,https://www.youtube.com/watch?v=4T1n5k3t_Sc,,
ALCOHOL HABIT #homeopathy #medicine @HomoeoHealthSolutions8,Jx12MkQ8z5w,Homoeo Health Solutions,2025-02-13T07:43:01Z,https://www.youtube.com/watch?v=Jx12MkQ8z5w,,
Is fatty liver contagious ? Dr P S Tiwari #homeopathy,Zmv-8GT82o4,Dr P S Tiwari (Shorts),2025-02-01T13:30:32Z,https://www.youtube.com/watch?v=Zmv-8GT82o4,Welcome to another video from Dr. P.S Tiwari. Today's video is about Is fatty liver contagious? FOR BOOKING APPOINTMENT ...,
Guess Remedy?? #homeopathy #explore #ytshorts #materiamedica #subscribe,22IvFhW9rb4,Cure Homoeopathy🫧,2025-01-12T06:58:53Z,https://www.youtube.com/watch?v=22IvFhW9rb4,,
Social Anxiety &  Social Phobia - Best Homeopathic Treatment - Dr Muhammad Arshad Awan,INQW0p9rb_0,Awan Homeopathic Center,2025-03-13T07:42:58Z,https://www.youtube.com/watch?v=INQW0p9rb_0,Social Anxiety & Social Phobia - Best Homeopathic Treatment - Dr Muhammad Arshad Awan Social Anxiety & Social Phobia.,
Complications of Perianal Abscess  #homeopathy,8JFRKllH-V8,NiGo Lifeline Homeopathy,2025-02-21T10:05:06Z,https://www.youtube.com/watch?v=8JFRKllH-V8,Complications of Perianal Abscess.,
Pain in Stomach #homeopathy #medicine #shorts,b081maVqPgk,Dr warsi homeopathy,2025-02-21T09:28:02Z,https://www.youtube.com/watch?v=b081maVqPgk,Homoeopathic medicine for indigestion l Abies Nigra.,
Burn Homeopathic Medicine | Kali Muriaticum 6x Benefits #shorts #youtubeshorts #homeopathy,sK4CHhkNTcI,VNS HOMEOPATHY ,2025-01-22T12:30:52Z,https://www.youtube.com/watch?v=sK4CHhkNTcI,Burn Homeopathic Medicine | Kali Muriaticum 6x Benefits #shorts #youtubeshorts #homeopathy #short #shortsvideo #shortsfeed ...,
"Tips of fingers rough, cracked fissured in every winter #healthadvice #homeopathy #trending #shorts",aESAD9w4mEA,Dr Santosh health tips,2025-02-09T10:24:06Z,https://www.youtube.com/watch?v=aESAD9w4mEA,,
What Is Primary Amenorrhea | Reasons For Irregular Periods In Telugu | Medi9 Homeopathy & Ayurveda,orddCw2PKog,Medi9 Homeopathy & Ayurveda - IMS,2025-01-22T10:30:31Z,https://www.youtube.com/watch?v=orddCw2PKog,What Is Primary Amenorrhea | Causes Of Primary Amenorrhea | Reasons For Irregular Periods In Telugu | Medi9 Homeopathy ...,
"Dr. Priya’s Homoeocare Self Care Products  Nature’s purity, homeopathy’s wisdom-crafted just for you",sEHLMWkRtMg,Dr Priya's Homoeocare ,2025-03-23T15:55:16Z,https://www.youtube.com/watch?v=sEHLMWkRtMg,,
"Siri, play it's sir's birthday ✨#birthday #doctor #health #homeopathy #celebration #fun #vibe #love",EK3pzb9IifY,Kalpana Homeopathy Dr Amit jain Dr Surabhi jain,2025-01-26T06:40:25Z,https://www.youtube.com/watch?v=EK3pzb9IifY,,
बदहजमी/Indigestion Homeopathy | Abies Nigra Homeopathic Medicine #shorts #youtubeshorts #homeopathy,Iu5anBl2IRM,VNS HOMEOPATHY ,2025-01-27T13:15:01Z,https://www.youtube.com/watch?v=Iu5anBl2IRM,बदहजमी/Indigestion Homeopathy | Abies Nigra Homeopathic Medicine #shorts #youtubeshorts #homeopathy #short ...,
Full video is on my youtube channel #shorts #youtubeshorts #ytshorts #homeopathy,YMu4zgJhOuY,Dr. Areesha Khan- Wellness Path,2025-02-23T06:30:13Z,https://www.youtube.com/watch?v=YMu4zgJhOuY,,
Winter remedies in Homeopathy #shortvideo #homeopathy #alternativemedicine #trendingshorts,1r6J4e2VCeE,Dr.Santosh Healthcare International,2025-01-20T05:20:52Z,https://www.youtube.com/watch?v=1r6J4e2VCeE,,
For consultation : Dm on 96198 18888#drseemathakkarofficial #drseemathakkar #homeopathy,ihp0VGlBPBM,Askdrseema,2025-03-08T14:35:06Z,https://www.youtube.com/watch?v=ihp0VGlBPBM,,
#gout #homeopathy #treatment #shortsvideo #shorts #ytshorts #trending #youtubeshorts #yt #short #dr,i5zUZGVCqMQ,Dr. Khare,2025-02-04T08:30:15Z,https://www.youtube.com/watch?v=i5zUZGVCqMQ,gout #homeopathy #treatment #shortsvideo #shorts #ytshorts #trending #youtubeshorts #yt #short #dr @Dr.Abhinavkhare ...,
#r49 #dr Reckeweg #homeopathy #homeoayur #sinus #review,7N7g77qmKu8,Divyanshu Mehta,2025-02-27T03:23:45Z,https://www.youtube.com/watch?v=7N7g77qmKu8,,
Books are a man's best friend 📖 #books #bookrecommendations #reading  #homeopathybooks #homeopathy,jWzKU1u3BFg,The Healthy Way,2025-03-20T16:15:41Z,https://www.youtube.com/watch?v=jWzKU1u3BFg,,
#sexualweakness #sexualhealthformen #weaknesstreatment #homeopathy #drchetangupta,inQV0Dt0icU,Dr-Chetan gupta,2025-03-17T15:39:06Z,https://www.youtube.com/watch?v=inQV0Dt0icU,,
Homeopathy vs Allopathy Which one works better for you? #Homeopathy #Allopathy #HealthCare #Wellness,VS9h38HR__g,WhyIndia,2025-01-02T14:14:16Z,https://www.youtube.com/watch?v=VS9h38HR__g,,
#doctor #funny #homeopathy #treatment #drshailvi#health #tips #homeopathicmedicine #shorts #share,0snD66JT49I,Dr Shailvi Singh,2025-03-07T00:47:37Z,https://www.youtube.com/watch?v=0snD66JT49I,,
#homeoaspireacademy #drvishalsrivastav #motivation #powerofhomoeopathy #homeopathy #vikasdivyakirti,oaU5IJl_9HY,Homeo Aspire Academy,2025-02-07T06:00:56Z,https://www.youtube.com/watch?v=oaU5IJl_9HY,,
Different Types Of Sinusitis In Telugu | Causes Of Sinusitis | Medi9 Homeopathy #shorts #sinusitis,9Vjz71T4Hww,Medi9 Homeopathy & Ayurveda - IMS,2025-02-13T12:08:59Z,https://www.youtube.com/watch?v=9Vjz71T4Hww,Different Types Of Sinusitis In Telugu | Causes Of Sinusitis | Medi9 Homeopathy & Ayurveda #shorts #sinusitis #medi9 ...,
Homeopathic medicine for treatment of post nasal discharge #homeopathy #allergy #shorts,XqS6h8FvZj8,Dr. vishal k nagar,2025-01-03T14:26:50Z,https://www.youtube.com/watch?v=XqS6h8FvZj8,Homeopathic medicine for treatment of post nasal discharge For consultation call us on Dr vishal homeopathy : 9899733332 Rx ...,
Scleranthus.. Flores de bach #salud  #medicina #medicinanatural #remedies #homeopathy #floresdebach,sHbxMHcEV7Q,Yo Denisse,2025-02-19T00:37:57Z,https://www.youtube.com/watch?v=sHbxMHcEV7Q,,
Dog & Cat Bites: Safe & Effective Homeopathic Remedies,ByLQsiM4-Kg,Dr. narendra kumar sinha,2025-01-01T14:30:05Z,https://www.youtube.com/watch?v=ByLQsiM4-Kg,"Emergency Homeopathic Solutions for Dog & Cat Bites: Safe & Effective Remedies Welcome to my channel! In this video, we ...",
Dry cough during winter season #healthadvice #trendingshorts #drycough #homeopathy #ytshorts,_s2ccjB0NPg,Dr Santosh health tips,2025-01-31T11:22:50Z,https://www.youtube.com/watch?v=_s2ccjB0NPg,,
Exam funk #trending #medicalscience #homeopathy #study #shorts #shortvideo #medico #trendingshorts,AlE8NkA_TSw,mediCOrner,2025-02-19T12:08:42Z,https://www.youtube.com/watch?v=AlE8NkA_TSw,,
understanding Autism?? #homeopathy #medical #holistichealth,RxLs55lfsB0,Dr AMAN PANDEY,2025-03-08T16:22:29Z,https://www.youtube.com/watch?v=RxLs55lfsB0,homeopathy #dramanpandey #medical #doctor #autism.,
Study hard #trending #shorts #shortvideo #medico #bhms #homeopathy #study #medicine #health #trend,T4qEN22ofLI,mediCOrner,2025-02-18T05:58:49Z,https://www.youtube.com/watch?v=T4qEN22ofLI,,
Homeopathy Treatment For Cholesterol Problem #cholesterol #homeopathy #shorts,TVunzy50V3U,Dr. Riddhi Pandey,2025-01-17T14:59:40Z,https://www.youtube.com/watch?v=TVunzy50V3U,Homeopathy Treatment For Cholesterol Problem #cholesterol #homeopathy #shorts Best Homoeopathic medicines for Erectile ...,
Talking all things perimenopause. Full episode now available #podcast #perimenopause #homeopathy,d4kJXvuMSQA,MINDSET & NEURO MASTERY,2025-02-06T15:34:44Z,https://www.youtube.com/watch?v=d4kJXvuMSQA,,
Dekha ek khwaab to ye silsile huye #homeopathy #shorts #trendingshorts,7fLNssFwc0Y,Talks Smarter,2025-02-26T00:59:59Z,https://www.youtube.com/watch?v=7fLNssFwc0Y,,
GERD CURE WITH HOMEOPATHY AND FREEDOM FRON ANTACIDS #homeopathicmedicine #homeopathy,J-tA4b7-Uc0,Ravi Clinic A Centre of Classical Homeopathy,2025-01-24T16:54:09Z,https://www.youtube.com/watch?v=J-tA4b7-Uc0,,
#shortsfeed #wellness #health #youtubeshorts #subscribe #healing #naturalremedies #homeopathy,ZQB8ktsvGXY,Nidhi goel homeopathy,2025-02-13T15:23:47Z,https://www.youtube.com/watch?v=ZQB8ktsvGXY,,
Day 1st free medical camp #shortvideos #shortsfeed #shortsvideo #shorts #doctor #homeopathy,dQ_Ios7eyJ4,Dr. Archana kumari (B.H.M.S),2025-03-19T03:51:40Z,https://www.youtube.com/watch?v=dQ_Ios7eyJ4,Day 1st free medical camp #shortvideos #shortsfeed #shortsvideo #shorts #doctor #homeopathy#youtubeshorts #youtube ...,
#homeopathy #homeopathytreatment #homeopathymedicine #shorts #allopathyvshomeopathy #shorts,QkGoYBwP0Lo,Sakshi Life,2025-02-03T03:00:21Z,https://www.youtube.com/watch?v=QkGoYBwP0Lo,Homeopathy is an alternative medicine based on the theory of treating | Shorts | Dr. PJK Venkateswarlu | Shorts | Sakshi Life ...,
Allopathic Medicine Vs Homeopathic Medicine | Dr Muhammad Arshad Awan,Vtq48oP0EXs,Awan Homeopathic Center,2025-01-30T07:41:52Z,https://www.youtube.com/watch?v=Vtq48oP0EXs,Allopathic Medicine Vs Homeopathic Medicine | Dr Muhammad Arshad Awan.,
Book your appointment now at 8168660799#drsonianain #acidity #chestburning #sourvomiting #homeopathy,W_VlAgtTA4A,Dr Sonia Nain ,2025-01-18T04:35:01Z,https://www.youtube.com/watch?v=W_VlAgtTA4A,,
Electro homeopathy vs Original Homeopathy #shorts #homeopathy #homeopathic #shortvideo #short,aug7ahuW38k,Dr Rohit Gupta - KEYNOTES Homoeopathy,2025-02-11T15:30:00Z,https://www.youtube.com/watch?v=aug7ahuW38k,shorts #homeopathicmedicine #short #shortvideo #homeopathictreatment #homeopathic #homeopathy #bhms ...,
Dry dandruff on your scalp in winter season #shortvideo #homeopathy #naturaltips #homeremedies,KC7ybWazrXE,Dr.Santosh Healthcare International,2025-01-19T04:52:07Z,https://www.youtube.com/watch?v=KC7ybWazrXE,,
Joint pain/جوڑوں کا درد #jointpain #health #healthtips #homeopathy #bryonia #shorts #shortvideo,x9vgeShLAdU,DrNadeem Ahmad,2025-03-12T15:13:12Z,https://www.youtube.com/watch?v=x9vgeShLAdU,,
Cured Slip Disc Patient Part 5 #homeopathytreatment #homeopathy #patient,8NxmFJ-OXrw,Dr Arpit Chopra's SuperSpecialty ModernHomoeopathic,2025-03-05T13:59:02Z,https://www.youtube.com/watch?v=8NxmFJ-OXrw,Dr. Arpit Chopra Jain (MD HOMOEOPATHY & Critical & Surgical Disease Specialist) Address:- Aarogya Super Speciality Modern ...,
Signs & Symptoms Of Vitamin D. Deficiency.. 💊🩺💫#homeopathic #homeopathy #homeopathyremedies #vitamin,YuB6EMt6GpY,Dr.Dayanand Pawar M.D Homeopathy,2025-01-30T06:43:45Z,https://www.youtube.com/watch?v=YuB6EMt6GpY,,
Holi Color Allergy & Injuries? Best Homeopathy Medicines #holi #holisong #holicolor #holi2025 #tips,Z25hJDh9VbM,Dr. Deepika's Homeopathy,2025-03-14T05:45:04Z,https://www.youtube.com/watch?v=Z25hJDh9VbM,"Holi is fun, but skin & eye allergies or injuries can be painful! Don't worry—homeopathy has the perfect solution. For Holi ...",
Save Your Eyes from Mobile and Computer Damage #homeopathy #homeopathytreatment #doctor,QgjdTcxHCok,DR SUMIT JHA  Homoeopathic World,2025-01-03T13:23:04Z,https://www.youtube.com/watch?v=QgjdTcxHCok,Save Your Eyes from Mobile and Computer Damage #homeopathy #homeopathytreatment #doctor.,
Reckeweg R41 vs. Schwabe Damiaplant – Which Works Better for Male Vitality? #homeopathy,vQvP6dk3-_c,Homeomart Homeopathy Online,2025-03-05T05:21:18Z,https://www.youtube.com/watch?v=vQvP6dk3-_c,Reckeweg R41 vs. Schwabe Damiaplant – Which One Should You Choose? Looking for a homeopathic solution for male vitality?,
Your Homeopathy Plants Are Judging You,PTJF89rkttU,Truemeds,2025-03-20T14:10:38Z,https://www.youtube.com/watch?v=PTJF89rkttU,POV - Your homeopathy plants realize you have no clue what they do... Yes they are judging you! But now you know. #Truemeds ...,
Are Spider Veins the same as Varicose Veins ? Dr P S Tiwari #homeopathy,OwYALeF3bvo,Dr P S Tiwari (Shorts),2025-01-20T13:30:14Z,https://www.youtube.com/watch?v=OwYALeF3bvo,Welcome to another video from Dr. P.S Tiwari. Today's video is about Are Spider Veins the same as Varicose Veins.,
Meet the Black Pioneers of Homeopathy,WUm87yTHXNM,Christina Marie,2025-01-31T11:45:35Z,https://www.youtube.com/watch?v=WUm87yTHXNM,Uncovering the hidden history of Black heroes—one fact at a time. Discover the innovators who shaped homeopathy!,
Tonsillitis treatment homeopathy | Throat pain | baryta mur 200 for tonsillitis | sore throat,UPcmILygfWg,Dr. Abdul Avval Khan,2025-01-26T14:30:14Z,https://www.youtube.com/watch?v=UPcmILygfWg,"Tonsillitis treatment homeopathy | Throat pain | baryta mur 200 for tonsillitis | sore throat Hello friends, My name is Dr. Abdul Avval ...",
Best Crack cream can heal overnight #homeopathy #crackcream #footcare #hb #shorts #explore #trending,ablhvIzprZU,HomoeoBuddy,2025-02-16T15:04:08Z,https://www.youtube.com/watch?v=ablhvIzprZU,,
if you control urine❌💧#urine #urineproblem #homeopathy #homeopathicmedicine #health,ZWwqonjsSds,Kalpana Homeopathy Dr Amit jain Dr Surabhi jain,2025-03-30T18:30:41Z,https://www.youtube.com/watch?v=ZWwqonjsSds,"Effects of Holding Urine Too Long 1. Bladder Weakening – Over time, the bladder muscles may lose strength, making urination ...",
Headache/آدھے سر  کا درد  #headache #health #healthtips #homeopathy #homeopathicmedicine #shorts,_Z5r14T1Vyo,DrNadeem Ahmad,2025-03-21T15:24:30Z,https://www.youtube.com/watch?v=_Z5r14T1Vyo,,
Gymnema Sylvestre Q Homeopathic Medicine in Hindi | Hahnemann Homoeo Hall,YCpIaBVjzz8,Hahnemann Homoeo Hall,2025-03-25T16:03:05Z,https://www.youtube.com/watch?v=YCpIaBVjzz8,Hello everyone myself Dr Satyam Kashyap. Watch this video to know about Gymnema Sylvestre q Homeopathic Medicine in Hindi ...,
Top medicine for weak bones #homeopathy #ytshorts #alternativemedicine #viralreels #youtubeshorts,2kohZiQlwhM,Dr.Santosh Healthcare International,2025-01-21T04:04:08Z,https://www.youtube.com/watch?v=2kohZiQlwhM,,
Sinusitis – Can Homeopathy Help Avoid Surgery? | Dr. Rajesh Shah | Life Force Homeopathy | Part 4/10,amezZDWWN4U,Life Force Homeopathy,2025-02-16T14:05:35Z,https://www.youtube.com/watch?v=amezZDWWN4U,,
Samuel Hahnemann Invented Homeopathy Medicine #bihar #up #rajasthan #gujarat,SwBjEqZC-FU,Logical Expression,2025-03-23T05:30:04Z,https://www.youtube.com/watch?v=SwBjEqZC-FU,Samuel Hahnemann Invented Homeopathy Medicine #bihar #up #rajasthan #gujarat.,
Homeopathic vacancy #ayush #news #bihar #homeopathy,LVekV_Z4QAY,MD HOMEOPATHY,2025-03-23T14:20:13Z,https://www.youtube.com/watch?v=LVekV_Z4QAY,,
Research Paper presentation in a CME #homeopathy #Lucknow #cme,6dp1TjFagMQ,The Healthy Way,2025-01-20T11:56:02Z,https://www.youtube.com/watch?v=6dp1TjFagMQ,,
"Struggling with digestion without coffee, cigarettes, or spicy food? 🌿 #Homeopathy #Digestion",0OQ7-rfzAyI,Dr. Anwaar Homeopathy,2025-03-13T09:16:38Z,https://www.youtube.com/watch?v=0OQ7-rfzAyI,,
Dr reckeweg r39 uses in hindi | R39 homeopathic medicine,qndYvKiIAaQ,Healthy Subscribers,2025-01-18T03:30:20Z,https://www.youtube.com/watch?v=qndYvKiIAaQ,Dr reckeweg r39 uses in hindi R39 homeopathic medicine uses in hindi R39 homeopathic uses in hindi Dr reckeweg r39 R39 Dr ...,
Homeopathy vs. Ayurveda: Understanding the Key Differences,1iFtzge4FM8,Layers of Life Podcast,2025-03-14T13:59:42Z,https://www.youtube.com/watch?v=1iFtzge4FM8,"Ayurveda and Homeopathy both offer natural remedies, but their approach to healing is distinct. Learn about the differences in ...",
My clinic in Bangalore 🏥👩‍⚕️🩺 #doctor #homeopathy #medicine #health #viralshort #bangalore #neetpg,w7M16tzDIyk,The Stetho Life,2025-02-23T09:28:55Z,https://www.youtube.com/watch?v=w7M16tzDIyk,,
Homeopathy for Recurrent Tonsillitis: Can Surgery Be Avoided? | Dr. Rajesh Shah | Part 2/10,rB8hZ2TgtW0,Life Force Homeopathy,2025-02-14T13:30:30Z,https://www.youtube.com/watch?v=rB8hZ2TgtW0,"Welcome to Part 2/10 of our “Homeopathy and Surgery Series.” Today, Dr. Rajesh Shah, M.D. (Hom.), Director of Life Force ...",
Allium Sativa Homeopathic Medicine Uses in Urdu (Garlic) #homeopathy #health #allium,ygFDSARglzE,Hikmat And Homeopathy,2025-01-06T05:41:01Z,https://www.youtube.com/watch?v=ygFDSARglzE,Allium sativum is garlic. Allium Sativum Mother Tincture is an effective remedy for abdominal pain and constipation. It is also ...,
how to prevent chickenpox #homeopathy #shorts #ytshort #hellohomeopathy #doctor,Ba0UsOxnfm4,Hello Homeopathy ,2025-02-11T04:25:43Z,https://www.youtube.com/watch?v=Ba0UsOxnfm4,how to prevent chickenpox #homeopathy #shorts #ytshort #hellohomeopathy #doctor #drmanabendramondal #healthtipsbangla ...,
homeopathy skin cream #homeopathy #skincare #soundarya,cna4G6nuRBo,Simar ,2025-03-04T04:58:45Z,https://www.youtube.com/watch?v=cna4G6nuRBo,,
"How to Reduce Thyroid Supplement Dependency? | Dr. Rajesh Shah, MD(Hom) | Homeopathy for Thyroid",oJdomBCFfwo,Life Force Homeopathy,2025-03-20T18:02:27Z,https://www.youtube.com/watch?v=oJdomBCFfwo,,
Arnica shampoo B&T Best homeopathy shampoo  for  dandruff hair fall,8mVxZ7lCJ4E,Dr. Akshay Vishwanathwar,2025-02-28T12:34:33Z,https://www.youtube.com/watch?v=8mVxZ7lCJ4E,,
चेहरे की झुर्रियों को हटाने के Natural Tips ! 🌸 #Wrinkles #homeopathy #shorts #skincare #video #live,YKo2J5zbh8A,"Dr Atul kumar Singh, MD, PG London",2025-02-08T06:00:52Z,https://www.youtube.com/watch?v=YKo2J5zbh8A,NaturalRemedies #AntiAging #HealthySkin #BeautyTips #SkincareRoutine #GlowUp #YouthfulSkin Are you also troubled by ...,
"Guillain Barre Syndrome (GBS) Treatment, Pathophysiology, Symptoms, Homeopathy Medicine",x9RMYJVuYEk,Dr Namrata Homeopathy,2025-01-29T14:00:20Z,https://www.youtube.com/watch?v=x9RMYJVuYEk,"Guillain Barre Syndrome (GBS) Treatment, Pathophysiology, Symptoms, Homeopathy Medicine #shorts #youtubeshorts ...",
"NIGA Homeopathy, Akluj. #care#homeopathy",kZa7Gh_sMv4,NIGA homeopathy,2025-01-09T06:54:19Z,https://www.youtube.com/watch?v=kZa7Gh_sMv4,,
Renal colic right side #trendingshorts #kidneydisease #viraltrend #youtubeshorts #homeopathy,8BP42M12Eyo,Dr.Santosh Healthcare International,2025-03-13T16:52:23Z,https://www.youtube.com/watch?v=8BP42M12Eyo,,
Happy Mind = Healthy Body #mindfulliving #mindfulness #homeopathy #healthylifestyle #mindwellness,eZNie3D-wu8,Dr. Akshat Salil,2025-02-19T10:28:11Z,https://www.youtube.com/watch?v=eZNie3D-wu8,The video lays the importance of the connection between the mental health and its effects on the physical body.,
Alpha TS Homeopathic medicine For Tention & Strees #health #shorts #homeopathy #viral #tension,DF3BoICVf7M,Manasha homeopathic,2025-03-10T06:20:59Z,https://www.youtube.com/watch?v=DF3BoICVf7M,Alpha TS Homeopathic medicine For Tention & Strees #health #shorts #homeopathy #viral #tension.,
Book your online consultation at 8168660799 #drsonianain #depression #stress #homeopathy #viralit,zPsY9JbzpH8,Dr Sonia Nain ,2025-01-28T07:50:32Z,https://www.youtube.com/watch?v=zPsY9JbzpH8,,
#motivation #chris #homeopathy doctor in Tenkasi #parentingtips,RWZSVfiZiyo,Dr.christy's  healthcare,2025-01-08T16:09:58Z,https://www.youtube.com/watch?v=RWZSVfiZiyo,,
Curare 30 Homeopathy medicine uses in Hindi |Unintentional functions of body |weakness of old people,v2_JmYCyxLQ,HOMEOPATHY AND HEALTH,2025-03-07T17:26:26Z,https://www.youtube.com/watch?v=v2_JmYCyxLQ,"Hi friends, i am Dr. Zahoor ul islam Shahid. In this video, i am going to share a rare information about homeopathy medicine ...",
Fermented Garlic Honey #homeopathicmedicine #naturalantibiotic #homeopathy #homeopathic,Aw-f9pHC3g4,My Cottage Kitchen Recipes,2025-01-14T05:52:04Z,https://www.youtube.com/watch?v=Aw-f9pHC3g4,,
Guess Homeopathy Remedy- Dr. Medha Khare Riddle#9 #homeopathy,a6hR9vlSZhA,Essence of Applied Mind- Homeopathy ,2025-01-10T04:30:01Z,https://www.youtube.com/watch?v=a6hR9vlSZhA,,
Lichen Planus Testimonial: A Homeopathic Relief Journey at Life Force Homeopathy,GF-PCCQRvJY,Life Force Homeopathy,2025-02-26T14:06:46Z,https://www.youtube.com/watch?v=GF-PCCQRvJY,Watch this powerful testimonial video where a patient shares her personal journey with Lichen Planus—a condition she has ...,
UP Big news homeopathy #exam #ayush #up #homeopathy,buqHP2G_9BY,MD HOMEOPATHY,2025-01-30T04:55:23Z,https://www.youtube.com/watch?v=buqHP2G_9BY,,
Can Homeopathy Replace Surgery? The Final Truth! | Dr. Rajesh Shah | Part 12/12 #homeopathy,rNz-LbbhzFI,Life Force Homeopathy,2025-03-17T04:36:10Z,https://www.youtube.com/watch?v=rNz-LbbhzFI,,
Aesculus ointment #homeopathy #homeopathicmedicine #piles #aesculushippocastanum,vsimcsXjGWE,DrShaliniHomeopathy,2025-03-05T17:22:29Z,https://www.youtube.com/watch?v=vsimcsXjGWE,In this video I am discussing about the Homeopathy medicine aesculus hippocastanum do watch the video for knowledge and ...,
Book your online consultation at 8168660799 #drsonianain #allergy #cold #eyeallergy  #homeopathy,NiA6OZiEcC0,Dr Sonia Nain ,2025-03-29T05:42:18Z,https://www.youtube.com/watch?v=NiA6OZiEcC0,,
Renal colic right side #trendingshorts #kidneydisease #viraltrend #youtubeshorts #homeopathy,8BP42M12Eyo,Dr.Santosh Healthcare International,2025-03-13T16:52:23Z,https://www.youtube.com/watch?v=8BP42M12Eyo,,
Happy Mind = Healthy Body #mindfulliving #mindfulness #homeopathy #healthylifestyle #mindwellness,eZNie3D-wu8,Dr. Akshat Salil,2025-02-19T10:28:11Z,https://www.youtube.com/watch?v=eZNie3D-wu8,The video lays the importance of the connection between the mental health and its effects on the physical body.,
Alpha TS Homeopathic medicine For Tention & Strees #health #shorts #homeopathy #viral #tension,DF3BoICVf7M,Manasha homeopathic,2025-03-10T06:20:59Z,https://www.youtube.com/watch?v=DF3BoICVf7M,Alpha TS Homeopathic medicine For Tention & Strees #health #shorts #homeopathy #viral #tension.,
Book your online consultation at 8168660799 #drsonianain #depression #stress #homeopathy #viralit,zPsY9JbzpH8,Dr Sonia Nain ,2025-01-28T07:50:32Z,https://www.youtube.com/watch?v=zPsY9JbzpH8,,
#motivation #chris #homeopathy doctor in Tenkasi #parentingtips,RWZSVfiZiyo,Dr.christy's  healthcare,2025-01-08T16:09:58Z,https://www.youtube.com/watch?v=RWZSVfiZiyo,,
SBL Sativol homeopathic medicine  uses in hindi,zJRjiW9KfYs,Healthy Subscribers,2025-02-11T03:30:27Z,https://www.youtube.com/watch?v=zJRjiW9KfYs,Sativol sbl homeopathic medicine Sativol homeopathic medicine uses in hindi Sativol tonic uses in hindi Sativol syrup uses in ...,
Curare 30 Homeopathy medicine uses in Hindi |Unintentional functions of body |weakness of old people,v2_JmYCyxLQ,HOMEOPATHY AND HEALTH,2025-03-07T17:26:26Z,https://www.youtube.com/watch?v=v2_JmYCyxLQ,"Hi friends, i am Dr. Zahoor ul islam Shahid. In this video, i am going to share a rare information about homeopathy medicine ...",
Fermented Garlic Honey #homeopathicmedicine #naturalantibiotic #homeopathy #homeopathic,Aw-f9pHC3g4,My Cottage Kitchen Recipes,2025-01-14T05:52:04Z,https://www.youtube.com/watch?v=Aw-f9pHC3g4,,
Life Force Homeopathy: Patient's Journey with PCOD & Underactive Thyroid | Inspiring Health Story,UTPrB3LxxOA,Life Force Homeopathy,2025-01-24T05:25:04Z,https://www.youtube.com/watch?v=UTPrB3LxxOA,"Disease Name: Underactive Thyroid PIN: 53805 Patient Location: Vidyavihar, Mumbai Patient Occupation: MBBS student ...",
Lichen Planus Testimonial: A Homeopathic Relief Journey at Life Force Homeopathy,GF-PCCQRvJY,Life Force Homeopathy,2025-02-26T14:06:46Z,https://www.youtube.com/watch?v=GF-PCCQRvJY,Watch this powerful testimonial video where a patient shares her personal journey with Lichen Planus—a condition she has ...,
UP Big news homeopathy #exam #ayush #up #homeopathy,buqHP2G_9BY,MD HOMEOPATHY,2025-01-30T04:55:23Z,https://www.youtube.com/watch?v=buqHP2G_9BY,,
Can Homeopathy Replace Surgery? The Final Truth! | Dr. Rajesh Shah | Part 12/12 #homeopathy,rNz-LbbhzFI,Life Force Homeopathy,2025-03-17T04:36:10Z,https://www.youtube.com/watch?v=rNz-LbbhzFI,,
Aesculus ointment #homeopathy #homeopathicmedicine #piles #aesculushippocastanum,vsimcsXjGWE,DrShaliniHomeopathy,2025-03-05T17:22:29Z,https://www.youtube.com/watch?v=vsimcsXjGWE,In this video I am discussing about the Homeopathy medicine aesculus hippocastanum do watch the video for knowledge and ...,
Book your online consultation at 8168660799 #drsonianain #allergy #cold #eyeallergy  #homeopathy,NiA6OZiEcC0,Dr Sonia Nain ,2025-03-29T05:42:18Z,https://www.youtube.com/watch?v=NiA6OZiEcC0,,
Avoid Surgery! Treat Gallstones Naturally with Homeopathy #gallstone #homeopathy #homeopathy,9QzD2fQyIWY,Dr Abhik Ghosh Homeopathy,2025-03-01T16:13:32Z,https://www.youtube.com/watch?v=9QzD2fQyIWY,Avoid Surgery! Treat Gallstones Naturally with Homeopathy #gallstone #homeopathy #homeopathy Contact Us - Dr Ghosh ...,
Improve Insulin resistance✅ #health #homeopathy #fatburning #estrogen #medicine #bellyfat #pcod,-uwbLyPhhVw,Kalpana Homeopathy Dr Amit jain Dr Surabhi jain,2025-01-04T13:40:50Z,https://www.youtube.com/watch?v=-uwbLyPhhVw,We understand many of you facing this - Let's resolve the stubborn fat with these herbs : 1. Cinnamon Benefits: Improves insulin ...,
Being healthy is the first celebration. #quote #motivation #health #doctor #dramitjain #homeopathy,n8rMCKED2t4,Kalpana Homeopathy Dr Amit jain Dr Surabhi jain,2025-01-15T10:30:54Z,https://www.youtube.com/watch?v=n8rMCKED2t4,,
Oromandibular Dystonia Treatment with Homeopathy | Patient's Healing Journey,Xgwk-ZpmQSc,Life Force Homeopathy,2025-02-12T10:53:08Z,https://www.youtube.com/watch?v=Xgwk-ZpmQSc,Struggling with Oromandibular Dystonia? Discover how Homeopathy at Life Force has helped a patient experience improvements ...,
सिर दर्द? Headache Homeopathic Medicine! Spigelia 30 Uses inHindi #shorts #youtubeshorts #homeopathy,MKJlq3fHfXw,VNS HOMEOPATHY ,2025-01-29T07:30:07Z,https://www.youtube.com/watch?v=MKJlq3fHfXw,सिर दर्द? Headache Homeopathic Medicine! Spigelia 30 Uses inHindi #shorts #youtubeshorts #homeopathy #short ...,
