Title,Video ID,Channel,Published At,URL,Description,Video Length,Views,Likes,Comments
Juice some celery with Nesh!💕 #weightloss #viralreels #viralshorts #healthy #celeryjuice #plusssize,UCEmqFpYgLU,Get Healthy with Nesh,2025-01-30T15:47:01Z,https://www.youtube.com/watch?v=UCEmqFpYgLU,,60,,,
"Thank you, @breville , for the amazing juicer! I appreciate you. 💗",6D3KWDpok0s,Heather Ann Pearl,2025-03-24T13:59:40Z,https://www.youtube.com/watch?v=6D3KWDpok0s,,16,,,
Adding celery juice in daily life for many health benefits #morningjuice #food #breakfastidea #reels,47KlcOWkG7g,Bhawana Ashu,2025-01-05T06:59:12Z,https://www.youtube.com/watch?v=47KlcOWkG7g,,46,,,
Celery & Apple Juice in the morning  #juicing #morningjuice #greenjuice #celeryjuice #health,7wOD6lycGhU,Iris in Balance,2025-02-18T05:47:13Z,https://www.youtube.com/watch?v=7wOD6lycGhU,,59,,,
I always start my days with something alkaline: a green juice/celery juice&/ lemon water #whatieat,2PBZ6skkl8o,Alice Santos,2025-02-26T17:54:01Z,https://www.youtube.com/watch?v=2PBZ6skkl8o,,34,,,
"Loose morning routine: Hydrate, move, journal, sun, supplements & walk with Lido!",K3-HS5XT-BE,Aegis Formulas,2025-03-21T22:03:11Z,https://www.youtube.com/watch?v=K3-HS5XT-BE,"Loose morning routine Celery juice upon waking to hydrate, support digestion, and help flush out toxins Sunshine + grounding ...",17,,,
Celery juice🌿 #usashorts #celeryjuice #holistichealth #holisticskincare,Csq5V6YtC0s,Emily ,2025-01-24T15:11:48Z,https://www.youtube.com/watch?v=Csq5V6YtC0s,,37,,,
Day 1 Drink celery juice with me #health #subscribe,jfZHDM1qgH0,Dianaonyoutube,2025-03-17T20:50:03Z,https://www.youtube.com/watch?v=jfZHDM1qgH0,,127,,,
🍏➕🥬 Celery = Ultimate Health Boost #CeleryJuice #AppleJuice #HealthyDrinks #trending,kqkOjQGJybE,Nitya Vibes,2025-03-01T00:30:30Z,https://www.youtube.com/watch?v=kqkOjQGJybE,"Try this refreshing Celery & Apple Juice combo! Packed with nutrients, it's perfect for detox, energy, and glowing skin. ✨ Don't ...",21,,,
Green juice recipe : celery spinach green apple cucumber lemon and ginger,AiEAlHlIT2Y,Cristina Isabel,2025-02-21T23:38:33Z,https://www.youtube.com/watch?v=AiEAlHlIT2Y,,32,,,
"Burn fat fast with this simple juice! Celery, lemon, and cucumber – the ultimate detox",dn4ANfAJxUo,Juice Alchemy,2025-03-13T23:35:45Z,https://www.youtube.com/watch?v=dn4ANfAJxUo,"Looking for an easy way to boost your metabolism and shed some fat? This refreshing juice combines celery, lemon, and ...",16,,,
#celeryjuice#cucumber#fatloss#juice#green#healthy#vijayawada#heart#healthylifestyle#gooddrinks,7NqSkcUafM0,Sokuladi,2025-03-12T17:51:07Z,https://www.youtube.com/watch?v=7NqSkcUafM0,,13,,,
Celery Sticks vs. Celery Juice: Which Is Healthier?,nJolzZdv15U,The Healing Bite,2025-01-22T02:17:56Z,https://www.youtube.com/watch?v=nJolzZdv15U,"Discover the differences between eating celery sticks and drinking celery juice. Learn which option offers more health benefits, ...",99,,,
I love a cold celery juice on a hot day. Where are you all from? Is it hot where you live? #trending,7s-AKlGqtEk,Mirela Barisic,2025-01-11T01:40:55Z,https://www.youtube.com/watch?v=7s-AKlGqtEk,,61,,,
Celery juice detox: surprisingly delicious,6Qu-QhS3VFw,Lauren Campbell,2025-03-19T15:33:13Z,https://www.youtube.com/watch?v=6Qu-QhS3VFw,Summer detox: celery juice takes center stage! #health #fok.,84,,,
Juicing #celeryjuice #juicing #cleaneating #detoxjuice #freshjuice,ZP4ngQakhr0,Christy Rene,2025-01-19T22:40:10Z,https://www.youtube.com/watch?v=ZP4ngQakhr0,Link to Juicing bottles https://amzn.to/3WmE6tO.,7,,,
Celery juice with apple cucumber and lemon.,QbTTY9ZeiCQ,Liza Caasi,2025-02-03T18:29:44Z,https://www.youtube.com/watch?v=QbTTY9ZeiCQ,,84,,,
Cauliflower & Celery Juice  Detox Power!,_HulWBn46lo,Healthy Heals Hearts,2025-02-07T23:00:34Z,https://www.youtube.com/watch?v=_HulWBn46lo,"Cauliflower and Celery Juice Ingredients: Steamed cauliflower, celery stalks, parsley, and lemon juice. Benefits: Low in calories ...",51,,,
Healthy morning drink 🍹#celeryjuice  #youtubeshorts #shorts #trending #cooking #cookwithme 🥰,3FfHdSGTf5U,Shus Shila 🌸,2025-03-31T22:00:03Z,https://www.youtube.com/watch?v=3FfHdSGTf5U,,31,,,
"Sick of ACID REFLUX, HEARTBURN, GERD? Try THIS Every Morning for Better GUT HEALTH #acidrefluxrelief",bVLC3Dg-paU,Jayshal Daya,2025-03-21T01:23:58Z,https://www.youtube.com/watch?v=bVLC3Dg-paU,"I wish I knew about this sooner! If you're struggling with acid reflux, constant heartburn, or digestive discomfort, this simple acid ...",44,,,
"Sick of ACID REFLUX, HEARTBURN, GERD? Try THIS Every Morning for Better GUT HEALTH #acidrefluxrelief",bVLC3Dg-paU,Jayshal Daya,2025-03-21T01:23:58Z,https://www.youtube.com/watch?v=bVLC3Dg-paU,"I wish I knew about this sooner! If you're struggling with acid reflux, constant heartburn, or digestive discomfort, this simple acid ...",44,,,
Celery juice! Dried apricots! 💗,J_hk0NW052Q,Heather Ann Pearl,2025-03-06T22:18:31Z,https://www.youtube.com/watch?v=J_hk0NW052Q,,35,,,
Celery Juice #fruit #diettips #fruitcleanse,2yYpScS31EA,Napps and Nurture,2025-02-15T17:05:40Z,https://www.youtube.com/watch?v=2yYpScS31EA,,60,,,
Boost your health with celery's antioxidants & nutrients,rkchdR9tFtk,JuiceGlow,2025-02-24T03:00:53Z,https://www.youtube.com/watch?v=rkchdR9tFtk,"Unlock #celery power: antioxidants, enzymes, & more! #celeryjuice #fok.",23,,,
Benefits of celery juice #celeryjuice #celery #detox #greenjuice,seUjwkpevp4,OpulentEchoess,2025-01-04T22:19:10Z,https://www.youtube.com/watch?v=seUjwkpevp4,,108,,,
gonna tilt the earth of its axis #detox #celeryjuice #weightloss,zILLxP2ZrQw,misscuddy,2025-01-31T17:01:13Z,https://www.youtube.com/watch?v=zILLxP2ZrQw,,9,,,
Get this waist right! #celeryjuice #guthealth #juicing #coldpress #health #flattummy #morningroutine,DV3ebx_YJ8Q,Karla ,2025-03-01T15:54:27Z,https://www.youtube.com/watch?v=DV3ebx_YJ8Q,,114,,,
Green celery mixed with cucumber 🥒 juice 😋 #fyp #juice #fypage #fypyoutube,21u-epFDnzk,Loveth Universe,2025-03-12T12:31:57Z,https://www.youtube.com/watch?v=21u-epFDnzk,,185,,,
Kicking Off A Healthy Lifestyle With A 10-Day Celery Juice Challenge,hv9FecBmOtI,Brennan,2025-03-19T19:02:46Z,https://www.youtube.com/watch?v=hv9FecBmOtI,"Day 1 of transforming my lifestyle! Starting with celery juice, cleaner eating, and priming exercises. Sharing my honest ...",180,,,
Boost your day with fiber-rich supplements! #celeryjuice #celerygummies,ZqyW2q44tLM,Stella Gonzalez,2025-03-10T03:47:12Z,https://www.youtube.com/watch?v=ZqyW2q44tLM,Boost your day with fiber-rich celery gummies #celeryjuice #gummies #supplements #fok.,32,,,
"FLUSH OUT TOXIN EVERYDAYWITH CELERY JUICE 🧃 In just 21 days, you could feel fresher😌👌🏽",501GExMTrcI,asma,2025-02-24T07:44:15Z,https://www.youtube.com/watch?v=501GExMTrcI,,58,,,
Celery juice is the secret to a healthier you! #healthtips #healthandperformance #healthyliving,CYFUOLTcxjM,Peak Performance For You,2025-01-08T13:00:14Z,https://www.youtube.com/watch?v=CYFUOLTcxjM,"Discover the incredible benefits of celery juice in just 60 seconds! Packed with vitamins, antioxidants, and hydration, celery ...",8,,,
#celeryjuice #juicing #juicingbenefits #health #tipsforhealth #makeup #fypシ゚,C9IsxV6zQEw,Karina Daniel,2025-01-18T20:24:16Z,https://www.youtube.com/watch?v=C9IsxV6zQEw,,56,,,
Celery juice day 3 #celeryjuice #healthylifestyle #medicalmedium #path2wellnessbyamandasheppard,BBBG6wgeobU,Amanda Sheppard,2025-02-05T04:48:48Z,https://www.youtube.com/watch?v=BBBG6wgeobU,,38,,,
Celery - Ginger Immunity Juice,7a7_Qb05GHM,PointDanielle,2025-02-04T04:29:15Z,https://www.youtube.com/watch?v=7a7_Qb05GHM,Ingredients Celery Green Apples Ginger Cucumber ✨ ✨ ✨ Boosting your immune system Cucumber boosts hydration Celery ...,22,,,
Celery juice every morning....no way..!?  #greenjuice #detox #guthealth #fromtoday #nottomorrow,SkCGSzscU-0,fullenerjuicy,2025-03-28T14:37:49Z,https://www.youtube.com/watch?v=SkCGSzscU-0,,,,,
DRINK YOUR GREENS🍵 #celeryjuice #healthylifestyle #healthyjuice #cucumber #lemon #antiinflammatory,DWfqLVJE6rk,Take it easy Sakhi,2025-01-23T11:07:58Z,https://www.youtube.com/watch?v=DWfqLVJE6rk,,47,,,
Let’s be healthy #love#cucumber#celeryjuice#ginger#healthylifestyle#consistency#healthyfood#diabetes,HcwOYP2Ds6k,Kershaw Bonhomme,2025-01-16T21:41:17Z,https://www.youtube.com/watch?v=HcwOYP2Ds6k,,,,,
10 reasons the Medical Medium knows celery juice is worth the hype!,vBkX5spTAgo,Healthy Hacks,2025-01-26T18:42:58Z,https://www.youtube.com/watch?v=vBkX5spTAgo,Find out why celery is good for you! Discover the incredible health benefits of celery! From reducing inflammation and ...,236,,,
Carrots 🥕 Celery and beetroot  juice,fZi_KnE4gZc,Jelie Vlog ,2025-02-22T14:03:43Z,https://www.youtube.com/watch?v=fZi_KnE4gZc,,40,,,
Boost your health with affordable celery juice #smallbusiness,ANkUj8qhUjw,PlantKitchen,2025-03-16T01:00:06Z,https://www.youtube.com/watch?v=ANkUj8qhUjw,Boost your health with affordable celery juice #smallbusiness #weightloss #fok.,,,,
Refreshing ginger lime celery juice #juice,LlnyrkAwKJk,Kai Souza Carvalho,2025-03-20T16:02:49Z,https://www.youtube.com/watch?v=LlnyrkAwKJk,Fresh ginger lime celery juice #fok #juice #fitness.,,,,
#celeryjuice #antiinflammatory #glassskin #ytshorts #shorts #naturalglowingskin #triedandtested,xgfO5CpcIww,Madhu,2025-02-19T21:07:28Z,https://www.youtube.com/watch?v=xgfO5CpcIww,,,,,
Is the celery juice trend for you? 🤔 I’m willing to bet it is NOT if you have chronic constipation,hbUl7pOkd5I,Jiaming Ju | Traditional Chinese Medicine,2025-02-05T21:04:40Z,https://www.youtube.com/watch?v=hbUl7pOkd5I,Is the celery juice trend for you? I'm willing to bet it is NOT if you have chronic constipation. Listen in to learn why I am against ...,,,,
Have you juiced Today? #medicalmedium #celeryjuice #celeryjuicechallenge #celery #healthtips,bJWY9EN4Ydw,Wellness_X3eauty,2025-02-14T18:24:13Z,https://www.youtube.com/watch?v=bJWY9EN4Ydw,,36,,,
Healthy celery juice,QGMI8tamGZM,Lois Aproka Gist,2025-01-13T06:42:35Z,https://www.youtube.com/watch?v=QGMI8tamGZM,,57,,,
Celery Juice: 5 Benefits You NEED to Know! 💚🥤,GaYaqSpWWgU,Una Chef en la Cocina,2025-02-11T16:00:26Z,https://www.youtube.com/watch?v=GaYaqSpWWgU,Celery juice is more powerful than you think! Here are 5 surprising benefits that can transform your health. Why drink ...,24,,,
Take a glass of celery juice everyday and enjoy the amazing health benefits #shorts #celery #juice,BHGWPee4ZrE,Dr. Sustainer,2025-03-20T10:54:52Z,https://www.youtube.com/watch?v=BHGWPee4ZrE,,100,,,
Apple 🍏 ginger🫚 celery juice,QlXph2WnsFE,MomTooMom ,2025-03-15T05:26:51Z,https://www.youtube.com/watch?v=QlXph2WnsFE,Evening juice in my Nama J2.,74,,,
The Enigmatic Story of Celery Juice's Resurgence,EKWQ335z1W4,TAKE CARE OF YOURSELF,2025-01-11T01:00:10Z,https://www.youtube.com/watch?v=EKWQ335z1W4,"Explore the compelling revival of celery juice, from ancient Egypt's prized elixir to its modern wellness resurgence and health ...",,,,
Here’s a powerful green juice!,yywAQU5uwI8,Tina’s Juicing Journey ,2025-03-29T01:32:44Z,https://www.youtube.com/watch?v=yywAQU5uwI8,,15,,,
How to Make Celery Juice,H-PaKZ6lOo0,Aisling FitzGibbon,2025-02-10T15:35:46Z,https://www.youtube.com/watch?v=H-PaKZ6lOo0,Celery juice will begin to kill off pathogens like viruses such as Epstein Barr and Shingles as well as bacteria such as ...,34,,,
Celery Juice  Secret Weapon for Eye Health,NnEa1xamohg,thefoodbeautifullife,2025-01-13T16:28:48Z,https://www.youtube.com/watch?v=NnEa1xamohg,"Discover the amazing benefits of celery juice! In this video, we dive into how celery juice works similarly to milk thistle with its ...",,137,6,0
😱Best juices for blood sugar control 😱 #new #diet #health #shorts #ytshorts #viralshort,VLrHMoAVScw,Fit with Tyagi,2025-01-03T14:25:23Z,https://www.youtube.com/watch?v=VLrHMoAVScw,Best juices for blood sugar control #new #diet #health #shorts #ytshorts #viralshort @FitwithTyagii . . Blood control juice How to ...,60,,,
Extracting celery juice with a juicer,7CnLeI6Yxsg,Yieach,2025-01-02T06:09:50Z,https://www.youtube.com/watch?v=7CnLeI6Yxsg,,,,,
Celery Juice.  Very beneficial to drink on an empty stomach.,fN332olMzpw,NATALEE WITTER,2025-01-09T09:47:48Z,https://www.youtube.com/watch?v=fN332olMzpw,Product testing. Portable blender. Celery Juice. Very beneficial to drink on an empty stomach. Preferably first thing in the morning.,,,,
green juice celery apple spinach ginger and before you eat have warm water and 🍋 lemon,-dz2-GMwbzk,Whitney Crowder,2025-01-19T20:17:47Z,https://www.youtube.com/watch?v=-dz2-GMwbzk,,,50,3,0
#celeryjuice#shorts#trending#youtubeshorts#summerdrink#healthydrinks#nutrition#hydrate #morebenefits,zUpDpO_PZ2g,NUTRE ,2025-03-05T12:52:56Z,https://www.youtube.com/watch?v=zUpDpO_PZ2g,"hello all, giving you benefits of celery #hydration #antiinflammatory #anticancer #nutrition #reducebellyfat #hearthealth ...",,,,
5 Side Effects of Celery Juice on Health: What You Need to Know,xTjTaCYEiF8,Healthy Life,2025-02-08T09:15:04Z,https://www.youtube.com/watch?v=xTjTaCYEiF8,"5 Side Effects of Celery Juice on Health: What You Need to Know Celery juice has become a popular health trend, but are you ...",,,,
Detox And Energize Your Body With Celery Juice!,FaxZgkgQAl8,Healthy Hacks,2025-02-11T20:30:02Z,https://www.youtube.com/watch?v=FaxZgkgQAl8,Discover the incredible benefits of drinking celery juice every morning. This video explores the advantages of incorporating celery ...,48,,,
Orange celery juice #asmrsounds #shorts #telaviv,uqYV29xh76M,CHA on the ROAD,2025-01-31T11:17:14Z,https://www.youtube.com/watch?v=uqYV29xh76M,,,,,
Celery. #everyone-followers #health #highlights #food #viralvideo,pIs3U_5aKAE,AlquinTV,2025-03-06T09:11:01Z,https://www.youtube.com/watch?v=pIs3U_5aKAE,Benefit of celery juice #everyonefollowers #highlights #followers #food #foodblogger.,103,40,1,0
What Would Happen If A Man Drinks Celery Juice For A Week?,TyErbZajNqo,WellFull,2025-03-17T05:00:21Z,https://www.youtube.com/watch?v=TyErbZajNqo,Health #Wellness #HealthyLifestyle #HealthTips# Nutrition# Exercise #HealthyHabits.,,,,
How to make celery juice step-by-step. 💗,UY5pbiYN2Tg,Heather Ann Pearl,2025-03-28T14:38:11Z,https://www.youtube.com/watch?v=UY5pbiYN2Tg,,,,,
Celery Stalks ● Celery Juice |Body Digestion & Detoxification!! #food #celeryjuice #bodydetox,Uyj3B9oe9QU,|Analiza Dalimocon Baltar,2025-03-22T00:56:36Z,https://www.youtube.com/watch?v=Uyj3B9oe9QU,,53,,,
celery juice..shots,SZWi-wtouxU,QueensJES,2025-03-05T22:50:54Z,https://www.youtube.com/watch?v=SZWi-wtouxU,,,,,
Organic Celery juice tastes so sweet 😋🤤,6aIoijmkxY4,WOWA FITNESS,2025-01-08T04:10:27Z,https://www.youtube.com/watch?v=6aIoijmkxY4,,,,,
"How to prepare celery juice for your overall health. It has antioxidant, antiinflammatory substances",8BULuYhWhvg,Mother and kids  channel ,2025-03-10T19:55:30Z,https://www.youtube.com/watch?v=8BULuYhWhvg,,,,,
Celery Juice - how to make it,IKL8g8Q_Pbw,Mythili Manoharan,2025-02-23T17:19:15Z,https://www.youtube.com/watch?v=IKL8g8Q_Pbw,,,,,
"Celery juice it’s a natural ral detox power, a heart-loving nutrients, and a hydration boost",Bs8H9u1i9iE,Vanisty Creole,2025-01-06T15:07:45Z,https://www.youtube.com/watch?v=Bs8H9u1i9iE,,,,,
@Generalmedicine1 if a man drink celery and apple juice daily #viralshorts #viralshort #food #foodie,RyT-zyHzc_M,Healing with Dr.Mehtab,2025-01-05T07:52:33Z,https://www.youtube.com/watch?v=RyT-zyHzc_M,"celery juice,celery juice benefits,celery juice cleanse,benefits of celery juice,celery and green apple juice,benefits of celery,celery ...",,,,
"Happy Tuesday come get ready with me! We’re making Coffee protein shakes, and celery juice.  #fit",eYqfh0juaBE,Unbreakable Fitness,2025-01-07T15:26:34Z,https://www.youtube.com/watch?v=eYqfh0juaBE,,,,,
"""This ONE Drink Could Transform Your Health – The Truth About Celery Juice!""",sDr2V-3Pcps,HEAL THY SELF,2025-02-22T06:59:59Z,https://www.youtube.com/watch?v=sDr2V-3Pcps,"Is celery juice really the miracle drink people claim, or is it just another health trend? In this video, we dive deep into the real ...",,,,
Morning Madness Juice #healthy #juice #tasty #guthealth #beetroot #celeryjuice #pineapple #carrot,pF5DcrMk9kg,Herbivore Horizons | Priyanka | Life & Food,2025-01-10T21:06:08Z,https://www.youtube.com/watch?v=pF5DcrMk9kg,,,,,
I drank Celery juice for 500 days and healed mystery illnesses #celeryjuice #celeryjuicechallenge,dMhVj7_TC1k,Hartwell,2025-03-14T02:24:40Z,https://www.youtube.com/watch?v=dMhVj7_TC1k,,,,,
celery juice for my darling #buhayprobinsya #foryoupage,Ho50UqRsiBg,Che May ,2025-02-25T00:27:33Z,https://www.youtube.com/watch?v=Ho50UqRsiBg,,53,,,
Join the celery juice trend today! #juice,IxOG0Y4x-lA,Rebeca Stafford,2025-02-17T14:15:01Z,https://www.youtube.com/watch?v=IxOG0Y4x-lA,Join the celery juice challenge today! #juice #whatilike #fok.,,,,
Try these amazing #celeryjuice #gummies for,2_JBPA0JRa0,Stella Gonzalez,2025-03-29T12:19:02Z,https://www.youtube.com/watch?v=2_JBPA0JRa0,Try these amazing #celeryjuice #gummies for better #guthealth #fok.,,,,
Celery juice with a pinch of sea salt for a morning drink #shorts #celeryjuice #breakfastdrink,itX5qI1Nkc0,Honey Stream Dreams,2025-02-04T19:51:54Z,https://www.youtube.com/watch?v=itX5qI1Nkc0,,,,,
How To Make Celery Juice🥬🍋,oqTPzV4rgFo,Colin’s Kitchen,2025-01-06T22:54:38Z,https://www.youtube.com/watch?v=oqTPzV4rgFo,Celery Juice Ingredients: Celery Lemon Ginger Water Cilantro Sugar or honey( optional),,,,
Celery Juice with Omega Juicer J8226,ykC7Zw6TLcQ,Sri Juliani Tampubolon,2025-01-24T02:00:34Z,https://www.youtube.com/watch?v=ykC7Zw6TLcQ,Recipe from Anthony William-Medical Medium.,,,,
Benefits of Celery Juice #healthyeats,NFrDtYgTDgE,Kiyanna Maria,2025-01-20T14:35:32Z,https://www.youtube.com/watch?v=NFrDtYgTDgE,,,,,
Homemade Celery Juice,haqYkOAbcnU,All Things Jan,2025-02-20T19:39:57Z,https://www.youtube.com/watch?v=haqYkOAbcnU,celeryjuice #homemadeceleryjuice #juice #healthyjuice #healthyjuicerecipe #tuumistjuicer #juiceforhealth #homemaderecipe.,,28,4,0
This celery juice hit the spot!,z42cdwYB9ZM,Losing To Win,2025-01-29T03:49:07Z,https://www.youtube.com/watch?v=z42cdwYB9ZM,,,,,
Celery Juice - how to make it,NQBESY0o8EU,All-In-One Adventures,2025-02-23T17:14:07Z,https://www.youtube.com/watch?v=NQBESY0o8EU,,94,,,
Omega NC900 Straight Celery Juice,8uxWlBd0gzU,Mark Thain,2025-03-22T13:45:41Z,https://www.youtube.com/watch?v=8uxWlBd0gzU,,142,,,
"""5 Health & Beauty Benefits of Drinking Celery Juice | Get Your Glow On!""",4vkr5Jm1N94,Go Get Glowing,2025-03-12T14:48:02Z,https://www.youtube.com/watch?v=4vkr5Jm1N94,"Looking for a natural way to boost your health and beauty? Celery juice might be the answer! In this video, we'll reveal 5 ...",,,,
Chug down 32oz Celery Juice:Set timer 30 min:Flush&Support your Liver daily:Loving My Body Back :-),TQgUO7n5TkM,Shirley Itza Chan,2025-03-02T01:59:34Z,https://www.youtube.com/watch?v=TQgUO7n5TkM,,16,,,
Take Heavy Metal Detox Smoothie 30 min after your celery juice to get out those toxic heavy metals,cbE-LMyPFcY,Shirley Itza Chan,2025-03-06T01:49:00Z,https://www.youtube.com/watch?v=cbE-LMyPFcY,,,,,
#celery green juice #greenjuice #healthylifestyle,FcZN7CHmh1Y,Gracie,2025-03-23T21:36:16Z,https://www.youtube.com/watch?v=FcZN7CHmh1Y,,14,,,
Take Heavy Metal Detox Smoothie 30 min after your celery juice to get out those toxic heavy metals,cbE-LMyPFcY,Shirley Itza Chan,2025-03-06T01:49:00Z,https://www.youtube.com/watch?v=cbE-LMyPFcY,,16,,,
#celery green juice #greenjuice #healthylifestyle,FcZN7CHmh1Y,Gracie,2025-03-23T21:36:16Z,https://www.youtube.com/watch?v=FcZN7CHmh1Y,,,,,
The Impact of Celery Juice on Adriana Lima's Skin Radiance,-p3DohWL_xo,NutriAnatomy,2025-01-29T01:00:00Z,https://www.youtube.com/watch?v=-p3DohWL_xo,"Explore how celery juice contributes to Adriana Lima's skin radiance through hydration, detox benefits, and potential digestive ...",,,,
How to make Medical Medium celery juice suitable for storing 24 hours,6_UVQlMmRxI,The Secret to Natural Healing,2025-01-26T13:55:56Z,https://www.youtube.com/watch?v=6_UVQlMmRxI,"According to Anthony William, celery juice made with a masticating juicer retains its medicinal properties for up to 24 hours if ...",,,,
I Started Drinking Celery Juice Everyday and this Happened,pHpAUIqIagg,Simon Calnan,2025-03-25T18:48:46Z,https://www.youtube.com/watch?v=pHpAUIqIagg,I started drinking Celery juice everyday as I was having a skin issue. It fixed it in a week. Do you juice celery? How has it helped ...,,27,0,0
"Anti-Inflammatory Juice Recipe: Apples, Ginger, Celery & Pineapple for Total Body Relief! 🌿🍍",PDffwwT2yZ4,Roots & Remedies,2025-01-29T21:48:11Z,https://www.youtube.com/watch?v=PDffwwT2yZ4,"Feeling bloated, achy, or just off? Inflammation could be the culprit! This powerful anti-inflammatory juice recipe, made with apples ...",185,,,
Celery juice #healthy,BEbOES7aUjA,Anushka Sharma,2025-01-28T05:47:07Z,https://www.youtube.com/watch?v=BEbOES7aUjA,,,,,
Cleanse Your Liver Naturally  Celery Juice Benefits,Uz1NA0TuMRo,thefoodbeautifullife,2025-01-13T16:28:18Z,https://www.youtube.com/watch?v=Uz1NA0TuMRo,"Discover the incredible power of apigenin, a flavonoid found in celery! This powerful antioxidant not only helps improve blood ...",44,,,
"Fat burner #juice #vitamin A & B, #celeryjuice #bloodpressurecontrol  #ldlcholesterol #chia",ssqU0e8YKzE,Keta Fit Tube: 1M,2025-03-20T17:17:15Z,https://www.youtube.com/watch?v=ssqU0e8YKzE,,,,,
"How-to: Celery Juice. I healed myself of a painful  “incurable” disorder, called IC. #celeryjuice",-0solqrY_-I,Hartwell,2025-02-26T01:10:57Z,https://www.youtube.com/watch?v=-0solqrY_-I,,,,,
"Day in my life, let’s work out and celery juice 👏🙌#lifestyle #mylifestyleandmyfamilylife",t7hE9UdaHwc,Serwaa's world,2025-02-13T13:01:15Z,https://www.youtube.com/watch?v=t7hE9UdaHwc,"Day in my life, let's work out and celery juice     Thank you for watching please like, comment subscribe ...",,,,
Celery Juice,RHH2PgS3ktM,Mark Ace Estrella Mabini,2025-02-13T23:43:07Z,https://www.youtube.com/watch?v=RHH2PgS3ktM,Celery Juice VISIT & FOLLOW MY FB PAGE https://www.facebook.com/axlmabini/ TIKTOK ...,226,,,
7-Day Celery Juice Challenge: What Happens?  #CeleryJuice #HealthBenefits #WellnessJourney,fetKYlEWdPk,Honed Fettle,2025-02-24T20:58:09Z,https://www.youtube.com/watch?v=fetKYlEWdPk,What happens when you drink celery juice for 7 days? Discover the surprising health benefits packed in this refreshing drink!,,,,
“Celery Juice: The Ultimate Detox Drink! 🥒✨ #HealthyLiving”,cuLoT6X0qeM,Tracy coker tv,2025-03-09T11:28:02Z,https://www.youtube.com/watch?v=cuLoT6X0qeM,,,,,
Fresh Celery with Brocolli juice for our patient Having Kidney Problem #trendingshorts  #ketojuice,sm2BW4rNy1U,Belo78,2025-03-23T07:58:51Z,https://www.youtube.com/watch?v=sm2BW4rNy1U,,23,,,
"A juice extractor that can make celery juice is a true, top-notch juice extractor. #shorts",dByI_3j3lDo,Gift Genius Deals,2025-03-02T14:48:07Z,https://www.youtube.com/watch?v=dByI_3j3lDo,"Amazon Finds & Product Reviews Thank you SO MUCH for 10k subs ❤️ Mgmt: briantuyen2802@gmail.com 1,5k on TikTok ...",15,,,
ASMR green juice - liver detox - green juice - celery juice,ZC3th_VtXtY,TurmericandPepperTales,2025-02-20T17:09:15Z,https://www.youtube.com/watch?v=ZC3th_VtXtY,green juice detoxification #liver cleanse #liverhealth #glowingskin #greenjuice #naturalloverdetox #detoxification #shorts.,103,,,
"I Drank Turmeric, Ginger, Cucumber And Celery Juice For 2 Weeks, This Is What Happened  #health",46WJJdOxFPo,Advice For Elderly,2025-03-20T22:15:37Z,https://www.youtube.com/watch?v=46WJJdOxFPo,"2-Week Transformation: I Drank Turmeric, Ginger, Cucumber, and Celery Juice Every Day! | Detox, Weight Loss, Energy Boost"" ...",,,,
Is it good to drink celery juice every morning? #putyourhealthfirst #dailyduediligence,Z_KuMIKVaZo,P.S. Wilson,2025-01-24T13:36:11Z,https://www.youtube.com/watch?v=Z_KuMIKVaZo,,,,,
#TLC #sassysmoothies #applesong  #celeryjuice #healthy #healthylifestyle #cucumber #ginger,GXFp4O6RabQ,BODYTALKfit,2025-02-04T00:29:00Z,https://www.youtube.com/watch?v=GXFp4O6RabQ,,,,,
March is National Celery Month. Ready for daily celery content this month? #celery #content #shorts,rVl3Fm89Pc4,Celery Content,2025-03-01T22:30:49Z,https://www.youtube.com/watch?v=rVl3Fm89Pc4,,10,,,
Celery juice for gut health and blood sugar#celeryjuice #healthbenefits #detox,uyYv0gyuJSY,Julieta Cavalcanti Cunha,2025-03-28T03:00:52Z,https://www.youtube.com/watch?v=uyYv0gyuJSY,Daily celery juice helps reduce inflammation and regulate blood sugar levels.#celeryjuice #healthbenefits #detox #inflammation ...,,,,
If a man drank celery and apple juice?,Q5G0fwY2g4A,Health Hub Shorts,2025-01-24T22:05:00Z,https://www.youtube.com/watch?v=Q5G0fwY2g4A,,,,,
Where To Purchase Celery Juice? - Beverage Buff,_XbUY2zdY0Y,BeverageBuff,2025-01-18T21:19:45Z,https://www.youtube.com/watch?v=_XbUY2zdY0Y,"Where To Purchase Celery Juice? In this video, we'll guide you through some excellent options for purchasing celery juice, ...",111,,,
📌 Top 10 Reasons You Should Be Drinking Celery Juice on an Empty Stomach! (+ 2 Bonus Benefits!),LI2ZepSVm8A,From The Earth Medicine ,2025-02-19T03:23:22Z,https://www.youtube.com/watch?v=LI2ZepSVm8A,Ever wondered why celery juice is all the rage? Here are 10 powerful reasons why drinking celery on an empty stomach can ...,,,,
Cilantro Parsley celery green apple juice,TTiaLAch25A,Cassie’s Way,2025-01-28T18:30:07Z,https://www.youtube.com/watch?v=TTiaLAch25A,,190,,,
