Title,Video ID,Channel,Published At,URL,Description,Video Length,Views,Likes,Comments
"""Heal your gut naturally! Managing Crohn’s with the right care can improve your well-being. 🌿💚""",_4Udya5yMUo,Dr.Rajeev's Homeopathy Clinic,2025-03-24T13:24:49Z,https://www.youtube.com/watch?v=_4Udya5yMUo,"Crohn's Disease: Understanding & Natural Care Crohn's disease is a chronic inflammatory condition of the digestive tract, ...",66,,,
How to Cure PCOD Naturally in Telugu | Sukheebhava Hospital #pcod #pcodproblem #shorts #telugushorts,Fn9TmqrJEBk,Madhavbaug Ayurvedic Hospital,2025-03-20T09:44:39Z,https://www.youtube.com/watch?v=Fn9TmqrJEBk,How to Cure PCOD Naturally || Sukheebhava Hospital #pcod #pcodproblem #shorts #telugushorts #pcod #pcodtreatment ...,48,,,
Causes Of Guillain Barre Syndrome | How To Cure Nerve Weakness Naturally | GBS | Renova,zTAbUZ5kqxg,RENOVA HOSPITALS,2025-03-22T14:11:10Z,https://www.youtube.com/watch?v=zTAbUZ5kqxg,Causes Of Guillain Barre Syndrome | How To Cure Nerve Weakness Naturally | GBS | Renova #guillainbarresyndrome #gbs ...,172,,,
How To Get Rid Of H Pylori Bacteria Naturally? - Biology For Everyone,CIohY7-OHn0,Biology for Everyone,2025-01-17T18:18:42Z,https://www.youtube.com/watch?v=CIohY7-OHn0,"How To Get Rid Of H Pylori Bacteria Naturally? In this informative video, we will discuss various natural methods to address H.",165,,,
How to Use Castor Leaves for Rheumatism & Joint Pain Relief#CastorLeaves #healthtips #PainRelief,-7JbOST9WIE,Okoh Chinenye Harriet,2025-03-13T13:06:26Z,https://www.youtube.com/watch?v=-7JbOST9WIE,How to Use Castor Leaves for Rheumatism & Joint Pain Relief#CastorLeaves #healthtips #painrelief Are you struggling with joint ...,46,,,
How to Cure Piles Naturally? | Quick Relief Tips! #drmongaclinic,yollBj-XV6E,"Dr Monga Ayurvedic Clinic, Amritsar & Ayurgrow ",2025-03-15T11:40:33Z,https://www.youtube.com/watch?v=yollBj-XV6E,"Suffering from piles? Don't worry! Here's a quick guide to relieve pain, reduce swelling, and heal naturally. Follow these ...",61,,,
Cure Oligospermia NATURALLY with Dr. Nizamuddin Qasmi's Herbal Medicine?,K3QKKMfZ_og,Saira Health Care,2025-03-09T06:12:46Z,https://www.youtube.com/watch?v=K3QKKMfZ_og,,55,,,
*Cure Azoospermia Naturally with Dr Nizamuddin Qasmi's Medicine?*,tzWrTeDJs6E,Saira Health Care,2025-03-26T09:11:09Z,https://www.youtube.com/watch?v=tzWrTeDJs6E,,60,,,
Bad Breath Cure Naturally – Homeopathy Remedies That Work!  মুখের দুর্গন্ধ দূর করার উপায়,yuJqJtB6Gv8,Dr Panchumi Mukherjee,2025-02-13T12:30:58Z,https://www.youtube.com/watch?v=yuJqJtB6Gv8,"Bad breath can be embarrassing and frustrating, but did you know that homeopathy offers a natural and effective cure?",218,,,
"""Soothe itchy hives naturally! Know the triggers, stay calm, and heal the skin with care. 🌿✨""",vArIhJTE_wE,Dr.Rajeev's Homeopathy Clinic,2025-03-29T13:23:48Z,https://www.youtube.com/watch?v=vArIhJTE_wE,"Hives (urticaria) are red, itchy welts caused by allergic reactions, stress, or infections. Natural remedies and lifestyle changes can ...",195,,,
Cranberry Cure Prevent UTIs & Boost Heart Health Naturally!,s1X4qp2Ec-s,Botanify,2025-03-13T00:15:07Z,https://www.youtube.com/watch?v=s1X4qp2Ec-s,Cranberry Cure: Prevent UTIs & Boost Heart Health Naturally! Tired of dealing with UTIs or concerned about heart disease?,60,,,
Ringworm Treatment at Home in Tamil | Home Remedies for Ringworm Cure | Natural Solution - INTAMIZH,IsIx5kEafWo,Intamizh,2025-03-12T16:31:06Z,https://www.youtube.com/watch?v=IsIx5kEafWo,Ringworm Treatment at Home in Tamil | Home Remedies for Ringworm Cure | Natural Solution - INTAMIZH Are you struggling ...,187,,,
"""CURE DIARRHOEA NATURALLY! Siddha's Powerful Remedy to Stop Diarrhoea Fast"" #loosemotion",pB4jG9UKZyo,Chella Siddha Clinic,2025-01-26T04:45:04Z,https://www.youtube.com/watch?v=pB4jG9UKZyo,For appointments ; https://wa.me/message/4ZAMUJMSVDBJN1 #DiarrhoeaRelief #SiddhaRemedy #NaturalCure #InstantRelief ...,31,,,
100 days challenge | Boost Immunity to Combat Kidney Failure & Diabetes Naturally! |  #shorts,5y-QbAmMlCQ,Snpkart,2025-03-02T14:12:21Z,https://www.youtube.com/watch?v=5y-QbAmMlCQ,Welcome to SNP World. We have cured more than lakhs of diseases with Sembavala Panam. It is 100% natural and no side ...,28,,,
D | how to cure kidney disease naturally |  #shorts,sNWxjoygcvs,Snpkart,2025-01-07T14:39:47Z,https://www.youtube.com/watch?v=sNWxjoygcvs,Welcome to SNP World. We have cured more than lakhs of diseases with Sembavala Panam. It is 100% natural and no side ...,29,,,
Motion sickness | Try this natural treatment and see Instant relief #acupressure #natural #shorts,2hZ0yH7qnpc,Dr. Sushma Choudhary,2025-01-05T13:11:19Z,https://www.youtube.com/watch?v=2hZ0yH7qnpc,"Discover the most effective **natural remedies for motion sickness** with Dr. Sushma. Whether you're traveling by car, plane, ...",40,,,
Cure Toenail Fungus Naturally | Powerful Home Remedy | Panchayu,nrjqnNeMznM,PanchAyu,2025-02-28T16:01:02Z,https://www.youtube.com/watch?v=nrjqnNeMznM,"Toenail fungal infections can be frustrating, causing discoloration, thickening, and even separation from the nail bed. Instead of ...",214,,,
Cure Insomnia & Beat Depression Naturally! | Vedic Upchar | Anil Bansal | #sleep #depression #shorts,HN2086RzW1o,Vedic Upchar,2025-03-19T09:30:08Z,https://www.youtube.com/watch?v=HN2086RzW1o,Cure Insomnia & Beat Depression Naturally! | Vedic Upchar | Anil Bansal | #sleep #depression #shorts Are you struggling with ...,29,,,
Natural Treatment: Cure Your Miserable Condition,z5orFUTzPec,Dr. Vikki Petersen,2025-02-11T17:30:13Z,https://www.youtube.com/watch?v=z5orFUTzPec,"Discover natural treatment options for a better life! We share inspiring advice and hope, showing you how treatable your condition ...",16,,,
4 Natural Cures to Boost Your Immune System – DIY Herbal Remedies for Cold & Flu #naturalremedies,IWNFkuaGpJU,Diabetes Holistic Health,2025-02-10T10:00:19Z,https://www.youtube.com/watch?v=IWNFkuaGpJU,"You're making a HUGE mistake! 99% of people ignore this IMMUNITY HACK, but it can change your life. In this video, we ...",53,,,
Cure Insomnia & Beat Depression Naturally! | Vedic Upchar | Anil Bansal | #sleep #depression #shorts,GUz6tyrchQw,Anil Bansal,2025-03-19T11:30:15Z,https://www.youtube.com/watch?v=GUz6tyrchQw,Cure Insomnia & Beat Depression Naturally! | Vedic Upchar | Anil Bansal | #sleep #depression #shorts Are you struggling with ...,29,,,
Manage IBS Naturally with Ayurveda | Consult an Ayurvedic Doctor from NirogStreet,vyIwqcTD2Fg,NirogStreet Ayurveda,2025-03-22T06:10:18Z,https://www.youtube.com/watch?v=vyIwqcTD2Fg,"Irritable Bowel Syndrome (IBS) is a common digestive disorder that causes symptoms like abdominal pain, bloating, and changes ...",36,,,
Meet the Tribal Healer Treating 117 Diseases Naturally | Hari Pangi’s Story,kGzAsCvIP8E,VideoVolunteers,2025-03-21T15:30:16Z,https://www.youtube.com/watch?v=kGzAsCvIP8E,"In the remote village of Tentuliguda, nestled within the Semiliguda block of Koraput district, Tribal Vaidya Hari Pangi is keeping an ...",229,,,
Ayurvedic Cure for Cold & Cough with 3 Simple Ingredients | Vedic Upchar | Anil Bansal | #shorts,h0tRj2mgLf8,Anil Bansal,2025-03-26T11:30:26Z,https://www.youtube.com/watch?v=h0tRj2mgLf8,Ayurvedic Cure for Cold & Cough with 3 Simple Ingredients | Vedic Upchar | Anil Bansal | #shorts Suffering from cold and cough?,30,,,
Struggling with Eczema? Find the Best Natural Relief and Ayurvedic Treatments for Eczema,2p1k-rGz4xQ,Vaidya Healthcare Ayurveda,2025-01-21T05:04:42Z,https://www.youtube.com/watch?v=2p1k-rGz4xQ,Struggling with Eczema? Find the best natural relief with Ayurvedic Treatments for Eczema at Vaidya Healthcare. Heal your ...,40,,,
How to Treat Skin Allergy Naturally at Home | Vedic Upchar | Anil Bansal | #skincare #shorts,rmpo6YF_S28,Anil Bansal,2025-03-12T11:30:29Z,https://www.youtube.com/watch?v=rmpo6YF_S28,How to Treat Skin Allergy Naturally at Home | Vedic Upchar | Anil Bansal | #skincare #shorts Natural Remedy for Skin Allergies ...,26,,,
Healing Pancreas Naturally with Homeopathy – A Success Story by Dr. Abdequaem Chimthanawala,di6aBqnZJzA,Dr. Abdequaem's GraceHealing Homoeopathy,2025-02-13T14:51:31Z,https://www.youtube.com/watch?v=di6aBqnZJzA,Healing Pancreas Naturally with Homeopathy – A Success Story by Dr. Abdequaem Chimthanawala** Pancreatic health is ...,34,,,
Control Diabetes Naturally! 9 Secret Herbs #herbs  #diabetescare #herbalremedies,6OjzVvNlmaQ,ANIRBAN BISWAS CLINIC FOR DIABETES,2025-03-05T12:10:05Z,https://www.youtube.com/watch?v=6OjzVvNlmaQ,Looking for natural ways to control diabetes? These 9 powerful herbs can help regulate blood sugar levels and improve insulin ...,60,,,
Ovarian Cyst Treatment with Ayurveda 🏵️ | Best Natural Cure for PCOS | Ayurvedic Remedies 🌿 #shorts,AloCLiQ1MRc,Dr Anupama Sharma 89k view ,2025-02-20T12:29:06Z,https://www.youtube.com/watch?v=AloCLiQ1MRc,"Ovarian Cyst Treatment with Ayurveda | If you're struggling with ovarian cysts or PCOS, Ayurveda offers natural remedies that ...",56,,,
How to cure diabetes naturally | Best treatment to reduce blood sugar and control diabetes | #shorts,ZaR3P1ozdQw,Snpkart,2025-03-12T11:34:10Z,https://www.youtube.com/watch?v=ZaR3P1ozdQw,Welcome to SNP World. We have cured more than lakhs of diseases with Sembavala Panam. It is 100% natural and no side ...,58,,,
Natural Ways to Boost Hemoglobin During Pregnancy! 🌸 #MaternalHealth,WM1HjMj-AQg,Sampoorna Fertility,2025-01-23T04:30:26Z,https://www.youtube.com/watch?v=WM1HjMj-AQg,Did you know? Hemoglobin deficiency is common in pregnant women and can lead to complications if ignored. This Maternal ...,23,,,
"CURE NATURALLY - SPONDYLITIS, SLIP DISC sciatica, Sacroilitis, Knee Pain, Back pain , ACHILES heel",ZnQn2jnT6Ys,HEALING HANDS & TRUE HEALTH CARE,2025-02-22T15:34:05Z,https://www.youtube.com/watch?v=ZnQn2jnT6Ys,Ranchi aur Bokaro mein.... Crop tractor neurotherapy advance acupressure physiotherapy patali therapy cupping therapy ...,17,,,
Boost Immunity Naturally Without Medicine?  | Vedic Upchar | Anil Bansal | #healthyliving #shorts,HgYlHM1Cyig,Anil Bansal,2025-03-31T12:30:13Z,https://www.youtube.com/watch?v=HgYlHM1Cyig,Boost Immunity Naturally Without Medicine? | Vedic Upchar | Anil Bansal | #healthyliving #shorts Want to stay healthy naturally ...,54,,,
How To Cure Vertigo Naturally With Herbal Remedies !!,8tQlxbRTtSY,Healthy Life,2025-02-05T02:09:18Z,https://www.youtube.com/watch?v=8tQlxbRTtSY,How To Cure Vertigo Naturally With Herbal Remedies !! Please Enable Subtitles In Your Language In ⚙️ Settings ❗ Remember ...,212,,,
Naturally Ayurvedic Cure for Psoriasis( సహజమైన ఆయుర్వేద చికిత్స సోరియాసిస్ కోసం),wmf4ipdZqLs,Lotus Siddha Ayurveda ,2025-01-20T14:55:35Z,https://www.youtube.com/watch?v=wmf4ipdZqLs,"Psoriasis is a skin condition where skin cells multiply up to 10 times faster than normal, leading to red, scaly patches on areas like ...",73,,,
How to cure PCOS & PCOD naturally #shortsviral,HeiBTE-QHhQ,The Satyaa Show | An Odia Podcast,2025-01-15T18:57:45Z,https://www.youtube.com/watch?v=HeiBTE-QHhQ,How to cure PCOS & PCOD #shortsviral.,61,,,
How to cure Lipoma Naturally at Home  #homeremedies #lipoma #shorts #viralshorsts,o0MWzn2fss8,Health Coach Pankaj  स्वास्थ ही जीवन है ,2025-01-06T12:02:00Z,https://www.youtube.com/watch?v=o0MWzn2fss8,,49,,,
From Dialysis Fear to Hope: How Uveda Nephro Panchamrit & Plus Helped Reduce Creatinine! #review,jkhJMcD8m4A,Uveda Naturals,2025-03-07T07:39:37Z,https://www.youtube.com/watch?v=jkhJMcD8m4A,"When dialysis seemed like the only option, Uveda Nephro Panchamrit & Plus brought new hope! This powerful Ayurvedic ...",47,,,
Ayurvedic Cure for Sinusitis / How to Treat Sinusitis Naturally / Sinusitis Treatment in Ayurveda,gY9CbiIneUw,Om Holistic Centre,2025-02-17T13:06:58Z,https://www.youtube.com/watch?v=gY9CbiIneUw,Ayurvedic Cure for Sinusitis / How to Treat Sinusitis Naturally / Sinusitis Treatment in Ayurveda @DrHarshaBhorhari Ayurvedic ...,51,,,
Best detox to cure thyroid disease naturally || weight loss detox drink #dtyamini,8CAP5NMdEbQ,Dt YAMINI CHANDRA KALER,2025-02-05T14:51:56Z,https://www.youtube.com/watch?v=8CAP5NMdEbQ,thyroid #weightloss #diet #tips #weightlosstips #hypothyroid #cure #ayurveda #dietitian #newshorts #shorts #youtubeshorts.,11,,,
R48 Asthma Treatment Naturally | How Reckeweg R48 Can Help ?,6wEC0ADAWoY,Sunny Health Capsule,2025-01-18T11:30:04Z,https://www.youtube.com/watch?v=6wEC0ADAWoY,R48 Asthma Treatment Naturally | How Reckeweg R48 Can Help ? Asthma treatment naturally Reckeweg R48 for asthma Natural ...,16,,,
Beat the Cold Naturally #youtubeshorts #shorts,Ie6dU4VWCKY,ArNAis Lifestyle,2025-01-08T17:01:48Z,https://www.youtube.com/watch?v=Ie6dU4VWCKY,Welcome to my youtube channel ArNAis lifestyle !! #indian #youtubeshorts #food Welcome to Go Greens! Your ultimate ...,31,,,
Top Iron-Rich Foods to Cure Anemia Naturally! 🩸🥦 | Boost Your Hemoglobin Fast! 🚀 #AnemiaCure,WX8XUIjD2pY,Dr Ayesha Naveed,2025-01-29T15:09:18Z,https://www.youtube.com/watch?v=WX8XUIjD2pY,Top Iron-Rich Foods to Cure Anemia Naturally! | Boost Your Hemoglobin Fast! #AnemiaCure #IronRichFoods.,34,,,
How to Cure Cold and Cough Fast in Winter | Naturally,m5RVwYShxgQ,Suman HITFIT,2025-01-11T03:30:31Z,https://www.youtube.com/watch?v=m5RVwYShxgQ,"Winter season can bring more than just chilly weather—it often means dealing with cold and cough. In this video, we share natural ...",175,,,
How to Cure Depression & Sleep Issues Naturally at Home | Vedic Upchar | Anil Bansal | #shorts,7ffFdXJk56w,Anil Bansal,2025-03-13T11:30:05Z,https://www.youtube.com/watch?v=7ffFdXJk56w,How to Cure Depression & Sleep Issues Naturally at Home | Vedic Upchar | Anil Bansal | #shorts Are you struggling with ...,40,,,
Cure Diabetes Naturally – No Medicine Needed | #shorts #facts,P1ZyNoGG5_U,Dr. Raja Shad,2025-03-19T17:58:09Z,https://www.youtube.com/watch?v=P1ZyNoGG5_U,"Diabetes is NOT a disease! It's a lifestyle problem that can be reversed naturally. Stop consuming sugar and added sugars, eat ...",110,,,
How to Control Diabetes Naturally | Fenugreek Seeds & Curd for Blood Sugar | Vayu News Telugu,kOB5kUWXOc0,Vayu News,2025-03-03T02:15:02Z,https://www.youtube.com/watch?v=kOB5kUWXOc0,Vayunews #vayunewstelugu #controldiabetes #diabetesremedy #bloodsugarcontrol #naturaldiabetescare #fenugreekforhealth ...,14,,,
Healing Hematoma with Homoeopathy naturally and gently | Dr. Abdequaem,myvMyyEBZxo,Dr. Abdequaem's GraceHealing Homoeopathy,2025-03-20T17:01:47Z,https://www.youtube.com/watch?v=myvMyyEBZxo,HealthwithHomoeopathy #SaluteHomoeopathy support #Homoeopathy4Health Salute to our Master Dr. Samuel Hahnemann ...,48,,,
Piles can be treated naturally!,JxXyJE3INaw,Dr Srikant Morlawar,2025-03-30T18:30:30Z,https://www.youtube.com/watch?v=JxXyJE3INaw,"Discomfort, itching, and pain from piles (hemorrhoids) can affect your daily life. Homeopathy helps reduce inflammation, relieve ...",43,,,
"""Heal your gut naturally! Managing Crohn’s with the right care can improve your well-being. 🌿💚""",_4Udya5yMUo,Dr.Rajeev's Homeopathy Clinic,2025-03-24T13:24:49Z,https://www.youtube.com/watch?v=_4Udya5yMUo,"Crohn's Disease: Understanding & Natural Care Crohn's disease is a chronic inflammatory condition of the digestive tract, ...",66,,,
"Heal Your Gut Naturally: Top Foods, Tips, & Secrets for a Healthy Microbiome & Weight Loss",8iaWP3gmzhQ,Dr Gooddeed,2025-01-05T12:30:07Z,https://www.youtube.com/watch?v=8iaWP3gmzhQ,"Ready to transform your health from the inside out? Your gut is the gateway to your overall well-being! In this video, Dr. Nivedita ...",19,,,
🌿 Heal Lifestyle Disorders Naturally! 🌿,ezBAC8-th8I,Yukti Herbs,2025-01-21T11:40:38Z,https://www.youtube.com/watch?v=ezBAC8-th8I,Did you know? Even modern medicine doctors agree that conditions like: ✔️ Diabetes ✔️ Thyroid Issues ...,43,,,
Cervical Dystonia & Neck Pain – Treat it Naturally with Homeopathy,1hvQPuNPMp0,Dr Kamlesh Kakde,2025-03-09T10:08:04Z,https://www.youtube.com/watch?v=1hvQPuNPMp0,"Ved Homeopathy Clinic | Call: 9975116983 Address: Plot No. 354, G-1, Meeraj Heights, Lady Amritbai Daga ...",47,,,
Healing Fatty Liver Naturally with Homeopathy – A Success Story by Dr. Abdequaem Chimthanawala,jdV-uJyPrXg,Dr. Abdequaem's GraceHealing Homoeopathy,2025-02-11T15:26:25Z,https://www.youtube.com/watch?v=jdV-uJyPrXg,Healing Fatty Liver Naturally with Homeopathy – A Success Story by Dr. Abdequaem Chimthanawala Fatty Liver can lead to ...,28,,,
How Ayurveda Treats Blocked Fallopian Tubes Naturally | Blessed Ayurveda,rUPupupJtAM,Blessed Ayurveda Hospital,2025-03-15T13:41:29Z,https://www.youtube.com/watch?v=rUPupupJtAM,"Struggling with blocked fallopian tubes? At Blessed Ayurveda, we specialize in natural Ayurvedic treatments for infertility.",75,,,
How to Cure PCOD Naturally in Telugu | Sukheebhava Hospital #pcod #pcodproblem #shorts #telugushorts,Fn9TmqrJEBk,Madhavbaug Ayurvedic Hospital,2025-03-20T09:44:39Z,https://www.youtube.com/watch?v=Fn9TmqrJEBk,How to Cure PCOD Naturally || Sukheebhava Hospital #pcod #pcodproblem #shorts #telugushorts #pcod #pcodtreatment ...,48,,,
Pre-Diabetic? Balance Your Insulin Naturally with This Diabetic-Infusion Tonic 🍋,PGGH8f70DY0,Dt. Manpreet Kalra,2025-02-26T09:02:19Z,https://www.youtube.com/watch?v=PGGH8f70DY0,Pre-Diabetic? Balance Your Insulin Naturally with This Diabetic-Infusion Tonic | Easy Home Remedy for Insulin Resistance ...,57,,,
Causes Of Guillain Barre Syndrome | How To Cure Nerve Weakness Naturally | GBS | Renova,zTAbUZ5kqxg,RENOVA HOSPITALS,2025-03-22T14:11:10Z,https://www.youtube.com/watch?v=zTAbUZ5kqxg,Causes Of Guillain Barre Syndrome | How To Cure Nerve Weakness Naturally | GBS | Renova #guillainbarresyndrome #gbs ...,172,,,
How to Use Castor Leaves for Rheumatism & Joint Pain Relief#CastorLeaves #healthtips #PainRelief,-7JbOST9WIE,Okoh Chinenye Harriet,2025-03-13T13:06:26Z,https://www.youtube.com/watch?v=-7JbOST9WIE,How to Use Castor Leaves for Rheumatism & Joint Pain Relief#CastorLeaves #healthtips #painrelief Are you struggling with joint ...,46,,,
Cure Oligospermia NATURALLY with Dr. Nizamuddin Qasmi's Herbal Medicine?,K3QKKMfZ_og,Saira Health Care,2025-03-09T06:12:46Z,https://www.youtube.com/watch?v=K3QKKMfZ_og,,55,,,
PREVENT ALZHEIMER NATURALLY  NOW!,TvA4J1l3oSA,HealthShot Daily,2025-01-24T10:48:20Z,https://www.youtube.com/watch?v=TvA4J1l3oSA,Discover the powerful natural ways to prevent Alzheimer's disease and maintain a healthy brain. Learn how to reduce the risk of ...,48,,,
Elevated Liver Enzymes: Causes & Natural Ways to Lower Them! #LiverHealth #Detox #naturalhealing,W0ps_lZDFqA,NutraStride,2025-03-16T17:00:27Z,https://www.youtube.com/watch?v=W0ps_lZDFqA,"Elevated liver enzymes can be a sign of fatty liver, toxin overload, or inflammation. If you're feeling fatigued, experiencing bloating, ...",42,,,
Natural Eczema Relief| Healing Power of Ayurveda with Vaidya Health Care's Herbal Remedies,Bvos8_i4DdE,Vaidya Healthcare Ayurveda,2025-01-03T11:58:39Z,https://www.youtube.com/watch?v=Bvos8_i4DdE,"Eczema relief with Vaidya Ayurveda Health Care's natural treatments. Our Ayurvedic methods, featuring herbal remedies and ...",42,,,
*Cure Azoospermia Naturally with Dr Nizamuddin Qasmi's Medicine?*,tzWrTeDJs6E,Saira Health Care,2025-03-26T09:11:09Z,https://www.youtube.com/watch?v=tzWrTeDJs6E,,60,,,
Cervical Neck Pain? Here's How to Heal Naturally by chiropractor..!!!  #chiropracticadjustment,m5UOip-Hk1E,Dr Shubham Ajmani,2025-01-29T17:09:04Z,https://www.youtube.com/watch?v=m5UOip-Hk1E,"Are you struggling with cervical neck pain? In this video, a professional chiropractor shares natural and effective methods to help ...",28,,,
🔥 Reverse Fatty Liver Naturally in Just 15 Days! 🔥,98KT-YcZTIk,Jeeva Sanjeevana Natural Life,2025-02-01T14:00:08Z,https://www.youtube.com/watch?v=98KT-YcZTIk,Struggling with fatty liver? The right diet & lifestyle changes can melt liver fat naturally . Discover expert guidance from Shri R.,55,,,
PCOD ko naturally theek kare| pcod | PCOS | cyst | period me dard | weight loss | ovulation #pcod,AtI_BtTDEAQ,Dr. Sarika Verma,2025-02-25T15:55:39Z,https://www.youtube.com/watch?v=AtI_BtTDEAQ,,49,,,
"""Soothe itchy hives naturally! Know the triggers, stay calm, and heal the skin with care. 🌿✨""",vArIhJTE_wE,Dr.Rajeev's Homeopathy Clinic,2025-03-29T13:23:48Z,https://www.youtube.com/watch?v=vArIhJTE_wE,"Hives (urticaria) are red, itchy welts caused by allergic reactions, stress, or infections. Natural remedies and lifestyle changes can ...",195,,,
☘️ Ayurvedic Cure for Stomach Ulcer | Real Patient Recovery Story #ayurveda #ulcers #stomachcancer,xL3jtyGNF4w,Yogtirth Ayurved,2025-02-08T13:57:28Z,https://www.youtube.com/watch?v=xL3jtyGNF4w,Description: Can Ayurveda heal stomach ulcers naturally? YES! Watch this inspiring patient testimonial on how Ayurvedic ...,50,,,
The Natural Cure for Varicose Veins,bIuIriebGZc,Ayushmann Clinic,2025-01-15T03:30:31Z,https://www.youtube.com/watch?v=bIuIriebGZc,Welcome to SWASTHA AYUSHMANN CHIKISTHALAYA ! share and subscribe to stay updated on our healthcare latest videos.,36,,,
Gout relief naturally #uricacid #gout #goutrelief #healthyfood #doctor,AwozM4TxUt4,WellFit by Ravi,2025-02-05T14:54:06Z,https://www.youtube.com/watch?v=AwozM4TxUt4,"7How we can relief from gout? Gout relief starts with a healthy diet—avoid purine-rich foods like red meat, seafood, and alcohol ...",32,,,
Uterine Fibroids Treatment with Ayurveda | Natural Cure for Fibroids #Ayurveda #Fibroid #shorts,dMnOnzHk4Mk,Dr Anupama Sharma 89k view ,2025-02-19T12:28:31Z,https://www.youtube.com/watch?v=dMnOnzHk4Mk,Are you struggling with uterine fibroids? Discover the best Ayurvedic treatments to naturally shrink fibroids and balance hormones.,60,,,
Reckeweg R38 A Natural Remedy for Ovarian Cysts Relief | R38,1BxzcSjTpKs,Sunny Health Capsule,2025-01-08T12:30:01Z,https://www.youtube.com/watch?v=1BxzcSjTpKs,Reckeweg R38 A Natural Remedy for Ovarian Cysts Relief | R38 Reckeweg R38 Ovarian cyst treatment Natural remedy for ...,16,,,
Cure Your HEADACHES & MIGRAINES Naturally!  #personalgrowth #selfimprovement #90days10x,04rauKXMwPQ,Release Technique,2025-02-10T20:00:00Z,https://www.youtube.com/watch?v=04rauKXMwPQ,Cure Your HEADACHES & MIGRAINES Naturally! Go To: https://www.releasetechnique.com/ Use Coupon Code POD97 to save ...,49,,,
"💆‍♂️🌟 Experience relief and wellness, naturally.",QgbCVdjEgDM,Vaidya Ashwani Kumar Ayurvedacharya,2025-03-06T12:05:52Z,https://www.youtube.com/watch?v=QgbCVdjEgDM,"""Embrace the healing power of Ayurveda! Say goodbye to joint pain, skin troubles, and fatigue with our Seraphic Pain Oil and ...",58,,,
🌿 Ayurveda: The Natural Path to Healing!,4lW1qHf5ol0,"Shah Satnam Ji Speciality Hospitals, Sirsa",2025-03-25T06:06:18Z,https://www.youtube.com/watch?v=4lW1qHf5ol0,"Discover the power of ancient Ayurveda at Shah Satnam Ji Specialty Hospital, Sirsa, where holistic treatments bring balance and ...",56,,,
"""Healing Epilepsy Naturally by larisha ayurved.  🌿🧠""",SJrp_r9ffJ8,Larisha Ayurved,2025-02-13T13:13:01Z,https://www.youtube.com/watch?v=SJrp_r9ffJ8,The Ayurvedic Way to Balance Mind & Body! ✨ Did you know that epilepsy (Aparsmaar) is considered a Tridoshaja disorder in ...,92,,,
"Cure Autoimmune Diseases Naturally - Full Masterclass by Dr. Prashanthi Atluri, (Holistic Healer)",j9eCsnMqdRQ,Wellcure,2025-03-12T13:04:04Z,https://www.youtube.com/watch?v=j9eCsnMqdRQ,"Tired of the medicines, arthritis pain, psoriasis struggles or thyroid weight issues? Watch this comprehensive video to gain ...",110,,,
LIFE CHANGING THYROID SUPPORT.  #natural #ayurveda #herbal #nosideeffect,_VutSIzzH7M,shivajeeva ayurveda ,2025-02-16T06:54:31Z,https://www.youtube.com/watch?v=_VutSIzzH7M,https://shivajeevaayurveda.com/product/thyroid-powder/ Watch this inspiring testimonial from our customer as they share their ...,58,,,
How to cure psoriasis naturally at home | Vedic Upchar | #skincare  #psoriasis #viralvideo #video,Smv5CoWO1xo,Vedic Upchar,2025-02-10T13:30:20Z,https://www.youtube.com/watch?v=Smv5CoWO1xo,How to cure psoriasis naturally at home | Vedic Upchar | #skincare #psoriasis #viralvideo #video Description: Welcome to our ...,140,,,
Reverse Fatty Liver Naturally – Best Foods for Liver Detox & Healing!,WRy7e95ZNqg,Nidhi Kakar,2025-02-04T00:00:27Z,https://www.youtube.com/watch?v=WRy7e95ZNqg,"Can you reverse fatty liver disease naturally? YES! Nearly 25% of the global population is affected by fatty liver disease, but the ...",7,,,
How to cure High Prolactin Naturally boost ovulation to get pregnant faster/Home Remedy,ytJYipYhcAw,Patilicious Tv,2025-03-07T17:13:16Z,https://www.youtube.com/watch?v=ytJYipYhcAw,How to cure High Prolactin Naturally boost ovulation to get pregnant faster. #everyone #trendingvideo #highlightseveryone ...,197,,,
"""🌿 Heal naturally with homeopathy! No side effects, just results. Watch now! 💊 #Homeopathy #Shorts""",ptyjRltbqAY,HOMEOPATHIC SOLUTIONS,2025-02-01T10:04:46Z,https://www.youtube.com/watch?v=ptyjRltbqAY,Welcome to Homeopathic Solutions | Dr. Shailendra Srivastava ✓ Discover Your Health Potential with Homeopathy! Are you ...,60,,,
Natural Thyroid Fix: Ayurvedic Solutions for Women’s Hormonal Balance,D7zmhSYDQms,Dr. Madhuri Ayurveda Expert,2025-02-13T15:54:17Z,https://www.youtube.com/watch?v=D7zmhSYDQms,"Are thyroid issues like fatigue, weight gain, or mood swings disrupting your life? For women, thyroid health is crucial, and ...",58,,,
