Title,Video ID,Channel,Published At,URL,Description,Video Length,Views,Likes,Comments
"Hangover juice hack: beets, carrots, apple, spinach, celery! #juice",2GiNbtMs8qE,Arnold Harris,2025-03-31T18:14:42Z,https://www.youtube.com/watch?v=2GiNbtMs8qE,"Juice hack: beets, carrots, spinach blend #juice #foodie #foodies #fok #cookingathome.",59,,,
Want to add more nutrients to your diet effortlessly? Fresh vegetable juices could be a game changer,JfAhCjn-Gf4,All That Matters Podcast,2025-03-31T14:30:07Z,https://www.youtube.com/watch?v=JfAhCjn-Gf4,,72,,,
How to make Celery juice #bloatedstomach #clearskin #celeryjuicechallenge,hsrZPcE7dKQ,waridi emiliani,2025-03-30T06:21:20Z,https://www.youtube.com/watch?v=hsrZPcE7dKQ,,61,,,
Favorite part of my nurse morning routine is making cold pressed celery juice,V85vJSpT8X0,Christine ,2025-03-30T00:55:26Z,https://www.youtube.com/watch?v=V85vJSpT8X0,,32,,,
Filipino dish(Dinakdakan)with cucumber side dish and celery juice,sTJXjynRDf8,Foodtrip,2025-03-30T00:46:00Z,https://www.youtube.com/watch?v=sTJXjynRDf8,,18,,,
The Unexpected Risks of Excessive Celery Juice Consumption,m8JLqxLKZxw,BEHIND WHAT WE EAT,2025-03-30T00:00:40Z,https://www.youtube.com/watch?v=m8JLqxLKZxw,"Explore the surprising health impacts of consuming too much celery juice, uncovering unexpected digestive issues and nutrient ...",56,,,
CELERY JUICE! ANTIINFLAMMATORY ANTIAGING ANTIOXIDANT,MangwnNB9fE,Drcorassa raw food nutrition,2025-03-27T22:00:17Z,https://www.youtube.com/watch?v=MangwnNB9fE,"Dr. Corassa, is a brazilian nutritionist, raw foodist and a nature hygienist for almost two decades!. Has published 10 books on ...",56,,,
THAT'S WHAT HAPPENS TO YOUR BODY IF YOU DRINK CELERY JUICE FOR 7 DAYS! #celery #shorts,IpBWPlKCgoE,HealthMoment2u,2025-03-27T17:13:06Z,https://www.youtube.com/watch?v=IpBWPlKCgoE,"Drink celery juice for 7 days, and your body will go through an incredible transformation! Disclaimer-The information provided on ...",35,,,
Boost digestion & skin with celery juice! #celeryjuice #healthyliving,gT9IBaRYL9c,Trieu Son Quyen,2025-03-27T04:32:58Z,https://www.youtube.com/watch?v=gT9IBaRYL9c,Boost digestion & skin with celery juice #celeryjuice #healthyjuices #healthyliving #fok.,24,,,
Fresh celery juice approved by the little one,w2tVWGEb7Mo,Yaeka Kichikawa,2025-03-27T00:15:06Z,https://www.youtube.com/watch?v=w2tVWGEb7Mo,Fresh celery juice approved #veganplussize #fok.,59,,,
Celery juice is easy and convenient to make #asmr #shorts,JFLBMN6ecyk,Hidden Khor,2025-03-26T10:00:31Z,https://www.youtube.com/watch?v=JFLBMN6ecyk,,14,,,
"Boost gut health, skin, & liver with celery juice!",SewAQd6FtAY,Ricardo Baker,2025-03-25T23:14:05Z,https://www.youtube.com/watch?v=SewAQd6FtAY,"Boost gut health, skin, and liver with celery juice #celeryjuice #fok.",21,,,
Celery Juice at my #Backyard#MorningDetoxjuice,jlLnSnsDDTI,Food on Backyard in America,2025-03-24T17:44:17Z,https://www.youtube.com/watch?v=jlLnSnsDDTI,,32,,,
Healthy Celery Juice🥬 #health #shortvideo #short #healthylifestyle,TFv2lzmiI0Y,Healthy Living,2025-03-24T17:39:01Z,https://www.youtube.com/watch?v=TFv2lzmiI0Y,,8,,,
Celery Juice ASMR 😊 #asmr #juice #juicing #healthy #healthyrecipes,O2-wjpgQNp4,Danika Lashay,2025-03-24T01:04:36Z,https://www.youtube.com/watch?v=O2-wjpgQNp4,,60,,,
How to make a celery Juice #celeryjuicechallenge,Oj9bTL9NE3Y,waridi emiliani,2025-03-22T07:46:27Z,https://www.youtube.com/watch?v=Oj9bTL9NE3Y,,61,,,
Celery juice is top tier you guys know I love this for skin  #short #shorts #danicolexx,fjoFbwYD9CE,ancolex,2025-03-22T07:38:48Z,https://www.youtube.com/watch?v=fjoFbwYD9CE,Celery juice is top tier you guys know I love this for skin but it also really helped me with bloating! #short #shorts #danicolexx.,8,,,
Fresh celery juice by Omega juicer #omegajuicer #celeryjuicechallenge,CEO6wh33OOQ,Emmarco Pro,2025-03-22T02:36:56Z,https://www.youtube.com/watch?v=CEO6wh33OOQ,,52,,,
Heal Your Body: The Power of Lemon Water And Celery Juice | Janet Prado,NhXWGdCV62s,Tammy Cho Path To The Heart,2025-03-21T13:15:05Z,https://www.youtube.com/watch?v=NhXWGdCV62s,A Short Clip From: Healing Chronic Illness through Love and Empowerment with Janet Prado | E39 Watch Full Episode: ...,44,,,
Celery juice | early morning drink #detox #celery,HeEl-IbbRIY,Ambika’s Kitchen,2025-03-21T02:16:06Z,https://www.youtube.com/watch?v=HeEl-IbbRIY,,16,,,
Celery Juice Pt.1 #shorts,j35PUyeB27c,JConway,2025-03-20T15:12:54Z,https://www.youtube.com/watch?v=j35PUyeB27c,,16,,,
Celery juice formany healthbenefits #trending #food #lifestyle #shortvideos #juice #celery #viralfyp,ROA_BJut3sw,Sarvada stories,2025-03-20T12:32:09Z,https://www.youtube.com/watch?v=ROA_BJut3sw,,50,,,
25 3 20 MZ01 Celery Juice #juicing #goodthing #juicer #juiceconcentrate #household,dQhAY9nI3l8,Yieach,2025-03-20T07:31:00Z,https://www.youtube.com/watch?v=dQhAY9nI3l8,"How much juice can be extracted from 547 grams of celery? Start the juicer and wait with anticipation. Wow, How refreshing it is!",20,,,
Day 7 of the 369 Liver Cleanse - Celery juice makes me cold,tP7T4qeyQSI,"Polar Compass - Astrology, Health & Human Design",2025-03-19T06:08:09Z,https://www.youtube.com/watch?v=tP7T4qeyQSI,,107,,,
Celery juice on this Tuesday....#healthylifestyle #healthyliving #celeryjuice,0T-6WpbTf_Q,Lifeofdazz,2025-03-18T23:34:59Z,https://www.youtube.com/watch?v=0T-6WpbTf_Q,,26,,,
More intentional mornings ❤️ celery juice before coffee. @namawell #juicing #namajuicer,X-T0Fy_nL34,Micah Althea,2025-03-18T17:59:33Z,https://www.youtube.com/watch?v=X-T0Fy_nL34,,14,,,
Is celery juice the ultimate health hack?  #Celery #HealthBenefits #WellnessHack #foryouu #healthy,YGhmV8kBJAk,DrBergQuickTips,2025-03-18T17:21:24Z,https://www.youtube.com/watch?v=YGhmV8kBJAk,"Is celery juice the most powerful natural remedy of our time? ✨ I tried it for 7 days, and the results were impressive! How to ...",43,,,
The Benefits Of Celery Juice,iMgz2QoNX44,Stamity Studios,2025-03-18T03:24:34Z,https://www.youtube.com/watch?v=iMgz2QoNX44,Song: Elektronomia - Vitality [NCS Release] Music provided by NoCopyrightSounds Free Download/Stream: http://ncs.io/Vitality ...,,,,
Portable Fruit Juice Maker Under 600/- | Mini Juice Maker #facts #juice #juicemachine,XNvaYpHZOYw,QuranStudyYT,2025-03-17T05:21:35Z,https://www.youtube.com/watch?v=XNvaYpHZOYw,Portable Fruit Juice Maker Under 600/- | Mini Juice Maker #facts #juice #juicemachine Duniya ka sabse Chota Mini Juice Maker ...,55,,,
Celery Juice w/Nama J2 + Week 12 in God’s Word #juicing,WNcal4_0pm4,Miss Jaxon,2025-03-17T02:56:06Z,https://www.youtube.com/watch?v=WNcal4_0pm4,Celery juice using Nama J2 (that I've had for years now) This week's reading (March 16-March 22): **Joshua 9 – Judges 2 Key ...,19,,,
Your sign to start drinking Celery Juice 🥤 🌱☀️,4GgvTbCCJOQ,Jvicedsue  ,2025-03-15T23:20:54Z,https://www.youtube.com/watch?v=4GgvTbCCJOQ,,26,,,
Celery Juice without Juicer,3M7P-xlPzD8,Nina Sophia,2025-03-15T08:29:27Z,https://www.youtube.com/watch?v=3M7P-xlPzD8,,12,,,
Let's Make Some Stankin Celery Juice 😭😝🌱 | Juicing Using My Nama J2,FfEkmkdQaqM,ThatColeVegan,2025-03-14T16:00:24Z,https://www.youtube.com/watch?v=FfEkmkdQaqM,"Hmmm Let's make some celery juice today guys! Make sure you buy organic produce, or even grow your own if you have the ...",138,,,
Lime Grape Celery Juice #shorts #celeryjuice #juicerecipe,i4eUZS17Arg,Michelle Blackwood,2025-03-11T15:26:19Z,https://www.youtube.com/watch?v=i4eUZS17Arg,,16,,,
Make celery juice w/ me! #celery #celeryjuice #juicing #shorts #health #lifestyle #skincare,zOCCxpUrAB8,karina,2025-03-11T15:14:25Z,https://www.youtube.com/watch?v=zOCCxpUrAB8,,,,,
"celery juice is full of nutrients & antioxidants that help with digestion, hydration, & wellness 💚",yzYBwkw7Ooo,The Juice Yard,2025-03-11T00:30:30Z,https://www.youtube.com/watch?v=yzYBwkw7Ooo,,45,,,
EASY WAY TO MAKE CELERY JUICE WITH LEMON 🍋 AT HOME #foryou #shortvideo #short #celeryjuice,wuKYoeMkkqE,Heart of Nature ,2025-03-10T06:54:30Z,https://www.youtube.com/watch?v=wuKYoeMkkqE,EASY WAY TO MAKE CELERY JUICE WITH LEMON AT HOME #foryou #shortvideo #short #celeryjuice.,27,,,
Why I Love My Celery and Celery Juice Now From Hating it?  #shorts #celery #health #benefits,8Bv1sZ426sw,Master Health Coach Kerry Dell,2025-03-10T00:19:27Z,https://www.youtube.com/watch?v=8Bv1sZ426sw,"From Celery HATER to LOVER! Yep, you heard that right! I used to pick out even the tiniest pieces of celery... Now? I can't get ...",29,,,
Celery Juice 💚Hydration + Vitamin & Mineral Rich ✅ #celeryjuicechallenge #healing #juicing #foodie,8l0jznsNqoc,Auntie Sway’s Kitchen,2025-03-09T20:57:09Z,https://www.youtube.com/watch?v=8l0jznsNqoc,,13,,,
"Freshly sipped celery juice, a delight for health!#telugu #celeryjuice #food #cooking #india",VztWJbILv-Y,dumbusdiary,2025-03-09T05:09:41Z,https://www.youtube.com/watch?v=VztWJbILv-Y,,41,,,
🌿 Beetroot Gooseberry Celery Juice | Power-Packed Red Elixir 🥤✨ #bcgjuice #glowjuice #shorts #detox,yUq9wVo7by8,ChitraS Simple Paleo,2025-03-08T14:00:58Z,https://www.youtube.com/watch?v=yUq9wVo7by8,"Beetroot Gooseberry Celery Juice | Power-Packed Red Elixir ✨ Looking for a refreshing, nutrient-dense juice to kickstart your ...",55,,,
Fresh pressed celery juice! #juicing #organic #freshpressed #juicingrecipes,D5Q5qGPyOH0,Naturally Nichole,2025-03-07T18:33:22Z,https://www.youtube.com/watch?v=D5Q5qGPyOH0,,16,,,
drinking celery juice has helped my skin sooo much 💚 #celeryjuice #celery #juicing,BZ6NpTYjTr4,Ashley Paige,2025-03-07T16:17:06Z,https://www.youtube.com/watch?v=BZ6NpTYjTr4,drinking celery juice has helped my skin sooo much #celeryjuice #celery #juicing #juicingtutorials #foryou #clearskin ...,9,,,
celery juice 🌱 #juicing #wellnessshots #celeryjuice,QaS3VQXSUKQ,victoriadrianna,2025-03-06T21:55:49Z,https://www.youtube.com/watch?v=QaS3VQXSUKQ,,9,,,
celery juice making #diet #health #healthydrink,r-1RU22ABZE,Isaack's diaries,2025-03-06T08:18:32Z,https://www.youtube.com/watch?v=r-1RU22ABZE,CELERY JUICE: - lemon - ginger - celery - green apple - water 1) wash the celery and cut 2) cut the ginger and apples 3) stract ...,39,,,
Glow inside out with daily dose of celery juice. #juicing #celeryjuice #celery #clearskin #shorts,J2QADE9EzqA,Mahtab Mirza,2025-03-05T19:43:09Z,https://www.youtube.com/watch?v=J2QADE9EzqA,youtubeshorts #flatstomach #bloating #bloatingtips #juicingtutorials #clearskin #clearskinsecret #healthyeating #healthydiet.,34,,,
Celery juice the only way to start your day @MedicalMediumAnthonyWilliam,jshzVX9ql18,Amanda Sheppard,2025-03-05T03:55:56Z,https://www.youtube.com/watch?v=jshzVX9ql18,,21,,,
## Healthy Celery Juice ##,Z5jasy4pw7c,Leema ,2025-03-04T22:43:49Z,https://www.youtube.com/watch?v=Z5jasy4pw7c,"Celery is good for digestion, heart health, liver health and a good hydrating source.",39,,,
let's make celery juice #adayinmylife #juice #cleanskin #detox  #celeryjuicechallenge #celeryjuice,qRo3iqZQYyg,Seirama,2025-03-04T14:42:07Z,https://www.youtube.com/watch?v=qRo3iqZQYyg,,7,,,
30 & fresh: morning recovery with eye masks & celery juice #stayfresh,xZ7QCTNgwBU,Brian Carter,2025-03-04T05:06:19Z,https://www.youtube.com/watch?v=xZ7QCTNgwBU,"Morning after fix: eye masks, dry shampoo & celery juice #stayfresh #morningafter #fok.",16,,,
Celery juice is a natural electrolyte! 💗,2-gj3qJywDc,Heather Ann Pearl,2025-03-03T15:37:05Z,https://www.youtube.com/watch?v=2-gj3qJywDc,,15,,,
The Power of Celery Juice - Boost Digestion and Banish Bloating - Anthony William,PKtsjLVtIEI,Vitality Visionary,2025-03-03T08:00:18Z,https://www.youtube.com/watch?v=PKtsjLVtIEI,MedicalMediumAnthonyWilliam.,52,,,
"Sunday’s juice prep, celery juice",gm8VrVWbfNk,Paper chasing pens & more,2025-03-03T00:10:50Z,https://www.youtube.com/watch?v=gm8VrVWbfNk,,34,,,
Celery detox juice recipe for digestion,Rjmajdf6Uu8,Ria Lapae,2025-03-02T17:27:48Z,https://www.youtube.com/watch?v=Rjmajdf6Uu8,"Making fresh cold pressed juice with celery, cilantro, spinach, lemon, ginger and green apple. This green juice recipe is great for ...",29,,,
Celery juice for skin health #celeryjuice #skincare #acnetips,7vOMm6G_0Rg,Molly Thomas,2025-03-02T14:00:08Z,https://www.youtube.com/watch?v=7vOMm6G_0Rg,Celery juice for glowing skin #celeryjuice #skincare #acnetips #naturalacnetreatment #fok.,6,,,
CELERY JUICE HEALTH BENEFITS #shorts #shortsfeed #healthbenefits #viralvideo #ytshorts,2bh43F16T7w,Clarion’s Kitchen ,2025-03-01T20:47:37Z,https://www.youtube.com/watch?v=2bh43F16T7w,,16,,,
Boost gut health with celery juice #celeryjuice,CTz7b4T5OVQ,Alex Martinez,2025-03-01T19:15:02Z,https://www.youtube.com/watch?v=CTz7b4T5OVQ,Boost gut health with celery juice #celeryjuice #healyourgut #fok.,11,,,
"Celery juice won’t detox U, but it will make you feel smug while you ignore the actual trash u eat.",RV5SKY2rJqQ,Functional Human,2025-03-01T15:00:36Z,https://www.youtube.com/watch?v=RV5SKY2rJqQ,Thinking about working out doesn't count as exercise. Get moving! 🏋️‍,11,,,
Make Celery Juice Without a Juicer!,IgXaDhsK4i0,Evergreen Longevity ,2025-02-28T22:00:13Z,https://www.youtube.com/watch?v=IgXaDhsK4i0,"Learn how to make refreshing celery juice without a juicer in this quick and easy tutorial! In under a minute, we'll show you how to ...",50,,,
Why you should drink celery juice every day!  #juicingrecipes #medicalmedium,sB3FG0VtBNU,Stephanie Klotz - Morning Cleanse,2025-02-28T19:58:55Z,https://www.youtube.com/watch?v=sB3FG0VtBNU,,25,,,
"Apple, Carrot, and Celery Juice #faithfulwalk #healthydrink #fruit #juice #fyp #shorts",RB7Y9uS-YH4,Faithful Walk,2025-02-28T06:48:19Z,https://www.youtube.com/watch?v=RB7Y9uS-YH4,,21,,,
homemade celery juice 🥬🤍 perfect to get rid of acne + bloating! #celeryjuice #juicehack #juice,tozfIe0UZ7Y,Jess Molly Bell,2025-02-27T20:50:49Z,https://www.youtube.com/watch?v=tozfIe0UZ7Y,,20,,,
"Celery Juice first thing in the AM, Incline Walking 12-15% post workout, Lions Mane, 10K Steps",3i5wVgGS4Y4,Lauren Solomon Fitness,2025-02-27T14:21:16Z,https://www.youtube.com/watch?v=3i5wVgGS4Y4,,9,,,
why celebs swear by celery juice#skincare #healthyfood #selflove #healthy #usa,CyYJXQ5OrNc,RomanaLeaf,2025-02-25T21:28:36Z,https://www.youtube.com/watch?v=CyYJXQ5OrNc,,12,,,
100% organic celery juice for cancer prevention & more #cancerprevention,DoBSqZ5gPq8,Lynda Nelson,2025-02-25T00:00:06Z,https://www.youtube.com/watch?v=DoBSqZ5gPq8,100% organic celery juice for cancer prevention & more #cancerprevention #organic #fok.,13,,,
"Celery juice review: low calorie, low sugar!#celeryjuice #healthydrink #weightloss",ULCqE045ux0,ClickConvert,2025-02-24T17:30:05Z,https://www.youtube.com/watch?v=ULCqE045ux0,"A person reviews celery juice, noting its low calorie and sugar content.#celeryjuice #healthydrink #weightloss #healthylifestyle ...",41,,,
Celery juice 🧃#health #celeryjuice #healthiswealth #discipline #goodhabits #shorts,lAvkZBicoCo,Emma-Louise ,2025-02-24T12:22:10Z,https://www.youtube.com/watch?v=lAvkZBicoCo,,,,,
5 days of celery juice—refreshing or risky? 🥬💧,_bbB8_5PmK8,health harmonics,2025-02-23T23:47:44Z,https://www.youtube.com/watch?v=_bbB8_5PmK8,JuiceChallenge #CeleryJuiceChallenge #Juicing #HealthyChoices #CeleryJuice #FoodFacts #JuiceDetox #Detox #GreenJuice ...,44,,,
Why I Love Celery Juice for my Stomach and Health?  #shorts #celery #nutrients #health,kz6OyoXyy4M,Master Health Coach Kerry Dell,2025-02-23T22:39:53Z,https://www.youtube.com/watch?v=kz6OyoXyy4M,"Celery juice is not just refreshing; it's a powerhouse for digestive health! By increasing hydrochloric acid in the stomach, it helps ...",29,,,
"🌱Cleanse, hydrate, thrive—celery juice for the win! #healthylifestyle #juicing #celeryjuice💫",gtkLqhUPtdI,Soeurette Russell,2025-02-21T16:05:26Z,https://www.youtube.com/watch?v=gtkLqhUPtdI,,7,,,
Celery Juice ( Blender Method) is so easy to make! #celery #celeryjuice #juicing,dln-Ydcxk4I,Mama Linda,2025-02-20T22:31:02Z,https://www.youtube.com/watch?v=dln-Ydcxk4I,"Celery juice is rich in antioxidants and nutrients that help detoxify the body, reduce inflammation, and support healthy, glowing ...",16,,,
Celery juice #healthy #plantbased#shortvideo,NxBSPsWdphA,Pradnya,2025-02-19T18:10:06Z,https://www.youtube.com/watch?v=NxBSPsWdphA,,30,,,
Drink celery juice everyday morning for clearer skin and a flatter stomach #celeryjuice,dtFIUoex73c,Juicing Tutorials,2025-02-19T13:59:45Z,https://www.youtube.com/watch?v=dtFIUoex73c,"Glow from the inside out with a daily dose of celery juice! ✨ It's super easy to make, yields a ton of juice, and is packed with ...",16,,,
Cucumber Celery juice 🥤#fypシ゚ #shorts #shortvideo #skincareroutine #glowingskin #weightloss #healthy,8U18M5AqthE,DoctorSpice,2025-02-17T14:10:35Z,https://www.youtube.com/watch?v=8U18M5AqthE,Cucumber Celery juice Ingredients used are 1. Celery 2. Cucumber 3. Lemon 4. Ginger #glowingskin #skincare ...,22,,,
Celery Juice Changed My Life! 🥬✨ Amazing Health Benefits You Need to Know! #wellness #shorts #diy,_1ISVn7Stv0,Levis Hapy Life Finds,2025-02-17T07:13:51Z,https://www.youtube.com/watch?v=_1ISVn7Stv0,,19,,,
Celery juice for extra love❤️❤️❤️❤️🎈,XtHY1_lVsRQ,“Life is life”,2025-02-15T11:20:35Z,https://www.youtube.com/watch?v=XtHY1_lVsRQ,,16,,,
Celery juice for healthy benefits and life style.       #celery #limejuice #gingershot,9s7pEQfl7L4,Chloe Damaris,2025-02-15T07:00:03Z,https://www.youtube.com/watch?v=9s7pEQfl7L4,"Celery is a very crunchy, succulent vegetable that grows in stalks. You can cook celery, often with more flavorful vegetables, or eat ...",16,,,
Celery Juice for Your Gut Health?,zyxrTGvRkpI,Marefat,2025-02-14T22:52:03Z,https://www.youtube.com/watch?v=zyxrTGvRkpI,"Celery juice for the win! Did you know it can help with gut health (and liver too)? Cleaner gut, clearer mind! #guthealth ...",45,,,
Celery Juice #Juicer #Juice #nutribullet #Blender #smoothie #food #drink #celeryjuice #celery,U_C1wmtn6xc,DEZD,2025-02-11T19:24:34Z,https://www.youtube.com/watch?v=U_C1wmtn6xc,,32,,,
Celery Juice Recipe for Weight Loss and Skin Health: Detox and Glow Naturally | Call Me Lols,_SWS5kEBOoQ,Call Me Lols,2025-02-11T08:30:20Z,https://www.youtube.com/watch?v=_SWS5kEBOoQ,Discover the incredible benefits of celery juice for weight loss and skin health in this easy-to-follow recipe. Packed with essential ...,53,,,
I Drank Celery Juice for 7 Days - Here's What Happened! 😱,mih0Opxtark,Una Chef en la Cocina,2025-02-10T16:00:50Z,https://www.youtube.com/watch?v=mih0Opxtark,"Celery juice is one of the most popular detox drinks, but does it really work? Inspired by Frank Suárez, I tried drinking celery ...",31,,,
BENEFITS OF CELERY JUICE | WEIGHTLOSS JOURNEY!!!!,bKjkoOeBEw8,GLOW WITH RO,2025-02-09T11:00:39Z,https://www.youtube.com/watch?v=bKjkoOeBEw8,food #weightlossandwellness #celery #weightloss #plussizeworkout.,36,,,
This one trick to get pure celery juice,KASM21G19aQ,Marefat,2025-02-08T21:26:06Z,https://www.youtube.com/watch?v=KASM21G19aQ,I'm a big fan of drinking celery juice that has been strained to make it as pure as possible. #celeryjuice #healthbenefits #juicing ...,31,,,
Green cabbage and celery juice,yO1TnPxqSsg,Ngozi Atiti,2025-02-08T01:15:50Z,https://www.youtube.com/watch?v=yO1TnPxqSsg,,34,,,
chugging celery juice with my bestie ✨ #momlife,LZVKBdC4sBU,Carmela Being,2025-02-07T18:54:13Z,https://www.youtube.com/watch?v=LZVKBdC4sBU,Join my toddler and I juicing our daily celery juice together! One of our favorite healthy habits!,12,,,
Drink Celery Juice Everyday... #healthtips #nutritionfacts #facts,RhspwUqn8YM,MINUTE HEALTH TIPS,2025-02-07T14:00:29Z,https://www.youtube.com/watch?v=RhspwUqn8YM,https://linktr.ee/minutehealthtips Disclaimer: The information provided on this channel is for educational and informational ...,52,,,
Drink Celery Juice On An Empty Stomach For A Month: See What Happens to Your Body.,KA8IzwPlhaQ,Wellness Habits,2025-02-05T09:00:21Z,https://www.youtube.com/watch?v=KA8IzwPlhaQ,"Are you seeking a natural method to enhance your gut health? Celery juice has transformed the lives of many! In this video, we ...",55,,,
Celery juice day 4 #celeryjuice #healthylifestyle #medicalmedium #path2wellnessbyamandasheppard,aSIMJmQWago,Amanda Sheppard,2025-02-05T04:50:42Z,https://www.youtube.com/watch?v=aSIMJmQWago,,48,,,
Celery Juice using the Nutri bullet #howtomakeceleryjuice #asmrvideos #asmrfood #asmrsounds #shorts,Y4g4ISQ_AnI,Angel Dayz,2025-02-04T20:58:03Z,https://www.youtube.com/watch?v=Y4g4ISQ_AnI,This video shows how to make celery juice using the nutribullet and in glass bottles. #juicer # juicer #nutrients #nutritiontips ...,24,,,
How to make Celery juice #celery #celeryjuice,NQu3uOdWri4,Angel Dayz,2025-02-04T20:00:52Z,https://www.youtube.com/watch?v=NQu3uOdWri4,On today's episode of Tips Tuesday-Journey to Wellness series i'm briefly sharing the benefits of celery. In addition to how to ...,82,,,
Discover natural highs with celery juice,iKjgM0AtbjM,Marefat,2025-02-03T20:20:43Z,https://www.youtube.com/watch?v=iKjgM0AtbjM,,56,,,
How to Make Celery Juice Wash and chop 1 bunch of celery *Juice using blend w| little water & strain,Xb9BmvPK7eQ,KaSusi Mo,2025-02-02T11:41:38Z,https://www.youtube.com/watch?v=Xb9BmvPK7eQ,,48,,,
Making celery juice #juicing #celery #healthy,hofYKf-SukQ,Elizabeth Grace,2025-01-31T04:26:48Z,https://www.youtube.com/watch?v=hofYKf-SukQ,juicing #celery #healthy #healthylifestyle #recipe.,,,,
నేను first time try చేసిన Celery Juice#viral#trending#celeryjuice#celery#shorts#telugu#food#fyp#yt,XUWYAIg5eGM,Sree's palate,2025-01-29T13:09:00Z,https://www.youtube.com/watch?v=XUWYAIg5eGM,నేను first time try చేసిన Celery Juice#viral#trending#celeryjuice#celery#shorts#telugu#food#fyp#yt ...,50,,,
"Papaya, Kiwi, celery Juice #veganlifestlye#juicerecipes#cleanjuice #healthylifestyle #veganlifestlye",GAT4--pZ_cI,VeganBae ,2025-01-29T03:16:41Z,https://www.youtube.com/watch?v=GAT4--pZ_cI,,33,,,
Celery Juice||Green juice||Healthy shot #shorts #ytshorts #juice #detoxjuice #healthydrink,qvxTxNQCxg4,Shyni Vista,2025-01-28T20:50:30Z,https://www.youtube.com/watch?v=qvxTxNQCxg4,"Benefits of celery juice: 1.celery juice to reduce inflammation and boost overall health!"" 2.celery juice can support digestive health ...",29,,,
Good morning ✌️#goodmorning #juice #celery #celeryjuice,_V2HwUux7JA,Glam and Glow 💫,2025-01-28T06:59:56Z,https://www.youtube.com/watch?v=_V2HwUux7JA,,30,,,
Myth: Drinking celery juice fixes everything #funfacts #myths #facts #jokes #health #trend,sp0obHQ2AFg,LOLSBOX,2025-01-27T16:13:32Z,https://www.youtube.com/watch?v=sp0obHQ2AFg,Fun Weird Myths and Facts Health Trends Myths Check out my YouTube Shorts for non-stop laughs! From hilarious jokes and ...,22,,,
Celery juice #youtubeshorts #shorts #juice #celeryjuicechallenge #watch,yvKez8bWRjM,Enjoy ,2025-01-27T16:12:08Z,https://www.youtube.com/watch?v=yvKez8bWRjM,,16,,,
Celery juice🍀#celeryjuice #trending #youtubeshorts #ashortaday #trendingshorts #healthy #foodie,tWAMz-6bPAo,Sejal Mohare,2025-01-27T15:36:32Z,https://www.youtube.com/watch?v=tWAMz-6bPAo,,26,,,
How to make celery juice in a blender,rcP9a37LZ54,The Secret to Natural Healing,2025-01-26T13:55:59Z,https://www.youtube.com/watch?v=rcP9a37LZ54,"Celery juice, referred to by Anthony William as the ""miracle medicine of our time"", can be made with a high-speed blender and a ...",36,,,
Celery Juice: The Ultimate Health Elixir!,xmmtS4wF7Y0,Right Life,2025-01-24T18:23:50Z,https://www.youtube.com/watch?v=xmmtS4wF7Y0,"Discover the incredible benefits of celery juice in this vibrant YouTube Short! Packed with antioxidants and essential vitamins, ...",53,,,
Celery juice that isn't a Hazmat..#juicing #celeryjuice #detox #skincare #guthealth #naturalbeauty,C8azynfvSqQ,Alchemyfitchef ,2025-01-24T11:02:56Z,https://www.youtube.com/watch?v=C8azynfvSqQ,,23,,,
The benefits of celery juice for health,4gmf6Brd6nw,Natalia Naila,2025-01-22T16:29:53Z,https://www.youtube.com/watch?v=4gmf6Brd6nw,juince #celery #health #recipe #wellness #shorts #podcast.,10,,,
Celery juice with lime🥰🤌🏽🍋‍🟩,zAO3Un83Id8,Skylah,2025-01-22T05:48:25Z,https://www.youtube.com/watch?v=zAO3Un83Id8,I do not own the rights to this music. #healing #healthy #juicing #wellness #spiritualjourney.,25,,,
Fresh Celery Juice 💚 #growyourown #celeryjuice #greenjuicerecipe #juicingforhealth #ytshorts,a9cdp_HG7Pc,GrowYourOwnLives,2025-01-20T21:07:04Z,https://www.youtube.com/watch?v=a9cdp_HG7Pc,,17,,,
Help! How do you guys drink celery juice?,Pbi56bp8sYs,Life with Meagan,2025-01-20T19:00:13Z,https://www.youtube.com/watch?v=Pbi56bp8sYs,This is going to be an adjustment for me! Please share your secrets!,55,,,
Health benefits of eating celery #healthyfood #health #celery #food #healthy #celeryjuice #shorts,fNzyQvv3N3M,Medgraphic Innovater,2025-01-19T02:53:30Z,https://www.youtube.com/watch?v=fNzyQvv3N3M,"Discover the amazing health benefits of celery! From boosting hydration to improving digestion, this nutrient-packed veggie is a ...",19,,,
6 Health Benefits Of Celery Juice | How To Improve Your Health | Healthy Tips,DZWAEK9bctc,Health & Relaxing Sounds,2025-01-18T17:00:12Z,https://www.youtube.com/watch?v=DZWAEK9bctc,6 Health Benefits Of Celery Juice | How To Improve Your Health | Healthy Tips | celery juice can work wonders for your body.,62,,,
Tried celery juice and this is what I have to say!!!! #acne #youtubeshorts,9YHk-Kpn3Zc,Dr.Bhagyashree,2025-01-18T05:08:25Z,https://www.youtube.com/watch?v=9YHk-Kpn3Zc,,52,,,
I grew too much celery inside my apartment #cleaneating #greenjuice #greenjuicerecipe #celeryjuice,eV2A2lJ94Oc,Cathryn Jenn,2025-01-17T17:36:53Z,https://www.youtube.com/watch?v=eV2A2lJ94Oc,cleaneating #greenjuice #greenjuicerecipe #celeryjuice #celery #gardenproject #indoorgarden #gardyn.,23,,,
