Title,Video ID,Channel,Published At,URL,Description,Video Length,Views,Likes,Comments
Mind The Gap: Stay on Track for Kidney Cancer Awareness! | Highlights 🎥,i5FKPmFh6m0,Medical Channel Asia,2025-03-31T06:25:01Z,https://www.youtube.com/watch?v=i5FKPmFh6m0,"Missed out on ""Mind The Gap: Stay on Track for Kidney Cancer Awareness!”? Rewind the clock ⏪️ with these key highlights ...",124,3819,4,0
#cancer #cancerawareness #hope,Noi41DDVDks,Dr Amar Jain,2025-01-16T18:25:34Z,https://www.youtube.com/watch?v=Noi41DDVDks,,47,3273,118,0
Anupam Kher at cancer awareness program! #thefilmycharcha #anupamkher,tMxKGacZoDU,The Filmy Charcha,2025-02-10T06:55:18Z,https://www.youtube.com/watch?v=tMxKGacZoDU,,18,3158,52,1
March is National Colorectal Cancer Awareness Month,N-a7Du3X1Fo,Colorectal Cancer Alliance,2025-03-01T22:35:13Z,https://www.youtube.com/watch?v=N-a7Du3X1Fo,It's National #ColorectalCancerAwarenessMonth! The ultimate self care is to get screened. Visit getscreened.org to learn more ...,32,4014,78,5
Cancer Awareness: Recognizing Early Signs. @ThePowerfulHumansOfficial #shorts #cancer #women,QvXD3Kgperc,TPH Clips,2025-03-09T16:40:00Z,https://www.youtube.com/watch?v=QvXD3Kgperc,"Full Podcast Link: https://youtu.be/IV0QDB-tpGs?si=gnK4L9qlFsj9GNnA Breast Cancer Symptoms, Treatment, Surgery by ...",51,2313,56,0
Breast Cancer Awareness by Dr. Parth Shah,TrH_9UUwELM,Synergy Superspeciality Hospital Rajkot,2025-02-07T06:04:28Z,https://www.youtube.com/watch?v=TrH_9UUwELM,Dr. Parth Shah shares vital insights on breast cancer—a condition where abnormal cell growth forms a tumor in the breast.,69,1878,3,0
Dr. Aniket Goenka shares vital cancer awareness insights at Pari Bazaar,nQYm9EtQtX0,Chirayu Medical College & Hospital,2025-03-12T04:00:38Z,https://www.youtube.com/watch?v=nQYm9EtQtX0,"An important moment from the Health and Hygiene segment at Pari Bazaar Heritage Festival 5.0, where Dr. Aniket Goenka, ...",40,1764,68,0
Pink Sakhi Saree walk #vizag #cancer #awareness,mmd7a0XsnOo,Pushpa Prasad,2025-02-16T17:44:15Z,https://www.youtube.com/watch?v=mmd7a0XsnOo,,60,1483,24,1
Cancer Awareness | World Cancer Day | Dr Irshad Pathan #cancer #cancerawareness #tobacco #oncologist,rY_JnJQ7IzA,Irshad Pathan (Cardiologist),2025-02-04T17:28:31Z,https://www.youtube.com/watch?v=rY_JnJQ7IzA,,60,1718,166,9
Immunotherapy harnesses the body's own immune system to fight cancer. #cancerawareness #cancer #yt,q6dYEhbZsbI,Dr. Vikas Goswami - Oncologist,2025-03-26T16:32:19Z,https://www.youtube.com/watch?v=q6dYEhbZsbI,,59,1779,54,0
I have cancer vs I beat cancer #cancer #cancerawareness,lOi1Qx2GghI,Tales,2025-03-18T15:01:16Z,https://www.youtube.com/watch?v=lOi1Qx2GghI,,5,1275,31,0
Does aluminium foil cause cancer?  #foodlover #causecan #cancerawareness #shortsvideo #yt #foil,KbiC0izqp6o,Dr. Vikas Goswami - Oncologist,2025-03-06T14:34:20Z,https://www.youtube.com/watch?v=KbiC0izqp6o,,59,1341,52,2
World cancer day # cancer awareness:- let's stand together.....,zOO5X-hYZtw,nazia khan,2025-02-04T12:42:00Z,https://www.youtube.com/watch?v=zOO5X-hYZtw,,60,1399,119,8
"Cervical Cancer Awareness Month: Stay Informed, Stay Healthy  | Cervical Cancer Causes & Symptoms",gXL6-IQed-E,Billroth Hospitals,2025-01-22T05:32:07Z,https://www.youtube.com/watch?v=gXL6-IQed-E,"January is Cervical Cancer Awareness Month, a crucial time to spotlight one of the leading health concerns for women.",49,1100,9,0
Best Highlights from the K10K Cancer Awareness Run 2025 | Kauvery Hospital,gDwjvsglSFs,Kauvery Hospital,2025-02-02T11:02:48Z,https://www.youtube.com/watch?v=gDwjvsglSFs,The K10K Cancer Awareness Run 2025 hosted by Kauvery Hospital Chennai was a huge success! With over 6500+ runners ...,33,1147,30,0
World Cancer Day #drkshilpireddy #worldcancerday #bestgynecologist #cancerawareness,kLh6i53C65c,Dr. K. Shilpi Reddy,2025-03-22T11:44:02Z,https://www.youtube.com/watch?v=kLh6i53C65c,,34,4943,45,0
Follow Up Checkup...Darneka Nehi Hai 👍👍✌️#cancer #awareness #motivation #mentalhealth,73M5W_KKHHY,Life With Cancer,2025-02-17T09:57:36Z,https://www.youtube.com/watch?v=73M5W_KKHHY,Follow Up Checkup... Darneka Nehi Hai ✌️#cancer #awareness #motivation #mentalhealth #youtube #youtubeshorts ...,25,972,47,10
1st time 5km walkthon #noble cause #navi mumbai #youtubeshort #cancer awareness #chale chalo#viral,FrR0nclR-J0,My mishty's world 🌎 ♥️ ,2025-02-11T07:07:25Z,https://www.youtube.com/watch?v=FrR0nclR-J0,,60,891,6,6
Dr. Jeenu Babu Raises Crucial Cervical Cancer Awareness at Vettukad St. Mary's School | Watch Now!,JTs9yHLlm6U,Yana Care ,2025-02-12T08:30:10Z,https://www.youtube.com/watch?v=JTs9yHLlm6U,Dr Jeenu Babu offers the much needed cervical cancer awareness for Vettukad St.Marys school kids...Watch here!,24,1133,24,0
Perfect Woman | Official Trailer | A Film on Cervical Cancer Awareness in Nigeria,L6yDNP4YmRU,Rise in Light,2025-01-23T06:54:42Z,https://www.youtube.com/watch?v=L6yDNP4YmRU,Rise in Light Presents Perfect Woman is Nigeria's first narrative short film on cervical cancer awareness. Created by Storytellers ...,73,883,17,0
Breast Cancer awareness 🧘‍♀️ #yogaforwomen #femalehealth,IlJmFlkahfw,Sheenam Thukral,2025-02-18T03:12:54Z,https://www.youtube.com/watch?v=IlJmFlkahfw,,26,882,40,0
Sanjay Dutt & Anupam Kher's Powerful Message on Cancer Awareness,dTOd5B6pzo8,Show Buzz,2025-02-10T04:54:58Z,https://www.youtube.com/watch?v=dTOd5B6pzo8,Watch as Sanjay Dutt and Anupam Kher come together to share their experiences and raise awareness about cancer.,15,1269,31,0
Poster making competition on cervical cancer awareness 🙌 #shorts #minivlog #ytshorts,tAnaB2O7dYQ,Classy Aparna ,2025-02-16T06:29:32Z,https://www.youtube.com/watch?v=tAnaB2O7dYQ,cervical cancer posters cervical cancer posters uk cervical cancer awareness posters cervical cancer awareness month posters ...,54,1222,42,1
K10K Cancer Awareness Run | Kauvery Hospital Chennai | Santhanam | 2nd February 2025,zKeiv9JX9ho,Kauvery Hospital,2025-01-07T02:30:41Z,https://www.youtube.com/watch?v=zKeiv9JX9ho,www.kauveryhospital.com The Clock is Ticking - Registration Closes January 20th Registration for the K10K Cancer Awareness ...,24,921,22,0
Hina Khan got Emotional During Her Speech On Cancer Awareness #hinakhan #cancer #bollywoodhelpline,rSc43SN0iBM,BollywoodHelpline,2025-02-04T14:23:23Z,https://www.youtube.com/watch?v=rSc43SN0iBM,,57,854,39,0
Understanding Cervical Dysplasia: Key Facts You Need to Know  | Cervical Cancer Awareness,T4-sus9AtK4,Billroth Hospitals,2025-01-28T08:46:47Z,https://www.youtube.com/watch?v=T4-sus9AtK4,"Cervical dysplasia is a condition where abnormal cells grow on the surface of the cervix. If left untreated, it can progress to cervical ...",45,891,8,0
Signs of Cancer . #drdeeptisharma #ytshorts #youtubeshorts #cancerawareness,NSKuzH52Oj8,Dr.Deepti Sharma ,2025-02-04T08:06:03Z,https://www.youtube.com/watch?v=NSKuzH52Oj8,"Cancer is the second-leading cause of death in the world. But survival rates are improving for many types of cancer, thanks to ...",10,812,17,4
K10K Cancer Awareness Run | 2nd February 2025 | Mirchi Shiva | Kauvery Hospital Chennai,H5F1t486Auo,Kauvery Hospital,2025-01-23T11:00:18Z,https://www.youtube.com/watch?v=H5F1t486Auo,www.kauveryhospital.com 🎗️ Join us for the K10K Cancer Awareness Run! ‍♂️  ‍♀️ Mark your calendars for February ...,26,847,19,0
Spreading Hope: Pink & White Keffiyehs for Breast Cancer Awareness 💕,HmMxb18qiPQ,Zuhd Store,2025-01-14T01:00:32Z,https://www.youtube.com/watch?v=HmMxb18qiPQ,"Spreading Hope, One Keffiyeh at a Time At Zuhd Store, we're honored to support the incredible efforts of two brothers raising ...",48,1176,12,0
#doctor #healthtips #vaccine #gynaedoctor #health #cancerawareness #cancer #cervix #hpvvirus,mEeIxIqpv64,Gynae Pedia -All About Women’s Health,2025-01-29T14:31:55Z,https://www.youtube.com/watch?v=mEeIxIqpv64,,57,801,20,0
K10K Cancer Awareness Run @beasantnagar #Chennai #shorts #viral,P6YCIyuiPrg,DHIYAS TIME,2025-02-02T03:34:26Z,https://www.youtube.com/watch?v=P6YCIyuiPrg,chennai #marathon #shortsfeed #viralshort #cancer #awareness #kauveryhospitalchennai #kauvery #2025 #todayshorts.,60,773,20,0
Inauguration of Alappuzha district 'Arogyam Anandam' - Cancer Awareness & Screening Campaign,C0UORcmcY4o,Dr. KM Cherian Institute of Medical Sciences,2025-02-27T12:54:58Z,https://www.youtube.com/watch?v=C0UORcmcY4o,We cordially invite you for the Inauguration of Alappuzha district 'Arogyam Anandam' - Cancer Awareness & Screening Campaign ...,54,860,25,0
🚨 Beware of Fake Cancer Babas! #cancer #cancerawareness #oncologist #visakhapatnam,grdkce72lss,Simplify Cancer,2025-02-01T07:30:21Z,https://www.youtube.com/watch?v=grdkce72lss,"Scammers on WhatsApp, Facebook, and YouTube are taking advantage of cancer patients with false promises and dangerous ...",61,2886,41,2
Cancer Awareness Program,D5GjIELwO-Q,Narsimha Reddy Engineering College code:NRCM,2025-02-04T02:25:00Z,https://www.youtube.com/watch?v=D5GjIELwO-Q,,46,913,52,1
K10K Cancer Awareness Run | Harish Kalyan | 2nd February 2025 | Register Now at k10k.run,Ej9rsyKwh6g,Kauvery Hospital,2025-01-22T07:00:10Z,https://www.youtube.com/watch?v=Ej9rsyKwh6g,"www.kauveryhospital.com The K10K Cancer Awareness Run is happening on 2nd February 2025 at Olcott Memorial School, ...",26,754,22,0
Cancer Awareness Walkathon- 8 Feb 2025 -   Basavatarakam Indo American Cancer Hospital 2,-5K0DQMxR90,Basavatarakam Cancer Hospital,2025-02-08T06:07:26Z,https://www.youtube.com/watch?v=-5K0DQMxR90,Cancer Awareness Walkathon- 8 Feb 2025 - Basavatarakam Indo American Cancer Hospital 2 For Latest Updates !! ☛ Visit our ...,39,1178,44,0
Is this Interesting ? #cancerwarrior #cancerawareness #cancer,ml2FdpNyBtE,Medico Against Cancer,2025-01-03T04:08:37Z,https://www.youtube.com/watch?v=ml2FdpNyBtE,,63,777,0,13
I'm making cute little ducks for fundraising! #relayforlife # #cancer #cancerawareness #rubberducky,Ln79MZDPyXM,The Crochet Fairy,2025-02-05T21:28:26Z,https://www.youtube.com/watch?v=Ln79MZDPyXM,,6,728,21,3
World Cancer Day- Cancer awareness program ❤️,n4mYNSling0,SRM BOARDING SCHOOL BANBIRA,2025-02-07T07:17:08Z,https://www.youtube.com/watch?v=n4mYNSling0,cancerawareness #worldcancerday #world #cancer #day #school #program #4february.,16,819,31,1
Colorectal Cancer Awareness Month 2025,jDMar-y8mkg,Health Care the the Homeless,2025-03-03T16:30:59Z,https://www.youtube.com/watch?v=jDMar-y8mkg,"March is Colorectal Cancer Awareness Month! Colorectal cancer is highly treatable if found early, so we are encouraging clients ...",58,691,7,0
One thing you must avoid to prevent CANCER❌ #shorts #cancerawareness #nosugar,cx94XvZVfnc,Pods Era,2025-03-07T14:03:00Z,https://www.youtube.com/watch?v=cx94XvZVfnc,"In this informative video, an expert delves into the crucial role diet plays in cancer prevention. He explains how eliminating sugar ...",45,700,28,0
Childhood Cancer Awareness Day 🎀 #brookefieldsmall #coimbatore #cancerfoundation #cancerawareness,POaZWtN_Xg0,Coimbatore Foodie Girl,2025-02-15T18:21:41Z,https://www.youtube.com/watch?v=POaZWtN_Xg0,,59,753,36,1
full vid on my page❤️ #cancer #skateboard #skating #cancerawareness #donate #gofundme #skateboarding,P3nikMEENQg,LINKINDRAKE,2025-03-11T23:12:43Z,https://www.youtube.com/watch?v=P3nikMEENQg,,46,690,13,0
Jamestown Jackals Breast Cancer Awareness Game. THIS SUNDAY! Be there or get crossed! #breastcancer,R3aMjT8Vbd8,Jamestown Jackals Marketing,2025-02-21T13:26:26Z,https://www.youtube.com/watch?v=R3aMjT8Vbd8,,58,629,18,1
I’ve dug two graves...@Sleepy.Rascal  || #Gacha #Irlau #Cancer #cancerawareness ||,vSf35_eN_yI,☾ᎯℒℰX☾,2025-01-17T05:48:22Z,https://www.youtube.com/watch?v=vSf35_eN_yI,,24,645,65,1
"""Foods that increase your risk of cancer"" #shorts #cancerawareness #cancer #viralshort#health",P8zFyPqg6y4, NextViralHit,2025-03-02T13:37:00Z,https://www.youtube.com/watch?v=P8zFyPqg6y4,"""Foods that increase your risk of cancer"" #shorts #cancerawareness #cancer #viralshort#health @NextViralHit Description: Did ...",48,627,23,0
Emraan Hashmi Urges Everyone to Act Early– Cancer Awareness Could Save Lives,3ZKQ84ylDxY,OnlyMyHealth,2025-02-04T12:00:07Z,https://www.youtube.com/watch?v=3ZKQ84ylDxY,Emraan Hashmi Urges Everyone to Act Early– Cancer Awareness Could Save Lives #onlymyhealth #cancerawareness ...,30,616,14,0
World cancer day.#art#cancer#cancerawareness#awareness#artoftheday#creativity#painting#creativeart,FpXW41WYQd4,Artyficiallymade,2025-02-04T11:59:08Z,https://www.youtube.com/watch?v=FpXW41WYQd4,,31,627,39,7
Cancer awareness programme 👍🙏#trending#awareness##song#ytshorts#shorts#,zdU9W_vlPCM,Ramaswamy creations,2025-02-25T01:54:12Z,https://www.youtube.com/watch?v=zdU9W_vlPCM,,61,640,17,0
We got this!💪 #cancer  #cancerawareness #youtubeshorts  #youtube #beatcancer #contentcreator,tbQ4kPKRJzU,Agustin De Spirito,2025-01-23T19:23:09Z,https://www.youtube.com/watch?v=tbQ4kPKRJzU,,15,572,12,5
Get check for cancer if #cancerscreening #lunghealth #cancer #cancerrisk #cancerawareness,g3hH8mvKXes,Dr. Pallavi Periwal,2025-01-13T05:36:38Z,https://www.youtube.com/watch?v=g3hH8mvKXes,,12,579,13,0
9/31 running 10km a day for colon cancer awareness month 🩵💙 #coloncancer #running #vlog,GggFO0ryVfg,Laura-Jean Bainbridge,2025-03-13T03:53:50Z,https://www.youtube.com/watch?v=GggFO0ryVfg,,41,572,0,1
Rectal cancer takes guts and your butt. #cancerawareness #rectalcancer #colonoscopy,AZLFJ9gmka4,Tony's Everyday Life,2025-02-23T01:41:06Z,https://www.youtube.com/watch?v=AZLFJ9gmka4,,7,595,32,3
Please kindly help if you can #cancer #cancer1 #cancerawareness,RHLUNFJn7pg,Give a chance to a child ,2025-03-11T07:52:15Z,https://www.youtube.com/watch?v=RHLUNFJn7pg,,22,557,59,2
Day 2/31 running 10km a day for colon cancer awareness month #running #vlog #coloncancer,Wy4v16wdCqk,Laura-Jean Bainbridge,2025-03-03T19:53:47Z,https://www.youtube.com/watch?v=Wy4v16wdCqk,,60,551,26,4
आपको बहत कुछ मिलेगा...👍🎁😃#cancer#awareness #motivation #mentalhealth #trending,etFj9oajxJU,Life With Cancer,2025-01-06T12:53:11Z,https://www.youtube.com/watch?v=etFj9oajxJU,आपको बहुत कुछ मिलेगा...      #cancer #awareness #motivation #mentalhealth #trending #youtube ...,51,577,40,7
#cancer #helpmemakethismakesense #love #cancerawareness,cbJT9TJRzz8,Give a chance to a child ,2025-03-10T19:37:37Z,https://www.youtube.com/watch?v=cbJT9TJRzz8,,20,533,63,2
Pap Smear Test.. Cancer Awareness🎗️#papsmear #cervicalcancer #cervical #cervicaltreatment #cancer#yt,WfsIwNMy0eg,Health & Medical Care 🌐,2025-03-05T18:20:17Z,https://www.youtube.com/watch?v=WfsIwNMy0eg,Pap Smear Test.. Cancer Awareness🎗️#papsmear #cervicalcancer #cervical #cervicaltreatment #cancer#yt #cancerawareness ...,19,3465,11,0
March is National Colorectal Cancer Awareness Month #ColorectalCancerAwarenessMonth,XrbGKc6aWfQ,Lead From Behind,2025-03-01T13:45:04Z,https://www.youtube.com/watch?v=XrbGKc6aWfQ,It's National #ColorectalCancerAwarenessMonth! The ultimate self care is to get screened. Visit getscreened.org to learn more ...,32,537,8,0
Breast Cancer Awareness with Dr. Vikas Goswami #breastcancer #breastcancerawareness #facts #trending,oJNsyHbL1zg,Dr. Vikas Goswami - Oncologist,2025-02-25T15:16:15Z,https://www.youtube.com/watch?v=oJNsyHbL1zg,,59,627,25,2
Day 3/31 10km a day for colon cancer awareness month #fyp #coloncancer #vlog,DOTB3kW9z2I,Laura-Jean Bainbridge,2025-03-05T03:15:46Z,https://www.youtube.com/watch?v=DOTB3kW9z2I,,19,530,22,5
Yaba TV Show supporting Lung Cancer Awareness. #lungcancer #lungcancersurvivor #talkshow,r5BWsInnMcw,Yaba TV Los Angeles,2025-01-13T19:35:34Z,https://www.youtube.com/watch?v=r5BWsInnMcw,"Sia Sia talks with Freddie Muse Jr., CEO of The Men's Cancer Network about the importance of early detection and regular health ...",53,542,12,1
Can every lump or swelling be a sign of cancer? #cancerawareness  #healthtips  #cancer,mdoNrMx8Kkg,Dr.Sudhir Kumar Rawal,2025-01-20T07:48:17Z,https://www.youtube.com/watch?v=mdoNrMx8Kkg,,45,533,9,0
Warming up for the ride at #bikeathon 2025. #cancer #awareness #event #cameragasvlogs,avWZ4dJPBI8,cameRagas Vlogs,2025-02-28T12:30:56Z,https://www.youtube.com/watch?v=avWZ4dJPBI8,visited the Bikeathon 2025 Cancer awareness event at Max Nanavati Hospital.,25,536,15,0
CANCER AWARENESS: Save your loved ones #podcast  #podcastclips  #fyp  #cancer  #health,rbr8k_K0Drw,Amir and Rick Show,2025-02-28T10:26:37Z,https://www.youtube.com/watch?v=rbr8k_K0Drw,,59,539,7,0
💡 Breast Cancer Awareness: Empowering Change Through Advocacy,ernopsFrxRc,The Tragedy Academy Podcast,2025-01-15T15:17:18Z,https://www.youtube.com/watch?v=ernopsFrxRc,"Empowering Change Through Advocacy In this clip, breast cancer survivor Jessica Baladad shares how her experience inspired ...",59,506,11,0
PSA Blood Test Time #zacbowfitness #prostatecancerawareness #prostatecancer #cancer #cancerawareness,1cRJ1Kxbdoo,ZacBow Fitness,2025-03-03T12:05:31Z,https://www.youtube.com/watch?v=1cRJ1Kxbdoo,,47,515,6,0
Breast Cancer Awareness | Gaanth Pe Dhyan | Tata Trusts,J56emZ1wElA,Tata Trusts,2025-02-04T14:36:38Z,https://www.youtube.com/watch?v=J56emZ1wElA,"Beyond the headlines and statistics, there are untold stories, silent struggles, and facts that rarely come up in everyday ...",58,504,7,1
23/31 10k a day for colon cancer awareness month 🩵💙 #runner #fightcrc #coloncancer,238SOB1AcTg,Laura-Jean Bainbridge,2025-03-25T18:19:43Z,https://www.youtube.com/watch?v=238SOB1AcTg,,44,494,23,4
Breast cancer awareness campaign video - (TVC 15 seconds landscape),YZnow65Kpuc,NHS Cancer Alliance - East of England,2025-02-18T10:05:40Z,https://www.youtube.com/watch?v=YZnow65Kpuc,The NHS has published a new campaign to encourage more women to take up their offer of screening for breast cancer.,15,688,2,0
Day 5/31 running 10km a day for colon cancer awareness month 🩵 #coloncancer #running #cancer,2AwL6FUL2-Q,Laura-Jean Bainbridge,2025-03-08T17:31:24Z,https://www.youtube.com/watch?v=2AwL6FUL2-Q,,6,503,33,2
Lets fighter cancer #cancer #cancer1 #cancerawareness,OtRt15UBMmc,Give a chance to a child ,2025-03-11T07:57:38Z,https://www.youtube.com/watch?v=OtRt15UBMmc,,26,483,37,0
Day 4/31 10km a day for colon cancer awareness month. ❤️ #coloncancer #minivlog #running,xrwGy_UAsHk,Laura-Jean Bainbridge,2025-03-06T16:06:34Z,https://www.youtube.com/watch?v=xrwGy_UAsHk,,43,473,0,6
Is Cancer Contagious? | Unseen Equation           #cancer #awareness #viralshorts #cancerawareness,bvjbEM58lO0,Unseen Equation,2025-03-14T13:03:30Z,https://www.youtube.com/watch?v=bvjbEM58lO0,,31,493,0,3
BREAST CANCER AWARENESS CAMPAIGN AT KROBO GIRLS SHS. #pamperme #love #breastcancerawareness,C5PCcwrO0L8,Sentigh,2025-03-20T09:48:21Z,https://www.youtube.com/watch?v=C5PCcwrO0L8,I spent my day at Krobo Girls SHS with Mx24 tv for the Crox it Out Campaign Movement.,41,554,13,0
Say No To Smoking🚫#Smoking #CancerAwareness #cancer #HealthyChoices #BeAware #StayStrong #Alcohol,6NZJryM91BY,Ashish Gupta,2025-03-03T14:23:23Z,https://www.youtube.com/watch?v=6NZJryM91BY,,28,471,13,1
"Fighting strong, living brave: cancer awareness #coldcap #cancerawareness",ejn9h2-74oI,Gordon Nguyen,2025-03-16T15:45:17Z,https://www.youtube.com/watch?v=ejn9h2-74oI,Fighting cancer with grace #coldcap #coldcapping #cancerawareness #breastcancer #fok.,6,467,17,0
Unknown factors which influence breast cancer #drramyavaliveru #breastcancer #cancerawareness,tg_cWLsMIvQ,Dr Ramya Valiveru | Breast and Thyroid surgeon,2025-02-24T05:25:29Z,https://www.youtube.com/watch?v=tg_cWLsMIvQ,,11,481,3,0
28/31 10k a day for colon cancer awareness month 🩵💙 #running #cancerawareness #coloncancer,13vGHSOgUgk,Laura-Jean Bainbridge,2025-03-29T21:56:28Z,https://www.youtube.com/watch?v=13vGHSOgUgk,,57,484,20,3
God gifted me second life ❤️#cancer #survivor #stories #women #cancerawareness #unlivedlife #viral,XtElXvVnSxc,Sukoon_The_Bharat,2025-02-04T03:48:22Z,https://www.youtube.com/watch?v=XtElXvVnSxc,"God gifted me second life ❤️#cancer #survivor #stories #women #cancerawareness #unlivedlife #viral cancer survivor,cancer ...",38,485,6,0
Cervical cancer vaccination #hpv # cervical  #cancer #awareness #video #sowjanya #gynecologist,z08sU5p5huM,Geethasagar ,2025-02-10T14:59:13Z,https://www.youtube.com/watch?v=z08sU5p5huM,,76,623,48,6
Alcohol ke 2 Peg... #cancerawareness #alcoholfree #alcoholaddiction #cancer,y_wa6L_GEfM,Dr Dinesh Singh Oncologist,2025-01-04T14:19:39Z,https://www.youtube.com/watch?v=y_wa6L_GEfM,,52,588,37,0
#cancer #cancerawareness #breastcancer #breastcancerawareness #cancerjourney #cancerfighter,OACbU9oBbTA,Great Mich Adventure,2025-02-18T13:59:43Z,https://www.youtube.com/watch?v=OACbU9oBbTA,,9,448,12,2
#followers #follow #ofw #followformore #followme #cancerpatient #cancerawareness #cancer #cancercare,saSaw5fS-_Q,Boy Kiat,2025-02-11T09:11:16Z,https://www.youtube.com/watch?v=saSaw5fS-_Q,,21,437,7,1
May is skin cancer awareness month. had your check? #sharethefacts,4zGEMK0Bf8k,Alexander Alsopm,2025-03-15T00:45:00Z,https://www.youtube.com/watch?v=4zGEMK0Bf8k,May is skin cancer awareness month time for a skin check! #sharethefacts #dermatology #skincare.,16,442,7,0
Breast Cancer Awareness | Early Detection of Breast Cancer | Importance of Breast Cancer Screening,cUD88JUukVU,"Indian Cancer Society, Karnataka",2025-02-06T07:28:20Z,https://www.youtube.com/watch?v=cUD88JUukVU,"Breast Cancer: Early Detection Saves Lives Early detection is key! The Indian Cancer Society, with Oracle's support, urges women ...",78,474,88,6
14/31 10k a day for colon cancer awareness month 🩵💙 #runner #coloncancer #vlog,_IWGUHYAxAQ,Laura-Jean Bainbridge,2025-03-19T20:29:40Z,https://www.youtube.com/watch?v=_IWGUHYAxAQ,,43,436,0,2
Can Alternative Treatments Really Cure Cancer? #cancerawareness #AlternativeTreatmentMyth,jf_ZLQoRBvM,Sundaram Medical Foundation,2025-03-31T11:30:26Z,https://www.youtube.com/watch?v=jf_ZLQoRBvM,Many believe that alternative treatments hold the cure for cancer. But what's the truth? If you're curious about whether these ...,60,1356,9,0
Young But Cancer Aware💪 #CancerAwareness #CancerPrevention #HealthFirst #BeAware #cancer #young,3jocNct0hb8,Ashish Gupta,2025-01-18T13:14:07Z,https://www.youtube.com/watch?v=3jocNct0hb8,,34,425,8,1
Lung Cancer किसे होता है? | Shine With Sameer #LungHealth #CancerCare #CancerAwareness,Gv8eZnaradc,Shine With Sameer,2025-01-22T04:45:00Z,https://www.youtube.com/watch?v=Gv8eZnaradc,Who is most at risk for lung cancer? Learn the key factors that can increase your chances of developing this disease.,46,425,12,2
Breast Cancer Awareness and World Cancer Day: A Call to Action,XZDlQtVGNXE,Cancer Foundation Hospital,2025-02-14T19:00:16Z,https://www.youtube.com/watch?v=XZDlQtVGNXE,"In honor of World Cancer Day 2025, this video aims to raise awareness about the importance of breast cancer awareness and ...",63,457,3,0
Cancer rates in Northeast India #shorts #cancerawareness #awareness,fiIqGDBFrms,All About Success Podcast,2025-01-08T13:47:47Z,https://www.youtube.com/watch?v=fiIqGDBFrms,,41,415,7,0
Thyroid Cancer Awareness🦋 #cancer #shorts #survival #awareness #thyroid #trending #fight #god #live,_Wshnf_VkgY,Filipa Gomes,2025-01-17T19:59:00Z,https://www.youtube.com/watch?v=_Wshnf_VkgY,,60,418,10,8
My Family's Cancer History: Breast Cancer Awareness,iHWMC63Kozg,David Witherspoon,2025-02-22T04:15:44Z,https://www.youtube.com/watch?v=iHWMC63Kozg,Join us for a poignant discussion on breast cancer awareness during Breast Cancer Awareness Month. We share personal stories ...,53,415,13,0
13/31 10k a day for colon cancer awareness month 💙🩵 #running #coloncancer #vlog,s2ZVje8Fayw,Laura-Jean Bainbridge,2025-03-19T20:28:22Z,https://www.youtube.com/watch?v=s2ZVje8Fayw,,48,423,0,1
|| cervical cancer awareness seminar || #viralvideos #doctor #awareness #motivation #cancer,igK6mNlObvA,the medicos,2025-03-03T13:20:24Z,https://www.youtube.com/watch?v=igK6mNlObvA,,16,510,10,1
Join Princess Latina's Breast Cancer Awareness Concert on March 22,9PIIdJS0rPQ,Just Gimme the Mic,2025-03-13T16:51:13Z,https://www.youtube.com/watch?v=9PIIdJS0rPQ,We're thrilled to support Princess Latina's Breast Awareness Concert in the Bronx on March 22. This heartfelt event honors cancer ...,32,415,6,0
October marks breast cancer awareness month #survivor #strong #mom,DWPjR9ecK0k,Green Martinez,2025-02-22T16:45:00Z,https://www.youtube.com/watch?v=DWPjR9ecK0k,October marks breast cancer awareness month! #survivor #strong #mom #gigi #fok.,60,407,5,0
Kidney Cancer Warning Signs You Shouldn’t Ignore! #ytshorts  #cancer #cancerawareness,BiiYmECx4uM,DR. SANDEEP HARKAR ,2025-03-13T05:19:47Z,https://www.youtube.com/watch?v=BiiYmECx4uM,Kidney Cancer Warning Signs You Shouldn't Ignore! #kidneycancer #besturologistingurugram #drsandeepharkar #holi ...,54,445,2,2
Sanjay Dutt & Anupam Kher come together to spread cancer awareness at the Jio Convention Centre 💪🏻,Yg7SVDOCEIc,BollywoodHelpline,2025-02-09T15:58:08Z,https://www.youtube.com/watch?v=Yg7SVDOCEIc,,89,396,8,0
Rare but Real: Saree Cancer Awareness – Know the Signs! | Dr Saadvik Raghuram Y | Arete Hospitals,vDSHgmU1eew,Arete Hospitals,2025-01-20T12:30:54Z,https://www.youtube.com/watch?v=vDSHgmU1eew,Saree Cancer: A Rare Skin Cancer Linked to Wearing Sarees Saree cancer is a rare type of skin cancer that occurs due to ...,42,568,4,0
World Cancer Day | Cancer Awareness | Early Detection | Cancer Care & Treatment | Amor Cancer Center,-9tbGW2QE9Y,Amor Multispecialty Hospitals,2025-02-04T06:34:23Z,https://www.youtube.com/watch?v=-9tbGW2QE9Y,World Cancer Day | Cancer Awareness | Early Detection | Cancer Care & Treatment | Amor Cancer Center About Amor Cancer ...,46,407,65,5
