Title,Video ID,Channel,Published At,URL,Description,Video Length
Day 7/30 Juice Cleanse! Try this powerful juice!! #juicecleanse #juicerecipe #detoxjuice #healthy,dEHC8fxcijg,Ashley G - Glo and Grow Lifestyle,2025-01-06T01:07:34Z,https://www.youtube.com/watch?v=dEHC8fxcijg,,
Boost your gut health with a juicing routine #juicecleanse #guthealth,h5qTiARjEmk,Angela Belokon,2025-02-25T15:45:05Z,https://www.youtube.com/watch?v=h5qTiARjEmk,Boost your gut health with a juicing routine #juicecleanse #guthealth #healthy #fok.,
Day 11 Of My 21 Day Anti-Inflammatory Juice Detox #antiinflammatory #juice #inflammation #juicewrld,2e9jK5EKFeA,Inflammation Help,2025-03-14T23:00:04Z,https://www.youtube.com/watch?v=2e9jK5EKFeA,"Day 11, and I'm halfway through the green juice detox, it's time to level up! ✓ 2 heads baby bok choy ✓ 1 cup dandelion ...",
Costco Juice Cleanse?! Let's Do This! 🥤,9h1lbiAL_Jc,antioxidantfruits,2025-02-01T04:45:00Z,https://www.youtube.com/watch?v=9h1lbiAL_Jc,Costco's Pressed 3-Day Cleanse Bundle (18 Juices & 6 Shots) https://www.costco.com/.product.100822226.html How to cleanse ...,
5 Green Juice Recipes for Health (and HOW to Make Them),DwE1MTNB6Q8,Laxita Rawat ,2025-01-04T06:48:13Z,https://www.youtube.com/watch?v=DwE1MTNB6Q8,"wellness, green juice, juicing tips, green smoothie recipes, wellness shots, detox drinks, green smoothies, nutritious juice, healthy ...",
Lose weight & detox with this Hydrating Cucumber Juice! 🥒 #juicing #juicer,c8sZgPeIRyY,Lynn Nessa,2025-03-15T23:00:29Z,https://www.youtube.com/watch?v=c8sZgPeIRyY,"Want to lose weight, flush out toxins, and feel amazing? This Hydrating Cucumber Juice is packed with nutrients that help reduce ...",
"Detoxify, cleanse and hydrate your body! #juicecleanse",HV_1t-6GmXQ,Ashley G - Glo and Grow Lifestyle,2025-01-02T20:23:52Z,https://www.youtube.com/watch?v=HV_1t-6GmXQ,,
Drop your seeds #gardening #organic #garden #juicecleanse #pineapple #healthylifestyle #viralvideo,v9wTzi_QeLQ,Cali Bro Jay,2025-03-23T12:36:30Z,https://www.youtube.com/watch?v=v9wTzi_QeLQ,,
Join the juice cleanse challenge!,0eDmAoqgGPY,Coreyn Mason,2025-03-01T20:45:00Z,https://www.youtube.com/watch?v=0eDmAoqgGPY,Juice cleanse begins! whos in? #fok.,
Juice recipe #shorts #trendingshorts #viralvideo,a4D9pZ9BhrY,FFood 🍳,2025-02-13T13:08:42Z,https://www.youtube.com/watch?v=a4D9pZ9BhrY,turmeric ginger lemon shot #juice cleanse recipes for gut health #turmeric immunity shot #best lemon extract #homemade liver ...,
"Beet, apple & lemon juice! #viralshorts #nutritiontips #recipe #healthy #kitchen #juicecleanse",nR8V7cU47_8,Get Healthy with Nesh,2025-03-03T13:46:41Z,https://www.youtube.com/watch?v=nR8V7cU47_8,,
Reduce inflammation with this immunity boost#immunity #juicerecipe #juicing #juicewrld #juicecleanse,sn7MC4a_3lk,TheRajEditt,2025-03-21T00:52:41Z,https://www.youtube.com/watch?v=sn7MC4a_3lk,"Glow Juice for Clear Skin & Energy! This Glow Juice is packed with vitamins and antioxidants to boost your skin, digestion, ...",
✅ Day 9: What Happens to Your Body After 9 Days of Juice Fasting?,tz5yDzqjnFA,Simply Hanessa,2025-02-28T13:01:30Z,https://www.youtube.com/watch?v=tz5yDzqjnFA,"We've made it to Day 9 of this juice fast, and I'm feeling the changes! From being caffeine-free to handling cravings better, my ...",
QuickStart #juicedetox  FREE GUIDE #rulockedin Detox Live JuicING with LaLa,WRCNMf18EFE,LaLa •The High Vibe Coach • Energy,2025-03-27T19:24:41Z,https://www.youtube.com/watch?v=WRCNMf18EFE,FREE Juicing for Weight Loss QuickStart Guide ...,
Spring has sprung! Anyone doing a juice cleanse? Tips on my site www.chefjjackson.com! #juicing,TKaxbJ_etao,Mr Foodtastic,2025-03-27T15:30:09Z,https://www.youtube.com/watch?v=TKaxbJ_etao,Follow me on social media for more short recipes and food-related videos Instagram: https://www.instagram.com/mrfoodtastic Tik ...,
Day 8/30 Juice Cleanse! Juice with me 🥕🍊 #juicecleanse #juicerecipe #healthylifestyle,fLcz8ErIV7o,Ashley G - Glo and Grow Lifestyle,2025-01-07T01:06:18Z,https://www.youtube.com/watch?v=fLcz8ErIV7o,,
It’s not fat loss #detox #cleanse #fatloss,T1iaj6JfVV0,Jayd Harrison (Jaydigains),2025-03-07T17:00:39Z,https://www.youtube.com/watch?v=T1iaj6JfVV0,"Juice cleanses can give the illusion of weight loss or fat burning, but it's mostly due to dehydration and the lack of food in your ...",
#juicerecipes #juice #juicecleanse #cleanjuice #cleaneating #veganlifestlye #vegan#healthylifestyle,mS0EQiuwFyQ,VeganBae ,2025-01-31T19:33:12Z,https://www.youtube.com/watch?v=mS0EQiuwFyQ,,
Day 7/30 Juice Cleanse! Try this powerful juice!! #juicecleanse #juicerecipe #detoxjuice #healthy,dEHC8fxcijg,Ashley G - Glo and Grow Lifestyle,2025-01-06T01:07:34Z,https://www.youtube.com/watch?v=dEHC8fxcijg,,
Boost your gut health with a juicing routine #juicecleanse #guthealth,h5qTiARjEmk,Angela Belokon,2025-02-25T15:45:05Z,https://www.youtube.com/watch?v=h5qTiARjEmk,Boost your gut health with a juicing routine #juicecleanse #guthealth #healthy #fok.,
Can you drink juice while fasting?,0GCj8Df1sx0,Emma | Your Fasting Coach,2025-01-28T20:00:00Z,https://www.youtube.com/watch?v=0GCj8Df1sx0,Is juice fasting really fasting?#fasting #intermittentfasting #intermittentdiet #weightloss #keto #ketodiet #fatloss #fastingforwomen ...,
Day 11 Of My 21 Day Anti-Inflammatory Juice Detox #antiinflammatory #juice #inflammation #juicewrld,2e9jK5EKFeA,Inflammation Help,2025-03-14T23:00:04Z,https://www.youtube.com/watch?v=2e9jK5EKFeA,"Day 11, and I'm halfway through the green juice detox, it's time to level up! ✓ 2 heads baby bok choy ✓ 1 cup dandelion ...",
Costco Juice Cleanse?! Let's Do This! 🥤,9h1lbiAL_Jc,antioxidantfruits,2025-02-01T04:45:00Z,https://www.youtube.com/watch?v=9h1lbiAL_Jc,Costco's Pressed 3-Day Cleanse Bundle (18 Juices & 6 Shots) https://www.costco.com/.product.100822226.html How to cleanse ...,
Lose weight & detox with this Hydrating Cucumber Juice! 🥒 #juicing #juicer,c8sZgPeIRyY,Lynn Nessa,2025-03-15T23:00:29Z,https://www.youtube.com/watch?v=c8sZgPeIRyY,"Want to lose weight, flush out toxins, and feel amazing? This Hydrating Cucumber Juice is packed with nutrients that help reduce ...",
"Detoxify, cleanse and hydrate your body! #juicecleanse",HV_1t-6GmXQ,Ashley G - Glo and Grow Lifestyle,2025-01-02T20:23:52Z,https://www.youtube.com/watch?v=HV_1t-6GmXQ,,
"I made some green juice 💚used celery, cucumber, lemon, ginger, and apples:) #fyp #detox #juicer",XQulY4T_K2Y,Jayda,2025-01-21T19:08:04Z,https://www.youtube.com/watch?v=XQulY4T_K2Y,,
Detox water#youtubeshorts #shortsfeed #viralshort #recipe #detox,YCvwERS5SZs,PratikshaBlog,2025-01-14T05:15:08Z,https://www.youtube.com/watch?v=YCvwERS5SZs,juicedetox #juicecleanse #detox #coldpressedjuice #juice #juicing #healthylifestyle #juicelife #healthyjuice #greenjuice #healthy ...,
8 BENEFITS of DETOX JUICE with KALE #shorts #juice #detox #health #healthy #kale,-rf0UE_Xh6g,CS Health,2025-01-09T15:00:00Z,https://www.youtube.com/watch?v=-rf0UE_Xh6g,,
"15-Day Juice Fast Update, Started at 93.5kg, after 15 days of dedication, I’m now at 87.7kg#fruit",y418Ef8W-gw,Terngu Uduezue,2025-01-08T09:03:30Z,https://www.youtube.com/watch?v=y418Ef8W-gw,,
Day 5 of 21 day Juice Fast,qO1cMgh1jTg,RealLyfeWithMo,2025-01-14T21:44:04Z,https://www.youtube.com/watch?v=qO1cMgh1jTg,,
Drop your seeds #gardening #organic #garden #juicecleanse #pineapple #healthylifestyle #viralvideo,v9wTzi_QeLQ,Cali Bro Jay,2025-03-23T12:36:30Z,https://www.youtube.com/watch?v=v9wTzi_QeLQ,,
Juicing detox for weight loss & fitness #fok #detoxdrinkrecipes,oRSpRHzqItk,Imran Khan,2025-03-07T03:41:38Z,https://www.youtube.com/watch?v=oRSpRHzqItk,Juicing for weight loss & detox drinks | fitness routine #fok #detoxdrink #weightloss.,
Join the juice cleanse challenge!,0eDmAoqgGPY,Coreyn Mason,2025-03-01T20:45:00Z,https://www.youtube.com/watch?v=0eDmAoqgGPY,Juice cleanse begins! whos in? #fok.,
"Beet, apple & lemon juice! #viralshorts #nutritiontips #recipe #healthy #kitchen #juicecleanse",nR8V7cU47_8,Get Healthy with Nesh,2025-03-03T13:46:41Z,https://www.youtube.com/watch?v=nR8V7cU47_8,,
✅ Day 9: What Happens to Your Body After 9 Days of Juice Fasting?,tz5yDzqjnFA,Simply Hanessa,2025-02-28T13:01:30Z,https://www.youtube.com/watch?v=tz5yDzqjnFA,"We've made it to Day 9 of this juice fast, and I'm feeling the changes! From being caffeine-free to handling cravings better, my ...",
Day 2 of 21 juice fast,ffQAvoBKrBc,RealLyfeWithMo,2025-01-11T18:25:41Z,https://www.youtube.com/watch?v=ffQAvoBKrBc,,
Spring has sprung! Anyone doing a juice cleanse? Tips on my site www.chefjjackson.com! #juicing,TKaxbJ_etao,Mr Foodtastic,2025-03-27T15:30:09Z,https://www.youtube.com/watch?v=TKaxbJ_etao,Follow me on social media for more short recipes and food-related videos Instagram: https://www.instagram.com/mrfoodtastic Tik ...,
My secret! Juice fast #weightgoal #GlowFromWithin #FreshJuiceMagic #HealthyLiving  #DynamicJoy,Jgqqd5zc_kg,Joy Umeobi,2025-02-21T02:00:22Z,https://www.youtube.com/watch?v=Jgqqd5zc_kg,weightmanagement #GlowFromWithin #FreshJuiceMagic #HealthyLiving #DynamicJoy Juice fast! One of the secrets to my weight ...,
Day 8/30 Juice Cleanse! Juice with me 🥕🍊 #juicecleanse #juicerecipe #healthylifestyle,fLcz8ErIV7o,Ashley G - Glo and Grow Lifestyle,2025-01-07T01:06:18Z,https://www.youtube.com/watch?v=fLcz8ErIV7o,,
Carrot & Orange Juice recipe #carrotjuice #orangejuice #freshjuice #healthyjuice #juicecleanse,Piv9lwQleag,Urvi's Kitchen,2025-03-04T10:57:43Z,https://www.youtube.com/watch?v=Piv9lwQleag,"Ingredients: • 4 large carrots, peeled and chopped • 2 large oranges, peeled and segmented • 1⁄2 cup water (adjust for desired ...",
Green Juice Detox #juice #juicing #detox #viralvideo #foodie #alkaline #healthy #removetoxins,6i5VbUSugTs,SPiRiTUAL G€MiNi GODD€SS ,2025-02-10T07:35:46Z,https://www.youtube.com/watch?v=6i5VbUSugTs,,
Day 12 of 21 on my juice fast,m2U4wcNWbcg,RealLyfeWithMo,2025-01-22T00:57:53Z,https://www.youtube.com/watch?v=m2U4wcNWbcg,,
3-Day Juice Fast 🍹✨,Qa6z7EuS2LQ,Diric Jordan,2025-01-21T22:33:49Z,https://www.youtube.com/watch?v=Qa6z7EuS2LQ,,
Do Juicing Cleanses Make You Sick?,E4ZlHsBhibg,DiabeticDad Man,2025-02-13T17:00:17Z,https://www.youtube.com/watch?v=E4ZlHsBhibg,"Avoid getting sick after your next juice cleanse with me. Introducing solid foods after your detox is no joke, do it wrong and you'll ...",
✅ Day 8: How I’m Staying Motivated on My Juice Fast!,fIDCEWG7ZSA,Simply Hanessa,2025-02-27T20:56:48Z,https://www.youtube.com/watch?v=fIDCEWG7ZSA,"Day 8: How We Staying Motivated on My Juice Fast! Eight days in, and let's be real—this journey isn't easy. But staying motivated ...",
SUPER HEALTHY / DETOX JUICE / REFRESHING #juicewrld #trending #youtubeshorts #ytshorts #health,QFgdPPdMyQE,Chef SV,2025-01-20T09:02:34Z,https://www.youtube.com/watch?v=QFgdPPdMyQE,Subscribe for more healthy and delicious recipes @Its_me_saffron #detox #healthylifestyle #health #kurus #diet #fitness ...,
#short #shorts Staring another JUICE fast tomorrow if yall wanna join me,bCkM_6hIGfA,RealLyfeWithMo,2025-03-17T19:13:01Z,https://www.youtube.com/watch?v=bCkM_6hIGfA,,
Watch this video if you want clear your skin!! #juice #cleanse #detox,XiLfvoYboRc,Elevated Movement Training,2025-03-09T23:45:49Z,https://www.youtube.com/watch?v=XiLfvoYboRc,,
💚 #greenjuicerecipe #weightloss #weightlossjourney #guthealth #juicecleanse,C25LNDQotjY,Harmony Ward,2025-01-21T18:54:31Z,https://www.youtube.com/watch?v=C25LNDQotjY,,
"Juice Fast Day 3 Dinner juices:1 OJ, 2 OJ with parsley&herbs, 3 Ginger turmeric Apple 🍎",1pJbxtzpA9I,Isabella Essence,2025-03-23T02:15:25Z,https://www.youtube.com/watch?v=1pJbxtzpA9I,,
Seek and you shall find ✨ #rawliving #juicefast #holistichealing #holistichealth #food #cleanse,BQ4Dz2pG1Q8,nystro,2025-02-01T06:23:54Z,https://www.youtube.com/watch?v=BQ4Dz2pG1Q8,"Seek and you shall find ✨ The truth is hidden in plain sight, waiting for YOU to uncover it. Your body is the temple, your mind the ...",
the juice you should be making every day #detox #healthylifestyle #juicecleanse #cleanliving,XUMEddC5zkY,Holistic Living with Adrienne,2025-03-19T21:49:37Z,https://www.youtube.com/watch?v=XUMEddC5zkY,,
5 Days of Juice Cleanse #shorts #ytshorts #smoothie #weightlosstips,KkAADhXOEkE,Transform to Fit,2025-02-25T11:40:34Z,https://www.youtube.com/watch?v=KkAADhXOEkE,Full Recipes     DAY ONE KIWI GREEN 1/2 bunch spinach leaves 4 celery stalks & leaves 3 kiwis DAY TWO MINTED ...,
"I really wanted something fried, but this will do 😭 #juicecleanse #coldpressedjuice #detox #health",GIT_LeqlQKA,angel sithideth,2025-03-18T20:42:11Z,https://www.youtube.com/watch?v=GIT_LeqlQKA,,
PREPARATION SAVES TIME #keepposting #gardening #viralvideo #growyourownfood #like #garden,CmahJgiMjxo,Cali Bro Jay,2025-02-24T02:03:12Z,https://www.youtube.com/watch?v=CmahJgiMjxo,juicing #detox #juice #vegan #healthylifestyle #healthy #juicecleanse #plantbased #health #healthyfood #coldpressedjuice ...,
Cleanse And Rejuvenate The ultimate Detox Juice Recipe For A Fresh Start..,_C4n3XNwKGc,Latoya Dalley,2025-01-17T16:44:01Z,https://www.youtube.com/watch?v=_C4n3XNwKGc,"Blend Together Pineapple, Orange,Red Bell pepper, Carrots and giner.. #youtubeshortsviral #animals #asmrsounds.",
Hydrating Cucumber Juice for Weight Loss & Detox!,lzMusjAb9oM,Lynn Nessa,2025-03-15T19:30:10Z,https://www.youtube.com/watch?v=lzMusjAb9oM,"Want to lose weight, flush out toxins, and feel amazing? This Hydrating Cucumber Juice is packed with nutrients that help reduce ...",
Get your cayenne!  #health #juice #detox #healthy #cayenne #capsaicin,6wj_zV4ctjM,Olivia Jade,2025-02-19T21:38:00Z,https://www.youtube.com/watch?v=6wj_zV4ctjM,,
Detox with this Juice #youtubeshorts #shorts #juicecleanse #detox #juice #asmr #asmrsounds,5JbmfwrjXIQ,Juice & Foods,2025-01-28T09:19:41Z,https://www.youtube.com/watch?v=5JbmfwrjXIQ,Detox with this Juice #youtubeshorts #shorts #juicecleanse #detox #juice #asmr I made this AMAZING Detox juice in #asmr.,
Carrot Pineapple #Juicing for #weightloss and #detox,LqzYAqohn7k,LaLa •The High Vibe Coach • Energy,2025-02-28T20:28:47Z,https://www.youtube.com/watch?v=LqzYAqohn7k,Golden Glow Detox Juice | Carrot Pineapple Orange Ginger Juice Recipe Want more juice recipes? Grab my Juicing e-Bundle.,
3-Day Detox with Costco: Pressed Juicery Cleanse,Fs7Im9Nu_KQ,antioxidantfruits,2025-02-02T00:00:13Z,https://www.youtube.com/watch?v=Fs7Im9Nu_KQ,Pressed 3-Day Cleanse Bundle (18 Juices & 6 Shots) https://www.costco.com/.product.100822226.html #healthylivingjourney ...,
10 Day Juice Cleanse Starting April 1st!,JJF4Snq-oeo,Janique ,2025-03-19T19:00:17Z,https://www.youtube.com/watch?v=JJF4Snq-oeo,lets do a 10 day juice challenge to prepare for the summer. lets recharge our energy with a juice challenge. 10 days of freshly ...,
Carrot Juice Cleanse #health #healthy #healthylifestyle,nfSZ2c58x2s,Jazmín,2025-01-12T03:05:58Z,https://www.youtube.com/watch?v=nfSZ2c58x2s,Contains: Vitamin A Vitamin E Vitamin C Antioxidants Good for skin + more!,
Get rid of Parasites. Juice Cleanse #shorts #juicecleanse #juice #recipe #parasite,SkNCigGjF2g,Juice & Foods,2025-02-19T17:10:53Z,https://www.youtube.com/watch?v=SkNCigGjF2g,Get rid of Parasites. Juice Cleanse #shorts #juicecleanse #juice #recipe #parasite #youtubeshorts #antiaging I made this simple ...,
#juicing #freshjuice #juicecleanse #gingershot  #healthyjuice #ginger #lime #orange #turmeric,to-WeRx_UM8,Triciaa.__,2025-02-17T12:01:20Z,https://www.youtube.com/watch?v=to-WeRx_UM8,,
"Detox juice, cleanse and glowing your skin #fruitjuice #detoxification #healthyjuicerecipe #shorts",ns3BtpMql7U,Liza Caasi,2025-02-10T06:30:47Z,https://www.youtube.com/watch?v=ns3BtpMql7U,,
✅ Day 12: Is Juice Fasting Expensive? Budget Tips for Juicing!,sI-dlNg2mlQ,Simply Hanessa,2025-03-04T02:07:11Z,https://www.youtube.com/watch?v=sI-dlNg2mlQ,"Juice fasting can seem pricey, but it doesn't have to be! Today, I'm breaking down the costs and sharing my best budget-friendly ...",
Watermelon cleanse and iron booster juice|homemade #juice #healthyliving #fyp #namaj2 #wellness,a5Kf3-_lrBg,UP CLOSE WITH JENNY,2025-03-15T10:51:41Z,https://www.youtube.com/watch?v=a5Kf3-_lrBg,,
"Think you're detoxing properly, but still feel sluggish? 👀",Ls9HRC8vVMk,Loren Lockman,2025-02-12T14:17:19Z,https://www.youtube.com/watch?v=Ls9HRC8vVMk,"After 37 years as a fasting specialist, here's what most ""wellness experts"" won't tell you about detox: True detoxification isn't about ...",
Drink for Detox.  Juice 7 day #juicecleanse reset #fruit,-xnJ19wHcjs,LaLa •The High Vibe Coach • Energy,2025-03-05T10:20:23Z,https://www.youtube.com/watch?v=-xnJ19wHcjs,Juicing E-Bundle https://stan.store/TheHighVibeCoach/p/get-the-juicing-bundle-now Flush toxins and fuel your body with this ...,
Aloe and Orange Juice Cleanse,VGc4hG5dN9w,Naturally Sherika,2025-01-07T19:27:46Z,https://www.youtube.com/watch?v=VGc4hG5dN9w,,
Juice Your Way to a HEALTHIER You! #juicecleanse #wellness #recipes #shorts #health,aq27Vvh8rQY,Nicole Ojo,2025-01-27T14:14:11Z,https://www.youtube.com/watch?v=aq27Vvh8rQY,Are you tired of feeling sluggish and run down? Do you want to boost your energy levels and supercharge your health?,
Oreng juice/ how to make orange juice #shorts #juice,MB0MWFKMlHw,Shah Nazifa,2025-02-14T10:30:13Z,https://www.youtube.com/watch?v=MB0MWFKMlHw,Oreng juice/ how to make orange juice #shorts #juice #shorts #videoshort #youtubeshorts #nazifaskitchen786 #orange ...,
2025 Reset | 1 Day Juice Cleanse,WkShY41xKjU,Ni 💎,2025-01-02T16:31:55Z,https://www.youtube.com/watch?v=WkShY41xKjU,"Let's reset and refocus with a juice cleanse Pressed Juicery , Houston Heights Pressed Juicery is my favorite back home so ...",
Day 1 Done: Kicking Off My 40-Day Juice Fast! 🥤💪 #JuiceFast #Day1Complete,OwsGNIVdAqg,Victoria Katherine,2025-01-14T02:41:52Z,https://www.youtube.com/watch?v=OwsGNIVdAqg,,
It’s juice cleanse time #food #gogreen #weightloss #health #juicingrecipes #viralvideo,fDQ7hLsBmK4,Black girl goes green,2025-01-06T11:53:41Z,https://www.youtube.com/watch?v=fDQ7hLsBmK4,,
🚨 Detox isn’t a 3-day juice cleanse,Jhearrckspg,Christy Tanner | Holistic Health Coach ,2025-02-21T14:56:05Z,https://www.youtube.com/watch?v=Jhearrckspg,Detox isn't a 3-day juice cleanse. It's a YEARS-long process. You didn't accumulate toxins overnight... so why do we expect to get ...,
Green Harmony#GreenGlow #JuiceCleanse #HealthyHabits #WellnessJourney #CeleryJuice #CucumberCooler,lOyG2Lwpkow,Zofia Kooks,2025-01-24T05:40:03Z,https://www.youtube.com/watch?v=lOyG2Lwpkow,,
Breaking My 3 Day Fast #DetoxYourBody #JuiceCleanse #FastingForHealth #WeightLossJourney  #juicing,K8E_jeM0bOI,Joenda Ezewele,2025-01-22T16:42:12Z,https://www.youtube.com/watch?v=K8E_jeM0bOI,,
DAY 6 JUICE CLEANSE I DID BACK IN NOV 2024!🙃#juicing #fyp,iOsVo4Xrku8,Donanieshaaa,2025-02-23T05:17:21Z,https://www.youtube.com/watch?v=iOsVo4Xrku8,,
Make the best detox juice at home 🍎🍋🏘️#shorts #detoxjuice #ytshorts #juice #abcjuice #viral #short,6M8xWTXLLlE,dolchi manchi,2025-01-18T15:57:10Z,https://www.youtube.com/watch?v=6M8xWTXLLlE,Make the best detox juice at home 🏘️#shorts #detoxjuice #ytshorts #juice #abcjuice #viral #short #shorts ...,
✅ Day 2: Juice Fasting Day 2: Dealing with Cravings & First Challenges!,xbcyq1er0eo,Simply Hanessa,2025-02-19T13:01:32Z,https://www.youtube.com/watch?v=xbcyq1er0eo,"Juice Fasting Day 2: Dealing with Cravings & First Challenges! | Simply Hanessa It's Day 2 of my juice fast, and the ...",
7 day juice cleanse to start the year. #juicy #cleaning #cleanse #newyear,EvfVaAEfaN0,The Creative Imitator,2025-01-08T02:41:21Z,https://www.youtube.com/watch?v=EvfVaAEfaN0,,
Aloe Vera Pineapple Juice Cleanse - Detox Juice Recipe | How To Make Aloe Vera Juice,G90wSe_yXik,Tina Blends,2025-02-28T15:52:30Z,https://www.youtube.com/watch?v=G90wSe_yXik,"Aloe Vera is known to cleanse the colon, flush out toxins, improve digestion, purify the blood, reduce inflammation, lower high ...",
The Truth About Detox Diets! Busted!        #healthtips #motivation #health #nutrition,bZjXD_oOsqs,Vitality Health Sphere,2025-01-14T17:00:41Z,https://www.youtube.com/watch?v=bZjXD_oOsqs,"Think detox teas and juice cleanses are the ultimate health hack? Think again! In this short video, we're busting the biggest myths ...",
PINEAPPLE ORANGE GINGER #keepposting #juicecleanse #orangepeeling #growyourownfood #healthyliving,GVFc1_ga4xs,Cali Bro Jay,2025-03-09T21:18:31Z,https://www.youtube.com/watch?v=GVFc1_ga4xs,,
The surprising dark side to trendy juice cleanses,nmH3G62BtLI,Wow StudyFinds!,2025-02-18T21:43:48Z,https://www.youtube.com/watch?v=nmH3G62BtLI,"Juicing and juice cleanses are all the rage for plenty of health-conscious folks. After all, who wouldn't want to start their day off with ...",
Almost there #juicecleanse #reset #momof4 #health #fyp #10dayschallenge,mEwsivXfFhI,LifeWith Kai,2025-01-11T17:18:21Z,https://www.youtube.com/watch?v=mEwsivXfFhI,,
✅ Day 4: What I Drink in a Day on a Juice Fast (Recipes & Tips!),U_CLhP2roHI,Simply Hanessa,2025-02-21T04:50:13Z,https://www.youtube.com/watch?v=U_CLhP2roHI,Recipe: Total three 64 ouch jug 2 pineapples 1 bunch celery 3 lemon 3 ginger 5 kiwi 4 bell pepper 1 bag carrot 1 bunch of kale 1 ...,
Immune Boosting Juice Recipe,vnrKcK_SdWQ,Healing kitchen With XterPed ,2025-03-19T13:56:49Z,https://www.youtube.com/watch?v=vnrKcK_SdWQ,"""Boost your immune system with this powerful and delicious juice recipe! Made with citrus fruits, carrots, and ginger. This juice is ...",
Start your day with a cleanse! 🍏🍋🌱,WoI02BCUczg,JuiceNext,2025-01-14T09:47:47Z,https://www.youtube.com/watch?v=WoI02BCUczg,"Start your day with a cleanse! Our Celery Cleanse Deluxe juice blends the refreshing crispness of celery, green apple, ...",
3 day cleanse cause #puregreen #cleanse #juice #detox #natural #health #cure #vegetables #chubby,HTLri4qatcQ,Olivia Jade,2025-02-19T21:02:43Z,https://www.youtube.com/watch?v=HTLri4qatcQ,,
I Tried Wale Uncle Ji Healthy Juice best naturaljuiceforbody,3YPbFJAAT-8,Laxita Rawat ,2025-01-04T06:37:00Z,https://www.youtube.com/watch?v=3YPbFJAAT-8,"juice cleanse, juice recipes, detox drink, green juice benefits, green juice recipes, fresh juicing, healthy juice, body cleanse, wale ...",
"""Refresh, Rejuvenate, Recharge: The Power of Detox Juice""  #detoxjuice #detox #summerdrink #shorts",zaFAI8BKrYQ,Krispitality,2025-03-07T05:12:17Z,https://www.youtube.com/watch?v=zaFAI8BKrYQ,"DetoxJuice #HealthyLiving #CleanseYourBody #RefreshingDrinks #cooking #viralvideo #trending #update ""Refresh, Rejuvenate, ...",
"3 The Easy Way Juice Cleanse starting March 🥉 I’m looking forward to coaching, empowering, teaching",gPT4Pylfkmw,Paul’s LAW,2025-02-26T21:55:56Z,https://www.youtube.com/watch?v=gPT4Pylfkmw,,
Juice cleanse day 1,AV-98Br1N2s,Kay's healthy journey ,2025-01-05T12:49:33Z,https://www.youtube.com/watch?v=AV-98Br1N2s,,
Great Papaya Juice Recipe. 🧡 #juicecleanse #juice #recipies #shortsfeed,tusghjNUa-4,GRACIOUSLYCEE,2025-01-10T16:24:15Z,https://www.youtube.com/watch?v=tusghjNUa-4,,
Juice cleanse and win a Nama J2 Juicer! See pinned comment. #shortsviral #shortsvideo,mzGcuoCysIA,Evie Kevish,2025-01-26T15:02:53Z,https://www.youtube.com/watch?v=mzGcuoCysIA,,
Unbig your back and belly with this dandelion green juice.#juicecleanse #juicewrld #shorts,LEQJbUqnLs8,Sasu Flavas,2025-01-10T14:37:37Z,https://www.youtube.com/watch?v=LEQJbUqnLs8,,
Juicing recipe to cleanse your liver. Detox juice recipe for liver is essential! #shortsvideo,nto0FjBcym8,Evie Kevish,2025-03-02T13:00:11Z,https://www.youtube.com/watch?v=nto0FjBcym8,,
#DetoxJuice#SmoothieRecipes#HealthyDrinks#JuiceCleanse#FreshJuices#JuicingForHealth,w6NH3XbtlxM,zendaistore,2025-01-22T16:14:24Z,https://www.youtube.com/watch?v=w6NH3XbtlxM,"ZendaiStore - Brand-specific and frequently used in their posts. #ZenVibes - Reflects their calming, zen-inspired products.",
Yummy juice cleanse! 🍓#weightlossjourney #juicecleanse,4tuHzr_GpPo,Risseroe,2025-02-23T20:46:42Z,https://www.youtube.com/watch?v=4tuHzr_GpPo,,
Juice Detox: My Energizing Journey! #trending #healthyfood #nutrition #fitness #recipe,GpVeIWAjke4,Healthy Life,2025-01-29T07:15:03Z,https://www.youtube.com/watch?v=GpVeIWAjke4,,
Juice cleanse day 2 #juicecleanse #juicerecipe #smoothie #healthyliving #healthyrecipes,VMzbvi7HnYw,Justcallmeshaz,2025-02-26T00:35:32Z,https://www.youtube.com/watch?v=VMzbvi7HnYw,,
#juicecleanse#fruit#veggies#guthealth,3xBLOG3AIkw,Terrill Adams,2025-01-11T00:12:57Z,https://www.youtube.com/watch?v=3xBLOG3AIkw,,
Research Shows that Juice Cleanses Are Not as Healthy as We Thought,Ggqzeuz4Qmg,MDPI,2025-02-28T09:15:32Z,https://www.youtube.com/watch?v=Ggqzeuz4Qmg,A new study published in the Open Access journal Nutrients by researchers from Northwestern University shows how juice ...,
#JuiceCleanse #DetoxTime #HealthyLiving  #WellnessJuice #NaturalEnergy #apple #ginger #celeryjuice,XfSh5qBsKgc,Cicis_recipes,2025-02-22T20:49:21Z,https://www.youtube.com/watch?v=XfSh5qBsKgc,,
This Juice Recipe Is a Wellness Breakthrough – Barbara O'Neill Explains,zaLmhkz6AN4,BHHEC Media Department,2025-03-24T00:30:40Z,https://www.youtube.com/watch?v=zaLmhkz6AN4,"Juicing is more than just a trend—it's a powerful tool for restoring health and vitality. At Black Hills Health Retreat, Barbara O'Neill ...",
NATURAL Liver Cleansing Juice FOR a Quick Detox?,PTMoADXqjN0,FOODS  AND  HEALTH TV,2025-01-02T23:35:42Z,https://www.youtube.com/watch?v=PTMoADXqjN0,NATURAL Liver Cleansing Juice FOR a Quick Detox? Discover the powerful NATURAL Liver Cleansing Juice recipe that can ...,
