Title,Video ID,Channel,Published At,URL,Description,Video Length
Full Juice Cleanse Day 1,3O_2zU1iSRQ,DiabeticDad Man,2025-01-28T17:00:03Z,https://www.youtube.com/watch?v=3O_2zU1iSRQ,Day 1 of my two week juice cleanse to reverse my diabetes Juice 1 ingredients: Carrots Apple Lime Turmeric Spinach Cucumber ...,
Natural green juice detox cleanse #recipe,L_n3iv4HAIE,Juanita Simpson,2025-01-18T11:27:15Z,https://www.youtube.com/watch?v=L_n3iv4HAIE,Natural green juice detox cleanse Try this detox green juice if you need a total body reset to detox and cleanse . This juice can ...,
21 day juice cleanse! Trucker edition! #cdl #ladytrucker #trucker #juicing #fasting,qlaftU2j9aE,Dekaily Davis,2025-01-23T02:10:59Z,https://www.youtube.com/watch?v=qlaftU2j9aE,,
Day 22 of my 90 Day Juice Cleanse (down 21 pounds) #juicewrld #viralvideo #shorts,fkbsblbuirY,Simply KP TV,2025-02-12T13:01:02Z,https://www.youtube.com/watch?v=fkbsblbuirY,Link to juice recipes Juicing For Beginners: Simple Recipes. Low Cost Ingredients : Lose Weight. Reduce Inflammation. Detox ...,
Juice Diets and Their Surprising Impact on Gut Health,SUxUdZLwf6k,Medindia Videos,2025-02-07T06:11:33Z,https://www.youtube.com/watch?v=SUxUdZLwf6k,"Juice cleanses have been marketed as a health trend, but recent research from Northwestern University sheds light on potential ...",
Completed my first 31 day juice cleanse 🙌🏽🍾🎊🎉🫐🍓🎈🍊#cleanjuice #cleansingjuice #juicedetox,GXKqlm8X6K0,VeganBae ,2025-02-01T22:22:10Z,https://www.youtube.com/watch?v=GXKqlm8X6K0,,
Day 9/30 Juice Cleanse! #healthyrecipes #juicecleanse #juicerecipe #cleansingjuice,82KunCGGDSY,Ashley G - Glo and Grow Lifestyle,2025-01-08T04:17:12Z,https://www.youtube.com/watch?v=82KunCGGDSY,,
Most powerful Detox Juice #shorts #youtubeshorts#viralvideo#viral #trending#food#recipe#detox#juice,7533_j7o6MA,dolchi manchi,2025-01-26T12:28:59Z,https://www.youtube.com/watch?v=7533_j7o6MA,Most powerful Detox Juice #shorts #youtubeshorts#viralvideo#viral #trending#food#recipe#detox#juice दुनिया का ...,
Day 10 green juice fast completed #juicecleanse #fasting #fyp,TClUHtyr5Xo,LifeWith Kai,2025-01-19T18:09:16Z,https://www.youtube.com/watch?v=TClUHtyr5Xo,,
"Juice Cleanse Showdown 5 Popular Brands Reviewed! 🍹✨ #juicecleanse, #healthtips",hkmxtikPY74,Wellness and Us,2025-01-07T22:30:09Z,https://www.youtube.com/watch?v=hkmxtikPY74,"Thinking about trying a juice cleanse but don't know which brand is right for you? In this video, I review 5 of the most popular juice ...",
Why you should NOT juice cleanse,E9MYk0YY1iM,Canopi Healthcare,2025-02-19T16:58:17Z,https://www.youtube.com/watch?v=E9MYk0YY1iM,"Juice cleanses have been marketed as the ultimate way to “reset” your gut, but new research is showing they might be doing more ...",
Juice Cleanse: Green Juice Detox #healthtips,wMV6U_R7ao8,Nexus N,2025-02-02T02:40:00Z,https://www.youtube.com/watch?v=wMV6U_R7ao8,,
✅ Day 6: Juice Fasting vs. Water Fasting – What’s the Difference?,VOVyQPaMIQY,Simply Hanessa,2025-02-26T18:16:13Z,https://www.youtube.com/watch?v=VOVyQPaMIQY,Recipe: Total 2 gallon 2 bags apple 2 bunch celery 4 lemon 3 ginger 2 bags carrot 4 bunch of kale 1 bag of spinach Day 6: Juice ...,
Day 1 Cleanse|Keep Trying Until One Day It Clicks ⏰ #springcleanse #juicecleanse #veggie #earthdetox,b_X8oZScezA,Elbony NC,2025-02-21T23:18:37Z,https://www.youtube.com/watch?v=b_X8oZScezA,3 day Fruit and Veggies Cleanse. Time for body #springcleanse #reset.,
FINALLY!!! DAY 7 JUICE CLEANSE I DID BACK IN NOV 2024!🙃 The end,SNJLeuA9IRQ,Donanieshaaa,2025-03-21T06:33:41Z,https://www.youtube.com/watch?v=SNJLeuA9IRQ,,
#bodytransformation #juicecleanse,uh1dWSodLjw,Sashareen Taylor ,2025-03-24T16:38:38Z,https://www.youtube.com/watch?v=uh1dWSodLjw,,
Juice cleanse?!? #health #food #bloodsuger,UYk-mV3VEaQ,Remi Rory,2025-02-09T14:00:02Z,https://www.youtube.com/watch?v=UYk-mV3VEaQ,,
ABC juice #healthy #abcjuice  #summerdrink #ashortaday #shortsfeed #trending @mrsneha-o9l,MZmSTwPTb6U,Mrs Neha,2025-03-29T15:18:05Z,https://www.youtube.com/watch?v=MZmSTwPTb6U,abc juice shorts healthy juice beetroot juice abc juice recipe glowing skin juice abc juice benefits abc juice for glowing skin weight ...,
30 Day Juicing Cleanse to Heal My Body  #NaturalHealing #JuiceCleanse  #HealingWithFood  #WeightLoss,Rk52U9bEs_s,Trina Shay,2025-02-18T07:03:56Z,https://www.youtube.com/watch?v=Rk52U9bEs_s,,
Think it’s time I do one to. Cr:lullpaige #shortsfeed #juicecleanse #2025,NQDbEyPl1LU,GRACIOUSLYCEE,2025-01-02T23:29:46Z,https://www.youtube.com/watch?v=NQDbEyPl1LU,,
"Girl it’s time to shop! Juice cleanse, Sea moss & more! #health #wellness #women #ytshorts",3WRMcCT2HXY,Chantel,2025-01-29T17:13:52Z,https://www.youtube.com/watch?v=3WRMcCT2HXY,,
Day 3 juice cleanse #juicecleanse #Detoxjuice #juicefast #healthyliving #youtubeshorts #explore,ymgv8e-N6uQ,Justcallmeshaz,2025-02-27T14:42:20Z,https://www.youtube.com/watch?v=ymgv8e-N6uQ,,
Juice Cleanse Guide,6ifcunGuAbI,Magic Light Warriors,2025-01-24T17:00:08Z,https://www.youtube.com/watch?v=6ifcunGuAbI,"Unlock the secrets to a safe and effective juice cleanse with our comprehensive guide! In this video, we'll walk you through ...",
4 Signs You Need a Juice Cleanse ASAP #Energy #skincare #shorts,hQzdEmq29nI,Healthy Life,2025-03-04T05:00:36Z,https://www.youtube.com/watch?v=hQzdEmq29nI,"energy #shorts #healthy Feeling tired, sluggish, or dealing with skin breakouts? You might be overdue for a juice cleanse!",
New year 3 day green juice cleanse. Let's turn our hearts GREEN 💚#shorts,bhuVALgrwEI,All Things With Belleve,2025-01-07T16:56:10Z,https://www.youtube.com/watch?v=bhuVALgrwEI,,
DETOX GUT HEALTHY JUICE CLEANSE | Taty's Tea Cabinet #tatysteacabinet #detoxjuice #guthealth,SOJlynvZCnI,Taty's Tea Cabinet,2025-02-17T17:03:51Z,https://www.youtube.com/watch?v=SOJlynvZCnI,,
Choose Fiber Over Juice Cleanses for Optimal Gut Health.#shorts#probiotics #juicecleanse #guthealth,z4LBIHIwNfQ,Medical and Health Tips (MHT),2025-02-10T01:15:03Z,https://www.youtube.com/watch?v=z4LBIHIwNfQ,Choose Fiber Over Juice Cleanses for Optimal Gut Health. Your gut microbiome is home to trillions of bacteria that influence ...,
Juice Cleanse for Heavy Metal Detox & Clean Blood & Lymph #healthylifestyle #recipe #diet #detox,utjd4HYISCM,Holistic Living with Adrienne,2025-03-22T19:57:56Z,https://www.youtube.com/watch?v=utjd4HYISCM,"Juice party time! My daughter and I are kicking off a cleanse with these vibrant, nutrient-packed juices! Red Juice: Apples ...",
These Are The Juices I Use While Doing a Juice Cleanse #juicing #Detox #juicecleanse,nrX9avC-me0,Content By Kendra,2025-02-27T17:00:57Z,https://www.youtube.com/watch?v=nrX9avC-me0,"It's almost March, and I've been juicing for 14 days straight! Y'all know the last time I weighed in, I was 301 lbs—but I'm officially ...",
juice cleanse day one pt 1 #isabellaessence #hawaii  #greenjuice #juicing,4bVbzmtrf6c,Isabella Essence,2025-03-20T22:28:54Z,https://www.youtube.com/watch?v=4bVbzmtrf6c,,
Make a Green Juice with Me! 💚 #juicecleanse #juicefast,9jO00a08Dic,Babel of a Taurus,2025-03-04T18:00:08Z,https://www.youtube.com/watch?v=9jO00a08Dic,,
START YOUR YEAR GLOWING + DETOXING YOUR BODY With This Juice healthy #juicecleanse #weightlossjuice,gpkBfC5rPVE,DM healthy life style,2025-01-18T18:00:27Z,https://www.youtube.com/watch?v=gpkBfC5rPVE,"Glowing Your Skin and Detox your body with this Drink, Simple, Easy and very Nutritive. #healthy #weightlossjuice ...",
DAY 2: 7 DAY JUICE CLEANSE🥤/ (Making changes to my lifestyle) #reels #shorts #happynewyear #tiktok,14J30tr7ATg,Iamlivingmiebestlife,2025-01-05T17:26:41Z,https://www.youtube.com/watch?v=14J30tr7ATg,,
#JuiceTime #FreshJuice #HealthyJuice#JuiceLovers #JuiceRecipes#DrinkYourVeggies#JuiceCleanse#JuiceTh,AdmUj9tfaIs,Safa muni,2025-03-19T13:35:30Z,https://www.youtube.com/watch?v=AdmUj9tfaIs,,
#fishingfood Fishing Food - Juice Cleanse of Lies,saXAXlwyv6M,Rativ's Creation,2025-03-08T17:03:48Z,https://www.youtube.com/watch?v=saXAXlwyv6M,,
✅ Day 3: Juice Fast Detox Symptoms – What’s Happening to My Body?,4fk4H3H1I-E,Simply Hanessa,2025-02-20T13:00:08Z,https://www.youtube.com/watch?v=4fk4H3H1I-E,Recipe: Total three 64 ouch jug 2 pineapples 1 bunch celery 3 lemon 3 ginger 5 kiwi 4 bell pepper 1 bag carrot 1 bunch of kale 1 ...,
QuickStart  to #juicing link in bio #weightloss FREE RECIPES and Guide,2WxTrsTfLbM,LaLa •The High Vibe Coach • Energy,2025-03-27T11:59:10Z,https://www.youtube.com/watch?v=2WxTrsTfLbM,FREE Juicing for Weight Loss QuickStart Guide ...,
TropTropical Beet Boost #juicecleanse,K0O_nTYk1hw,Sunkissed and Raw,2025-02-10T18:41:17Z,https://www.youtube.com/watch?v=K0O_nTYk1hw,"Boost your health with this powerhouse juice! Fresh pineapple, apple, beetroot, and ginger come together to support ...",
"3 Day Juice Cleanse: Promoting natural living, do this to restore and heal the gut🥤👏🏾!!️",N3tr8L_cUYE,Lia Fit ,2025-01-30T17:36:09Z,https://www.youtube.com/watch?v=N3tr8L_cUYE,,
Gut cleansing juice recipe. #backtoourroots222 #godsmedicine #juicerecipe www.BackToOurRoots222.com,o_be1McPiNY,BackToOurRoots222,2025-02-14T00:58:46Z,https://www.youtube.com/watch?v=o_be1McPiNY,,
#veganary #juicewrld #juicecleanse #detox,DtZFUqfKYjE,Nourish 2Glow,2025-01-02T21:27:41Z,https://www.youtube.com/watch?v=DtZFUqfKYjE,,
Let’s get our greens for the week. #juicerecipe #greenjuice #coldpressedjuice #juicecleanse,0wQANISvjno,McNultys Make Juice,2025-03-05T14:06:56Z,https://www.youtube.com/watch?v=0wQANISvjno,Follow us on social: https://www.tiktok.com/@mcnultymakesjuice https://www.tiktok.com/@jessmcnulty ...,
"Green Juice Cleanse - kale, lemon, pineapple and water",5aHwWl6CwSA,Sable Creates,2025-01-29T10:34:02Z,https://www.youtube.com/watch?v=5aHwWl6CwSA,,
Day 2! Pizza inspo#cdl #ladytrucker #juicecleanse #dayinmylife #truckgirl #juicefasting #nama,5zGhOcp0B-8,Dekaily Davis,2025-01-26T21:54:21Z,https://www.youtube.com/watch?v=5zGhOcp0B-8,,
Evie Kevish’s Favorite Juices #juicing  #juicerecipe #juicingtips,RAyQGi44zIs,Juice Guru Institute,2025-03-26T15:00:35Z,https://www.youtube.com/watch?v=RAyQGi44zIs,Discover the potent power of these cleansing juices!,
Carrot + Orange Juicing Cleanse 🥕🥰 #carrot #juicing #health,MhrA3Z_3lnA,Mira,2025-01-23T08:19:43Z,https://www.youtube.com/watch?v=MhrA3Z_3lnA,I'm not sure why I was whispering lol but more videos will come in after this !!,
Attempting a Juice Cleanse 🍏| Life With Bela,spEbRC85QjU,Life With Bela,2025-03-20T22:02:53Z,https://www.youtube.com/watch?v=spEbRC85QjU,"My initial goal was to do a 5 day juice cleanse, which turned into about only 3 days haha. In the future I will be trying again, also ...",
I lost 25lbs on my 40 day juice cleanse #juicecleanse #healthyliving #wellnessforlife,8oirm7gkzAg,Victoria Katherine,2025-02-23T19:32:04Z,https://www.youtube.com/watch?v=8oirm7gkzAg,"In just 40 days, I lost 25 pounds with a juice cleanse! ✨ Join me as I share my incredible journey, the benefits of juicing, and ...",
Pineapple 🍍 juice cleanse watch my journey🙂#letsgetalkaline🙌🏾,V_I6j96ul0I,Lets get Alkaline,2025-02-23T20:44:36Z,https://www.youtube.com/watch?v=V_I6j96ul0I,,
Kidney Detox Juice | Natural Cleanse & Reset! #youtubevideo #beetroot #carrot #cucumber #trending,7sWrqhuOI4c,365dayshealthyhacks,2025-02-09T22:30:01Z,https://www.youtube.com/watch?v=7sWrqhuOI4c,"Welcome to 365dayshealthyhacks! Your go-to channel for easy, everyday tips to live your healthiest life—365 days a year!",
When is the BEST time to take Giloy Juice? #giloyjuice #viral,Ip-a58T9aiY,Vks Medicos,2025-02-03T12:35:43Z,https://www.youtube.com/watch?v=Ip-a58T9aiY,When is the BEST time to take Giloy Juice? #giloyjuice #viral The Perfect Time to Take GILOY JUICE #giloyjuice #viralvideo .,
যাযাবরদের আস্তানা #juicebar #juice #vegan #smoothies #juicecleanse #freshjuice #healthy,bMHm2CymIfc,Unlimited Videos Club,2025-01-06T15:03:50Z,https://www.youtube.com/watch?v=bMHm2CymIfc,,
Juice Cleanse Day 7,XjD7aN7Vre0,Kay's healthy journey ,2025-01-11T12:35:49Z,https://www.youtube.com/watch?v=XjD7aN7Vre0,,
Detox And Energize Your Body With Celery Juice!,FaxZgkgQAl8,Healthy Hacks,2025-02-11T20:30:02Z,https://www.youtube.com/watch?v=FaxZgkgQAl8,Discover the incredible benefits of drinking celery juice every morning. This video explores the advantages of incorporating celery ...,
3 Solid Reasons to Rethink Your Juice Cleanse | GoodRx,XMJMy57sECg,GoodRx,2025-01-19T11:00:43Z,https://www.youtube.com/watch?v=XMJMy57sECg,Some people opt for a juice cleanse if they want to “reset” their diet. Others invest in juice cleanse kits when they want to “detox.,
Crimson Glow Juice! 🍇 #juicelover #juicecleanse #juicefeast #juicefast #rawvegan #rawliving,2KXameqbthY,Sunkissed and Raw,2025-01-31T16:42:42Z,https://www.youtube.com/watch?v=2KXameqbthY,Say hello to Crimson Glow! 1 cluster of red grapes 1 beetroot 1 pomegranate A refreshing blend cold-pressed to perfection!,
Ultimate Full-Body Detox Juice Recipe | Cleanse & Boost Your Health Naturally!,XGvL1A6Vqvw,Health & Healing Center 101,2025-02-12T03:36:27Z,https://www.youtube.com/watch?v=XGvL1A6Vqvw,Looking for a natural way to cleanse your body and boost your energy? This powerful full-body detox juice is packed with ...,
#ayaresafarms #dayinmylifeblackgirl #ugccreator #juicecleanse #sacredwoman,MN3TsVulBto,Ekua Ahima,2025-01-19T15:01:40Z,https://www.youtube.com/watch?v=MN3TsVulBto,,
Juice Cleanse: Detox or Deception! #facts #food #short #motivation,-H2MqtFtKPY,Nutrivia AI,2025-02-28T13:30:00Z,https://www.youtube.com/watch?v=-H2MqtFtKPY,Ever wondered if juice cleanses are truly beneficial or just another health fad? Join us as we delve into the intriguing world of juice ...,
What I eat in a day on a juice cleanse to reset. #whatieatinaday #juicecleanse #getfit #reset,WhrldaAVGns,Neeners,2025-02-04T18:28:50Z,https://www.youtube.com/watch?v=WhrldaAVGns,,
BEET EM UP Beet Juice Cleanse | Twissted.life,y2wEpE7rl7o,Twissted Life Juice,2025-03-04T01:58:17Z,https://www.youtube.com/watch?v=y2wEpE7rl7o,High blood pressure? Stress? A diet that's been looking a little... questionable? Time to Beet 'Em Up! This juice is your ...,
My thoughts on the “watermelon fast”! 🍉 #faddiets #juicecleanse #waterfast #fastweightloss #fatloss,8pzVmrl14iQ,Aspasia | Fitness,2025-02-27T03:12:30Z,https://www.youtube.com/watch?v=8pzVmrl14iQ,,
My Go-To Juice Cleanse: 7-Day Renew & Recharge Breakdown | JizzJuic3 Wellness Program,u6S4Yzc4I_I,Bryson Gulley,2025-03-28T16:17:18Z,https://www.youtube.com/watch?v=u6S4Yzc4I_I,"This is the 7-day juice program I always come back to — Renew & Recharge. In this clip, I break down what juices are included ...",
"Lose Weight, Eliminate Constipation, and Cleanse Your Gut - All in 1 Week! #weightloss #shorts #yt",laCsX_-ukVo,Healthy Organic Ways,2025-01-07T16:40:01Z,https://www.youtube.com/watch?v=laCsX_-ukVo,"Lose Weight, Eliminate Constipation, and Cleanse Your Gut - All in 1 Week! Here's the secret drink to help you feel lighter, reduce ...",
What Happens To Your Body On A Juice Fast?,kWK133vOuAE,Earth Strong Works,2025-02-03T10:17:00Z,https://www.youtube.com/watch?v=kWK133vOuAE,"Curious about juice fasting and its impact on your health? In this video, we dive into the science behind juice fasting, explaining ...",
Ready for day 18 of my juice cleanse 💪🥕🥒🥬🍏🍍🍊🍋🍇,y0GavvJnmDM,Sunkissed and Raw,2025-01-28T10:02:34Z,https://www.youtube.com/watch?v=y0GavvJnmDM,,
Doing a green juice cleanse. 🍈🍏🍐🍌🫑🥒🥬🥦🫒🥝🫛🥗🍵,C8a1kmJ6fMY,Kaylen April,2025-03-12T14:29:31Z,https://www.youtube.com/watch?v=C8a1kmJ6fMY,,
Day 5 Of My 21 Day Anti-Inflammatory Juice Detox #antiinflammatory #juicewrld #juice #inflammation,6boOmDcyRPA,Inflammation Help,2025-03-08T11:00:07Z,https://www.youtube.com/watch?v=6boOmDcyRPA,"Feeling empowered on Day 5 of my Anti-Inflammatory Juice Cleanse! This Green Revitalize Green Juice might taste tough, but it's ...",
Juicing Recipe #immuneboosters #juicing #detox #juicecleanse #detoxcleanse #juicerecipe #healthyeati,G-OxAfGS_5g,Blessings at Home,2025-01-07T20:00:08Z,https://www.youtube.com/watch?v=G-OxAfGS_5g,Healthy juicing for health and weight loss. Check out a few of my recipes .#juicedetox.,
Raw Vegan Journey Day 22/30.                  #juicecleanse #tummytuck #weightloss,KnNfQnJGgSI,Trina Shay,2025-03-11T10:32:19Z,https://www.youtube.com/watch?v=KnNfQnJGgSI,,
Purple cabbage juice recipe,ZxJaaZiGlIc,Juanita Simpson,2025-01-18T05:00:27Z,https://www.youtube.com/watch?v=ZxJaaZiGlIc,Juicy Js Purple cabbage juice recipe This juice is what I so needed to reset my gut . This purple cabbage juice provides healthy ...,
#thefrankjuice #frankjuice #juicecleanse #saftkur #fasten #gesundheit #ernährung #lifestyle,VuZxeBXUlXM,Frank Juice GmbH,2025-03-31T09:41:05Z,https://www.youtube.com/watch?v=VuZxeBXUlXM,,
Could Your Juice Cleanse Be Slowing Your Metabolism and Causing Serious Gut Issues?,1GOO37zebD8,Accelerated Health with Sara Banta,2025-02-16T15:01:01Z,https://www.youtube.com/watch?v=1GOO37zebD8,"Think a juice cleanse is helping you? You want to detox. You want to lose weight. So you grab a juice cleanse, thinking you're ...",
"🍍 How a Juice Cleanse Can Mess with Your Gut, Metabolism, Immunity 🍍",Yeko44IacqQ,Healthy Sporty Foody,2025-02-07T07:18:46Z,https://www.youtube.com/watch?v=Yeko44IacqQ,"How a Juice Cleanse Can Mess with Your Gut, Metabolism, Immunity.",
Pack our 18 pack juice cleanse,zjTt0nLLagI,Juanita Simpson,2025-01-15T14:29:08Z,https://www.youtube.com/watch?v=zjTt0nLLagI,Juicy Js juice providing fresh raw organic juice cleanses . Local source produce .,
Juice Cleanse: Health Hack Ya Health Risk? | Detox Myth Exposed | Weight Loss & Gut Health,puh10X54wjM,Amar Parashar,2025-02-28T14:41:55Z,https://www.youtube.com/watch?v=puh10X54wjM,Juice Cleanse – Health Hack ya Health Risk? Kya aap bhi soch rahe hain juice cleanse karne ka? Log kehte hain ki yeh toxin ...,
4 Delicious Green Juice Recipes (Healthy Detox) #shorts,Rm9gbYkuyho,Healthy World,2025-01-15T18:36:06Z,https://www.youtube.com/watch?v=Rm9gbYkuyho,shorts #juicecleanse #juicing #greenjuice #healthyworld Embark on a journey of revitalization with our nutrient-packed green ...,
Juicing is FAST: Debunking the Myth!,mnx0oXelLhg,Bryson Gulley,2025-01-14T03:26:33Z,https://www.youtube.com/watch?v=mnx0oXelLhg,"Debunk the myth that juicing is time-consuming! Learn how to prep, juice, and store your healthy drinks efficiently, saving time and ...",
Liver Detox Juice  Cleanse -  Repair,AbMdQ909TgQ,Juice House,2025-01-11T12:47:04Z,https://www.youtube.com/watch?v=AbMdQ909TgQ,Liver Detox Juice Cleanse - Repair #Juicehouse #DetoxSmoothie #detox #greenjuice #heathy #juicerecipe #detoxjuice #shorts.,
What’s Inside the 3-Day Juice Cleanse (Detox Delight) | JizzJuic3 Program Breakdown,L-ME_LSM6KY,Bryson Gulley,2025-03-28T16:21:55Z,https://www.youtube.com/watch?v=L-ME_LSM6KY,"In this clip, I'm giving you a quick breakdown of what you get in the Detox Delight 3-Day Juice Program — the perfect reset for your ...",
Juice Cleanse Secrets Revealed! 🥤✨ Transform Your Year! 🌟,MJC1RKPZ0UQ,Herschy And The Keegs Show,2025-01-29T20:55:31Z,https://www.youtube.com/watch?v=MJC1RKPZ0UQ,Join us in this festive New Year celebration as we share health goals and an incredible juice cleanse journey! Discover how we ...,
This is your sign to do a juice cleanse✨ #viralshort #juice #selfcare #juicecleanse #weightloss,26E7wM3Jqu0,Layana Brown,2025-02-24T15:55:17Z,https://www.youtube.com/watch?v=26E7wM3Jqu0,,
✨ Day 1 of My 21-Day Juice Cleanse ✨,aDb1bdEocW8,Dezan Speaks,2025-01-03T16:04:30Z,https://www.youtube.com/watch?v=aDb1bdEocW8,"My wife, Sackeria, and I started strong today! But walking past Popeyes and Taco Bell had me like, “Lord, help me!",
"Detox Beet Juice Recipe | Weight Loss, Fat Loss, Juice Cleanse, Body Reset",MbjEuIuUznE,All Things Desiree,2025-01-23T21:17:52Z,https://www.youtube.com/watch?v=MbjEuIuUznE,"Ready to detox and refresh your body with a delicious and nutrient-packed juice? In this video, I'm sharing my go-to beet juice ...",
#DetoxJuice#SmoothieRecipes#HealthyDrinks#JuiceCleanse#FreshJuices#JuicingForHealth,YoNM_Ek4RZY,foods.cooking11,2025-01-16T14:12:13Z,https://www.youtube.com/watch?v=YoNM_Ek4RZY,"Welcome to Foods.Cooking 11! Your ultimate destination for mouthwatering recipes, cooking tips, and food inspiration!",
DAY 1: 7 DAY JUICE CLEANSE (First Drink) 🥤/HAPPY NEW YEAR 🎇 #reels #shorts #2025 #tiktok #explore,O7irh-1Pyv0,Iamlivingmiebestlife,2025-01-04T15:52:21Z,https://www.youtube.com/watch?v=O7irh-1Pyv0,reels #tiktok #food #happy #holiday #shorts #inspiration #foodie #2024 #new #eating #spices #yearofyou NEW YEAR/ NEW ...,
Gut cleanse #diy #juicecleanse #skincare #healthcare #healthy #shorts #youtube #foodie,HVnXfLWaZGk,STHÈR ,2025-02-14T20:51:10Z,https://www.youtube.com/watch?v=HVnXfLWaZGk,,
Juice cleanse day 2,AM8AXTlObVU,Kay's healthy journey ,2025-01-06T12:51:36Z,https://www.youtube.com/watch?v=AM8AXTlObVU,,
GUT HEALTH JUICE CLEANSE FOR QUICK WEIGHTLOSS,jAYsHBn4Vd8,Zeeberry's Tv,2025-03-11T11:45:49Z,https://www.youtube.com/watch?v=jAYsHBn4Vd8,"Gut juice cleanse is important for a healthy body, especially if you're trying to lose weight and looking to enhance your overall ...",
Cold pressed juice. #coldpressedjuice #juicecleanse #juice #healthyfood #greenjuice #breville,Py9WjGLO7cA,Brit | Creature Comfort Living,2025-01-30T23:02:45Z,https://www.youtube.com/watch?v=Py9WjGLO7cA,,
#JuiceFasting#JuiceCleanse#DetoxJuice#RawJuice#ColdPressedJuice#HealthyDetox#JuiceReset#Fasting,6yjOrJZxBJA,Mikael DeSouza,2025-02-09T12:20:08Z,https://www.youtube.com/watch?v=6yjOrJZxBJA,,
3 day Juice Cleanse finished #foryoupage #detox #detoxjuice #fasting #worshipmusic #onlyGod,LeLwGi8yeHQ,Reverse  the Curse,2025-02-27T02:38:26Z,https://www.youtube.com/watch?v=LeLwGi8yeHQ,,
27 Year Old Detox Transformation #weightloss #detox #juicecleanse #autoimmunedisease #healing #love,CkqrrEyc3k8,Chex,2025-01-25T23:13:03Z,https://www.youtube.com/watch?v=CkqrrEyc3k8,,
What I drank on day 14 of my juice cleanse,SFRLg99pBCo,Sunkissed and Raw,2025-01-24T21:29:58Z,https://www.youtube.com/watch?v=SFRLg99pBCo,"In today's video, I'm sharing what I drank on Day 14 of my juice cleanse journey aimed at reversing and shrinking fibroids while ...",
An Introductory Guide To Fire Cleansing (Aggressive Juice Cleansing) #juicecleanse #rose #veganism,WGy8-DtYhTQ,Dixon V Fitness And Boardsports,2025-02-17T00:16:38Z,https://www.youtube.com/watch?v=WGy8-DtYhTQ,,
#detox #eatclean #coloncleanse #colonhealth #food  #guthealth #gutcleanse #parasite #cleanse #juice,YnuSDFBOGQ0,UltimateBeauty10,2025-02-20T15:43:39Z,https://www.youtube.com/watch?v=YnuSDFBOGQ0,,
Your Body Needs This! ✨Cold-Pressed Juice Cleanse 🔥 Click Link in bio #health  #weightloss #shorts,YbFqrIIzAvE,Chantel,2025-03-07T17:00:50Z,https://www.youtube.com/watch?v=YbFqrIIzAvE,,
Homemade Recipe for Fat Loss  Juice ❤️#fatloss #healthydiet #detoxjuice #viralshorts#trending,XKB11FxAzlc,Krishiv healthy health 02,2025-01-18T05:27:44Z,https://www.youtube.com/watch?v=XKB11FxAzlc,Homemade Recipe for Fat Loss Juice ❤️#fatloss #healthydiet #detoxjuice #viralshorts#ytshorts #youtubeshorts #trending ...,
Carrot Juice DETOX: Flush Out Toxic Sugars FAST!,9jb9El98CQQ,Essence of Health,2025-02-04T04:00:10Z,https://www.youtube.com/watch?v=9jb9El98CQQ,Are you tired of feeling sluggish and bloated from consuming too much sugar? Do you want to boost your energy and kickstart ...,
"""Cleanse Your Colon Naturally with this Refreshing Juice Recipe | Detox & Digestive Health""",ArQk18IIyp8,Fitfuel Health and Fitness ,2025-01-18T19:03:20Z,https://www.youtube.com/watch?v=ArQk18IIyp8,Boost your digestive health and cleanse your colon naturally with this refreshing and nutrient-packed juice recipe.,
✅ Day 13: Juice Fast and Exercise – Should You Work Out While Fasting?,NtT2MRs466U,Simply Hanessa,2025-03-04T13:00:28Z,https://www.youtube.com/watch?v=NtT2MRs466U,"It's Day 13 of my juice fast, and today we're talking about exercise while fasting! Should you work out while on a juice cleanse?",
3 Detox Drinks for a Healthy Body🦾 #health #facts #nutritionfacts,OctqxF1kF5Q,Healthy Lifestyle,2025-01-06T06:30:52Z,https://www.youtube.com/watch?v=OctqxF1kF5Q,"3 Detox Drinks for a Healthy Body   #health #facts #nutritionfacts keto, low carb recipes, low carb love, low carb foods, keto ...",
Heavy metal detox juice #HeavyMetalDetox #Juice #JuiceCleanse #GreenJuice,8HnmY8gBEUw,Sunkissed and Raw,2025-01-26T10:29:23Z,https://www.youtube.com/watch?v=8HnmY8gBEUw,"Heavy metal detoxification is the process of removing toxic metals, such as lead, mercury, arsenic, and cadmium, from the body.",
Easy Kiwi Green Juice 🥝 #juicing #cleanse #fyp,GXhK4OAyb2Q,Nickeya,2025-01-29T01:37:49Z,https://www.youtube.com/watch?v=GXhK4OAyb2Q,,
Colon Cleanse Juice 🍍 🥒  #coloncleanse #juice #fyp #health #explorepage,2028xszv-fs,Nickeya,2025-01-29T00:52:07Z,https://www.youtube.com/watch?v=2028xszv-fs,,
Watermelon Wisdom Root Chakra Juice Cleanse 🍉💪🏽❤️Make The Wise Choice 3kingpro2call.com,hLn8AfXC2hk,3 KING PRO 2CALL ,2025-01-06T22:06:28Z,https://www.youtube.com/watch?v=hLn8AfXC2hk,,
Detox Diets: Scam or Science? The TRUTH Revealed!,i4u8ZpFrFpg,Quiztioner Central,2025-03-30T13:30:32Z,https://www.youtube.com/watch?v=i4u8ZpFrFpg,"Are detox diets actually cleansing your body, or is it all just a myth? From juice cleanses to detox teas, everyone's talking about ...",
