Title,Video ID,Channel,Published At,URL,Description,Video Length,Views,Likes,Comments
Is The Carnivore Diet EXPENSIVE?,JtH-hEfxFxY,Anthony Chaffee MD,2025-03-31T21:15:17Z,https://www.youtube.com/watch?v=JtH-hEfxFxY,,35,81200,2983,141
"How the Carnivore Diet Cured My IBS, Anxiety, and Depression",qCfgv9zwu-g,Norse Carnivore,2025-03-31T20:35:55Z,https://www.youtube.com/watch?v=qCfgv9zwu-g,"I felt like a prisoner in my own body. IBS, anxiety, depression—it controlled everything. No energy. No confidence. No life.",21,100,4,0
Meal 3 Sardine & Egg Metabolic Reset | Keto & Carnivore Diet Recipe,PgNlWtLPxqg,Ketogenic Woman,2025-03-31T20:00:12Z,https://www.youtube.com/watch?v=PgNlWtLPxqg,Meal 3 Sardine & Egg Metabolic Reset | Keto & Carnivore Diet Recipe Watch full 3 days of Sardine and Egg metabolic reset video ...,16,5324,194,5
Kelly Hogan's friend isn't on the CARNIVORE diet #carnivore #keto,yKVmDrbKJhc,Carnism Is Cancer,2025-03-31T19:22:33Z,https://www.youtube.com/watch?v=yKVmDrbKJhc,,74,494,0,0
Carnivore Diet is Insane #standupcomedy,xsq-EpSljDM,Christophe Jean,2025-03-31T18:51:40Z,https://www.youtube.com/watch?v=xsq-EpSljDM,,44,28845,505,23
Mother’s Day on Carnivore 🥩💐#carnivorediet #carnivore #mothersday #meat,MUAWgj7hEOc,Coach Carnivore Cam,2025-03-31T18:06:57Z,https://www.youtube.com/watch?v=MUAWgj7hEOc,,49,185312,2934,189
Day 86 on the CARNIVORE DIET 🥩🍖🥓 #carnivore #diet #mukbang #food #vlog #shorts,2iYWU-89yMQ,Alex Murphy,2025-03-31T17:48:31Z,https://www.youtube.com/watch?v=2iYWU-89yMQ,,63,3095,85,2
Carnivore Diet: #1 Protein Mistake,sTydfoysB9I,Go Carnivore,2025-03-31T13:01:12Z,https://www.youtube.com/watch?v=sTydfoysB9I,"The ultimate protein episode: how much protein you need, ideal timing, and quality of protein. Get 40% storewide on the Primal ...",38,5624,111,2
Do You Have To Fast On a Carnivore Diet?,g79jYvbUoOc,KenDBerryMD,2025-03-31T12:30:33Z,https://www.youtube.com/watch?v=g79jYvbUoOc,Do You Have To Fast On a Carnivore Diet?,26,170609,6634,173
Exploring the Carnivore Diet Quick Benefits vs  Long Term Effects #carnivore,uRPAwxvZlDk,Dr. Shawn Baker Podcast,2025-03-31T03:00:50Z,https://www.youtube.com/watch?v=uRPAwxvZlDk,Join Revero now to regain your health: https://revero.com/YT Revero.com is an online medical clinic for treating chronic diseases ...,30,2717,152,7
Meal 2 Egg & Sardine Fast Metabolic Reset | Keto & Carnivore Diet,4B5Rtr6ab9s,Ketogenic Woman,2025-03-30T20:00:01Z,https://www.youtube.com/watch?v=4B5Rtr6ab9s,Meal 2 Egg & Sardine Fast Metabolic Reset | Keto & Carnivore Diet Watch full 3 days of Sardine and Egg metabolic reset video or ...,23,7156,330,1
How to make perfect eggs #carnivore #carnivorediet,MBxx89vqBsA,carnivoreray,2025-03-30T18:41:39Z,https://www.youtube.com/watch?v=MBxx89vqBsA,,68,207769,3193,98
Day 85 on the CARNIVORE DIET 🥩🍖🥓 #carnivore #diet #mukbang #grocery #groceryshopping,x62OltqJ_a8,Alex Murphy,2025-03-30T17:48:16Z,https://www.youtube.com/watch?v=x62OltqJ_a8,,113,1516,68,0
Carnivore Diet Bagels 🥯 #carnivorediet #carnivore #bagels #recipe #food #lowcarb,MYDFSvgecSQ,Coach Carnivore Cam,2025-03-30T17:01:01Z,https://www.youtube.com/watch?v=MYDFSvgecSQ,,28,17890,514,83
🤍🎢🥹💕 #weightloss #perdidadepeso #carnivorediet #carnivore #skinnytok #weightlossmotivation,zSE7gMCtoGg,charlottebellafab,2025-03-29T23:44:32Z,https://www.youtube.com/watch?v=zSE7gMCtoGg,,11,9517,115,5
Day 84 on the CARNIVORE DIET 🥩🍖🥓 #carnivore #diet #mukbang #carnivorediet,-E16f8aczrM,Alex Murphy,2025-03-29T19:18:14Z,https://www.youtube.com/watch?v=-E16f8aczrM,,62,816,32,0
#animalbased #salmonbites #carnivore #carnivorediet #carnivoreketo #carnivores #fypyoutube #lowcarb,fuEu2cMB_QY,Hav Inpires,2025-03-29T18:45:07Z,https://www.youtube.com/watch?v=fuEu2cMB_QY,,53,585,0,0
Honest Thoughts About The Carnivore Diet - Day 150,VG0wRxdb3gY,Jordi,2025-03-29T02:00:21Z,https://www.youtube.com/watch?v=VG0wRxdb3gY,Can't believe I've crossed 150 days on the carnivore diet. I was supposed to only do it for 30days Now I'm looking forward to ...,54,353,37,2
Beef sirloin tips 😮‍💨 #carnivore #carnivorediet @butcher_box #butcherbox #Ad,wFeJ5ec9vjo,carnivoreray,2025-03-28T20:26:45Z,https://www.youtube.com/watch?v=wFeJ5ec9vjo,,39,31719,972,36
Day 83 on the CARNIVORE DIET 🥩🍖🥓#millerandcarter #tbone #carnivore #diet #carnivorediet,suKOfOABjxQ,Alex Murphy,2025-03-28T18:21:54Z,https://www.youtube.com/watch?v=suKOfOABjxQ,,118,710,33,2
3lbs of red meat for my only meal of the day... #redmeat #carnivore #carnivorediet #health #meat,_hg6UJFkEZ0,Coach Carnivore Cam,2025-03-28T17:11:20Z,https://www.youtube.com/watch?v=_hg6UJFkEZ0,,45,25012,698,140
RFK prescribes the carnivore diet!,M5haKQT9cEE,Shawn Baker MD,2025-03-28T17:00:51Z,https://www.youtube.com/watch?v=M5haKQT9cEE,,96,9480,1234,80
The Dark Truth About the Carnivore Diet,PeQPo98RlJk,The Limitless Man,2025-03-28T16:54:33Z,https://www.youtube.com/watch?v=PeQPo98RlJk,"The carnivore diet is praised as the ultimate solution for health, fat loss, and even reversing chronic diseases—but is it really all it's ...",223,264,6,16
Unraveling myths about kidney stones and the carnivore diet,LXfgmK-Wl-M,Shawn Baker MD,2025-03-28T15:00:34Z,https://www.youtube.com/watch?v=LXfgmK-Wl-M,Unraveling myths about kidney stones and the carnivore diet : Monique Attinger Join Revero now to regain your health: ...,58,5070,774,22
Unexpected Side Effect of Meat+Fruit Diet #shorts #nutrition #carnivore #carnivorediet,_fXFPw8gPW4,RelentlessPodcast,2025-03-28T12:17:07Z,https://www.youtube.com/watch?v=_fXFPw8gPW4,,35,785,20,2
Day 79/100 carnivore... #weightloss #carnivore #diet #calisthenics,BLddEMaiiTQ,Nahom G,2025-03-28T01:52:14Z,https://www.youtube.com/watch?v=BLddEMaiiTQ,,17,2249,28,2
Carnivore Deep Dish Pizza 🍕#carnivorejourney #carnivorediet #weightlossjourney #pizza #cooking,Ewb7E5yhfG0,Krista’s Country Kitchen,2025-03-28T01:22:01Z,https://www.youtube.com/watch?v=Ewb7E5yhfG0,,15,4851,81,11
Day 82 on the CARNIVORE DIET 🍖🥩🥓#strokesurvivor #charity #carnivore #carnivorediet #diet,OItUac6IXaA,Alex Murphy,2025-03-27T21:56:09Z,https://www.youtube.com/watch?v=OItUac6IXaA,strokesurvivor #charity #carnivore #carnivorediet #diet.,120,1115,51,0
Carnivore Eggs Benedict #carnivorediet #carnivore #recipe #eggsbenedict #breakfast,E_5S6LfrErQ,Coach Carnivore Cam,2025-03-27T18:50:30Z,https://www.youtube.com/watch?v=E_5S6LfrErQ,,42,17474,625,63
Full day of eating on a beginner carnivore diet #diet #diets #carnivore #carnivorediet #weightloss,RkUFAXq3bYA,Christina Campbell,2025-03-27T16:46:49Z,https://www.youtube.com/watch?v=RkUFAXq3bYA,,,,,
The surprisingly healthy Carnivore Diet,gOjrax0ZGo8,outofCuriousCity,2025-03-26T21:13:22Z,https://www.youtube.com/watch?v=gOjrax0ZGo8,carnivorediet #MeatOnly #healthfacts #ketocarnivore #animalbased #carnivorelifestyle #meatheals #highprotein ...,58,0,0,0
Day 81 on the CARNIVORE DIET 🍖🥩🥓#carnivore #diet #reformer #pilates #shorts #mukbang  #fiveguys,abAz6Jl4Dww,Alex Murphy,2025-03-26T19:08:35Z,https://www.youtube.com/watch?v=abAz6Jl4Dww,carnivore #diet #reformer #pilates #shorts #mukbang #fiveguys.,141,1223,51,1
Carnivore gets a lot of hate... 🤬#carnivore #carnivorediet,JAZvdMXPs6E,Coach Carnivore Cam,2025-03-26T18:33:35Z,https://www.youtube.com/watch?v=JAZvdMXPs6E,,54,31264,1307,267
I Eat RAW Meat on the Carnivore Diet – Here’s Why,0_U8WX-mM3E,Norse Carnivore,2025-03-26T17:00:06Z,https://www.youtube.com/watch?v=0_U8WX-mM3E,"Why do I eat raw meat on my carnivore diet? It might sound crazy, but the truth is... it makes me feel AMAZING. No dogma, no ...",128,417,21,26
"I added fruit to my carnivore diet, here’s what happened!",4zhmLGLGkQk,Shawn Baker MD,2025-03-26T16:00:06Z,https://www.youtube.com/watch?v=4zhmLGLGkQk,I added fruit to my diet and this happened!! Join Revero now to regain your health: https://revero.com/YT Revero.com is an online ...,37,121298,2734,290
Alcohol on Carnivore Diet?,hmI8mntXh1E,The Williams Table,2025-03-26T02:21:57Z,https://www.youtube.com/watch?v=hmI8mntXh1E,"Discover why alcohol isn't compatible with the carnivore diet. We explore the carb and sugar content in alcoholic beverages, even ...",38,1388,73,7
Day 66 #carnivore #diet #keto #mussels #rotisseriechicken #food #fyp #foryou #shorts #explorepage,lvdYDo7a2IE,Kelly Kim,2025-03-25T22:49:28Z,https://www.youtube.com/watch?v=lvdYDo7a2IE,,14,1521,44,2
LEE PRIEST: Carnivore Diet  #bodybuilding  #leepriest #fitness,gVx1F03GV7g,Sam's Fitness - Gym Equipment,2025-03-25T21:00:37Z,https://www.youtube.com/watch?v=gVx1F03GV7g,Check out equipment reviews by Sam here: @samsfitnessgymequipmentaust Looking to upgrade your gym? Check out ...,16,28563,733,30
Diarrhea On The Carnivore Diet?,kaDAN5H4kZ8,KenDBerryMD,2025-03-25T19:00:33Z,https://www.youtube.com/watch?v=kaDAN5H4kZ8,Diarrhea On The Carnivore Diet?,25,54928,3197,158
Benefits of low carb keto carnivore diet ￼,NRqt2Vx4cE4,Dr. Eric Westman - Adapt Your Life,2025-03-24T21:19:36Z,https://www.youtube.com/watch?v=NRqt2Vx4cE4,Want to improve your health? Focus on carbohydrates! Studies show that reducing carbs leads to better results than low-fat ...,50,16478,1089,21
DON'T Count MACROS On A Carnivore Diet!,ylVKcXnzYOw,KenDBerryMD,2025-03-24T20:30:24Z,https://www.youtube.com/watch?v=ylVKcXnzYOw,DON'T Count MACROS On A Carnivore Diet!,27,28721,2983,181
A Proper Healthy Subway Sandwich 🔥#carnivore #carnivorediet #healthy #subway #sandwich #lowcarb,C2JuLcDmRMQ,Coach Carnivore Cam,2025-03-24T19:18:50Z,https://www.youtube.com/watch?v=C2JuLcDmRMQ,,61,88615,2044,182
Dietitian reacts to the trending carnivore diet...,4JlnH-jMpEU,Joe Leech (MSc) - Gut Health & FODMAP Dietitian,2025-03-24T17:00:05Z,https://www.youtube.com/watch?v=4JlnH-jMpEU,"While the carnivore diet might sound appealing, it's not balanced in nutrients or fiber. And even if you feel good while on a ...",75,1088,31,4
The TOP benefits of Carnivore diet! 🥩 @DrCywesCarbAddictionDoc  #carnivore #weightloss,UlvPtRimyug,"Dr. Jones, DC",2025-03-24T15:43:49Z,https://www.youtube.com/watch?v=UlvPtRimyug,,51,292,0,2
Carnivore Diet Food shopping. #carnivore #food #carnivorediet #cooking,IW1xxyFiGF0,Kid Carnivore,2025-03-24T09:01:18Z,https://www.youtube.com/watch?v=IW1xxyFiGF0,Carnivore is such a powerful way to eat and nourish your body. Thousands of people have had great results and cured a lot of ...,37,690,6,1
Carnivore diet hacks featuring happy dogs #dog #love #carnivore #fok,sGQ4ABkwDQM,Adams Wilson,2025-03-23T18:27:15Z,https://www.youtube.com/watch?v=sGQ4ABkwDQM,Carnivore diet transformations with happy dogs #dog #diet #love #carnivore #fok.,38,125,6,0
Carnivore Diet #weightloss #carnivore,xQQQEOzMF2M,Primal Pursuit,2025-03-23T01:30:05Z,https://www.youtube.com/watch?v=xQQQEOzMF2M,,10,95,2,0
The Real Reason the Carnivore Diet Matters (And It's Not What You Think),UbFxGbi0KTo,"Robert Kiltz, MD",2025-03-22T16:00:29Z,https://www.youtube.com/watch?v=UbFxGbi0KTo,"How Carnivore Freed Me from Disordered Eating, with Lauren Night Hughes In this powerful episode of the Carnivore ...",100,2035,127,14
Carnivore Soufflé! #cooking #baking #souffle #carnivore #carnivorediet #glutenfree #lowcarb #food,LzHEHewkTW0,Maria Emmerich,2025-03-22T15:13:12Z,https://www.youtube.com/watch?v=LzHEHewkTW0,,29,3105,0,9
One of the biggest benefits for me being on the carnivore diet! #carnivorediet #carnivore,ZLG_e3G3ta0,Be Raw Podcast,2025-03-22T13:26:08Z,https://www.youtube.com/watch?v=ZLG_e3G3ta0,,53,10,0,0
Wild Game Sausage Making Tips for Carnivore Diet and the Meateater,jW-hcZnqw8w,Living My Alaska,2025-03-22T00:00:37Z,https://www.youtube.com/watch?v=jW-hcZnqw8w,Learn how to make your own carnivore diet-friendly sausage using a mix of moose and pork. Join us in this episode of Living My ...,54,1552,30,2
My First & Only Meal of the Day 🥩🍳🧈#carnivorediet #carnivore #lowcarb #omad #healthyfood #health,FcNUHbXXNyg,Coach Carnivore Cam,2025-03-21T17:50:28Z,https://www.youtube.com/watch?v=FcNUHbXXNyg,,36,58930,1220,158
Day 76 on the CARNIVORE DIET 🍖🥩🥓,2E8vnxEI78c,Alex Murphy,2025-03-21T17:49:13Z,https://www.youtube.com/watch?v=2E8vnxEI78c,carnivore #diet #mukbang #couples #jfkfiles #jfk.,188,679,33,1
"Carnivore Diet: No Scurvy, IBS Relief",By5RKKYqrx4,TheTexasBoys-SHARING LIFE & TRUTH,2025-03-21T17:00:21Z,https://www.youtube.com/watch?v=By5RKKYqrx4,Buy Bare Root Trees: Use Link to get 10% OFF https://foodforestnursery.com/coupon/thetexasboys10/ If you are looking for hard ...,45,1016,41,5
The Life-Changing Carnivore Diet: Transform Your Health,Pxihb_ClVdc,Motivate with Coach Camp,2025-03-21T13:15:02Z,https://www.youtube.com/watch?v=Pxihb_ClVdc,The Life-Changing Carnivore Diet: Transform Your Health Episode - Kristina and Juno Avent: Discuss life after a cervical cancer ...,56,13,0,0
What I Eat A Day With Carnivore Diet 🥩 Lost -60 Pounds & Get Jacked 🚀#animalbased,6dLzSamHIb0,DIKER Carnivore Coach ,2025-03-21T12:48:31Z,https://www.youtube.com/watch?v=6dLzSamHIb0,What I Eat A Day With Carnivore Diet Lost -60 Pounds & Get Jacked #whatieat #fulldayofeating #realfood #wholefoods ...,17,530,19,1
Carnivore Ice Cream Sandwich 🍨#carnivorediet #carnivore #recipe #icecream #dessert,t_e7DhTgFII,Coach Carnivore Cam,2025-03-20T18:52:56Z,https://www.youtube.com/watch?v=t_e7DhTgFII,,47,21273,851,87
Trying the carnivore diet 😅,wEXukygD0Dw,Ash Sewlal,2025-03-19T18:07:32Z,https://www.youtube.com/watch?v=wEXukygD0Dw,,43,15479,983,15
"Carnivore diet with the most delicious, juicy and tender steaks! #carnivore #carnivorediet",gJeH3_EQQ4g,AUGUST STEAK,2025-03-19T14:25:13Z,https://www.youtube.com/watch?v=gJeH3_EQQ4g,,26,6282,86,1
Day 73 on the CARNIVORE DIET 🥩🍖🥓#carnivorediet #carnivore #mukbang #couples #chowchow #shorts,sVxmGa-RPRE,Alex Murphy,2025-03-18T19:26:07Z,https://www.youtube.com/watch?v=sVxmGa-RPRE,carnivorediet #carnivore #mukbang #couples #chowchow #shorts.,77,896,51,0
Carnivore diet and bodybuilding!,z0dKl_GOSHo,OneMoSet,2025-03-17T15:41:15Z,https://www.youtube.com/watch?v=z0dKl_GOSHo,shorts #ai #bodybuilding.,11,76003,582,17
Why the Carnivore Diet Might Wreck Your Gut (And How to Fix It),3ZUHtGumEcs,Dr. Kyle Sun,2025-03-17T15:07:50Z,https://www.youtube.com/watch?v=3ZUHtGumEcs,,34,675,16,0
Carnivore Diet Enchiladas #carnivorediet #carnivore #recipe #enchiladas #cooking #food #lowcarb,_Okb44_ypms,Coach Carnivore Cam,2025-03-16T18:39:39Z,https://www.youtube.com/watch?v=_Okb44_ypms,,50,18413,905,139
Day 71 on the CARNIVORE DIET 🥩🥓🍖#carnivore #diet #carnivorediet #mukbang #couples #shorts,uTpH7k0sP8U,Alex Murphy,2025-03-16T18:38:11Z,https://www.youtube.com/watch?v=uTpH7k0sP8U,carnivore #diet #carnivorediet #mukbang #couples #shorts.,98,816,57,0
Taco Deviled Eggs for the Carnivore Diet | Recipe,LoUnlh0kwpg,CarnivorousChef,2025-03-16T17:24:11Z,https://www.youtube.com/watch?v=LoUnlh0kwpg,"In this video I make some deviled eggs. Not just any deviled eggs, but TACO flavored deviled eggs. This recipe is super simple ...",217,4233,700,43
1 Meal Per Day on Carnivore Diet,2Ywb3fboKZw,Marcus Sidhu (N1Fitness),2025-03-16T14:39:23Z,https://www.youtube.com/watch?v=2Ywb3fboKZw,COACHING - http://www.n1fitness.com/coaching INSTAGRAM - https://www.instagram.com/n1fitness/ TIKTOK ...,17,52242,596,43
Scurvy on Carnivore Diet... How Many Cases?,wgEuKxAiPrQ,Kent Carnivore,2025-03-15T13:44:25Z,https://www.youtube.com/watch?v=wgEuKxAiPrQ,Here's why people on carnivore don't get scurvy... #carnivorediet #ketodiet #vegandiet.,153,8011,786,142
Vitamin C On The Carnivore Diet,Mn5_jYjtp9w,KenDBerryMD,2025-03-15T08:00:25Z,https://www.youtube.com/watch?v=Mn5_jYjtp9w,Vitamin C On The Carnivore Diet.,35,73243,6005,202
How many meals on Carnivore?? #carnivore #food #carnivorediet #cooking,chz0yY8kHgE,Kid Carnivore,2025-03-15T07:59:47Z,https://www.youtube.com/watch?v=chz0yY8kHgE,,46,11530,353,14
Carnivore Breakfast LASAGNA #cooking #breakfast #carnivore #carnivorediet #lowcarb #recipe #yummy,k8z4TOKxLG8,Maria Emmerich,2025-03-14T15:17:24Z,https://www.youtube.com/watch?v=k8z4TOKxLG8,,14,4385,0,14
Carnivore diet meal idea - chicken addition #carnivore #carnivorediet @butcher_box #butcherbox #Ad,Zs4DbF3KvAA,carnivoreray,2025-03-14T01:38:15Z,https://www.youtube.com/watch?v=Zs4DbF3KvAA,,52,64758,2121,57
Is The Carnivore Diet RIGHT For YOU? Watch This...,SDd1AtHauSA,KenDBerryMD,2025-03-13T22:00:49Z,https://www.youtube.com/watch?v=SDd1AtHauSA,Is The Carnivore Diet RIGHT For YOU? Watch This...,19,73303,5567,253
Mike Israetel Talks About Carnivore Diet! | Dr Mike Israetel,OXZ-yquXFlc,Body Building Tips,2025-03-13T14:00:23Z,https://www.youtube.com/watch?v=OXZ-yquXFlc,"Is the Carnivore Diet the Ultimate Nutrition Hack? In this video, Dr. Mike Israetel shares his thoughts on the carnivore diet.",,,,
Should you ditch coffee on a carnivore diet?,bBFidPW8-Ls,Shawn Baker MD,2025-03-13T04:49:58Z,https://www.youtube.com/watch?v=bBFidPW8-Ls,Should you ditch coffee on a carnivore diet? Source IG: kentcarnivore Join Revero now to regain your health: ...,55,22015,2119,228
A carnivore diet transformation!!,HsuNL6DSXH4,Shawn Baker MD,2025-03-13T00:13:41Z,https://www.youtube.com/watch?v=HsuNL6DSXH4,A carnivore diet transformation!! Source: @NoahFleming Join Revero now to regain your health: https://revero.com/YT ...,60,15463,2906,124
Kidney Disease And The Carnivore Diet,XMv_WvaqvlY,KenDBerryMD,2025-03-12T20:00:19Z,https://www.youtube.com/watch?v=XMv_WvaqvlY,Kidney Disease And The Carnivore Diet.,36,34642,2824,114
Who else loves Eggs? 🍳 #egg #eggs #healthyfood #carnivorediet #carnivore #lowcarb #health #keto,Ej7SPCkNGIQ,Coach Carnivore Cam,2025-03-12T18:48:29Z,https://www.youtube.com/watch?v=Ej7SPCkNGIQ,,51,52966,1663,251
Is a Carnivore Diet Safe for Heart and Kidney Issues?,NVUyvbZ-G4g,Dr. Robert Cywes M.D. Ph.D. #CarbAddictionDoc,2025-03-12T11:51:44Z,https://www.youtube.com/watch?v=NVUyvbZ-G4g,Find out on the last episode of my #Carnivore Series https://youtu.be/whT9jq7TdqM.,164,31333,1728,73
Carnivore Diet Hash Brown Fries #carnivore #carnivorediet #recipe #hashbrown #fries #food #lowcarb,uWwbMo0Nyn0,Coach Carnivore Cam,2025-03-11T19:03:25Z,https://www.youtube.com/watch?v=uWwbMo0Nyn0,,25,20607,764,113
Day 65 on the CARNIVORE DIET 🥓🍖🥩,k5lGaYCq8z0,Alex Murphy,2025-03-10T19:51:13Z,https://www.youtube.com/watch?v=k5lGaYCq8z0,mukbang #couples #carnivorediet #carnivore.,183,592,22,3
Full day of eating on a carnivore diet for beginners 🥩#carnivorediet #carnivore #health #meat,xo89DoBUfa4,Coach Carnivore Cam,2025-03-10T19:16:09Z,https://www.youtube.com/watch?v=xo89DoBUfa4,,52,50324,1629,233
Dining out on a carnivore diet: tips & tricks #carnivorediet #diet,HyRU0wg8L18,Taïcha Tayou,2025-03-10T05:12:23Z,https://www.youtube.com/watch?v=HyRU0wg8L18,Eating out on a carnivore diet: tips & tricks #carnivorediet #diet #weightloss #goalsounds #fok.,29,2900,40,2
Carnivore Diet Secrets,MmdwwxYS1ls, Carnivore Coach Lisa Pickart,2025-03-30T15:37:08Z,https://www.youtube.com/watch?v=MmdwwxYS1ls,mahadevstatus #mahakal #mahadev #LiveWithoutRegret #WomenEmpowerment #LifeBack #Transformation #CoachLisa ...,31,498,29,0
Can you do a carnivore diet with one kidney?,4PAk5wTLleg,Shawn Baker MD,2025-03-27T16:00:05Z,https://www.youtube.com/watch?v=4PAk5wTLleg,Can you do a carnivore diet with one kidney? Join Revero now to regain your health: https://revero.com/YT Revero.com is an ...,41,4430,758,33
The Carnivore Diet Trend is Dying Out!,ahQ0jgA2O_M,Korin Sutton ,2025-03-25T10:17:03Z,https://www.youtube.com/watch?v=ahQ0jgA2O_M,"The Carnivore Diet Trend is Dying Out! Look at @LiverKing, once the raw meat poster child, now showing up with fruit bowls and ...",60,785,87,12
Carnivore dinner in the green kitchen! #carnivore #ketocookingchannel #food #cooking #carnivorediet,k9QXkLvpj_k,Kid Carnivore,2025-03-23T08:15:58Z,https://www.youtube.com/watch?v=k9QXkLvpj_k,Carnivore is such a powerful way to eat and nourish your body. Thousands of people have had great results and cured a lot of ...,31,738,14,0
I TRIED to do a strict diet carb eaters #carnivorediet #meatlovers,ItEaa0Gnryk,Consistent Wellness,2025-03-22T13:47:40Z,https://www.youtube.com/watch?v=ItEaa0Gnryk,shorts #carnivorediet #diet #carnivore #meatlovers #lowcarb.,,,,
How much meat do you get from half a cow?,gGwlJjOhDBQ,Joey Sorts,2025-03-12T19:41:26Z,https://www.youtube.com/watch?v=gGwlJjOhDBQ,"Half cow... Sorted ✓ The best part of this for me is convenience. Im good on meat for a while, and one less thing to have to ...",47,4976046,117645,4749
Carnivore diet ? #health #food #weighttips #fasterwaytofatloss #diet,eBUS1uRq6FM,Zack Chug,2025-02-13T18:33:28Z,https://www.youtube.com/watch?v=eBUS1uRq6FM,,37,3327368,180761,908
What I eat in a day on Carnivore 🥩#carnivore #carnivorediet,Rm_T6zoNGSM,Coach Carnivore Cam,2025-02-07T18:38:16Z,https://www.youtube.com/watch?v=Rm_T6zoNGSM,,33,636041,13995,995
The danger of carnivore done wrong!,DkQQKjenwZs,"Dr. Boz [Annette Bosworth, MD]",2025-02-02T18:00:06Z,https://www.youtube.com/watch?v=DkQQKjenwZs,The Workbook: https://on.bozmd.com/BozWorkbook https://on.bozmd.com/WalmartBozWorkbook --------------------- Thanks for ...,55,374673,12139,960
Electrolytes On The Carnivore Diet! 👉,r2UhQhJpmro,KenDBerryMD,2025-01-25T10:30:22Z,https://www.youtube.com/watch?v=r2UhQhJpmro,Electrolytes On The Carnivore Diet!,56,204747,15419,460
Is Carnivore Diet Healthy?,cSP5vkfEapA,Jeremy Miller,2025-01-10T18:12:28Z,https://www.youtube.com/watch?v=cSP5vkfEapA,,60,173770,7083,211
Meals On The Carnivore Diet 👉,B-8EhU6aTMg,KenDBerryMD,2025-02-01T06:00:22Z,https://www.youtube.com/watch?v=B-8EhU6aTMg,Meals On The Carnivore Diet.,24,303571,11444,232
Eating one meal a day can transform your health🔥#carnivore #carnivorediet #omad #fasting #health,DtODGNOTAOs,Coach Carnivore Cam,2025-01-18T18:28:00Z,https://www.youtube.com/watch?v=DtODGNOTAOs,,51,154224,4497,287
What I order when I go out for Breakfast on Carnivore✅ #carnivore #carnivorediet #breakfast #healthy,ChsWDvOdDsA,Coach Carnivore Cam,2025-01-27T18:59:33Z,https://www.youtube.com/watch?v=ChsWDvOdDsA,,36,197306,3211,367
What Foods You Can Eat On The Carnivore Diet? 👉,3slmyEfwPg4,KenDBerryMD,2025-01-21T22:58:16Z,https://www.youtube.com/watch?v=3slmyEfwPg4,What Foods You Can Eat On The Carnivore Diet?,30,156651,9316,295
Carnivore weight loss transformation #carnivore #carnivorediet #ketodiet #carnivores  #weightloss,rTXwGX_PGDs,Courtney Luna,2025-01-21T16:52:58Z,https://www.youtube.com/watch?v=rTXwGX_PGDs,,18,231363,7086,379
A Proper Carnivore Family Feast🔥#carnivore #carnivorediet #healthylifestyle #healthy #family #meat,zt4JE3mlntU,Coach Carnivore Cam,2025-01-22T19:24:41Z,https://www.youtube.com/watch?v=zt4JE3mlntU,,45,107216,3246,317
What To Cook With On The Carnivore Diet? 👉,1n7y3XknheY,KenDBerryMD,2025-01-22T20:00:18Z,https://www.youtube.com/watch?v=1n7y3XknheY,What To Cook With On The Carnivore Diet?,24,106363,8139,321
The Best Way to Cook Eggs 🍳✅#egg #eggs #carnivore #carnivorediet #healthyfood #healthy #lowcarb,Jy8Ai5z7gcc,Coach Carnivore Cam,2025-01-20T18:37:34Z,https://www.youtube.com/watch?v=Jy8Ai5z7gcc,,44,95953,2707,231
Dairy On The Carnivore Diet? Watch This! 👉,Jc1NfrMAlw0,KenDBerryMD,2025-03-04T06:00:21Z,https://www.youtube.com/watch?v=Jc1NfrMAlw0,Dairy On The Carnivore Diet? Watch This!,38,110772,7766,250
Carnivore Diet Bacon Sandwich 🥓#carnivore #carnivorediet #recipe #bacon #sandwich #breakfast #food,NWqtQ9FsETE,Coach Carnivore Cam,2025-02-20T19:10:29Z,https://www.youtube.com/watch?v=NWqtQ9FsETE,,42,81500,1918,283
How To Do The Carnivore Diet To Lose Weight? Watch This! 👉,OMWGPanb2aw,Anthony Chaffee MD,2025-01-24T22:18:41Z,https://www.youtube.com/watch?v=OMWGPanb2aw,,35,110301,6162,310
What I eat in a day on the carnivore diet! #food #keto #carnivore,EE-lISiL5F4,Carnivore Revolution,2025-02-13T02:50:39Z,https://www.youtube.com/watch?v=EE-lISiL5F4,,57,80025,3179,180
Fibre on a Carnivore Diet🥩#carnivore #carnivorediet #health #healthy #healthyfood #lowcarb,ZPKDq32KODw,Coach Carnivore Cam,2025-02-10T19:49:07Z,https://www.youtube.com/watch?v=ZPKDq32KODw,,49,103999,2473,414
Alcohol On The Carnivore Diet? Watch This! 👉,IVHLo7Sr2k0,KenDBerryMD,2025-02-12T20:00:20Z,https://www.youtube.com/watch?v=IVHLo7Sr2k0,Alcohol On The Carnivore Diet? Watch This!,45,79996,6592,369
How to Start a Carnivore Diet ✅🥩#carnivore #carnivorediet #health #healthy #weightloss #meat #steak,8zk5wuzwJus,Coach Carnivore Cam,2025-01-01T18:36:17Z,https://www.youtube.com/watch?v=8zk5wuzwJus,,54,70808,2344,260
Why Protein Is The LEAST IMPORTANT Ingredient On The Carnivore Diet...👉,tyvATz5xFn8,Dr. Robert Cywes M.D. Ph.D. #CarbAddictionDoc,2025-02-17T20:00:57Z,https://www.youtube.com/watch?v=tyvATz5xFn8,,36,98351,3715,158
Give Time To Feel The Benefits Of A Carnivore Diet!,q60DFm4PD1s,KenDBerryMD,2025-01-23T08:00:17Z,https://www.youtube.com/watch?v=q60DFm4PD1s,Give Time To Feel The Benefits Of A Carnivore Diet!,33,96900,7364,342
Eating out on a Carnivore Diet 🥩#carnivore #carnivorediet #steak #healthy #healthylifestyle #meat,s2xa8ztpuRo,Coach Carnivore Cam,2025-02-19T18:59:10Z,https://www.youtube.com/watch?v=s2xa8ztpuRo,,31,69471,1568,247
Protein To Fat Ratio On The Carnivore Diet! 👉,x7jv4rrbMbc,KenDBerryMD,2025-03-04T18:00:20Z,https://www.youtube.com/watch?v=x7jv4rrbMbc,Protein To Fat Ratio On The Carnivore Diet!,27,100469,6821,222
Vitamin C Deficiency On The Carnivore Diet? Watch This! 👉,_CbAiaFZHng,KenDBerryMD,2025-01-20T01:00:22Z,https://www.youtube.com/watch?v=_CbAiaFZHng,Vitamin C Deficiency On The Carnivore Diet? Watch This!,38,67189,6220,256
Spices On The Carnivore Diet? Watch This! 👉,jOTdCRTkgCA,KenDBerryMD,2025-02-13T09:10:24Z,https://www.youtube.com/watch?v=jOTdCRTkgCA,Spices On The Carnivore Diet? Watch This!,23,71411,4810,132
