Title,Video ID,Channel,Published At,URL,Description,Video Length,Views,Likes,Comments
Kitchen Treasures: Okra for Diabetes Management! @besugarfit,7A6zsRyiKjY,besugarfit,2025-03-07T01:30:03Z,https://www.youtube.com/watch?v=7A6zsRyiKjY,BOOK a FREE CONSULTATION to know how you can reverse diabetes with sugarfit: http://bit.ly/3WupQgk Subscribe to besugarfit ...,60,,,
4 NITRIC OXIDE DUMP EXERCISE FOR DIABETES MANAGEMENT 👍😊#short#nitricoxidedump,6yd58IJb1Vo,"Sarikas Life, Fittess, Food, Fun, Family ",2025-03-20T10:59:41Z,https://www.youtube.com/watch?v=6yd58IJb1Vo,4 NITRIC OXIDE DUMP EXERCISE FOR DIABETES MANAGEMENT ...,21,,,
The Magic of Fermented Foods in Diabetes Management,iFoXj-3d7U4,GLUCOSE BALANCED BITES,2025-03-14T00:00:42Z,https://www.youtube.com/watch?v=iFoXj-3d7U4,"Explore the benefits of fermented foods in managing diabetes, highlighting their impact on gut health and blood sugar.",49,,,
Embracing Mediterranean Diet for Diabetes Management,_la4HcaeMTQ,GLUCOSE BALANCED BITES,2025-03-16T00:00:34Z,https://www.youtube.com/watch?v=_la4HcaeMTQ,"Explore how the Mediterranean diet supports diabetes management with its focus on healthy fats, lean proteins, and low-GI foods, ...",48,,,
The #2 superpower for managing diabetes? MOVEMENT. 🚶‍♂️💪,Pnhp4iCeveA,FTF WARRIOR,2025-03-06T22:24:08Z,https://www.youtube.com/watch?v=Pnhp4iCeveA,,60,,,
"""Unlocking the Potential of Calcium in Diabetes Management""lDr G Kiran l#drkiran",J45FtaQbNu4,Diabetes Guru,2025-01-20T05:21:21Z,https://www.youtube.com/watch?v=J45FtaQbNu4,"""Calcium plays a crucial role in many bodily functions, including bone health and muscle function. But what about its impact on ...",59,,,
Does STRESS Affect Your Diabetes Management?,Dp-sR_p8G7g,Diabetes Info,2025-03-13T22:58:34Z,https://www.youtube.com/watch?v=Dp-sR_p8G7g,"Managing diabetes can be challenging enough, but did you know that stress can affect your diabetes management? In this video ...",236,,,
Why Metformin is the Superstar of Diabetes Meds!,Tqru2AGgELo,Pharmacist Online,2025-02-03T00:00:16Z,https://www.youtube.com/watch?v=Tqru2AGgELo,"""Which Diabetes Medications Work BEST? ✓ Confused about diabetes medications? This video breaks down the different types ...",47,,,
Diabetes Management Tips #diabetes #shorts,h3KkthEgdHk,Wili Healthcare,2025-01-12T05:03:27Z,https://www.youtube.com/watch?v=h3KkthEgdHk,"Learn how to manage diabetes effectively with these simple and practical tips! From a balanced diet to regular exercise, stress ...",90,,,
Avacado toast effect on blood sugar  #diabetes #diabetesmanagement,lwXijFjn2gA,DiabetesFreeLiving,2025-02-05T05:00:41Z,https://www.youtube.com/watch?v=lwXijFjn2gA,Episode 5 - Avacado toast on Multigrain Bread + Banana slice Below are the ingredients : - Multigrain Bread - Mashed avacado ...,43,,,
Carrots: Moderate Glycemic Index for Diabetic. #superfoods #diabetesmanagement #diabetes,YhjsQ458SEo,Fit & Nourished Health,2025-03-21T23:37:30Z,https://www.youtube.com/watch?v=YhjsQ458SEo,Watch the complete video here https://youtu.be/PqR_0gwVa3c.,44,,,
"Best Foods for Diabetics: Eat Smart, Stay Healthy #DiabetesDiet #DiabetesManagement #HealthyFats",bTxxT_plILw,Pure Detox Life,2025-02-02T02:02:38Z,https://www.youtube.com/watch?v=bTxxT_plILw,"Best Foods for Diabetics: Eat Smart, Stay Healthy Discover top diabetes-friendly foods in this vibrant 30-second YouTube short!",45,,,
Cucumbers: Hydrating Diabetic Superfood! #superfoods #diabetes #diabetesmanagement,CG9tt4MQzKI,Fit & Nourished Health,2025-03-21T23:40:50Z,https://www.youtube.com/watch?v=CG9tt4MQzKI,Watch the complete video here https://youtu.be/PqR_0gwVa3c.,51,,,
Keto Diet for Diabetes Management,PtNLfbIfd1M,GLUCOSE BALANCED BITES,2025-03-19T00:00:30Z,https://www.youtube.com/watch?v=PtNLfbIfd1M,"Exploring the keto diet's role in diabetes management, focusing on key foods, benefits, and a quick meal idea. #KetoDiet ...",42,,,
Why Are Diabetics Scared To Eat Fruit? #diabetes #diabetic #diabetesawareness #diabetesmanagement,M02zUHvQ0nQ,Timmy Daniel,2025-02-08T08:12:44Z,https://www.youtube.com/watch?v=M02zUHvQ0nQ,,31,,,
Early signs of insulin resistance #bloodsugar #insulinresistance #diabetesmanagement,D6CRELh20F0,Paul Minhas,2025-01-02T12:24:36Z,https://www.youtube.com/watch?v=D6CRELh20F0,I found these products (INFO link below) about around 2021 and my wife used use them to get health again-she was down to 90 ...,42,,,
struggling with food as a type one diabetic...... #diabetes management #typeonediabetes #food #foodie,UHJg3u79Uxc,ella | type one diabetes & lifestyle,2025-02-22T02:43:07Z,https://www.youtube.com/watch?v=UHJg3u79Uxc,,31,,,
Masala dosa effect on blood sugar  #diabetes #diabetesmanagement #food,uU7ZVpe1rcs,DiabetesFreeLiving,2025-02-04T20:05:48Z,https://www.youtube.com/watch?v=uU7ZVpe1rcs,Episode 4 - Restaurant Masala Dosa Below are the ingredients : - Rice/lentil batter - Mashed potatoes - Green chutney - coconut ...,51,,,
Dietitians Cannot Diagnose or Recommend Medications #diabetesmanagement #dietitianapproved,m7HULEgU-aU,Kim Rose Dietitian,2025-03-30T13:28:09Z,https://www.youtube.com/watch?v=m7HULEgU-aU,,104,,,
Healthy tips for Diabetes Patient. #healthylifestyle #diabetesmanagement #diabetesawareness #helth,i4UrF_Hj3PQ,ShortTime.in12,2025-02-24T16:24:38Z,https://www.youtube.com/watch?v=i4UrF_Hj3PQ,diabetes #diabetesawareness #diabetesmanagement #diabetescare #diabeteslifestyle #diabeteslifestyle #healthylifestyle ...,57,,,
Understanding Plant-Based Diet for Diabetes Management,iun6jzvFv2g,GLUCOSE BALANCED BITES,2025-03-17T00:00:39Z,https://www.youtube.com/watch?v=iun6jzvFv2g,"Explore the benefits of a plant-based diet for diabetes management, highlighting its balance of nutrients and positive impact on ...",53,,,
Stop settling for ‘good enough’ in diabetes management. 🚫,9pML6RnLNpQ,FTF WARRIOR,2025-03-05T21:24:34Z,https://www.youtube.com/watch?v=9pML6RnLNpQ,,52,,,
STOP Letting Diabetes Control Your Life! #diabetesmanagement,PAi2OELo_Q0,The Brain Coach,2025-01-02T19:00:15Z,https://www.youtube.com/watch?v=PAi2OELo_Q0,"Discover the fantastic benefits of jackfruit for diabetes management! In this video, we explore the nutritional profile of jackfruit and ...",48,,,
Discover the Best Breakfast Choices for Diabetes Management #healthyfood  #diabetesfoods,3gib4evDk5E,Health Hive,2025-01-31T14:01:50Z,https://www.youtube.com/watch?v=3gib4evDk5E,"Overview: Managing blood sugar starts with your morning routine! In this video, we'll explore five powerful morning habits that can ...",41,,,
My journey with Diabetes #whatieat #diabetesmanagement #wellness #foodies #planner #journal #lowcarb,AaVcYIp0YKQ,Megan Life Blog,2025-01-02T02:50:58Z,https://www.youtube.com/watch?v=AaVcYIp0YKQ,A personal journey of overcoming health challenges and finding tools to regain control. Discover the simple yet powerful steps I ...,42,,,
Did you know probiotics could be a game changer for diabetes care?,3GKWMUdaA7M,PharmaServe Inc,2025-01-09T00:15:00Z,https://www.youtube.com/watch?v=3GKWMUdaA7M,"These “good” bacteria can improve gut health, balance blood sugar, and fight inflammation, which is key for managing diabetes.",32,,,
Blackberry ll blackberries as beneficial for diabetes management ll #blackberry #fruit  #gardening,fUbulnpmDhw,Smart Horticulture Tips,2025-01-04T13:06:11Z,https://www.youtube.com/watch?v=fUbulnpmDhw,"Blackberry, blackberries as beneficial for diabetes management, smart horticulture tips,",40,,,
Here are 5 foods that are good for diabetes management,6h-OS4hNKMA,health,2025-01-05T14:23:15Z,https://www.youtube.com/watch?v=6h-OS4hNKMA,health #diabetes #diabetic.,44,,,
Top Green Juice Recipe for Managing Diabetes,Er96zmIATuE,Juice Guru Institute,2025-01-21T16:00:23Z,https://www.youtube.com/watch?v=Er96zmIATuE,"Support diabetes management with this green juice! Juice celery, cucumber, lemon, kale, chard or spinach, dandelion greens, ...",29,,,
Prediabetes and Menopause,hb4-u-WQ3sk,Diabetes Management Group,2025-03-08T18:36:31Z,https://www.youtube.com/watch?v=hb4-u-WQ3sk,"New podcast episode with the amazing @livingrevivedtherapy !!! Learn more about how menopause influences type 2 diabetes, ...",60,,,
🌟 Managing diabetes can be empowering! 🥰 Heres some everyday tips to help stay on track! #diabetes,wktGB-g33s8,Jing ,2025-03-18T02:46:17Z,https://www.youtube.com/watch?v=wktGB-g33s8,,40,,,
Know the medicinal herbs that are used in management of diabetes in Ayurveda #trending #diabetes,EjGH2lPQzkg,Ministry of Ayush,2025-02-13T09:34:31Z,https://www.youtube.com/watch?v=EjGH2lPQzkg,,25,,,
"**""Diabetes Management: 5 Must-Know Tips for a Healthier Life! 🌿✨""**#diabetes",S-AiPTTuZmQ,Keerthana Ayurvedics (DrBinil Balakrishnan),2025-01-29T05:44:01Z,https://www.youtube.com/watch?v=S-AiPTTuZmQ,,62,,,
Yoga for Diabetes Management: Top Poses to Regulate Blood Sugar Levels,muATlfVIUpc,Workout  for You,2025-02-05T08:26:27Z,https://www.youtube.com/watch?v=muATlfVIUpc,"Discover effective yoga poses to help manage diabetes by improving insulin sensitivity and reducing stress. In this video, we ...",20,,,
Balancing Your Blood Sugar Holistically #shorts #diabetesmanagement,Qanp4j6NiIw,Holistic Health Associates,2025-01-20T16:30:57Z,https://www.youtube.com/watch?v=Qanp4j6NiIw,,48,,,
Smart Food Choices for Managing Diabetes  #DiabetesManagement #HealthyEating #SmartChoices,Lp0_ayLa3Aw,Lifeful Health,2025-01-19T11:41:39Z,https://www.youtube.com/watch?v=Lp0_ayLa3Aw,Discover how smart food choices can help manage diabetes effectively. #DiabetesManagement #HealthyEating #SmartChoices ...,48,,,
5 best fruits for diabetes management #medicalstudent #nepalicommunity,CU5XGcsg7cM,Dr Hari Bhusal foundation (BIHANI Academy),2025-03-31T02:57:32Z,https://www.youtube.com/watch?v=CU5XGcsg7cM,,54,,,
Understanding the Glycemic Index: A Guide for Diabetes Management,RfQvU_zN35Y,GLUCOSE BALANCED BITES,2025-03-10T00:00:20Z,https://www.youtube.com/watch?v=RfQvU_zN35Y,Learn about the glycemic index and how it can be utilized to manage diabetes through smarter dietary choices and exercise ...,45,,,
Nature’s Secret Allies for Managing Diabetes!,nNi1mPKoPts,Better Health for You,2025-01-28T11:59:10Z,https://www.youtube.com/watch?v=nNi1mPKoPts,Nature's Secret Allies for Managing Diabetes! Did you know that certain fruits are nature's secret allies for managing diabetes?,,,,
Do not intake extra calories in diabetes. #diabetesmanagement #diabetessymptoms #diabetescare,D0mlSDPOrZc,kapilathecreator,2025-03-06T11:59:00Z,https://www.youtube.com/watch?v=D0mlSDPOrZc,Do not intake extra calories in diabetes. #diabetesmanagement #diabetessymptoms #diabetescare.,82,,,
Microbiome Matters: Gut Health in Diabetes Management,gGxpgOwIT7I,GLUCOSE BALANCED BITES,2025-03-15T00:00:36Z,https://www.youtube.com/watch?v=gGxpgOwIT7I,"Explore the vital role of gut health in diabetes management, focusing on microbiome-friendly foods and probiotics for improved ...",45,,,
Paneer tikka sandwich effect on blood sugar  #diabetes #diabetesmanagement,gLrodkDwD1Q,DiabetesFreeLiving,2025-02-07T05:00:40Z,https://www.youtube.com/watch?v=gLrodkDwD1Q,Episode 7 - Paneer Tikka Sandwich and my blood sugar Below are the ingredients : - White Bread - Paneer - Indian spices ...,50,,,
3 या 6? कितने बार खाना चाहिए? #diabetesmanagement  #healthyeating  #balancedmeals,fX0CPNPOF4o,FitCine Ayurved,2025-01-07T13:47:12Z,https://www.youtube.com/watch?v=fX0CPNPOF4o,"Discover the truth about meal frequency for diabetics! Learn how balanced meals and snacks can help stabilize blood sugar, ...",49,,,
Manage Diabetes with these Asanas,rcmn1AZsR04,Kapiva ,2025-02-18T07:00:35Z,https://www.youtube.com/watch?v=rcmn1AZsR04,"Yoga asanas help manage diabetes through improved insulin sensitivity, stress reduction, weight management, enhanced ...",36,,,
🩸 Mastering Diabetes: Top Tips for Smooth Blood Sugar Control!,dj9085Volgw,Prasanka,2025-03-23T19:45:02Z,https://www.youtube.com/watch?v=dj9085Volgw,Mastering Diabetes: Smooth Control Tips! (Expert Advice for Blood Sugar Balance) Struggling to manage diabetes and keep ...,55,,,
Diabetes Management Hacks You NEED To Know,7chgR6em7js,Sehat Sangam,2025-01-13T09:41:57Z,https://www.youtube.com/watch?v=7chgR6em7js,,27,,,
Diabetes: Foods to include #diabetes #diabetesawareness #diabetesmanagement #diabeteslifestyle,YhaeHTuUHQg,The Knowledge Voyage,2025-01-24T06:58:04Z,https://www.youtube.com/watch?v=YhaeHTuUHQg,This video highlights the top foods you should include if you have diabetes. Managing your blood sugar levels is key to a healthy ...,44,,,
Daily wins with diabetes management #omnipod #type1,MC-xapp26NA,James McCormick,2025-03-31T07:29:36Z,https://www.youtube.com/watch?v=MC-xapp26NA,Living with type 1 diabetes: another pump challenge #type1 #type1diabetes #fok.,68,,,
#diabetesmanagement  #bloodsugarcontrol  #naturalremedies  #diabetescontrol  #jamunseedspowder,eOqVqYX16n8,Shreya oza - Dietician,2025-02-10T14:15:07Z,https://www.youtube.com/watch?v=eOqVqYX16n8,Did you know Jamun seeds powder can help regulate blood sugar levels and manage diabetes? Watch till the end to learn ...,26,,,
Brussels Sprouts:  The Diabetes Superfood! #brussels #diabetesmanagement #diabetes,KLoaqJEu-Is,Fit & Nourished Health,2025-03-21T21:11:16Z,https://www.youtube.com/watch?v=KLoaqJEu-Is,Watch the complete video here https://youtu.be/PqR_0gwVa3c.,59,,,
#diabetesfriendlyfoods #diabetesmanagement #fitindiahealthyindia,jIzjsiXxP8A,Dr Janardhan murthy,2025-02-25T05:51:10Z,https://www.youtube.com/watch?v=jIzjsiXxP8A,diabetesfriendlyfoods #diabetesmanagement #fitindiahealthyindia.,29,,,
7 Best Exercises to Manage Diabetes | Stay Active and Healthy,XjPRZskEZ3k,Nuri Vit,2025-01-05T23:31:45Z,https://www.youtube.com/watch?v=XjPRZskEZ3k,Discover the 7 best exercises to effectively manage diabetes and maintain a healthy lifestyle. 🏋️‍♂️ These workouts are ...,33,,,
Artificial Pancreas Diabetes Management Revolution,MZLZJ2GETT0,Lisa Voronkova,2025-02-17T02:27:35Z,https://www.youtube.com/watch?v=MZLZJ2GETT0,,32,,,
"""Breads to Avoid for Better Diabetes Management! 🚫🍞"" @StayHealthyWithPrem",neSuikYredA,Stay Healthy With Prem,2025-02-16T21:21:42Z,https://www.youtube.com/watch?v=neSuikYredA,"Learn which breads to avoid if you have diabetes to keep your blood sugar levels in check. Discover why white bread, brioche, ...",54,,,
How GLP1 Agonists Work  The Science Explained,p74dnZFOcrY,Pharmacist Online,2025-02-06T18:30:43Z,https://www.youtube.com/watch?v=p74dnZFOcrY,"""GLP‐1 Agonists EXPLAINED: The Weight Loss Breakthrough"" Welcome back to Pharmacist Online! In this deep dive, we uncover ...",67,,,
Veg Club sandwich effect on blood sugar #diabetes #diabetesmanagement,0n5mdCioJHo,DiabetesFreeLiving,2025-02-06T05:00:02Z,https://www.youtube.com/watch?v=0n5mdCioJHo,Episode 6 - Veg Club Sandwich and my blood sugar Below are the ingredients : - White Bread - Potato masala - Veggis like onion ...,48,,,
Day 9 #highfiber #changeyourmindsetchangeyourlife #whatieatinaday #diabetesmanagement,xB9zWSlRrdY,LavLife_WithDiabetes,2025-03-19T23:29:12Z,https://www.youtube.com/watch?v=xB9zWSlRrdY,,58,,,
Tomatoes: Low Glycemic Index Superfood for Diabetics! #superfoods #diabetes #diabetesmanagement,eV-lpzwMiqM,Fit & Nourished Health,2025-03-22T00:10:20Z,https://www.youtube.com/watch?v=eV-lpzwMiqM,Watch the complete video here https://youtu.be/PqR_0gwVa3c.,52,,,
This simple change could transform your diabetes management,bjFWmG053s8,Lewis Bertus PA-C - Diabetes Reversal Health Coach,2025-01-17T20:30:04Z,https://www.youtube.com/watch?v=bjFWmG053s8,"Discover the incredible potential of a whole food, plant-based diet for normalizing blood sugar and reversing diabetes. Are you ...",45,,,
Diabetic meal plan! 👌🏽 #diabetes #diabetesawareness #diabetesmanagement #shorts,eRZ-ImOJGQg,Dayra Glow Up Finds,2025-03-29T14:38:30Z,https://www.youtube.com/watch?v=eRZ-ImOJGQg,,37,,,
#viralfood #streetfood #rolls #yutubeshorts #snacks #lowcarb #ragiroti #diabetesmanagement,2T9Me8QATUI,Radhikadailyvibes ,2025-03-09T09:32:02Z,https://www.youtube.com/watch?v=2T9Me8QATUI,Vegetable ragi flour rolls sound like a delicious and healthy recipe! Here's a simple idea to create them: ### Ingredients: - **For ...,52,,,
Yoga for Diabetes Management | Bhujangasana Yoga Pose #yogafordiabetes #diabetes #yoga #shorts,BT9YQYM55Xk,Lifestyle by Parijat,2025-03-05T08:48:35Z,https://www.youtube.com/watch?v=BT9YQYM55Xk,,17,,,
Diabetes Management: Natural Ways to Control Blood Sugar Fast | Vedic Upchar | #diabetes #shorts,XQ3UidxvLHo,Vedic Upchar,2025-03-16T09:30:18Z,https://www.youtube.com/watch?v=XQ3UidxvLHo,Diabetes Management: Natural Ways to Control Blood Sugar Fast | Vedic Upchar | #diabetes #shorts Struggling with diabetes and ...,49,,,
Mastering Portion Control for Diabetes,Fs1luQ5vy9I,Diabetes Daily Dose,2025-01-03T20:30:15Z,https://www.youtube.com/watch?v=Fs1luQ5vy9I,Portion control is key in diabetes management! Learn how it affects blood sugar and tips to implement it in your meals.,51,,,
"Diabetes in Cats: Symptoms, Causes & Management Tips 🐾💉",qyqWhYeqbpw,Pawltu,2025-03-10T03:00:50Z,https://www.youtube.com/watch?v=qyqWhYeqbpw,"Feline diabetes can be managed with proper care. Learn the common symptoms, causes, and how to help your cat live well with ...",46,,,
Can Diabetes Management Lead to Insulin Free Living?,_8Yqx6nZRgo,"Arti Thangudu, MD",2025-02-14T10:00:48Z,https://www.youtube.com/watch?v=_8Yqx6nZRgo,"This episode features Dr. Sandra Sobel, a board-certified endocrinologist, lifestyle medicine specialist, and obesity expert based ...",44,,,
Habits for Better Diabetes Management in 2025! 🌟#DiabetesManagement #HealthyLiving,hUpAwq2Klp8,Dr Ruchita Mehta ,2025-01-02T12:29:22Z,https://www.youtube.com/watch?v=hUpAwq2Klp8,,10,,,
Long Term Risks of Diabetes  What You Should Know,8v-QElXDLxk,Pharmacist Online,2025-02-01T19:00:04Z,https://www.youtube.com/watch?v=8v-QElXDLxk,Diabetes Expert Shares INSULIN Secrets You Never Knew! DIABETES DECODED 2025! Uncover the truth about Type 1 vs ...,74,,,
"Mulberries are rich in vitaminC,antioxidants,antiinflammatory used in diabetes management #mulberry",OmzjOItmnn8,nikitha repala,2025-03-20T15:01:28Z,https://www.youtube.com/watch?v=OmzjOItmnn8,They're good for heart health Mulberries and mulberry extracts can lower cholesterol levels. By reducing bad cholesterol ...,54,,,
Blood Pressure Control Foods for Diabetic Patient #હરાવો #diabetes #diabetesdiet,_lpM0PiIhnk,Health Campus,2025-03-09T13:29:00Z,https://www.youtube.com/watch?v=_lpM0PiIhnk,Blood Pressure Control Foods for Diabetic Patient Healthy Diet Plan for Diabetes & Blood Pressure | Indian Vegetarian Recipes ...,15,,,
Sugar control tips in hindi| Diabetes control tips| sugar Kaise kam kare| |#diabetes #diabetesdiet,Cd7f1iGdelc,Dr. Manish Show Official,2025-02-16T04:23:29Z,https://www.youtube.com/watch?v=Cd7f1iGdelc,Sugar control tips in hindi| Diabetes control tips| sugar Kasie kam kare| |#diabetes #shorts #diabetesdiet #diabetes #shorts #short ...,46,,,
"Weight loss ho PCOD, thyroid ya diabetes—solution fancy diets nahi balki ghar ka khana hai  🥗",tCr-ZM7Nfqs,CureEats,2025-02-22T15:33:22Z,https://www.youtube.com/watch?v=tCr-ZM7Nfqs,"Weight loss ho ya PCOD, thyroid ya diabetes—solution fancy diets nahi, balki ghar ka khana hai! Toh chaliye, health ko ...",38,,,
🔬 The Hidden Link Between Gut Health & Blood Sugar! #DiabetesHealth #GutHealth #BloodSugarControl,5NsWAuQYlCE,Sugar Control Chronicles,2025-02-07T17:14:57Z,https://www.youtube.com/watch?v=5NsWAuQYlCE,The Hidden Link Between Gut Health & Blood Sugar! #DiabetesHealth #GutHealth #BloodSugarControl Did you know your gut ...,49,,,
Are Glycemic Index Diets Worth It? #diabetesmanagement #bloodsugarcontrol #healthyhabits#lowerhba1c,W7Sgcs58oJM,Sehat Sangam,2025-01-23T11:40:05Z,https://www.youtube.com/watch?v=W7Sgcs58oJM,"Are you considering a glycemic index diet to manage your blood sugar levels? In this video, we'll dive into the concept of glycemic ...",54,,,
🥰 This #CAT Meets A #SNAKE 🐍🐍!!️ #diabetesmanagement #cat #hognose #blackcat #reptiles #catvideos,_5fOykSHwE4,Saving Hearts,2025-03-31T15:57:06Z,https://www.youtube.com/watch?v=_5fOykSHwE4,,11,,,
Managing diabetes doesn’t have to be complicated,UK9hTwAsuHQ,SAT KARTAR,2025-01-08T11:30:56Z,https://www.youtube.com/watch?v=UK9hTwAsuHQ,"Managing diabetes doesn't have to be complicated. With the power of Ayurveda, you can support your body's natural balance and ...",16,,,
शुगर कंट्रोल टिप्स#diabetesdietitian #diabetics #DiabeticCare #diabetesmanagement,z-M7GYF4z4M,biovedics,2025-01-15T01:50:01Z,https://www.youtube.com/watch?v=z-M7GYF4z4M,शुगर कंट्रोल टिप्स#diabetesdietitian #diabetics #DiabeticCare #diabetesmanagement.,9,,,
Is 200 Blood Sugar Normal after Eating? #diabetesmanagement #diabetesawareness,3HA8hztUKcI,MediDoc,2025-01-08T20:38:02Z,https://www.youtube.com/watch?v=3HA8hztUKcI,,21,,,
When to Be Concerned About Medication Side Effects,MNxdIeHFrKY,Pharmacist Online,2025-02-05T18:43:12Z,https://www.youtube.com/watch?v=MNxdIeHFrKY,"If you're taking diabetes medication, understanding the side effects is crucial! In this video, we break down the most common ...",64,,,
ABCD of Diabetes Management: Z for Zzz Sleep | Diabetes Management | Dr Sushil Patel,4sGRlnUP0n4,The Sugar Specialist,2025-02-10T10:30:02Z,https://www.youtube.com/watch?v=4sGRlnUP0n4,"Learn how better sleep can enhance your overall health and glucose control. If you're struggling with sleep issues and diabetes, ...",207,,,
Printed power | A revolutionary biosensor to change the treatment of diabetes forever,vfoN1TdLyew,Universities Australia,2025-03-17T23:04:16Z,https://www.youtube.com/watch?v=vfoN1TdLyew,"There are 1.3 million people living with diabetes in Australia, globally this is predicted to reach 1.3 billion people by 2050. Testing ...",123,,,
Powerful Herbs for Diabetes Management,aSl4mFv3VJ0,Health Tips Channel,2025-03-26T23:22:52Z,https://www.youtube.com/watch?v=aSl4mFv3VJ0,Powerful Herbs for Diabetes Management Discover Powerful Herbs for Diabetes Management! Are you looking for natural ...,49,,,
#diabetes #brownsugar#diabetesmanagement #diabetesawareness.,pTmiWjQJCcM,DieticianPharma Hub,2025-03-08T11:54:53Z,https://www.youtube.com/watch?v=pTmiWjQJCcM,,49,,,
ABCD of Diabetes Management: V for Vascular Complications | Dr Sushil Patel,84WOt7GQpow,The Sugar Specialist,2025-01-16T07:30:03Z,https://www.youtube.com/watch?v=84WOt7GQpow,"Vascular complications are common in people with diabetes, affecting both large and small blood vessels. This can lead to ...",137,,,
Diabetes Management: Control It & Live a Normal Life | Dr. Meenakshi Sundari #diabetes,yO3ID0hVINo,SRM Global Hospitals,2025-03-17T11:14:49Z,https://www.youtube.com/watch?v=yO3ID0hVINo,"Can You Control Diabetes and Live a Normal Life? Diabetes doesn't have to control you! In this video, Dr. Meenakshi Sundari ...",153,,,
Managing diabetes just got easier with Shifa Insulin Syringes. Because every dose matters!,tyMB3x-4d7M,Shifa Medical Devices,2025-02-11T17:09:38Z,https://www.youtube.com/watch?v=tyMB3x-4d7M,The wait is finally over! Shifa Insulin Syringe is here to change the game. What makes it stand out? What sets it apart from the rest ...,116,,,
Taking Care of Your Feet: Avoiding Nerve Pain  #defeatdiabetes,ov94dur95As,DIABETES ESSENTIALZ,2025-02-14T16:45:05Z,https://www.youtube.com/watch?v=ov94dur95As,Taking Care of Your Feet – Avoiding Nerve Pain Did you know that foot care is crucial for those living with diabetes?,59,,,
ABCD of Diabetes Management: U for Understanding Diabetes | Prevent Complications | Dr Sushil Patel,0QON-qjFB7o,The Sugar Specialist,2025-01-06T06:53:39Z,https://www.youtube.com/watch?v=0QON-qjFB7o,"Understanding diabetes is key to managing the condition effectively. Early awareness helps prevent complications, improves ...",113,,,
Diabetes and Egg Yolks: Separating Fact from Fiction #shorts #egg #eggyolk #diabetesmanagement,zmBvvnkRP2M,Nidhi's Health Line Channel ,2025-02-09T07:33:03Z,https://www.youtube.com/watch?v=zmBvvnkRP2M,"THe relationship between agave, cholesterol, and diabetes: Agave and Cholesterol: A Healthy Combination for Diabetes ...",27,,,
"""Unlocking the Potential of Protein Supplementation in Diabetes Management""lDr G Kiranl #drkiran",8ZciNKLj5AU,Diabetes Guru,2025-01-15T11:57:11Z,https://www.youtube.com/watch?v=8ZciNKLj5AU,"""Protein plays a vital role in many bodily functions, including muscle growth and repair. But can it also help diabetics manage their ...",59,,,
Managing Side Effects of Diabetes Medications,MfWpAqzSpPM,Pharmacist Online,2025-02-04T21:45:00Z,https://www.youtube.com/watch?v=MfWpAqzSpPM,"If you're taking diabetes medication, understanding the side effects is crucial! In this video, we break down the most common ...",72,,,
Protein Power: Key Foods for Diabetes Management,yWZUIGcO_G4,GLUCOSE BALANCED BITES,2025-03-13T00:01:00Z,https://www.youtube.com/watch?v=yWZUIGcO_G4,"Explore the essential role of protein-rich foods in managing diabetes through balanced diet and exercise, with tips on meal ...",46,,,
Day #7 - What I eat in a day as Diabetic ? #diabetes #diabetic #diabetesmanagement #diabetescare,BzxCKZH6pak,Happily Diabetic,2025-03-06T17:48:50Z,https://www.youtube.com/watch?v=BzxCKZH6pak,,60,,,
Diabetic neuropathy and balance,uUGvoWy8vIA,Diabetes Management Group,2025-02-07T04:39:35Z,https://www.youtube.com/watch?v=uUGvoWy8vIA,"Our balance is a combination of our vision, hearing, and sensation of our body. With diabetic peripheral neuropathy, there is ...",60,,,
