Title,Video ID,Channel,Published At,URL,Description,Video Length,Views,Likes,Comments
"Survivors, advocates, and lawmakers are coming together for breast cancer awareness",0bRMMKgRKWc,WRTV Indianapolis,2025-03-31T10:04:55Z,https://www.youtube.com/watch?v=0bRMMKgRKWc,"Survivors, advocates, and lawmakers are coming together for breast cancer awareness.",111,113,9,1
Tobacco & Cancer: The Deadly Connection  | Dr. Veenoo Agarwal – Medical Oncologist,ylX5uLt_h48,Cancer Cure Talks,2025-03-31T09:29:36Z,https://www.youtube.com/watch?v=ylX5uLt_h48,cancerprevention #cancerawareness #cancer #cancersurvivor #cancersupport #cancertreatment #cancerresearch #cancercare ...,89,233,1,0
Tutu Triumph: Bob's tutu antics for cancer awareness! #cancerawareness  #charityrace  #funnystory,Mj3p8yW3E7Y,MsB47,2025-03-30T12:18:21Z,https://www.youtube.com/watch?v=Mj3p8yW3E7Y,,43,471,7,0
26/31 10k a day for colon cancer awareness month 🩵💙 #runner #cancerawareness #coloncancer,V6RAZPtz30o,Laura-Jean Bainbridge,2025-03-29T21:53:20Z,https://www.youtube.com/watch?v=V6RAZPtz30o,,36,527,27,2
March is Colorectal Cancer Awareness Month; it's the third most common cancer in the U.S..,woQs14c_xHU,NBC Connecticut,2025-03-29T17:29:14Z,https://www.youtube.com/watch?v=woQs14c_xHU,In the lasts two decades colon cancer has moved up from being the fourth leading cause of cancer death in people under 50 -- to ...,84,138,1,0
Colon cancer awareness Part 1 by Dr Jivraj Mehta Hospital,YZyqOnYHe1E,Dr. Jivraj Mehta Smarak Health Foundation,2025-03-29T09:14:56Z,https://www.youtube.com/watch?v=YZyqOnYHe1E,"Colon cancer is one of the 10 most common cancers in India, yet its early symptoms often go unnoticed. Recognizing these ...",70,117,5,0
Round 3 #cancerawareness #cancerjourney,D9h3TP9erWI,Life with Tashanna🥰,2025-03-28T18:38:27Z,https://www.youtube.com/watch?v=D9h3TP9erWI,,22,892,115,47
"Runner honors mom in Cooper River Bridge Run, raising cancer awareness with each step",SK86-mJ4wzk,ABC News 4,2025-03-28T16:00:36Z,https://www.youtube.com/watch?v=SK86-mJ4wzk,"CHARLESTON, S.C. (WCIV) — As the Cooper River Bridge Run nears, excitement is building across Charleston. Thousands of ...",157,147,0,0
Lavender Lehenga for Cancer Awareness 💜 #shorts #grwm #fashion,fNUArkDNAc8,Tahlia Suraj,2025-03-28T12:30:43Z,https://www.youtube.com/watch?v=fNUArkDNAc8,"A single moment can change everything. Let's talk about early cancer detection. Cancer doesn't always come with a warning, but ...",15,58465,979,11
Colon Cancer Awareness Month,AGrwmNld4OM,KTVN 2 News Nevada,2025-03-28T06:36:17Z,https://www.youtube.com/watch?v=AGrwmNld4OM,Natalie Brand has the story of a young woman who is trying to raise awareness about the importance of early detection.,126,32,0,0
What's Going Around: Colorectal Cancer Awareness Month,9jHXYVR8FmY,"KY3 News - Springfield, Mo.",2025-03-27T23:53:06Z,https://www.youtube.com/watch?v=9jHXYVR8FmY,A local physician is urging people to get their recommended colorectal cancer screenings. For more Local News from KY3: ...,119,776,0,0
Prostate Cancer Awareness at the State House,WIr5RuCvD5Q,WWLP-22News,2025-03-27T22:04:10Z,https://www.youtube.com/watch?v=WIr5RuCvD5Q,"Today is Prostate Cancer Awareness Day at the State House, and lawmakers are speaking out about the importance of early and ...",106,44,0,0
Colorectal Cancer Awareness | Healthwatch 16,Tqw3z9W4180,WNEP,2025-03-27T21:34:55Z,https://www.youtube.com/watch?v=Tqw3z9W4180,Newswatch 16's Kerry Kearns spoke with a medical expert about why health screenings like colonoscopies are essential.,104,97,2,0
Carolina Digestive Diseases - Colon Cancer Awareness Month 3.28,oXJH3lT3ilM,WITN-TV,2025-03-27T12:39:22Z,https://www.youtube.com/watch?v=oXJH3lT3ilM,https://cddgastro.com/ For more Local News from WITN: https://www.witn.com/ For more YouTube Content: ...,31,9,0,0
A little prayer for Xander please 🙏 ❤️ #childhoodcancer #cancerawareness #cancer #prayer #prayers,pzB-0XU2XSk,VFamily6,2025-03-26T21:24:05Z,https://www.youtube.com/watch?v=pzB-0XU2XSk,,21,4170,27,3
Early Symptoms of Cancer #cancerawareness #healthtipstelugu #ytshorts #shorts,Jkdx6hmeyFI,Socialpost Health,2025-03-26T14:00:17Z,https://www.youtube.com/watch?v=Jkdx6hmeyFI,Socialposthealth #healthtipstelugu #anchoranushakomal Early Warning Signs of Cancer You Shouldn't Ignore | Early Symptoms ...,59,4487,101,15
Cancer Awareness | Important Insights by Dr. Abhishek Das,XDRf244zwuo,Dr Abhishek Das,2025-03-26T03:42:34Z,https://www.youtube.com/watch?v=XDRf244zwuo,"Join Dr. Abhishek Das as he shares vital information about cancer awareness, early detection, prevention, and treatment options.",47,623,11,0
18/31 10k a day for colon cancer awareness month 🩵💙 #runner #coloncancer #cancer #vlog,Xl7_x_-9_JE,Laura-Jean Bainbridge,2025-03-25T18:09:18Z,https://www.youtube.com/watch?v=Xl7_x_-9_JE,,12,428,8,3
Colon Cancer Awareness: Know the Facts,VrVWt7-KgBg,Aster Medcity,2025-03-25T03:30:28Z,https://www.youtube.com/watch?v=VrVWt7-KgBg,"Colon cancer is one of the most common and preventable cancers—if detected early. ‍⚕️Dr. Sreekanth M P, Associate ...",58,964,7,0
Breast Cancer Awareness: Early Detection & Prevention | Dr. Suvendu Maji | Surgical,XMjKmzT_FiI,Dr Suvendu Maji Surgical Oncologist Kolkata,2025-03-24T10:06:16Z,https://www.youtube.com/watch?v=XMjKmzT_FiI,"Breast cancer is one of the most common cancers among women, but early detection can save lives. In this video, Dr. Suvendu ...",68,162,10,0
Dr Chanchal Goswami - Colorectal Cancer Awareness,JaiAdKvfn-0,MedGenome,2025-03-24T07:18:54Z,https://www.youtube.com/watch?v=JaiAdKvfn-0,"Dr. Chanchal Goswami, Senior Consultant – Medical Oncology, Manipal Hospital, Kolkata highlights the importance of early ...",122,19758,0,0
Early Warning! These Tests Can Detect Cancer in Time #shorts #cancerawareness #earlydetection,OlJJIrSjXk4,Boring laugh,2025-03-23T14:30:16Z,https://www.youtube.com/watch?v=OlJJIrSjXk4,Early Warning! These Tests Can Detect Cancer in Time #shorts #cancerawareness #earlydetection Credit - @rajshamani orignal ...,53,137,2,0
Colorectal Cancer Awareness Month. #colorectalcancerawareness #cancer #cancerawareness #cancercare,5A_cSFmU4w8,Dr. Nikhil Agrawal,2025-03-23T08:14:55Z,https://www.youtube.com/watch?v=5A_cSFmU4w8,,55,213,0,0
Twin Warriors #cancer #awareness  #diagnosis #heath #wellness #twins #retinoblastoma #love #fighter,anXhBKgvtaU,The Oakley Twins' Journey,2025-03-22T23:28:59Z,https://www.youtube.com/watch?v=anXhBKgvtaU,,11,16637,478,9
Colon Cancer Awareness Month. 3 of 3.,ndNYmzuUlck,Kenneth Candido,2025-03-22T22:41:53Z,https://www.youtube.com/watch?v=ndNYmzuUlck,,45,108,4,3
Whole day of Radiation Oncologist #ytshorts #cancertreatment #cancerawareness #radiatontherapy #yt,5AdO0ZTTOWg,Dr Rekha Arya Cancer Specialist,2025-03-22T18:09:08Z,https://www.youtube.com/watch?v=5AdO0ZTTOWg,,31,4108,54,2
"No Shame, Get Screened!: Colon Cancer Awareness Month",PoX42Gn3Oc4,OUR NEWS,2025-03-22T14:00:48Z,https://www.youtube.com/watch?v=PoX42Gn3Oc4,"No Shame, Get Screened!: Colon Cancer Awareness Month Colon Cancer is now the primary cause of cancer-related deaths ...",52,1447,31,0
Colonoscopy vs. Cologuard: What's the Difference? (Colon Cancer Awareness),k9kf_10Hutc,Support Local: Baton Rouge,2025-03-21T14:27:49Z,https://www.youtube.com/watch?v=k9kf_10Hutc,"Get the facts about colon cancer screening! Dr. Matt Rolfsen explains the new screening guidelines (starting at 45), the ...",238,17848,0,0
#cancer #cancerawareness,z4Pk8BDTNNE,cowboycult863,2025-03-20T22:30:57Z,https://www.youtube.com/watch?v=z4Pk8BDTNNE,,19,90,3,0
#breastcancer #breastcancerawareness #cancerawareness #cancerjourney #cancerfighter #surgery,4GIhd_npvwM,Great Mich Adventure,2025-03-20T00:15:14Z,https://www.youtube.com/watch?v=4GIhd_npvwM,,45,505,7,2
15/31 10k a day for colon cancer awareness month 💙🩵 #running #coloncancer #vlog,p8-dl-cYvoQ,Laura-Jean Bainbridge,2025-03-19T20:31:00Z,https://www.youtube.com/watch?v=p8-dl-cYvoQ,,18,476,0,4
#cancer #cancerawareness #healthstories,MQWp78_oPXQ,Cultivating Health Narratives (Storytelling),2025-03-19T16:18:40Z,https://www.youtube.com/watch?v=MQWp78_oPXQ,,41,281,7,0
Birth control pills prevent ovarian cancer #cancerawareness #healthtipstelugu #ytshorts #shorts,zXLPDBA0-Ik,Socialpost Health,2025-03-19T16:01:16Z,https://www.youtube.com/watch?v=zXLPDBA0-Ik,Socialposthealth #healthtipstelugu #anchoranushakomal Birth control pills prevent ovarian cancer | Contraceptives Lead to ...,53,774,27,15
🛡️💉 Immunotherapy #shorts #shortvideo #shortsfeed #cancerawareness,lJoEQ5neQis,Dr. Vikas Goswami - Oncologist,2025-03-18T16:01:07Z,https://www.youtube.com/watch?v=lJoEQ5neQis,,44,1702,57,0
Thyroid Cancer Awareness | Maa Super Specialties | Maa Hospitals | Cancer Symptoms | Shorts,T86D8dezT9o,MAA ENT HOSPITALS,2025-03-18T09:07:17Z,https://www.youtube.com/watch?v=T86D8dezT9o,March is Medullary Thyroid Cancer Awareness Month! Medullary Thyroid Cancer (MTC) is a rare but aggressive form of thyroid ...,41,903,8,0
Colorectal Cancer Awareness Month: A discussion of early detection and treatment,c6iu892WwYs,KCAL News,2025-03-13T15:00:42Z,https://www.youtube.com/watch?v=c6iu892WwYs,"Dr. Karl Kwok, gastroenterologist, discusses symptoms of colorectal cancer, survival rates and treatment.",234,803,19,1
March is Colorectal Cancer Awareness Month! Early screenings and imaging can save lives.,Wg7tBKsODzY,Delaware Imaging Network,2025-03-13T04:00:24Z,https://www.youtube.com/watch?v=Wg7tBKsODzY,"As an outpatient imaging center, we're here to help detect and diagnose. Get screened and encourage others to do the same.",11,604,6,0
Voices of Strength: The Fight for Stomach Cancer Awareness,Zg8tsg6HflY,Hope For Stomach Cancer,2025-03-12T19:05:44Z,https://www.youtube.com/watch?v=Zg8tsg6HflY,"Too many lives have been lost to stomach cancer due to late detection. This video shares powerful stories from survivors, ...",146,32577,153,2
"""National Colorectal Cancer Awareness Month: Are You at Risk?"" #motivation #inspiration #coloncancer",Qc2aLN_occM,InspireUpliftEvolve,2025-03-12T13:30:14Z,https://www.youtube.com/watch?v=Qc2aLN_occM,Subscribe to stay updated with more content! https://shorturl.at/atFZ7 New video every day! March is colorectal cancer ...,141,33933,125,0
cervical cancer awareness,A9bsk3-zwX0,DR. PRATHISTA RAO,2025-03-11T17:46:47Z,https://www.youtube.com/watch?v=A9bsk3-zwX0,,93,562,16,1
🚨 Hookah & Cancer:  #HookahRisks #CancerAwareness #SayNoToHookah #LungHealth #StaySmokeFree,9OiJS1a7Ks4,Dr. Vikas Goswami - Oncologist,2025-03-11T13:03:18Z,https://www.youtube.com/watch?v=9OiJS1a7Ks4,,30,496,19,0
Colon Cancer Awareness Month: Know the signs before it's too late,atDTihO1tXI,WBNS 10TV,2025-03-09T14:45:54Z,https://www.youtube.com/watch?v=atDTihO1tXI,Colorectal cancer is one of the most treatable forms of cancer when caught early with a 90% survival rate.,192,872,6,1
Cancer Symptoms you shouldn’t ignore Cancer Awareness Podcast with Dr Ajesh Raj Saksena,lnXrPZO3cpE,Mana Zoomin TV,2025-03-09T09:33:50Z,https://www.youtube.com/watch?v=lnXrPZO3cpE,"Smoking is a ticking time bomb! Here are 16 different types of cancers you can get from smoking. Stay informed, stay healthy!",55,125,0,1
"Women's Day, International Women's Day, Breast Cancer awareness, Breast cancer symptoms & treatments",RWnTYg8LRsM,"Brand Promotion Agency, Promotional Media Agency ",2025-03-08T12:31:00Z,https://www.youtube.com/watch?v=RWnTYg8LRsM,Happy International Women's Day #women #breastcancer #breatcancerawareness #internationalwomensday #health ...,85,978,0,0
Busting Thyroid Cancer Myths || Cancer Awareness || Prathima Cancer Institute #shorts #telugushorts,NrVoDbHyTWg,Prathima Cancer Institute,2025-03-07T03:30:10Z,https://www.youtube.com/watch?v=NrVoDbHyTWg,"Thyroid cancer is often misunderstood. Many believe it's always deadly, but with early detection, it's highly treatable. It's not just ...",88,1561,16,0
Cancer Awareness Programme 2025 | United by Unique | RVCN & Aster RV,u1pNb19ZG1Y,R V College of Nursing,2025-03-06T13:11:25Z,https://www.youtube.com/watch?v=u1pNb19ZG1Y,"The NSS unit of #RVCN, in collaboration with Aster RV and esteemed institutions like SDS TRC & RGICD College of Nursing, ...",124,231,70,16
Cervical Cancer Awareness | Women's Health Awareness | Cancer Prevention Tips |,XFiPzhpeGnA,"Indian Cancer Society, Karnataka",2025-03-06T11:05:38Z,https://www.youtube.com/watch?v=XFiPzhpeGnA,"A doctor speaks with a teacher, reminding her that health should be a priority too. Educators shape young minds, but their ...",74,244,71,0
"Colon cancer awareness, screening and prevention",v-R5pAbE73U,Novant Health,2025-03-05T14:36:59Z,https://www.youtube.com/watch?v=v-R5pAbE73U,"Just because you're under the recommended screening age for colon cancer, that doesn't mean you shouldn't be aware of key ...",7,1180,9,2
March is Colon Cancer Awareness Month-Get Your Screening Today!,0J3N8_tN8rY,Bergen Medical Associates,2025-02-28T03:10:49Z,https://www.youtube.com/watch?v=0J3N8_tN8rY,"Take control of your health - if you're 45 or older, schedule a colon cancer screening at Bergen Medical Associates. Our skilled ...",31,32445,0,0
Discussions will lead to better Breast Cancer Awareness | Dr. Kaushal Patel | Zydus Group,2BDoL6pdbO4,Zydus Lifesciences,2025-02-25T05:41:07Z,https://www.youtube.com/watch?v=2BDoL6pdbO4,"The conversation around breast cancer is still considered a taboo in India, but it's time to break the silence. Join Dr. Kaushal Patel, ...",60,21120,6,0
"Pancreatic Cancer Awareness | Dr. Appou Tamijmarane, Consultant General Surgeon | Cancer Treatment",x8UslL_7sfE,Fakeeh University Hospital,2025-02-22T10:01:08Z,https://www.youtube.com/watch?v=x8UslL_7sfE,"FUH in A Minute | Pancreatic Cancer Awareness In this episode of FUH in A Minute, Dr. Appou Tamijmarane, Consultant ...",110,4664,4,0
#cancer #cancersymptoms #cancersigns #lungcancer #cancerawareness #cancerscreening #shorts,TqX2_i6FH9c,Sakshi Life,2025-02-21T10:00:29Z,https://www.youtube.com/watch?v=TqX2_i6FH9c,"Symptoms of lung cancer | Shorts | Dr. Deepak Koppaka | Sakshi Life Namaste, Health Warriors! Welcome to Sakshi Life , your ...",59,6693,75,0
Keep Cancer Away-Remove Plastic from Your Kitchen Today #cancerawareness #facts #shorts #viralvideo,Vr6YUop4msA,Dr. Vikas Goswami - Oncologist,2025-02-20T14:26:41Z,https://www.youtube.com/watch?v=Vr6YUop4msA,,44,617,35,0
CANCER? | Immunotherapy | Cancer Healer Center | #cancerawareness,HPK60fDhq_c,Dr. Krishna's Cancer Healer Center,2025-02-20T13:21:06Z,https://www.youtube.com/watch?v=HPK60fDhq_c,"CANCER? hope and the right treatment can still make a difference! Immunotherapy[CAM] has helped patients heal, even in ...",59,3966,170,57
CARE Hospitals | Prostate Cancer Awareness | World Cancer Day 2025,yZsczkav51c,CARE Hospitals,2025-02-17T06:27:37Z,https://www.youtube.com/watch?v=yZsczkav51c,Health isn't just about today—it's about ensuring you are there for all the tomorrows. Prostate cancer is one of the most common ...,80,375385,146,0
Does Breast Cancer Always Cause Hair Loss? #cancerawareness #mythbusters #oncology #shorts #facts,C9ogqBzgQ5Y,Dr. Vikas Goswami - Oncologist,2025-02-13T16:32:38Z,https://www.youtube.com/watch?v=C9ogqBzgQ5Y,,27,1790,41,0
Cancer Awareness Blog Reel | Manipal Hospital Gurugram,Cj-HJnIl7jE,Manipal Hospitals,2025-02-12T10:27:30Z,https://www.youtube.com/watch?v=Cj-HJnIl7jE,"Detect Early, Prevent Cancer! Cancer can often be prevented or treated effectively if detected early. Be aware of the ...",40,4329,7,0
Care Starts With You | CARE Hospitals | Breast Cancer Awareness,F89E7jUJ7wg,CARE Hospitals,2025-02-09T14:00:12Z,https://www.youtube.com/watch?v=F89E7jUJ7wg,"Mothers spend their lives caring for everyone around them—but sometimes, they forget to care for themselves. Breast cancer can ...",77,407958,1072,0
"Cancer Awareness Walkathon   Basavatarakam Indo American Cancer Hospital, Hyderabad",v4Vn4uGZTjM,Basavatarakam Cancer Hospital,2025-02-08T06:06:30Z,https://www.youtube.com/watch?v=v4Vn4uGZTjM,"Cancer Awareness Walkathon Basavatarakam Indo American Cancer Hospital, Hyderabad For Latest Updates !! ☛ Visit our ...",31,1239,45,0
Crystal Chappell surprises Michelle Ray Smith during her Breast Cancer Awareness month appearance.,l29MjVsb4XM,The Locher Room,2025-02-07T11:45:05Z,https://www.youtube.com/watch?v=l29MjVsb4XM,Subscribe to The Locher Room: https://bit.ly/TheLocherRoom #crystalchappell #oliviaspencer #avaperalta #breastcancer ...,60,780,29,0
Cancer Awareness | Manipal Hospital Delhi,tC3_A6iH_lk,Manipal Hospitals,2025-02-06T08:10:08Z,https://www.youtube.com/watch?v=tC3_A6iH_lk,"We took to the streets to ask people some important questions about cancer, and the responses were eye-opening! Awareness is ...",59,3529,6,0
"OTV Kicks Off Mini Marathon For Cancer Awareness, MD Jagi Mangat Panda Leads The Trail",WUAkJNZseKw,OTV News English,2025-02-04T03:21:23Z,https://www.youtube.com/watch?v=WUAkJNZseKw,"OTV Kicks Off Mini Marathon For Cancer Awareness, MD Jagi Mangat Panda Leads The Trail #minimarathon #worldcancerday ...",24,459,6,0
SPARSH Hospital - Yeswanthpur | Cancer Awareness | Dr. Anil Kumar N | Preventive Measures,QMtCGf_904A,SPARSH Hospital,2025-02-03T05:08:31Z,https://www.youtube.com/watch?v=QMtCGf_904A,"Cancer Awareness with Dr. Anil Kumar N Join Dr. Anil Kumar N, Senior Consultant in Medical Oncology & Hematology at ...",79,88,2,0
A Lifeline for Families Fighting Childhood Cancer #crime #cancerawareness #documentary,dZTWcryKXN4,True Lives,2025-02-01T14:15:03Z,https://www.youtube.com/watch?v=dZTWcryKXN4,WATCH THE FULL VIDEO HERE: https://youtu.be/B6RQKnUIt7o Dive into three powerful stories that touch on the resilience of ...,59,3759,122,1
World Cancer Day Drawing | World Cancer Day Poster | Cancer Awareness Drawing | Cancer Day Poster,Z3bRqKGAFPA,Crafts A2Z,2025-01-31T15:57:53Z,https://www.youtube.com/watch?v=Z3bRqKGAFPA,,59,6484,162,5
World Cancer Day Drawing | World Cancer Day Poster | Cancer Awareness Drawing | Cancer Day Drawing,V6iqY1Sh88M,Easy Drawings By Crafts A2Z,2025-01-30T10:14:02Z,https://www.youtube.com/watch?v=V6iqY1Sh88M,,59,5865,107,3
Hailee Steinfeld's Powerful Breast Cancer Awareness Ad for Super Bowl 59 । USA TODAY NEWS,xfAxL-TV8KY,USA TODAY NEWS,2025-01-28T16:35:17Z,https://www.youtube.com/watch?v=xfAxL-TV8KY,Hailee Steinfeld is taking a bold step in raising awareness for breast cancer with a powerful new campaign in partnership with ...,142,14115,20,5
Firefighter Cancer Awareness,3-xUHefxEYs,Indiana Homeland Security,2025-01-28T16:34:51Z,https://www.youtube.com/watch?v=3-xUHefxEYs,Indiana State Fire Marshal Steve Jones emphasizes the importance of cancer awareness among firefighters.,197,5084,90,24
"This Cervical Cancer Awareness Month, consult your Pediatrician for the HPV vaccine #MSD #HPV",jvw_7IgF3D4,MSD India,2025-01-28T12:24:30Z,https://www.youtube.com/watch?v=jvw_7IgF3D4,"As parents, every little step you take is to protect her. From the moment she takes her first breath to preparing her for life's ...",61,2710130,25,0
Kaiser Permanente doctor discusses importance of cervical cancer awareness month,hEcodZrAcj8,KCAL News,2025-01-27T18:34:31Z,https://www.youtube.com/watch?v=hEcodZrAcj8,January is cervical cancer awareness month. The American Cancer Society reports that about 13000 women are diagnosed with ...,238,1079,7,0
Cervical Cancer Awareness | Dr. Anandita | MHP,tBnIWMWUsmE,Manipal Hospitals,2025-01-17T13:21:02Z,https://www.youtube.com/watch?v=tBnIWMWUsmE,Dr. Anandita highlights the importance of cervical cancer prevention through the HPV vaccine and early screening. Get informed ...,49,3630,7,0
"January, Cervical Cancer Awareness Month",jwg6yTYOwq8,Roche,2025-01-10T16:48:17Z,https://www.youtube.com/watch?v=jwg6yTYOwq8,Subscribe to our YouTube channel now: https://www.youtube.com/user/roche?su... Get in touch with us: https://www.roche.com/ ...,26,899,16,0
IARC marks Cervical Cancer Awareness Month 2025,hpQsa2rmWKw,IARC WHO,2025-01-10T14:14:21Z,https://www.youtube.com/watch?v=hpQsa2rmWKw,The International Agency for Research on Cancer (IARC) is marking Cervical Cancer Awareness Month by showcasing some of ...,18,690,3,0
Cervical Cancer Awareness | Manipal Hospital Delhi,CyP5fsrHkdk,Manipal Hospitals,2025-01-09T12:48:25Z,https://www.youtube.com/watch?v=CyP5fsrHkdk,"January is Cervical Cancer Awareness Month Cervical cancer is the most common gynaecological cancer in women, affecting ...",37,3633,8,0
Cervical Cancer Awareness | Prevention & Treatment,354YF2QrEz0,Narayana Health,2025-01-09T04:30:01Z,https://www.youtube.com/watch?v=354YF2QrEz0,"January marks World Cervical Cancer Awareness Month, a crucial time to spread awareness about one of the most common ...",57,533,10,0
Rotary starts campaign to raise cancer awareness,MGw2Fzbaz3M,NTVUganda,2025-01-08T18:49:37Z,https://www.youtube.com/watch?v=MGw2Fzbaz3M,"This year's Rotary Cancer Run will span two days, scheduled for the last weekend of August 2025. The event will kick off on ...",110,213,4,0
BIG WAVE A320-214 CONDOR AIRLINES(Breast Cancer Awareness Livery) take off at Madeira Aiport,uJ4ufjImU-Y,Madeira Aviation Spotting,2025-03-29T22:54:19Z,https://www.youtube.com/watch?v=uJ4ufjImU-Y,https://www.youtube.com/@madeira_aviation_spotting?sub_confirmation=1 BIG WAVE A320-214 CONDOR AIRLINES(Breast ...,185,162,9,0
Check out the Cancer rates for Oregon!#kickincancer #cancerawareness #cancer #oregon #pnw #subscribe,epMv29YHuS4,Kickin' Cancer Productions,2025-03-29T03:31:03Z,https://www.youtube.com/watch?v=epMv29YHuS4,Join us as we reflect on the last 5 years of Kicking Cancer and our journey to educate and inspire! Our mission has always been ...,45,616,5,1
Colorectal cancer awareness month,pnCvbrIncuI,WSPA 7News,2025-03-27T10:37:16Z,https://www.youtube.com/watch?v=pnCvbrIncuI,Colorectal cancer awareness month.,169,55,2,0
Colon cancer awareness month highlights importance of health screenings,sWCt-Uo7kC4,WIFR TV,2025-03-27T01:34:07Z,https://www.youtube.com/watch?v=sWCt-Uo7kC4,Colon cancer awareness month highlights importance of health screenings For more Local News from WIFR: ...,52,47,1,1
March is Colorectal Cancer Awareness Month,ttGkNw6M9Lo,CBS Miami,2025-03-26T12:09:26Z,https://www.youtube.com/watch?v=ttGkNw6M9Lo,"Dr. Joseph Corallo, a surgeon at HCA Westside in Plantation, said there is concern because more younger adults are being ...",198,168,0,0
Cancer Awareness,oGlr4Hty6t8,Timothy Flynn Ministries,2025-03-24T23:43:40Z,https://www.youtube.com/watch?v=oGlr4Hty6t8,,194,7,2,1
Colorectal Cancer Awareness with QMG Gastroenterologist Dr. Adam Niemann,NzMvbGTc2FQ,Quincy Medical Group,2025-03-24T17:13:44Z,https://www.youtube.com/watch?v=NzMvbGTc2FQ,,36,130,4,0
Prom queen #gacha #beachbunny #brat #2018 #glmm #cancerawareness #antizoo,NzhVp8qJ5qA,★Sapphire Stonez☆ (Quit),2025-03-18T22:05:28Z,https://www.youtube.com/watch?v=NzhVp8qJ5qA,,,,,
Cancer awareness vid/vent. #cancerawareness #cancer #awareness #ventig #repost,K8IeYCVY-K4,★Sapphire Stonez☆ (Quit),2025-03-17T08:12:54Z,https://www.youtube.com/watch?v=K8IeYCVY-K4,,,,,
"Breast Cancer Survivor Story | A Journey of Strength, Hope & Awareness | Niramayaoncology",0mWeAiO9TPw,Niramaya Oncology ,2025-03-10T12:30:01Z,https://www.youtube.com/watch?v=0mWeAiO9TPw,She is a breast cancer survivor who faced challenges with courage and emerged stronger than ever. Her story is a powerful ...,56,65,0,0
Cervical Cancer Awareness: Insights by Dr. Halah Younus | Specialist in Obstetrics & Gynecology,PP0TE0kKUMY,Fakeeh University Hospital,2025-01-03T04:38:38Z,https://www.youtube.com/watch?v=PP0TE0kKUMY,"Halah Younus, Specialist in Obstetrics & Gynecology at Fakeeh University Hospital, shares essential insights on Cervical Cancer ...",122,5877,0,0
I would give anything to have you back #cancer #fcancer #happymoments #cancerawareness #coloncancer,w2lbxkWWivg,Deehealthylife180,2025-02-11T19:02:23Z,https://www.youtube.com/watch?v=w2lbxkWWivg,,18,149833,15309,570
cancer awareness video #gacha #gachatrend #tweening #gachalife #gachaclub #shorts #kowkii,EAqf8pG8Pmw,kowkii⭐️,2025-02-15T15:06:47Z,https://www.youtube.com/watch?v=EAqf8pG8Pmw,,91,201921,26788,491
🙄🙄#cancer #lungcancer #lungcancerawareness #cancersurvivor #oncology #cancerawareness,BNF2yN9F6c0,The One Lung Lounge,2025-02-01T23:32:51Z,https://www.youtube.com/watch?v=BNF2yN9F6c0,,6,31614,317,10
Cervical Cancer Awareness program by Gullab Seva🌸,FbK5JyT-ABE,Aisshwarya DKS Hegde,2025-01-10T07:41:15Z,https://www.youtube.com/watch?v=FbK5JyT-ABE,,56,16528,0,3
!!️NON STICK PAN CAUSE CANCER 😱!!️ #tamilhealthtips #nonstickpan #cancer #awareness,tFDdwi4ZKCk,Arvind D,2025-03-12T09:30:30Z,https://www.youtube.com/watch?v=tFDdwi4ZKCk,,55,14575,738,14
Cancer Awareness Tips #cancer #cancersurvivor #cancerawareness #tumour,tu5Lf--rDTQ,Dr.Dushyant Chouhan BONE & JOINTs Surgeon,2025-02-23T02:50:28Z,https://www.youtube.com/watch?v=tu5Lf--rDTQ,,58,19471,266,3
Rodney Taylor: Bringing Lung Cancer Awareness to the Barbershop,8T6Z1R0KxYQ,Lung Cancer Foundation of America,2025-03-02T16:00:16Z,https://www.youtube.com/watch?v=8T6Z1R0KxYQ,,35,11937,409,2
Prevention of cancer is my primary passion! #cancer #cancerprevention #cancerawareness,flFjnMYVRIQ,Simplify Cancer,2025-01-15T07:38:59Z,https://www.youtube.com/watch?v=flFjnMYVRIQ,"Meet Dr. Raghu Vamsi, a highly skilled Surgical Oncologist at Omega Hospital Visakhapatnam, whose passion extends beyond ...",58,8593,536,23
Today SKIE classes Hosted a  One Day Cancer Awareness programme on World Cancer Day #safe,X5uDQvlf-No,SKIE Classes,2025-02-04T16:39:22Z,https://www.youtube.com/watch?v=X5uDQvlf-No,Today SKIE classes Hosted a One Day Cancer Awareness programme on World Cancer Day . Programme was organised by ...,55,6620,223,5
