Title,Video ID,Channel,Published At,URL,Description,Video Length
Deepika Padukone's Secret Glow Juice | Recipe Revealed By Celebrity Nutritionist Shweta Shah,URC86xCZlUk,Sushmita's Diaries,2025-01-13T10:04:55Z,https://www.youtube.com/watch?v=URC86xCZlUk,Deepika Padukone's Secret Glow Juice | Recipe Revealed By Celebrity Nutritionist Shweta Shah topic covered : Deepika ...,
The Secret Juice Every Woman Needs!,HfiuVGb6urY,Satvic Movement,2025-01-18T13:00:20Z,https://www.youtube.com/watch?v=HfiuVGb6urY,"Share this with all the women you know who deserve to feel their best.   From mood swings to hormonal imbalances, so many ...",
Best early morning detox water #shorts,y-rO9QRkkaM,Indian ASMR Gallery,2025-02-09T12:30:53Z,https://www.youtube.com/watch?v=y-rO9QRkkaM,"Detox Water Recipe: Cucumber, Lemon, Pudina Leaf, and Ginger (Overnight Soak) Glass Jar I have used ...",
ABC Juice: The Ultimate Detox Drink Boost Your Health #ABCJuice #DetoxDrink #WeightLoss #JuiceRecipe,wtKPwAPrS5g,Eat & Repeat,2025-01-24T08:30:31Z,https://www.youtube.com/watch?v=wtKPwAPrS5g,ABC Juice Recipe for Detox and Weight Loss ABC Juice: The Ultimate Detox Drink Boost Your Health #ABCJuice #DetoxDrink ...,
Why I drink green juice everyday? #health #weightloss #juice,I0nj50tR0CA,Good Living Now with Harold,2025-01-09T12:38:10Z,https://www.youtube.com/watch?v=I0nj50tR0CA,"Why I drink green juice everyday? Day 7...10 Day Green Juice Weight Loss Challenge. Juice ingredients: cucumber, spinach, ...",
Drink This Daily to Flush Toxins,KiR7KuSwveE,Satvic Movement,2025-03-31T13:00:20Z,https://www.youtube.com/watch?v=KiR7KuSwveE,"Drinking this juice is one of the most powerful ways to give your system a cleanse every morning, but if you're ready to take it to ...",
Parasite Cleaning Fruit #papaya #fruit #health,kQjkBuikJ5Y,Good Living Now with Harold,2025-01-15T16:28:03Z,https://www.youtube.com/watch?v=kQjkBuikJ5Y,,
Best detoxing Ash Gourd Juice #telusamanasaa #sisters #telugu #movie #songs #saree #detox #health x,YcAPyTmPteU,telusa manasaa,2025-02-04T01:28:31Z,https://www.youtube.com/watch?v=YcAPyTmPteU,,
*SIMPLE* DETOX water at HOME✨🏠 #youtube #yt #ashortaday #ytshortsindia #detox #selfcare #viralvideo,UIKYVdx-3Jw,Akancha Sharma,2025-01-17T12:24:00Z,https://www.youtube.com/watch?v=UIKYVdx-3Jw,"Detox Like a Pro with This Cucumber, Amla, and Lemon Water Recipe! Hey, hydration queens and health champs!",
Ithu Ungalukku Theriuma #juicecleanse #healthtechnology #technology #tamiltech #adhavanaj,BUPj-Xi0sg0,Adhavan Aj,2025-02-04T11:44:32Z,https://www.youtube.com/watch?v=BUPj-Xi0sg0,,
2 Powerhouse Cold Press Juices for Weight Loss,azl1n7Jrv_s,That Savage Kitchen,2025-01-15T19:00:02Z,https://www.youtube.com/watch?v=azl1n7Jrv_s,"ThatSavageKid Don't forget to Subscribe, enable notifications, and give this video a thumbs up! I Would Really Appreciate it If Yall ...",
Detox & Glow with This Green Juice! ✨,JSw2JVtcm34,Brandon Ahmaud,2025-01-20T20:59:19Z,https://www.youtube.com/watch?v=JSw2JVtcm34,Ingredients You'll Need: -1 Bunch of Dandelion Greens -1 Green Apple -1 Cucumber -1 Jicama -1 Key Lime -1 Thumb of Ginger ...,
Iron boost beet juice  100 days of wellness Eps 2  #juicing  #recipe #juice #drinkrecipes #lowiron,9D4Y4o5X2E4,Ronica,2025-01-28T23:29:23Z,https://www.youtube.com/watch?v=9D4Y4o5X2E4,Iron-Boosting Beet Juice This Iron-Boosting Beet Juice is the ultimate energy boost. Beets bring the natural nitrates to boost blood ...,
Amla detox water juice & Amla benefits #shorts #amla #gooseberry,FwbKBrX8y9s,Monika's Kitchen 21,2025-03-09T08:40:06Z,https://www.youtube.com/watch?v=FwbKBrX8y9s,Amla detox water juice & Amla benefits #shorts #amla #gooseberry #amla #gooseberry #shortvideo #amazing #amlajuicebenefits ...,
Kickstart your mornings with this Detox Drink for Weight Loss #weightloss #determination,4toC6q7L8Nc,Juicing Tutorials,2025-01-06T14:38:47Z,https://www.youtube.com/watch?v=4toC6q7L8Nc,Kickstart your mornings with this Detox Juice for Weight Loss —your new best friend for crushing those New Year's goals!,
Why I drink green juice everyday? #health #recipe #green #juice,TnxtLQGIGK8,Good Living Now with Harold,2025-03-04T00:40:57Z,https://www.youtube.com/watch?v=TnxtLQGIGK8,,
3 Delicious Juice Remedies #health #remedies #recipe #wellness,Qd0d8buCCfY,Good Living Now with Harold,2025-02-11T01:17:17Z,https://www.youtube.com/watch?v=Qd0d8buCCfY,,
Delicious Gut Healing Juice #healing #healthy #fruit,36D-pfzJkmQ,Good Living Now with Harold,2025-03-13T01:03:33Z,https://www.youtube.com/watch?v=36D-pfzJkmQ,,
Morning Routine | 10 Day Green Juice Weight Loss Challenge #weightloss #health #juice,RYOSMFCHitc,Good Living Now with Harold,2025-01-03T12:27:19Z,https://www.youtube.com/watch?v=RYOSMFCHitc,,
🍏 Heart Healthy Juice Recipe | Kuvings AUTO10 Plus @thegoodlivingnow,iEIXobS5sdo,Kuvings USA,2025-01-20T13:30:24Z,https://www.youtube.com/watch?v=iEIXobS5sdo,"thegoodlivingnow Shop AUTO10 Plus Juicer, linked in channel bio #beetroot #beets #beetjuice #carrot #carrotjuice ...",
నేను first time try చేసిన Celery Juice#viral#trending#celeryjuice#celery#shorts#telugu#food#fyp#yt,XUWYAIg5eGM,Sree's palate,2025-01-29T13:09:00Z,https://www.youtube.com/watch?v=XUWYAIg5eGM,నేను first time try చేసిన Celery Juice#viral#trending#celeryjuice#celery#shorts#telugu#food#fyp#yt ...,
Skunks And Gail’s Juice Cleanse #shorts #viral,YSawgR4SuTE,Clip Station,2025-01-07T04:16:42Z,https://www.youtube.com/watch?v=YSawgR4SuTE,"shorts #viral #comedy #canada #funny #shortsviral #shortsfeed Gail is on a juice cleanse & has a skunk problem... Like, comment ...",
ఈ Red detox Juice అదిరిపోయింది#viral#trending#food#detoxjuice#shorts#healthy#ytshorts#fyp#redjuice,OVGUHzvsysA,Sree's palate,2025-02-20T13:00:36Z,https://www.youtube.com/watch?v=OVGUHzvsysA,ఈ Red detox Juice అదిరిపోయింది#viral#trending#food#detoxjuice#shorts#healthy#ytshorts#fyp#redjuice ...,
Sadhguru Ash Gourd Juice Recipe| Detox Your Guts With Most Satvic Food On Earth,0e3tWdeZbNA,Sushmita's Diaries,2025-01-25T15:31:18Z,https://www.youtube.com/watch?v=0e3tWdeZbNA,"Sadhguru Ash Gourd Juice Recipe| Detox Your Guts With Most Satvic Food On Earth topic covered : ash gourd juice,safed pethe ...",
10 Day Green Juice Weight Loss Challenge (Springtime) #spring #weightloss #health,azbVnWZZq0o,Good Living Now with Harold,2025-03-10T14:08:18Z,https://www.youtube.com/watch?v=azbVnWZZq0o,,
Wheatgrass Wellness Shots #health #healing #juice,8bwPqQgGKq4,Good Living Now with Harold,2025-01-17T01:15:54Z,https://www.youtube.com/watch?v=8bwPqQgGKq4,,
Detox water for Glowing skin and Weight loss #shorts #ytshorts #detoxjuice #iamdkflavors #detox,MfvgztPiCL0,Deepak Zen Life,2025-02-01T12:55:40Z,https://www.youtube.com/watch?v=MfvgztPiCL0,Detox water for Glowing skin and Weight loss You can consume it for 3-4 days for best results❤️ Ingredients: Water: 1 ...,
"burns fat-1 , Cucumber, Green Apple & Kiwi Detox Juice!  #detox  #drink",7tVDDtj0Fb8,JUICIST,2025-02-26T17:00:18Z,https://www.youtube.com/watch?v=7tVDDtj0Fb8,"""Today, I'm sharing a super easy and refreshing detox drink made with just three ingredients: cucumber, green apple, and kiwi!",
24 HOUR JUICE CLEANSE,YnjY3-FnOF4,charlize chiu,2025-02-03T17:22:11Z,https://www.youtube.com/watch?v=YnjY3-FnOF4,,
1 juice for glowing skin|coconut milk+ carrot juice#glowingskin#koreanskin#skincare#juice#shorts#yt,k9d6aUj6HiA,Sayan's Scribbling Diaries,2025-03-23T10:42:25Z,https://www.youtube.com/watch?v=k9d6aUj6HiA,"carrot juice,coconut milk juice,carrot coconut milk juice,how to make carrot juice,carrot juice for glowing skin,carrot ginger juice ...",
Day 2 of Juice Cleanse | Epic Juice Recipe #detox #juicerecipe #antiinflammatory,mn6JQK2lVxs,Splash of Goodness,2025-01-14T05:00:44Z,https://www.youtube.com/watch?v=mn6JQK2lVxs,"Day 2 of my juice cleanse! I had to share this EPIC juice I just whipped up—pineapple , carrot , orange , and ginger Its ...",
Cold pressed Watermelon juice | Nama J2 #onestopchop,M6Mtiy0GXno,OneStopChop,2025-03-03T20:03:01Z,https://www.youtube.com/watch?v=M6Mtiy0GXno,,
Fresh fruit juice recipe ||Healthy mix juice #trending #viralshort  #shorts#drink#detoxdrink #easy,vMbW0nsSuXw,Yasmeennaaz recipe's ,2025-03-14T11:20:27Z,https://www.youtube.com/watch?v=vMbW0nsSuXw,Fresh fruit juice recipe ||Healthy mix juice #trending #viralshort #shorts#drink#detoxdrink #easy don't forget subscribe this ...,
How To Make Juice Using a Blender 🩷🌱 #juicing #fruits #vegetables #juicecleanse #danielfast #vegan,VkeSbo7usmc,Therealsiyah,2025-01-20T23:07:08Z,https://www.youtube.com/watch?v=VkeSbo7usmc,juicing #juicingrecipes #juicingforweightloss #juicecleanse #healthyeating #healthyrecipes #whatiateinaday #cleaneating ...,
day 5: from water fast to juice cleanse,4bSBqi8EhL8,Brandon Ahmaud,2025-03-31T12:00:06Z,https://www.youtube.com/watch?v=4bSBqi8EhL8,Juice Recipe Here's what I used: -1 1/4 pound of burdock -1 fennel bulb (floral sprouts removed) -4 red cosmic apples -1 key lime ...,
The juice that’s been growing my hair and clearing my skin 10/10 highly recommend 🫶🏾,DQtFI8otfSU,Daizha Da'zhon,2025-01-19T14:55:17Z,https://www.youtube.com/watch?v=DQtFI8otfSU,,
#DetoxJuice#SmoothieRecipes#HealthyDrinks#JuiceCleanse#FreshJuices#JuicingForHealth#HomemadeJuice,r5twQFe132Q,skammyjuice,2025-02-26T22:33:13Z,https://www.youtube.com/watch?v=r5twQFe132Q,"Welcome to Skyummyjuice! Your ultimate destination for refreshing, delicious, and healthy drink creations. From energizing ...",
Fresh Homemade Orange Juice #juicing #immuneboost #detox,fCHng8xU4ew,Splash of Goodness,2025-01-30T15:58:07Z,https://www.youtube.com/watch?v=fCHng8xU4ew,Nothing beats fresh homemade Orange Juice! Do you agree? Follow @splashofgoodness for more healthy ideas.,
Antioxidant Juice That Hits DIFFERENT! 🍊🥭🔥,s5QvPM150-E,Brandon Ahmaud,2025-03-08T13:01:23Z,https://www.youtube.com/watch?v=s5QvPM150-E,,
Day 1 of My 5 Day Juice Cleanse | 4 Juice Recipes #juicing #detox #immuneboost,7aNYggWGfW0,Splash of Goodness,2025-01-13T16:00:07Z,https://www.youtube.com/watch?v=7aNYggWGfW0,"Day 1 of my 5-day juice fast is here, and I'm sharing four of my favorite juices! Tag a friend and follow @splashofgoodness for ...",
"Want to try super healthy juice? Amla Juice for weight loss, detox, skin & hair",ug-RYGPJZZ8,Rana Rao Vlog,2025-01-23T03:22:51Z,https://www.youtube.com/watch?v=ug-RYGPJZZ8,,
Sip Your Greens to a Better Health! Green Detox Juice #juicing #immuneboost #detox,WEZkOV8p3Vo,Splash of Goodness,2025-02-18T17:51:27Z,https://www.youtube.com/watch?v=WEZkOV8p3Vo,"Sip Your Greens, Boost Your Health! If you're not eating enough greens daily, drink them! This powerhouse green juice is ...",
ABC Juice: My Go To for a Healthy Juice Cleanse! #juicing #detox #immuneboost,qzW_TPXyAv4,Splash of Goodness,2025-01-16T14:31:17Z,https://www.youtube.com/watch?v=qzW_TPXyAv4,"Day 4 of my juice cleanse, and I'm loving it! One of my favorites is ABC Juice—Apple, Beet, and Carrot. Follow ...",
I consume this kale juice IN MODERATION for an iron boost 🌱✨ #iron,TkmUNTEBLug,Halos Kitchen ,2025-02-21T15:41:07Z,https://www.youtube.com/watch?v=TkmUNTEBLug,,
Ketogenic diet or juice cleanse (what is better for weight loss)😮 #weigthloss #keto #calories #diet,wZHvwduJzBc,Jonathan Clarke,2025-01-02T16:00:57Z,https://www.youtube.com/watch?v=wZHvwduJzBc,,
I need a juice cleanse #shorts,1RiAVZh8E8s,You are what you eat!,2025-01-15T20:43:17Z,https://www.youtube.com/watch?v=1RiAVZh8E8s,,
Reset Your Body in 5 Days! Juice cleanse #juicecleanse #detox #juicing,oYX8eyKYnHo,Splash of Goodness,2025-01-10T18:20:45Z,https://www.youtube.com/watch?v=oYX8eyKYnHo,I'm kicking off the New Year with a 5-day juice cleanse starting January 13th to the 17th to reset my body and flood it with nutrients ...,
Epic Combo Juice! Must try! #juicing #immuneboost #juicerecipe,RT4GE3_Pzek,Splash of Goodness,2025-01-18T14:00:33Z,https://www.youtube.com/watch?v=RT4GE3_Pzek,"Epic Carrot Orange Lemon juice is great for eyes, heart and brain. It's a must try combo. Follow @splashofgoodness for more ...",
Juice Recipe You Will Love! Last Day of my 5 Day Juice Detox #juicing #detox #immuneboost,8UhhcTWklRg,Splash of Goodness,2025-01-17T15:44:06Z,https://www.youtube.com/watch?v=8UhhcTWklRg,Final Day of My 5-Day Juice Cleanse! Wrapping it up with one of my all time favorites: a refreshing Pineapple Orange Mint ...,
How to make immune boosting juice 🍊🫚✨ #juicingtutorials #juicingrecipes #juicecleanse,g0eti_byotE,Maryam Owens,2025-01-09T03:30:01Z,https://www.youtube.com/watch?v=g0eti_byotE,,
Unbelievable! This Watermelon Juice is a GAME CHANGER! #detox #juicecleanse #juicing #fruit #shorts,EbGXHtrYMaI,Nicole Ojo,2025-01-29T21:31:06Z,https://www.youtube.com/watch?v=EbGXHtrYMaI,,
Natural Gut Friendly Green Juice #Cleanse #Homemade #DetoxJuice,vHCo3Lx4-Oc,Balanced Inside and Out,2025-02-25T11:01:20Z,https://www.youtube.com/watch?v=vHCo3Lx4-Oc,"Looking for a refreshing and healthy juice combo? This pear, cucumber, lemon, and mint blend is packed with hydration and ...",
How To Make Juice Using A Blender🌱#juicecleanse #juicing #detox #detoxjuice #guthealth #healthyfood,dCj8Z_BKeFE,Therealsiyah,2025-01-23T13:15:38Z,https://www.youtube.com/watch?v=dCj8Z_BKeFE,,
My 24 Hour Juice Cleanse Journey,eaNRUNwNVA8,Brandon Ahmaud,2025-01-01T14:00:36Z,https://www.youtube.com/watch?v=eaNRUNwNVA8,,
Day 3 Juice Cleanse: Green Powder Juice Recipe & Benefits! #juicecleanse #juicing #detoxjuice,8kUF928V0NI,Splash of Goodness,2025-01-15T16:33:26Z,https://www.youtube.com/watch?v=8kUF928V0NI,"Day 3 of my juice cleanse! Starting my day with this Green Power Juice has been incredible! It's packed with detoxifying, ...",
Juice Fasting Before Vacation: My 24-Hour Reset,XtmI3To97VM,Brandon Ahmaud,2025-01-11T13:28:27Z,https://www.youtube.com/watch?v=XtmI3To97VM,,
Detox your body naturally with this simple green juice,adpIY1GmsHk,iamvanessae,2025-01-20T14:00:02Z,https://www.youtube.com/watch?v=adpIY1GmsHk,Healthy green juice recipe for detoxing #shorts #detox #juicer #juice Hurom H400 Juicer: huromamerica.sjv.io/k0m6P3.,
"How to get rid of acne, dark spywith juicing #juicing #detox #skincare #juicingbenefits",Od90L7B6kss,misscuddy,2025-02-02T22:00:19Z,https://www.youtube.com/watch?v=Od90L7B6kss,,
LIVER CLEANSE | Juice for Clear Skin & Detox ✨ #juicing #skincare #wellness #healthyrecipes,KeNJGlIJ8Is,Bites by Ash,2025-02-27T19:18:37Z,https://www.youtube.com/watch?v=KeNJGlIJ8Is,This is a Liver cleansing juice that helps to remove toxins and flush fat! Drink it every day for 7 days for best results! Oranges: -high ...,
Refresh & Rejuvenate with This Fennel Pineapple Refresher! 💚🍍,f0wTpSlQwCA,JuiceNext,2025-03-12T11:22:12Z,https://www.youtube.com/watch?v=f0wTpSlQwCA,"Refresh & Rejuvenate with This Fennel Pineapple Refresher! Give your body a hydrating boost with this crisp blend of fennel, ...",
Detox Juice 🤩 #shorts #shortsfeed #guddikirecipe #detox #healthy #juice #beetroot  #carrot #amla,P1ZaHEsq2vo,Guddi ki Recipe ,2025-03-08T06:51:16Z,https://www.youtube.com/watch?v=P1ZaHEsq2vo,Detox Juice #shorts #shortsfeed #guddikirecipe #detox #healthy #juice #beetroot #carrot #amla Related Tags :- Guddi ki ...,
Green juice cleanse🧃🥲 #pizza #food #asmr #mukbang,GVQs0KcpTCk,Pizz of Art,2025-03-08T20:21:42Z,https://www.youtube.com/watch?v=GVQs0KcpTCk,,
Juicing to heal the body! #juicingforweightloss #juicedetox #guthealth #juicecleanse #viralshorts,4G5OQd0HDIc,DineWithKay,2025-02-18T18:54:30Z,https://www.youtube.com/watch?v=4G5OQd0HDIc,,
Gut HeaLTH Detox Hack! Ash Gourd Safed Petha Juice = Cleanse + Glow #DetoxYourBody #short,mfyTNoXjSI4,Shubhangi's Kitchen Diaries,2025-03-09T12:45:05Z,https://www.youtube.com/watch?v=mfyTNoXjSI4,Discover the Ultimate Gut Health Detox Hack with our incredible Ash Gourd Safed Petha Juice! Are you ready to cleanse your ...,
The Most Powerful Liver Cleansing Juice You Need To Try,2FtfjtuuxQg,Splash of Goodness,2025-02-13T17:00:03Z,https://www.youtube.com/watch?v=2FtfjtuuxQg,Nama J2 Juicer. Save $55 using my code EVA10 at checkout. https://namawell.com/discount/EVA10?ref=splashofgoodness The ...,
First day of my juice cleanse,ITzoB-Dg0I4,Karlye Taylor,2025-03-15T04:23:12Z,https://www.youtube.com/watch?v=ITzoB-Dg0I4,,
❤️ The best juice for cardiovascular (heart) health! 🌱🍏🥕,h1oSrsGmLdM,Darrell Palmes,2025-02-20T15:04:57Z,https://www.youtube.com/watch?v=h1oSrsGmLdM,"Heart disease be gone! . With a vibrant blend of apples, carrots, ginger, and beets, this drink is packed with nutrients that the body ...",
Flat tummy detox juice 💚 full recipe is in the description,AUlEUFQ9guE,Simone Kiana,2025-02-25T22:10:18Z,https://www.youtube.com/watch?v=AUlEUFQ9guE,"Get $$ off my juicer! Coupon code     Flat tummy detox juice recipe: (Makes around 38oz, feel free to half this recipe for a smaller ...",
Unlock Flawless Skin: The Secret Juice Remedy for Every Skin Type!,MHbA1PCrb5k,Elemental Glow,2025-01-28T19:11:54Z,https://www.youtube.com/watch?v=MHbA1PCrb5k,"Unlock Flawless Skin: The Secret Juice Remedy for Every Skin Type! Struggling with skin issues? From oily skin to fine lines, ...",
Juice that promotes hair growth. 💚,W2mf86Fh41E,Alisha Richard,2025-02-23T23:31:49Z,https://www.youtube.com/watch?v=W2mf86Fh41E,"This easy juice recipe promotes hair growth. Happy juicing, ladies.",
Juice cleanse #juice #wedrink #drinks #juicewrld #shake #banana #orange #orangejuice #carrot #fruit,cmXI6QWKX68,Cooking with Gulshan,2025-02-06T08:56:02Z,https://www.youtube.com/watch?v=cmXI6QWKX68,,
Juice cleanse journey begins after years of waiting #health,pUxSj4xQhnI,范小,2025-03-30T10:35:01Z,https://www.youtube.com/watch?v=pUxSj4xQhnI,Embarking on a juice cleanse journey after jaw surgery recovery #juicecleanse #fok.,
Unboxing my juicer for my cleanse! DAY 7  #juicecleanse #namajuicer #healthyfood #rawfooddiet,Eq-mTT3ID2k,The Raw Food Glow,2025-01-08T20:10:05Z,https://www.youtube.com/watch?v=Eq-mTT3ID2k,,
Your Juice Cleanse Detox Is A Lie—Here's Why!,0PVnFI0z9Rc,Gundry MD,2025-03-19T16:00:01Z,https://www.youtube.com/watch?v=0PVnFI0z9Rc,Your Juice Cleanse Detox Is A Lie—Here's Why! #GundryMD #GutHealth #guthealthtips #detox #detoxjuice #detoxjuices ...,
Refresh & Rejuvenate with This Fennel Green Juice! 💚🥒,J5a5rMO51PU,JuiceNext,2025-01-30T10:58:43Z,https://www.youtube.com/watch?v=J5a5rMO51PU,"Refresh & Rejuvenate with This Fennel Green Juice! Give your body a boost with this crisp, hydrating blend of fennel, Granny ...",
Delicious Green Juice Recipe #greenjuicerecipe#greenjuice#detox#juicing#cleanse#healthyfood,6Z5CPTTrOlw,Mayra Ibarra,2025-02-05T19:38:43Z,https://www.youtube.com/watch?v=6Z5CPTTrOlw,,
Easy Juice Cleanse: Apple & Carrot Shake! #detox #healthy #easy #recipe #asmr #drink #fresh #diet,iYl93uemlOA,WhenInManila,2025-03-18T06:38:04Z,https://www.youtube.com/watch?v=iYl93uemlOA,,
Ramzan 🌛 Special healthy juice 🥤#bayan #energydrink #shortsfeed #naturalremedies #shortsviral #viral,t75ivkyNKHg,Rubina ka Kitchen01,2025-02-24T05:00:40Z,https://www.youtube.com/watch?v=t75ivkyNKHg,OoRamzan Special healthy juice #bayan #energydrink #shortsfeed #naturalremedies #shortsviral #viral islamic quotes ...,
Juicing Secrets for Ultimate Detox & Energy | Barbara O'Neill,Laog95QpwJI,Holistic Health Optimal,2025-03-30T09:19:12Z,https://www.youtube.com/watch?v=Laog95QpwJI,barbaraoneill #naturalremedies #holistichealth.,
Day 1 of my 3 day juice cleanse🍒🤍 #shortsfeed,9Vsy2RYDOS0,Cecilys Natural,2025-02-09T02:51:54Z,https://www.youtube.com/watch?v=9Vsy2RYDOS0,,
Watch for recipe 🌱 drink up and feel the glow ✨ #juicecleanse #juicedetox #juicerecipe,W4gAWcHU2K8,Ashley G - Glo and Grow Lifestyle,2025-01-14T03:24:50Z,https://www.youtube.com/watch?v=W4gAWcHU2K8,,
Gut Detox Hack! Ash Gourd Safed Petha Juice = Cleanse + Glow #DetoxYourBody #HealthyLiving #short,SrJBYz1QD_0,khana khazana,2025-01-04T10:59:55Z,https://www.youtube.com/watch?v=SrJBYz1QD_0,Gut Detox Hack! Ash Gourd Safed Petha Juice = Cleanse + Glow #DetoxYourBody #HealthyLiving #short.,
DID I THINK A JUICE CLEANSE WAS A GOOD IDEA?#weightlossforwomen #realisticweightloss #weightloss,PKxp7urgDmc,Kols,2025-02-13T22:36:09Z,https://www.youtube.com/watch?v=PKxp7urgDmc,,
Glow from Within with This Morning Juice! ✨🥕,NY3_bESfWDI,JuiceNext,2025-01-31T11:00:41Z,https://www.youtube.com/watch?v=NY3_bESfWDI,Glow from Within with This Morning Juice! ✨   Start your day with the juice that dermatologists can't stop talking about!,
Carrot and Beetroot Mix Juice for Summer's 🥤🥤#shorts #juice #juicewrld #viralvideo #summer,e4ceWhqqplA,Reena Raj Mirzapuri,2025-03-05T14:06:14Z,https://www.youtube.com/watch?v=e4ceWhqqplA,"Carrot and Beetroot Mix Juice for Summer's #shorts #juice #juicewrld #viralvideo #summer carrot juice, beetroot juice, green ...",
Day 3 of my juice cleanse! I love this Nama juicer!!!! #ladytrucker #juicecleanse #juicefasting #cdl,o0HySIGD3Ho,Dekaily Davis,2025-01-27T21:06:09Z,https://www.youtube.com/watch?v=o0HySIGD3Ho,,
30 days juice cleanse to heal my body. #juicing #weightloss #HealingJourney #rawvegan,5A0s14JXgMc,Trina Shay,2025-02-18T07:13:02Z,https://www.youtube.com/watch?v=5A0s14JXgMc,,
Refreshing Healthy Juices for a Boost of Energy by smirti Irani  for breakfast and brunch!,wnNmjbrMBaI,The Rupam Kitchen,2025-02-16T12:44:42Z,https://www.youtube.com/watch?v=wnNmjbrMBaI,Refreshing Healthy Juices for a Boost of Energy by smirti Irani for breakfast. Looking for a quick and delicious way to energize ...,
Detox 7 day juice cleanse recipes  #detoxjuice #weightloss,btKfbIZ8bMM,LaLa •The High Vibe Coach • Energy,2025-03-02T12:00:23Z,https://www.youtube.com/watch?v=btKfbIZ8bMM,"JUICING FOR WEIGHT LOSS & DETOX! Want to burn fat, boost energy, and cleanse your body naturally? This juice recipe is ...",
healthy detox juice (part-1) |Dr.Karanam Parinithi #detoxjuice #turmeric #shortstelugu  #shorts,AACVzJZPQQ0,Diet and Slim by Pari,2025-01-26T04:24:59Z,https://www.youtube.com/watch?v=AACVzJZPQQ0,in this video Dr.Karanam Parinithi will be explaining about healthy detox drink made of amla turmeric and ginger #detoxjuice ...,
"Juice cleansing for weightloss, digestion, and gut health. #juicecleanse",asx3dGiFhYw,gabriella.gissellexo ,2025-01-09T23:14:17Z,https://www.youtube.com/watch?v=asx3dGiFhYw,,
Why Your Juice Cleanse May Not Be Working!,QHUgfmcPxXU,Whitney Peoples,2025-01-17T23:32:11Z,https://www.youtube.com/watch?v=QHUgfmcPxXU,Resource Page: https://stan.store/WhitneyPeoples RAW VEGAN 1.0 BUNDLE - THE ULTIMATE RAW VEGAN BUNDLE ...,
I did a 60 day juice cleanse... and this is what happened 😳🤯😩 #juicecleanse,BgoSOyEcpVU,Ms.FitVegan,2025-03-15T12:36:36Z,https://www.youtube.com/watch?v=BgoSOyEcpVU,,
Super delicious juice! Day 16/30 and I’m feeling great! 🌱 drink up and feel the glow ✨#juicecleanse,B4spU0GMoT8,Ashley G - Glo and Grow Lifestyle,2025-01-15T04:01:28Z,https://www.youtube.com/watch?v=B4spU0GMoT8,,
Juicing with Seven for Immunity! 🍓🍏🍉 #superhealthy #juicing #juicecleanse #j2juicer,3-pn1XSgtDs,Seven Santana,2025-01-12T17:46:15Z,https://www.youtube.com/watch?v=3-pn1XSgtDs,,
5 day juice cleanse #juicing #juicerecipe #immunity,8cObkp9Xk5U,shani kalua,2025-01-27T01:00:10Z,https://www.youtube.com/watch?v=8cObkp9Xk5U,"making healthy juices has been my most recent obsession. my gut health has never been better, and overall my body and mind ...",
The best orange juice for your body and skin! Drink up and feel the glow ✨ #juicecleanse #juicedetox,D6tOdnQGaHo,Ashley G - Glo and Grow Lifestyle,2025-01-11T03:49:37Z,https://www.youtube.com/watch?v=D6tOdnQGaHo,,
Raw Generation 7 Day Juice Cleanse 🥤,QIqIayd_pvY,Destini Renee',2025-01-10T23:00:19Z,https://www.youtube.com/watch?v=QIqIayd_pvY,,
🤩 Hydrating Green Juice at Home #detox #recipe #healthy #shorts  #greenjuice #kuvings,K2oHe8VdLwo,Healthy Bitz - Vani Mittal,2025-02-19T06:29:00Z,https://www.youtube.com/watch?v=K2oHe8VdLwo,detoxjuice #greenjuice #cucumber #cucumberspinach #healthy #trendingonshorts #healthyrecipes #hydration #detox ...,
Day 5/30 Juice Cleanse! Give this delicious juice a try ✨ #juicecleanse #juicerecipe,HNmcF7n0kUc,Ashley G - Glo and Grow Lifestyle,2025-01-03T22:15:42Z,https://www.youtube.com/watch?v=HNmcF7n0kUc,,
Day 5 update on my 31 day juice cleanse! #juicecleanse #juicingjourney #healthyfood #namajuicer,Qowtn1nQFX0,The Raw Food Glow,2025-01-06T18:25:22Z,https://www.youtube.com/watch?v=Qowtn1nQFX0,,
Easy Cleanse Detox Juice #detox #cleanse #healthy #juice,ndWmNzAZefg,Sim_simmer__,2025-01-29T14:29:12Z,https://www.youtube.com/watch?v=ndWmNzAZefg,,
Juice detox🥒🫚🥬🍋🍏,jYU9SP4TY8U,Canoly,2025-01-24T02:25:41Z,https://www.youtube.com/watch?v=jYU9SP4TY8U,Making one of the green juice recipes during Joc (IG: @evolutionofjoc) 10-Day juice detox           Detoxify your body with the ...,
I’m juicing every day this year. Get into it! #juicecleanse #juice #juicerecipes,V-HdqMOwEeQ,Felicia Plant-Based Vitality,2025-01-24T14:43:52Z,https://www.youtube.com/watch?v=V-HdqMOwEeQ,,
How is papaya juice made #shorts,zP5UjRDLHIA,Youtubecooking1995,2025-03-13T12:32:05Z,https://www.youtube.com/watch?v=zP5UjRDLHIA,How is papaya juice made #shorts papaya juice papaya juice recipe papaya juice benefits papaya juice in telugu papaya juice for ...,
This juice cleanse has me feeling great!!! Day 11 and I feel like my body is detoxing! #juicecleanse,JeK9LtRyMn8,Ashley G - Glo and Grow Lifestyle,2025-01-10T04:54:52Z,https://www.youtube.com/watch?v=JeK9LtRyMn8,,
