Title,Video ID,Channel,Published At,URL,Description,Video Length,Views,Likes,Comments
The many benefits of the Carnivore diet,91nVpzHU244,JK Fitness and Nutrition,2025-01-10T23:38:15Z,https://www.youtube.com/watch?v=91nVpzHU244,"I am grateful every day to have tried this way of eating. Although it definitely is different than anything I have tried, the benefits ...",42,2491,253,14
🥩 🍳 🥑 #carnivore #diet #fatloss #bodybuilding #gym #steak #fitness,KmPMGr84K6M,Noah,2025-03-01T01:46:12Z,https://www.youtube.com/watch?v=KmPMGr84K6M,,9,1693,21,5
What a day of eating looks like in the carnivore diet.  #shorts #carnivore,_4hWTom616s,Diego Cuevas,2025-01-14T05:15:11Z,https://www.youtube.com/watch?v=_4hWTom616s,,32,1566,43,6
Carnivore Diet Day23 #carnivore#carnivorediet#diet#food#foodlover#foodie#asmr#foodblogger#fyp#shorts,WyiF0UVv6UQ,DooDooPoo,2025-01-06T21:44:31Z,https://www.youtube.com/watch?v=WyiF0UVv6UQ,,,,,
Carnivore diet and mental health  #carnivore #mentalhealth,IKNVHknKmWY,"Robert Kiltz, MD",2025-02-12T12:09:08Z,https://www.youtube.com/watch?v=IKNVHknKmWY,Subscribe to my channel here: @doctorkiltz Dr Rimka is a holistic healer. She has been in the health industry for over 24 years ...,46,3011,280,7
Sardines for Lunch #carnivorediet #carnivore #carnivorejourney #sardines #ketodiet #ketodiet,fkFq3TOnSdU,JJ and Eric Carnivore,2025-03-08T14:53:19Z,https://www.youtube.com/watch?v=fkFq3TOnSdU,I love sardines with a bit of salt and mustard.,22,2037,33,0
Embracing my carnivore diet fails & successes #carnivore #animalbased,9_FCw9DX5gM,Rick Moore,2025-03-10T22:54:52Z,https://www.youtube.com/watch?v=9_FCw9DX5gM,Embracing my carnivore snack fails: a real take on diet challenges #carnivore #healthyliving #fok.,42,1506,10,0
🥩What I eat on the Carnivore Diet|Simple & Delicious #carnivorediet #weightloss#weightlossjourney,o7Fiu9gcBIE,DeeDee.Monroe,2025-03-28T18:55:00Z,https://www.youtube.com/watch?v=o7Fiu9gcBIE,"Whether you're a dedicated carnivore, ketovore, low carb, curious about the lifestyle, or looking for new meal ideas, I'm sharing ...",43,3516,265,13
#carnivore #carnivorediet #animalbased #meatbased #ketovore #carnivoreketo #beef #fypyoutube #foodie,JdSbawQuHtE,Hav Inpires,2025-03-27T21:16:58Z,https://www.youtube.com/watch?v=JdSbawQuHtE,,22,1545,0,0
"DAY 26 - CARNIVORE - EGGS, TUNA, BACON, CHEESE, ETBC #carnivore #diet #food #tuna #muscle #training",NlEGg3cBdIs,EXTINCTNATTY,2025-01-26T17:36:22Z,https://www.youtube.com/watch?v=NlEGg3cBdIs,,15,1541,15,0
This is Why You Can't Understand Carnivore  #carnivorediet,GhWDr3sCdg4,"Robert Kiltz, MD",2025-03-02T17:00:15Z,https://www.youtube.com/watch?v=GhWDr3sCdg4,"Dave Mac is a well-known Carnivore YouTuber. Inspired by his own successes with the carnivore diet, he set out to share his ...",27,1622,234,12
Carnivore Diet: Can Ribeyes Alone Lead to Weight Loss? 🥩,S_lB3o_3WM0, Peter Attia Clips,2025-01-12T18:30:20Z,https://www.youtube.com/watch?v=S_lB3o_3WM0,"Is the carnivore diet effective for weight loss? In this discussion, we explore the idea of eating only ribeyes and why such a ...",48,1813,24,0
Ehsan shows physique update after a full carnivore diet month - 260lbs to 226lbs,DWpdmEPbbN0,Generation Iron Fitness & Bodybuilding Network,2025-02-02T15:16:33Z,https://www.youtube.com/watch?v=DWpdmEPbbN0,,22,1462,39,11
Day 44 on the CARNIVORE DIET 🥓🍖🥩,UhWJjW8v_ck,Alex Murphy,2025-02-17T20:02:18Z,https://www.youtube.com/watch?v=UhWJjW8v_ck,carnivore #diet #couples #mukbang #blakelively.,237,1409,44,3
What i eat to stay sharp #carnivorediet #carnivore #diet #gym #fyp,62qdJAhM7M8,Juris Janke,2025-02-24T19:23:54Z,https://www.youtube.com/watch?v=62qdJAhM7M8,,21,1386,9,4
Carnivore Diet: Essential Supplements for Optimal Health,zThAHiUKous,The Nerve Doctors - Neuropathy Pain Treatment,2025-02-23T13:54:31Z,https://www.youtube.com/watch?v=zThAHiUKous,"To thrive on the carnivore diet long-term, we need careful supplementation to avoid nutrient deficiencies. Discover how Dr. Paul ...",28,1517,69,7
Day 42 #carnivorediet this is #dinner 🍳 #carnivorejourney #food #carnivore #ketodiet #weightloss,IG3VWsJSv0c,Coach Crim,2025-01-17T03:15:11Z,https://www.youtube.com/watch?v=IG3VWsJSv0c,,60,1250,27,4
Carnivore Diet and Seatbelts-Deniers: The SAME Flawed Logic?🤯,u3WuN6GcFho,Luca Fithealth,2025-03-01T16:28:35Z,https://www.youtube.com/watch?v=u3WuN6GcFho,What do Seatbelts-Deniers and Carnivores have in Common? Apply for 1:1 coaching or group coaching here: ...,137,1246,32,49
What I ate today on The Carnivore Diet- Valentine’s Day,sdvAP-LPJ2U,JK Fitness and Nutrition,2025-02-14T18:06:41Z,https://www.youtube.com/watch?v=sdvAP-LPJ2U,I feel like every day is a holiday for me as I get to enjoy and look forward to eating such delicious food! Best thing about this way of ...,58,2639,241,6
Why try the Carnivore Diet? #carnivore #carnivorediet,bJ8JYUYgByo,Carnivore OT,2025-02-03T01:56:34Z,https://www.youtube.com/watch?v=bJ8JYUYgByo,,31,1311,39,0
Man Hands filled with cholesterol 😱 #healthchannel #carnivorediet #carnivore #diet #doctor #health,G9XnorXzfps,Hello Doctor Talks,2025-03-20T14:07:43Z,https://www.youtube.com/watch?v=G9XnorXzfps,"A man in his 40s, who followed an extreme carnivore diet based on advice from the internet, ended up at Tampa General Hospital ...",10,2466,16,4
Meal Prep for the Carnivore Diet | Easy & Delicious Ground Beef Prep 🥩🔥,5sCk4KgWCL4,Backyard Butchers,2025-02-07T01:47:20Z,https://www.youtube.com/watch?v=5sCk4KgWCL4,"Stay on track with your carnivore diet by prepping high-quality ground beef for the week! Whether you're making burgers, ...",44,1458,25,0
Carnivore Diet Meals,LtZeDN1P5Ns,Jordi,2025-01-09T08:00:25Z,https://www.youtube.com/watch?v=LtZeDN1P5Ns,Your next carnivore diet meal idea If you're stuck eating the same thing over and over and are looking to shake things up.,34,1177,16,0
The Potato Chip of the carnivore world #carnivorediet #carnivore #bacon,ZHVmb7DKKT8,TheTexasBoys-SHARING LIFE & TRUTH,2025-02-02T15:15:49Z,https://www.youtube.com/watch?v=ZHVmb7DKKT8,,44,1148,64,1
Can You Have a Healthy Pregnancy on a Carnivore Diet?,HIAitWZkOVE,"Robert Kiltz, MD",2025-03-07T17:00:29Z,https://www.youtube.com/watch?v=HIAitWZkOVE,Today we learn more about the benefits of carnivore and how it affects pregnancy in positive way. Connect more with Dr. Kiltz: ...,211,2308,155,22
Day 70 on the CARNIVORE DIET 🥓🥩🍖#carnivore #diet #carnivorediet #mukbang #shorts #americanintheuk,Gh1Ej2XrTRg,Alex Murphy,2025-03-15T19:23:17Z,https://www.youtube.com/watch?v=Gh1Ej2XrTRg,carnivore #diet #carnivorediet #mukbang #shorts #americanintheuk.,63,1256,67,1
Day 27 carnivore diet dinner #fypage #fyp #carnivorediet #carnivores #carnivorelife #weightloss #foo,Bz4fKcMMOFs,Carnivorous Pickleballer,2025-02-24T11:20:19Z,https://www.youtube.com/watch?v=Bz4fKcMMOFs,,16,1046,15,0
Current weight 238 #carnivorediet #carnivore #weightloss #weightlossprogress,f4ldgqOKJz0,Coach Crim,2025-02-07T16:12:46Z,https://www.youtube.com/watch?v=f4ldgqOKJz0,,51,1112,36,3
Day 11 of The Carnivore Diet!!! What happens when I add eggs??? Well... first thing you should know is,6TJxwhSQcgs,MeatPowered,2025-01-23T19:30:22Z,https://www.youtube.com/watch?v=6TJxwhSQcgs,,53,1046,0,2
Day 5 of the Carnivore Diet #healthy#carnivore#holistichealth#healthyeating#gym#foodie#growth#diet t,xQTzstA5vnM,Raining Zi,2025-02-10T22:41:37Z,https://www.youtube.com/watch?v=xQTzstA5vnM,,16,970,26,7
Carnivore diet good for IBD? #ibd #guthealth #carnivorediet #ulcerativecolitis #crohnsdisease,CXwWjyWLUAE,High Carb Health,2025-03-04T21:54:23Z,https://www.youtube.com/watch?v=CXwWjyWLUAE,"The carnivore diet doesn't heal you. It traps you. At first, it seems like a miracle. No fiber = no symptoms. But what's really ...",13,1576,33,14
Carnivore Priming Day 2 #carnivore #priming #carnivorediet #carnivorelifestyle #liondiet #keto,TQnYgHqYNUM,Coach Markus Willard,2025-02-20T04:11:41Z,https://www.youtube.com/watch?v=TQnYgHqYNUM,Summary of the Priming Protocol The Priming Protocol is a structured approach developed by Raymond Nazon of the Steak and ...,44,,,
Is the Carnivore Diet a Magic Elixir or Disaster? @lilliekane #keto #carnivore #meat #disease,RxXcdWhlOYo,Nutrition by Victoria,2025-02-21T16:31:43Z,https://www.youtube.com/watch?v=RxXcdWhlOYo,"Sucrose, High-Fructose Corn Syrup, and Fructose, Their Metabolism and Potential Health Effects: What Do We Really Know?",16,1418,41,11
All we need is BACON #trucker #carnivorediet #carnivore #bacon #diet,rLuTqH2SArU,Country,2025-03-05T20:16:30Z,https://www.youtube.com/watch?v=rLuTqH2SArU,,31,1035,76,10
Day 29 🥩 #food #carnivore #diet #steak #cooking #cheese #eggs,sqRU7Z4Ku9w,Ethan Massey,2025-01-29T17:01:27Z,https://www.youtube.com/watch?v=sqRU7Z4Ku9w,,11,925,30,2
Day 3 of Carnivore Diet #healthylifestyle#holistichealth#healthyeating#gym#foodie#growth#carnivore,EQlrdG7GigA,Raining Zi,2025-02-06T22:00:51Z,https://www.youtube.com/watch?v=EQlrdG7GigA,,23,896,22,16
🥩 Juicy Oven-Baked Brisket with Homemade Rub! 🔥 | Carnivore Diet & Farmstead Cooking,EGdCjhsvHuw,MiniFarmLife,2025-03-31T21:36:42Z,https://www.youtube.com/watch?v=EGdCjhsvHuw,Cover with lid half way through baking**My husband and I made the juiciest oven-baked brisket using my homemade brisket rub!,51,2025,56,4
"Beef, Cheese, and Pepperoni. #carnivore #carnivorediet #airfryer #food #diet #cooking #health #keto",FsuM_XxMXdk,Newman,2025-01-27T19:12:31Z,https://www.youtube.com/watch?v=FsuM_XxMXdk,,59,899,19,1
What I eat a day on the carnivore diet #carnivorediet #carnivore #lowcarbdiet #gastricsurgery,Qyk6pn0Qnsw,LeahGenae,2025-01-25T16:46:54Z,https://www.youtube.com/watch?v=Qyk6pn0Qnsw,191 days of and I'm still thriving! I don't track macros I try make sure I try to get at least 2 stick of butter in a day.,31,867,20,0
the food pyramid in the carnivore diet. #carnivorediet #carnivore #keto #lowcarb,OgKZSKG566o,Genxcarnivoredude,2025-02-19T19:48:51Z,https://www.youtube.com/watch?v=OgKZSKG566o,the food pyramid in the carnivore diet. #carnivorediet #carnivore #keto #lowcarb.,42,883,19,0
Carnivore Diet: Fasting Glucose & A1C,cw1SF2HmRbs,TheTexasBoys-SHARING LIFE & TRUTH,2025-02-18T00:00:34Z,https://www.youtube.com/watch?v=cw1SF2HmRbs,Preorder links for book: Amazon: https://www.amazon.com/gp/product/1628605766 B&N: ...,53,986,49,1
Carnivore diet and heart disease risk - Dr Shawn Baker on the science #carnivorelifestyle,lVq75JopUOs,Family Health Lab,2025-03-05T05:14:23Z,https://www.youtube.com/watch?v=lVq75JopUOs,Carnivore diet and heart disease risk - Dr Shawn Baker on the science: https://youtu.be/v9KUzBjKkV4.,24,1330,36,7
Meat on the grill | carnivore dinner #carnivore #diet #health #healthy,bktHDFisftw,MachineMonster,2025-02-14T00:40:04Z,https://www.youtube.com/watch?v=bktHDFisftw,,53,836,44,3
Carnivore Diet day 45- #weightloss #food #carnivorejourney #carnivore #diet #dietplan #carnivorediet,iHrNx01SVLI,Eddie_Gets_Fit,2025-02-14T22:23:03Z,https://www.youtube.com/watch?v=iHrNx01SVLI,,13,818,14,2
P is for Patience | ABCs of Keto and Carnivore Diet #keto #carnivore,GTIplZiDTUw,Ketogenic Woman,2025-02-24T21:00:25Z,https://www.youtube.com/watch?v=GTIplZiDTUw,"P is for Patience | ABCs of Keto and Carnivore Diet Watch PART 2 of ""ABCs of Carnivore & Keto"" Sunday Live Q&A Replay (or ...",32,946,125,7
🥩 Carnivore Diet: Is it Healthy?,964XbkB7wp8,Transcend Company,2025-01-30T19:00:09Z,https://www.youtube.com/watch?v=964XbkB7wp8,Is the carnivore diet as healthy as it seems? Let's break down the surprising effects. #carnivore #carnivorediet #diet #health ...,23,795,5,3
anyone else tried this diet ? 🫐🥑🥩🍳 #carnivorediet #diet #steakandeggs #food #carnivore #healthy,aUmdpZ6fKjs,Chris Doan,2025-02-19T13:49:46Z,https://www.youtube.com/watch?v=aUmdpZ6fKjs,,8,768,23,2
What I eat in a day on the carnivore diet🥩 #carnivore #carnivorediet #food #diet #fyp,UVJ4mbK5fSI,TeamNelson,2025-01-24T18:24:43Z,https://www.youtube.com/watch?v=UVJ4mbK5fSI,,21,764,17,2
What I Eat A Day 3 Years Strong Carnivore Diet 🥩⚡️ Medicin3-Free 💯,jwWLnreJ81s,DIKER Carnivore Coach ,2025-02-19T18:52:12Z,https://www.youtube.com/watch?v=jwWLnreJ81s,"What I Eat A Day 3 Years Strong Carnivore Diet Here's my full day of eating routine ! We're lions, not sheep anymore!",21,773,26,0
Day 49 #carnivorediet this is #brunch 🍳  #carnivorejourney #food #carnivore #ketodiet #weightloss,QDcnVZeqzZM,Coach Crim,2025-01-23T19:50:45Z,https://www.youtube.com/watch?v=QDcnVZeqzZM,,59,741,59,5
Day 41 #carnivorediet this is #dinner 🍳 #carnivorejourney #food #carnivore #ketodiet #weightloss,hpBishSYce4,Coach Crim,2025-01-16T03:50:56Z,https://www.youtube.com/watch?v=hpBishSYce4,,53,724,61,14
Day 17 lunchtime! #fypage #fypage #carnivore #diet #fypyoutube #fypシ゚ #fyp,27dRAAR0eKI,Carnivorous Pickleballer,2025-02-13T22:51:08Z,https://www.youtube.com/watch?v=27dRAAR0eKI,,16,712,16,6
Why People Love the Carnivore Diet,GTxfRRRF5Fc,Nuviva Medical Weight Loss Clinics,2025-01-13T19:30:02Z,https://www.youtube.com/watch?v=GTxfRRRF5Fc,READ DESCRIPTION ⬇️ It's world carnivore month. A lot of people like this diet because it's been known to cause weight loss.,52,684,17,0
What I eat a day on the carnivore diet #carnivorediet #carnivore #lowcarbdiet #gastricsurgery,4Gv0sSLciuI,LeahGenae,2025-01-06T15:30:02Z,https://www.youtube.com/watch?v=4Gv0sSLciuI,175 days of and I'm still thriving! I don't track macros.,36,679,14,0
"Day, one of the carnivore diet! Breakfast!￼ #carnivore #nutrition #weightloss",1-ZD-oVYlrs,Joy Sickinger,2025-02-01T14:27:03Z,https://www.youtube.com/watch?v=1-ZD-oVYlrs,,60,674,18,2
Diarrhea on a Carnivore Diet? Here’s Why,rFl1koiFVto,Sameer Dossani,2025-02-13T21:01:43Z,https://www.youtube.com/watch?v=rFl1koiFVto,"Some people experience digestive issues when transitioning to carnivore, especially if they suddenly increase their fat intake.",55,872,29,3
DAY 25 carnivore diet dinner #fypage #food #carnivorediet #fyp #fypyoutube #weightloss,Sbd56OdibYA,Carnivorous Pickleballer,2025-02-22T20:02:46Z,https://www.youtube.com/watch?v=Sbd56OdibYA,,31,664,13,4
Day 7 #food #carnivore #diet #journey #keto #breakfast #dinner #whatieatinaday #2025 #cooking,OO0KuZnW1yE,Kelly Kim,2025-01-08T17:32:51Z,https://www.youtube.com/watch?v=OO0KuZnW1yE,,38,701,23,6
WHAT I EAT AT WORK TO LOSE WEIGHT ON THE CARNIVORE DIET #carnivore #weightlossjourney,_B-2JmZeinM,Madeline R.,2025-02-07T00:12:18Z,https://www.youtube.com/watch?v=_B-2JmZeinM,,48,669,23,1
Discipline will take you farther. #fitness #diet #carnivore #carnivorediet #healthy #wholefood #gym,pG85hmQWJzg,TJxShippuden,2025-03-18T17:09:14Z,https://www.youtube.com/watch?v=pG85hmQWJzg,,40,668,21,0
What Do I Eat On The Carnivore Diet? — Day 9 Of 30 Day Challenge!,U9076cXIGrY,MeatPowered,2025-01-21T20:50:07Z,https://www.youtube.com/watch?v=U9076cXIGrY,,51,723,0,2
Day 600 of Carnivore Diet #carnivore #carnivorelifestyle,obWSFxi2ky8,Vegan Turned Carnivore ,2025-02-16T18:45:37Z,https://www.youtube.com/watch?v=obWSFxi2ky8,,35,843,24,0
Unlocking Liver Health:  The Power of Carnivore Diet,k593orB_ujI, Carnivore Coach Lisa Pickart,2025-03-21T21:07:19Z,https://www.youtube.com/watch?v=k593orB_ujI,mahadevstatus #mahakal #mahadev #LiveWithoutRegret #WomenEmpowerment #LifeBack #Transformation #CoachLisa ...,51,885,31,0
2-Year Results on the Carnivore Diet,LHh50JKNF5E,Spa and Tell,2025-01-16T17:03:45Z,https://www.youtube.com/watch?v=LHh50JKNF5E,"Join Me as I share my 2-year results on Carnivore If on IG: Comment ""carnivore2"" for this video. If you are on YouTube, the full ...",19,743,50,2
DAY 11/30 CARNIVORE DIET| #shorts #cooking #diet #fitness #motivation #mealprep,FIIZg1S480A,Sean Fitzpatrick,2025-01-17T23:06:32Z,https://www.youtube.com/watch?v=FIIZg1S480A,DAY 11.,14,638,8,0
Favorite meat poll: join the #carnivore community! #carnivorediet,7EYpbs0bipI,Rick Moore,2025-02-26T14:30:06Z,https://www.youtube.com/watch?v=7EYpbs0bipI,Favorite meat poll: join the discussion #carnivore #carnivorediet #animalbased #fok.,15,632,13,2
Carnivore Diet Steak and Eggs,4q_WDY63hQk,Let Chad Cook,2025-01-17T21:26:19Z,https://www.youtube.com/watch?v=4q_WDY63hQk,Chad eats Steak and Eggs that he cooked. #carnivore #carnivorediet #keto #ketodiet.,60,695,28,9
Morning fatty coffee & eggs routine #carnivore #carnivorediet #fattycoffee #pcos,p7FoJn47Dxw,Russell Jackson,2025-02-14T19:30:07Z,https://www.youtube.com/watch?v=p7FoJn47Dxw,Morning routine: fatty coffee & fried eggs #carnivore #carnivorediet #fattycoffee #fok.,10,634,5,0
Day 53 on the CARNIVORE DIET 🥓🍖🥩,nTevUaSbBEM,Alex Murphy,2025-02-26T20:28:13Z,https://www.youtube.com/watch?v=nTevUaSbBEM,carnivore #carnivorediet #flight #dubai.,220,653,19,3
🥩 Red Meat: The Real Superfood #functionalmedicine #carnivore #diet,QNlL30pd9KE,Chronically Healthy ,2025-03-18T17:35:37Z,https://www.youtube.com/watch?v=QNlL30pd9KE,,52,618,0,0
The Carnivore Diet's Impact on Teeth and Inflammation | Dr Allan Matthews #dentistry #edinburgh,AeYN17LzhEM,Integrated Dentalcare,2025-02-24T07:48:28Z,https://www.youtube.com/watch?v=AeYN17LzhEM,"In this video, Dr. Allan Matthews discusses the effects of diet on oral health, specifically focusing on the carnivore diet. He explores ...",118,1204,18,7
What I eat on a day doing the carnivore diet. Snack ideas. #reels #carnivore,Jg5LTCL0oJI,Diego Cuevas,2025-01-09T02:16:00Z,https://www.youtube.com/watch?v=Jg5LTCL0oJI,,58,610,23,4
What I ate today #carnivorediet #committedcarnivore #carnivore,Ibby47RbRqw,Committed Carnivore,2025-02-22T02:12:22Z,https://www.youtube.com/watch?v=Ibby47RbRqw,,20,593,8,1
bout to be #killenit with this Carnivore diet! #eggs #carnivore #carnivorediet #meateater #letsgo,p9XYToKxA7w,Life with the Killen’s,2025-01-04T22:52:07Z,https://www.youtube.com/watch?v=p9XYToKxA7w,,62,596,6,0
Why I’m doing the carnivore diet 👌 #carnivore #keto #weightloss #weightlossjourney #fitdad,KJbZpEtkGSI,Carnivore Dad,2025-02-12T05:52:45Z,https://www.youtube.com/watch?v=KJbZpEtkGSI,,44,596,7,0
My parents are on the carnivore diet,-LEOPS_Ulsk,Erin Maguire,2025-01-20T16:00:00Z,https://www.youtube.com/watch?v=-LEOPS_Ulsk,erinmaguire #standupcomedy #comedian #steakhouse.,32,666,11,0
Carnivore as a teacher/coach sometimes looks like this #carnivore #carnivorediet #diet #food #fyp,5r_9M-w9ztQ,TeamNelson,2025-01-28T23:38:35Z,https://www.youtube.com/watch?v=5r_9M-w9ztQ,,7,600,16,4
Carnivore Diet 🥩🍗🍕🍳🥓☕️#shorts #carnivore #yummy,JqWKpDTn9P8,A Dash of Gratitude,2025-02-12T18:16:54Z,https://www.youtube.com/watch?v=JqWKpDTn9P8,adashofgratitude #carnivorediet #shorts #shortsvideo Be sure to click the link to my Creative Carnivore video for full details and ...,52,601,28,3
First time trying Venison | Carnivore Diet : See what happened #carnivore #venison #diet #shorts,m-Oup9-8kXs,A Little Bit Of Everything / S Dickens,2025-03-01T15:01:24Z,https://www.youtube.com/watch?v=m-Oup9-8kXs,,26,640,8,5
Day 15 of carnivore diet dinner #carnivore #carnivore diet #fyp #fypage #fypシ゚ #fypage,1RQ1v9riZKE,Carnivorous Pickleballer,2025-02-12T10:56:20Z,https://www.youtube.com/watch?v=1RQ1v9riZKE,,16,574,13,2
Who's doing carnivore diet?#diet #carnivore #keto #shortsfeedviral,8m7rL8X0r2A,Viva Flavors,2025-01-09T23:26:01Z,https://www.youtube.com/watch?v=8m7rL8X0r2A,,12,586,6,1
Carnivore will SIMPLIFY your kitchen! (And your life) #carnivore #carnivorediet,fOn0fBD7yPo,T-Bone the Carnivore,2025-03-16T19:22:15Z,https://www.youtube.com/watch?v=fOn0fBD7yPo,,30,623,8,2
Carnivore Diet,Blyg5rCHMhQ,Aaron Hartman MD,2025-01-31T21:10:17Z,https://www.youtube.com/watch?v=Blyg5rCHMhQ,"Carnivore diet: is it worth the hype? The carnivore diet is everywhere right now, and for good reason—it can be a powerful ...",42,589,27,2
What I eat for dinner on the carnivore diet!#carnivore#carnivorediet #carnivores #carnivorelifestyle,OJSs_qmsvlA,Finding Dustin,2025-01-10T02:07:56Z,https://www.youtube.com/watch?v=OJSs_qmsvlA,,17,568,13,0
First time trying Venison | Carnivore Diet #carnivore #venison #diet #shorts,uL3Rn2jcY7Q,Pilates With Me / S.Dickens,2025-03-01T15:06:30Z,https://www.youtube.com/watch?v=uL3Rn2jcY7Q,,26,640,12,2
Eat More Meat #healthyeating #carnivore #food #carnivorediet #meat #meatbaseddiet #grill,vLMRrV543Eo,James Barbour Carnivore RV Traveler,2025-01-04T15:04:55Z,https://www.youtube.com/watch?v=vLMRrV543Eo,"Eat More Meat on the carnivore diet. January 2025 is World Carnivore Month. Steak, Fish, Lamb, burgers - they are all mouth ...",46,557,10,0
Day 3 #Carnivore Diet Workout is 1 hour of #Cardio Burned Over 700 Calories 🔥 #gym  #carnivorediet,OFmy19lU9Tk,Lalos Gets Fit 💪🏽,2025-01-09T21:37:10Z,https://www.youtube.com/watch?v=OFmy19lU9Tk,,16,561,10,0
Carnivore Diet Changed My Life #carnivore #nutrition,iBG7qnw-7QM,Carnivore OT,2025-02-05T17:51:58Z,https://www.youtube.com/watch?v=iBG7qnw-7QM,,24,1559,37,1
Are you ready to experience the amazing benefits of the carnivore diet? 🍖🔥,vKNHXU42kvM,Fasting  & Carnivore Diet ,2025-03-18T16:34:12Z,https://www.youtube.com/watch?v=vKNHXU42kvM,"Are you ready to experience the amazing benefits of the carnivore diet? Download our app to track your journey, stay on ...",39,552,10,0
What I eat on the carnivore diet #carnivorediet #carnivore #eggs #steak #foodshorts #diet #ketodiet,OE2GbJEvWnI,living_a_newlife2024,2025-01-29T03:34:05Z,https://www.youtube.com/watch?v=OE2GbJEvWnI,,15,555,12,0
Carnivore Nachos #carnivore #carnivorediet #food #diet #fyp,xstaBUPiAN4,TeamNelson,2025-02-02T00:09:49Z,https://www.youtube.com/watch?v=xstaBUPiAN4,,26,613,23,2
Why OMAD is Easier on the Carnivore Diet,sVeFaaOqJVI,FACTASY,2025-02-06T21:20:52Z,https://www.youtube.com/watch?v=sVeFaaOqJVI,This video examines the benefits of eating only one meal a day—OMAD—and why it's easier to pull off on the carnivore diet.,175,957,51,5
Carnivore Diet FOR LIFE 🥩🔪,Cg4yWvuHuIg,Issy Watson,2025-03-08T04:19:08Z,https://www.youtube.com/watch?v=Cg4yWvuHuIg,"Beef fat, steaks, pork, chicken, salmon, any meat!! It's all so good! Carnivore, keto, animal based. Whatever you are, load your ...",47,558,15,1
75 hard and carnivore diet 💪 #carnivore #keto #weightloss #weightlossjourney #fitdad,vMtLUaYLrio,Carnivore Dad,2025-02-11T09:01:24Z,https://www.youtube.com/watch?v=vMtLUaYLrio,,42,605,11,0
#frankiesfreerangemeats #carnivore #diet #lifestyle #cooking #food,2j4_bpjWrxI,Thomas Doyle III,2025-01-16T17:48:57Z,https://www.youtube.com/watch?v=2j4_bpjWrxI,,14,533,8,6
Pork belly! #food #carnivore #carnivorediet #pork #diet #carnivorelife #ketodiet #dieta #short #yes,JN9BhI8jBS0,living_a_newlife2024,2025-02-15T02:30:28Z,https://www.youtube.com/watch?v=JN9BhI8jBS0,,29,535,12,0
Chicken meat #music #feed #chicken #meat #carnivore #diet #cool #nessa,emAJC88FkpI,Richi's Truth,2025-02-23T11:59:51Z,https://www.youtube.com/watch?v=emAJC88FkpI,,16,538,16,0
111 Grams Of Protein for $13 😳 #carnivore #carnivorediet #meat #dairy #protein #fasting,t-tRd3vLQj0,KC_Golf,2025-01-06T18:17:22Z,https://www.youtube.com/watch?v=t-tRd3vLQj0,,34,537,10,6
Carnivore Diet Cost Exposed: Can You Afford to Eat Meat-Only? (Price Breakdown) #steak #meat,W5nByUIBiSQ,Spa and Tell,2025-03-06T18:41:26Z,https://www.youtube.com/watch?v=W5nByUIBiSQ,Carnivore Diet Cost Exposed: Can You Afford to Eat Meat-Only? (Price Breakdown)   Video: ...,29,748,21,3
My Morning routine on the CARNIVORE DIET #carnivorediet #carnivore #steak #eggs #beef #diet,OJso_Z6ZvM8,GetGoinOutdoors,2025-02-17T15:04:26Z,https://www.youtube.com/watch?v=OJso_Z6ZvM8,,58,533,6,0
"Bacon, smokies, and cheese in air fryer. #carnivore #carnivorediet #airfryer #keto #diet #food #idea",Ru9kDDieLow,Newman,2025-01-29T06:47:23Z,https://www.youtube.com/watch?v=Ru9kDDieLow,,54,528,7,0
Carnivore dinner day #15 NY Strip and eggs. #carnivore #carnivorediet #carnivorejourney,da_lGtPNGIE,Finding Dustin,2025-01-23T22:55:30Z,https://www.youtube.com/watch?v=da_lGtPNGIE,Carnivore meal day #15 NY Strip and Eggs #carnivore #carnivore #carnivorejourney #carnivorelifestyle.,13,532,10,0
#carnivore #carnivoretips #carnivorecoaches #carnivoredietbeginners #fyp #carnivorediet #meat,RaJui6Nq5qw,Getting Real With Réal Andrews Podcast,2025-02-20T21:03:21Z,https://www.youtube.com/watch?v=RaJui6Nq5qw,carnivore #carnivoretips #carnivorecoaches #carnivoredietbeginners #fyp #carnivorediet #meat #creatorsearchinsights ...,41,534,5,1
Cauliflower Snacks: The Crunchy Revolution #carnivore diet,c4KK_l5Fz-4,Kravings Of Calcutta,2025-01-13T10:30:17Z,https://www.youtube.com/watch?v=c4KK_l5Fz-4,"In the world of health and nutrition, the quest for the perfect snack has led to a crunchy revolution - Cauliflower Snacks!",61,524,7,0
Day 29 #carnivore #diet #chicken #fyp #foryou #keto #ketodiet #food #shorts #recipe #카니보어 #nosugar,rUEn8Ei2hM4,Kelly Kim,2025-02-02T22:51:57Z,https://www.youtube.com/watch?v=rUEn8Ei2hM4,,27,544,20,4
2nd day on the carnivore diet.,hTgciAM_wX8,Grama Pat,2025-01-02T21:56:35Z,https://www.youtube.com/watch?v=hTgciAM_wX8,,29,517,6,1
#fypyoutube #animalbased #carnivore #breakfast #lowcarb #ketodiet #carnivorediet #ketocarnivore #fyp,KpKLB9gOW8o,Hav Inpires,2025-03-06T16:53:59Z,https://www.youtube.com/watch?v=KpKLB9gOW8o,,19,522,0,0
Cowboy butter. Carnivore diet approved. #carnivore #shorts #reels #butter #recipes #simple #eat,xldfsve66fA,Randy Nance,2025-01-27T11:55:25Z,https://www.youtube.com/watch?v=xldfsve66fA,,60,537,6,1
Day 31 carnivore diet dinner #fypage #fypyoutube #weightlossdiet #carnivorediet #carnivore #fyp,56K_w_drHx0,Carnivorous Pickleballer,2025-03-02T02:45:50Z,https://www.youtube.com/watch?v=56K_w_drHx0,,14,508,9,0
Day 5 Carnivore Priming #carnivore #priming #carnivorelifestyle #carnivorediet,Zlk9N541V5o,Coach Markus Willard,2025-02-23T04:23:27Z,https://www.youtube.com/watch?v=Zlk9N541V5o,Carnivore Priming Day 5 #carnivore #priming #carnivorediet #beef #eggs #liondiet #keto #animalbased #intuitiveeating ...,58,,,
