Title,Video ID,Channel,Published At,URL,Description,Video Length
Tired of Being Tired? What is Sleep Hygiene and How It Can Transform Your Nights?,u5xvFmMb6qU,Sleep Well Network,2025-03-20T14:01:05Z,https://www.youtube.com/watch?v=u5xvFmMb6qU,What is Sleep Hygiene? Did you know that getting a good night's sleep can be as easy as changing a few habits? In this video ...,
How Good Sleep Hygiene Improves Your Health and Boosts Energy Levels 🌙,ZJTFscJ1j_A,PrimeCare360,2025-02-12T20:34:05Z,https://www.youtube.com/watch?v=ZJTFscJ1j_A,"Good sleep hygiene is essential for overall well-being! A restful night's sleep can improve mood, boost energy, enhance brain ...",
4 Good Habits For Health Sleep #sleephygiene #sleepwell #sleeptips #choices,PFxiVGZ4gUM,Brenda The Soulutionist,2025-03-24T00:22:07Z,https://www.youtube.com/watch?v=PFxiVGZ4gUM,"4 Good Habits For Health Sleep Prioritizing good sleep habits, such as establishing a consistent sleep schedule, creating a ...",
"""The Importance of Sleep Hygiene""@Suprasonic_2025",HAjoY7lyaVk,SUPRASONIC_2025,2025-01-28T13:49:06Z,https://www.youtube.com/watch?v=HAjoY7lyaVk,Understanding Sleep Hygiene Sleep hygiene refers to practices and habits that help improve the quality of sleep. These practices ...,
Mental Health Minute: Improving Wellness with Sleep Hygiene,_vAHp1B8RoU,Zumbro Valley Health Center,2025-03-25T17:53:41Z,https://www.youtube.com/watch?v=_vAHp1B8RoU,Zumbro Valley Health Center has partnered with KAAL ABC 6 News to present a Mental Health Minute on sleep hygiene.,
#music #gospelmusic #sleepwellness #love #sleephygiene,nP5rgfWU6m4,Ike Tobe,2025-01-03T22:15:32Z,https://www.youtube.com/watch?v=nP5rgfWU6m4,,
Sleep Hygiene for FIFO Workers: How to Improve Rest in Mining Shift Work 😴🏗️,mYE7V3O2-3M,Fitness School,2025-01-31T09:56:31Z,https://www.youtube.com/watch?v=mYE7V3O2-3M,"New research from Edith Cowan University (ECU) highlights the importance of sleep hygiene for fly-in, fly-out (FIFO) mining shift ...",
Improve Your Sleep Hygiene to Combat Sexomnia!,POmbeOfEMAQ,Vigyan Recharge Fam,2025-03-10T22:17:25Z,https://www.youtube.com/watch?v=POmbeOfEMAQ,"Have you ever heard of Sexomania? Also known as Sleep Sex Disorder, this rare and mysterious condition causes people to ...",
Don’t miss out! Sleep resources for BCBAs #bcba #behavioranalyst #sleephygiene #ceu #webinar,21tswq4xDV4,Gabrielle Carmody | BCBA LBA CBSS,2025-01-15T22:34:01Z,https://www.youtube.com/watch?v=21tswq4xDV4,,
ronaldo`son #animation #bettersleep #soundtrack #sleephygiene,HPrQKes5hhw, by xzaza,2025-03-26T01:42:28Z,https://www.youtube.com/watch?v=HPrQKes5hhw,,
Improve Your Sleep Hygiene with these 5 Tips! #SleepHygiene #BetterSleep #RestfulNights #SleepTips,81xK5op9WY4,Slow Mel,2025-03-03T06:00:04Z,https://www.youtube.com/watch?v=81xK5op9WY4,"Welcome to our Sleep Hygiene series! In this video, we'll share five essential tips to help you improve your sleep quality and ...",
Revolutionizing Men's Self-Care: Unlocking Sleep Hygiene,Aom07oPtuuo,Gentleman’s Essentials,2025-01-18T01:00:08Z,https://www.youtube.com/watch?v=Aom07oPtuuo,Explore how Ryan's journey in prioritizing sleep hygiene enhances his personal care and well-being. #SleepHygiene #SelfCare ...,
Worst Foods to Eat Before Bedtime! #shorts,6Va3z0VyS4c,BD Facts 2,2025-03-24T08:25:45Z,https://www.youtube.com/watch?v=6Va3z0VyS4c,Worst Foods to Eat Before Bedtime! #shorts #youtubeshorts #facts #trending #shortsfeed #shortvideo #Sleep #HealthFacts ...,
Sleep Hygiene: The Secret to Hormone Balance,2DKg29ywA4A,The Healthy Reset,2025-02-02T13:01:23Z,https://www.youtube.com/watch?v=2DKg29ywA4A,"Discover the secrets to better sleep hygiene and how it impacts your mental health, especially during perimenopause.",
"Good sleep hygiene Or Healthy Sleep ; Meaning, Tips for A good Sleep Hygiene",KLIe2iZbc6Y,MBBS NAIJA,2025-02-17T12:38:00Z,https://www.youtube.com/watch?v=KLIe2iZbc6Y,Good sleep hygiene is crucial for achieving healthy and restful sleep. Here are some tips to help improve your sleep habits: Tips ...,
Essential Sleep Hygiene Tips for Restful & Restorative Sleep. #motivation #managestress #tips,c9B1LaOKIno,Psychoaura,2025-02-22T08:33:39Z,https://www.youtube.com/watch?v=c9B1LaOKIno,Contact us Website: https://psychoaura.com Email: psychoaura01@gmail.com Phone Number: +92 329 5850475 Follow us: ...,
🌙 Prioritize Sleep Hygiene for Better PCOS Management! 💤💖,NWT1E0VS8LI,Dr Shweta Bansal Wazir,2025-02-26T05:39:35Z,https://www.youtube.com/watch?v=NWT1E0VS8LI,"Did you know that women with PCOS often face sleep disturbances, which can impact metabolic health and hormonal balance?",
Natural Solutions For Better Sleep:  Tips & Tricks..,QjLZAByCs0o, Jesse truREMedi,2025-02-20T18:35:38Z,https://www.youtube.com/watch?v=QjLZAByCs0o,Natural Solutions For Better Sleep: Tips & Tricks.. Most people have NO IDEA what poor sleep will do to your health. Sleep ...,
The Impact of Sleep on Weight Loss: What You Need to Know  #health #sleep,CdtXrI4Xb24,Active Life Blueprint,2025-01-27T18:00:10Z,https://www.youtube.com/watch?v=CdtXrI4Xb24,Quality sleep is a crucial yet often overlooked component of weight loss. Poor sleep can disrupt hormones that regulate hunger ...,
Sleep Hygiene,iELkShCIoGM,Riman North America,2025-01-02T19:03:27Z,https://www.youtube.com/watch?v=iELkShCIoGM,Sleep hygiene involves the adoption of specific rituals and habits to improve sleep quality - learn how it can apply to your daily ...,
Better Sleep Starts Here: Essential Sleep Hygiene Techniques 💤,nDwvz4m_tK4,snmazleena samad,2025-03-02T07:33:42Z,https://www.youtube.com/watch?v=nDwvz4m_tK4,"Struggling to get quality sleep? Let's fix that! In this video, we explore simple yet effective sleep hygiene techniques to help you ...",
"Unlock Better Sleep: The Hot, Cold, Deaf, & Blind Method",UHebilZ-pls,ADS LIVE,2025-01-17T14:30:25Z,https://www.youtube.com/watch?v=UHebilZ-pls,"Discover the viral ""Hot, Cold, Deaf, and Blind"" sleep hack! This video explores this simple yet effective technique for improving ...",
Practicing proper sleep hygiene,ljiiXjOXFfs,Call A Doc,2025-01-18T07:18:37Z,https://www.youtube.com/watch?v=ljiiXjOXFfs,Good sleep is the foundation of a healthy mind and body. ✨ Practicing proper sleep hygiene can improve your quality of rest ...,
How Much is Your Lack of Sleep Costing You? #sleepdeprivation #insomnialief,UyQ31_agTjA,Sleep Well Network,2025-03-02T00:00:24Z,https://www.youtube.com/watch?v=UyQ31_agTjA,"Are you underestimating the true cost of poor sleep? In this video, we break down how sleep deprivation impacts your health, ...",
SLEEP HYGIENE: Importance of Rest,36UnZnzmCLE,RestVengers,2025-03-23T15:51:11Z,https://www.youtube.com/watch?v=36UnZnzmCLE,,
Gary Brecka - Unlocking the Power of Sleep - Transform Your Routine !,EfF-E16IY4U,Gladiator Faith & Mindset,2025-03-28T16:53:50Z,https://www.youtube.com/watch?v=EfF-E16IY4U,Gary Brecka - Unlocking the Power of Sleep - Transform Your Routine ! #garybrecka #health #nutrition #nutritiontips ...,
30-Day Sleep Hygiene Challenge,bh1W-8iZL8w,Pat Ziemer,2025-02-26T13:45:24Z,https://www.youtube.com/watch?v=bh1W-8iZL8w,Transform your nights with our 30-Day Sleep Hygiene Challenge! Embrace better sleep through simple routines and adjustments.,
Easy Tricks for Good Sleep #sleep #sleepcycles #sleeppatterns #sleepsounds #sleepingfast #goodsleep,NMqWcN3_GPc,Kaliiim,2025-01-08T22:39:11Z,https://www.youtube.com/watch?v=NMqWcN3_GPc,"Sleep is essential for overall well-being, playing a vital role in physical and mental health. It allows the body to repair itself, ...",
"The Importance of Sleep Hygiene: Better Rest, Better You 😴✨  #facts #confidence",ugxs52KnD5g,DeepDesire,2025-02-07T02:23:19Z,https://www.youtube.com/watch?v=ugxs52KnD5g,"""Struggling with sleep? Good sleep hygiene can change everything! Try these habits: 1️⃣ Stick to a consistent bedtime ⏰ ...",
Sleep Hygiene with Ocean Glow,HRdX7RTR6H4,Sonotherapy - Topic,2025-03-09T23:04:51Z,https://www.youtube.com/watch?v=HRdX7RTR6H4,Provided to YouTube by eMuzyka Sleep Hygiene with Ocean Glow · Sonotherapy · Therapy Zen Revolution Sound Therapy for ...,
Beginner's Guide To Sleep Hygiene #healthyliving #Tranquillamsleep,G79qEvrOSkE,Tranquillam Sleep,2025-01-20T03:14:49Z,https://www.youtube.com/watch?v=G79qEvrOSkE,Beginner's Guide to Sleep Hygiene Struggling with sleep? Let's get your snooze game strong with these 4 simple tips for ...,
Sleep Hygiene,CWPMeFrO104,EX PRESS - Topic,2025-01-30T13:07:31Z,https://www.youtube.com/watch?v=CWPMeFrO104,Provided to YouTube by DistroKid Sleep Hygiene · EX PRESS · Devon Dawson Milley · Devon Dawson Milley · Devon Dawson ...,
Tips for better sleep hygiene.For kids learning and fun.,c8CkquG_9gY,Ali Muttaqui @123 Quarashi ,2025-01-26T14:57:46Z,https://www.youtube.com/watch?v=c8CkquG_9gY,Tips for better sleep hygiene Stay connected with us by subscribing to our channel.,
Are You Ruining Your Sleep? 🤔#sleephygiene #sleep,ljT7hc7HE5M,The Unexpected ,2025-03-24T03:27:44Z,https://www.youtube.com/watch?v=ljT7hc7HE5M,"Are your nightly habits sabotaging your sleep quality? In this eye-opening video, we delve into common mistakes that might ...",
#14 #sleep #sleepquality #sleepbetter #sleephygiene #sleeproutine #helthtips #healthscope #health,bfzFD15Tpr8,Healthscope,2025-02-09T20:30:03Z,https://www.youtube.com/watch?v=bfzFD15Tpr8,"A good sleep is essential for brain function, physical health, emotional well-being, and overall longevity.",
The Fascinating World of the Sleep System: Recharge Your Body Naturally,w9S3NloBE8Y,Body Blueprint,2025-01-29T01:00:49Z,https://www.youtube.com/watch?v=w9S3NloBE8Y,"Explore the intricate sleep system, highlighting its role in restoration and healing. Gain insights from Dr. Lisa Thompson and ...",
The Benefits of Sleep Hygiene Practices,tw6-E-zjmRg,Mindful Insights,2025-02-13T01:00:52Z,https://www.youtube.com/watch?v=tw6-E-zjmRg,"This short video delves into 'sleep hygiene' as a mental health strategy, highlighting its impact on cognitive function and emotional ...",
🌙  Women TalkingTM Wednesday | Dr. Sarah Vadeboncoeur on Sleep Hygiene for Midlife Women,AuWndXJQMV0,HealthyherLife,2025-01-29T19:27:52Z,https://www.youtube.com/watch?v=AuWndXJQMV0,"Struggling with sleep in your 40s, 50s, or 60s? In this exclusive snippet, Dr. Sarah Vadeboncoeur shares top sleep hygiene tips to ...",
#bollywood #music #travel #sleephygiene #nature #sleepquality #love #soundsleep #mandir se ♥️ 💐,LhkYNEarRlM,Video Venture vloger,2025-03-19T09:48:10Z,https://www.youtube.com/watch?v=LhkYNEarRlM,,
Are You Sleeping Well?,ry19_kFVe_k,newvision ,2025-03-27T15:23:20Z,https://www.youtube.com/watch?v=ry19_kFVe_k,"Sleep is essential for overall health and well-being. It allows the body and mind to rest, repair, and recharge. Quality sleep ...",
Sleep Hygiene: Top 7 Tips for Better Sleep - How to Get 8 Hours of Rest Every Night #sleepissues,Nsz1G-WjHjo,Chill Bytes,2025-01-09T20:20:10Z,https://www.youtube.com/watch?v=Nsz1G-WjHjo,,
Sleep Hygiene,f1YpZrf_UNo,Mindtapestry,2025-01-16T16:28:07Z,https://www.youtube.com/watch?v=f1YpZrf_UNo,"Struggling with poor sleep, restless nights, or low energy? You're not alone. Quality sleep is essential for mental clarity, focus, and ...",
Day 203 Sleep Hygiene   Avoiding Late Night Snacks,T_gafzY733A,Comprehensive Healing Solutions & CHS Foundation,2025-01-18T03:02:06Z,https://www.youtube.com/watch?v=T_gafzY733A,Day 203: Sleep Hygiene - Avoiding Late-Night Snacks Daily Tip: Avoiding heavy snacks late at night improves digestion and ...,
Day 183 Sleep Hygiene   Waking Up Naturally,A8s1kP_4UuU,Comprehensive Healing Solutions & CHS Foundation,2025-01-17T00:32:45Z,https://www.youtube.com/watch?v=A8s1kP_4UuU,Day 183: Sleep Hygiene - Waking Up Naturally Daily Tip: Gradually waking up with natural light or gentle sounds helps your body ...,
6 Simple Sleep Hygiene Tips for Better Rest Tonight 💤✨,tSHwHi2sBqE,Tiny Changes Network,2025-01-18T22:03:43Z,https://www.youtube.com/watch?v=tSHwHi2sBqE,"Struggling to fall asleep or wake up feeling refreshed? ✨ In this video, we share 6 simple yet powerful sleep hygiene tips to ...",
Why Should You Practice Good Sleep Hygiene? - Sleep Wellness Workshop,3YF7DHa5-kw,Sleep Wellness Workshop,2025-01-27T09:25:47Z,https://www.youtube.com/watch?v=3YF7DHa5-kw,Why Should You Practice Good Sleep Hygiene? Unlock the secrets to a better night's sleep with our latest video on sleep hygiene ...,
Unlocking the Power of Sleep! #purevitality,UpknekMOfKw,Pure Vitality,2025-02-08T06:45:01Z,https://www.youtube.com/watch?v=UpknekMOfKw,"Unlocking the Power of Sleep! Unlock the secrets of restorative rest in our latest video, ""Unlocking the Power of Sleep!"" Discover ...",
The Mystery of REM Sleep: Unlocking Dreams,bmbifU8EeRw,Deep psychology,2025-02-09T01:00:23Z,https://www.youtube.com/watch?v=bmbifU8EeRw,"Explore the world of REM sleep and its influence on creativity, memory, and dream experiences. #RemSleep #SleepScience ...",
Cuddle Sleep Health - Boost Your Immune System With Better Sleep    copy,IOcGOxzbOzk,Cuddle Sleep Health,2025-01-21T00:31:21Z,https://www.youtube.com/watch?v=IOcGOxzbOzk,How @cuddlesleep Sleep+ Formula and good sleep hygiene helps boost your immune system.,
✨ Unlock Better Sleep Tonight! 🛌 Top Sleep Hygiene Tips You NEED to Know 😴💤,hcP6DfEj_YE,Alberto Bermudez,2025-01-21T20:37:40Z,https://www.youtube.com/watch?v=hcP6DfEj_YE,Struggling to get a good night's sleep? Let's talk about Sleep Hygiene—a holistic approach to creating healthier bedtime habits ...,
Sleep Hygiene: How to Unlock Your Best Rest for Success,qfvDOyVmVLY,Crafty Genius,2025-01-12T07:11:01Z,https://www.youtube.com/watch?v=qfvDOyVmVLY,"Here's a YouTube video description you can use for ""Sleep Hygiene: How to Unlock Your Best Rest for Success"": Sleep Hygiene: ...",
"Sleep Hygiene: 8 Simple Tips for Better Sleep 🌙 | Improve Your Sleep Tonight!"" #shorts",876pDT4jXac,FitNutrid,2025-01-16T23:42:47Z,https://www.youtube.com/watch?v=876pDT4jXac,Struggling to get quality sleep? Discover 8 effective sleep hygiene tips to improve your sleep and wake up refreshed every ...,
Day 199 Sleep Hygiene   Incorporating Evening Yoga,mzDPsPd4dgc,Comprehensive Healing Solutions & CHS Foundation,2025-01-17T01:20:26Z,https://www.youtube.com/watch?v=mzDPsPd4dgc,"Day 199: Sleep Hygiene - Incorporating Evening Yoga Daily Tip: Gentle yoga before bed relaxes your body and mind, promoting ...",
Day 6 #sleepquality #sleephygiene  #bettermeeveryday #dailychallenge #motivation #health,IocR9-sXpj0,Better Me Every Day,2025-03-05T04:00:19Z,https://www.youtube.com/watch?v=IocR9-sXpj0,"Want to level up your life? Take on this daily challenge and start building better habits, one step at a time! Subscribe for ...",
#SleepBetter #HealthyEating #FoodTips #Nutrition #SleepHygiene,uleMd8mhZP4,Sains Farmasi Official,2025-02-11T21:00:43Z,https://www.youtube.com/watch?v=uleMd8mhZP4,Sleep better and wake up refreshed with our science-backed recommendations on the best foods to eat and avoid before bedtime ...,
Moringa Facts #facts #sleepaid #moringasuperfood #sleepingaid #sleephygiene #psychologyfacts,wCnP5Ax2xUQ,Moringameli,2025-03-15T19:01:08Z,https://www.youtube.com/watch?v=wCnP5Ax2xUQ,,
Importance of sleep hygiene,Cl-bZ4bRmfM,Well-being,2025-03-14T13:00:24Z,https://www.youtube.com/watch?v=Cl-bZ4bRmfM,Importance of sleep hygiene.,
Day 291 Sleep Hygiene   Setting a Morning Sunlight Routine,hUo8ABO0aSM,Comprehensive Healing Solutions & CHS Foundation,2025-01-18T18:21:59Z,https://www.youtube.com/watch?v=hUo8ABO0aSM,Day 291: Sleep Hygiene - Setting a Morning Sunlight Routine Daily Tip: Exposing yourself to sunlight in the morning supports ...,
Day 139 Sleep Hygiene   Preparing for a Regular Sleep Routine,G6FojJuGB50,Comprehensive Healing Solutions & CHS Foundation,2025-01-16T21:39:11Z,https://www.youtube.com/watch?v=G6FojJuGB50,Day 139: Sleep Hygiene - Preparing for a Regular Sleep Routine Daily Tip: Consistency in your sleep schedule promotes better ...,
""" Top 3 Sleep Hygiene Tips for Better Rest & Balanced Blood Sugar """,8EODgMENWJ8,Sugar Balance Hub,2025-01-04T16:28:05Z,https://www.youtube.com/watch?v=8EODgMENWJ8,sugarbalancehub.,
Not able to sleep ? #sleep #sleepbetter #sleepaid #shorts #viralshorts,n5ZH9641lcM,FactzEdu,2025-03-20T07:00:38Z,https://www.youtube.com/watch?v=n5ZH9641lcM,What are the best natural sleep aids? How to sleep better? How can I improve my sleep quality naturally? What is the best remedy ...,
Day 131 Sleep Hygiene   Incorporating Evening Aromatherapy,lv_icRgRgFo,Comprehensive Healing Solutions & CHS Foundation,2025-01-16T21:24:35Z,https://www.youtube.com/watch?v=lv_icRgRgFo,Day 131: Sleep Hygiene - Incorporating Evening Aromatherapy Daily Tip: Aromatherapy before bed relaxes your body and mind ...,
SLEEP HYGIENE,VG3JyvkIIYk,Bhushan Kumar,2025-02-12T16:18:09Z,https://www.youtube.com/watch?v=VG3JyvkIIYk,ways to sleep good.,
#ADHD & Sleep: Combatting #Insomnia with Better Routines #SleepHygiene,TCREjrsZ90M,Mindset Remix +,2025-03-08T15:02:04Z,https://www.youtube.com/watch?v=TCREjrsZ90M,ADHD & Sleep: Combatting #Insomnia with Better Routines #SleepHygiene.,
How Poor Sleep Impacts Your Mind: Tips for Better Sleep Hygiene,tQWNZlGRJ60,Brain Buzz,2025-01-15T23:00:52Z,https://www.youtube.com/watch?v=tQWNZlGRJ60,How Poor Sleep Impacts Your Mind: Tips for Better Sleep Hygiene Description Struggling with poor sleep? Insufficient sleep and ...,
Want Better Sleep? Check out These 5 Tips. #SleepHygiene #SleepBetter #HealthyHabits #RestWell,vkyrc6GDsVw,Slow Mel,2025-03-10T05:00:50Z,https://www.youtube.com/watch?v=vkyrc6GDsVw,Struggling with sleep? Join us as we explore five practical tips for better sleep hygiene! From limiting screen time to creating a ...,
Day 47 Sleep Hygiene   The Benefits of Reading Before Bed,48IAYXpf_e0,Comprehensive Healing Solutions & CHS Foundation,2025-01-15T20:37:45Z,https://www.youtube.com/watch?v=48IAYXpf_e0,Day 47: Sleep Hygiene - The Benefits of Reading Before Bed Daily Tip: Reading before bed relaxes your mind and reduces stress ...,
"Sleep Hygiene :Tips for better sleep, creating a sleep-friendly environment, and overcoming insomnia",VPIVXpsxmBg,glow & grow,2025-03-10T03:43:05Z,https://www.youtube.com/watch?v=VPIVXpsxmBg,"Struggling to get a good night's rest? This video is packed with tips for better sleep, how to create a sleep-friendly environment, ...",
Simple Tips for Better Sleep Hygiene,PVwOCdeb6_8,Southern CBD Company,2025-01-12T15:15:03Z,https://www.youtube.com/watch?v=PVwOCdeb6_8,Improve your sleep quality with these simple tips for better sleep hygiene. This video covers effective habits like maintaining a ...,
"Sleep hygiene, follow the steps 🤍 #insomnia #mentalhealth #psychiatry",9DrTQPgw9zE,Dr.TalaDarabkeh,2025-03-09T07:34:16Z,https://www.youtube.com/watch?v=9DrTQPgw9zE,,
#adhd #sleep #ptsd #mentalhealth,9iTTdiyhcwY,Elisa James777,2025-03-23T10:18:46Z,https://www.youtube.com/watch?v=9iTTdiyhcwY,"For individuals with ADHD, sleep challenges are common, and a racing mind is a frequent culprit, making it difficult to fall asleep ...",
Sleep Hygiene: Tips for Better Sleep and Restful Nights!,nmzgXWifGJc,Healtharious,2025-03-13T23:15:03Z,https://www.youtube.com/watch?v=nmzgXWifGJc,"Struggling to get a good night's sleep? In this video, we share essential sleep hygiene tips to help you improve your sleep quality ...",
How Do You Practice Sleep Hygiene? - Oncology Support Network,gJBPQ_GGDDc,Oncology Support Network,2025-03-26T06:01:03Z,https://www.youtube.com/watch?v=gJBPQ_GGDDc,"How Do You Practice Sleep Hygiene? In this informative video, we'll discuss the concept of sleep hygiene and how simple ...",
What Is Sleep Hygiene? - Sleep Wellness Workshop,kVZrKKY9XEw,Sleep Wellness Workshop,2025-01-15T07:45:02Z,https://www.youtube.com/watch?v=kVZrKKY9XEw,"What Is Sleep Hygiene? In this informative video, we'll discuss the concept of sleep hygiene and how it can lead to better rest and ...",
Day 341 Sleep Hygiene   Setting a Screen Free Hour Before Bed,MWhtOYWBtek,Comprehensive Healing Solutions & CHS Foundation,2025-01-19T17:57:41Z,https://www.youtube.com/watch?v=MWhtOYWBtek,"Day 341: Sleep Hygiene - Setting a ""Screen-Free Hour"" Before Bed Daily Tip: Avoiding screens before bed reduces blue light ...",
Day 111 Sleep Hygiene   Evening Stretch Routine,iydxBwE2gdg,Comprehensive Healing Solutions & CHS Foundation,2025-01-16T19:20:39Z,https://www.youtube.com/watch?v=iydxBwE2gdg,Day 111: Sleep Hygiene - Evening Stretch Routine Daily Tip: A gentle stretch routine before bed relaxes your muscles and ...,
Day 251 Sleep Hygiene   Trying a Weighted Eye Mask,IeDzZez91bw,Comprehensive Healing Solutions & CHS Foundation,2025-01-18T06:24:42Z,https://www.youtube.com/watch?v=IeDzZez91bw,Day 251: Sleep Hygiene - Trying a Weighted Eye Mask Daily Tip: A weighted eye mask provides gentle pressure that can help ...,
What Are the Best Sleep Hygiene Rules to Follow? | Sleep Wellness Workshop,-F6W4miv_1c,Sleep Wellness Workshop,2025-01-25T01:28:56Z,https://www.youtube.com/watch?v=-F6W4miv_1c,What Are the Best Sleep Hygiene Rules to Follow? Are you looking to enhance your sleep experience and wake up feeling ...,
Top Tips for Better Sleep #SleepHygiene #HealthySleeping #Wellness #MindfulLiving #SleepWell,3An-En72Hww,Slow Mel,2025-03-24T05:00:02Z,https://www.youtube.com/watch?v=3An-En72Hww,"Welcome back! Today, we're diving into five key tips for practicing good sleep hygiene and enhancing your sleep experience.",
Start of Fixing My Sleep Schedule | Journal Entry #4,6c8QnnDvLz0,Dip into Wellness,2025-02-10T21:49:01Z,https://www.youtube.com/watch?v=6c8QnnDvLz0,"Sleep is important—duh. But actually getting consistent sleep? That's where I struggle. Right now, my sleep schedule is all over ...",
What is the role of sleep hygiene in overall wellness,b-CM3p14XXE,What is and How to ,2025-02-19T21:24:29Z,https://www.youtube.com/watch?v=b-CM3p14XXE,"Good sleep is crucial for mental and physical well-being. In this video, we explore the science of sleep hygiene—how bedtime ...",
#music #food #facts #foodfacts #health #sleephygiene #healthylifestyle,zixVX7Ql_aw,Nutritional_values_,2025-03-26T15:55:06Z,https://www.youtube.com/watch?v=zixVX7Ql_aw,,
🌙 Trouble Sleeping? Try Natural Sounds! 🛌  #SleepHygiene #NatureSounds #BetterSleep #CalmVine,uiWOeBIGePI,CalmVibe Audio & Video,2025-02-17T20:08:12Z,https://www.youtube.com/watch?v=uiWOeBIGePI,,
Sleep hygiene advice for insomnia (and why it doesn’t work),MzZBzfGEU-0,Ivo 🌜Former Insomniac,2025-01-15T11:30:37Z,https://www.youtube.com/watch?v=MzZBzfGEU-0,"When we have insomnia, we often try many things to sleep better, spending time, energy, and money on different methods.",
Day 320 Sleep Hygiene   Trying Bedtime Aromatherapy,o4AYxvPc32s,Comprehensive Healing Solutions & CHS Foundation,2025-01-19T17:30:05Z,https://www.youtube.com/watch?v=o4AYxvPc32s,Day 320: Sleep Hygiene - Trying Bedtime Aromatherapy Daily Tip: Using calming scents before bed promotes relaxation and ...,
Sleep Hygiene,U26b7d4Q4YY,Therapy No Stress - Topic,2025-03-19T23:02:27Z,https://www.youtube.com/watch?v=U26b7d4Q4YY,Provided to YouTube by eMuzyka Sleep Hygiene · Therapy No Stress Quieting the Ringing for a Peaceful Mind ℗ 2025 Silgoa ...,
Day 15 Sleep Hygiene   Powering Down Electronics,ECPB1v5lhTM,Comprehensive Healing Solutions & CHS Foundation,2025-01-15T19:48:16Z,https://www.youtube.com/watch?v=ECPB1v5lhTM,Day 15: Sleep Hygiene - Powering Down Electronics Daily Tip: Turning off screens an hour before bed improves sleep quality by ...,
Can Exercise Improve Sleep Hygiene? - Oncology Support Network,2-nEVh4NBxY,Oncology Support Network,2025-03-18T11:15:11Z,https://www.youtube.com/watch?v=2-nEVh4NBxY,"Can Exercise Improve Sleep Hygiene? Have you ever struggled to get a good night's sleep? In this informative video, we'll ...",
Day 103 Sleep Hygiene   Winding Down with Reading,PZ1ZlGlY1ks,Comprehensive Healing Solutions & CHS Foundation,2025-01-16T19:07:48Z,https://www.youtube.com/watch?v=PZ1ZlGlY1ks,Day 103: Sleep Hygiene - Winding Down with Reading Daily Tip: Reading before bed helps your mind transition from activity to ...,
Sleep & Mental Health | Mental Health #shorts #viralshorts #sleephygiene,te_hWksx_M4,Adam's Health,2025-02-26T13:30:38Z,https://www.youtube.com/watch?v=te_hWksx_M4,"Poor sleep = poor mental health. How does mental health shape our actions? This short reveals real-life examples ""Sleep ...",
Day 9 - Sleep Hygiene,WMVCKG-xVlo,European Learning Hub,2025-03-15T19:22:22Z,https://www.youtube.com/watch?v=WMVCKG-xVlo,Welcome to Day 9 of the Rise and Shine Well-being Challenge. Struggling with sleep? Learn practical tips to improve your ...,
Five steps to maintain Sleep Hygiene 😴✅ #tips #educational #health,j-bY2FWsUjI,Wellness Waves,2025-02-21T13:35:24Z,https://www.youtube.com/watch?v=j-bY2FWsUjI,"Health,health tips,educational,wellness waves,tips,Sleep,five steps.",
Day 43 Sleep Hygiene   Avoiding Heavy Meals Before Bed,rmE-1clcq-Y,Comprehensive Healing Solutions & CHS Foundation,2025-01-15T20:33:08Z,https://www.youtube.com/watch?v=rmE-1clcq-Y,Day 43: Sleep Hygiene - Avoiding Heavy Meals Before Bed Daily Tip: Eating heavy meals late at night can disrupt your sleep.,
#animation #bettersleep #soundtrack #sleephygiene #sleepsolution #sleepquality #aiart #audio,BD6KLYvtCqI, by xzaza,2025-03-28T09:12:22Z,https://www.youtube.com/watch?v=BD6KLYvtCqI,,
Harnessing the Benefits of Sleep Hygiene on Mental and Physical Health,pZnI7Bh_f48,NutriMind&FitBody,2025-03-04T01:00:43Z,https://www.youtube.com/watch?v=pZnI7Bh_f48,"Explore how optimal sleep hygiene supports mental and physical health by regulating mood, enhancing cognitive function, and ...",
