Title,Video ID,Channel,Published At,URL,Description,Video Length,Views,Likes,Comments
Balanced diet is key! 🥗🍽️,ZPLlY1VoCuw,Dr. Shilpa Arora,2025-03-31T11:35:31Z,https://www.youtube.com/watch?v=ZPLlY1VoCuw,Ensure your mind is at peace while eating to fully absorb nutrients. . Avoid distractions and eat mindfully. . Follow @dr.shilpaarora ...,41,2048786,72767,290
✅ காலையில் தண்ணீர் குடிப்பதால்... 💥||#ShreeShathaka_NutriDiet 🍎 #Diet #Nutrition #viralvideo,cDAGbH9eyVo,Shree Shathaka Nutri Diet ,2025-03-31T04:30:29Z,https://www.youtube.com/watch?v=cDAGbH9eyVo,Welcome to @ShreeShathaka_NutriDiet Hashtag us:- #Shreeshathaka_NutriDiet #nutrition #dietetics #mealplans ...,22,777,2,0
Oil-Free Diets: Benefits and Drawbacks Explained,PzBZWLGw9UE,Medindia Videos,2025-03-31T04:20:38Z,https://www.youtube.com/watch?v=PzBZWLGw9UE,Exploring the oil-free diet trend? This dietary approach promises benefits like weight loss and improved heart health but comes ...,28,907,7,0
5 Fruits To Eat Every Morning #health #wellness #diet #nutrition #fruit,H0RX884QNs8,LongevityLab,2025-03-31T00:37:24Z,https://www.youtube.com/watch?v=H0RX884QNs8,Here are 5 fruits you can eat every morning for health and wellness Disclaimer: Eating these fruits alongside a balanced diet can ...,43,26332,445,3
A well balanced diet? 😮‍💨,5UdsiuOwU7U,Jack Meets World,2025-03-30T15:08:34Z,https://www.youtube.com/watch?v=5UdsiuOwU7U,,8,13810571,420879,1969
Myths about weight loss #nutrition #bodytransformation #viralvideo,A5f5bOZCrM4,Yuliya Longevity ,2025-03-30T14:09:43Z,https://www.youtube.com/watch?v=A5f5bOZCrM4,5 real rules that actually help you lose weight: ✓ Eat a balanced diet and aim for a small calorie deficit (100–200 calories) ✓ Add ...,23,2225,26,1
Healthy Food Combos for a Balanced Diet,W6ewPlItql0,Earthistry 🌱,2025-03-30T02:00:20Z,https://www.youtube.com/watch?v=W6ewPlItql0,"Looking for healthy and tasty food combos? In this video, we've got you covered! These combinations offer the perfect balance of ...",,,,
Indian Thali from each culture offer balanced nutrition,UGjuR4bIe_4,Shammis Yogalaya,2025-03-29T12:35:50Z,https://www.youtube.com/watch?v=UGjuR4bIe_4,,18,1302,7,0
Gut Health = Good Health! #health #fitness #nutrition #tips,gsMLOy6fUuQ,The Health Lab,2025-03-29T11:01:01Z,https://www.youtube.com/watch?v=gsMLOy6fUuQ,"Watch Gut Health = Good Health! Did you know your gut health affects more than just digestion? In this video, we dive into why gut ...",53,23,2,0
Six antioxidant foods #AntiAging #HealthyEating #Nutrition #Superfoods #Longevity #health #healthy,l2iI0EqZE4o,Ageless Science,2025-03-29T08:00:42Z,https://www.youtube.com/watch?v=l2iI0EqZE4o,"Want to boost your health with natural antioxidants? These 6 powerhouse foods fight free radicals, reduce inflammation, and keep ...",20,708,22,0
#”The Path to a Healthier Life: Embracing Wellness Every Day”,4or9tZma2yA,Sunitha 1003vlogs,2025-03-26T14:30:04Z,https://www.youtube.com/watch?v=4or9tZma2yA,"A healthy lifestyle involves making choices that promote physical, mental, and emotional well-being. It includes balanced nutrition, ...",6,39086,103,0
Unlocking the Secrets of Balanced Nutrition,o7wmMO__X1w,DynamicRecov,2025-03-26T08:03:44Z,https://www.youtube.com/watch?v=o7wmMO__X1w,Unlocking the Secrets of Balanced Nutrition.,31,449,3,0
Week 6: Boost Breakfast with Balanced Nutrition,ou76hP_3akU,Emrah_14,2025-03-26T00:00:43Z,https://www.youtube.com/watch?v=ou76hP_3akU,"Week 6 of the meal planning series centers on convenient, nutritious breakfast recipes ideal for a busy lifestyle. #MealPlanning ...",41,6,1,0
🥗🍠 Balanced nutrition = balance in life!#nutrition #healthyeating #fitnessmotivation #eatclean,lJrHo0leDyM,Alphabet Grown,2025-03-24T12:42:27Z,https://www.youtube.com/watch?v=lJrHo0leDyM,,24,429,0,0
Achieve your goals with balanced nutrition #weightloss #lowcaloriesnacks #food,SLZeyoJ7l84,Isabela Ferreira Rocha,2025-03-23T19:32:02Z,https://www.youtube.com/watch?v=SLZeyoJ7l84,Achieve your goals with balance #weightloss #lowcaloriesnacks #food #fitness #fok.,23,439,17,0
"Nutrition that keeps your body in balance, gives you strength 💪 #balancednutrition  #hormonalbalance",QsBDHyMjRRY,Alphabet Grown,2025-03-22T20:25:10Z,https://www.youtube.com/watch?v=QsBDHyMjRRY,,23,48,0,0
Boost Your Health  The Power of Balanced Nutrition,S_dRGwU3cXc,Ask FitTech,2025-03-21T07:34:00Z,https://www.youtube.com/watch?v=S_dRGwU3cXc,"Welcome to Ask FitTech, where we explore the latest in health, wellness, and biohacking to help you optimize your life!",37,44,1,0
Fuel Your Kids: Balanced Nutrition Guide,Gf5GzplACKA,unitedtechnofit,2025-03-20T22:13:25Z,https://www.youtube.com/watch?v=Gf5GzplACKA,Unlock the secrets to a balanced diet for your kids! #HealthyKids #NutritionTips #BalancedDiet #ChildHealth #ParentingHacks ...,80,1,0,0
Balanced Nutrition for Happy Hens | Country Living UK,Wl226_gQgiY,Country Living UK,2025-03-20T11:15:15Z,https://www.youtube.com/watch?v=Wl226_gQgiY,See more at https://www.countryliving.com/uk/ Like us on Facebook: https://www.facebook.com/countrylivinguk/ Follow us on ...,32,151,4,0
Ultimate Guide to Balanced Nutrition for Beginners,cGXN0LMr1oA,Change Your Life Today ,2025-03-19T18:00:28Z,https://www.youtube.com/watch?v=cGXN0LMr1oA,Ultimate Guide to Balanced Nutrition for Beginners Ultimate Guide to Balanced Nutrition for Beginners | Healthy Eating Made ...,174,0,0,0
Encouraging Balanced Nutrition and Physical Activity,Oro4S8QdbCk,"Tiny Steps, Big Adventures: The Parenting Playbook",2025-03-19T16:00:32Z,https://www.youtube.com/watch?v=Oro4S8QdbCk,"Raise Happy, Healthy Kids with Balanced Nutrition & Fun Physical Activity!** Want to set your child up for a lifetime of health ...",195,4,0,0
Balanced nutrition is key to maintaining health and energy after 50. Part 2?,bfxd3YuF9MU,lika,2025-03-19T12:03:33Z,https://www.youtube.com/watch?v=bfxd3YuF9MU,,36,0,0,0
Weight loss daily vlog Reasonable diet balanced nutrition Diet for children to lose weight Share,gn6aIzqQeGw,Amazing ASMR 315,2025-03-19T11:28:23Z,https://www.youtube.com/watch?v=gn6aIzqQeGw,Weight loss daily vlog Reasonable diet balanced nutrition Diet for children to lose weight Share.,35,128,5,0
Healthy Balanced Nutrition Breakfast for kids!  #shorts,7V4PJodGidY,Goody Food Kitchen,2025-03-18T16:57:48Z,https://www.youtube.com/watch?v=7V4PJodGidY,,18,528,12,0
Malindi Balanced Nutrition For Healthy Teeth & Gums,n3biRrIO0ps,Dental Awareness Malindi Center,2025-03-18T13:19:30Z,https://www.youtube.com/watch?v=n3biRrIO0ps,Balanced nutrition plays a pivotal role in maintaining the health of your teeth and gums by providing the essential nutrients ...,58,0,0,0
Pro360 | BALANCED NUTRITION FOR A BALANCED LIFE,dcveJSmqrF8,Pro360 India,2025-03-18T13:00:58Z,https://www.youtube.com/watch?v=dcveJSmqrF8,SHOP NOW : www.pro360.shop #minature #minatureworld #fitness #healthy #minecraft #protein #manufacturing #manufacturer ...,34,285,16,0
Unlocking Vibrant Health  The Power of Balanced Nutrition,LKoTra3XsmE,Ask FitTech,2025-03-18T07:16:37Z,https://www.youtube.com/watch?v=LKoTra3XsmE,"Welcome to Ask FitTech, where we explore the science of health, wellness, and biohacking to help you unlock your full potential!",65,5,1,0
From Fast-Food Reliance to Balanced Nutrition Advocate: Jake's Journey,dJ0qUqlv4Vo,Beyond Before&After,2025-03-18T00:00:36Z,https://www.youtube.com/watch?v=dJ0qUqlv4Vo,"Jake's journey from fast-food dependency to balanced nutrition exemplifies resilience and success, culminating in an 85-pound ...",,,,
Mastering Balanced Nutrition  Simple Choices for a Healthier You,PAEMLZHy0XU,Ask FitTech,2025-03-17T14:30:07Z,https://www.youtube.com/watch?v=PAEMLZHy0XU,"Welcome to Ask FitTech! In this video, we dive into the essentials of Mastering Balanced Nutrition: Simple Choices for a Healthier ...",21,2,0,0
Balanced Nutrition for the Picky Eaters | Mediclinic Middle East,qrPtlFdU6w0,Mediclinic Middle East,2025-03-17T12:01:43Z,https://www.youtube.com/watch?v=qrPtlFdU6w0,"At Mediclinic Al Mussafah, we help you manage your child's picky eating habits. Listen to Dr. Mohamed Laban, Consultant ...",75,16,1,0
"Daily weight loss vlog, reasonable diet and balanced nutrition, what to eat for a slightly fat b",fZzFsWTVXhY,Amazing ASMR 315,2025-03-17T11:27:27Z,https://www.youtube.com/watch?v=fZzFsWTVXhY,"Daily weight loss vlog, reasonable diet and balanced nutrition, what to eat for a slightly fat b.",39,101,2,0
📌 Balanced Nutrition: The Right Quality & Quantity of Food for a Healthy Body #Natxtra #doctor,ejYp3W-7hkg,NatXtra,2025-03-17T06:47:51Z,https://www.youtube.com/watch?v=ejYp3W-7hkg,"Eating the right food in the right amounts is key to maintaining a healthy body. In this video, we explore the essential components ...",39,87,3,0
"Daily weight loss vlog, reasonable diet and balanced nutrition, eat thin but not hungry, what sh",jC6GeKCa6Bc,Amazing ASMR 315,2025-03-16T07:24:03Z,https://www.youtube.com/watch?v=jC6GeKCa6Bc,"Daily weight loss vlog, reasonable diet and balanced nutrition, eat thin but not hungry, what sh.",21,456,11,0
Are You Eating Too Much Fruit? The Key to Balanced Nutrition ft. Dr. Joel Fuhrman,9va9clhu_Mw,The Glen Merzer Show,2025-03-16T00:00:13Z,https://www.youtube.com/watch?v=9va9clhu_Mw,Can a diet too high in fruit or rice be unhealthy—especially as we age? Dr. Joel Fuhrman explains the importance of protein ...,49,440,21,0
Text to video 丨 1  Balanced Nutrition Eating a nutritious diet fuels your body a,qq1sMhPw7yM,Ahmed's2025,2025-03-15T21:34:36Z,https://www.youtube.com/watch?v=qq1sMhPw7yM,1. Balanced Nutrition Eating a nutritious diet fuels your body and strengthens your immune system. Aim for: ✓ Whole foods like ...,6,0,0,0
Balanced nutrition after a workout is essential | YannaFitness,OzRi8SSyT9A,Maria Anthea - Coach “Yanna”,2025-03-14T13:04:47Z,https://www.youtube.com/watch?v=OzRi8SSyT9A,,21,519,8,0
"Today's breakfast, a reasonable diet and balanced nutrition, what should a little fat boy eat in",h5--B1Anb7k,Amazing ASMR 315,2025-03-13T23:27:31Z,https://www.youtube.com/watch?v=h5--B1Anb7k,"Today's breakfast, a reasonable diet and balanced nutrition, what should a little fat boy eat in.",20,234,8,0
Are you eating carbs loaded Breakfast? Try This Balanced Nutrition Breakfast instead! #shorts,nCI4-d9Hod8,Goody Food Kitchen,2025-03-12T17:10:35Z,https://www.youtube.com/watch?v=nCI4-d9Hod8,,14,337,13,2
How can you help your dog thrive #Nutrition #Gut health #Balanced nutrition #Maintain the gut microe,4Lzs5U9GyZA,DailyAvisFinds,2025-03-11T17:47:29Z,https://www.youtube.com/watch?v=4Lzs5U9GyZA,,21,13,0,0
Building Resilience through Balanced Nutrition,QarrYBwzuzQ,Dailydose,2025-03-10T00:00:31Z,https://www.youtube.com/watch?v=QarrYBwzuzQ,"Explore the connection between nutrition and mental resilience, featuring Dr. Mark Jensen and Clara's journey to balanced ...",44,0,0,0
Fuel your day with balanced nutrition,0CQEUQGD9Ic,Kimberly Walker,2025-03-09T03:15:00Z,https://www.youtube.com/watch?v=0CQEUQGD9Ic,Boost your nutrition #fok.,23,55,1,0
Quick workout + balanced nutrition = my fit mom life! #busymomsgetfit #healthyhabits,lq4QIqmcpgA,Flavie Fit Life ,2025-03-08T23:16:46Z,https://www.youtube.com/watch?v=lq4QIqmcpgA,"Woke up to sunshine, made a smoothie, and got in some good stretches—starting the day the right way! ✓As a busy mom, I know ...",50,508,14,0
"❌ Stop dieting, start thriving Balanced nutrition is your key to feeling great #balance#healthyfood",TNlBJZPYgBc,Amanda Ynal,2025-03-08T11:34:10Z,https://www.youtube.com/watch?v=TNlBJZPYgBc,"Immunity Vitamins C, D, zinc, and antioxidants protect you from viruses and stress Beauty Healthy hair, skin, and nails - Yep, ...",23,473,8,0
#lowcarbs  #sugarfree  #healthyfood  #nutrition  #balancednutrition #sugarcontrol,ZIDkoDChZ6Q,Samanta,2025-03-08T08:57:02Z,https://www.youtube.com/watch?v=ZIDkoDChZ6Q,,34,15,0,0
FAJR BREEZE DAY 6: BALANCED NUTRITION: THE PROPHETIC DIET,U8WK5HZEGWU,Bushrah Olagunju-Matemilola,2025-03-06T04:23:35Z,https://www.youtube.com/watch?v=U8WK5HZEGWU,"Are you aware that if you take sahur the right way and in the way prescribed by the prophet, it becomes a rewardable act of ...",142,774,87,9
Balanced Nutrition for PCOS: What’s Important to Include in Your Diet,OGxaGrW3vEA,Dona Dell,2025-03-04T19:37:16Z,https://www.youtube.com/watch?v=OGxaGrW3vEA,"7. Staying hydrated supports digestion, blood sugar regulation, and metabolism. 8. Healthy fats from avocado, nuts, and seeds ...",29,2,1,0
The Importance Of Balanced Nutrition?,igsxiJ84g8Q,How To Go Good Health,2025-03-04T11:52:14Z,https://www.youtube.com/watch?v=igsxiJ84g8Q,The Importance Of Balanced Nutrition?#viralvideo #youtubeshorts #health.,63,63,4,0
The Importance of Balanced Nutrition for Health?,P2jhN2_gcxc,How To Go Good Health,2025-03-04T11:40:56Z,https://www.youtube.com/watch?v=P2jhN2_gcxc,The Importance of Balanced Nutrition for Health?#viralvideo.,,,,
The Importance of Balanced Nutrition for Health?,TmvW0dFJPT8,How To Go Good Health,2025-03-04T11:14:39Z,https://www.youtube.com/watch?v=TmvW0dFJPT8,The Importance of Balanced Nutrition for Health?#goodhealth#better Health.,,,,
💪✨ The art of balanced nutrition  ! #EatRight #StayFit #HealthyLiving @farzana life style coach,FjrM5SyEtpE,Farzana lifestyle coach ,2025-03-04T04:23:02Z,https://www.youtube.com/watch?v=FjrM5SyEtpE,,52,38,4,1
"The dog's own puppy rice, raw flesh and blood formula, balanced nutrition, arrangement!  , Recomme",kYOdf51JfK0,Yug devani,2025-03-03T13:36:46Z,https://www.youtube.com/watch?v=kYOdf51JfK0,"The dog's own puppy rice, raw flesh and blood formula, balanced nutrition, arrangement! , Recommended dog snacks, dog ...",21,427,11,0
"Maifudi Nutrition Forest Meat and Vegetarian Forest with balanced nutrition and palatability, go",2ATtI-eUyn0,TiMi TV,2025-03-02T01:46:17Z,https://www.youtube.com/watch?v=2ATtI-eUyn0,"Maifudi Nutrition Forest Meat and Vegetarian Forest with balanced nutrition and palatability, go.",20,959,19,0
The Role of Calcium in Balanced Nutrition for Mental and Physical Health,pC-kkbbabBQ,NutriMind&FitBody,2025-03-02T01:00:41Z,https://www.youtube.com/watch?v=pC-kkbbabBQ,"This script explores calcium's role in mental and physical health, highlighting its impact on bone strength and neurological ...",42,1,0,0
The importance of balanced nutrition,OKNozv1Md0Q,Nella Banjarnahor,2025-03-01T13:39:37Z,https://www.youtube.com/watch?v=OKNozv1Md0Q,,54,11,0,0
Role of Tryptophan in Balanced Nutrition for Mental and Physical Health,Rc5Xh_ZQ3a8,NutriMind&FitBody,2025-02-28T01:00:21Z,https://www.youtube.com/watch?v=Rc5Xh_ZQ3a8,"Exploring how tryptophan, an essential amino acid, influences mental and physical health through serotonin production, mood ...",39,9,1,0
Balanced Nutrition: Keeping Your Cat Healthy  #CatPaw #Cat#fluffy#interestingAboutCats#RareFacts,U4AXBJEEt00,Cat Paw,2025-02-25T19:32:41Z,https://www.youtube.com/watch?v=U4AXBJEEt00,A well-balanced diet is essential for your cat's overall health and longevity. Choosing high-quality commercial food or carefully ...,42,476,17,0
Sunlight and Mental Health: A Balanced Nutrition Perspective,hWMfMR_OGN8,NutriMind&FitBody,2025-02-25T01:00:39Z,https://www.youtube.com/watch?v=hWMfMR_OGN8,Exploring the correlation between sunlight exposure and mental health within a balanced nutrition context. Discover how vitamin ...,56,2,1,0
Balanced Nutrition for a Healthy Dog  #DogPaws #DogLovers#DogWorld#PuppyLove,OVeR3Rey1HA,Dog Paws,2025-02-24T20:05:26Z,https://www.youtube.com/watch?v=OVeR3Rey1HA,"Providing your dog with a well-balanced diet is crucial for their health, energy, and longevity. The right food should match their ...",40,33,3,0
The Role of Selenium in Balanced Nutrition for Mental and Physical Health,QeAZ4aAncZg,NutriMind&FitBody,2025-02-24T01:00:30Z,https://www.youtube.com/watch?v=QeAZ4aAncZg,"Explores selenium's role in supporting cognitive function and preventing oxidative damage, contributing to balanced nutrition.",42,7,2,0
Are Vegetables Really Poison? Balanced nutrition with Dr. Tygran,05tIaLAzSLQ,Dr.Tygran,2025-02-23T10:00:01Z,https://www.youtube.com/watch?v=05tIaLAzSLQ,"Guys! Follow the balanced nutrition. If there is a space for vegetables in your balanced nutrition, please eat them. The most ...",52,529,8,3
The Role of Iodine in Balanced Nutrition for Mental and Physical Health,PbhC5tCXVfM,NutriMind&FitBody,2025-02-23T01:00:19Z,https://www.youtube.com/watch?v=PbhC5tCXVfM,"Explore the impact of iodine, a vital but often overlooked nutrient, on mental and physical health. #Iodine #MentalHealth ...",42,9,2,0
"Maifudi Nutrition Forest Meat and Vegetarian Forest with balanced nutrition and palatability, go",uWn6ludsbXk,TiMi TV,2025-02-23T00:19:00Z,https://www.youtube.com/watch?v=uWn6ludsbXk,"Maifudi Nutrition Forest Meat and Vegetarian Forest with balanced nutrition and palatability, go.",25,449,9,0
Meat Myths DEBUNKED! Balanced Nutrition Tips,M279IqMkrhc,GlobalNatureBeats,2025-02-21T16:04:27Z,https://www.youtube.com/watch?v=M279IqMkrhc,Discover the secrets to balanced nutrition! We explore the importance of balanced eating and debunk common myths about meat.,28,14,0,0
This combination of fruits and foods ensures balanced nutrition and optimal health! #shorts,3Cx5geZ86wc,SecretsToHealthyFitLife,2025-02-20T07:00:01Z,https://www.youtube.com/watch?v=3Cx5geZ86wc,This combination of fruits and foods is the perfect blend to ensure balanced nutrition and optimal health. By pairing nutrient-dense ...,70,24,0,0
Energize with HITT Boxing and Balanced Nutrition,tjmr9k9OS_0,fitlifefusion,2025-02-20T01:00:44Z,https://www.youtube.com/watch?v=tjmr9k9OS_0,"Discover HIIT Boxing, a dynamic workout combining high-energy drills with nutrition to boost physical and mental health.",46,1,0,0
The Role of Probiotics and Prebiotics in Balanced Nutrition for Mental and Physical Health,qxwCmagvC-4,NutriMind&FitBody,2025-02-20T01:00:45Z,https://www.youtube.com/watch?v=qxwCmagvC-4,"Explore how probiotics and prebiotics enhance mental and physical health by improving gut microbiota, boosting mood, and ...",44,1,2,0
6 Healthy Meal Prep Idea for Busy weekdays#nutrition #healthyfood #balancednutrition,FeHh9-NUNRQ,Vibrant Life Habits ,2025-02-19T18:00:19Z,https://www.youtube.com/watch?v=FeHh9-NUNRQ,"Are you struggling to eat healthily during your busy week? We've got you covered! In this video, we're sharing 10 Healthy Meal ...",89,3,1,0
Balanced Nutrition | Good Diet #food #weightloss #balanceddiet,TbyYPre8XtA,PeakFit...Health & Safety Journey,2025-02-19T12:40:10Z,https://www.youtube.com/watch?v=TbyYPre8XtA,PeakFitJourney2.,16,33,6,0
The Importance of Balanced Nutrition:A Guide to Healthy Eating #earlynutrition #healthyfeeding,hwTWfx7YkVA,Gagan Health and Wellness,2025-02-18T16:11:30Z,https://www.youtube.com/watch?v=hwTWfx7YkVA,This video explores the importance of balanced nutrition and the role of nutritional supplements in supporting overall health and ...,67,33,0,0
The Importance of Balanced Nutrition Why Tuna Alone is Not EnoughAs any cat parent...,oUmkNKNkUAQ,Edward Lance Lorilla,2025-02-18T00:39:45Z,https://www.youtube.com/watch?v=oUmkNKNkUAQ,Explore now at ...,59,9,0,0
Balanced nutrition,LPzoLM8yAyM,Roong Nun,2025-02-17T06:41:59Z,https://www.youtube.com/watch?v=LPzoLM8yAyM,,53,487,7,0
balanced nutrition,AUFeAvulA_g,Roong Nun,2025-02-17T06:30:28Z,https://www.youtube.com/watch?v=AUFeAvulA_g,,127,2,0,0
Are You Making Balanced Nutrition Decisions?,R8QmN8fBVSE,The Healthy Quiz ,2025-02-16T19:00:24Z,https://www.youtube.com/watch?v=R8QmN8fBVSE,"From portion control to food swaps, this quiz will reveal how well you know the secrets to healthy eating. #HealthyLiving ...",59,0,0,0
Preventing obesity with balanced nutrition #goodhealth,g3314LFnsM8,Healthy Roots Journey,2025-02-16T12:30:38Z,https://www.youtube.com/watch?v=g3314LFnsM8,Another chronic condition that has strong ties to nutrition is obesity. Our risk of accumulating excess weight goes up when we eat ...,26,211,0,0
Stay healthy and hydrated with balanced nutrition during Ramadan. 🌙🥗,nHzprawF6mE,Adeeba Tour and Travels,2025-02-16T06:30:19Z,https://www.youtube.com/watch?v=nHzprawF6mE,Call Adeeba Tour and Travels to book your Umrah package in the holy month. #ramadanfasting #HealthyFasting ...,35,452,37,0
The Secret to Balanced Nutrition – Fuel Your Body the Right Way!,cHZL3KVj6ko,EECP FHCC (EECP FHCC),2025-02-14T05:30:14Z,https://www.youtube.com/watch?v=cHZL3KVj6ko,"The Secret to Balanced Nutrition – Fuel Your Body the Right Way! Welcome to *Effectiveness*! In this video, we reveal the secret ...",100,58,2,0
What is balanced nutrition in Ayurveda?,diDVRXd0clE,Hindu University of America,2025-02-13T11:17:36Z,https://www.youtube.com/watch?v=diDVRXd0clE,"Mahara: The Ayurvedic Approach to Balanced Nutrition In Ayurveda, nutrition is not just about eating food; it's about consuming ...",106,95,2,0
Mastering Balanced Nutrition: My Pescatarian Journey,3qACx-0Bn6w,TSMFITNESS,2025-02-13T06:58:37Z,https://www.youtube.com/watch?v=3qACx-0Bn6w,Join us as we explore the concept of balanced nutrition through a pescatarian lifestyle. Discover valuable insights on dietary ...,31,443,4,0
Balanced nutrition Best source #healthyfood,k3SNbP3lkss,FitFlare,2025-02-12T13:10:11Z,https://www.youtube.com/watch?v=k3SNbP3lkss,In this video you will be learning about the balanced nutrition recommended to watch.,228,1,0,0
"Bsure - Complete, Balanced Nutrition Supplement Drink For The Entire Family #nutritionalsupplements",tQqVk0spdW0,BSure,2025-02-12T12:51:14Z,https://www.youtube.com/watch?v=tQqVk0spdW0,healthsupplements #nutritionalsupplements #dietarysupplement #bsure #vitaminsupplement #vitamin #essencialnatura #nutrition ...,31,441144,5721,0
🥦 A light belly comes from the right foods and balanced nutrition!  #HealthyDigestion #LightEveryDay,_1EaJ1nG8Hs,Alphabet Grown,2025-02-11T19:36:13Z,https://www.youtube.com/watch?v=_1EaJ1nG8Hs,,27,420,0,0
"Balanced Nutrition Made Easy! Eat Smart, Stay Fit, Glow Up! #shorts",7GPUx0w5hw8,HealthHub Daily,2025-02-10T20:55:03Z,https://www.youtube.com/watch?v=7GPUx0w5hw8,"Want to feel amazing, look your best, and stay healthy? Balanced nutrition is the key! Eat a variety of whole foods like lean ...",35,2,2,0
Balanced nutrition.,apmPLkjY8c0,chukwudi iwenwanne,2025-02-10T20:04:58Z,https://www.youtube.com/watch?v=apmPLkjY8c0,,131,1,1,0
The Ideal Dinner Plate for Balanced Nutrition,qK2sfY3-H2I,Achieve Integrative Health,2025-02-10T00:00:37Z,https://www.youtube.com/watch?v=qK2sfY3-H2I,"The Ideal Dinner Plate for Balanced Nutrition 🍽️ For optimal health and restorative longevity, here's a simple meal formula: ...",63,899,0,1
A Day in the Life of Balanced Nutrition!,TNPdxhQr86M,Alpero Healthcare Pvt. Ltd.,2025-02-04T04:30:20Z,https://www.youtube.com/watch?v=TNPdxhQr86M,"What does a day of balanced nutrition look like? It's simpler than you think! With the right mix of protein, fiber, and healthy fats, you ...",46,35,1,0
Create a Balanced Nutrition Plan,F5HBQhK4HLQ,Dr. Lam Coaching,2025-02-03T00:03:53Z,https://www.youtube.com/watch?v=F5HBQhK4HLQ,"Fuel your body the right way! No extreme diets—just balanced, nutrient-packed meals to keep you energized. Plan ahead, stay ...",39,261,3,0
Can Dry Cat Food Provide Complete and Balanced Nutrition for Cats? - PetGuide360.com,do14zrPwjaI,PetGuide360,2025-02-02T21:42:44Z,https://www.youtube.com/watch?v=do14zrPwjaI,Can Dry Cat Food Provide Complete and Balanced Nutrition for Cats? Understanding the nutritional needs of your feline friend is ...,177,3,0,0
maintaining health with balanced nutrition and diet part 7,4oJCrwJKZi0,HumanSyntax,2025-02-02T04:16:00Z,https://www.youtube.com/watch?v=4oJCrwJKZi0,,32,1,0,0
maintaining health with balanced nutrition and diet part 2,-5FKlmd-2w0,HumanSyntax,2025-02-02T04:15:09Z,https://www.youtube.com/watch?v=-5FKlmd-2w0,,32,5,0,0
maintaining health with balanced nutrition and diet part 3,fWUaghSHXu0,HumanSyntax,2025-02-02T04:15:20Z,https://www.youtube.com/watch?v=fWUaghSHXu0,,34,0,0,0
maintaining health with balanced nutrition and diet part 8 end,xNZ5Y6FG61s,HumanSyntax,2025-02-02T04:16:11Z,https://www.youtube.com/watch?v=xNZ5Y6FG61s,,31,3,0,0
maintaining health with balanced nutrition and diet part 6,1HBBn6vQZX8,HumanSyntax,2025-02-02T04:15:51Z,https://www.youtube.com/watch?v=1HBBn6vQZX8,,32,1,1,0
maintaining health with balanced nutrition and diet part 1,szGG2JZdHEY,HumanSyntax,2025-02-01T08:58:29Z,https://www.youtube.com/watch?v=szGG2JZdHEY,,32,2,0,0
The Power of Balanced Nutrition for Physical & Mental Wellness | Cooper-Mgmt.Com,hqEgS1_gCVM,Cooper-Mgmt,2025-01-31T18:51:13Z,https://www.youtube.com/watch?v=hqEgS1_gCVM,"Want to boost your energy, improve focus, and feel your best every day? Your diet plays a crucial role in your physical health, ...",118,8,1,0
"""Boost Your Health: Develop a Balanced Nutrition Habit Today | Healthy Eating Tips""",OD_QA0OWrwc,Max Motivation Tips,2025-01-30T16:30:06Z,https://www.youtube.com/watch?v=OD_QA0OWrwc,"""Boost Your Health: Develop a Balanced Nutrition Habit Today | Healthy Eating Tips"" Today, create a healthy eating habit and ...",38,2,0,0
"""Boost Your Health Today: Simple Tips for Balanced Nutrition | Healthy Eating Guide""",0Hdog8rgqx8,Max Motivation Tips,2025-01-28T11:00:00Z,https://www.youtube.com/watch?v=0Hdog8rgqx8,"""Boost Your Health Today: Simple Tips for Balanced Nutrition | Healthy Eating Guide"" Today, create a healthy eating habit and ...",38,4,0,0
Essential elements of balanced nutrition #shorts,VW55q9sBl0I,Sunita's Wellness Nutrition Hub,2025-01-28T09:11:57Z,https://www.youtube.com/watch?v=VW55q9sBl0I,shorts.,33,47,7,0
