Title,Video ID,Channel,Published At,URL,Description,Video Length,Views,Likes,Comments
"High-protein raw meal for cats, balanced & luxurious #rawfed",lskWjkp_-KI,Roberto Menjivar,2025-03-22T15:24:28Z,https://www.youtube.com/watch?v=lskWjkp_-KI,Luxury raw meal for cats with balanced nutrition #rawfed #catnutrition #catlover #fok.,33,2515,171,5
Balanced Meal plate,uJM6G_AYbEY,Learning Lens,2025-03-21T12:44:31Z,https://www.youtube.com/watch?v=uJM6G_AYbEY,"A vibrant and wholesome meal plate featuring fluffy white rice, rich beetroot curry with a hint of spice, flavorful chicken fry.",28,2271,53,0
"Balanced diet project, Balanced diet #shorts #ytshorts#viral#trending #ytshorts#trending#easydraw",naUdKpsxb-0,Bharti TLM8,2025-01-12T11:32:06Z,https://www.youtube.com/watch?v=naUdKpsxb-0,BhartiTLM8 Balanced diet project|Balanced diet working model|Balanced diet Science project|Balanced diet Chart balanced diet ...,52,18762,157,2
7 Keys to Longevity: Dr. John Scharffenberg,-h51gyZbOqw,NutriPeg Health ,2025-02-25T17:02:35Z,https://www.youtube.com/watch?v=-h51gyZbOqw,"Discover the essential factors that can significantly enhance your lifespan and well-being. In this insightful video, we explore: ...",59,3479,114,1
✅ இந்த அறிகுறிகள்  உடலில் தெரிந்தால்... 💥||#ShreeShathaka_NutriDiet 🍎 #Diet #Nutrition #viralvideo,Fhe2w9MTh_E,Shree Shathaka Nutri Diet ,2025-03-15T04:30:08Z,https://www.youtube.com/watch?v=Fhe2w9MTh_E,Welcome to @ShreeShathaka_NutriDiet Hashtag us:- #Shreeshathaka_NutriDiet #nutrition #dietetics #mealplans ...,22,2043,11,0
Episode-7/7 of sharing Healthy Balanced Weightloss Mealplate series#diet#food#ytviral#shortsfeed#yt,53E5s2OPp84,Diet&FitnessTales,2025-03-10T10:30:04Z,https://www.youtube.com/watch?v=53E5s2OPp84,Episode -7/7of sharing Healthy Balanced Weightloss Mealplate series 465 calories Healthy Balanced Weightloss meal plate This ...,58,2145,58,0
"Dave Mac: ""You Will Get Sick Without a Balanced Diet""",zJ1n4qcY_3Y,"Robert Kiltz, MD",2025-02-27T17:01:18Z,https://www.youtube.com/watch?v=zJ1n4qcY_3Y,Come hear what Dave Mac has to say about the carnivore diet and the balanced diet. @zerocarb #carnivorediet #podcast ...,53,2383,361,14
Break Free From Diet Culture #healthylifestyle #foodfacts #jayshetty #healthyliving,zfs4wlZTvWg,SnapIt Health & Motivation,2025-01-03T00:30:38Z,https://www.youtube.com/watch?v=zfs4wlZTvWg,shorts #glucose #jayshetty #jayshettypodcast #jessieinchauspe #dietculture #bodypositivity #healthyliving #nutritionscience ...,46,1896,32,0
Balanced Meal Thali With Desi Swaad | Indian Thali |#shorts #thali #indianfood #desifood  #mealideas,VD-DDjZNUFk,The Tempting Dishes,2025-03-05T04:30:10Z,https://www.youtube.com/watch?v=VD-DDjZNUFk,Ultimate Moong Dal Thali | Ghar Ka Swad & Balanced Meal! #IndianThali #ThaliPresentation #GharKaKhana Craving a ...,32,1901,0,0
Make smart Food choices with BN Restaurant Guide,tY2sqxqS0wA,Balance Nutrition,2025-03-11T06:35:33Z,https://www.youtube.com/watch?v=tY2sqxqS0wA,"In my recent podcast with SuccessFunde, I shared how the BN Restaurant Guide helps people make smart food choices without ...",27,2300,29,0
Nutrition: A balanced diet fuels a dog's body and supports overall well-being. #positivereinforce,-hsGvZ87k_4,ARABIC SONGS REMIX ,2025-02-19T04:44:46Z,https://www.youtube.com/watch?v=-hsGvZ87k_4,,10,31,3,0
"Nutrition, Balanced Diet",UNfBFiihKvQ,Important Notes for Studying,2025-02-02T12:09:45Z,https://www.youtube.com/watch?v=UNfBFiihKvQ,,13,26,1,0
balanced diet easy chart for mahila supervisor//nutrition and health subtopic#mpesb/ #nutritionweek,lG0YmxyXcfw,Pallavi ,2025-03-04T17:44:33Z,https://www.youtube.com/watch?v=lG0YmxyXcfw,,15,23,3,0
Flat Tummy & Lean Muscle Diet: What I Eat in a Day 🥗 #dietplan #flatstomach #nutrition #weightloss,pxCFSoGD4I4,Medha Das Sarma,2025-01-07T07:00:33Z,https://www.youtube.com/watch?v=pxCFSoGD4I4,Looking to achieve a flat tummy and build lean muscles? Here's a sneak peek into my daily meal plan that keeps me energized ...,18,1741253,61672,121
"a full day of balanced, new healthy recipes",dZKDGJ4DgnE,growingannanas,2025-02-19T18:10:33Z,https://www.youtube.com/watch?v=dZKDGJ4DgnE,,24,891245,43132,300
Why You’re Always Hungry (and How to Eat to Fix It),OgaoTW-N2uQ,Healthy Emmie,2025-01-13T13:53:35Z,https://www.youtube.com/watch?v=OgaoTW-N2uQ,,28,306188,22354,122
What I eat in a day (healthy and balanced),upUN6V8gL0s,Savannah Wright,2025-03-28T17:01:06Z,https://www.youtube.com/watch?v=upUN6V8gL0s,,51,58557,1809,23
What my kids (4.5 year olds) eat in a day? - From a certified child nutritionist 7:30 am-,w4vE_Fjiy1Y,Sanchita Daswani,2025-03-01T08:02:39Z,https://www.youtube.com/watch?v=w4vE_Fjiy1Y,"What my kids (4.5 year olds) eat in a day? - From a certified child nutritionist 7:30 am- Breakfast- waffles ( has banana, egg, nut ...",26,7904,118,2
Superfoods vs. A Balanced Diet: The Shocking Truth #shorts,ValvICReH-Q,Dr. Nene,2025-02-21T15:45:02Z,https://www.youtube.com/watch?v=ValvICReH-Q,"Superfoods are often marketed as miracle solutions for better health, but are they really worth the hype? In this video, we break ...",36,7386,449,8
Dr. Casey Means' 5-Step Good Energy Eating Plan for Optimal Health and Cellular Nutrition 🌿💪,uxWSYGZGZtA,KaikoMedia,2025-01-03T04:08:41Z,https://www.youtube.com/watch?v=uxWSYGZGZtA,"Discover Dr. Casey Means' 5-Step Good Energy Eating Plan—a simple, non-dogmatic approach to fueling your body for optimal ...",58,6327,250,3
Is Pad Thai Healthy? Nutrition Breakdown & Balanced Plate Rating,Jyf3R3tslEQ,Kate Guner,2025-03-09T17:30:58Z,https://www.youtube.com/watch?v=Jyf3R3tslEQ,"Let's be real—Pad Thai is insanely delicious, but is it actually a balanced meal? What's inside? Noodles: Tasty carbs, but ...",55,1508,70,3
ఆహారం విషయంలో ఈ పొరపాట్లు చెయ్యకండి || Balanced Diet is Very Importanat || Vardhan Ayurveda,ZfOKH_qlFmY,Vardhan Ayurveda,2025-01-08T09:40:57Z,https://www.youtube.com/watch?v=ZfOKH_qlFmY,BalancedDiet #HealthyEatingTips #DrVardhan #VardhanAyurveda #NutritionAwareness #DietMistakesToAvoid ...,62,942,34,0
Balanced Bites: Xav's Beef Kefta Tagine,uj8KZ5KIIWo,Let's Eat Balanced,2025-02-27T09:33:06Z,https://www.youtube.com/watch?v=uj8KZ5KIIWo,It's all about balance with this simple take on a Moroccan classic using naturally delicious beef!,56,43831,2706,0
Balanced Bites: Daniel's Air Fryer Asian-Style Beef,Rj6JxVERZnc,Let's Eat Balanced,2025-02-27T09:21:19Z,https://www.youtube.com/watch?v=Rj6JxVERZnc,"Grab your air fryer and try this easy, balanced Asian-Style Beef recipe – it's quick and delicious!",58,20185,1716,0
BEAT Fatigue by BALANCING Meals,fSPOEAJFkyA,Dr. Andrew Neville,2025-02-10T13:15:06Z,https://www.youtube.com/watch?v=fSPOEAJFkyA,Do you want to take a lonnnng winter's nap after every meal? It might be due to reactive hypoglycemia. When you eat certain ...,41,831,96,12
Full Day of Eats #mealideas #nutrition #healthy #food #balanced #fitness #gym #realistic #lifestyle,vguMPlqHxoI,Olivia Grace,2025-01-10T03:54:23Z,https://www.youtube.com/watch?v=vguMPlqHxoI,,22,620,15,0
Pineapple Diet 🍍 #pineapple #diet #health #nutrition #weightloss,NpcANJpRk_U,Medical Centric,2025-01-24T16:30:12Z,https://www.youtube.com/watch?v=NpcANJpRk_U,pineapplediet #nutritionfacts #healthtips #quickweightloss #dietplan #healthbenefits #digestivehealth #bloatingrelief ...,40,1319,23,2
Sardine Danger #diet #health #nutrition #weightloss #trending,aYoH3BUV6EE,Medical Centric,2025-01-06T18:30:01Z,https://www.youtube.com/watch?v=aYoH3BUV6EE,weightloss #healthtips #sardines #dietdanger #nutritionfacts #healthyliving #balanceddiet #tiktoktrend #medicalcentric ...,40,625,6,0
5 Common Mistakes in Your Child's Diet | Expert Nutrition Advice at Narayana Hospital,w7qzUrxxHEA,Narayana Health,2025-03-11T12:10:14Z,https://www.youtube.com/watch?v=w7qzUrxxHEA,Is your child's diet balanced? Here are 5 common mistakes you might be making with your child's nutrition: Overemphasis on Milk: ...,54,309,16,1
How To Eat A Balanced Diet | Proteins | Carbohydrates | Fats | Dr Ravi Vide | #shorts #idreamhealth,mLdmX6dR09I,iDream Health,2025-03-05T11:17:38Z,https://www.youtube.com/watch?v=mLdmX6dR09I,Watch▻How To Eat A Balanced Diet | Proteins | Carbohydrates | Fats | Dr Ravi Vide | #shorts #idreamhealth DISCLAIMER: The ...,94,2330,43,2
Everyday use 5 min ready-to-eat Breakfast🍽️ #morning #nutrition #quickrecipe #breakfast #vegetarian,kVK3e1pBRMg,From Kitchen to Cosmos,2025-03-27T12:43:30Z,https://www.youtube.com/watch?v=kVK3e1pBRMg,"Looking for a quick, nutritious, and delicious breakfast? This 5-minute ready-to-eat recipe is perfect for busy mornings! Packed ...",154,306,16,1
Protect your kidneys with these 5 simple steps! #diaryofakidneywarriorpodcast,_uuLwLvN3YY,Diary of a Kidney Warrior,2025-03-12T19:16:58Z,https://www.youtube.com/watch?v=_uuLwLvN3YY,Protect your kidneys with these 5 simple steps! Stay hydrated Eat a balanced diet Monitor your blood pressure ...,20,103,2,0
National Nutrition Month 2025 | KIMS Hospitals,6WoQkhuDSMI,KIMS Hospitals,2025-03-19T04:36:11Z,https://www.youtube.com/watch?v=6WoQkhuDSMI,"Fuel Your Health, Empower Your Life! Let's focus on healthy eating, balanced meals and mindful nutrition for a stronger, ...",40,188,3,0
Brown Rice Sushi & Fat Loss? Dr. Mike Explains! 🍙😂 #nutritiontips #healthandfitness #diettrends,sJ9OQHEjwtk,SnapIt Health & Motivation,2025-01-25T00:50:00Z,https://www.youtube.com/watch?v=sJ9OQHEjwtk,shorts #nutritiontips #healthandfitness #diettrends #fatlosstips #weightlossjourney #sushilover #browricesushi #dietdebate ...,33,12668,132,0
DAY 7 OF BALANCED 30-MIN MEALS: GREEK TURKEY BURGS!,dxATjr-b1TU,Lindsay Pleskot,2025-03-18T17:45:24Z,https://www.youtube.com/watch?v=dxATjr-b1TU,"DAY 7 OF BALANCED 30-MIN MEALS: GREEK TURKEY BURGS! If you've ever been a skeptic of ground turkey, this will ...",18,2503,75,2
"""Vegan Influencer Dies After Extreme Fruit-Only Diet!""",lLfCrqvGBtw,AchieveTrail,2025-03-30T17:18:00Z,https://www.youtube.com/watch?v=lLfCrqvGBtw,"Zhanna Samsonova, a 39-year-old Russian vegan influencer known as Zhanna D'Art, reportedly died on July 21, 2023, ...",5,,,
Lower Estrogen To Lose Fat And Stop Bloating - 3 Tips,pMe3wfKOOYc,Live Well With S,2025-02-23T18:46:50Z,https://www.youtube.com/watch?v=pMe3wfKOOYc,Here is how you can lower estrogen to lose fat and stop bloating. Excess estrogen will not only make fat loss difficult but also can ...,37,1636,25,0
Join 90 Days Diet Plan for Healthy Lifestyle #doctorspandana,mbuko1GG-oY,doctor spandana,2025-02-10T10:20:19Z,https://www.youtube.com/watch?v=mbuko1GG-oY,"Join the 90-Day Diet Plan for a Healthy Lifestyle! | Transform Your Health with #DoctorSpandana | Sustainable Weight Loss, ...",58,1953,69,5
Fun facts about fruit #health #healthy #fruit #healthtips #food #nutrition,wASO-4_EIbA,Health Burst,2025-03-09T14:01:22Z,https://www.youtube.com/watch?v=wASO-4_EIbA,"Discover the amazing world of fruit! From boosting your antioxidant intake to supporting a healthy lifestyle, fruit is packed with ...",21,1532,33,2
"5 low-sugar, whole-food swaps for a balanced diet",Z_YKONUnIos,Alexhealth ,2025-03-17T20:00:29Z,https://www.youtube.com/watch?v=Z_YKONUnIos,Smart Snack Swaps for a Healthier You! Doritos Nacho Cheese → Simply 7 Quinoa Chips (Sea Salt) Instead of ...,19,1426,42,1
Balance meal plate,VZYDH-ABelU,Learning Lens,2025-03-20T13:15:27Z,https://www.youtube.com/watch?v=VZYDH-ABelU,Balanced Meal Plate Main: Soft chapathi (whole wheat flatbread) – a great source of fiber and complex carbs for sustained ...,17,1412,37,0
Do you really need to eat immediately after a workout? Nope! #postworkout #balancednutrition #health,nvZ3A63LRPw,Dr Asif Munaf,2025-01-15T17:45:09Z,https://www.youtube.com/watch?v=nvZ3A63LRPw,,47,1423,73,3
The Hidden Strength of Chicken Bone Broth,sYoBQRr67SQ,Healthy Nutrition,2025-01-16T01:00:46Z,https://www.youtube.com/watch?v=sYoBQRr67SQ,Chicken bone broth offers surprising joint and immune support due to its collagen content. Discover how to incorporate it into ...,45,1571,48,3
How to build a perfectly balanced plate,YrTEYCQr5ik,Simple App,2025-03-19T11:34:40Z,https://www.youtube.com/watch?v=YrTEYCQr5ik,How to build a perfectly balanced plate 🍽️ Ever wonder how much of each nutrient should actually be on your plate? The key to ...,11,1420,24,0
🔍 What I Eat in a Day to Stay Full & Energized | Healthy & Satisfying Meals for All-Day Energy ⚡,Hr-aK0SoUr8,Ariellelorre,2025-03-29T08:08:12Z,https://www.youtube.com/watch?v=Hr-aK0SoUr8,"Want to stay full, energized, and satisfied throughout the day? In this video, I'm sharing a realistic ""What I Eat in a Day"" that keeps ...",14,1470,18,0
Balanced meal plate,bT0_87vsa-w,Learning Lens,2025-03-25T12:30:48Z,https://www.youtube.com/watch?v=bT0_87vsa-w,"Enjoy a delicious and balanced Mela Plate packed with flavors and nutrition! White Rice – Soft and fluffy, the perfect base.",39,1216,44,2
Weightloss Challenge Day 14/100 || Chia pudding recipe #whatieatinaday #trending #shorts #diet,rcTcOjTrcKQ,Vlogging Mom Diaries,2025-03-21T19:35:20Z,https://www.youtube.com/watch?v=rcTcOjTrcKQ,post partum weightloss challenge from 100 kg ... weightloss challenge day 1/100 ...what I eat in a day with balanced nutrition.,19,1110,15,0
The 90/10 Rule Unlock The Secret To A Balanced Diet 🍎🍫,MCYuBvG6gTs,Weight Loss Paradise,2025-03-14T00:00:19Z,https://www.youtube.com/watch?v=MCYuBvG6gTs,"Transform Your Life with Weight Loss Paradise! ✨   Win BIG with Us! For a limited time, we're offering YOU the chance to ...",48,1101,16,2
प्रेगनेंसी के पहले शुरुआती महीनो में प्रॉपर डाइट का महत्व || importance of diet in pregnancy,VKPA1tnu-CE,Dr. Suchismita Biswal,2025-03-08T10:30:11Z,https://www.youtube.com/watch?v=VKPA1tnu-CE,"If you don't take a balanced and nutritious diet during pregnancy, it doesn't mean that just because you are carrying one baby, you ...",58,1072,26,0
"A budget-friendly, balanced meal made with free quality ingredients from the Foodbank!",9s6yC6YthoY,Foodbank SBC,2025-02-07T20:20:05Z,https://www.youtube.com/watch?v=9s6yC6YthoY,,37,1092,27,0
Top Natural Sources of Sodium | Essential for a Healthy Body #short,529knXXhGGQ,Genericart Medicine,2025-03-10T13:00:12Z,https://www.youtube.com/watch?v=529knXXhGGQ,"Sodium is a vital mineral that plays an important role in maintaining fluid balance, nerve function, and muscle contractions.",55,1073,38,0
How to scientifically match the diet of the Green-cheeked Conure. #parrots #pet #parakeet #birds,d3GqU4LdWrk,Happy parrots,2025-01-20T11:11:01Z,https://www.youtube.com/watch?v=d3GqU4LdWrk,,164,985,53,0
💥 Quick Lunch vs. 4 Balanced Meals 💥,i4d-1kJCB8A,FlexPro Meals,2025-01-08T15:00:48Z,https://www.youtube.com/watch?v=i4d-1kJCB8A,Quick Lunch vs. 4 Balanced Meals What we eat impacts how we feel and how productive we are. Eating foods with purpose ...,11,890,6,0
How To Make A Well Balanced Plate #groceryshopping #plantbased #balanceddiet,vbUn5I0qzBk,VeganPopEats,2025-01-04T09:54:55Z,https://www.youtube.com/watch?v=vbUn5I0qzBk,,60,865,53,1
Ep 2: Aloo Paratha! Is it as balanced as you think?🤔,3wWDbQsi91g,Supply6,2025-02-08T12:27:27Z,https://www.youtube.com/watch?v=3wWDbQsi91g,,38,940,20,0
Balanced Lunch Recipe Ideas for Busy Days – Stay Healthy,bLzeoDcrw7U,Key Dishes,2025-01-25T13:00:49Z,https://www.youtube.com/watch?v=bLzeoDcrw7U,A balanced lunch recipe is essential for maintaining energy levels and promoting overall health throughout the day. In this video ...,17,887,14,0
Balanced meal plate 🍽️ #rohitasweety #balanceddiet #balancedmeal,GSo6_m9rjI0,Rohitasweety,2025-02-23T05:04:41Z,https://www.youtube.com/watch?v=GSo6_m9rjI0,"Rohitasweety, Healthy meal plate, Balanced meal plate, meal prep, weight loss, weight loss diet, healthy eating, balanced diet, ...",37,1731,24,3
Ultimate Lifestyle,59Dket2FUp0,RandomizerBoutique,2025-01-21T21:54:10Z,https://www.youtube.com/watch?v=59Dket2FUp0,"Find it here: https://bit.ly/4hmpDGd Unlock the secrets to a healthier, happier, and longer life with ""Ultimate Lifestyle.",13,787,195,0
The Perfect Balanced Meal Plate!🍛 #rohitasweety,s2infTNwotU,Rohitasweety,2025-02-16T10:54:52Z,https://www.youtube.com/watch?v=s2infTNwotU,"Learn how to create the perfect balanced meal plate that will nourish your body and satisfy your taste buds! In this video, we'll ...",39,1198,19,6
Nutritionist Rujuta Diwekar explains to #ExamWarriors how balanced diet improves mental well-being!,l5lxIwkLV9c,Ministry of Information & Broadcasting,2025-02-14T10:24:07Z,https://www.youtube.com/watch?v=l5lxIwkLV9c,You become what you eat! Nutritionist Rujuta Diwekar explains to #ExamWarriors how eating home-made food and a balanced ...,33,1470,36,1
Balanced Diet for Busy Professionals: Practical Tips for a Healthy Lifestyle,EHNqnWqcnLE,Aakash Bhutani,2025-01-03T11:01:28Z,https://www.youtube.com/watch?v=EHNqnWqcnLE,Learn how to create a balanced diet plan that fits into your busy schedule. Whether you're a working professional or someone ...,58,753,0,0
Carrot Juice: Fact or Fiction for Hair Growth?,HsdZGlNK0cg,Medindia Videos,2025-01-30T09:19:31Z,https://www.youtube.com/watch?v=HsdZGlNK0cg,"Is carrot juice the ultimate solution for hair growth? While it's a powerhouse of vitamins A, C, and B, it's not a miracle worker.",27,1090,24,0
How breakfast helps lose weight and balance your metabolism? Learn more at LifeSpa.com or linktree,3aMBQGjZoTg,John Douillard,2025-03-05T22:21:06Z,https://www.youtube.com/watch?v=3aMBQGjZoTg,"From protein to fiber, a balanced breakfast sets the tone for your entire day. What's your go-to morning fuel? #johndouillard ...",59,750,54,3
🚨 These everyday foods are wrecking your hormones! 🚨 #hormonalbalance #nutrition #grocery,b8BQgwYrbfA,Scarlett’s Glow ,2025-03-04T09:53:36Z,https://www.youtube.com/watch?v=b8BQgwYrbfA,Did you know that some of your favorite snacks might be throwing your hormones out of balance? From hidden sugars to harmful ...,46,688,29,1
Mastering Nutrition: Focus on Vegetables and Lean Proteins,M3RGLVuaIME,Meet Dr. Gyimah,2025-01-28T16:03:27Z,https://www.youtube.com/watch?v=M3RGLVuaIME,"Explore the essential components of a balanced diet by prioritizing non-starchy vegetables, lean proteins, healthy fats, and whole ...",13,429,5,0
Nutrition Briefs - The Role of Diet in Managing Excess Weight 🐾,5d9_hjazU8Q,Purina Institute,2025-01-15T17:54:10Z,https://www.youtube.com/watch?v=5d9_hjazU8Q,https://www.purinainstitute.com/centresquare/focused-nutrition/the-role-of-diet-in-managing-excess-weight A tailored nutritional ...,86,231,0,0
Are you really having balanced diet ? #healthifymoms #cheshta #momfitnessjourney,sdGmXhf8E34,Healthify Moms,2025-03-30T14:58:40Z,https://www.youtube.com/watch?v=sdGmXhf8E34,,71,94,7,1
Nutrition Briefs - The Role of Diet in Managing Excess Weight 🐾,5d9_hjazU8Q,Purina Institute,2025-01-15T17:54:10Z,https://www.youtube.com/watch?v=5d9_hjazU8Q,https://www.purinainstitute.com/centresquare/focused-nutrition/the-role-of-diet-in-managing-excess-weight A tailored nutritional ...,86,231,0,0
Are You Really Eating a Well-Balanced Diet? #shorts,uVU_QqRvme4,PartnerMD,2025-02-17T15:01:17Z,https://www.youtube.com/watch?v=uVU_QqRvme4,Are You Really Eating a Well-Balanced Diet? Learn what a truly balanced meal looks like and how to improve your nutrition!,36,144,1,0
Let Our Doctors Guide You to a Balanced and Healthy Ramadan!,TCIXUJjcWwg,Ahalia Hospital Abudhabi,2025-03-12T05:21:07Z,https://www.youtube.com/watch?v=TCIXUJjcWwg,"This Ramadan, our doctors are here to support you in maintaining a balanced and healthy lifestyle. Learn how to manage your ...",48,95,2,1
Are you really having balanced diet ? #healthifymoms #cheshta #momfitnessjourney,sdGmXhf8E34,Healthify Moms,2025-03-30T14:58:40Z,https://www.youtube.com/watch?v=sdGmXhf8E34,,71,94,7,1
Choose Fiber Over Juice Cleanses for Optimal Gut Health.#shorts#probiotics #juicecleanse #guthealth,z4LBIHIwNfQ,Medical and Health Tips (MHT),2025-02-10T01:15:03Z,https://www.youtube.com/watch?v=z4LBIHIwNfQ,Choose Fiber Over Juice Cleanses for Optimal Gut Health. Your gut microbiome is home to trillions of bacteria that influence ...,42,78,4,0
पीरियड्स में संतुलित आहार जरूरी | Balanced Diet for Periods | Sehat Talk 3,TgCSmH2A4OM,Live Hindustan,2025-01-27T05:35:00Z,https://www.youtube.com/watch?v=TgCSmH2A4OM,पीरियड्स में संतुलित आहार जरूरी | Balanced Diet for Periods | Sehat Talk 3 #SehatTalk #Health ...,57,57228,32,0
13 building blocks for stellar health#shorts#life#lifefacts#motivation,7HcmONB0k6M,Life_Facts,2025-02-02T15:00:09Z,https://www.youtube.com/watch?v=7HcmONB0k6M,Description: Great health isn't just about diet and exercise—it's a combination of daily habits that nourish your body and mind.,4,653,34,0
How To Eat A Balanced Meal ⚖️ #shorts,G1vaxRh98n4,Daniel Vierra,2025-03-10T15:02:46Z,https://www.youtube.com/watch?v=G1vaxRh98n4,How To Eat A Balanced Meal ⚖️ What's your go-to breakfast? Drop your favorite combo in the comments! I might try it next!,24,651,19,0
Boost your fertility with a balanced diet!,T7QwusTJjBQ,Dr Saroja Vadlapati,2025-01-24T12:33:46Z,https://www.youtube.com/watch?v=T7QwusTJjBQ,"Check out my simple, nutritious meal plan for a healthy lifestyle. From breakfast to dinner, I've got you covered with ...",116,688,56,1
Why Is Nutrition Good For You?! Let’s Ask Smoke The Cat,ihRLErM6YoY,"Dr. J, Countess Warrior, Major Sexy, X5",2025-02-11T17:56:21Z,https://www.youtube.com/watch?v=ihRLErM6YoY,"Why Is Nutrition Good For You?! Let's Ask Smoke The Cat nourishing your body can enhance your physical health, elevate your ...",33,3485,849,0
Balanced mixture of nutrients that supports brain function #15minutesrecipe 🍲,pdAAhWr30yM,Balial🍋‍🟩,2025-02-23T09:56:39Z,https://www.youtube.com/watch?v=pdAAhWr30yM,quicklunchideas #jhatpatrecipe #healthyricerecipes #vegetablerice #instantrecipe #healthyeating #ricebowls #easycooking ...,59,643,13,2
❌ Stop These Dangerous Diet Habits NOW! #caloriedeficit #menstrualproblems,8wbP5rpM1Ck,Mythless Wellness,2025-01-05T17:49:03Z,https://www.youtube.com/watch?v=8wbP5rpM1Ck,"Nutrition Hack: Constant fluctuations in your calorie intake can lead to hormonal imbalances and metabolic issues, which are ...",39,602,24,16
Are you sure your dog meal is balanced? #shorts #dogfooddiet #healthydogfood #diy #rawdogfood,30oMua-4gfo,Zen_BorderCollie,2025-03-15T15:00:04Z,https://www.youtube.com/watch?v=30oMua-4gfo,Feeding homemade meals isn't just about throwing ingredients together—missing key nutrients can lead to serious health issues!,43,598,18,3
"Best Foods for Diabetics: Eat Smart, Stay Healthy #DiabetesDiet #DiabetesManagement #HealthyFats",bTxxT_plILw,Pure Detox Life,2025-02-02T02:02:38Z,https://www.youtube.com/watch?v=bTxxT_plILw,"Best Foods for Diabetics: Eat Smart, Stay Healthy Discover top diabetes-friendly foods in this vibrant 30-second YouTube short!",45,596,7,2
Today's balanced lunch plate,rN_qjJMppt8,Food &Beyond,2025-01-04T18:20:16Z,https://www.youtube.com/watch?v=rN_qjJMppt8,"Millet - Carbs, Protein Mochakottai Kuzhambu - Protein Salad- Fiber Buttermilk - Probiotics Egg - Protein Snake gourd kootu ...",33,586,32,4
Today's Balanced lunch plate,c5mQA745-Pg,Food &Beyond,2025-01-03T16:43:23Z,https://www.youtube.com/watch?v=c5mQA745-Pg,"Millet - Carbs and protein Buttermilk kuzhambu with pumpkins - Probiotic, Fiber Beans usili - Fiber and protein ( I forgot to plate it ...",41,568,25,4
All about balanced diet. | Nutritionist #podcast,MaKUKSS99EM,The Room of Tales,2025-01-06T08:14:22Z,https://www.youtube.com/watch?v=MaKUKSS99EM,All you need to know about Balanced diet. | Dr. Ananya Bhowmik Mitra #theroomoftales #podcast #trendingreels #kolkata ...,66,627,17,0
Thriving with Diabetes Your Ultimate Guide to Balanced Blood Sugar & Vibrant Living,244K-idsmuQ,The Balance Bowl,2025-02-02T11:07:40Z,https://www.youtube.com/watch?v=244K-idsmuQ,Thriving with Diabetes Your Ultimate Guide to Balanced Blood Sugar & Vibrant Living #thebalancebowl​ #weightlossjourney​ ...,11,555,8,0
Debunking Diet Myths: Balanced Diet is Key!,mlXZgp07nkg,Health Hacks & Wine Racks,2025-02-26T13:57:31Z,https://www.youtube.com/watch?v=mlXZgp07nkg,Smash common diet myths with our engaging video! Join two women as they debunk misconceptions about healthy eating in a ...,29,548,4,0
😃 Find Out How a Balanced Meal Really Looks Like! #PickyEatersSolutions #PickyEatingCoach,XJAFV48kfGw,Family Wellness ,2025-02-12T17:15:02Z,https://www.youtube.com/watch?v=XJAFV48kfGw,"Are you unsure how to create a balanced meal that's both healthy and satisfying? Learn how to combine proteins, healthy fats, ...",10,546,6,1
Today's balanced lunch plate,iisBi1iysAs,Food &Beyond,2025-01-05T19:11:14Z,https://www.youtube.com/watch?v=iisBi1iysAs,"Karuppu Kavuni fried rice with lots of veggies - Fiber , carbs Egg Burji - Protein Greek Yogurt - Protein Raw salad - Fiber #nutrition ...",36,542,15,0
How to Plan Balanced Meal? #balancedmeals #healthychoices #healthyfood #healthyeating,0mmdoSDfg7I,FactsScan,2025-03-07T11:50:00Z,https://www.youtube.com/watch?v=0mmdoSDfg7I,"Just like family, every food has a purpose! ‍  ‍  ‍   Some give strength, some bring energy, and together they keep us ...",60,541,23,0
A healthy horse starts with a balanced gut microbiome,eRjEZcEgCoo,Bio-az,2025-02-12T07:00:24Z,https://www.youtube.com/watch?v=eRjEZcEgCoo,"A healthy horse starts with a balanced gut microbiome. At Bio-azTM, we harness the power of science-backed synbiotics to support ...",9,524,18,0
