Title,Video ID,Channel,Published At,URL,Description,Video Length,Views,Likes,Comments
Sugar Cravings on a Carnivore Diet 🥩#carnivore #carnivorediet #lowcarb #health #healthyfood,2WytHc-0KV4,Coach Carnivore Cam,2025-02-21T18:15:10Z,https://www.youtube.com/watch?v=2WytHc-0KV4,,56,65155,2305,187
Meal Prep on a Carnivore Diet 🥩#carnivorediet #carnivore #mealprep #healthy #lowcarb #cooking,rHxfTTYf_10,Coach Carnivore Cam,2025-02-26T18:26:30Z,https://www.youtube.com/watch?v=rHxfTTYf_10,,54,69274,2644,299
Eat More Butter!🧈✅ #carnivore #carnivorediet #lowcarb #nutrition #health #butter #healthyfood,pYryGpTzRu4,Coach Carnivore Cam,2025-01-13T19:04:32Z,https://www.youtube.com/watch?v=pYryGpTzRu4,,46,70983,2124,243
How To Do The Carnivore Diet CHEAP! 👉,T0Dh1NNAR_0,KenDBerryMD,2025-01-16T22:50:16Z,https://www.youtube.com/watch?v=T0Dh1NNAR_0,How To Do The Carnivore Diet CHEAP!,34,65284,5670,132
Chicken on a Carnivore Diet ✅ #carnivore #carnivorediet #chicken #healthy #food #cooking #nutrition,c4juUSsSiGg,Coach Carnivore Cam,2025-02-05T19:19:34Z,https://www.youtube.com/watch?v=c4juUSsSiGg,,49,57077,1518,144
The Problem with the “Carnivore” Diet,qZn5xXqjTZE,ATHLEAN-X™,2025-02-07T19:04:19Z,https://www.youtube.com/watch?v=qZn5xXqjTZE,"Are you having trouble losing weight, even though you are on a diet? Well, the problem may be stemming from the fact that your ...",47,58437,2524,118
Problems you may face when adapting to Carnivore 🥩 #carnivore #carnivorediet #health #healthy,-FkNYGTFWBA,Coach Carnivore Cam,2025-01-06T18:42:02Z,https://www.youtube.com/watch?v=-FkNYGTFWBA,,58,52714,1966,202
My First Meal of the Day 🥩🍳#carnivore #carnivorediet #steak #egg #meat #health #food #nutrition,Zt32z4fLRf4,Coach Carnivore Cam,2025-01-03T19:07:45Z,https://www.youtube.com/watch?v=Zt32z4fLRf4,,31,50136,1539,166
How Much Fat Should I Eat On The Carnivore Diet? 👉,wnaWGlgz-Ro,Dr. Robert Cywes M.D. Ph.D. #CarbAddictionDoc,2025-01-07T13:01:21Z,https://www.youtube.com/watch?v=wnaWGlgz-Ro,,13,52141,2109,67
Don't Count Calories On The Carnivore Diet! 👉,KvtC3nGdvj8,KenDBerryMD,2025-03-06T22:55:32Z,https://www.youtube.com/watch?v=KvtC3nGdvj8,Don't Count Calories On The Carnivore Diet!,27,58682,5599,281
Budget Carnivore Diet Food Shop🥩#carnivore #carnivorediet #food #shopping #budget #healthylifestyle,aU-1ZSYO0SQ,Coach Carnivore Cam,2025-02-17T19:21:19Z,https://www.youtube.com/watch?v=aU-1ZSYO0SQ,,113,55216,2012,214
Focus On RUMINANT Animals On The Carnivore Diet! 👉,k0PPahiEYB8,KenDBerryMD,2025-02-05T19:30:44Z,https://www.youtube.com/watch?v=k0PPahiEYB8,Focus On RUMINANT Animals On The Carnivore Diet!,40,48142,5624,164
Why The Carnivore Diet ACTUALLY WORKS 👉,ZgN9_A6bxCY,Anthony Chaffee MD,2025-01-31T11:00:49Z,https://www.youtube.com/watch?v=ZgN9_A6bxCY,,24,47512,4101,143
Slowly Transition To The Carnivore Diet! 👉,Oa1gv5XZTNQ,KenDBerryMD,2025-02-05T07:30:22Z,https://www.youtube.com/watch?v=Oa1gv5XZTNQ,Slowly Transition To The Carnivore Diet!,29,49426,5111,233
Eating Fruit On The Carnivore Diet,KE3klbYgfmo,Anthony Chaffee MD,2025-02-20T22:40:15Z,https://www.youtube.com/watch?v=KE3klbYgfmo,,48,48643,3354,316
Carnivore Diet Bread 🍞 #carnivore #carnivorediet #recipe #bread #food #healthyfood #lowcarb,4B3piCqTIFY,Coach Carnivore Cam,2025-01-21T18:47:31Z,https://www.youtube.com/watch?v=4B3piCqTIFY,,37,45338,1592,232
Dairy on a Carnivore Diet 🧀🥛🧈#carnivorediet #carnivore #dairy #nutrition #health #lowcarb,BaJ5ot54eHE,Coach Carnivore Cam,2025-03-05T17:44:48Z,https://www.youtube.com/watch?v=BaJ5ot54eHE,,61,48387,1513,150
What your favourite combo? #carnivorediet #carnivore #beef #groundbeef #beefmince #cooking,ieCNZgyf17o,Coach Carnivore Cam,2025-01-29T18:45:08Z,https://www.youtube.com/watch?v=ieCNZgyf17o,,43,38817,1252,157
What FOODS You Can Eat On The Carnivore Diet? 👉,hGgpoy-24Gw,KenDBerryMD,2025-01-31T19:55:20Z,https://www.youtube.com/watch?v=hGgpoy-24Gw,What FOODS You Can Eat On The Carnivore Diet?,30,44175,4019,193
Always Check Labels 👀 #carnivore #carnivorediet,PSA0G-dI7Ew,Coach Carnivore Cam,2025-01-31T17:29:39Z,https://www.youtube.com/watch?v=PSA0G-dI7Ew,,28,35561,874,181
Carnivore Diet Didn't Work? Give It TIME 👉,arOzF7_A4Wc,KenDBerryMD,2025-02-27T00:00:20Z,https://www.youtube.com/watch?v=arOzF7_A4Wc,Carnivore Diet Didn't Work? Give It TIME.,33,36396,4205,217
Water On The Carnivore Diet 👉,sOzhU1LM_4w,KenDBerryMD,2025-02-22T15:01:31Z,https://www.youtube.com/watch?v=sOzhU1LM_4w,Water On The Carnivore Diet.,23,37573,3868,162
Carnivore Diet Hot Dogs 🌭 #carnivore #carnivorediet #recipe #hotdog #hotdogs #lowcarbrecipes,uyZ7A6IUPk0,Coach Carnivore Cam,2025-02-27T19:20:31Z,https://www.youtube.com/watch?v=uyZ7A6IUPk0,,41,35092,1273,188
Kidney Disease GETS BETTER On A Carnivore Diet? Watch This! 👉,q2IiCKFOCQg,KenDBerryMD,2025-03-07T20:35:36Z,https://www.youtube.com/watch?v=q2IiCKFOCQg,Kidney Disease GETS BETTER On A Carnivore Diet? Watch This!,36,32475,3433,159
Why SALT Is Important On The Carnivore Diet! 👉,0lxGpTH6OCQ,KenDBerryMD,2025-02-21T22:50:45Z,https://www.youtube.com/watch?v=0lxGpTH6OCQ,Why SALT Is Important On The Carnivore Diet!,35,34081,3934,173
Why Electrolytes Are Important On The Carnivore Diet,g9HKCZEqXeg,KenDBerryMD,2025-02-20T20:30:37Z,https://www.youtube.com/watch?v=g9HKCZEqXeg,Why Electrolytes Are Important On The Carnivore Diet.,56,31408,4084,166
Dairy On The Carnivore Diet 👉,qAGme1nNCyw,Anthony Chaffee MD,2025-02-22T21:45:03Z,https://www.youtube.com/watch?v=qAGme1nNCyw,,21,37185,2381,167
My First & Only Meal of the Day 🥩🍳#carnivorediet #carnivore #omad #meat #egg #steak #healthyfood,-mJCRSF7X_U,Coach Carnivore Cam,2025-03-03T19:22:03Z,https://www.youtube.com/watch?v=-mJCRSF7X_U,,36,29963,983,182
Can You Get BORED Of Steak On A Carnivore Diet? 👉,cAFSlPQwooI,Anthony Chaffee MD,2025-02-25T00:39:09Z,https://www.youtube.com/watch?v=cAFSlPQwooI,"Imagine convincing everyone that they must mistrust their natural senses, such as taste, satiety, and hunger. Our sense of taste is ...",37,32005,3598,175
What To Cook With On A Carnivore Diet? 👉,hGk5C21_lSk,KenDBerryMD,2025-02-23T11:31:05Z,https://www.youtube.com/watch?v=hGk5C21_lSk,What To Cook With On A Carnivore Diet?,24,28714,3493,132
Meals On The Carnivore Diet 👉,9THqotIJCc0,KenDBerryMD,2025-02-28T23:10:17Z,https://www.youtube.com/watch?v=9THqotIJCc0,Meals On The Carnivore Diet.,24,28975,3084,93
5 Hacks to keep you on track when starting a Carnivore Diet 🥩 #carnivore #carnivorediet #health,IasBNNQLDl4,Coach Carnivore Cam,2025-03-07T19:27:24Z,https://www.youtube.com/watch?v=IasBNNQLDl4,,37,28334,1045,148
Focusing On RED MEAT On The Carnivore Diet 👉,qYhFjqCHkTA,KenDBerryMD,2025-02-21T09:45:27Z,https://www.youtube.com/watch?v=qYhFjqCHkTA,Focusing On RED MEAT On The Carnivore Diet.,40,26374,3621,147
Cheap Meat On The Carnivore Diet? 👉,NMDGgRB0QGM,KenDBerryMD,2025-03-02T06:10:40Z,https://www.youtube.com/watch?v=NMDGgRB0QGM,Cheap Meat On The Carnivore Diet?,38,28075,3479,158
Eating HIGH FAT On The Carnivore Diet,9GF1-kvcOPI,Dr. Robert Cywes M.D. Ph.D. #CarbAddictionDoc,2025-02-18T21:01:21Z,https://www.youtube.com/watch?v=9GF1-kvcOPI,,24,75053,2307,106
Vitamin C Deficiency On The Carnivore Diet? 👉,lNQSB4wVLbM,KenDBerryMD,2025-02-06T19:30:18Z,https://www.youtube.com/watch?v=lNQSB4wVLbM,Vitamin C Deficiency On The Carnivore Diet?,38,26187,2858,94
What I eat in a day carnivore diet #carnivore #carnivorediet #wieiad #whatieat #whatieatinaday,8uxq7jQIlNU,Courtney Luna,2025-01-18T01:55:19Z,https://www.youtube.com/watch?v=8uxq7jQIlNU,,53,25311,1723,60
Flying Dutchman at In-N-Out #carnivore #carnivorediet #ketodiet #innout #flyingdutchmen #fastfood,GpNYypl3BUQ,Courtney Luna,2025-01-23T17:03:26Z,https://www.youtube.com/watch?v=GpNYypl3BUQ,,25,25017,1368,106
Spices On The Carnivore Diet,yuLmf3jx3MY,KenDBerryMD,2025-03-09T05:00:16Z,https://www.youtube.com/watch?v=yuLmf3jx3MY,Spices On The Carnivore Diet.,23,29279,2430,78
DON'T Track Macros & Calories On The Carnivore Diet!,gfSmhck_Lzg,KenDBerryMD,2025-03-09T17:00:19Z,https://www.youtube.com/watch?v=gfSmhck_Lzg,DON'T Track Macros & Calories On The Carnivore Diet!,34,25585,2667,83
Slowly Transition To The Carnivore Diet 👉,v8kY_iNDwy0,KenDBerryMD,2025-02-25T00:40:34Z,https://www.youtube.com/watch?v=v8kY_iNDwy0,Slowly Transition To The Carnivore Diet.,29,24965,2918,132
Salt is essential for life ✅ #carnivore #carnivorediet #salt #health #healthy #nutrition,I052iiu_hBo,Coach Carnivore Cam,2025-02-28T18:07:08Z,https://www.youtube.com/watch?v=I052iiu_hBo,,52,23176,986,117
Carnivore Diet Beef Noodles 🍜 #carnivore #carnivorediet #recipe #beef #noodles #food #healthyfood,Reuhx17jAtg,Coach Carnivore Cam,2025-02-02T18:50:34Z,https://www.youtube.com/watch?v=Reuhx17jAtg,,37,20595,829,154
Carnivore Diet Fish Goujons #carnivore #carnivorediet #recipe #seafood #fish #lowcarb,IlqJQHw1zWw,Coach Carnivore Cam,2025-02-11T18:53:02Z,https://www.youtube.com/watch?v=IlqJQHw1zWw,,27,20495,712,144
How to deal with sugar cravings on a carnivore diet 🍪🍰,HpYPVnMePhU,Shawn Baker MD,2025-01-15T22:00:10Z,https://www.youtube.com/watch?v=HpYPVnMePhU,How to deal with sugar cravings on a carnivore diet Revero Clinic for treating chronic diseases: https://revero.com Join ...,59,20206,2768,122
Harvard’s Shocking Carnivore Diet Study! 🥩📄 #carnivorediet,JAyYZDA5Sos,Healthier Than Yesterday,2025-03-29T04:00:12Z,https://www.youtube.com/watch?v=JAyYZDA5Sos,"In a groundbreaking study published by Harvard & Oxford University Press, researchers uncovered something that shocked ...",57,43401,0,54
Carnivore Diet Coffee Ice Cream ☕️🍨 #carnivore #carnivorediet #recipe #coffee #icecream #dessert,dCHi6erpdEs,Coach Carnivore Cam,2025-02-16T18:32:57Z,https://www.youtube.com/watch?v=dCHi6erpdEs,,38,21250,1086,123
Carnivore Protein Pudding 🍮 #carnivore #carnivorediet #recipe #protein #pudding #dessert #food,HqlNdAMn_8k,Coach Carnivore Cam,2025-02-13T20:34:47Z,https://www.youtube.com/watch?v=HqlNdAMn_8k,,32,18713,677,138
What I eat in a day on the carnivore diet! #food #diet #carnivore #lowcarb #keto,TzzvrDuIEUE,Carnivore Revolution,2025-02-17T02:27:42Z,https://www.youtube.com/watch?v=TzzvrDuIEUE,,29,17912,1063,43
Carnivore for the win #carnivore #carnivorediet #cleaneating #ketodiet #carnivorerecipes #healthy,LAT7_sF8PSI,Courtney Luna,2025-01-23T15:09:20Z,https://www.youtube.com/watch?v=LAT7_sF8PSI,,32,17726,2032,71
Is “Miss Meat”s carnivore diet healthy? #diet #nutrition #health #whatieatinaday,77gMIt0v5B4,Sillz,2025-03-17T18:32:11Z,https://www.youtube.com/watch?v=77gMIt0v5B4,,150,23063,1481,80
Day 1 of 365 ✅ #weightloss #carnivore #carnivorediet,HQAhKMmEjSw,shawn,2025-01-02T02:45:49Z,https://www.youtube.com/watch?v=HQAhKMmEjSw,,33,16390,835,67
The healing powers of a carnivore diet!!,III6QRzzY1M,Shawn Baker MD,2025-01-24T22:29:16Z,https://www.youtube.com/watch?v=III6QRzzY1M,The healing powers of a carnivore diet!! Source: @GeorgiaEdeMD @howtocarnivore Join Revero now to regain your health: ...,117,16115,2177,80
Carnivore Diet Casserole #carnivorediet #carnivore #recipe #food #cooking #casserole #lowcarb,cP5SLaOjk9M,Coach Carnivore Cam,2025-03-02T19:49:00Z,https://www.youtube.com/watch?v=cP5SLaOjk9M,,40,16476,759,100
Carnivore Affogato ☕️🍨#carnivore #carnivorediet #recipe #coffee #icecream #food #dessert #healthy,3RL-chUf_Nc,Coach Carnivore Cam,2025-01-19T18:33:02Z,https://www.youtube.com/watch?v=3RL-chUf_Nc,,33,15283,682,121
Carnivore Diet Bacon Sausage & Egg Butty #carnivore #carnivorediet #breakfast #recipe #lowcarb,wYk7ZRQyYCw,Coach Carnivore Cam,2025-03-06T19:44:47Z,https://www.youtube.com/watch?v=wYk7ZRQyYCw,,33,15942,604,96
The Nose To Tail Carnivore Diet 👉,qY-55D-scog,KenDBerryMD,2025-03-01T18:05:31Z,https://www.youtube.com/watch?v=qY-55D-scog,The Nose To Tail Carnivore Diet.,26,15022,1711,59
The carnivore diet and LDL cholesterol!!,qyVD3D6PmUY,Shawn Baker MD,2025-03-08T22:17:22Z,https://www.youtube.com/watch?v=qyVD3D6PmUY,The carnivore diet and LDL cholesterol!! 🎙️: @TheNotaRubicon Join Revero now to regain your health: https://revero.com/YT ...,177,16179,1896,64
Carnivore Flatbread🔥 #carnivore #carnivorediet #recipe #flatbread #food #cooking #healthy #lowcarb,EL5BDU7srWo,Coach Carnivore Cam,2025-01-14T18:49:42Z,https://www.youtube.com/watch?v=EL5BDU7srWo,,29,14884,637,151
#carnivorediet #carnivore #weightlossdiet #weightloss #weightlossjourney #weightlosstransformation,THOXwe99aVk,Courtney Luna,2025-01-26T17:50:10Z,https://www.youtube.com/watch?v=THOXwe99aVk,,16,13996,872,36
BEST Carnivore Ice cream #carnivore #diet #recipe #keto #dessert #icecream #fyp #foryou #shorts,KTN94dvyP-Q,Kelly Kim,2025-01-26T23:30:26Z,https://www.youtube.com/watch?v=KTN94dvyP-Q,,73,31259,1989,70
Carnivore Diet Breakfast Muffins #carnivore #carnivorediet #recipe #breakfast #muffins #food,Um28Vef1bxo,Coach Carnivore Cam,2025-02-25T19:08:55Z,https://www.youtube.com/watch?v=Um28Vef1bxo,,26,12813,628,108
Is Carnivore Diet Better Than Keto | Hal Cranmer,teimszzq-7M,Mikhaila Peterson,2025-02-09T23:00:47Z,https://www.youtube.com/watch?v=teimszzq-7M,Follow Me— All Platforms: https://linktr.ee/mikhailapeterson Instagram: https://instagram.com/mikhailapeterson TikTok: ...,35,12088,861,24
Why Paul Saladino Added Fruits To His Carnivore Diet 👉,5dFqtg2eBgI,Dr. Abs,2025-02-06T22:40:19Z,https://www.youtube.com/watch?v=5dFqtg2eBgI,Why Paul Saladino Added Fruits To His Carnivore Diet.,23,18536,293,67
Carnivore Diet is Spreading Like Crazy!  🥩🔥,mJveBzrk4v4,HomeSteadHow,2025-02-16T13:34:32Z,https://www.youtube.com/watch?v=mJveBzrk4v4,"Dr. Baker joins me to discuss the rising popularity of the Carnivore Diet, its long-term effectiveness, and the countless success ...",60,8955,1149,34
Meal Prep For The Week | Carnivore #diet #fitness #food #mealprep #nutrition #nutritiontips #health,fBUnzXv9Ri0,Zack Bowden,2025-01-10T00:41:12Z,https://www.youtube.com/watch?v=fBUnzXv9Ri0,,27,8976,238,10
Man develops ‘cholesterol hands’ while on carnivore diet #news #florida #fox13news,EzZO_mgz4TM,FOX 13 Tampa Bay,2025-01-29T18:36:33Z,https://www.youtube.com/watch?v=EzZO_mgz4TM,"A man who told doctors he ate nothing, but 6–9 pounds of butter, cheese and hamburgers every day for eight months ended up at ...",40,8452,153,31
Carnivore Diet Day24 #carnivore#carnivorediet#fish#diet#food#foodie#foodlover#fyp#shorts#fitness,mHSq3Ij6unU,DooDooPoo,2025-01-07T21:31:02Z,https://www.youtube.com/watch?v=mHSq3Ij6unU,,,,,
What I Eat in a Day (High Fat Carnivore),raL_ywEwCgw,Marcus Sidhu (N1Fitness),2025-03-06T19:19:04Z,https://www.youtube.com/watch?v=raL_ywEwCgw,COACHING - http://www.n1fitness.com/coaching INSTAGRAM - https://www.instagram.com/n1fitness/ TIKTOK ...,28,24131,417,48
What I eat in a day on the carnivore diet! #food #healthy #wings #eggs #recipe,2azrGchDDQM,Carnivore Revolution,2025-03-26T03:25:03Z,https://www.youtube.com/watch?v=2azrGchDDQM,,35,7557,513,11
How Lauren Healed Anxiety & Depression with the Carnivore Diet..,f6PyeaQnVdk,HomeSteadHow,2025-01-11T16:37:30Z,https://www.youtube.com/watch?v=f6PyeaQnVdk,"In this episode, Lauren joins me as we explore the profound changes I've experienced—weight loss, improved mental clarity, and ...",59,9707,860,20
Better Vision with the Carnivore Diet?,aNWto3zpxLs,Doctor Eye Health,2025-03-09T16:21:04Z,https://www.youtube.com/watch?v=aNWto3zpxLs,Can the carnivore diet actually improve your vision? Many people claim their eyesight has gotten better since switching to an ...,29,9045,328,28
Vitamins I take on the Carnivore Diet,DRAQGF6-zwY,JK Fitness and Nutrition,2025-01-31T15:19:11Z,https://www.youtube.com/watch?v=DRAQGF6-zwY,There are 3 main vitamins I take on the carnivore diet. Unfortunately there are essential vitamins we need that cannot be found in ...,58,8162,560,66
Crispy Air Fryer Sardines Recipe for Keto Carnivore Diet 72 Hour Sardine Challenge,pz7EOhMQNQs,Ketogenic Woman,2025-01-03T21:00:37Z,https://www.youtube.com/watch?v=pz7EOhMQNQs,Crispy Air Fryer Sardines Recipe for Keto Carnivore Diet 72 Hour Sardine Challenge Watch the full video Air Fryer Sardines With ...,40,6245,332,8
"""The Carnivore Diet Didn't Work For Me"" Here's Why...",EPA8Dt1fwXU,Dr. Abs,2025-01-14T12:25:23Z,https://www.youtube.com/watch?v=EPA8Dt1fwXU,"I don't sell products, but I do sell education to help you or your patients live longer, healthier and beautiful-er for as cheap as ...",39,5477,295,40
CARNIVORE DIET - 💰 SAVE MONEY AT COSTCO!,M0DyDKhjuBs,Beatdown BBQ,2025-01-07T03:24:56Z,https://www.youtube.com/watch?v=M0DyDKhjuBs,,125,6186,397,10
What I eat in a day on the carnivore diet! #food #keto #carnivore #lowcarb,b0Sg3e1eVQg,Carnivore Revolution,2025-01-22T02:48:12Z,https://www.youtube.com/watch?v=b0Sg3e1eVQg,,35,4911,452,16
#godisgood#day1#carnivorediet #carnivore #diet#weightloss #motivation#weightlossjourney#fyp #fy,AM66vyq4S5o,Johan Team carnivore ,2025-01-14T23:11:17Z,https://www.youtube.com/watch?v=AM66vyq4S5o,,60,4234,310,43
"Losing weight with the carnivore diet, what I eat #food #carnivore #lowcarb #keto",BqadJNNLNcE,Carnivore Revolution,2025-01-20T04:44:45Z,https://www.youtube.com/watch?v=BqadJNNLNcE,,54,4300,368,21
Carnivore Diet Day24 #carnivore#carnivorediet#diet#meat#foodie#foodlover#fyp#shorts#foodlover,ArZswYVBv4k,DooDooPoo,2025-01-08T21:33:45Z,https://www.youtube.com/watch?v=ArZswYVBv4k,,,,,
The Carnivore diet and perimenopause,K46wpBieM3U,JK Fitness and Nutrition,2025-01-09T23:22:02Z,https://www.youtube.com/watch?v=K46wpBieM3U,I get asked quite often if the Carnivore diet is ideal for peri/menopausal women. I can't think of a better way of eating for me that ...,51,7488,512,37
My fat intake on the Carnivore Diet,vIyg3fhONCo,JK Fitness and Nutrition,2025-01-27T18:08:44Z,https://www.youtube.com/watch?v=vIyg3fhONCo,"Although this video is from my first few months eating carnivore, the same could be said about how I approach my meals today.",59,5879,499,30
Florida Man Excretes Cholesterol Through Skin After Adopting Carnivore Diet | GRAVITAS,chleLbxK1fM,WION,2025-01-29T18:01:39Z,https://www.youtube.com/watch?v=chleLbxK1fM,A Florida man in his 40s landed in hospital after following online advice to adopt a carnivore diet of only meat and dairy.,60,3314,72,13
Steak 🥩& Eggs 🍳 For Lunch #carnivore #diet #steak #howto #dad #medium #carnivorediet,7rhGqN1Cp70,Cez Visuals ,2025-03-01T16:05:16Z,https://www.youtube.com/watch?v=7rhGqN1Cp70,,61,3248,166,9
CARNIVORE Deviled Eggs! #food #cooking #recipe #carnivore #carnivorediet #eggs #protein #yummy,yZtDatQaVE8,Maria Emmerich,2025-03-16T14:57:52Z,https://www.youtube.com/watch?v=yZtDatQaVE8,,60,3657,0,11
Q is for Quality | ABCs of Keto and Carnivore Diet #keto #carnivorediet,eXeGAnreg2s,Ketogenic Woman,2025-02-26T21:00:29Z,https://www.youtube.com/watch?v=eXeGAnreg2s,"Q is for Quality | ABCs of Keto and Carnivore Diet Watch PART 2 of ""ABCs of Carnivore & Keto"" Sunday Live Q&A Replay (or click ...",37,3200,418,16
What I eat in a day on a high fat carnivore diet! #food #keto #lowcarb #carnivore #wieiad,ZaiAMLx8KDs,Carnivore Revolution,2025-01-28T04:47:12Z,https://www.youtube.com/watch?v=ZaiAMLx8KDs,,38,2994,426,33
I Made The Ultimate Carnivore Diet Recipe,Rd-iykRs6zw,John Phillips Fishing,2025-02-12T12:34:02Z,https://www.youtube.com/watch?v=Rd-iykRs6zw,"In this video, I'm excited to share with you the ultimate carnivore diet recipe that combines the power of animal protein and healthy ...",58,10349,296,10
1 1/2 Years on the Carnivore Diet: A Typical Day of What I Eat,q3YFbpRlnnk,StevenSteph,2025-03-13T17:01:02Z,https://www.youtube.com/watch?v=q3YFbpRlnnk,"Curious about life on the Carnivore Diet? After 1 1/2 years of eating only meat, here's a typical day of what I eat! From breakfast to ...",144,2765,237,14
Is the carnivore diet a concern for pregnancy? @mikhaila,y4HivXA3QJY,"Robert Kiltz, MD",2025-01-28T18:00:46Z,https://www.youtube.com/watch?v=y4HivXA3QJY,"In the podcast episode ""Doctor On The Carnivore Diet and Fertility | Robert Kiltz EP 218,"" Dr. Robert Kiltz, a fertility expert and ...",58,4653,353,4
Carnivore Diet for 22 Years #carnivorediet,AKYtZVdCQNw,Dr. Shawn Baker Podcast,2025-02-17T03:00:11Z,https://www.youtube.com/watch?v=AKYtZVdCQNw,Revero Clinic for treating chronic diseases: https://revero.com Join Revero Now to transform your health: ...,36,2409,427,14
Day 30 #carnivorediet This is #lunch 🍳 #carnivorejourney #food #weightloss #motivation #carnivore,3XZN7dkiGig,Coach Crim,2025-01-04T21:36:40Z,https://www.youtube.com/watch?v=3XZN7dkiGig,,53,2393,124,4
N is for Nature | ABCs of Keto Carnivore Diet #keto #carnivorediet #carnivore,IRZLgjA7BLI,Ketogenic Woman,2025-02-21T21:00:22Z,https://www.youtube.com/watch?v=IRZLgjA7BLI,"N is for Nature | ABCs of Keto Carnivore Diet Watch PART 2 of ""ABCs of Carnivore & Keto"" Sunday Live Q&A Replay (or click on ...",28,2469,193,7
Carnivore Diet 101 | New Year’s Resolution To Unlimited Energy #coaching #diet #carnivore #fitness,a9M6asawh8Y,Zack Bowden,2025-01-04T00:59:22Z,https://www.youtube.com/watch?v=a9M6asawh8Y,,44,2469,117,3
Carnivore Diet Secret,ccBW3FY0-3o,Carnivore Quest,2025-02-19T02:52:46Z,https://www.youtube.com/watch?v=ccBW3FY0-3o,The Carnivore Diet gets rid of sugar and carb cravings. #carnivore #carnivorediet #weightloss #shorts #health.,26,3058,329,15
Carnivore Congee #carnivore #carnivorediet #protein #lowcarb #recipe #mealprep #yummy #ketodiet,iDSDJBacMpQ,Maria Emmerich,2025-01-09T17:36:22Z,https://www.youtube.com/watch?v=iDSDJBacMpQ,,17,2311,0,0
Big Mac’s on CARNIVORE BREAD! #food #carnivore #carnivorediet #mealprep #yummy #keto #ketodiet,vTjggh4cMOQ,Maria Emmerich,2025-01-17T17:53:10Z,https://www.youtube.com/watch?v=vTjggh4cMOQ,,21,2309,0,14
WHAT I’VE LEARNED ONE WEEK ON CARNIVORE DIET 🥩🤯,FU-CB1m4T18,Alex Murphy,2025-01-10T18:26:41Z,https://www.youtube.com/watch?v=FU-CB1m4T18,WHAT I'VE LEARNED ONE WEEK ON CARNIVORE DIET.,221,2131,94,9
Day 26 🥩 #food #carnivore #diet #steak,6PMIA-oomH0,Ethan Massey,2025-01-26T18:03:22Z,https://www.youtube.com/watch?v=6PMIA-oomH0,,8,2019,43,2
RFKJr. joked about putting Gov. Morrisey on a carnivore diet. #rfkjr #govmorrisey #diet #shorts,JnqBNmGdw8Q,Jeff Square,2025-03-28T18:45:41Z,https://www.youtube.com/watch?v=JnqBNmGdw8Q,"At the podium on Friday, RFK Jr. joked about putting Gov. Morrisey on a carnivore diet and making him participate in public ...",57,2174,150,6
No More SUNBURN On The Carnivore Diet? 👉,Mplzh_BL_ns,Dr. Abs,2025-03-06T22:20:32Z,https://www.youtube.com/watch?v=Mplzh_BL_ns,No More SUNBURN On The Carnivore Diet?,12,3300,125,19
The Carnivore Diet: Why It's Harmful for Nerve Healing,N3hh-YrHThM,The Nerve Doctors - Neuropathy Pain Treatment,2025-02-27T19:01:28Z,https://www.youtube.com/watch?v=N3hh-YrHThM,Explore the hidden dangers of the carnivore diet for nerve health. We uncover the deficiencies in essential nutrients like B ...,59,2344,134,26
GERD and Meat | ABCs of the Keto Carnivore Diet,779C_M_7qV0,Ketogenic Woman,2025-02-03T21:00:09Z,https://www.youtube.com/watch?v=779C_M_7qV0,"GERD and Meat | ABCs of the Keto Carnivore Diet Watch ""ABCs of Carnivore & Keto"" Sunday Live Q&A Replay: ...",57,2408,279,8
Is COFFEE Ruining Your Carnivore Diet??,m-n9fPInUNY,Ancestral Wisdom,2025-01-06T13:39:28Z,https://www.youtube.com/watch?v=m-n9fPInUNY,Should you drink coffee on a carnivore diet? The answer might surprise you!,48,3798,78,3
Dr. Mike Israetel On The Carnivore Diet #carnivorediet,iN9lq_O_0Wo,Dr. Shawn Baker Podcast,2025-02-12T03:00:37Z,https://www.youtube.com/watch?v=iN9lq_O_0Wo,Revero Clinic for treating chronic diseases: https://revero.com Join Revero Now to transform your health: ...,55,2612,119,10
G is for Gut Healing | ABCs of Keto Carnivore Diet,MIQpDUxqYSs,Ketogenic Woman,2025-02-05T21:00:30Z,https://www.youtube.com/watch?v=MIQpDUxqYSs,"G is for Gut Healing | ABCs of Keto Carnivore Diet Watch ""ABCs of Carnivore & Keto"" Sunday Live Q&A Replay: ...",37,1886,142,8
Counting calories on the Carnivore Diet,xyVxrXqwd7M,JK Fitness and Nutrition,2025-02-11T17:19:37Z,https://www.youtube.com/watch?v=xyVxrXqwd7M,"I get asked quite often, do I track calories? How much do I eat ? First off, I have come from a long history of tracking my macros ...",58,3315,242,23
HOW TO SHOP FOR THE CARNIVORE DIET ON A BUDGET!,lP3WQJUTGtQ,Alex Murphy,2025-01-21T15:43:47Z,https://www.youtube.com/watch?v=lP3WQJUTGtQ,HOW TO SHOP FOR THE CARNIVORE DIET ON A BUDGET!,180,2812,122,5
Dietitian Reviews the Viral Carnivore Diet,D06wm24La1Q,Joe Leech (MSc) - Gut Health & FODMAP Dietitian,2025-01-27T17:00:14Z,https://www.youtube.com/watch?v=D06wm24La1Q,The carnivore diet has a lot of flaws that not enough people are talking about...here's why I wouldn't recommend it as a gut health ...,55,3145,66,42
Day 7 of Carnivore Diet #healthy #carnivore #holistichealth #healthyeating #gym #foodie #growth#diet,t4VNrvGDpD8,Raining Zi,2025-02-15T18:48:53Z,https://www.youtube.com/watch?v=t4VNrvGDpD8,,15,1694,30,5
Carnivore Pancakes! #carnivore #carnivorediet #animalbased #recipe #worldcarnivoremonth #food #keto,CgalYXgCIRw,Maria Emmerich,2025-01-08T18:40:00Z,https://www.youtube.com/watch?v=CgalYXgCIRw,,15,1874,0,0
O is for Oxylates | ABCs of Keto and Carnivore Diet #keto #carnivore,ICzvClwbgoo,Ketogenic Woman,2025-02-23T21:00:19Z,https://www.youtube.com/watch?v=ICzvClwbgoo,"O is for Oxylates | ABCs of Keto and Carnivore Diet Watch PART 2 of ""ABCs of Carnivore & Keto"" Sunday Live Q&A Replay (or ...",47,1779,285,9
Debunking the Carnivore Diet's War on Vegetables: What Science Says,8gzjwhqkRg4,Sentient,2025-02-25T13:30:05Z,https://www.youtube.com/watch?v=8gzjwhqkRg4,"Meatfluencers want you to believe that vegetables are bad for you, but what does the science say? Subscribe to our channel: ...",140,1775,49,127
