Title,Video ID,Channel,Published At,URL,Description,Video Length
Start Your Day Right  The Power of Warm Lemon Water,Xx-W2N_7gTM,IIOM,2025-02-07T15:08:50Z,https://www.youtube.com/watch?v=Xx-W2N_7gTM,IIOM - International Institute of Original Medicine - Subscribe to our YouTube channel: https://bit.ly/IIOMonlineYouTube for more ...,
#sunshinetea #lemonginger #lemonwater #organichoney #morningroutine,HfZlBDyP8I4,LunasLunaverse,2025-03-13T10:42:06Z,https://www.youtube.com/watch?v=HfZlBDyP8I4,,
"Drink This Lemon Water For Few Days, Results Will Amaze You 😱",RKRno3mff6k,Doctor Ayesha Qaiser,2025-02-25T14:21:51Z,https://www.youtube.com/watch?v=RKRno3mff6k,"Drink This Lemon Water For Few Days, Results Will Amaze You Lemon water has several potential health benefits, including: ...",
The Benefits of Drinking Lemon Water☑️ #benefits #drink #lemon #lifestyle #youtubeshort #facts,kH7wZceYs5g,Balance lifestyle,2025-03-15T22:09:20Z,https://www.youtube.com/watch?v=kH7wZceYs5g,,
Benefits of Honey & Lemon Water in the Morning #healthhorizon #healthytips #lemon #honeybenefits,ETYEwW6MgJI,HEALTH HORIZON,2025-02-17T12:43:38Z,https://www.youtube.com/watch?v=ETYEwW6MgJI,,
The perfect lemon water with bubbles. #sulfitefree #nosulfites #lemonwater,cSYPTy7FI4Q,Everyday Nickel,2025-02-16T13:05:06Z,https://www.youtube.com/watch?v=cSYPTy7FI4Q,,
Revitalize Your Mornings  Lemon Water Boost!,0TJnXMR_eYI,Info Express,2025-01-30T10:00:03Z,https://www.youtube.com/watch?v=0TJnXMR_eYI,,
Did You Know Lemon Water Burns 3x More Belly Fat? #weightlosstips,I2bi7-uNlmI,NaturalCures89,2025-01-18T13:42:36Z,https://www.youtube.com/watch?v=I2bi7-uNlmI,Subscribe to Natural Cures : http://bit.ly/2WUEEIc For more Our Programs: ▻ Visit: https://beacons.ai/naturalcures89 Our social ...,
What Happens If You Drink Lemon Water Every Morning? 🍋#LemonWater #MorningRoutine #HealthTips,n9ybT3FcnV0,Do you know ?,2025-03-13T12:15:05Z,https://www.youtube.com/watch?v=n9ybT3FcnV0,"Ever wondered what drinking lemon water every morning does to your body? ✨ It can improve digestion, boost your immune ...",
Easy way to lemon water😋 #youtubeshorts #lemon #water #shorts #shortvideos #shortsviral #make #tips,r8LxHdqyfvE,Nirmala Simple Vibes 😍,2025-02-20T05:03:03Z,https://www.youtube.com/watch?v=r8LxHdqyfvE,,
"""5 Surprising Benefits of Drinking Lemon Water""",nPNyAHymhQ8,Health Hub,2025-01-14T14:42:18Z,https://www.youtube.com/watch?v=nPNyAHymhQ8,Did you know that starting your day with lemon water can transform your health? Discover five incredible benefits of drinking ...,
Lemon water with mint is so delicious💖 #lemon #water  #lemonwater #delicious #love  #loveit,F6z2RTPMURY,Yusuf Aytac,2025-03-28T11:42:09Z,https://www.youtube.com/watch?v=F6z2RTPMURY,,
7 Reasons to Sip Lemon Water This Summer || Summer Health || GHK RiteDiet by Dr. Tejji Sarna,Xn3zqOWAfIw,GHK RiteDiet by Dr Tejji Sarna,2025-03-28T14:49:06Z,https://www.youtube.com/watch?v=Xn3zqOWAfIw,LemonWater #SummerHealth #Hydration #ImmunityBoost #HealthyLiving #WellnessTips Discover the refreshing benefits of ...,
Benefits of morning Lemon water (Part 2) 🍋💦#lemonwater #lemon #lemons #health #healthy #healthtips,8vRi_ypJc4U,Dougie Doge,2025-03-18T08:10:33Z,https://www.youtube.com/watch?v=8vRi_ypJc4U,,
Lemon water 😋😋🥰🥰#youtubeshorts video # yt short video 🥰,SDkgOQ5ti0k,Piyali Hazra,2025-03-23T10:45:49Z,https://www.youtube.com/watch?v=SDkgOQ5ti0k,,
Challenge to drink lemon water for 14 days  #lemon #lemonjuice #squeezlemon #shorts #youtubeshorts,UkR0a17aNS4,The Well-Being,2025-03-01T23:00:32Z,https://www.youtube.com/watch?v=UkR0a17aNS4,Challenge to drink lemon water for 14 days #benefitsoflemonwater #lemon #lemonjuice #squeezlemon#challenge #shorts ...,
Lemon water challenge the final day we made it #shortirl #challenge2025 #sweatsquad,hKyWYEwZrc4,Miss Key Kitchen and more 🤍,2025-01-31T15:15:38Z,https://www.youtube.com/watch?v=hKyWYEwZrc4,,
health benefits of drinking lemon water~ 🍋🤍~,s6HY41OmwcE,lunar_hijabi12,2025-03-29T16:39:12Z,https://www.youtube.com/watch?v=s6HY41OmwcE,,
Why You Should Drink Warm Lemon Water,5204IW5cStE,Zoby Zone,2025-01-28T17:00:07Z,https://www.youtube.com/watch?v=5204IW5cStE,stay healthy by eating and drinking healthy.,
The Truth About Drinking Lemon Water 🍋,hHKpuIcGlDQ,Flex Factor,2025-01-22T19:00:23Z,https://www.youtube.com/watch?v=hHKpuIcGlDQ,"Discover delicious and healthy food tips to elevate your meals! Whether you're looking for heart-friendly recipes, quick meal ideas ...",
🍋 Start your day with lemon water! Boost immunity + digestion. 🌞,I0Je6_yFskw,Simone Gisondi,2025-03-03T11:55:51Z,https://www.youtube.com/watch?v=I0Je6_yFskw,Start your day with lemon water! Boost immunity + digestion. #HealthTips #Hydration #Immunity #xuhuongtiktok.,
Chia seeds #chiaseeds #lemon #water #shortfeed #shorts #shortsfeed #vitamin #gaming #sunset #health,7ofsoHw8gQc,Living my dream by Tamana ,2025-03-16T14:23:38Z,https://www.youtube.com/watch?v=7ofsoHw8gQc,,
Drink lemon water #reduce #weight #naturally,kXymCYXdwNw,Dr. Nasir Ali Khan Vlogs,2025-01-02T21:13:48Z,https://www.youtube.com/watch?v=kXymCYXdwNw,,
Healthy with Lemon Water - #lemonwater #health #drink #weightloss #skincare #vitaminc #detox,dP4XStazPU0,VitalVision_EN,2025-02-13T02:00:25Z,https://www.youtube.com/watch?v=dP4XStazPU0,"In this video, we reveal the surprising benefits of lemon water for your health. We'll show you how to easily prepare your own ...",
"If you don’t know much about drinking lemon water daily, you guys need to do your research on this",zUqMxzlA1fw,Just Jess,2025-02-24T00:05:42Z,https://www.youtube.com/watch?v=zUqMxzlA1fw,"If you don't know much about drinking lemon water daily, you guys need to do your research on this and the perfect way to get ...",
Having a Cup of Warm Lemon Water...,QKgO9fj88C4,Healing Tips,2025-01-24T19:57:48Z,https://www.youtube.com/watch?v=QKgO9fj88C4,Healing Tips: ✨https://linktr.ee/HealingTips Having a Cup of Warm Lemon Water... #healingtips #healingnaturally ...,
Jeera Water for Good Digestion & Weight Loss |Cumin Lemon Water |जीरा पानी,ruTcbwUiDhA,Khana Khazana,2025-03-19T04:15:13Z,https://www.youtube.com/watch?v=ruTcbwUiDhA,,
Experiment of salt and Lemon+Water,za-0heDZ7M8,Kuttikurumbikal ,2025-03-08T07:56:48Z,https://www.youtube.com/watch?v=za-0heDZ7M8,,
Morning Lemon Water Benifits,hPEshD9jesE,Health tips shorts,2025-03-21T17:34:00Z,https://www.youtube.com/watch?v=hPEshD9jesE,,
I Tried The Magical Lemon Water TikTok Trend,kUqpQawJ6lM,Recipes Shorts,2025-02-21T08:10:00Z,https://www.youtube.com/watch?v=kUqpQawJ6lM,https://www.youtube.com/@Recipesshortss @hebbars.kitchen @BristiHomeKitchen @nishamadhulika @ChefPrateeksKitchen ...,
lemon water 🌊💦💦 #music #remix,bcu6NNv-0Fc, rowdy baby ,2025-03-17T10:17:06Z,https://www.youtube.com/watch?v=bcu6NNv-0Fc,,
Main Reason of Drinking Lemon Water Every Morning !,PiEwr3W5DgE,Doctor Television,2025-01-05T16:54:26Z,https://www.youtube.com/watch?v=PiEwr3W5DgE,Main Reason of Drinking Lemon Water Every Morning ! Welcome to Doctor Television @doctortelevision1 Discover the incredible ...,
Tasty#Healthy#Lemon Water.(Summer Drink).,w-FQeeTpqSs,Cook with Mary's Vlog,2025-02-28T15:41:28Z,https://www.youtube.com/watch?v=w-FQeeTpqSs,,
Honey & Lemon water : the ultimate morning boost,msBXKa23U9s,HEALTHY LIFESTYLE P  ,2025-02-17T11:49:20Z,https://www.youtube.com/watch?v=msBXKa23U9s,healthylifestyle #like #share #subscribe #shortvideo #youtubeshorts.,
Lemon Water in the Morning 🍋☀️ @MedicalMediumAnthonyWilliam 🙏🏼,3EoNrm54Nzo,Yoga Diet & Lifestyle,2025-02-12T04:05:13Z,https://www.youtube.com/watch?v=3EoNrm54Nzo,This is an excellent way to start the day. ☀️ Morning is a natural cleansing time for the body. Half a lemon in 16 ounces of cool ...,
Zest Up Your Life with Lemon Water! #shorts #lemonwater #hydration #healthtips #moodboost,rtQbvJUsDWk,Ageless Wellbeing,2025-03-21T16:01:05Z,https://www.youtube.com/watch?v=rtQbvJUsDWk,Discover the refreshing benefits of lemon water and creative ways to incorporate it into your daily routine for hydration and ...,
✨ Refresh and revitalize with Lemon Perfect Lemon Water! 🍋 Hydrate your body and enjoy a burst of,0wWGMOLBRL4,Just Jess,2025-01-30T19:03:06Z,https://www.youtube.com/watch?v=0wWGMOLBRL4,Refresh and revitalize with Lemon Perfect Lemon Water! Hydrate your body and enjoy a burst of zesty flavor without any added ...,
Detox water every Morning by Shalini Passi | Lemon water | Detox your body #shorts,M6geWDjTQjo,Sippy Bhatia,2025-02-18T03:53:45Z,https://www.youtube.com/watch?v=M6geWDjTQjo,,
Start your day with Lemon Water🍋,dDmja_zkjh4,GenZenHub,2025-02-08T02:00:33Z,https://www.youtube.com/watch?v=dDmja_zkjh4,HealthJourney #HealthyLiving #Nutrition #BalancedLifestyle #HolisticHealth #WellnessJourney #MentalWellness #SelfCare ...,
Lemon Water,--6dXVV2Ot0,Health and Herbs,2025-02-09T08:45:00Z,https://www.youtube.com/watch?v=--6dXVV2Ot0,"Lemon Water Benefits | Start Your Day with a Refreshing Boost Looking for a quick, refreshing way to kickstart your day?",
Start Your Day with Lemon Water #lemonwaterbenefits  #balancenutrition #short,BVqXHLwg4n8,healthper,2025-01-13T09:45:44Z,https://www.youtube.com/watch?v=BVqXHLwg4n8,"Start Your Day with Lemon Water Why drink lemon water in the morning? It's an easy way to hydrate, support liver function, and ...",
Starting the day with a glass of lemon water is a game changer!  | HealthPro | Med About You,bx_rqkHlXck,MED ABOUT YOU,2025-01-02T20:00:30Z,https://www.youtube.com/watch?v=bx_rqkHlXck,"Welcome to Med About You, your go-to destination for all things health, wellness, and medical knowledge! It aids digestion ...",
नींबू पानी पीने के फायदे | Benefits Of Drinking Lemon Water | #shorts,2vXR7Jm-wDQ,Fact's Pifa,2025-01-19T12:00:05Z,https://www.youtube.com/watch?v=2vXR7Jm-wDQ,नींबू पानी पीने के फायदे | Benefits Of Drinking Lemon Water | #shorts Tags: nimbu pani peene se kya hota ...,
Start Your Day Right: Benefits of Warm Lemon Water in the Morning 🍋💧,Uo-KRTTFH6g,DIY Remedy,2025-01-01T13:45:02Z,https://www.youtube.com/watch?v=Uo-KRTTFH6g,Start Your Day Right: Benefits of Warm Lemon Water in the Morning Have you tried drinking warm water with lemon first thing ...,
Warm Water vs. Copper Water vs. Lemon Water | Which is Best to Drink in the Morning?,TwdbkdMKNtg,RO Water Solutions,2025-03-12T04:30:12Z,https://www.youtube.com/watch?v=TwdbkdMKNtg,"Drinking water in the morning is one of the best habits for good health, but which type of water is best? Warm Water? Copper ...",
Day 12 #challenge #lemon #lemonwater #challengeaccepted #detox #healthyliving #healthy #skiing #hi,tXaNXQgLURg,Hangout With Kim,2025-02-22T17:09:59Z,https://www.youtube.com/watch?v=tXaNXQgLURg,"Hi, I'm Kim Originally from The South Of Vietnam, I am now exploring life in France, and since I have had a chance to live in ...",
Starting the day with a glass of lemon water is a game changer! | Med About You,hamzK5mWymY,MED ABOUT YOU,2025-03-01T20:00:19Z,https://www.youtube.com/watch?v=hamzK5mWymY,"Welcome to Med About You, your go-to destination for all things health, wellness, and medical knowledge! It aids digestion ...",
Health Benefits Of Lemon Water #shorts #health,aXM9Em2sCLw,Viralom,2025-01-05T13:19:06Z,https://www.youtube.com/watch?v=aXM9Em2sCLw,Health Benefits Of Lemon Water #shorts #health About the video: Start your day with the amazing benefits of lemon water!,
"""Start your day with a refreshing boost! 🍋 #lemon #lemonwater #lemonjuice #lemonwaterbenefits",pGaBq9gcN1c,Health & food ?,2025-01-14T08:22:17Z,https://www.youtube.com/watch?v=pGaBq9gcN1c,"What happens to your body if you drink lemon water every day? Lemon has Stronger Immune System, Packed with vitamin C, ...",
Why You Should Drink Cinnamon Lemon Water Every Morning | A Simple Drink with 8 BIG Health Benefits,UjKq90cyWik,Wellness,2025-02-18T18:18:00Z,https://www.youtube.com/watch?v=UjKq90cyWik,Why You Should Drink Cinnamon Lemon Water Every Morning | A Simple Drink with 8 BIG Health Benefits Discover the 8 ...,
Lemon water health benefits | animation series #health #lemon #water #body #viralvideo,lgGCmtEikjE,*Animation series*,2025-02-01T13:18:16Z,https://www.youtube.com/watch?v=lgGCmtEikjE,lemonjuice #health #lifestyle #benefits #amazingfact #comedy #animations #jokes #art #shortsviral #shortsfeed General Health ...,
Sparkling Lemon Water Refreshing Health Boost!,JjYmbwnxBU8,Fantomazfors ,2025-03-28T07:16:45Z,https://www.youtube.com/watch?v=JjYmbwnxBU8,,
Prepping my lemon water for in the morning 🍋#lemonwater #detoxify#lemon#food #health#healthy,ufvJjQCrzww,Christal's Body Shop,2025-02-02T23:19:01Z,https://www.youtube.com/watch?v=ufvJjQCrzww,,
Lemon benefits |  lemon water  k faiday | healthy food | health tips,4vEwOmrAdYg,Healthy food for all,2025-02-03T05:31:51Z,https://www.youtube.com/watch?v=4vEwOmrAdYg,lemon benefits| lemon k faiday #lemon #lemonwater #lemonforhelath #healthyfood #healthyfoods #best #food #healthtips ...,
Benefits of drinking lemon water in the morning#healthylifestyle #health #viralvideo #ytshorts,dwHlxVziluE,Healthy Tips,2025-01-27T16:22:14Z,https://www.youtube.com/watch?v=dwHlxVziluE,,
"Drink Lemon Water for 7 Days 🍋,💪,✨ #shorts #morning",fCEw4NZlLGM,Dawn to Dusk,2025-01-30T06:05:02Z,https://www.youtube.com/watch?v=fCEw4NZlLGM,"Bored with plain water? Consider experimenting with lemon water! In this short, I reveal why lemon water is exploding in ...",
Day 19 Challenge Drinking Lemon Water #friends #letsplay  #challange #weekend #detox #girl  #healthy,X3LZ03i2CMA,Hangout With Kim,2025-03-01T14:24:32Z,https://www.youtube.com/watch?v=X3LZ03i2CMA,"Hi, I'm Kim Originally from The South Of Vietnam, I am now exploring life in France, and since I have had a chance to live in ...",
Wonderful World of Lemons: 🍋 Benefits of Lemon Water ~Dr. Davari,YI2Y-FJ5lno,TashxTalks,2025-01-16T17:45:01Z,https://www.youtube.com/watch?v=YI2Y-FJ5lno,Drinking lemon water can offer several potential health benefits. Here's a breakdown of the key advantages: 1. Hydration Support ...,
BENEFIT LEMON WATER,9CfYpJFJF1o,GissHealthyTips TV,2025-02-28T08:54:39Z,https://www.youtube.com/watch?v=9CfYpJFJF1o,"Start your day with a refreshing glass of lemon water! Boost your immunity, improve digestion, and hydrate your body right from ...",
🍋 water#cutebaby #lemon #water #ytshorts,vxznLhFcF3M,Pupi yt,2025-02-10T11:17:59Z,https://www.youtube.com/watch?v=vxznLhFcF3M,,
The Dangerous Side Effect of Drinking Too Much Lemon Water!,81_bx7J7RMc,FITWEIGHTLOGY,2025-03-27T17:00:16Z,https://www.youtube.com/watch?v=81_bx7J7RMc,"Hi, everyone! Today's video talks about: The Dangerous Side Effect of Drinking Too Much Lemon Water! ✓ VISIT OUR WEBSITE ...",
lemon water فوائد الليمون,aRYni6G52J8,Baszmat Almarifa,2025-02-18T11:55:09Z,https://www.youtube.com/watch?v=aRYni6G52J8,"lemonCitrus fruits, such as lemons, are particularly rich in vitamin C. This vitamin acts as an antioxidant, safeguarding your cells ...",
HEALTHY CHALLENGES: 7 DAYS DRINKING LEMON WATER - WHAT HAPPENS?,q7GWWW-SMUA,Lifestyles,2025-01-30T21:27:37Z,https://www.youtube.com/watch?v=q7GWWW-SMUA,"What if you drank lemon water for 7 days? In this exciting short, we dive into my personal experience and the amazing changes ...",
Cucumber and lemon water recipe #recipe #drinkrecipes #healthy #talks #viralvideo #viral #shorts,K19NEZrCZbE,justjudith,2025-03-22T22:21:34Z,https://www.youtube.com/watch?v=K19NEZrCZbE,,
drink lemon water every day for 7 days! 🍋,7HxtyGDr7kM,Body BoostHQ,2025-01-15T16:00:10Z,https://www.youtube.com/watch?v=7HxtyGDr7kM,"improved digestion and glowing skin to boosted energy and detoxification, this simple habit can transform your health. Start your ...",
"""Start Your Day Right! | Chia Seeds & Lemon Water Morning Routine"" #shorts",W1oX1bBaEcU,Sangeeta Wellness Hub,2025-03-25T01:50:49Z,https://www.youtube.com/watch?v=W1oX1bBaEcU,"""Start Your Day Right! | Chia Seeds & Lemon Water Morning Routine"" #shorts @sangeetawellnesshub ""Want to boost digestion, ...",
"Unlock the Incredible Health Benefits of Lemon Water! 🍋💧 | Boost Immunity, Detox & More!",R68HoZHpr8I,Jack Natual,2025-03-23T02:33:29Z,https://www.youtube.com/watch?v=R68HoZHpr8I,Lemon water is more than just a refreshing drink—it's a powerhouse of health benefits that can transform your overall well-being.,
5 Surprising Benefits of Drinking Lemon Water Daily!#LemonWater #HealthyHabits #DetoxDrink,UV-MG6DPHMM,𝔹𝕖 𝕦𝕟𝕚𝕢𝕦𝕖,2025-02-20T06:41:09Z,https://www.youtube.com/watch?v=UV-MG6DPHMM,,
Start Your Day With Lemon Water,2newsBQjjCQ,Healing Tips,2025-02-23T01:31:57Z,https://www.youtube.com/watch?v=2newsBQjjCQ,Healing Tips: ✨https://linktr.ee/HealingTips Start Your Day With Lemon Water #healingtips #healingnaturally #naturalremedies.,
lemon water uses/health tips #shortsviral #health,jQQVKLGbP3s,sindhu stories telugu ,2025-03-27T15:40:50Z,https://www.youtube.com/watch?v=jQQVKLGbP3s,lemon water uses/health tips #shortsviral #health #telugushorts #healthadvice #healthandwellness #healthtips #news ...,
Lemon water first thing!,EkDhMZQzgRk,Elizabeth Baker,2025-02-23T07:26:49Z,https://www.youtube.com/watch?v=EkDhMZQzgRk,,
This is the reason to always drink lemon water,cWJCprs7UKE,ALO Bariatrics,2025-01-12T16:47:03Z,https://www.youtube.com/watch?v=cWJCprs7UKE,What happens when you drink lemon water? Drinking lemon water for 14 days offers surprising benefits! Lemons contain over ...,
Premium Lemon Water to Boost Testosterone!,zO9k_NVTZjY,Now Organic Health,2025-01-04T16:06:59Z,https://www.youtube.com/watch?v=zO9k_NVTZjY,Start your morning Right and boost your Testosterone with some citrus fruit/Lemon water. #healthiswealthbaby #lemonwater ...,
Lemon Water: The Miracle Drink You NEED To Know About #lemon #lemonwater #DetoxDrink #Healthy,TXrAV9Y6zZQ,Top Chefs,2025-01-09T21:48:50Z,https://www.youtube.com/watch?v=TXrAV9Y6zZQ,Lemon Water: The Miracle Drink You NEED To Know About #lemon #lemonwater #DetoxDrink #Healthy #food #recipe Discover ...,
Start day with lemon water to hydrate and refresh🍋 #morningroutine #hydration #shorts #slowliving,feqgpb3rqRg,DDotWellness,2025-03-09T16:06:51Z,https://www.youtube.com/watch?v=feqgpb3rqRg,I start my day by drinking lemon water to hydrate and refresh. A little lemon water to kickstart the morning sets a fresh tone and ...,
#horror#lemon#water #comedy #music #cute,GiAUGNjLnvs,R̤a̤i̤n̤b̤o̤w̤g̤a̤l̤a̤x̤y̤,2025-03-22T05:41:34Z,https://www.youtube.com/watch?v=GiAUGNjLnvs,,
neembu pani peene ke fayde - Lemon Water Benefits - गर्म पानी में शहद और नींबू  मिलाकर पीने के फायदे,vSDgwM5392k, Best Ayurveda Remedies,2025-03-25T18:12:08Z,https://www.youtube.com/watch?v=vSDgwM5392k,"In this video, you will know about, neembu pani peene ke fayde - Lemon Water Benefits - गर्म पानी में शहद और ...",
Does Lemon Water Really Help You Lose Weight? Big Myth #health #healthyfood#weightloss,2zLba-9nuV4,Eternal Health Ways,2025-01-09T12:31:57Z,https://www.youtube.com/watch?v=2zLba-9nuV4,,
benefits of lemon water in em stomach | #morningdrink #fertilityjourney #dietplan #pcos #pcod #food,-h0jpGYAeFQ,yumhealthydiet,2025-02-16T06:52:50Z,https://www.youtube.com/watch?v=-h0jpGYAeFQ,,
Why You Should Start Your Day with Lemon Water! 🍋😱#YouTube#YouTuber#YouTubeChannel#YouTubeShorts.,Ne2Y1LgagF4,KNOWLEDGE BOOK,2025-02-18T12:15:02Z,https://www.youtube.com/watch?v=Ne2Y1LgagF4,,
Kickstart your morning with refreshing lemon water! ✨ Hydrate and energize your day. #MorningRoutine,IMzeuR9IxGo,Jasmeet Sandhu,2025-02-25T01:35:20Z,https://www.youtube.com/watch?v=IMzeuR9IxGo,,
Lemon water challenge Day 2 #challenge2025,GILrX7RuEbI,Miss Key Kitchen and more 🤍,2025-01-28T12:49:31Z,https://www.youtube.com/watch?v=GILrX7RuEbI,,
The Zesty Power of Lemon Water #wellness #balance #energy #balanceandharmony #fitnessmotivation,OvdBuJd-7PY,The Balanced Life ,2025-02-25T16:47:05Z,https://www.youtube.com/watch?v=OvdBuJd-7PY,,
Lemon water xpiriment,KyNWIBdRVLE,Eco-friendly-diy,2025-01-22T14:34:00Z,https://www.youtube.com/watch?v=KyNWIBdRVLE,,
Why You Should Drink Lemon Water Daily!,XHvhywK9Dug,Fit Self Care,2025-01-03T12:00:45Z,https://www.youtube.com/watch?v=XHvhywK9Dug,"Start your day the right way! Discover the amazing health benefits of drinking lemon water daily, from boosting energy to ...",
Why You Should Add Lemon Water 🍋 #shorts #healthylifestyle #morningroutine #detox,V1kzv-iSIWg,Fit Plus,2025-02-04T23:00:23Z,https://www.youtube.com/watch?v=V1kzv-iSIWg,Why You Should Add Lemon Water to Your Morning Routine Why You Should Add Lemon Water to Your Morning Routine ...,
#body cleansing with clean water and lemon #water #lemon #life,rJrq0mUPp2g,@Lyntalkshow2 ,2025-02-27T11:39:59Z,https://www.youtube.com/watch?v=rJrq0mUPp2g,,
Day 14 Challenge Drinking Lemon Water #challenge #healthyliving #detox #commitment #pushyourself,VkTACg5LkAs,Hangout With Kim,2025-02-24T09:42:55Z,https://www.youtube.com/watch?v=VkTACg5LkAs,"Hi, I'm Kim Originally from The South Of Vietnam, I am now exploring life in France, and since I have had a chance to live in ...",
Dave Tries Watermelon Lemon Perfect Hydrating Lemon Water,3DDKpMB1deE,DGF2099 Productions,2025-03-02T12:00:04Z,https://www.youtube.com/watch?v=3DDKpMB1deE,,
Experiment with lemon and salt water #trending #shorts #experiment #lemon #water #viralvideo#science,XEKqiTxTGfk,Science Tube ,2025-02-25T14:53:31Z,https://www.youtube.com/watch?v=XEKqiTxTGfk,,
Lemon Water: Myths vs. Reality! (Shocking Truth)😱 #lemonwater #health #youtubeshorts #viralvideo,oy3bEWTqE-0,Dr. Manayer’s Health World,2025-03-17T08:00:49Z,https://www.youtube.com/watch?v=oy3bEWTqE-0,The TRUTH About Lemon Water! Are You Drinking It WRONG? Lemon water is hyped as a miracle drink—but is it really that ...,
"lemon water 🍋 does not cleanse your body?!? byDr.Jen gunter, Here’s  what will!!",3prFDKHxBAA,Cryptic zone,2025-01-05T22:35:53Z,https://www.youtube.com/watch?v=3prFDKHxBAA,"Welcome to Crypric zone your space for spiritual growth, inner peace, and deeper connection to the universe. ❤️Whether you're ...",
Lemon water benefits 🍋#food #fitnesstips #diet #healthbenefits,BuDdYy9CnHA,Ahmad kamal Arshad,2025-03-24T12:00:17Z,https://www.youtube.com/watch?v=BuDdYy9CnHA,,
10 Benefits of Lemon water,GIICrbiyFyQ,Grow Healthy Lifestyle,2025-03-06T15:07:18Z,https://www.youtube.com/watch?v=GIICrbiyFyQ,,
What Happens When You Drink Lemon Water Every Day? 🍋💧 #shorts,KlpCNFjtjhk,Natural Remedies,2025-02-18T15:00:23Z,https://www.youtube.com/watch?v=KlpCNFjtjhk,"Drinking lemon water every day can do wonders for your health! In this video, we'll explore the incredible benefits of making ...",
"""3 Mind-Blowing Facts You Didn’t Know | lemon water|weight loss|eye #shorts",m95LFGRvNNU,Prince Raj ,2025-01-11T13:00:56Z,https://www.youtube.com/watch?v=m95LFGRvNNU,"""In this video, I'm sharing 3 mind-blowing facts that you probably didn't know! From eye color to the surprising benefits of lemon ...",
Turmeric with Lemon Water for SoreThroat| morning turmeric detox drink | #youtubeshorts #shorts,KjT3FY3HwS8,Cook with Moon,2025-02-11T06:25:45Z,https://www.youtube.com/watch?v=KjT3FY3HwS8,Turmeric with Lemon Water for SoreThroat| morning turmeric detox drink | #youtubeshorts #shorts #youtubeshorts #short ...,
Boost Your Vein Health with Lemon Water. #shorts.,Dea_fu47R24,Partha Gupta,2025-01-17T03:00:08Z,https://www.youtube.com/watch?v=Dea_fu47R24,Boost Your Vein Health with Lemon Water. #shorts @nutriation12. Boost your vein health naturally with the refreshing power of ...,
The Morning Ritual for Weight Loss: Warm Lemon Water #HealthyLiving #lemonwaterbenefits #weighlosst,UvcNJyB7RPU,Lifeful Health,2025-01-18T19:00:36Z,https://www.youtube.com/watch?v=UvcNJyB7RPU,Discover the amazing benefits of drinking warm lemon water every morning for weight loss and overall health! Lifeful Health.,
Lemon Water vs. Plain Water: The Ultimate Hydration Debate! 🍋💧,I14f3RVFRWE,The Kormendy Trott Team,2025-03-16T15:00:22Z,https://www.youtube.com/watch?v=I14f3RVFRWE,Watch Ariel and Adrian go head-to-head over the ultimate hydration debate! Ariel swears by his cloudy lemon water with Celtic ...,
Does Drinking Lemon Water Really Help in Weight Loss?#lemon #drink #health #myths #shorts #ytshorts,RqibBR0ZmF4,Medknows,2025-01-02T02:00:14Z,https://www.youtube.com/watch?v=RqibBR0ZmF4,,
What will happen if you drink lemon water for 2 weeks! #healthtips #healthylife,fdTd0aC1Llk,Quick Mind HQ,2025-02-19T17:03:36Z,https://www.youtube.com/watch?v=fdTd0aC1Llk,,
Drink LEMON WATER Daily For AMAZING Health Results! #shorts,ZFzsAOvUpf8,Live To Be Happy,2025-02-15T13:45:01Z,https://www.youtube.com/watch?v=ZFzsAOvUpf8,"Discover the incredible health benefits of drinking lemon water daily! From boosting your immune system to aiding digestion, and ...",
What Happens When You Drink Lemon Water EVERY Morning #lemon #healthyfood #arthritis #foodlover,_WiiKWS5LUs,Arthritis Delicious Bites,2025-03-13T14:47:08Z,https://www.youtube.com/watch?v=_WiiKWS5LUs,,
Mixed Berry Lemon Water #mukbang #foodie #fruit #water,1mCK_sofGdY,Southern Honeyyy,2025-01-23T21:02:04Z,https://www.youtube.com/watch?v=1mCK_sofGdY,,
Why Lemon Water is the Perfect Weight Loss Drink,MU_onvTZW80,Health After,2025-01-20T16:30:05Z,https://www.youtube.com/watch?v=MU_onvTZW80,Lemon water isn't just refreshing—it can help you lose weight too! Here's how it works. #WeightLossTips #HealthyDrinks ...,
