Title,Video ID,Channel,Published At,URL,Description,Video Length,Views,Likes,Comments
Raw Mango's Role in Diabetes Management #diabetes #mango #rawmango,MXFyejlYj3s,Dhanya Ama Parampara,2025-03-27T12:00:34Z,https://www.youtube.com/watch?v=MXFyejlYj3s,"Raw mango offers potential benefits for diabetes. Unlike ripe mangoes, raw mangoes boast low glycemic index, rich fiber, and ...",59,,,
"Understanding Diabetes – Causes, Symptoms & Treatment - Dr. Sanjay Kalra",9qup122kBVo,Medtalks,2025-03-12T08:15:43Z,https://www.youtube.com/watch?v=9qup122kBVo,"Understanding Diabetes: Causes, Symptoms & Treatment – Insights from Dr. Sanjay Kalra! Stay informed about diabetes ...",126,,,
Top 5 Yoga Mudras for Diabetes Management,RHcXiBY1wM0,7pranayama Yoga App,2025-01-15T13:44:54Z,https://www.youtube.com/watch?v=RHcXiBY1wM0,Find App on Play or App Store: https://goo.gl/nbTZSh You can also follow us on : Website: https://7pranayama.com Facebook: ...,56,,,
ATTD 2025: Revolutionizing Diabetes Care,3ZP9vW-43QA,ATTD,2025-01-24T07:06:03Z,https://www.youtube.com/watch?v=3ZP9vW-43QA,"Join us at ATTD 2025 in Amsterdam to explore groundbreaking science, cutting-edge technologies, and transformative ideas in ...",53,,,
Hetal Bhagat’s Diabetes Reversal – Lost 2 Kgs in Just 4 Days After Madhavbaug Treatment!,Mou3ZLMYO4I,Madhavbaug,2025-03-24T06:55:39Z,https://www.youtube.com/watch?v=Mou3ZLMYO4I,"Meet Hetal Bhagat, who was referred to Madhavbaug by his brother for diabetes reversal. After starting the treatment, ...",90,,,
#complexcarbs #diabeticfood #goodcarbs #diabetesmanagement #diabetesawareness,RF3aJfQLJv0,DieticianPharma Hub,2025-03-06T07:07:31Z,https://www.youtube.com/watch?v=RF3aJfQLJv0,,40,,,
Obesity: A Major Cause of Diabetes! Can Complex Carbs Help Control Sugar?,a8eeBtnICMM,FM Sehat Zindagi,2025-02-01T08:00:00Z,https://www.youtube.com/watch?v=a8eeBtnICMM,Obesity: A Major Cause of Diabetes! Can Complex Carbs Help Control Sugar? Subscribe our channel FM Sehat Zindagi for More ...,49,,,
Artificial Pancreas: The Future of Diabetes Control! 🔥#artificialpancreas #cgms #insulinpump,ECuQKrPykpY,ANIRBAN BISWAS CLINIC FOR DIABETES,2025-03-27T11:32:24Z,https://www.youtube.com/watch?v=ECuQKrPykpY,Managing diabetes just got easier with the Artificial Pancreas—a revolutionary system that automates blood sugar control.,55,,,
Understanding Insulin Sensitivity - Your Key To Better Diabetic Management,rpo8z-ptOLw,Insulou,2025-03-09T10:20:00Z,https://www.youtube.com/watch?v=rpo8z-ptOLw,Your insulin sensitivity tells you how sensitive you are to insulin at any given point during the day - and it does change throughout ...,32,,,
How To EAT CARBS with Diabetes! #mexicanrecipes #diabetes #diabetesmanagement,Kf88u8D4Emk,HealthySimpleYum,2025-02-28T18:11:21Z,https://www.youtube.com/watch?v=Kf88u8D4Emk,"Carbs Are Not The Enemy! Hey foodie fam, before we get into today's topic, don't forget to like and subscribe for more plant-based ...",57,,,
What is Pre Diabetes or Pre Diabetic Level #diabetesawareness #diabetesmanagement #diabetes,My7LxeHgBD8,MediDoc,2025-01-08T23:01:13Z,https://www.youtube.com/watch?v=My7LxeHgBD8,,29,,,
#insulin #insulinresistance#insulindeficiency#diabetesawareness #diabetesmanagement,7MXf1A4PdOo,DieticianPharma Hub,2025-02-27T08:33:10Z,https://www.youtube.com/watch?v=7MXf1A4PdOo,,55,,,
Does Diabetes Affect Genders Differently? | Dr. Chhavi on Women & Diabetes Management @besugarfit,BsBxyHzaLaw,besugarfit,2025-03-08T10:25:38Z,https://www.youtube.com/watch?v=BsBxyHzaLaw,Did you know that diabetes affects men and women differently? Women with diabetes have a 44% higher risk of heart disease ...,162,,,
Dr. Meenakshi - HbA1c is a Key Marker for Diabetes Management - Apollo Cradle,077m24xqoIk,Apollo Cradle,2025-03-12T12:54:53Z,https://www.youtube.com/watch?v=077m24xqoIk,"HbA1c – Your 3-Month Blood Sugar Report Card! In this video, Dr. Meenakshi R. Kamath explains why HbA1c is a key ...",123,,,
let’s change my PANCREAS? #typeonediabetes #diabetesmanagement #diabetesawareness,fBPKv9L2dok,ella | type one diabetes & lifestyle,2025-02-26T05:05:22Z,https://www.youtube.com/watch?v=fBPKv9L2dok,,18,,,
"""Unlocking the Potential of Iron Supplementation in Diabetes Management""lDr G Kiranl#drkiran",dJADewX-gSY,Diabetes Guru,2025-01-17T10:03:30Z,https://www.youtube.com/watch?v=dJADewX-gSY,"""Iron plays a crucial role in many bodily functions, including oxygen transport and energy production. But can iron ...",58,,,
Expert Insights: Dr. Shyam Prasad Reveals How Sugar Knocker Transforms Diabetes Management,ri8wmgSeIrE,Sugar Knocker,2025-01-22T04:02:59Z,https://www.youtube.com/watch?v=ri8wmgSeIrE,"Discover expert advice from Dr. Shyam Prasad as he shares the benefits of Sugar Knocker, a natural Ayurvedic supplement ...",51,,,
Diabetes Control: Low GI Foods to Include #diabetes#diabetesawareness#diabetesmanagement,3iXaI88MGXo,The Knowledge Voyage,2025-02-02T18:13:45Z,https://www.youtube.com/watch?v=3iXaI88MGXo,"Learn about low glycemic index (GI) foods in managing diabetes. Discover the best foods to stabilise your blood sugar, from ...",58,,,
What Really Happens in Your Body with Diabetes,gIZrDZUytYI,Pharmacist Online,2025-02-02T07:00:31Z,https://www.youtube.com/watch?v=gIZrDZUytYI,Diabetes Expert Shares INSULIN Secrets You Never Knew! DIABETES DECODED 2025! Uncover the truth about Type 1 vs ...,97,,,
Diet plan for Diabetes #diabetesmanagement  #diabetescare #diabetescure #diabetescontroltips,V-pdEZ29rIE,Wisdom  Health and Education Channel,2025-01-20T16:44:53Z,https://www.youtube.com/watch?v=V-pdEZ29rIE,My Experiment with Diabetes My Diet.,181,,,
SGLT2 Inhibitors  The Kidney’s Sugar Filters!,gPhetClmH8Y,Pharmacist Online,2025-02-02T19:00:25Z,https://www.youtube.com/watch?v=gPhetClmH8Y,"""Which Diabetes Medications Work BEST? ✓ Confused about diabetes medications? This video breaks down the different types ...",25,,,
Diabetes .... Management and some Allopathic or Ayurvedic medicine,ewDT6z7n_-c,Drsk Patel,2025-01-30T12:28:14Z,https://www.youtube.com/watch?v=ewDT6z7n_-c,,93,,,
The Best food to control your diabetes #shorts #shortsfeed #trending #viral,9m8rpm81gqQ,kanika chakraborty,2025-03-01T11:30:09Z,https://www.youtube.com/watch?v=9m8rpm81gqQ,Best food to control your diabetes #shorts #shortsfeed #trending #viral Your Quries:- Best food for diabetes Cure diabetes ...,24,,,
#type1diabetes #type1diabetesawareness                        #diabetesmanagement,cm_k9Hxby5I,DieticianPharma Hub,2025-02-28T18:33:18Z,https://www.youtube.com/watch?v=cm_k9Hxby5I,,41,,,
"#diabetesmanagement #youtubeshorts  #diet   #eathealthy  Smart, Live Well!",NDNn6rH0ZQ8,TOP HEALTH TV,2025-02-15T21:15:22Z,https://www.youtube.com/watch?v=NDNn6rH0ZQ8,diabetesawareness.,99,,,
Where to find life-changing tools for diabetes management #diabeticalertdog,nwcUZsfv_YI,James McCormick,2025-03-20T23:00:50Z,https://www.youtube.com/watch?v=nwcUZsfv_YI,Where to get diabetes alert dogs: a helpful tip #diabeticalertdog #diabetes #type1warrior #fok.,60,,,
Control Diabetes #diabetes #shorts #diabetesawareness #diabetesmanagement,iBtb9CySzLc,Dr. Amit Singh - Health Shorts ,2025-01-31T14:55:07Z,https://www.youtube.com/watch?v=iBtb9CySzLc,Control Diabetes #diabetes #shorts.,21,,,
Manage diabetes with coconut sugar #healthy #sugar #weightloss #shots #viralvideo #diabetes #fitness,oEPA0rOM8do,Sehat by Shivani Aswal,2025-02-15T16:03:00Z,https://www.youtube.com/watch?v=oEPA0rOM8do,,64,,,
Diabetes Management Made Simple: Essential Tips for Better Control,Gwq_P3BxTLg,DIABETES AND SKIN AND ORAL CARE,2025-01-21T12:30:16Z,https://www.youtube.com/watch?v=Gwq_P3BxTLg,Diabetes Management Made Simple: Essential Tips for Better Control #DiabetesManagement #HealthyLiving #DiabetesTips ...,60,,,
“Ragi:A superfood for diabetes management,hAVv3_W3yZo,Dhanya Ama Parampara,2025-02-04T12:44:01Z,https://www.youtube.com/watch?v=hAVv3_W3yZo,"Ragi good for people with diabetes? This nutrient-rich grain is known for its low glycemic index, making it a great choice for ...",58,,,
Regular exercise is a game-changer for diabetes management!,5WgDH6S2F3M,Erode Diabetes Foundation,2025-03-11T11:26:14Z,https://www.youtube.com/watch?v=5WgDH6S2F3M,Benefits of Exercise for Diabetes ✓ Regulates Blood Sugar - Improves insulin sensitivity and helps maintain stable glucose levels.,25,,,
Boost Your Sex Life: Manage Diabetes & Weight Now!,JWA2CLNQ2_U,The Sex Doctor,2025-03-06T12:48:49Z,https://www.youtube.com/watch?v=JWA2CLNQ2_U,Discover how managing your weight and type 2 diabetes can lead to better sexual health. We explore the connection between ...,27,,,
Diabetes Management: Balanced Diet and Exercise,MoFI4H1oZZM,GLUCOSE BALANCED BITES,2025-03-05T01:00:23Z,https://www.youtube.com/watch?v=MoFI4H1oZZM,"Practical advice for managing diabetes through a nutritious diet and regular exercise, with tips on meal planning and the benefits ...",51,,,
Heart problems in diabetes can be easily prevented. #diabetes #diabetesmanagement #diabetescare,Z4ta277zFy0,Dr. Isha Arora ,2025-01-03T13:13:10Z,https://www.youtube.com/watch?v=Z4ta277zFy0,Heart related problems are important cause of morbidity and early mortality in diabetes l. These problems are easily prevented ...,21,,,
Arugula  A Leafy Green for Diabetics! #superfoods  #food #diabetes #diabetesmanagement  #bloodsugar,TW-kACahlqs,Fit & Nourished Health,2025-03-21T23:32:14Z,https://www.youtube.com/watch?v=TW-kACahlqs,Watch the complete video here https://youtu.be/PqR_0gwVa3c.,48,,,
The Role of Omega-3 in Diabetes Management: Tips for a Balanced Diet,iE4dh5hkfzY,GLUCOSE BALANCED BITES,2025-03-09T01:00:41Z,https://www.youtube.com/watch?v=iE4dh5hkfzY,"Explore the benefits of omega-3 fatty acids in diabetes management, highlighting sources and meal tips for blood sugar control.",46,,,
Must watch - Yogic Management for Diabetes,PTmpCaCUVfE,YogaBlissforAll,2025-02-19T12:22:32Z,https://www.youtube.com/watch?v=PTmpCaCUVfE,"Diabetes is a disease that occurs when your blood glucose or blood sugar, is too high. Glucose is your body's main source of ...",199,,,
How can you smartly lower your daily medicine intake !!#drkmsaifullah #diabetesmanagement,onNtR_uig_Y,Dr. K.M. Saifullah,2025-03-17T06:30:45Z,https://www.youtube.com/watch?v=onNtR_uig_Y,"How can you smartly lower your daily medicine intake !! In this insightful video, Dr. K. M. Saifullah sir discusses how visiting an ...",42,,,
Fatigue in diabetes is common and can be easily managed. #diabetes #diabetesmanagement #diabetescare,-ozla-yPBhw,Dr. Isha Arora ,2025-01-17T12:33:58Z,https://www.youtube.com/watch?v=-ozla-yPBhw,Fatigue is an extremely common symptom experienced by people with both Type 1 and Type 2 diabetes.Major Causes of ...,46,,,
Really Dexcom ? Well this is how my morning started out !!! #diabetes #diabetesmanagement #dexcom,Ba-z5bIhVX4,Type2Princess,2025-03-19T02:07:11Z,https://www.youtube.com/watch?v=Ba-z5bIhVX4,,11,,,
Goodbye Finger Pricks: The Future of Diabetes Management is Here! 🌟,MZH9XGGhFwU,Bhavana Srikanth,2025-01-25T10:14:39Z,https://www.youtube.com/watch?v=MZH9XGGhFwU,"Diabetes management just got a major upgrade! Imagine a tiny biosensor embedded under your skin, continuously monitoring ...",51,,,
Exercise for Diabetes Management | Weight Loss |  Simrat Yoga 🧘‍♀️,1GpOadYuq-U,Simrat Yoga,2025-02-02T07:21:07Z,https://www.youtube.com/watch?v=1GpOadYuq-U,,52,,,
How does culture impact diabetes management during pregnancy for Black women in the UK?,Ci6Od6D67ok,Diabetes Africa,2025-02-11T10:13:05Z,https://www.youtube.com/watch?v=Ci6Od6D67ok,"Listen to our expert speakers, Dr Tolu Shonibare, Prof. Claire Meek, and Nuru Clark, as they discuss how cultural factors can ...",31,,,
🕒 5 Powerful Benefits of Intermittent Fasting for Diabetes Management! 🩸  #diabetes #doctor #fasting,_ZUPrOCQEMc,Sre Iswarrya Hospital,2025-03-28T04:05:49Z,https://www.youtube.com/watch?v=_ZUPrOCQEMc,Can intermittent fasting help with diabetes? The answer is YES! Watch this video to learn the 5 major benefits of intermittent ...,24,,,
Diabetes management.... small changes in your life style.,kNkDx4t74OE,Yoga lakshmi thoughts,2025-02-21T02:40:44Z,https://www.youtube.com/watch?v=kNkDx4t74OE,Diabetes Life Style.,93,,,
Revolutionize Diabetes Management with MRPS Formula Today,R7t2U6GA3L0,The Upgrade Life,2025-03-14T16:55:03Z,https://www.youtube.com/watch?v=R7t2U6GA3L0,Revolutionize your approach to diabetes management with the groundbreaking MRPS formula! Learn how this innovative ...,224,,,
4 applications of AI in diabetes management,sNRjEiPfBN8,Alcimed,2025-02-10T12:51:38Z,https://www.youtube.com/watch?v=sNRjEiPfBN8,"About 422 millions of people worldwide live with diabetes, which is the cause of 1.5 million deaths each year. Type 1 diabetes ...",97,,,
Best exercise for diabetes to reduce blood sugar levels #diabetesmanagement #diabetesreversal,IAAwVsQYios,Sehat Sangam,2025-02-02T05:00:46Z,https://www.youtube.com/watch?v=IAAwVsQYios,Walking is a best exercise in diabetes in to reduce blood glucose levels. It manages the normal blood glucose levels by two ways: ...,25,,,
Delicious Smoothie Recipe for Type 2 Diabetes Management,AGTWUGGeEKY,Meet Dr. Gyimah,2025-01-03T01:57:22Z,https://www.youtube.com/watch?v=AGTWUGGeEKY,Discover how to create a fiber and protein-rich smoothie that's perfect for managing or preventing type 2 diabetes. With simple ...,27,,,
Master Diabetes Management with Medigrad’s Fellowship in Diabetology!,wuboaHr3GYA,Medigrad,2025-02-12T10:13:42Z,https://www.youtube.com/watch?v=wuboaHr3GYA,Looking to specialize in Diabetology? Medigrad's Fellowship in Diabetology equips doctors with advanced knowledge in ...,7,,,
✅ Lantus SoloStar – Your Guide to Long-Acting Insulin  ✅#LantusSoloStar #DiabetesManagement,wPGKaqOdo9c,Dr Khalid Warraich MRCGP(UK),2025-03-18T17:17:44Z,https://www.youtube.com/watch?v=wPGKaqOdo9c,"Are you or a loved one managing diabetes? Looking for a reliable, long-acting insulin to keep your blood sugar stable?",184,,,
"#diabetesmanagement  Diet  Eat Smart, Live Well! 2025 02 15",nvjQKaDFYiw,TOP HEALTH TV,2025-02-18T01:49:06Z,https://www.youtube.com/watch?v=nvjQKaDFYiw,healthyliving.,99,,,
Diabetes and Skin Problems: What You Need to Know.... #diabetesmanagement,_UHW9FCrtJY,Dr Snehal Kulkarni,2025-01-15T06:06:16Z,https://www.youtube.com/watch?v=_UHW9FCrtJY,"Did you know that certain skin problems could be early signs of diabetes? In this video, we explore how conditions like darkened ...",187,,,
4. App Setup - BETACHEK Diabetes Management App | C50 blood glucose meter (Apple & Android Devices),_X5plK9SiDw,BETACHEK,2025-01-23T09:47:11Z,https://www.youtube.com/watch?v=_X5plK9SiDw,"The BETACHEK Diabetes Management App is free software that analyses and summarises your results, for Apple and Android ...",,,,
Can the Planets check diabetes? #diabetes #diabetesmanagement #diabetic #medical #doctor #astrology,E4vARMNsePY,Karan Manchanda,2025-02-06T12:45:36Z,https://www.youtube.com/watch?v=E4vARMNsePY,Diabetes ? Know more #diabetes #diabetic #diabetesmanagement #healthawareness #health #healthy #life #horoscope ...,56,,,
Easy Diabetes Workout #workout #diabetes,MVzgmyEa3ds,Diabetes Management Group,2025-02-16T17:12:17Z,https://www.youtube.com/watch?v=MVzgmyEa3ds,"Warm up; 5 sec x 5 reps Lower ab squeeze crunch in each position (straight, right, left) 5 sec x 5 reps ankle squeezes in each ...",57,,,
High Blood Sugar ko karo gayab 🤯🌱✨ #shorts #homeremedies #diabetesmanagement,zwwDwa520so,Wellness with Suvarna,2025-01-13T16:16:00Z,https://www.youtube.com/watch?v=zwwDwa520so,High Blood Sugar ko karo gayab ✨ #shorts #homeremedies #diabetesmanagement Your Queries: diabetes best drink for ...,19,,,
Neuropathy-diabetes management #neuroscience #neuropathy #diabetes #conservative #medicine #aging,W5-zF56Upe0,Varges Academy,2025-03-13T21:09:08Z,https://www.youtube.com/watch?v=W5-zF56Upe0,,185,,,
Foot ulcer in diabetes during winter. #diabetes #diabetesmanagement #diabetescare,8y2RgYf5YWk,Dr. Isha Arora ,2025-01-08T06:46:55Z,https://www.youtube.com/watch?v=8y2RgYf5YWk,"Many people with diabetes have numbness in feet or loss of sensation, this makes them prone to ulceration and injuries in foot.",45,,,
Healthy Choices With Diabetes - Dinner | Healthy Can Be Easy (Short 1) #diabetesmanagement #dinner,fOBElkqTn98,Gaylord Specialty Healthcare / Gaylord Hospital,2025-01-28T19:50:43Z,https://www.youtube.com/watch?v=fOBElkqTn98,"GaylordHealthcare Managing diabetes doesn't mean you have to give up a satisfying dinner! In this video, Liz Glass, a dietitian ...",60,,,
Day #4 - What I eat in a day as Diabetic ? #diabetes #diabetic #diabetesmanagement #diabetescare,AFSu7mvA_8I,Happily Diabetic,2025-03-04T07:28:03Z,https://www.youtube.com/watch?v=AFSu7mvA_8I,,60,,,
Day 16/300 . Building muscle helps a lot in my diabetes management . #diabeteslife #தமிழ்,x4ox3ST4i_o,Diabetes Conquerors,2025-01-22T21:16:37Z,https://www.youtube.com/watch?v=x4ox3ST4i_o,,19,,,
Manage Your Diabetes Now With Methi Cinnamon Tea✅ ✨#mapmymeals #recipe #nutritionforlife,DYtFQytoOZU,Map My Meals,2025-01-20T09:30:32Z,https://www.youtube.com/watch?v=DYtFQytoOZU,,22,,,
Harnessing the Power of Vitamin D in Diabetes Management,v_bRnYiPXPI,GLUCOSE BALANCED BITES,2025-03-27T00:00:52Z,https://www.youtube.com/watch?v=v_bRnYiPXPI,Explore how Vitamin D plays a crucial role in blood sugar management and overall diabetic health. #VitaminD #HealthTips ...,36,,,
Wearable Devices for Diabetes Management #Short #diabetes,y0ZbyV1WeA4,Demystifying Medicine McMaster,2025-01-03T15:01:14Z,https://www.youtube.com/watch?v=y0ZbyV1WeA4,This video provides a brief outline of two commonly used devices to manage diabetes: continuous glucose monitors (CGMs) and ...,45,,,
Dark ChocolateA Sweet Treat for Diabetes Management | Keshav,MEizi-CM9XU,Chocolate Insights by Keshav,2025-01-13T13:26:28Z,https://www.youtube.com/watch?v=MEizi-CM9XU,"Can chocolate be diabetes-friendly? Absolutely! Dark chocolate, with its lower sugar content and rich antioxidants, supports ...",49,,,
Unlocking Diabetes Management: Beyond Diet Transformation,kvrDVddS_JE,Functional Nurses & Practitioners,2025-03-21T19:56:36Z,https://www.youtube.com/watch?v=kvrDVddS_JE,Discover the hidden factors influencing diabetes beyond just dietary changes. We explore incredible interventions and the role of ...,75,,,
Recap  Managing Diabetes Medication Side Effects,uv9ei347fJw,Pharmacist Online,2025-02-04T22:30:07Z,https://www.youtube.com/watch?v=uv9ei347fJw,"If you're taking diabetes medication, understanding the side effects is crucial! In this video, we break down the most common ...",91,,,
