Title,Video ID,Channel,Published At,URL,Description,Video Length
Classmates | Pranit More | #rjpranit #pranitmore #homeopathy #love #relationship,xpSiCW4ox4g,Pranit More Crowdwork Clips,2025-01-25T12:43:17Z,https://www.youtube.com/watch?v=xpSiCW4ox4g,,
5 Cup Method Homoeopathy Medicine 💊 #sadimkhan #shorts @mariakhan.03 @mukeem03,TiDVFNC8aCk,Sadim Khan,2025-01-08T04:30:17Z,https://www.youtube.com/watch?v=TiDVFNC8aCk,team03 #mariakhan #shortsviral #shortvideo #youtubeshorts #trending #5cupmethod #homoeopathy #homoeopathic #medicine ...,
Constipationrelief(மலச்சிக்கல்)#constipation #constipationhomeremedies #guthealth #homeopathy,VqHJmkPd2oU,ilanhomoeo,2025-03-20T14:31:00Z,https://www.youtube.com/watch?v=VqHJmkPd2oU,,
Transforming Wellness with Homeopathy/Dr.Tanya Bakshi's Expert Advice #vimarsh with ‎@DrRobinSharma,WAv62kzGbaQ,Dr.Robin Sharma,2025-01-16T09:08:58Z,https://www.youtube.com/watch?v=WAv62kzGbaQ,,
|| 5 साल पुराने नज़ले का होम्योपैथी से स्थाई इलाज || #pdmjaipur #homeopathy #najla #noseallergy #pdm,5MpecGaf_G0,PDM Homeopathy Hospital,2025-01-23T13:00:05Z,https://www.youtube.com/watch?v=5MpecGaf_G0,PDM JAIPUR(Group Of Advance Homeopathy Hospital) ⛑️Permanent Treatment के लिए एडवांस ...,
|| बचपन की एलर्जी से 1 मिला महीने में आराम || #pdmjaipur #homeopathy #allergytreatment #pdm,571gMPDbENg,PDM Homeopathy Hospital,2025-01-20T13:33:17Z,https://www.youtube.com/watch?v=571gMPDbENg,PDM JAIPUR(Group Of Advance Homeopathy Hospital) ⛑️Permanent Treatment के लिए एडवांस ...,
Transplant-Free Future with Modern Homeopathy Liver Care,rGEeSKH2g5g,Modern Homeopathy,2025-03-18T11:14:08Z,https://www.youtube.com/watch?v=rGEeSKH2g5g,Transplant-Free Future with Modern Homeopathy Liver Care Mr. Gajendra Jadhav was diagnosed with Liver Parenchymal ...,
Hormonal balance secrets #homeopathy #naturalhealing #shorts #ayurveda #thehimachalipodcast,a5FkjQKxC4A,The Himachali Podcast,2025-01-26T13:10:13Z,https://www.youtube.com/watch?v=a5FkjQKxC4A,,
Best Homeopathic Medicine for Itching | Rumex Crispus | Symptoms |,cZCGC36r3pY,Drkirti vikram singh,2025-01-20T07:01:30Z,https://www.youtube.com/watch?v=cZCGC36r3pY,Namaskar Dosto in this short video i will talk about Homeopathic Medicine for Itching. Homeopathic Medicine Rumex Crispus ...,
Dissolve Gallbladder Stones Without Surgery with Modern Homeopathy!,a97LByrnDXU,Modern Homeopathy,2025-02-13T09:06:55Z,https://www.youtube.com/watch?v=a97LByrnDXU,gallbladderstones #gallbladder #digestivefluid #nonsurgicalgastroenterologist #gastroenterologist #homeopathic ...,
Alfalfa | The Great Homeopathic Tonic | Homeopathic Medicine,AVrIWW_u66A,Drkirti vikram singh,2025-02-23T08:04:36Z,https://www.youtube.com/watch?v=AVrIWW_u66A,Namaskar Dosto in this hindi short video i will talk Homeopathic Medicine Alfalfa Symptoms of Alfalfa and Alfalfa how to Use ...,
"Sulphur 200 #drtarun | sulphur 200 rajiv dixit,",FVADIKl6gAI,Dr. Tarun Chauhan,2025-03-08T03:31:08Z,https://www.youtube.com/watch?v=FVADIKl6gAI,"sulphur 200, sulphur 200 homeopathy, sulphur 200 ch ke fayde, sulphur 200c uses in hindi, sulphur 200 ch, sulphur 200 ...",
Homeopathic Medicine Cydonia Vulgaris | How to Use |,ZXySXl6DC0E,Drkirti vikram singh,2025-03-26T04:27:42Z,https://www.youtube.com/watch?v=ZXySXl6DC0E,Namaskar Dosto in this short video i will talk about Homeopathic Medicine Cydonia Vulgaris effective medicine for Energy and ...,
पुराना से पुराना बीमारी ठीक करे | Homeopathic Medicine Psorinum |,7Trd03Y4r_o,Drkirti vikram singh,2025-03-24T05:54:35Z,https://www.youtube.com/watch?v=7Trd03Y4r_o,Namaskar Dosto in this short video i will talk about Homeopathic Medicine Psorinum Effective medicine for Eczema Asthma ...,
Top 3 Homeopathic Medicine aap ke Ghar Me Jarur Hona Chahiye in summer Season |,Ok9Z0smVTn8,Drkirti vikram singh,2025-03-01T17:08:52Z,https://www.youtube.com/watch?v=Ok9Z0smVTn8,Namaskar Dosto in this short video i will talk about Homeopathic Medicine which is useful for Summer season Disease .,
My Top 3 Homeopathic Medicine Combination for Gas indigestion & Stomach Problem ?,-ctqiJ5YHRk,Drkirti vikram singh,2025-03-12T07:00:45Z,https://www.youtube.com/watch?v=-ctqiJ5YHRk,Namaskar Dosto in this short video i will talk about Homeopathic Medicine Combination for gas Acidity indigestion constipation ...,
Skin Disease 1 Best skookum chuck  Homeopathic Medicine | How to Use,fYjjAUQy5d8,Drkirti vikram singh,2025-01-07T10:38:51Z,https://www.youtube.com/watch?v=fYjjAUQy5d8,Namaskar Dosto in this short video i will talk about Homeopathic skookum chuck effective medicine for Skin Disease specially ...,
For Anemia & lack of Nutrition | Homeopathic Medicine,3vZEJ0qtYf0,Drkirti vikram singh,2025-01-09T04:55:41Z,https://www.youtube.com/watch?v=3vZEJ0qtYf0,Namaskar Dosto in this short video i will talk about Homeopathic Medicine lecithinum effective medicine for Anemia weakness ...,
Dr Reckeweg R89 Drop for Hair fall and baldness | Homeopathic hair Drop,xVyox6vL8FA,Drkirti vikram singh,2025-03-18T13:19:10Z,https://www.youtube.com/watch?v=xVyox6vL8FA,Namaskar Dosto in this short video i will talk about Homeopathic Medicine Homeopathic hair Drop Dr Reckeweg R 89 drop for ...,
Hair Oil Me Milake Lagaye | Best Homeopathic Medicine |,fV68EJYun7k,Drkirti vikram singh,2025-02-01T15:36:40Z,https://www.youtube.com/watch?v=fV68EJYun7k,Namaskar Dosto in this short video i talked about Homeopathic Medicine for hair fall . Jaborandi Mother Tincture with hair oil ...,
Pimples अब ठीक हो जायेगे | Pimples Acne Combination | Homeopathic Medicine,fOdB3y28jKM,Drkirti vikram singh,2025-01-25T16:16:40Z,https://www.youtube.com/watch?v=fOdB3y28jKM,Namaskar Dosto in this short video i will talk about Homeopathic Medicine for pimples and acne My Combination for acne and ...,
1st Acidity Combination | Homeopathic Medicine | Dr kirti vikram,gHeAM5_ony8,Drkirti vikram singh,2025-01-23T04:18:49Z,https://www.youtube.com/watch?v=gHeAM5_ony8,Namaskar Dosto in this short video i will talk about Homeopathic Medicine for Acidity . @Drkirtivikramsingh #drkirtivikramsingh ...,
पुराना सिरदर्द | Best Homeopathic Medicine | Headache Migraine |,tBjYBgb1Ww0,Drkirti vikram singh,2025-02-20T06:10:08Z,https://www.youtube.com/watch?v=tBjYBgb1Ww0,Namaskar Dosto in this short video i will talk about Homeopathic Medicine Headache old headache.,
Best Homeopathic Treatment for Boils & Folliculitis,JHM-OedsLUc,Modern Homeopathy,2025-02-14T06:11:49Z,https://www.youtube.com/watch?v=JHM-OedsLUc,carbuncle #boil #medtoday #boilstreatmentathome #boilstreatmentmedicine #boilstreatmenthomeopathy ...,
Unwanted hair in Face | Best Homeopathic Medicine,43EFx-W3l9o,Drkirti vikram singh,2025-02-26T03:56:40Z,https://www.youtube.com/watch?v=43EFx-W3l9o,Namaskar Dosto in this short video i will talk to Best Homeopathic Medicine for unwanted facial hai Homeopathic Medicine Oleum ...,
Homeopathy और Medical Science पर बोले Nitin Gadkari | Paisa Live,S2pP2zNhY6s,Paisa LIVE,2025-03-09T06:27:52Z,https://www.youtube.com/watch?v=S2pP2zNhY6s,Hemeopathy और Medical Science पर बोले Nitin Gadkari #PaisaLive #trending #financialmarket #news #stockmarket ...,
Top Homeopathic Medicine For Eczema | Viola Tricolor | How to Use,d7nHmesK2Lo,Drkirti vikram singh,2025-03-20T15:06:50Z,https://www.youtube.com/watch?v=d7nHmesK2Lo,Namaskar Dosto in this short video i talked about Homeopathic Medicine Viola tricolor effective medicine for Eczema and Asthma.,
Does Homeopathy work?,kNgaJ5Bsap8,Akshay Dixit,2025-01-05T15:47:58Z,https://www.youtube.com/watch?v=kNgaJ5Bsap8,,
"Testosterone Booster in Homeopathy / Testes Siccati 3x Dr.Reckeweg, Treatment of all male problems",kKqdYyj7GoY,Dr Nikhil Sahu,2025-01-17T03:34:09Z,https://www.youtube.com/watch?v=kKqdYyj7GoY,"Testosterone Booster in Homeopathy / Testes Siccati 3x Dr.Reckeweg, Treatment of all male problems, Testosterone Booster in ...",
#itching #itchingproblem #skincare #skincaretips #itchingtreatment #homeopathy #drchetangupta,MYvMPe2BgLU,Dr-Chetan gupta,2025-03-26T12:03:29Z,https://www.youtube.com/watch?v=MYvMPe2BgLU,,
IBS Treatment | Stomach Problems | Gut Health | Homeopathic Treatment,2_dZ21UHczg,Afecto Homeopathy®,2025-01-27T11:50:18Z,https://www.youtube.com/watch?v=2_dZ21UHczg,IBS issues weighing you down? Must watch this video to know the reasons & find relief from IBS naturally with expert homeopathy ...,
LOW BACK PAIN | कमर दर्द | Lumbar Spondylosis | Sciatica | Homeopathic Treatment | Dr Aadil |,EJlAU8gPftU,Dr Aadil Chimthanawala,2025-02-25T12:30:23Z,https://www.youtube.com/watch?v=EJlAU8gPftU,Today Dr Aadil will be giving you a brief explanation and treatment part of Low back pain or Lumbar spondylosis which refers to ...,
Pimples Combination | Homeopathic Medicine,DKvF5OJnZpc,Drkirti vikram singh,2025-03-28T07:26:19Z,https://www.youtube.com/watch?v=DKvF5OJnZpc,Namaskar Dosto in this short video i will talk about Homeopathic Medicine for pimples best Homeopathic Medicine Combination ...,
"""Homeopathic Remedy Sulphur 30 for Skin Allergies | Natural Relief & Benefits 🍃✨""",eQgwGq5C9yw,Homeo Cure Lab,2025-01-28T19:18:59Z,https://www.youtube.com/watch?v=eQgwGq5C9yw,"""Struggling with skin allergies? Discover how Homeopathic Sulphur 30 can help! This natural remedy is known for its ...",
Is Homeopathic Medicine Effective | Kya Homeopathic ka Koi Nuqsan Hota Hai?,xyXnCP6RN0o,Marham Find A Doctor,2025-01-20T16:00:57Z,https://www.youtube.com/watch?v=xyXnCP6RN0o,"To find more details, book an appointment, or take an online consultation with Dr. Fatima Humayoun, visit: ...",
Boost Your Energy with Ashwagandha Homeopathic Remedies!,5Lse7lAlzXk,Dr.arshad health tv,2025-02-08T13:46:29Z,https://www.youtube.com/watch?v=5Lse7lAlzXk,"Ashwagandha is a powerful homeopathic remedy known for its adaptogenic properties, helping with stress, anxiety, weakness, ...",
#constipation #constipationrelief #constipationtreatment #homeopathy #homeopathydr #drchetangupta,J0NFZlC6CbM,Dr-Chetan gupta,2025-02-15T13:07:38Z,https://www.youtube.com/watch?v=J0NFZlC6CbM,,
#gastricproblem #ibsrelief #ibssymptoms #diarrhoea #homeopathy #homeopathydr #drchetangupta,INf3R_nieuY,Dr-Chetan gupta,2025-02-01T06:08:40Z,https://www.youtube.com/watch?v=INf3R_nieuY,,
Influenzinum: Symptoms and Uses -- Dr P S Tiwari #homeopathy,_tNgdB1IgtA,Dr P S Tiwari,2025-01-01T13:00:39Z,https://www.youtube.com/watch?v=_tNgdB1IgtA,Welcome to another video from Dr. P.S Tiwari. Today I'll be talking about Symptoms of Influenzinum Medicine. ▻ Dr P S Tiwari ...,
Albuminuria treatment with homeopathy #trendingshorts #alternativemedicine #ytshorts #viralreels,PeSyK0mcql4,Dr. Santosh Kumar Padhy,2025-03-16T12:20:35Z,https://www.youtube.com/watch?v=PeSyK0mcql4,,
Everything turned into gas after eating #trendingshorts #homeopathy #viralreels #ytshorts,u9G1PJSj0OM,Dr. Santosh Kumar Padhy,2025-02-17T04:11:43Z,https://www.youtube.com/watch?v=u9G1PJSj0OM,,
#ibs #ibsrelief #healthygut #guthealth #healthylifestyle #homeopathy #drchetangupta,dI53MnXl77g,Dr-Chetan gupta,2025-03-17T12:20:02Z,https://www.youtube.com/watch?v=dI53MnXl77g,,
Heavy gas in stomach with burning and pain #trendingshorts #homeopathy #viralreels #viralshorts,D1yWErrz7ns,Dr. Santosh Kumar Padhy,2025-02-07T06:27:52Z,https://www.youtube.com/watch?v=D1yWErrz7ns,,
Sulphur 30 homeopathic medicine best skin medicine !!,09P5eptftkg,Dr Shashi's health corner,2025-01-15T08:32:46Z,https://www.youtube.com/watch?v=09P5eptftkg,,
#fear #fearchronic #anxiety #anxietyrelief #homeopathy #homeopathydr #drchetangupta,d82Gm58UQos,Dr-Chetan gupta,2025-02-04T16:13:28Z,https://www.youtube.com/watch?v=d82Gm58UQos,,
#weakness #lowenergy #bodyweakness #weaknesstreatment #homeopathy #drchetangupta,UMpF5oTA9xo,Dr-Chetan gupta,2025-03-19T12:27:37Z,https://www.youtube.com/watch?v=UMpF5oTA9xo,,
Swollen external piles with sensitive pain #trendingshorts #homeopathy #alternativemedicine,i7mc4_mKKeY,Dr. Santosh Kumar Padhy,2025-03-14T03:58:59Z,https://www.youtube.com/watch?v=i7mc4_mKKeY,,
Sulphur Homeopathy | Powerful Remedy for Skin Problems & Gut Health,QZb2zSF02HU,Dr.arshad health tv,2025-02-12T15:51:26Z,https://www.youtube.com/watch?v=QZb2zSF02HU,Sulphur Homeopathic Medicine - Key Benefits: - Sulphur homeopathic uses - Benefits of sulphur in homeopathy - How to use ...,
Cascarilla: Symptoms and Uses -- Dr P S Tiwari #homeopathy,CjriWPxvyaw,Dr P S Tiwari,2025-01-24T13:00:30Z,https://www.youtube.com/watch?v=CjriWPxvyaw,Welcome to another video from Dr. P.S Tiwari. Today I'll be talking about Golden Symptoms of Cascarilla. ▻ Dr P S Tiwari (Shorts) ...,
Stomach diseases/معدہ کی امراض #health #healthtips #homeopathy ##shorts #shortvideo,SIYQSiyWmS8,DrNadeem Ahmad,2025-03-30T18:03:44Z,https://www.youtube.com/watch?v=SIYQSiyWmS8,,
symptoms constantly changing in any acute and chronic disease#trendingshorts #viralreels #homeopathy,f6hsbwUF5UY,Dr. Santosh Kumar Padhy,2025-03-28T07:25:01Z,https://www.youtube.com/watch?v=f6hsbwUF5UY,,
Large quantities of colourless urine in diabetes mellitus #trendingshorts #homeopathy #viralshorts,ykcf1zViZ-M,Dr. Santosh Kumar Padhy,2025-02-21T17:34:03Z,https://www.youtube.com/watch?v=ykcf1zViZ-M,,
#nervepain #nervepainrelief #painmanagement #neuropathy #homeopathy #drchetangupta,U27sbjlHpx4,Dr-Chetan gupta,2025-02-20T15:35:17Z,https://www.youtube.com/watch?v=U27sbjlHpx4,,
High urea and creatinine levels in blood #trendingshorts #renalfailure #homeopathy #viralreels,qhTiimOsSD4,Dr. Santosh Kumar Padhy,2025-03-10T14:27:44Z,https://www.youtube.com/watch?v=qhTiimOsSD4,,
Top medicine for dry skin & less sweating #trendingshorts #viralreels #homeopathy #viraltrend #viral,vO-8vdtHZRc,Dr. Santosh Kumar Padhy,2025-03-27T04:18:39Z,https://www.youtube.com/watch?v=vO-8vdtHZRc,,
red pimples on forehead and cheeks #trendingshorts #alternativemedicine #viralvideo #homeopathy,b4K1gbeXsBE,Dr. Santosh Kumar Padhy,2025-03-22T03:21:52Z,https://www.youtube.com/watch?v=b4K1gbeXsBE,,
Best medicine for asthma and respiratory problems #trendingshorts #homeopathy #viralreels  #asthma,fis_zd69Dm4,Dr. Santosh Kumar Padhy,2025-02-16T10:03:24Z,https://www.youtube.com/watch?v=fis_zd69Dm4,,
#digestivehealth #healthygut #constitution #acidityrelief #bloatingrelief #homeopathy #drchetangupta,2023movymo8,Dr-Chetan gupta,2025-03-16T15:56:43Z,https://www.youtube.com/watch?v=2023movymo8,,
Intercostal rheumatism top remedy for winter season #trendingshorts #homeopathy #viralreels,_WFx95BLCWA,Dr. Santosh Kumar Padhy,2025-02-03T03:16:18Z,https://www.youtube.com/watch?v=_WFx95BLCWA,,
Top medicine for acne pimples on face #trendingshorts #homeopathy #viralreels #ytshorts #viralshort,DTbOE6T63S8,Dr. Santosh Kumar Padhy,2025-02-18T05:24:57Z,https://www.youtube.com/watch?v=DTbOE6T63S8,,
inflammation and pain in ears due to cold #trendingshorts #homeopathy #homeoclinic #viralvideo,Do8TRunet94,Dr. Santosh Kumar Padhy,2025-03-24T10:25:34Z,https://www.youtube.com/watch?v=Do8TRunet94,,
Iodum homeopathic medicine benefits !! Best for thyroid problems !!,ku3i4_kBaas,Dr.Shashi Boricha Homeopathy,2025-01-21T10:18:57Z,https://www.youtube.com/watch?v=ku3i4_kBaas,,
Heavy constipation after allopathic medicines #trendingshorts #homeopathy #viralreels #viralshorts,dDt_ZalOAis,Dr. Santosh Kumar Padhy,2025-02-19T09:32:53Z,https://www.youtube.com/watch?v=dDt_ZalOAis,,
Right sided nervous pain #trendingshorts #neuralgia #homeopathy #viralreels #ytshorts,YL1Vniyx4Ho,Dr. Santosh Kumar Padhy,2025-03-30T04:04:39Z,https://www.youtube.com/watch?v=YL1Vniyx4Ho,,
Tubal blockage : twisted tubes treated with Homeopathy,1enV4LJYePc,DR SUKHJEET HOMEOPATHY,2025-01-14T13:52:40Z,https://www.youtube.com/watch?v=1enV4LJYePc,,
Can You Overdose on Homeopathic Medicine? Dr. Rajesh Shah Explains #homeopathy,49ttYJPXScI,Life Force Homeopathy,2025-01-27T05:30:01Z,https://www.youtube.com/watch?v=49ttYJPXScI,"""Wondering if you can overdose on homeopathic medicine? Watch Dr. Rajesh Shah, a globally renowned homeopath with 40 ...",
Best Homoeopathic Hospital In Patna #homoeopathy #hospital #patna,uMZ9cQ3qHyQ,Dr Gyan Homoeopathic Hospital,2025-01-28T17:03:17Z,https://www.youtube.com/watch?v=uMZ9cQ3qHyQ,Best Homoeopathic Hospital In Patna #homoeopathy #hospital #patna.,
#cervicalpain #cervicalspondylitis #painmanagement #painrelief #homeopathy #drchetangupta,n7rBtWbOq7o,Dr-Chetan gupta,2025-03-06T15:58:56Z,https://www.youtube.com/watch?v=n7rBtWbOq7o,,
toothache homeopathic medicine #shorts #shortsbangla #ytshorts #ytshortsindia #hellohomeopathy,jOtcSeZOZbg,Hello Homeopathy ,2025-03-23T13:55:57Z,https://www.youtube.com/watch?v=jOtcSeZOZbg,toothache homeopathic medicine #shorts #shortsbangla #ytshorts #ytshortsindia #hellohomeopathy #youtubeshorts #youtube ...,
Psoriasis with burning and itching #autoimmunedisease #trendingshorts #homeopathy #ytshorts,j9lAP5HgH2k,Dr. Santosh Kumar Padhy,2025-03-16T10:09:35Z,https://www.youtube.com/watch?v=j9lAP5HgH2k,,
#womenhealth #womenissues #femalehealth #periodpain #homeopathy #homeopathydr #drchetangupta,q1PgsKq5AGU,Dr-Chetan gupta,2025-02-17T15:44:03Z,https://www.youtube.com/watch?v=q1PgsKq5AGU,,
#anemia #anemiaproblems #anemiaprevention #anemiatreatment #homeopathy #drchetangupta,icpRh3roVfE,Dr-Chetan gupta,2025-03-21T15:26:46Z,https://www.youtube.com/watch?v=icpRh3roVfE,,
#allergicrhinitis #runnynose #noseblock #allergyrelief #allergytreatment #homeopathy #drchetangupta,Kx5Rw2sPQ3Y,Dr-Chetan gupta,2025-01-02T12:01:06Z,https://www.youtube.com/watch?v=Kx5Rw2sPQ3Y,,
DAMIANA homeopathic mother tincture in Hindi,3dJ8GHSs_Gg,Here's Your Doctor..🏥,2025-03-16T07:53:19Z,https://www.youtube.com/watch?v=3dJ8GHSs_Gg,damiana #aiapget2024 #allenskeynotes #homeopathic #homeopathicmedicine #homeopathictreatment #homeopathy #lecture ...,
Homeopathic medicine for sinus problems #trendingshorts #homeopathy #viralreels #youtubeshorts,flrti4jS_EI,Dr. Santosh Kumar Padhy,2025-02-19T05:21:04Z,https://www.youtube.com/watch?v=flrti4jS_EI,,
Conium mac 30 homeopathic medicine uses & benefits in hindi ! Conium 30 ! Conium 200 ! Conium 1 M !!,gUXgSn48KtQ,Dr Shashi's health corner,2025-02-01T11:49:42Z,https://www.youtube.com/watch?v=gUXgSn48KtQ,,
Ruta homeopathic medicine uses in hindi !!,jafWqetpT3M,Dr.Shashi Boricha Homeopathy,2025-02-20T07:51:18Z,https://www.youtube.com/watch?v=jafWqetpT3M,watch full video : https://youtu.be/iysiC7_fjmI thnk u.,
Homeopathy.. Real or scam? | Homeopathy #shorts #viral #rajshamani,Abqc4-tw9aE,Homeopathic Tips by Dr. Namrata ,2025-02-07T17:20:37Z,https://www.youtube.com/watch?v=Abqc4-tw9aE,Follow on instagram - https://instagram.com/s.r.homoeopathy @s.r.homoeopathy Mobile :- 9289066324 #shorts​ ...,
#insomnia #insomniarelief #sleepwell #homeopathy #homeopathydr #drchetangupta,Sdl59_2ulSk,Dr-Chetan gupta,2025-03-13T13:00:23Z,https://www.youtube.com/watch?v=Sdl59_2ulSk,,
Top medicine for dental cavities #trendingshorts #homeopathy #homeopathicmedicine #viralreels,TN9JPrdJb6M,Dr. Santosh Kumar Padhy,2025-02-08T03:02:56Z,https://www.youtube.com/watch?v=TN9JPrdJb6M,,
#anger #angermanagement #stress #stressrelief #homeopathy #homeopathydr #drchetangupta,VLG2NgjcVXc,Dr-Chetan gupta,2025-02-21T12:36:03Z,https://www.youtube.com/watch?v=VLG2NgjcVXc,,
#prostateenlargement #prostatesupport #prostatehealth #prostatetreatment #homeopathy #drchetangupta,GBW06CbZ2IE,Dr-Chetan gupta,2025-03-30T16:45:45Z,https://www.youtube.com/watch?v=GBW06CbZ2IE,,
Stomatitis with fetid odor from mouth #trendingshorts #homeopathy #viralreels #ytshorts #viraltoday,BFqpvc64AdI,Dr. Santosh Kumar Padhy,2025-02-11T04:24:06Z,https://www.youtube.com/watch?v=BFqpvc64AdI,,
Sabina 30 Homeopathic Medicine for Genital Warts causes by HPV | Dr Sunil Patidar #warts #homeopathy,74kkmZDvtmM,Dr. Patidar's Homeopathic Centre,2025-02-09T09:00:06Z,https://www.youtube.com/watch?v=74kkmZDvtmM,ABOUT THIS VIDEO: - Hello Friend's: - I am Dr. Sunil Patidar from Bhopal B.H.M.S   ...,
Shocking Truth about PhD in Homeopathy #shorts #bhms #aiapget #ntet #homeopathy #shortvideo #short,jCaTGaZLPHM,Dr Rohit Gupta - KEYNOTES Homoeopathy,2025-03-30T04:30:19Z,https://www.youtube.com/watch?v=jCaTGaZLPHM,"shorts #bhms #aiapget #homeopathy #shortvideo #short #ntet A homeopathic PhD is not a valid degree under NCH in India yet, ...",
#piles #bleedingpiles #pilestreatment #pilescare #homeopathy #drchetangupta #viralshorts,0uw1Mo9VHS0,Dr-Chetan gupta,2025-03-29T12:33:40Z,https://www.youtube.com/watch?v=0uw1Mo9VHS0,,
#anemia #anemiatreatment #pregnancytips #pregnancycare #homeopathy #drchetangupta,MxbEkuNSP9I,Dr-Chetan gupta,2025-02-23T15:38:17Z,https://www.youtube.com/watch?v=MxbEkuNSP9I,,
#homeopathy #shorts #reels #shortvideo,xjSwvXzxq64,Dr. Areesha Khan- Wellness Path,2025-03-07T19:55:15Z,https://www.youtube.com/watch?v=xjSwvXzxq64,,
upsssc homeopathic pharmacist final expected cut off 2025 #upsssc_homeopathic_pharmacist_cutoff,saLQBSaDRMw,STH-1 Skills,2025-02-06T17:05:37Z,https://www.youtube.com/watch?v=saLQBSaDRMw,upsssc homeopathic pharmacist final expected cut off 2025 #upsssc_homeopathic_pharmacist_cutoff upsssc homeopathic ...,
Important Tips for Potency Selection |Homeopathic Medicine #drnisha #homeopathiclectures,ZfPc-FFUxXs,Dr. Nisha's tutorials Homeo,2025-02-01T03:30:17Z,https://www.youtube.com/watch?v=ZfPc-FFUxXs,,
#migraine #migrainerelief #migrainemanagement #headacherelief #homeopathy #drchetangupta,h-ciPV1NvJ4,Dr-Chetan gupta,2025-02-24T11:32:21Z,https://www.youtube.com/watch?v=h-ciPV1NvJ4,,
sinus homeopathic medicine l sinus homeopathy medicine l adel 23 ricura drop #short,NCiDqaeojW4,Dr Abhishek Ojha,2025-01-08T16:00:02Z,https://www.youtube.com/watch?v=NCiDqaeojW4,sinus homeopathic medicine l sinus homeopathy medicine l adel 23 ricura drop #short Content cover – sinus homeopathic ...,
Under Eye Dark Circles Homeopathic Medicine #shorts,wzFD5sn3QWk,Dr. Arwa Bohra ,2025-02-13T14:41:07Z,https://www.youtube.com/watch?v=wzFD5sn3QWk,"Dark Circles Ka Permanent Solution - Homeopathy Se! ✨ Dark circles sirf thakaan ya neend ki kami ki wajah se nahi hote, balki ...",
Indigo 30 homeopathic medicine,FR2pIWiZZM0,Doctor Khari,2025-02-08T10:30:11Z,https://www.youtube.com/watch?v=FR2pIWiZZM0,Indigo homeopathic medicine Indigo 30 homeopathic medicine Indigo 30 Indigo 30 ch Indigo homeopathic medicine uses in hindi ...,
#snoring #snoringsolution #snoringtreatment #homeopathy #homeopathydr #drchetangupta,LTNPQBzhgKw,Dr-Chetan gupta,2025-02-15T15:43:47Z,https://www.youtube.com/watch?v=LTNPQBzhgKw,,
Gymnema Sylvestre Homeopathic Medicine in Hindi,RZhpmmtGmp8,Hahnemann Homoeo Hall,2025-03-19T07:30:09Z,https://www.youtube.com/watch?v=RZhpmmtGmp8,,
GTR17 #hhf #gtr #materiamedica #funwaytolearn #homeopathy #homeopathicmedicine #bhms #remedies,TOs07CRmKnM,Grace Homeopathy Clinic,2025-03-09T04:30:27Z,https://www.youtube.com/watch?v=TOs07CRmKnM,Guess the remedy and comment. ✨:HHF:✨ APPLICABLE ✓ REPLICABLE ✓ EASY ✓ FUN ✓ HOMEOPATHY ❤❤❤ Dr. JOWIN ...,
Severe back pain associated with piles #trendingshorts #homeopathy #viralreels #youtubeshorts,wEYl-LB1-FQ,Dr. Santosh Kumar Padhy,2025-02-13T03:17:04Z,https://www.youtube.com/watch?v=wEYl-LB1-FQ,,
#ibs #ibsrelief #gastricproblem #gastrocare #gastrichealth #homeopathy #drchetangupta,fn0i-5UDHa4,Dr-Chetan gupta,2025-03-06T12:58:21Z,https://www.youtube.com/watch?v=fn0i-5UDHa4,,
#lipoma #lipomaremoval #lipomatreatment #homeopathy #homeopathydr #drchetangupta,DkFTiDJ78M8,Dr-Chetan gupta,2025-02-04T11:16:41Z,https://www.youtube.com/watch?v=DkFTiDJ78M8,,
"How is homeopathy different than allopathy by Dr Rajesh Shah, MD (Hom) Life Force Homeopathy",WUxcpE9eNjg,Life Force Homeopathy,2025-02-04T16:47:39Z,https://www.youtube.com/watch?v=WUxcpE9eNjg,"Ever wondered what makes homeopathy different from allopathy? Dr. Rajesh Shah, MD (Homeopathy) and Director of Life ...",
#cholesterolcontrol #cholestroltreatments #healthyheart #homeopathy #homeopathydr #drchetangupta,ZUY22nm_bbY,Dr-Chetan gupta,2025-02-08T15:35:10Z,https://www.youtube.com/watch?v=ZUY22nm_bbY,,
Homeopathic Medicine Combination for Kidney Stone Treatment by Dr. Sunil Patidar #kidneystone,Y6SjuoD8Xeo,Dr. Patidar's Homeopathic Centre,2025-02-15T12:30:29Z,https://www.youtube.com/watch?v=Y6SjuoD8Xeo,ABOUT THIS VIDEO: - Hello Friend's: - I am Dr. Sunil Patidar from Bhopal B.H.M.S   ...,
#fibroids #uterinebleeding #uterinefibroids #womenshealth #homeopathy #homeopathydr #drchetangupta,VJie-mmBRk8,Dr-Chetan gupta,2025-02-07T07:15:21Z,https://www.youtube.com/watch?v=VJie-mmBRk8,,
#gonorrhea #stddisease #sexuality #infectioncontrol #gonorrheatreatment #homeopathy #drchetangupta,lthzKCKgFbY,Dr-Chetan gupta,2025-03-23T12:10:29Z,https://www.youtube.com/watch?v=lthzKCKgFbY,,
#melasma #skincare #skincaretips #melasmatreatment #homeopathy #drchetangupta,bL10dEYmtXo,Dr-Chetan gupta,2025-03-03T12:38:14Z,https://www.youtube.com/watch?v=bL10dEYmtXo,,
Painful Joints ? Dr P S Tiwari #homeopathy Treatment,8HQ7_32hN3o,Dr P S Tiwari (Shorts),2025-01-02T13:30:07Z,https://www.youtube.com/watch?v=8HQ7_32hN3o,Welcome to another video from Dr. P.S Tiwari. Today's video is about Painful joints and its homeopathy medicine. FOR BOOKING ...,
#fallopiantubes #fallopiantubeblockage #femaleinfertility #femalehealth #homeopathy #drchetangupta,uNm8tJLqbPo,Dr-Chetan gupta,2025-03-09T12:41:24Z,https://www.youtube.com/watch?v=uNm8tJLqbPo,,
Dr Care Homeopathy in Hyderabad #drcarehomeopathy #drcare #homeopathy #shorts,14gklxFwV3U,Venkys Food Byte,2025-03-04T14:30:00Z,https://www.youtube.com/watch?v=14gklxFwV3U,"Dr Care Homeopathy in Hyderabad #drcarehomeopathy #drcare #homeopathy #shorts Dr care homeopathy, contact numbers ...",
