Title,Video ID,Channel,Published At,URL,Description,Video Length,Views,Likes,Comments
Sustainable change & results: a guide to balanced nutrition & movement,56j3FKRYmug,Sam Cue,2025-03-05T14:45:00Z,https://www.youtube.com/watch?v=56j3FKRYmug,Master sustainable nutrition & movement for real results! #weightloss #weightlossjourneys.,7,410,1,0
#cleanfood #balancednutrition #boostyourmetabolism #healthychoices #nutritiontips  #NADplus,yhz0MlMwm5U,Vital.Vibes99,2025-03-19T07:17:53Z,https://www.youtube.com/watch?v=yhz0MlMwm5U,,27,408,7,0
#IndoorCats #BalancedNutrition #CatParents #PetCareTips #VeterinaryAdvice #Blackcats #kitten #kitty,xN4xykI_s_s,Black cat club,2025-01-12T09:04:18Z,https://www.youtube.com/watch?v=xN4xykI_s_s,,7,407,8,0
#balancednutrition #healthychoices #NADplus #longevity #cellularhealth #energyboost #fitandhealthy,U8UeV4ngZN8,Vital.Vibes99,2025-03-19T08:28:45Z,https://www.youtube.com/watch?v=U8UeV4ngZN8,,25,408,2,0
The Secret to Balanced Nutrition and Weight Loss 🔥 #fireblood #winstreak #naturalsupplements,xuAcD9LFcho,Petros Fireblood,2025-01-30T01:32:54Z,https://www.youtube.com/watch?v=xuAcD9LFcho,,39,412,8,2
Maifudi Nutrition Forest Meat and Vegetarian with Balanced Nutrition and Picky Food for Hairy Ch,QozUPwfmbuU,TiMi TV,2025-03-21T02:35:27Z,https://www.youtube.com/watch?v=QozUPwfmbuU,Maifudi Nutrition Forest Meat and Vegetarian with Balanced Nutrition and Picky Food for Hairy Ch.,28,391,10,0
10 Powerful Habits to Overcome Insulin Resistance #diabetescare #balancednutrition,nYJmfyn-tvE,Health Wise,2025-01-14T18:15:02Z,https://www.youtube.com/watch?v=nYJmfyn-tvE,"Your journey to better health starts here. In this video, we're diving into powerful tips and insights that will transform your ...",38,359,8,1
What is actually a Balanced Meal?  #Nutrifiit #Nutrition #basics #3rd,OXX4_7jwEbk,simplynutrifit ,2025-01-06T17:46:14Z,https://www.youtube.com/watch?v=OXX4_7jwEbk,Learn How You Can Create A Balanced Meal In Simple Steps In Under 1min.,57,302,14,0
Best time to consume supplements #indyte #healthylifestyle #food #balancednutrition #weightloss,iy4ut2-eJpE,Dietitian Priyanka,2025-02-05T13:07:29Z,https://www.youtube.com/watch?v=iy4ut2-eJpE,"Supplements are essential for our body, but their effectiveness depends on one key factor – timing! ⏰ Taking supplements at the ...",60,612,40,0
"Daily weight loss vlog, reasonable diet and balanced nutrition, weight loss check-in together, w",fS3NQzS0Pc8,Amazing ASMR 315,2025-03-16T11:42:04Z,https://www.youtube.com/watch?v=fS3NQzS0Pc8,"Daily weight loss vlog, reasonable diet and balanced nutrition, weight loss check-in together, w.",19,239,5,0
100% balanced & healthy nutrition,83VnBszAmFA,Hill's Pet Nutrition South Africa,2025-02-26T09:26:48Z,https://www.youtube.com/watch?v=83VnBszAmFA,Want to give your best friend the best life possible? It all starts with what's in their bowl! Hill's Science Plan is specially formulated ...,7,241,0,0
A Day in My Latina Nutrition Coach Life | Weight Loss Journey | Balanced Eating,B3XZA3gOC_k,lean Latina habits,2025-02-10T11:00:13Z,https://www.youtube.com/watch?v=B3XZA3gOC_k,A Day in My Latina Nutrition Coach Life | Weight Loss Journey | Balanced Eating Learn More : https://linktr.ee/kat_loyatraining ...,27,213,6,0
100% balanced & healthy nutrition in every bite!,EMDcgi9LXgE,Hill's Pet Nutrition South Africa,2025-02-26T09:28:57Z,https://www.youtube.com/watch?v=EMDcgi9LXgE,"While we struggle with our healthy meal preps, our pets have 100% balanced and healthy nutrition in just one bowl. Who's really ...",7,224,0,0
"Aunties, please also pay attention to balanced nutrition. The national treasure is worthy of bei",fxDW-llBZhE,Relaxation Expert,2025-02-13T01:43:33Z,https://www.youtube.com/watch?v=fxDW-llBZhE,"Aunties, please also pay attention to balanced nutrition. The national treasure is worthy of bei.",16,167,16,0
Build a healthy life with a balanced plate and smart nutrition! #balanceddiet #yuvaap #findyoury,EQg0mQmY15E,Root Cause By Yuvaap | Daily LIVE Fitness Classes,2025-02-15T11:45:01Z,https://www.youtube.com/watch?v=EQg0mQmY15E,A balanced plate means a healthier you! 🍽️ Majority of the problems and overeating stops when you learn how to mindful eat ...,110,171,6,0
"""Importance of a Balanced Diet with Herbalife Nutrition: Achieve Optimal Health!"" | +91 9659957910",63Yo5Vt7sHU,Weight Loss Food tamil,2025-03-07T15:23:36Z,https://www.youtube.com/watch?v=63Yo5Vt7sHU,"""Importance of a Balanced Diet with Herbalife Nutrition: Achieve Optimal Health!"" | +91 9659957910 Discover the importance of a ...",224,146,4,0
"Maifudi Nutrition Forest Meat and Vegetarian Forest with balanced nutrition and palatability, go",g6fhHLEAmj8,TiMi TV,2025-03-19T03:01:15Z,https://www.youtube.com/watch?v=g6fhHLEAmj8,"Maifudi Nutrition Forest Meat and Vegetarian Forest with balanced nutrition and palatability, go.",28,154,2,0
Day 01: Delicious & Easy 7-Day Diabetes Meal Plan | Healthy meals/Diabetes/sugar Control,kekehlSOSYY,House of Knowledge,2025-03-23T03:49:51Z,https://www.youtube.com/watch?v=kekehlSOSYY,"Here's a 7-day diabetes-friendly meal plan with three meals a day, designed to help manage blood sugar levels while providing ...",108,160,2,2
Discover the Secret to Balanced Wellness with Berberine! ft.  TOPLUX NUTRITION,yo5hWWooiug,Sweet Angel TV,2025-01-13T05:19:58Z,https://www.youtube.com/watch?v=yo5hWWooiug,Discover the Secret to Balanced Wellness with Berberine! ft. TOPLUX NUTRITION https://youtu.be/yo5hWWooiug VIDEO POSTED ...,185,141,13,2
After proper balanced nutrition & correct homoeopathic medicine walks 4500 steps,NTuZe8ZDK2c,Holistic Lifestyle Hub,2025-03-27T09:55:48Z,https://www.youtube.com/watch?v=NTuZe8ZDK2c,,37,133,0,0
This nutrition tip saved my life! You can eat a balanced diet & still reach your gym goals! #health,32aZLEvyH7Q,Shea Spence,2025-02-11T18:01:29Z,https://www.youtube.com/watch?v=32aZLEvyH7Q,,9,134,8,1
Nutrition 101: What’s a Balanced Diet?  #shorts #fyp #trending #trendingshorts #viralvideo #facts,LWzN9dRw1WM,HealthyTipsChannel ,2025-02-17T13:29:36Z,https://www.youtube.com/watch?v=LWzN9dRw1WM,,50,127,6,2
Day7/100 health awareness topics|importance of Nutrition food| healthy Balanced diet|laxmisinsights,EeLBB4rJHaQ,Laxmi's Insights,2025-02-10T01:13:48Z,https://www.youtube.com/watch?v=EeLBB4rJHaQ,,80,120,20,0
"Hydration,Scalp Care,Protective Styling,Regular Trims,Balanced Nutrition 6. Consistency (major key)",6R2IOzLTbA0,Amber Dew Naturals LLC,2025-01-19T02:21:04Z,https://www.youtube.com/watch?v=6R2IOzLTbA0,,74,149,21,0
Balanced diet lunch box! #india #usa #lunch #healthydiet #lunchboxideas #healthyeating #nutrition,m_bzcs5U04U,MMJ Foods,2025-01-17T07:40:37Z,https://www.youtube.com/watch?v=m_bzcs5U04U,,56,105,3,0
A balanced diet #LiverHealth #HealthyEating #SGOT #SGPT #Nutrition,xkopAU75fF0,lghsiddha,2025-03-04T15:15:49Z,https://www.youtube.com/watch?v=xkopAU75fF0,,23,109,3,0
Unlocking the Power of Nutrition/balanced diet,XS2N726mPnU,Mohammed Ibrahim,2025-03-22T16:15:31Z,https://www.youtube.com/watch?v=XS2N726mPnU,"Discover the vital role nutrition plays in our overall health and fitness. In this video, we delve into the importance of balanced diet, ...",125,153,21,4
The Power of Balanced Nutrition: Fuel Your Body for Health & Vitality,n34wi4s_QfM,LifewithBala,2025-02-04T11:41:55Z,https://www.youtube.com/watch?v=n34wi4s_QfM,"Discover the power of balanced nutrition and how it can transform your health, energy levels, and overall well-being. In this video ...",80,131,6,0
Balanced Nutrition,qGCENGXRiJM,Fit Healthy And Well,2025-03-20T01:50:29Z,https://www.youtube.com/watch?v=qGCENGXRiJM,,,,,
Balanced diet😜 #nutritionhealthandwellbeing #food #balancednutrition #bestshorts,1zE05ZVPUO8,Anita,2025-01-24T23:00:01Z,https://www.youtube.com/watch?v=1zE05ZVPUO8,youtubeshorts #shorts #shortvideos #cute #catlover #lovecat #taby #cat #cutecat #didyouknow #facts #inspiration #subscribe ...,5,79,4,0
What i eat in a day: future rds balanced nutrition #futurerd,f4hP4makuzQ,Lynda Martinez,2025-02-17T04:30:26Z,https://www.youtube.com/watch?v=f4hP4makuzQ,A days nutrition for aspiring rds #fok #balancelifestyle.,15,75,2,0
All foods can be a part of balanced diet #balanceddiet #nutrition #food #youtubeshorts,xutGxg-0gcs,Muskan Arooj,2025-03-06T08:59:09Z,https://www.youtube.com/watch?v=xutGxg-0gcs,,9,88,7,0
How to Create a Balanced Plate for Every Meal! #nutrition #healthyeating,5xWga04PDgY,LiveWell HealthOasis,2025-01-15T05:15:00Z,https://www.youtube.com/watch?v=5xWga04PDgY,"How to Create a Balanced Plate for Every Meal! 🍽️   In this short, we'll show you how to create a balanced plate that will ...",58,79,3,0
"Maifudi Nutrition Forest Dog Food with Meat and Vegetarian Food is balanced and palatable, and y",MjymzEaxrxc,Funny Dog,2025-02-24T02:05:08Z,https://www.youtube.com/watch?v=MjymzEaxrxc,"Maifudi Nutrition Forest Dog Food with Meat and Vegetarian Food is balanced and palatable, and y.",21,73,0,0
Nutrition Balanced Diet your intake healthy For more information Please do call on +919743435461☎️,hDH4Z0rdWYY,fattofitvijaygujjar,2025-02-06T14:41:50Z,https://www.youtube.com/watch?v=hDH4Z0rdWYY,Thank you for choosing FAT TO FIT @fattofitwithvijaygujjar @fattofitwithvijaygujjar You can reach us on +91 ...,81,64,1,0
#High protein Rich Food#healthylifestyle changes#Balanced meal plate# Nutrition food #dietfood#,gpWW04v0ZH8,Annapoorna Health Club,2025-03-21T04:30:20Z,https://www.youtube.com/watch?v=gpWW04v0ZH8,,177,68,10,11
Daily menu #HealthyEating #DailyMenu #HealthyDiet #MealPlan #BalancedNutrition #HealthyFood,bycd3EuC1NE,Lola Glamm,2025-03-06T15:17:09Z,https://www.youtube.com/watch?v=bycd3EuC1NE,,16,50,6,0
#Diet # Balanced Diet # Nutrition # ncert #neet # biology # cbse,tipte5wsZ1c,EASY 2 LEARN,2025-02-27T06:23:29Z,https://www.youtube.com/watch?v=tipte5wsZ1c,,12,51,9,2
The Best Balanced Diet for Stage 5 Patients: Nutrition Guide @MuMe-kk5pc,qG6mMc1Mgn4,Mu & Me -Educational Channel for Kids,2025-02-09T19:26:43Z,https://www.youtube.com/watch?v=qG6mMc1Mgn4,"Maintaining a balanced diet in stage 5 is crucial for health and recovery. This video covers essential nutrition tips, best food ...",200,50,6,0
National Nutrition Week- Balanced diet @ My Daughter's Project # J SRI Shorts #education,UeO2Jn1RkFM,NALLA PRABHAVVI,2025-02-22T05:17:21Z,https://www.youtube.com/watch?v=UeO2Jn1RkFM,,57,51,2,0
When you start your day off with a power TEA! #BalancedNutrition,Ln4iV-OtLBA,Remy Squad,2025-03-29T22:16:43Z,https://www.youtube.com/watch?v=Ln4iV-OtLBA,,24,82,6,0
The Truth About a Balanced Diet + Exercise | Muscle Head Nutrition,6Dwb-Za4hac,Musclehead Nutritions,2025-02-08T05:02:38Z,https://www.youtube.com/watch?v=6Dwb-Za4hac,,10,46,2,0
Power-Packed NPK 19-19-19 Fertilizer: Balanced Nutrition for Thriving Plants,bhJUGLLjTG8,Go Garden,2025-02-27T11:28:06Z,https://www.youtube.com/watch?v=bhJUGLLjTG8,(please subscribe and Like Our Videos ) ▻Website Purchase Link ...,45,58,0,0
Nutrition for Kids: Creating a Balanced Diet for Your Child! (3 Minutes),E-NsmOq5hEc,Microlearning Daily,2025-01-29T12:11:45Z,https://www.youtube.com/watch?v=E-NsmOq5hEc,Nutrition for kids: essential tips for healthy growth is the focus of this informative video! Join us as we explore the vital nutrients that ...,160,50,4,0
🥬 Fresh Vegetables for Budgies 🐤 A Guide to Balanced Nutrition 🩺,fdMaD_1Plz4,World of Budgie,2025-01-20T03:15:02Z,https://www.youtube.com/watch?v=fdMaD_1Plz4,"Discover the fascinating world of budgie mutations with our comprehensive visual guide! In this video, we delve into the colorful ...",62,36,1,0
The importance of Balanced Nutrition in Layers.#layerfarm #poultry #poultaryfarm,kHKV266Heic,The FarmLand,2025-02-12T19:58:19Z,https://www.youtube.com/watch?v=kHKV266Heic,Today we will be FOCUSING on the IMPORTANCE of NUTRIENTS in your FEEDS and how they impact the growth and ...,60,109,11,1
Balanced Daily Nutrition: A Healthy Meal Plan for Energy and Well-being,pFnmFTe2Tt0,SPORTGOFW,2025-03-16T14:11:12Z,https://www.youtube.com/watch?v=pFnmFTe2Tt0,Want to maintain a healthy lifestyle and keep your energy levels high throughout the day? This balanced daily meal plan provides ...,6,144,5,0
Essential Nutrients for a Balanced Diet #health #nutrition #shortsviral  #foryou,4q4LdPA2do8,Daily dose of health ,2025-03-28T16:54:45Z,https://www.youtube.com/watch?v=4q4LdPA2do8,,64,41,6,0
Mastering Macronutrients  Your Guide to Balanced Nutrition,XSUxr5ydCNw,Ask FitTech,2025-03-18T12:04:49Z,https://www.youtube.com/watch?v=XSUxr5ydCNw,"Welcome to Ask FitTech, where we dive deep into health, wellness, and biohacking to help you optimize your life! In this video ...",88,36,0,0
Plant-powered protein; Gut-friendly nutrition; Balanced energy; Healthy lifestyle staple. See link,qTn6_U8tCzM,Juicy Ferg,2025-01-03T11:53:07Z,https://www.youtube.com/watch?v=qTn6_U8tCzM,,11,36,2,0
"The Balanced Bodybuilding Diet, Keeping Carbs for Competitions #nutrition #food #podcastclips #sport",Tw53E3UDOIA,The Unrestricted Podcast,2025-03-06T00:08:49Z,https://www.youtube.com/watch?v=Tw53E3UDOIA,,59,35,0,0
Healthy Aging for Women: The Power of Balanced Nutrition !  #WomenHealth  #HealthyAging,DZxbNNHyWKI,Encore Fitness by Ria,2025-02-24T14:44:46Z,https://www.youtube.com/watch?v=DZxbNNHyWKI,Healthy Aging for Women: The Power of Balanced Nutrition ! #WomenHealth #HealthyAging #BalancedNutrition ...,106,38,0,0
"""From Nutrition to Fitness: Your Balanced Health Strategy!""",kr2_HBdwzqc,Slam Dunk Central TV,2025-03-21T17:30:13Z,https://www.youtube.com/watch?v=kr2_HBdwzqc,From Nutrition to Fitness: Your Balanced Health Strategy! 🏋️‍♂️ Want to feel your best every day? The right balance of ...,58,31,0,0
"Bsure - Complete, Balanced & Sugar Free Nutrition Supplement Drink For The Entire Family",Buej0uKptos,BSure,2025-01-15T05:37:55Z,https://www.youtube.com/watch?v=Buej0uKptos,Scientifically formulated formula with 28 essential vitamins and minerals that provide complete balanced nutrition. Contains ...,20,53,0,0
"Your Path to Parenthood, Expert Care, Balanced Nutrition & a Healthy Lifestyle!",Je-22EonlpU,Srijan Kashi Multispeciality Hospital,2025-02-24T10:55:32Z,https://www.youtube.com/watch?v=Je-22EonlpU,"Your Path to Parenthood, Expert Care, Balanced Nutrition & a Healthy Lifestyle! Contact Srijan Kashi Multispeciality Hospital for ...",40,41,1,0
"""From Nutrition to Fitness: Your Balanced Health Strategy!""",WNYH114mJ2g,Niche Fusion Marketplace,2025-03-21T17:30:12Z,https://www.youtube.com/watch?v=WNYH114mJ2g,From Nutrition to Fitness: Your Balanced Health Strategy! 🏋️‍♂️ Want to feel your best every day? The right balance of ...,58,29,2,0
"pov: your body feels grounded with every bite, not overwhelmed #healthyhabits #balancednutrition",dYMY_C3E37Y,luna_natural_beauty ,2025-01-10T21:32:48Z,https://www.youtube.com/watch?v=dYMY_C3E37Y,,19,29,1,0
marrow life 100% nutrition balanced                                             #healthyfood #food,h_IJR4hp__k,AB King biotech,2025-02-08T03:22:45Z,https://www.youtube.com/watch?v=h_IJR4hp__k,,46,29,13,2
Optimizing Pre- and Post-Workout Nutrition #healthyfood #balancednutrition #nutritionfirst,-QsGUDVMdsM,Challenge foods,2025-02-16T16:06:36Z,https://www.youtube.com/watch?v=-QsGUDVMdsM,,61,29,0,0
Unveiling Kendall Jenner's Balanced Fitness and Nutrition Routine,1E_8Ny975t0,Vital Senses,2025-03-26T00:00:01Z,https://www.youtube.com/watch?v=1E_8Ny975t0,"Explore Kendall Jenner's balanced fitness routine, highlighting her combination of diverse workouts with a nutrition plan focusing ...",50,35,0,0
Progress over perfection Sustainable habits balanced nutrition & consistency lead to lasting results,rAl6ff8AXAk,Rekha seervi,2025-02-01T06:26:04Z,https://www.youtube.com/watch?v=rAl6ff8AXAk,,44,30,0,0
#health #balancednutrition #naturalproducts #foodforhealth #mindfuleating,p29B2SeefC8,JackieNambus,2025-02-07T20:43:38Z,https://www.youtube.com/watch?v=p29B2SeefC8,,29,,,
"Nutrition: balanced diet, sugar-free diet, clean eating, healthy food, mindful eating   #sugarfree",RjGYUqZFhy0,TED-Ed Health ,2025-01-08T18:10:00Z,https://www.youtube.com/watch?v=RjGYUqZFhy0,,55,36,0,0
#health #balancednutrition #naturalproducts #foodforhealth #mindfuleating,3HiW1W7iK_k,JackieNambus,2025-02-07T23:47:41Z,https://www.youtube.com/watch?v=3HiW1W7iK_k,,21,,,
"Celebrate National Nutrition Month: Tips for a Healthier, Balanced Diet with Avalon Health! 🌱",qVseLOOKzmg,Avalon Health,2025-03-05T16:08:55Z,https://www.youtube.com/watch?v=qVseLOOKzmg,"National Nutrition Month — March is National Nutrition Month, and it's the perfect time to focus on nourishing your body with a ...",12,47,0,0
Are We Designed To Eat MEAT? | Healthy Diet Plan #shorts #balancednutrition,Odt9MLw4oYY,Dennis Fenrich,2025-02-17T21:30:05Z,https://www.youtube.com/watch?v=Odt9MLw4oYY,Are We Designed To Eat MEAT? | Healthy Diet Plan Food is emotional. People argue about meat and plant-based diets like it's a ...,63,25,0,0
Eat a Balanced Diet for Better Health | Nutrition Tips for a Healthy Life,CURxhw23iB4,Daily Fit Dose,2025-02-21T19:30:04Z,https://www.youtube.com/watch?v=CURxhw23iB4,Eat a Balanced Diet for Better Health | Nutrition Tips for a Healthy Life Eating a balanced diet is essential for maintaining good ...,54,25,0,0
Balanced Diet vs. Crash Diet: Choose Wisely for Sustainable Health | PineFit Nutrition Guide,-qicZEsAXEI,Pine_Fitness_English,2025-02-17T02:30:00Z,https://www.youtube.com/watch?v=-qicZEsAXEI,"Welcome to PineFit! Your Partner in Holistic Health and Wellness At PineFit, we believe that a healthy body and mind are the ...",55,24,0,0
Wellness programme मे जाने के बाद #healthylifestyle #herbalife #balancednutrition #weightgain #viral,ykU_62DY8hU,Rahul singh : Influencer,2025-03-24T15:42:32Z,https://www.youtube.com/watch?v=ykU_62DY8hU,,60,21,0,0
Ensure Nutrition Supplement | Balanced Diet | Uses and Benefits,INgbNhvqyvo,Jameel Medical Insights,2025-01-11T16:25:56Z,https://www.youtube.com/watch?v=INgbNhvqyvo,Ensure Nutrition Supplement | Balanced Diet | Uses and Benefits Ensure Nutrition Supplement is a balanced dietary powder that ...,212,21,0,0
Nutrition Simplifies - Learn Building A Balanced Plate for Healthy Meals (Shorts),yOlpJ-vtIqw,A2E - Ascend2Elevate,2025-03-08T20:17:53Z,https://www.youtube.com/watch?v=yOlpJ-vtIqw,"Struggling to make sense of nutrition? With endless diet trends and conflicting advice, building a balanced plate can feel ...",91,40,2,0
is dedicated to proper and balanced nutrition for pregnant women #PregnancyNutrition   #Pregnancy,SXGazhlPNT8,PurelyHealth ,2025-02-10T09:03:27Z,https://www.youtube.com/watch?v=SXGazhlPNT8,,22,20,1,0
2024: prioritize self-care & balanced nutrition! #fruit #vegetables,ptKhCO7JOoE,Alison Roberts,2025-03-29T01:30:28Z,https://www.youtube.com/watch?v=ptKhCO7JOoE,2024: prioritize self-care & balanced nutrition! #fruit #vegetables #healthy #nutritionfacts.,41,19,0,0
ONE SMALL HEALTH HABIT THAT CAN CHANGE YOUR LIFE #balancednutrition #healthtips #medicalhealth,BBFPO9OxZAA,THE BALANCED LIVING NETWORK ,2025-02-14T11:46:01Z,https://www.youtube.com/watch?v=BBFPO9OxZAA,,,,,
Key Principles of Balanced Nutrition: A Comprehensive Guide to Healthy Eating and Digestion!,Z2i0lhILz9Y,Dr. Meena Shah - Health & Life Coach ,2025-01-21T10:35:46Z,https://www.youtube.com/watch?v=Z2i0lhILz9Y,"In this video, we dive deep into the world of balanced nutrition and how it impacts your overall health. Discover the power of the ...",154,19,2,0
Balanced nutrition for better health.#nutrition #healthylifestyle#balanceddiet#healthtips#wellness,87kvDDcRqrk,Health With Lanesia,2025-01-14T04:21:56Z,https://www.youtube.com/watch?v=87kvDDcRqrk,"This video explores the crucial role of macronutrients – carbohydrates, proteins, and fats – in supporting optimal body function.",87,19,1,0
Balanced Diet French Cooking Secrets!  #antiaging #podcast #ageinggracefully #diet #nutrition,SCDhCjzkrLk,DMH,2025-01-23T23:00:23Z,https://www.youtube.com/watch?v=SCDhCjzkrLk,Balanced Diet? French Cooking Secrets! Uncover the secrets to a balanced diet and how culture shapes our eating habits!,60,20,3,0
Zippy Balanced Nutrition Food for Active Dogs,C68xJ5sOsFs,Pet Care By Rossari,2025-01-17T12:21:59Z,https://www.youtube.com/watch?v=C68xJ5sOsFs,Nutritionally balanced food for the active lifestyle Food Available in - Starter - Puppy - Adult Brain & Eye Development – With ...,21,20,1,0
Balanced Diet: The Key to a Healthy Life | Best Nutrition Tips! 🥦✨,WHauen4-8Ro,Prime Health Secrets,2025-03-19T19:30:08Z,https://www.youtube.com/watch?v=WHauen4-8Ro,"Do you want to eat healthier and feel your best? In this video, we break down everything you need to know about a balanced diet, ...",177,19,1,1
One Unhealthy Meal Won’t Hurt? | Portion Control and Balanced Nutrition,OddkNAPqW5g,Parah Ltd,2025-02-26T09:17:04Z,https://www.youtube.com/watch?v=OddkNAPqW5g,"The mindset of “One unhealthy meal won't hurt” undermines the significance of portion control and balanced nutrition, as it ...",104,18,4,1
Optimizing Pre- and Post-Workout Nutrition #healthyfood #balancednutrition #food,WPo2wLMsMdk,Challenge foods,2025-02-16T16:20:53Z,https://www.youtube.com/watch?v=WPo2wLMsMdk,,61,19,0,0
#energyboost #cutthesugar #sugarcrash #fatiguesolution #balancednutrition #healthylifestyle,grgK1g7KIAA,MiVital,2025-03-18T18:09:17Z,https://www.youtube.com/watch?v=grgK1g7KIAA,,52,19,1,0
Weight Loss and Gain Muscle with Balanced Diet and Nutrition.,FNzkUQx8Ofw,Dietitian Priyanka,2025-01-17T14:15:01Z,https://www.youtube.com/watch?v=FNzkUQx8Ofw,"Meet Mr. M. Prasad, He is from USA He is from South India and his choices were south indian dishes. He was initially not sure if ...",59,40,2,0
healthy living and balanced nutrition,0MEbdQ0qVko,All Smile Always,2025-03-26T09:07:09Z,https://www.youtube.com/watch?v=0MEbdQ0qVko,fun #technique #botox #cosmetics holistic approach healthy living nutritional balance I emphasise that my current priority is ...,16,53,2,0
"Messed Up Your Diet? Don’t Quit, try Balanced Nutrition",oYSpB3gKnPY,Dr.Tygran,2025-02-26T10:01:02Z,https://www.youtube.com/watch?v=oYSpB3gKnPY,"Balanced nutrition is key, and while consistency is important, occasional exceptions happen. If you eat something extra, don't ...",85,22,0,0
Balanced Life through Clean Nutrition,F6Am0nS3WTU,SMOODY,2025-01-03T01:00:17Z,https://www.youtube.com/watch?v=F6Am0nS3WTU,Explore clean nutrition for a balanced life with practical tips and insights on wholesome eating. #NutritionTips #HealthyEating ...,33,17,1,0
"Different types of food, balanced nutrition",OiAxJ-kCcvc,Mike,2025-01-25T22:28:11Z,https://www.youtube.com/watch?v=OiAxJ-kCcvc,"五十年前天津钢厂有平炉炼钢,还有转炉炼钢和电炉炼钢。后来平炉炼钢被淘汰了。请说出目前最新的炼钢技术方式,请说出平炉炼 ...",61,15,0,0
balanced nutrition education (Ayu kurnia refiyani_085),8E9mDA10V50,STr Teknologi Laboratorium Mèdis 2023 UNIMUS,2025-01-13T09:52:53Z,https://www.youtube.com/watch?v=8E9mDA10V50,,49,14,1,0
Balanced Healthy Diet Lunch box! #india #usa #lunch #nutrition,dmoGX-1_29E,MMJ Foods,2025-01-15T07:04:50Z,https://www.youtube.com/watch?v=dmoGX-1_29E,,65,17,3,0
Healthy daily meals: nutrition tips for a balanced lifestyle #ww,Xwocv5fUT_0,張明貴,2025-03-14T09:37:50Z,https://www.youtube.com/watch?v=Xwocv5fUT_0,Daily healthy eating routine #ww #healthcoach #nutritioncoach #goodeats #realfood #mealplan.,13,15,0,0
PregnancyTips #FirstTrimester #HealthyPregnancy #BalancedNutrition #StayHydrated #usa,ew6iRwQgGeU,Sokolol,2025-02-12T05:29:33Z,https://www.youtube.com/watch?v=ew6iRwQgGeU,,13,13,0,0
"Complete,Balanced & SugarFree nutrition for your family.Best for Kids & Elderly.Bones ko strong kry💪",FINYgtmAKEc,Iffiandkids,2025-01-15T04:11:49Z,https://www.youtube.com/watch?v=FINYgtmAKEc,,46,15,0,1
Fuelling my body with balanced meals #caloriedeficit #fitness #nutrition #whatieatinaday,zy2Fln9Eapo,Don't just eat ENJOY,2025-02-02T22:14:25Z,https://www.youtube.com/watch?v=zy2Fln9Eapo,,34,12,0,0
BALANCED DIET || #balanceddiet #nutrition #organic  #eatbalanced  #wellnessforlife @Nutritionforlife,WxJCcKXa57A,Nutrition For Life,2025-02-27T08:34:55Z,https://www.youtube.com/watch?v=WxJCcKXa57A,,47,12,2,0
Maintaining a Balanced Diet - Nutrition Month Ep. 2,qsQgZLPatzs,ALS Society of New Brunswick and Nova Scotia,2025-03-13T14:01:00Z,https://www.youtube.com/watch?v=qsQgZLPatzs,"Today, we are diving into the crucial topic of maintaining a balanced diet in the second installment of our Nutritional Q&A series!",49,13,0,0
For a Healthy and Active lifestyle we need Balanced Nutrition that's the only formula to nourish,l2oI0p43-gY,Living Water Wellness,2025-03-14T07:38:43Z,https://www.youtube.com/watch?v=l2oI0p43-gY,,27,13,0,0
Final assessment [increase awareness about balanced nutrition],zWXfWtbXg3I,Fanesya Rahma W,2025-01-14T13:09:25Z,https://www.youtube.com/watch?v=zWXfWtbXg3I,,184,10,3,2
How to Create Balanced Meal Prep Containers for Optimal Nutrition,2l-I3Yw0U7k,Life Hack Lab,2025-03-29T16:43:13Z,https://www.youtube.com/watch?v=2l-I3Yw0U7k,,44,17,1,0
#healthyfood #balancednutrition #food #nutritionfirst,F9f_LM6feyA,Challenge foods,2025-02-16T16:34:32Z,https://www.youtube.com/watch?v=F9f_LM6feyA,,61,11,0,0
# food#eyes #health #balanced diet# Cataract#eye vision#nutrition #nutritionfacts,VvCEuU2IqG8,Preet Chahal,2025-02-12T08:23:09Z,https://www.youtube.com/watch?v=VvCEuU2IqG8,,36,12,0,0
#postpartumnutrition#healthandmotherhood#recipesformoms#recoveryafterbirth#balancednutrition,s-isu_rNQRk,Samanta,2025-03-13T09:45:49Z,https://www.youtube.com/watch?v=s-isu_rNQRk,Balanced nutrition for recovery.,28,9,0,0
