Title,Video ID,Channel,Published At,URL,Description,Video Length
अनिन्द्रा Insomnia केलिये लाभकारी होमियोपैथी दवा#insomnia #sleeplessness #homeopathy #shorts #doctor,laPyGd-dsMM,Dr Mohit Homeopathy Expert ,2025-03-16T04:54:21Z,https://www.youtube.com/watch?v=laPyGd-dsMM,,
RUBRIC study COMMUNICATIVE #homeopathy #mind # DR SWETA AGARWAL,DegUFvJn65I,Dr sweta Agrawal,2025-02-24T06:08:33Z,https://www.youtube.com/watch?v=DegUFvJn65I,,
Sunny Herbal hair colour #reel #health #haircare #colour #facts #sunny #homeopathy,gmQese9dP7Y,Manasha homeopathic,2025-03-11T07:44:10Z,https://www.youtube.com/watch?v=gmQese9dP7Y,Sunny Herbal hair colour #reel #health #haircare #colour #facts #sunny #homeopathy.,
Eye pain #eyepain #health #healthtips #homeopathy #shorts #shortvideo,NeOy9h9EAUw,DrNadeem Ahmad,2025-02-11T14:36:44Z,https://www.youtube.com/watch?v=NeOy9h9EAUw,,
अनजाने में पेशाब?😱होम्योपैथिक मेडिसिन! Pulsatilla 30 Uses #shorts #youtubeshorts #homeopathy,Spm-v9CGRkE,DR RATNESH KUMAR SINGH,2025-01-05T13:00:29Z,https://www.youtube.com/watch?v=Spm-v9CGRkE,अनजाने में पेशाब?  होम्योपैथिक मेडिसिन! Pulsatilla 30 Uses #shorts #youtubeshorts ...,
Orchitinum 3x Homoeopathic medicine Best treatment for sexual weakness |Use of Orchitinum3x,6U1_X1DouMo,Dr kailash prasad,2025-03-25T10:24:23Z,https://www.youtube.com/watch?v=6U1_X1DouMo,drkailashprasad6817 @kailashprasadofficial Orchitinum 3x Homoeopathic medicine Best treatment for sexual weakness |Use of ...,
Weakness after sickness #doctor  R.K Hinduja #homeopathy,iZ5TcV7RN8Q,Hinduja Homeopathy,2025-01-04T12:22:16Z,https://www.youtube.com/watch?v=iZ5TcV7RN8Q,,
Aque plus cream for acne pimple #best #skincare #homeopathy,oTXHKt_FZmI,Dr. shama homeopathic,2025-02-07T12:20:20Z,https://www.youtube.com/watch?v=oTXHKt_FZmI,Aque plus cream for acne pimple #best #skincare #homeopathy.,
Lines on Nails #homeopathy #medicine #shorts,QxplNEcPs-U,Dr warsi homeopathy,2025-02-12T15:04:32Z,https://www.youtube.com/watch?v=QxplNEcPs-U,Vertical Lines on Nails.,
"Seborrheic keratosis treatment !! Seborrheic keratosis symptoms,causes & homeopathic medicine !!",9mE7FNYLJjM,Dr.Shashi Boricha Homeopathy,2025-03-24T11:55:50Z,https://www.youtube.com/watch?v=9mE7FNYLJjM,,
Book your appointment now at 8168660799 #drsonianain #fear #anxiety #palpitation #homeopathy #viral,5LfGpPLKEuU,Dr Sonia Nain ,2025-02-07T06:26:46Z,https://www.youtube.com/watch?v=5LfGpPLKEuU,,
ஹோமியோபதி கட்டுக்கதைகள் #homeopathy #myth #bestdoctor #madurai #chennai #coimbatore,yQc4yYN_u08,Pandian’s Homoeo care,2025-01-11T06:11:35Z,https://www.youtube.com/watch?v=yQc4yYN_u08,,
Guess Homeopathy Remedy  Dr  Aparna Pitre Riddle#12 #homeopathy,JMLjhHXx8Mk,Essence of Applied Mind- Homeopathy ,2025-01-31T11:30:11Z,https://www.youtube.com/watch?v=JMLjhHXx8Mk,"All Copyrights reserved with- ""Essence of Applied Mind"". The content used in this video is intended for educational and ...",
ANAEMIA #homeopathy #doctor #diet #hemoglobin #drjoshihomeopathy #drshwetajoshi #lowbloodpressure,AuQ1tUynXCE,Dr. JOSHI HOMOEOPATHY,2025-02-01T04:43:40Z,https://www.youtube.com/watch?v=AuQ1tUynXCE,,
The Power of Homeopathy for Infections #ancienthealth #podcast #shorts #homeopathy,J-8ir2TEpX0,Doctor Motley,2025-03-28T14:23:29Z,https://www.youtube.com/watch?v=J-8ir2TEpX0,"Just like a virus scan on your computer, homeopathy hones in on viruses in your body! I've seen incredible success with ...",
Reckeweg R82 | Effective Homeopathic Anti-Fungal Drops for Skin & Health,KVE3V_WXIjU,Sunny Health Capsule,2025-02-19T12:30:26Z,https://www.youtube.com/watch?v=KVE3V_WXIjU,Reckeweg R82 | Effective Homeopathic Anti-Fungal Drops for Skin & Health Reckeweg R82 Reckeweg R82 benefits Anti-fungal ...,
Book your appointment now at 8168660799 #drsonianain #ashthma #mucus #homeopathy #natrumsulphuricum,2_taLpp7S6o,Dr Sonia Nain ,2025-01-29T07:28:59Z,https://www.youtube.com/watch?v=2_taLpp7S6o,,
Homeopathic Materia Medica book... William Boericke's #bhmsstudents #homeopathy  #materiamedica,N_3aH5t7-kg,Shreya Study Goal🎯,2025-01-12T12:33:13Z,https://www.youtube.com/watch?v=N_3aH5t7-kg,,
Health Camp Day #health #healthcamp #doctors #homeopathy #bhms #homoeopathy,hemC_xKtnnk,Nandini Mishra,2025-01-25T15:37:32Z,https://www.youtube.com/watch?v=hemC_xKtnnk,,
सिर दर्द की होम्योपैथिक दवा! Chamomilla 30 Homeopathic Medicine #shorts #youtubeshorts #homeopathy,V1nPkmn66U4,DR RATNESH KUMAR SINGH,2025-01-09T13:02:00Z,https://www.youtube.com/watch?v=V1nPkmn66U4,सिर दर्द की होम्योपैथिक दवा! Chamomilla 30 Homeopathic Medicine #shorts #youtubeshorts ...,
Podcast Out Now!! #homeopathy #homeopathicdoctor #podcast #viralshorts #remedies #naturalcure,qY0UYCTNrNU,Sycoriaan Matrimonial Services,2025-01-21T15:44:00Z,https://www.youtube.com/watch?v=qY0UYCTNrNU,,
Natrum Mur Homeopathic Medicine Short Introduction #homeopathy #skincare,FieEa2zXX-M,Hikmat And Homeopathy,2025-03-23T18:22:42Z,https://www.youtube.com/watch?v=FieEa2zXX-M,Natrum Mur 200 It relieves signs of fatigue and exhaustion and boosts energy levels in the body. It acts as an anti-inflammatory ...,
Tinnitus(ringing in ears or buzzing sound) homeopathic treatment #tinnitus #homeopathy #tinnituscure,5wrEIxtrTcc,"Dr.Himanshu Goel (MD, Homoeopathic Physician)",2025-03-25T07:26:22Z,https://www.youtube.com/watch?v=5wrEIxtrTcc,,
Homeopathy for Piles (Hemorrhoids) | Can It Avoid Surgery? | Dr. Rajesh Shah | Part 07/10,5YfiAUuT29c,Life Force Homeopathy,2025-02-25T20:48:20Z,https://www.youtube.com/watch?v=5YfiAUuT29c,,
Hirsutism Homeopathic Treatment by Dr. Ali Muhammad|Top Hirsutism Medicine,53b8EjvXOpM,Mojza of Homeopathic Doctor,2025-03-13T08:09:32Z,https://www.youtube.com/watch?v=53b8EjvXOpM,Hirsutism Homeopathic Treatment by Dr. Ali Muhammad|Top Hirsutism Medicine.,
Treat Hiatal Hernia without surgery naturally with Homeopathy | #hiatalhernia #homeopathy,me64Wyc2VZU,Dr. Anwaar Homeopathy,2025-01-09T06:19:11Z,https://www.youtube.com/watch?v=me64Wyc2VZU,,
Hair care😘#naturalhealth #homeopathy #homeopathicmedicine #homeopathic #haircare #hair #beautyadvice,V_mcOwEzHQU,Yashna🔺(𝙒𝙖𝙮 𝙊𝙛 𝙇𝙞𝙫𝙞𝙣𝙜) ,2025-02-23T11:37:21Z,https://www.youtube.com/watch?v=V_mcOwEzHQU,YashnaSM.,
Homeopaat Treatment For Alopecia Areata #alopecia #homeopathy #haircare #doctor,Xrd-fyN4cDQ,Dr Abhik Ghosh Homeopathy,2025-02-22T13:06:53Z,https://www.youtube.com/watch?v=Xrd-fyN4cDQ,,
From Doubt to Belief – Homeopathy Proves Its Strength by Treating Chronic Diseases,3462Y2Ru0SY,Modern Homeopathy,2025-01-28T08:15:21Z,https://www.youtube.com/watch?v=3462Y2Ru0SY,modernhomeopathy #healingbeyondlimits #incurablediseases #advancehomeopathy #dialysisfree #kidneyfailuresymptoms ...,
R 27 Homeopathic medicine /kidney stones/  stone pain relief #health #homeopathic #kidney #viral,lGRwkqb-bMg,Manasha homeopathic,2025-02-22T07:09:56Z,https://www.youtube.com/watch?v=lGRwkqb-bMg,R 27 Homeopathic medicine /kidney stones/ stone pain relief #health #homeopathic #kidney #viral.,
Aesculus Hippocastanum Q Uses #homeopathy #vericoseveins #piles #haemorrhoids,B3Dr_3Pwt1k,DrShaliniHomeopathy,2025-02-25T14:17:43Z,https://www.youtube.com/watch?v=B3Dr_3Pwt1k,,
@drvishalsrivastav #homeoaspireacademy #homeopathy #friendship #friends #viralvideo #viralreels #3,3bVASJFiaaA,Homeo Aspire Academy,2025-02-22T12:07:32Z,https://www.youtube.com/watch?v=3bVASJFiaaA,,
Gallbladder stone/ Cholelithiasis and Homeopathy #the #homeopathy #world,63IjKpFm39c,The HOMEOPATHY WORLD,2025-01-03T17:40:00Z,https://www.youtube.com/watch?v=63IjKpFm39c,Gallbladder stone/ Cholelithiasis and Homeopathy #the #homeopathy #world #trending.,
Homeopathy pharmacist Best of luck all exam going students,M9RzT7wZpk8,Dr. Manisha Dubey (Homeopathy Physician),2025-02-02T01:33:26Z,https://www.youtube.com/watch?v=M9RzT7wZpk8,,
#depression #tension #khoof #dar #perishani #zehniPerishani #depressed #susti #homeopathy #how,rF8uqL2lpHk,HOMEOPATHY AND HEALTH,2025-01-12T17:35:29Z,https://www.youtube.com/watch?v=rF8uqL2lpHk,depression #tension #khoof #dar #perishani #zehniPerishani #depressed #susti #homeopathy #how.,
#homeoaspireacademy #drvishalsrivastav #astonished #stramonium #homeopathy #cannabis #viralvideo,eBmACSoMTDE,Homeo Aspire Academy,2025-02-15T05:14:49Z,https://www.youtube.com/watch?v=eBmACSoMTDE,,
#fungal Infection ka ilaj (Bacho me #fungal ka Problem) #homeopathy #skincare #skin,rUTCes0rvQE,Dr Tareque Noman,2025-03-05T09:19:14Z,https://www.youtube.com/watch?v=rUTCes0rvQE,Bacho me fungal infection ye video me fungal infection ka puri tarah se treatment hua hai jo iske pury sharir pe genitals pe agaya ...,
Cured Oligospermia Part 3 #homeopathytreatment #homeopathy #patient,33aZt_UsxZI,Dr Arpit Chopra's SuperSpecialty ModernHomoeopathic,2025-03-10T11:51:57Z,https://www.youtube.com/watch?v=33aZt_UsxZI,Dr. Arpit Chopra Jain (MD HOMOEOPATHY & Critical & Surgical Disease Specialist) Address:- Aarogya Super Speciality Modern ...,
Cerato bach flower remedy uses #youtubeshorts #viralvideo #homeopathy,e5Dd3Pi-ceQ,drsurekha jhankar,2025-02-03T11:43:02Z,https://www.youtube.com/watch?v=e5Dd3Pi-ceQ,Homeopathic treatment by Dr surekha jhankar Hi every one thanks for your support and in this video I am telling you about cerato ...,
इलेक्ट्रो होम्योपैथी दवाई सस्ती या महंगी? Electro homeopathy medicines rates cheap or high?,zblrohhflbI,Nirogi Kaya EH health care & research center,2025-01-18T05:38:30Z,https://www.youtube.com/watch?v=zblrohhflbI,"Nirogi Kaya Electro homeopathy health care and research center contact 9991505223, Dr. Rustam Saini This content are made ...",
Homeopathic medicine for  #indigestion #homeomitra #homeopathy #medicine #robinia #G.E.R.D #burps,Pz0duTpdHWI,Homeo Mitra ,2025-03-23T13:32:57Z,https://www.youtube.com/watch?v=Pz0duTpdHWI,homeomitra #homeopathy #alternativemedicine #digestion #digestivehealth #gas #treatmen #medical #medicine #medicina.,
Cured Chronic Kidney Disease (CKD) Patient Part 21 #homeopathytreatment #homeopathy #patient,EmsZiPtcyC4,Dr Arpit Chopra's SuperSpecialty ModernHomoeopathic,2025-03-13T13:16:42Z,https://www.youtube.com/watch?v=EmsZiPtcyC4,Dr. Arpit Chopra Jain (MD HOMOEOPATHY & Critical & Surgical Disease Specialist) Address:- Aarogya Super Speciality Modern ...,
Petroleum 30 homeopathic medicine uses & benefits in hindi !! Petroleum best for skin problems !!,umW64UBrkyQ,Dr Shashi's health corner,2025-03-15T06:56:44Z,https://www.youtube.com/watch?v=umW64UBrkyQ,,
A Complete Guide To Pediatric Psychiatry - By Dr.F.Rameezha Burvin - #homeopathy,EmQ5PH07vNc,Dr.Meena_dharman,2025-02-22T04:58:00Z,https://www.youtube.com/watch?v=EmQ5PH07vNc,A Complete Guide To Pediatric Psychiatry - By Dr.F.Rameezha Burvin - Book collection of Dr.Meena Dharman #drmeenadharman ...,
Renal Stone Treatment | Homeopathy Treatment For Kidney Stone #renalstone #kidneystone #doctor,NuccA8f7cJw,Dr Abhik Ghosh Homeopathy,2025-03-22T15:37:03Z,https://www.youtube.com/watch?v=NuccA8f7cJw,,
Cured Interstitial Lung Disease Patient Part 16 #homeopathytreatment #homeopathy #patient,lAfYKa9Ci2s,Dr Arpit Chopra's SuperSpecialty ModernHomoeopathic,2025-03-15T13:39:02Z,https://www.youtube.com/watch?v=lAfYKa9Ci2s,Dr. Arpit Chopra Jain (MD HOMOEOPATHY & Critical & Surgical Disease Specialist) Address:- Aarogya Super Speciality Modern ...,
Corn Homeopathic Medicine #corn #homeopathy #viralhacks #healthtips #naturalhealingremedies #trend,WCngkRrS_b4,swatiraj ka Lifestyles,2025-03-09T04:22:16Z,https://www.youtube.com/watch?v=WCngkRrS_b4,Corn Homeopathic Medicine #corn #HomeopathyForCorns #corntreatment #naturalhealing #holistichealth ...,
Book your online consultation at 8168660799 #highbloodpressure #headaches #glononium #homeopathy,W47iUB6Q9eg,Dr Sonia Nain ,2025-03-27T05:32:32Z,https://www.youtube.com/watch?v=W47iUB6Q9eg,,
Dr Madhuri About 50% Discount On Medicines #medi9 #homeopathy #ayurveda #drmadhuri,X4WWi8yYicQ,AROGYA MITRA ,2025-01-30T10:50:33Z,https://www.youtube.com/watch?v=X4WWi8yYicQ,Dr Madhuri About 50% Discount On Medicines #medi9 #homeopathy #ayurveda #drmadhuri.,
#BestHomeopathicClinic #Homeopathy #HomeopathicDoctor #Hairfall #KidneyStone #Skincare #Gas #Liver,s6oBtKDEkMU,Dr A K Mishra's Homeopathy,2025-01-28T17:05:34Z,https://www.youtube.com/watch?v=s6oBtKDEkMU,,
1st year Homeopathy books for students..#homeopathy  #doctor #neet #bhms #bhmsexams #mbbs #mbbslife,p4wX3-vkoak,omni present2025,2025-03-05T05:38:32Z,https://www.youtube.com/watch?v=p4wX3-vkoak,this short give you the information about the 1st year Homeopathy textbooks for students #bhmsexams #bhmsstudents ...,
#deceiveColour #deceiveColor #RangonKaDhoka #homeopathy #homeopathicmedicine #eyesproblem #eyesight,eEGUsB6Hrmc,HOMEOPATHY AND HEALTH,2025-01-25T06:19:44Z,https://www.youtube.com/watch?v=eEGUsB6Hrmc,deceiveColour #deceiveColor #RangonKaDhoka #homeopathy #homeopathicmedicine #eyesproblem #eyesight.,
Secale Cornutum #homeopathy,HHlrdAKRAaU,Dr Vaishali Jain - Homoeopath,2025-01-27T05:37:15Z,https://www.youtube.com/watch?v=HHlrdAKRAaU,,
Cherry plum bach flower remedy uses #youtubeshorts #bachfloweruses #homeopathy,AxwUzz3NX-M,drsurekha jhankar,2025-02-06T11:40:58Z,https://www.youtube.com/watch?v=AxwUzz3NX-M,Homeopathic treatment by Dr surekha jhankar Hi every one thanks for your support and in this video I am telling you about cherry ...,
INCONTINENCE -Homeopathy Treatment Drkukreja kalani online consultation 8291492566,kOHo4Rj7jr4,Kent Homeopathy Clinic Powai,2025-03-08T09:19:19Z,https://www.youtube.com/watch?v=kOHo4Rj7jr4,"Incontinence is the inability to control bodily functions, particularly urination or defecation. It can result from various causes, ...",
Cured Oligospermia Part 9 #homeopathytreatment #homeopathy #patient,oUCaRfM3jKo,Dr Arpit Chopra's SuperSpecialty ModernHomoeopathic,2025-03-10T11:53:05Z,https://www.youtube.com/watch?v=oUCaRfM3jKo,Dr. Arpit Chopra Jain (MD HOMOEOPATHY & Critical & Surgical Disease Specialist) Address:- Aarogya Super Speciality Modern ...,
Aspen bach flower से करे अज्ञात भय को दूर #youtubeshorts #homeopathy,tlm5Vxg4z0U,drsurekha jhankar,2025-01-22T11:50:31Z,https://www.youtube.com/watch?v=tlm5Vxg4z0U,Homeopathic treatment by Dr surekha jhankar Hi every one thanks for your support and in this video I am telling you about ...,
Arnica Basic Use for Pain. #health #homeopathy #information,mb9tyEs8JjA,Hikmat And Homeopathy,2025-02-19T18:32:45Z,https://www.youtube.com/watch?v=mb9tyEs8JjA,"Arnica has been used for centuries as an alternative medicine to treat hair loss, arthritis, inflammation, bruises, infections, and ...",
Antimonium tartaricum How It Relates to Other Homeopathic Medicines Homeopathy Insights  #homeopathy,DYi9GM0StKI,A Homeopath,2025-01-22T04:30:06Z,https://www.youtube.com/watch?v=DYi9GM0StKI,इस शॉर्ट्स वीडियो में होम्योपैथिक दवा **Antimonium Tartaricum** की **Pharmacokinship** ...,
Healing with Homeopathy and #homeopathy #skincare #health #skin,Cuvvq2Wf8t8,MINDWELL,2025-01-04T12:05:33Z,https://www.youtube.com/watch?v=Cuvvq2Wf8t8,,
Best Homeopathic Medicine for Chills & Shivering | Natural Remedies for Cold & Body Coldness,BeLW2wisrOE,Rehman Homoeo Clinic Official,2025-03-09T18:30:19Z,https://www.youtube.com/watch?v=BeLW2wisrOE,Homeopathy #NaturalRemedies #ColdAndFlu #ChillsAndShivering #HomeopathicMedicine #WinterWellness #HolisticHealing ...,
#presumptuous- #rubrics #hindi  #homeopathy #drprachidua #lycopodium #bhms #hhf #bhmsstudents,dyFTSV5wjk0,Dr Prachi Dua,2025-03-01T09:25:37Z,https://www.youtube.com/watch?v=dyFTSV5wjk0,,
Homeopathy And The Body’s Elimination System,w1ARSBKto_s,Institute for Neuro-Immune Medicine,2025-02-20T17:01:12Z,https://www.youtube.com/watch?v=w1ARSBKto_s,"Alongside host Haylie Pomroy, Dr. Payam Hakimi, Medical Director at Body of Harmony discusses how homeopathy supports the ...",
Gangrene Cured  Video Coming soon... | Dr Aaditya Doshi | Homeopathy| #Gangrene #homeopathy,m9Wn8tTMtcs,Dr Aaditya Doshi & Dr. Pradip Doshi's Hospital ,2025-03-12T14:39:28Z,https://www.youtube.com/watch?v=m9Wn8tTMtcs,Case of Gangrene Cured by Dr Aaditya Doshi. Video Coming soon...!!! For Appointment contact us on +91-8320247033 This is A ...,
Homeopathy Treatment For Renal Stone #renalstone #homeopathy #kidneystone #shorts,CPIpwGxFmpQ,Dr Abhik Ghosh Homeopathy,2025-01-11T12:22:45Z,https://www.youtube.com/watch?v=CPIpwGxFmpQ,,
What to do if you have frequent nosebleeds??#nosebleed #treatment #homeopathy #bleeding #blood ng,fSAFyJ71JBI,Fatema Haidry ,2025-02-16T20:23:38Z,https://www.youtube.com/watch?v=fSAFyJ71JBI,Epistaxis (Nosebleed) Causes: 1. Dry air – Common in winter or air-conditioned rooms 2. Nose picking – Damages blood vessels ...,
Cured Hypothyroidism Disease Patient Part 13 #homeopathytreatment #homeopathy #patient,pkoeVn63u0I,Dr Arpit Chopra's SuperSpecialty ModernHomoeopathic,2025-03-20T13:06:58Z,https://www.youtube.com/watch?v=pkoeVn63u0I,Dr. Arpit Chopra Jain (MD HOMOEOPATHY & Critical & Surgical Disease Specialist) Address:- Aarogya Super Speciality Modern ...,
Cured Slip Disc Patient Part 13 #homeopathytreatment #homeopathy #patient,OqTvq8-9KHc,Dr Arpit Chopra's SuperSpecialty ModernHomoeopathic,2025-03-05T14:00:23Z,https://www.youtube.com/watch?v=OqTvq8-9KHc,Dr. Arpit Chopra Jain (MD HOMOEOPATHY & Critical & Surgical Disease Specialist) Address:- Aarogya Super Speciality Modern ...,
Book your online consultation at 8168660799 #drsonianain #migrane #eyepain #spigelia #homeopathy,651Skh6VTco,Dr Sonia Nain ,2025-03-28T06:44:40Z,https://www.youtube.com/watch?v=651Skh6VTco,,
Homeopathic medicine for treatment of kneepain #homeopathy #jointpain #shorts,c-S0lJYrrXw,Dr. vishal k nagar,2025-01-14T16:09:11Z,https://www.youtube.com/watch?v=c-S0lJYrrXw,Homeopathic medicine for treatment of kneepain For consultation call us on Dr vishal homeopathy: 9899733332 Rx homeopathic ...,
Nux Vomica 200 (Removes' side effects of Allopathy and wrong injection) #homeopathy  #allopathy,8PEIJJyWH24,Hikmat And Homeopathy,2025-03-20T18:07:20Z,https://www.youtube.com/watch?v=8PEIJJyWH24,Nux Vomica 200 Give this video a Thumbs Up if you like it. Comment Your Views and Suggestion. Share This Video If You find it ...,
CORN/गट्टे/गोखुर😱होम्योपैथिक मेडिसिन! Thuja Homeopathy Uses #shorts #youtubeshorts #homeopathy,_QFWwciEaIQ,DR RATNESH KUMAR SINGH,2025-02-08T06:02:00Z,https://www.youtube.com/watch?v=_QFWwciEaIQ,CORN/गट्टे/गोखुर  होम्योपैथिक मेडिसिन! Thuja Homeopathy Uses #shorts #youtubeshorts ...,
ا#dakar #paitmegas #gas #aphara #بڑے بڑے ڈکار #gastrouble #digestion #digestionproblems #homeopathy,CD2mBIhLDsc,HOMEOPATHY AND HEALTH,2025-01-08T16:58:05Z,https://www.youtube.com/watch?v=CD2mBIhLDsc,dakar #paitmegas #gas #aphara #بڑے بڑے ڈکار #gastrouble #digestion #digestionproblems #homeopathy.,
Asthma Control Made Simple! | Bakson's Homoeopathy,hD0hGnoKdVw,Bakson's Homoeopathy,2025-02-28T07:19:29Z,https://www.youtube.com/watch?v=hD0hGnoKdVw,"FOR CONSULTATION CONTACT BAKSON'S CLINIC ADDRESS: B-2, BASEMENT, SOUTH EXTENSION I, BLOCK A, NEW ...",
पेट दर्द की होम्योपैथिक दवा | Colocynth Homeopathic Medicine Uses #shorts #youtubeshorts #homeopathy,rlkwGC15g2s,DR RATNESH KUMAR SINGH,2025-01-10T14:30:33Z,https://www.youtube.com/watch?v=rlkwGC15g2s,पेट दर्द की होम्योपैथिक दवा | Colocynth Homeopathic Medicine Uses #shorts #youtubeshorts ...,
What Is Sinusitis In Telugu | Sign And Symptoms Of Sinusitis | Medi9 Homeopathy & Ayurveda #shorts,hG1wCxN7YVg,Medi9 Homeopathy & Ayurveda - IMS,2025-01-08T10:00:47Z,https://www.youtube.com/watch?v=hG1wCxN7YVg,What Is Sinusitis In Telugu | Sign And Symptoms Of Sinusitis | Reason For Sinusitis | Homeopathy Treatment For Sinusitis | Medi9 ...,
Cured Bronchial Allergic Asthma Patient Part 8 #homeopathytreatment #homeopathy #patient,UaqLT5PlzHE,Dr Arpit Chopra's SuperSpecialty ModernHomoeopathic,2025-03-26T13:36:44Z,https://www.youtube.com/watch?v=UaqLT5PlzHE,Dr. Arpit Chopra Jain (MD HOMOEOPATHY & Critical & Surgical Disease Specialist) Address:- Aarogya Super Speciality Modern ...,
Why do #Homoeopaths do not share prescriptions or keep them #secret ? #homeopathy #alternative,8kP0WNC_BcE,Dr. Vidur Vithal MD,2025-02-18T12:06:35Z,https://www.youtube.com/watch?v=8kP0WNC_BcE,Homeopaths often do not share prescriptions for several reasons: 1. Individualized Treatment – Homeopathy is based on the ...,
Rapid fire @ A alphabet Allen's keynote #homeopathy #homeopathicmedicine,rWmqlDDHzPA,Aude Sapere,2025-03-17T07:13:45Z,https://www.youtube.com/watch?v=rWmqlDDHzPA,,
#homeopathy exam2feb#upsssc#expacted cut off #homeopathy pharmasist,d83ZTxyRBzc,U.P. EXAM ASPIRANTS,2025-02-07T21:12:55Z,https://www.youtube.com/watch?v=d83ZTxyRBzc,homeopathy exam2feb#upsssc#expacted cut off #homeopathy pharmasist.,
Cured Idiopathic Thrombocytopenic Purpura (ITP) Part 1 #homeopathytreatment #homeopathy #patient,fGyYlYxO0F4,Dr Arpit Chopra's SuperSpecialty ModernHomoeopathic,2025-03-04T14:10:18Z,https://www.youtube.com/watch?v=fGyYlYxO0F4,Dr. Arpit Chopra Jain (MD HOMOEOPATHY & Critical & Surgical Disease Specialist) Address:- Aarogya Super Speciality Modern ...,
patient Review - Kidney Stone Remove With Homeopathy - Dr. Ayaz Ghoghari #kidneystone #homeopathy,w1rFYHP_wq4,Dr. Ayaz Ghoghari,2025-03-10T08:02:41Z,https://www.youtube.com/watch?v=w1rFYHP_wq4,,
Cured Bronchial Allergic Asthma Patient Part 17 #homeopathytreatment #homeopathy #patient,WxHUHIBUMTM,Dr Arpit Chopra's SuperSpecialty ModernHomoeopathic,2025-03-26T13:38:13Z,https://www.youtube.com/watch?v=WxHUHIBUMTM,Dr. Arpit Chopra Jain (MD HOMOEOPATHY & Critical & Surgical Disease Specialist) Address:- Aarogya Super Speciality Modern ...,
Feeling Tired & Weak? It Could Be B12 Deficiency! #shorts #homeopathy,iWzuQV6sW1I,Homeo Care Clinic,2025-02-27T11:52:04Z,https://www.youtube.com/watch?v=iWzuQV6sW1I,Feeling Tired & Weak? It Could Be B12 Deficiency! ✨ Boost your energy and health naturally with homeopathy. Let's restore ...,
#sciatica #sciaticanervepain #sciaticapaintreatment #sciaticapain #langrikadard #homeopathy #pain,OMb_OtgFwGA,HOMEOPATHY AND HEALTH,2025-03-20T13:02:06Z,https://www.youtube.com/watch?v=OMb_OtgFwGA,sciatica #sciaticanervepain #sciaticapaintreatment #sciaticapain #langrikadard #homeopathy #pain.,
One more patient is cure through Homeopathic Medicine || ##homeopathics #homeopathy #medicine,boOxJ0mZahY,Dr Afzal khan,2025-01-15T17:51:47Z,https://www.youtube.com/watch?v=boOxJ0mZahY,,
Gurikbal Singh Explains Allopathy vs Homeopathy | Benefits & Side Effects of Tablets #radiohaanji,hmol4iBtoyY,Radio Haanji,2025-03-19T01:00:30Z,https://www.youtube.com/watch?v=hmol4iBtoyY,"Gurikbal Singh, a pharmacist, shares insights on allopathy vs homeopathy—their benefits, uses, and possible side effects.",
Homeopathy Treatment For PILES #piles #homeopathy #homeopathytreatment #doctor #Hemorrhoids,aRHygZLUGZs,Dr Abhik Ghosh Homeopathy,2025-01-25T13:09:35Z,https://www.youtube.com/watch?v=aRHygZLUGZs,PILES Cure Case No 4 | Homeopathy Treatment for Piles | Dr Abhik Ghosh Homeopathy Contact Us - Dr Ghosh Homoeopathy ...,
Joints Pain me turant relief pane ke liye #homeopathic #viralvideo #homeopathy,hsrPM6AFQRA,Homeopathic By Devraj Yadav,2025-03-14T10:26:02Z,https://www.youtube.com/watch?v=hsrPM6AFQRA,Video from Devraj Yadav.,
अनियमित पीरियड? Irregular Periods Homeopathic Medicine! Calcarea Phos Uses #shorts #homeopathy,FO7DUUgaHss,DR RATNESH KUMAR SINGH,2025-02-21T13:30:14Z,https://www.youtube.com/watch?v=FO7DUUgaHss,अनियमित पीरियड? Irregular Periods Homeopathic Medicine! Calcarea Phos Uses #shorts #homeopathy ...,
#predictivehomeopathy #hahnemannclasses #homeopathy #books #education,ALBrKPrAQzQ,HAHNEMANN CLASSES,2025-02-27T15:59:51Z,https://www.youtube.com/watch?v=ALBrKPrAQzQ,,
Harmful effects of over the counter pain killer medicines  #homeopathy #painkiller #arthritis,KXMd7pAS2ps,NiGo Lifeline Homeopathy,2025-02-05T12:08:17Z,https://www.youtube.com/watch?v=KXMd7pAS2ps,Harmful effects of over the counter pain killer medicines #homeopathy #painkiller #arthritis.,
DIY VIT C SERUM #Skincare #diy #skincareroutine #homeopathy #nightskin routine #ski #shorts@DrAnjul,XLH-tuK8cYo,Dr Anjul,2025-01-28T13:13:52Z,https://www.youtube.com/watch?v=XLH-tuK8cYo,,
Homeopathy for Eyebrow Hair Loss #homeopathy #eyebrowhairloss @HomeoDoctor,sNx5EHslfBM,Homeo Doctor,2025-03-20T12:49:03Z,https://www.youtube.com/watch?v=sNx5EHslfBM,"Are you suffering from eyebrow hair loss? This common issue can be frustrating, but don't worry! Homeopathy offers a natural and ...",
#insomnia #homeopathy #ytshorts #reels #shorts,vTnQNmVmZ9I,Dr. Areesha Khan- Wellness Path,2025-03-18T14:47:35Z,https://www.youtube.com/watch?v=vTnQNmVmZ9I,,
How Many Types Of Piles In Telugu | Causes For Piles | Medi9 Homeopathy & Ayurveda #shorts #piles,NsSPuc-b3eM,Medi9 Homeopathy & Ayurveda - IMS,2025-01-05T06:00:13Z,https://www.youtube.com/watch?v=NsSPuc-b3eM,How Many Types Of Piles In Telugu | Causes For Piles | Medi9 Homeopathy & Ayurveda #shorts #piles #medi9 #homeopathi ...,
