Title,Video ID,Channel,Published At,URL,Description,Video Length
Lemon water please try it🍋🍋🍋,WlVvz6AjwzI,Alisha creative world 🎊🎊,2025-01-28T15:07:28Z,https://www.youtube.com/watch?v=WlVvz6AjwzI,,
"""Morning Morning 🌄 lemon water 🍋💧 #food #trending #trendingshorts",TkvHRbkS8mA,VinnusKitchen7,2025-02-18T03:23:41Z,https://www.youtube.com/watch?v=TkvHRbkS8mA,,
Lemon Water: Healthy Habit or Hidden Danger? 🍋⚠️,Kh0GifkivsY,Know Your Body Zen ,2025-01-04T12:30:25Z,https://www.youtube.com/watch?v=Kh0GifkivsY,"Discover the truth about lemon water in our fast-paced reel, ""The Truth About Lemon Water ✨""! While it seems like a refreshing ...",
Itna Jaan Gya hu 🤪 #shorts #shortvideo #hotel #dinner #lemon #water #restaurant #uk #enjoy #life,rfyOU9I4lwk,The RK World,2025-03-29T06:15:34Z,https://www.youtube.com/watch?v=rfyOU9I4lwk,Itna Jaan Gya hu @therkworld8903.,
What happens when you drink lemon water for 14 days,is4HO2Zbl0g,Fit Over 50 Now,2025-03-16T01:08:30Z,https://www.youtube.com/watch?v=is4HO2Zbl0g,"Start your day with lemon water and see incredible health perks in just 2 weeks! Prevent fatty liver, balance blood sugar, and ...",
science experiment with lemon water and salt #science experiment #knowledge bites,_3zKlM-IZrM,Knowledge_bites,2025-03-25T03:57:24Z,https://www.youtube.com/watch?v=_3zKlM-IZrM,,
The Benefits of Lemon Water is UNDERRATED!,nHgGVj5gF1g,Health Fit,2025-03-07T11:05:02Z,https://www.youtube.com/watch?v=nHgGVj5gF1g,"Lemon water is rich in vitamin C, Studies show it aids digestion and promotes hydration. Antioxidants in lemons may reduce ...",
| Nimbu Pani | nimbu pani recipe  | #trending #shorts | Lemon Water |,Octzq_aD2-o,B's Food Lab,2025-03-02T05:29:29Z,https://www.youtube.com/watch?v=Octzq_aD2-o,Nimbu Pani | summer drink | Nimbu Pani Recipe | Ingredients: Lemon - 1nos Salt - 1⁄4tsp Roasted Cumin Powder – 1⁄2tsp Sugar ...,
Lemon Water In Morning | Benefits of Lemon Water | #लिंबूपाणी #lemon #lemonwaterbenefits #shortsfeed,lATPnl8FoB0,Aaipan bhari,2025-01-07T02:52:47Z,https://www.youtube.com/watch?v=lATPnl8FoB0,lemonwater #लिंबू #पाणी #lemonwaterbenefits #lemonwaterinmorning #drinkinglemonwater #healthtips #ahar ...,
Lemon water with Sabjaseeds #trending #shorts #popular #reels #juice,Yt0vEIy52BI,Bhavana sirivella all in one vlogs,2025-03-28T05:00:24Z,https://www.youtube.com/watch?v=Yt0vEIy52BI,Bhavanasirivellaallinonevlogs #trending #juice #lemon #sabjaseeds #popular.,
Cucumber and Lemon Water #shorts,2JLANMjoyko,mhel's kitchen and vlog,2025-02-19T09:12:38Z,https://www.youtube.com/watch?v=2JLANMjoyko,,
Lemon Water for Digestion | Start Your Day Right with Lemon Water! 🍋💧,h60MMQaNXrE,Natural Living,2025-01-18T09:30:02Z,https://www.youtube.com/watch?v=h60MMQaNXrE,Do you know the easiest way to detox your body every morning?” Start your day with a simple habit: squeeze half a lemon into ...,
Cucumber and Lemon Water: The Ultimate Health Drink,BxsTvqdv8F0,Puzzling Chronicles,2025-01-28T22:00:07Z,https://www.youtube.com/watch?v=BxsTvqdv8F0,Ever wondered how a simple drink can transform your health? Start your day with cucumber and lemon water! Discover the ...,
"Feeling bloated? Detox with Ayurveda warm lemon water, Triphala & yoga for a healthier you!",6n4CxmY5zYk,Krishnendu Ayurveda,2025-02-12T06:13:40Z,https://www.youtube.com/watch?v=6n4CxmY5zYk,,
But first hot lemon water,MhM0b2dkPGY,Alexis,2025-02-10T19:00:45Z,https://www.youtube.com/watch?v=MhM0b2dkPGY,,
This will help you lose weight like never before #fitwithamit #busybutfit  #lemonwater  #detox,kpakeV58aMg,Amit Bhardwaj,2025-01-20T03:34:59Z,https://www.youtube.com/watch?v=kpakeV58aMg,,
Unlock the Amazing Benefits of Lemon and Ginger Water #lemon #lemonwater #ginger #food,CNPdKpEXLJo,Top Chefs,2025-01-01T23:29:13Z,https://www.youtube.com/watch?v=CNPdKpEXLJo,Unlock the Amazing Benefits of Lemon and Ginger Water #lemon #lemonwater #ginger #food #recipe Discover the incredible ...,
🍋💧Lemon Water: Kick Start Your Day! 🍋💧 #healthtips #easynutrition #healthyliving,kF4QHVo1FyQ,Peak Performance For You,2025-03-24T17:00:54Z,https://www.youtube.com/watch?v=kF4QHVo1FyQ,"Lemon Water: Kick Start Your Day! Boost your mornings with lemon water! ✨ Hydrate, support digestion, and get a dose of ...",
Lemon Water Is Your Body's Best Friend 🍋💧,kcD3vJaD1_s,Simply Good Health,2025-02-13T21:01:34Z,https://www.youtube.com/watch?v=kcD3vJaD1_s,"Boost your health with lemon water! Discover the amazing benefits of drinking lemon water daily—better digestion, glowing ...",
lemonade #lemonwater #summerdrink #shorts,C4zJWjoK3ag,Harsha's Kitchen,2025-03-04T11:11:54Z,https://www.youtube.com/watch?v=C4zJWjoK3ag,lemonade #lemonwater #summerdrink #shorts #mocktail #lemonjuice #lemonade ingredients gud mint leaves ginger lemon juice ...,
Lemon Water Mistakes # lemo #lemon #lemonwatermistakes #lemonwaterbenefits #healthyliving #health,3KinIelX2X8,Nourish 'N' Thrive,2025-01-01T01:29:17Z,https://www.youtube.com/watch?v=3KinIelX2X8,,
Unbelievable benefits of drinking lemon water🍋🍋🍋💦💦 #health #information #facts #dailylife #nutrition,BHcp8-aOyO0,Energize your day,2025-01-27T14:02:54Z,https://www.youtube.com/watch?v=BHcp8-aOyO0,,
“Should You Drink Lemon Water Every Morning?” – Facts vs. myths.,CzpPaB0mUio,Peak Health,2025-03-11T18:45:00Z,https://www.youtube.com/watch?v=CzpPaB0mUio,Should You Drink Lemon Water Every Morning?” – Facts vs. myths. #lemon #healthyfood #health #fitness #goodhealth MEDICAL ...,
Refresh Your Day with Cucumber Lemon Water! 💧✨,2QpdMef_0cY,ELEVATED ESSENTIALS,2025-01-07T15:57:16Z,https://www.youtube.com/watch?v=2QpdMef_0cY,Transform your hydration game with this simple cucumber lemon water recipe in my Wake Up & Slay tumbler! Not only does ...,
morning drink hot lemon water #weightloss #wealth #morning #lemon #healthy #drinks #drink,oXr4OB4FFi0,RAS MEALS ,2025-03-30T01:46:24Z,https://www.youtube.com/watch?v=oXr4OB4FFi0,,
#lemonwater #lemonperfect #lemonwaterbenefits #drinkwater #water #healthyhydration #zerosugar,7DmblxDiqwE,DezaraiShante',2025-01-16T20:22:25Z,https://www.youtube.com/watch?v=7DmblxDiqwE,,
I feel fancy and skinny already 🤣😭 #lemonwater #sparklingwater #eatclean #sarcastic #relatable,5pyQGhk4Dr0,That sassy blonde farmsteader,2025-02-18T17:53:59Z,https://www.youtube.com/watch?v=5pyQGhk4Dr0,,
Lemon-Chia Water 🥰 #healthydrink  #refreshingdrink  #lemonwater  #shortsvideo  #popular  #shorts,dWt1wh90a3w,Food Tryp,2025-01-22T17:55:57Z,https://www.youtube.com/watch?v=dWt1wh90a3w,,
Why drink lemon water? 🍋💦,rLBa8Q2iITk,Amy Shapiro - Real Nutrition NYC,2025-03-31T18:43:07Z,https://www.youtube.com/watch?v=rLBa8Q2iITk,"It's more than just a refreshing start to your day - it's a health booster in a glass. Packed with vitamin C, lemon water helps support ...",
5 Reasons Why To Drink Cucumber & Lemon Water !!️ #lemonwater,rNTZAKia8rw,MiiraaOnTheWall,2025-02-06T15:01:12Z,https://www.youtube.com/watch?v=rNTZAKia8rw,Have You Ever Wondered whether you started using birth control too early & that could be the cause of your pcos? @3:57 mark !,
Pov: prepping your lemon water! #ad #lemon #lifehack #fok,hcFuBUw-pN8,Rick Lee,2025-03-27T01:00:37Z,https://www.youtube.com/watch?v=hcFuBUw-pN8,Boost your morning routine with lemon water #ad #lemon #lifehack #fok #healthyliving.,
Benefits of Lemon Water #healthymorning #healthylifestyle #healthydiet,T8DDaAJqMWg,Healthy Body Shorts,2025-03-09T14:30:08Z,https://www.youtube.com/watch?v=T8DDaAJqMWg,Drinking Lemon Water in the morning boosts immune system.,
Is Lemon Water the Key to Better Health? 🍋💧 #healthylifestyle #hydration,aufMTh-Cp2M,Health Power Food,2025-02-16T15:00:03Z,https://www.youtube.com/watch?v=aufMTh-Cp2M,"Lemon water is a simple yet powerful way to start your day! Packed with vitamin C, antioxidants, and detoxifying properties, ...",
Drink lemon water in morning for 14 days day tow #lemonwaterbenefits #short,3j6EiGABM7s,Chef Ricardo Cooking,2025-02-20T13:30:17Z,https://www.youtube.com/watch?v=3j6EiGABM7s,Drink lemon water in morning for 14 days day tow #lemonwaterbenefits #shortsvideo NEW BOOK OUT NOW ...,
Boost Your Morning Energy with Lemon Water 🍋 | Easy Health Hack for Wellness 💧,JNqOoYfkm3I,Healthy life + Healthy fit,2025-01-01T21:45:00Z,https://www.youtube.com/watch?v=JNqOoYfkm3I,Start your day right with this simple morning health hack! Drinking warm lemon water helps: ✔️ Boost your metabolism ...,
Lemon water,_VnMp15aUhM,Time pass,2025-01-26T11:02:11Z,https://www.youtube.com/watch?v=_VnMp15aUhM,,
Lemon Juice | lemon water benefits | nimbu pani recipe |  #shorts #trending #food,TCevcbgj1nE,💜Radhe💜 289k views • 2 house ago,2025-03-16T09:02:25Z,https://www.youtube.com/watch?v=TCevcbgj1nE,title _ Lemon Juice | lemon water benefits | nimbu pani recipe | #shorts #trending #food Yeh Nimbu Paani Kabhi Try kiya aapne ?,
Lemon masala soda 🤤😍😋#shorts #youtubeshorts #fruit #trending #lemon#lemonwater#viralshorts,BEXHZQAoLr4,Fruits Food,2025-03-05T12:36:14Z,https://www.youtube.com/watch?v=BEXHZQAoLr4,Lemon masala soda #shorts #youtubeshorts #fruit #trending #lemon#lemonwater#viralshorts.,
What Happens If You Drink Lemon Water Every Day? Surprising Benefits & Risks!,1eggjatrUoo,DR Knows,2025-03-21T21:00:02Z,https://www.youtube.com/watch?v=1eggjatrUoo,"Drinking lemon water daily has become a popular health trend, but is it really as beneficial as people claim? From boosting ...",
Lemon water,jpjGUmO8TRs,Briszell's Way,2025-03-16T11:18:29Z,https://www.youtube.com/watch?v=jpjGUmO8TRs,,
Constructing lemon water #cute #ai #garmi #trending #viralvideo #funny #shorts #cat #duck #rabbit,QqCwOO3B5Ps,FunWithAiWorld,2025-03-25T16:04:51Z,https://www.youtube.com/watch?v=QqCwOO3B5Ps,RabbitRescue #CuteAnimals #BunnyAdventure #AnimalRescue #ai #animation #rabbit . Rabbit Journey  | The Rabbit Save to ...,
"lemon water, summer special #lemon #summerdrink",uo2iTRi-Xr8,Anitha Gurrala,2025-03-20T10:43:47Z,https://www.youtube.com/watch?v=uo2iTRi-Xr8,,
Game changer #lemon #water #health #beverage,1RuJumD4et4,T G,2025-03-22T15:47:08Z,https://www.youtube.com/watch?v=1RuJumD4et4,Game-changing beverage: boost your health with #lemon #water #fok.,
Lemon Water v/s Glucon-D ❓ #shorts #lemonwater #glucond,KKQkE6laxl8,Its Mistu,2025-01-22T01:30:16Z,https://www.youtube.com/watch?v=KKQkE6laxl8,"Lemon Water v/s Glucon-D ❓ #shorts #lemonwater #glucondbenefits lemon water,glucon-d,lemon water vs glucon d,lemon water ...",
What Happens to Your Body When You Drink Lemon Water for 14 Days #lemonwater #detoxdrink #hydration,vpCHanoqtDM,BlowDot,2025-03-15T23:00:49Z,https://www.youtube.com/watch?v=vpCHanoqtDM,"Drinking lemon water for 14 days can have a transformative impact on your body! Packed with vitamin C, antioxidants, and ...",
"Want a simple way to detox your body? Try lemon water! s: #LemonWater, #DetoxTips, #HealthyDrinks",IlCxr5M5bpM,Dr Kamlesh Inspires 1,2025-01-29T13:33:58Z,https://www.youtube.com/watch?v=IlCxr5M5bpM,"Detoxifies and Cleanses Lemon water is often called a ""detox drink"" because it helps flush out toxins from your body.",
Top 3 Surprising Benefits of Drinking Lemon Water Every Morning,pmVvZTgBWM4,Mind's Radiance,2025-01-20T16:49:08Z,https://www.youtube.com/watch?v=pmVvZTgBWM4,Looking for a simple health boost? Drinking lemon water every morning is a refreshing and beneficial habit that can transform ...,
Morning drink 🍋🍸#chiaseeds #lemon #water #morningdrink #morning #diet #breakfast #chia #antioxidants,ssP6gXJWBHM,Anjali Sanepara,2025-03-21T05:27:08Z,https://www.youtube.com/watch?v=ssP6gXJWBHM,,
When you want to embrace lemon water but struggle,tgmDEADIHkA,The Taste of Life,2025-03-04T01:00:47Z,https://www.youtube.com/watch?v=tgmDEADIHkA,When you want to embrace healthy habits but reality hits #fok.,
Honest review on “Lemon Water” perfume by #Trufragrance&Beauty #tjmaxx #lemonwater  #Trufragrance,K2789y7P5ws,Business Blooming,2025-01-19T06:07:31Z,https://www.youtube.com/watch?v=K2789y7P5ws,,
ASMR lemon water #asmrvideo #food #water,q6701lGMUOI,Theek edit,2025-01-03T10:31:33Z,https://www.youtube.com/watch?v=q6701lGMUOI,,
#  Lemon water 🍋🍋🍋🍋🍋🍋# short 😋😋,vbo4SskdbFI,HAPPY KITCHEN  official_123,2025-02-22T17:21:09Z,https://www.youtube.com/watch?v=vbo4SskdbFI,,
निम्बू पानी lemon water  🍋 💧 #prayagrajkumbhmela  #mahakumbh #viralvideo #trandingshorts,w29yOzM6mXI,@Jaybirds603,2025-02-11T12:35:01Z,https://www.youtube.com/watch?v=w29yOzM6mXI,Hi friends... This is my new channel. please support my channel @jaybirds603.,
childhood memory lemon drink in summer holidays #lemon drink #telugusongs #lemon water,zkxZnSmZduk,Nazim cooking &vloges,2025-03-12T13:01:29Z,https://www.youtube.com/watch?v=zkxZnSmZduk,,
5 Incredible Benefits of Drinking Lemon Water Ever #lemonwater #healthtips #hydration,7hTodkE7TIE,HealthyRoots,2025-01-26T10:30:06Z,https://www.youtube.com/watch?v=7hTodkE7TIE,"Start your day with a refreshing glass of lemon water! Not only does it hydrate, but it also offers incredible health benefits.",
Start Your Day with Lemon Water 🍋 | Morning Wellness Boost,45B07mGD7Wo,BOOST YOUR VITAL,2025-01-29T03:45:00Z,https://www.youtube.com/watch?v=45B07mGD7Wo,Kickstart your morning with the refreshing power of lemon water! Discover how this simple habit can transform your health by ...,
5 Surprising Benefits of Warm Lemon Water,0Ql8KknLlZY,Healthness,2025-03-12T11:00:20Z,https://www.youtube.com/watch?v=0Ql8KknLlZY,Discover the hidden benefits of warm lemon water! #HealthTips #LemonWater #WellnessJourney #DailyRoutine #Hydration.,
What happens when you use lemon 🍋 water daily for 14 days? #lemonwater #healthtips #doctoradvise #MD,FcEHzGp-rV0,Dr. Bhupen Skin hair & medicine ,2025-01-07T17:29:41Z,https://www.youtube.com/watch?v=FcEHzGp-rV0,,
Daily shorts//my morning routine//lemon water.,2j0dX3DpYDY,SoloSerenity,2025-03-02T04:30:00Z,https://www.youtube.com/watch?v=2j0dX3DpYDY,Hey besties! I hope you're all doing amazing! I've been working on overcoming my procrastination by creating daily shorts and ...,
Lemon 🍋 & soda drink 🍸 # short# ytshort # summer drink # lemon water # sodawater# easy # drinck,b8gbjQ09gwM,Asm cooking ,2025-03-29T09:47:57Z,https://www.youtube.com/watch?v=b8gbjQ09gwM,Lemon & soda drink # short# ytshort # summer drink # lemon water # sodawater# easy # drinck # summer drink #ytshorts ...,
"Lemon Water + Apples = Super Health, Say Experts",ciiaS1kZUh8,  Health Tips Shah G,2025-02-24T08:03:11Z,https://www.youtube.com/watch?v=ciiaS1kZUh8,"LemonWater #AppleBenefits #superhealthtv Lemon Water + Apples = Super Health, Say Experts, Abhinav Mahajan, Fit Men Cook ...",
My lemon water healing,Xp-35gZBuzw,Marjorie Lounds,2025-01-10T20:22:30Z,https://www.youtube.com/watch?v=Xp-35gZBuzw,"Why should lemon water in the morning be one of your non-negotiable habits? It hydrates, aids digestion, boosts metabolism, and ...",
Why You Need Lemon Water for Your Immune System! #shorts,3dU9W8itrjU,elias debebe,2025-01-01T02:00:03Z,https://www.youtube.com/watch?v=3dU9W8itrjU,Why You Need Lemon Water for Your Immune System! #shorts Discover the incredible benefits of lemon water for your immune ...,
"Start Your Day Right: The Power of Warm Lemon Water! HealthyMorning #LemonWater #WellnessTips""",PFaOkLszAi8,Thrive And Shine Health,2025-03-20T10:40:00Z,https://www.youtube.com/watch?v=PFaOkLszAi8,"Start your day with warm lemon water! It aids digestion, hydrates your body, and boosts your immune system. Simple, natural ...",
Lemon water #honey #lemonjuice #minivlog #telugu #trend,YrUpCyq7mYM,Shivani talks,2025-01-10T13:18:59Z,https://www.youtube.com/watch?v=YrUpCyq7mYM,,
Magical health benefits of lemon water|healthy diet|health guide|lemon water#naturalcare#skincare,D2EeRi8JGoY,Natural care,2025-02-10T07:01:44Z,https://www.youtube.com/watch?v=D2EeRi8JGoY,Magical health benefits of lemon water|healthy diet|health guide|lemon water#naturalcare#skincare Important role of vitamin ...,
✨What I drink in the morning✨ #lemonwater #shorts,XHFoVrPqx6A,SaraBearKing,2025-02-06T17:40:03Z,https://www.youtube.com/watch?v=XHFoVrPqx6A,https://linktr.ee/Sarabearking ✌️❤️ If you enjoyed today's video be sure to hit the Subscribe button and turn post notification on ...,
lemon water 💦 #lemonade #lemon #lemonwater #youtubeshorts  #ytshorts,_bSKiVsmBgU,SL foodie world,2025-03-31T06:03:54Z,https://www.youtube.com/watch?v=_bSKiVsmBgU,how to make lemon water.,
How to draw lemon water glass cup diagram in a simple way please subscribe #trending #ytshorts #draw,z8g8l-Hdqdw,Kanna drawing ,2025-02-03T10:41:51Z,https://www.youtube.com/watch?v=z8g8l-Hdqdw,,
The Magic of Drinking Lemon Water #lemonwater #healthylifestyle,e1jbqM7c3Fg,Body Balance,2025-01-08T09:00:46Z,https://www.youtube.com/watch?v=e1jbqM7c3Fg,"Drinking lemon water offers numerous health benefits, making it a simple yet powerful habit to add to your daily routine. Rich in ...",
Maximize Health Benefits: Smart Lemon Water Tips,r9ak0H0W7ps,"Vibrant, Healthy and Fit",2025-01-27T06:00:25Z,https://www.youtube.com/watch?v=r9ak0H0W7ps,"Discover how to enhance your health with lemon water by avoiding common mistakes. Learn to dilute, time your consumption, ...",
"""Break"" your ""Fast"" with Lemon Water",omtgvb1ORMo,TashxTalks,2025-02-01T14:15:03Z,https://www.youtube.com/watch?v=omtgvb1ORMo,"""Break"" your ""Fast"" with lemon Water ! Lemon water is a simple, refreshing drink with potential health benefits, especially when ...",
summer special drink lemon water.....,fIZIAQ2TbO4,Pavani Kalyan vlogs ,2025-03-20T05:55:52Z,https://www.youtube.com/watch?v=fIZIAQ2TbO4,,
Be careful with lemon water #dentist #dentistry #food #oralhygeine #hygeine #podcast,RHBMh8e0biA,The Physio Diaries Podcast,2025-02-14T17:40:21Z,https://www.youtube.com/watch?v=RHBMh8e0biA,,
"Boost hydration & immunity with zesty lemon water! 🍋💦 Simple, refreshing, and full of Vitamin C!",9HSk_wSyJmg,Divya Iyer,2025-03-04T02:51:53Z,https://www.youtube.com/watch?v=9HSk_wSyJmg,Zest Up Your Hydration! Bored of plain water? Let's add some zing! ✨ Just squeeze half a fresh lemon into your water ...,
Unlock the Power of Lemon Water for Health,eOkB_GXXYgk,"Vibrant, Healthy and Fit",2025-02-02T06:00:23Z,https://www.youtube.com/watch?v=eOkB_GXXYgk,"Discover the amazing antimicrobial benefits of lemon water! From supporting digestive health to boosting your immune system, ...",
Easy Experiment with lemon and Salt water|lemon water experiment for students|DIY #scienceexperiment,Jh2ag7u3tXQ,Supriya Rai,2025-02-22T12:37:56Z,https://www.youtube.com/watch?v=Jh2ag7u3tXQ,teachersofyoutube #teacher #teachersfollowteachers #teacherlife #teacherproblems #trending #memes #viral #share #youtubers ...,
Lemon Water - Is It Worth The Hype?,DoH7UhrkYzo,Science & Fun,2025-02-09T15:12:05Z,https://www.youtube.com/watch?v=DoH7UhrkYzo,,
Why You Should Start Your Day with Lemon Water 🍋,w5purIEDMlo,Preventive Wellness,2025-01-10T11:18:06Z,https://www.youtube.com/watch?v=w5purIEDMlo,Discover the amazing benefits of starting your day with a glass of lemon water! From boosting hydration to improving digestion ...,
Morning Boost Showdown: Yoga vs. Lemon Water – Which Energizes You Best?,17rsxrVkVSY,Daily Dose of Wellness,2025-02-01T18:54:24Z,https://www.youtube.com/watch?v=17rsxrVkVSY,Ever wake up feeling sluggish? We all have our morning rituals to shake off that sleepiness and get energized. What's your go-to?,
Benefits of Drinking Lemon Water,Rfww_hK81DU,Winwas shorts,2025-01-16T03:01:14Z,https://www.youtube.com/watch?v=Rfww_hK81DU,,
Lemon #water #shortsviral,Tb_--F1pWVE,Muhammad Amjad,2025-01-23T06:15:23Z,https://www.youtube.com/watch?v=Tb_--F1pWVE,,
Refresh & Detox  Easy Cucumber Lemon Water!,r4DOm2pIPek,Heal With Ayurveda,2025-02-01T08:40:24Z,https://www.youtube.com/watch?v=r4DOm2pIPek,"Refresh your body and mind with our ultimate detox water recipe featuring crisp cucumber, zesty lemon, and fragrant mint!",
#benefits Of #lemon & Cucumber Water! So Many Healthy Benefits 🍋🥒,a4BLseoeDE8,Robin Walker  @robinsnestradio,2025-02-07T14:07:36Z,https://www.youtube.com/watch?v=a4BLseoeDE8,lemonwater And Cucumbers Before You Go to Bed Can Assist You On Your Wellness Journey. #detoxdrink #weightloss ...,
Drink lemon water every morning on a empty stomach!,0H_-WaKwY9U,Chef Ricardo Cooking,2025-03-13T07:26:11Z,https://www.youtube.com/watch?v=0H_-WaKwY9U,Drink lemon water every morning on a empty stomach!Drink lemon ginger every morning on a empty stomach!,
Lemon water is alkaline good for health by Dr Usha Jain.#drushajain #health # healthytip#lemonwater,XqO1uH4jiGw,Dr. Usha Jain Anti-Aging and Urgent Care Center ,2025-03-19T23:17:42Z,https://www.youtube.com/watch?v=XqO1uH4jiGw,,
What Happens to Your Skin When You Drink Lemon Water? 🤔  お酒を辞めてレモン水を飲むと肌が蘇る🥹😳🍋✨️ #rejuvenateyourskin,AAXoJjFo89Q,Aimonヨガで世界をハッピーに,2025-03-24T01:15:41Z,https://www.youtube.com/watch?v=AAXoJjFo89Q,,
🍋 The Magic of Lemon Water! 💧✨ #lemonwater #healthydrinks,_NZo7sCCjrw,Premium Health Tips ,2025-03-28T22:00:27Z,https://www.youtube.com/watch?v=_NZo7sCCjrw,"Lemon water isn't just refreshing—it's packed with health benefits! Drinking lemon water boosts hydration, aids digestion, ...",
The Perfect lemon water?!?  #lemonperfect #stayhydrated #water #lemonwater #drinkfinds,DZeprhyyTVY,The Snack Network,2025-02-13T01:00:11Z,https://www.youtube.com/watch?v=DZeprhyyTVY,Our Snack Producers Robby Bobby Miller Thank you so much for watching The Snack Network! We taste new things almost ...,
How to make Lemon Water #recipe #lemonwaterbenefits,CjWX08GGINY,Mr. Knowsitallbrotherman,2025-02-27T18:07:32Z,https://www.youtube.com/watch?v=CjWX08GGINY,Simple way to have lemon infused water Just few lemons and water.,
#recipe of summer drink🍻🍷#new recipe of lemon water🍋 #viral shorts🎊💐,pdFrZco29ac,Niharika Batra🥳,2025-03-17T01:03:58Z,https://www.youtube.com/watch?v=pdFrZco29ac,,
What are the benefits of drinking lemon water?  10 Ways Your Body Benefits from Lemon Water,K5HhcFfAKWk,Nutrition Villa,2025-01-07T04:20:38Z,https://www.youtube.com/watch?v=K5HhcFfAKWk,Why you should drink a glass of lemon water in the morning? 10 Reasons Why You Should Drink Lemon Water.,
What I eat for Breakfast 24 detox water #minivlog #detox water #lemonwater#dailyvlog,3N_fBVhxe8w,ShivshaktiHub1313🧿,2025-02-05T03:41:23Z,https://www.youtube.com/watch?v=3N_fBVhxe8w,,
Lemon Water benefits #drink #healthytips,rVg0IrXVfnw,Health Wellnest ,2025-03-07T15:55:34Z,https://www.youtube.com/watch?v=rVg0IrXVfnw,,
"7 Benifits of having lemon Water Daily #""The Power of Lemon Water: Boosting Health and Vitality.""",Swy7HPkkPDg,Dr.Dharmesh padvi,2025-03-03T13:30:17Z,https://www.youtube.com/watch?v=Swy7HPkkPDg,"dr. dharmesh Padvi # Orthopaedic Surgeon #Udit Hospital Vansda #shorts​ Welcome to our channel! In today's video, we're ...",
Chia-ginger-lemon water #shorts,VBItXAesmQ0,Auma fit,2025-03-08T23:21:34Z,https://www.youtube.com/watch?v=VBItXAesmQ0,,
Is Lemon Water in the Morning Really That Healthy? The Truth!,nhP_osPZVKk,Houston Primary MD,2025-02-26T17:01:03Z,https://www.youtube.com/watch?v=nhP_osPZVKk,"Is lemon water really the ultimate health drink? While it won't detox your body, it can boost hydration, support digestion, and ...",
lemon water. #lemonwater #lemonwaterbenefits #healthadvice #viralvideo,Uo166zoeZqs,Health tips ,2025-03-18T07:01:52Z,https://www.youtube.com/watch?v=Uo166zoeZqs,,
Start Your Day with Lemon Water Why? #lemonbenefits  #shorts #MorningRoutine,CqwW9FWwyM4,Goodness in Every Bite,2025-01-29T16:21:07Z,https://www.youtube.com/watch?v=CqwW9FWwyM4,"Start your day the right way with lemon water! In this short video, discover 5 major benefits of drinking lemon water every ...",
Lemon water Benefits #shorts #lemon water #lemonchiaseedswater #detoxwater,uMbBZHNuiJ4,Preet's Nutri-Life Kitchen ,2025-01-28T02:13:47Z,https://www.youtube.com/watch?v=uMbBZHNuiJ4,,
Maximize Health Benefits: Smart Lemon Water Tips,xC-wWi5Vw88,"Vibrant, Healthy and Fit",2025-01-26T06:00:25Z,https://www.youtube.com/watch?v=xC-wWi5Vw88,"Discover how to enhance your health with lemon water by avoiding common mistakes. Learn to dilute, time your consumption, ...",
Lemon water and my blood sugar!,sBwHwxCBoDo,Healthy Side,2025-02-17T10:00:05Z,https://www.youtube.com/watch?v=sBwHwxCBoDo,Lemon water and my blood sugar! I LOST 15KG IN JUST 4 WEEKS WITH THIS STRONGEST FAT BURNER DRINK! Want to know ...,
let's make lemon water 🍋#shorts,RKP7OAbAxdM,Shumaila's world,2025-02-18T16:51:55Z,https://www.youtube.com/watch?v=RKP7OAbAxdM,,
Lemon water benefits 🍋what are the benefits of drinking it#lemon,SQN-4WJeLHQ,Informed Tech,2025-01-31T08:41:25Z,https://www.youtube.com/watch?v=SQN-4WJeLHQ,"Asslam-o-Alaikum..!   Welcome My Youtube Channel.     My Content is basically of Urdu Health tips, Health Golden words ...",
T8 Koan - Lemon Water ft. Mick Jenkins (Official Audio),eQsFi6sch3E,T8 Koan,2025-03-14T15:59:25Z,https://www.youtube.com/watch?v=eQsFi6sch3E,Follow me on Instagram @t8.koan Produced by Que Mixed and mastered by Liam Dember @elevateminds ALL RIGHTS ...,
The best fat cutter drink honey lemon water#viralvideo #weightloss #juice #detox #benifits #fatloss,s7WOOanZfsc,SMS Healthy lifestyle ,2025-02-10T07:02:46Z,https://www.youtube.com/watch?v=s7WOOanZfsc,the best fat burning workout the best fat burner the best fat loss workout lemon water health benefits of lemon water weight loss ...,
If You Drink Lemon Water Daily What Happens To Your Body,gaUHwJx1tMI,HealthHub,2025-02-14T14:51:37Z,https://www.youtube.com/watch?v=gaUHwJx1tMI,,
