Title,Video ID,Channel,Published At,URL,Description,Video Length
Drink your lemon water!! 🍋 #shorts #useful #beauty #healthylifestyle #healthyfood #healthy,JN4aFB7dps8,Hybee | 하이비,2025-01-04T23:03:08Z,https://www.youtube.com/watch?v=JN4aFB7dps8,,
Best early morning detox water #shorts,y-rO9QRkkaM,Indian ASMR Gallery,2025-02-09T12:30:53Z,https://www.youtube.com/watch?v=y-rO9QRkkaM,"Detox Water Recipe: Cucumber, Lemon, Pudina Leaf, and Ginger (Overnight Soak) Glass Jar I have used ...",
Start Your Day Right with Lemon Water #shorts #lemon #gunjanshouts,gTNhCf9_izs,Sunita Purkait (SP),2025-02-07T17:20:52Z,https://www.youtube.com/watch?v=gTNhCf9_izs,"Start Your Day Right with Lemon Water #shorts #lemon #gunjanshouts #recipe Lemon water can improve digestion, boost ...",
Benefits of lemon water by  health coach gunjan taneja #shorts #lemondrink  #gunjanshouts,abtKm0t0jo4,Sneha’s korner,2025-01-05T07:09:08Z,https://www.youtube.com/watch?v=abtKm0t0jo4,Benefits of lemon water |by health coach gunjan taneja #shorts #celebrecipe #lemon #lemonwaterbenefits #bollywood #celebrity ...,
Chia seeds water with lemon | #weightloss #glowingskin #lossbellyfat #immunitybooster #drink #shorts,ia67lT5eAIk,Sinchana,2025-02-10T17:04:08Z,https://www.youtube.com/watch?v=ia67lT5eAIk,"Please like, share & subscribe for more content! Chia seeds with lemon as a refreshing beverage. It's packed with nutrients like ...",
Drink this every morning goodmorning #healthylifestyle #lemonwater #cayennepepper #wellnessjourney,2PnHPJgIZ2c,Good Living Now with Harold,2025-03-11T13:35:50Z,https://www.youtube.com/watch?v=2PnHPJgIZ2c,,
c vitamin rich food#lemon water uses#please subscribe,_HxyTZTDdNc,SS motivational thoughts,2025-03-05T03:12:50Z,https://www.youtube.com/watch?v=_HxyTZTDdNc,,
What Would Happen If You Drink Lemon Water for 14 Days?,De4sHeeJ6W0,Dr. Berg Shorts,2025-01-25T13:00:21Z,https://www.youtube.com/watch?v=De4sHeeJ6W0,"What would happen if you drink a glass of water every morning for 14 days? In this video, we explore the incredible benefits of ...",
Easy and simple nimbu sharbat #asmr #shorts #food #recipe #nimbu #drink #fruit #summer #lemonade,ME8UvEhF3kU,Drink's with little girl,2025-03-10T07:58:00Z,https://www.youtube.com/watch?v=ME8UvEhF3kU,Easy and simple nimbu sharbat #asmr #shorts #food #recipe #nimbu #drink #fruit #summer #lemonade.,
*SIMPLE* DETOX water at HOME✨🏠 #youtube #yt #ashortaday #ytshortsindia #detox #selfcare #viralvideo,UIKYVdx-3Jw,Akancha Sharma,2025-01-17T12:24:00Z,https://www.youtube.com/watch?v=UIKYVdx-3Jw,"Detox Like a Pro with This Cucumber, Amla, and Lemon Water Recipe! Hey, hydration queens and health champs!",
"Rose Water, Glycerin और Lemon Juice दिलाएगा झाईओं से छुटकारा! Subhash Goyal 📞90560 90561",csICROZ_yzE,Dharm Gyan,2025-03-10T13:17:20Z,https://www.youtube.com/watch?v=csICROZ_yzE,"""Subhash Goyal is the founder of Vardhan Ayurvedic & Herbal Medicines is one of the Best Ayurveda in Chandigarh, India for ...",
Avoid lemon water on empty stomach #health #fitness #telugu #shorts,GygWxAm_iCY,R_WIN,2025-01-27T11:30:15Z,https://www.youtube.com/watch?v=GygWxAm_iCY,Did you know that drinking lemon water on an empty stomach right after you wake up might not be the best idea? Watch this video ...,
Hot Lemon Water  Drink of Alia Bhatt | Detox Morning Drink,9UKnyfXIPPw,Nutribite Recipes ,2025-02-16T06:26:19Z,https://www.youtube.com/watch?v=9UKnyfXIPPw,Alia Bhatt swears by drinking warm lemon water every morning! But why is this simple drink so powerful? Lemon water in the ...,
Restaurant style Fresh lime recipe | Fresh lime recipe,zcTXqk71SDY,CookTube Official,2025-01-29T12:25:02Z,https://www.youtube.com/watch?v=zcTXqk71SDY,Restaurant style Fresh lime recipe | Fresh lime recipe *Restaurant-Style Fresh Lime Recipe | Refreshing & Tangy!* In this video ...,
Lemon 🍋 Juice #shorts,XoeZZqjyM9Q,Village Mom Recipes ,2025-03-09T12:30:22Z,https://www.youtube.com/watch?v=XoeZZqjyM9Q,,
What Happens If You Drink Lemon Water for 2 Weeks?!,D_d54aFY8w4,Dr. Eric Berg DC,2025-03-07T10:00:23Z,https://www.youtube.com/watch?v=D_d54aFY8w4,What if a simple glass of lemon water every morning could transform your health? Drinking lemon water daily for 14 days can lead ...,
The REAL Reason to Drink Lemon Water,D5zx9lt67oU,Dr. Berg Shorts,2025-02-28T11:30:08Z,https://www.youtube.com/watch?v=D5zx9lt67oU,Have you ever wondered what would happen if you drank lemon water every day for 14 days? This simple habit can have a ...,
Experiment with lemon and saltwater #trending#shorts#experiment#lemon#water#viralvideo,6hzMDDxInuI, Sindhusree's world,2025-02-18T13:57:27Z,https://www.youtube.com/watch?v=6hzMDDxInuI,,
Glycerine lemon and rose water glowing skin#youtubeshorts #viralvideos We Beauty Style,Mhf7e-zMCoU,WE BEAUTY STYLE,2025-01-28T16:22:53Z,https://www.youtube.com/watch?v=Mhf7e-zMCoU,,
Loaded Lemon Water 🍋 #water #asmr #restock #lemon #yellow #thatgirl #viral #fyp #shorts #drinks,yBcHXOD_v2U,mikayla mcneany,2025-03-27T17:25:46Z,https://www.youtube.com/watch?v=yBcHXOD_v2U,,
Loaded Lemon Water Restock 🍋🌊 #asmr #restock #water #lemon #yellow #aesthetic #viral #shorts #fyp,VRjAuAbUJzM,mikayla mcneany,2025-03-22T21:01:14Z,https://www.youtube.com/watch?v=VRjAuAbUJzM,,
प्रेगनेंसी में नींबू पानी पीना चाहिए या नहीं lemon juice in pregnancy in hindi #shorts #Drgourirai,Yn1ax3r1amk,Dr Gouri Rai,2025-03-04T12:30:35Z,https://www.youtube.com/watch?v=Yn1ax3r1amk,प्रेगनेंसी में नींबू पानी पीना चाहिए या नहीं lemon juice in pregnancy in hindi #shorts ...,
Ultimate DETOX Drink! Cucumber Chia Mint Lemon Water 🌿💧,pg6I6RFVfuQ,Dr. Food Lab,2025-03-26T16:09:45Z,https://www.youtube.com/watch?v=pg6I6RFVfuQ,"Cucumber Chia Mint Lemon Detox Water – The Ultimate Hydration & Detox Drink! ✨ Looking for a refreshing, healthy detox ...",
Lemon Water Has AMAZING Benefits!,Vdu7U_gjOk0,Dr. Berg Shorts,2025-03-18T12:00:47Z,https://www.youtube.com/watch?v=Vdu7U_gjOk0,What if a simple glass of lemon water every morning could transform your health? Drinking lemon water daily for 14 days can lead ...,
Lemon water paint #music #cute #fypviral #art #drawing #painting #lemon #rek #fyp #fyp #youtube,UGsE6qCW01k,Image Feature,2025-03-16T13:57:12Z,https://www.youtube.com/watch?v=UGsE6qCW01k,,
नींबू🍋पानी पीने का फायदा  !! Morning Lemon Water Benefit #shorts #shortvideo #fitness,fyBwpzGw558,JK KITCHEN HOME ,2025-03-10T05:00:23Z,https://www.youtube.com/watch?v=fyBwpzGw558,नींबू  पानी पीने का फायदा !! Morning Lemon Water Benefit !! JK Kitchen Home #shorts #shortvideo #fitness.,
A Warning About Drinking Lemon Water Every Single Day,MsXKxlRiDYI,Dr. Ellie Phillips,2025-03-18T16:30:05Z,https://www.youtube.com/watch?v=MsXKxlRiDYI,The problem with drinking lemon water every day. Zellie's Xylitol: ...,
Fast Weight Loss With Chia Seeds Lemon Mint Water / iftar Drinks Ramadan Diet Plan /Fat Cutter Drink,RzooY8gcWuY,Rahilas Cookhouse,2025-03-12T08:00:06Z,https://www.youtube.com/watch?v=RzooY8gcWuY,Drink this water regularly and lose weight faster!! How to lose weight fast - lose 5 kg in a month with this powerful morning routine ...,
Lazy Girl  Lemon Water Prep,YOoqIy3MQjY,Betterfasting ,2025-01-17T17:00:49Z,https://www.youtube.com/watch?v=YOoqIy3MQjY,,
#youtubeshorts #trendingshorts #viralvideo #gymshorts #almonds #apple #dates #milk #lemon #water,Ltr0JBv3w9c,Ayaan Malik shorts,2025-01-04T07:47:06Z,https://www.youtube.com/watch?v=Ltr0JBv3w9c,,
Lemon Water Protects Your Liver!! #liverhealth #lemonwaterbenefits #nutritiontips #lemonwater,ieyGPg1y3DU,Dr. Nick Zyrowski,2025-01-08T15:01:02Z,https://www.youtube.com/watch?v=ieyGPg1y3DU,Do you drink lemon water? (Follow @dr.nickzyrowski for daily health tips),
This Is Why Lemon Water Should Be Your Morning Drink,E3gsYs7BhFM,Living Springs Retreat,2025-01-11T16:45:00Z,https://www.youtube.com/watch?v=E3gsYs7BhFM,"Lauren shares the power of gratitude and lemon water in promoting health, energy, and better digestion. Start your day with this ...",
Lemon water benefits you didn’t know🍋,CfWMZipqgJk,Autumn Bates,2025-03-07T18:43:01Z,https://www.youtube.com/watch?v=CfWMZipqgJk,,
क्या नींबू पानी रोज पीना चाहिए  - Lemon Water Benefits! #Prernasdietclinic #diet,qcbF-hnyRBE,Prerna's Diet Clinic,2025-03-03T07:06:23Z,https://www.youtube.com/watch?v=qcbF-hnyRBE,"Kya Roz Nimbu Pani Peena Chahiye? Bahut log weight loss aur detox ke liye roz lemon water peete hain, par kya ye safe hai?",
lemon water  VS highlighter water 😳 epti kaanama poguthu #shorts #trending #experiment,T8B89yKGPjo,Nazeer's MindVoice,2025-01-27T00:55:00Z,https://www.youtube.com/watch?v=T8B89yKGPjo,Lemon experiment Shorts Trending Experiment.,
Lemon Water For Weight Loss,33opZgzARe8,Marham Find A Doctor,2025-01-07T13:00:10Z,https://www.youtube.com/watch?v=33opZgzARe8,Lemon Water For Weight Loss | Nimbo Pani Se Wazan Kam Karne Ka Tarika Lemon water is a popular beverage for weight loss ...,
The Digestive Power of Lemon Water You Need to Know,X1Enk8imMMw,Living Springs Retreat,2025-01-12T16:45:01Z,https://www.youtube.com/watch?v=X1Enk8imMMw,"Lemon water is the ultimate drink for digestive health. It relieves symptoms of indigestion, aids in waste elimination, and even ...",
How Lemon Water and a Simple Recipe Can Transform Your Skin,ShbGGALic88,Living Springs Retreat,2025-01-17T16:45:01Z,https://www.youtube.com/watch?v=ShbGGALic88,Drinking lemon water before breakfast can improve your skin and overall health. Learn why timing matters and discover a simple ...,
Does Lemon Water Really Help in Weight Loss? The Truth Revealed #Lemon #water #HealthTips #summer,s9frauGyv5o,Sri's Family,2025-03-02T09:05:00Z,https://www.youtube.com/watch?v=s9frauGyv5o,Does Lemon Water Really Help in Weight Loss? The Truth Revealed #Lemon #water #HealthTips #summer #health #healthy ...,
The Alkaline Power of Lemon Water You Need to Know,3XrwLrNoMDk,Living Springs Retreat,2025-01-15T16:45:00Z,https://www.youtube.com/watch?v=3XrwLrNoMDk,"Many people think lemons are too acidic, but did you know they have an alkaline effect on the body after digestion? Lemon water ...",
Struggling with constipation?💩#constipation#digestion#indigestion#stomachache#lemonwater,kOue9J0hKJo,The Yogic Cure,2025-03-03T09:55:53Z,https://www.youtube.com/watch?v=kOue9J0hKJo,A simple yet powerful morning ritual to support digestion and hydration is to sit in Malasana while sipping on warm lemon water.,
Lose Weight FAST with Lemon Water in Just 30 Days,D5Ch2Y7n8to,Food Vs Health Hindi TV,2025-02-13T10:00:12Z,https://www.youtube.com/watch?v=D5Ch2Y7n8to,Learn how to lose weight fast with lemon water ! Looking to lose weight fast? Try drinking lemon water for 30 days! In this video ...,
Cool Minty lemon water🍹🧊#shorts #ytshorts #summervibes #summerdrink,BS4g_I302fw,TASTY PRAVAS ,2025-03-31T01:30:01Z,https://www.youtube.com/watch?v=BS4g_I302fw,Minty lemon water recipe | mint lemon water | lemon water | #lemonwater #lemonade #lemondrink #drinksforsummer #drink ...,
I also start everyday with warm lemon water w apple cider vinegar & aloe Vera shots!,gfKIHxssrFo,Madysen Tyler Freeman,2025-03-26T17:41:34Z,https://www.youtube.com/watch?v=gfKIHxssrFo,,
Detox Water Myth Busted! | Lemon Water | Healthcare Tips | Truth About Body Detox  #detoxwater,LL6kqySuQWQ,Doctor Neetu Narula ,2025-02-25T11:50:23Z,https://www.youtube.com/watch?v=LL6kqySuQWQ,Detox Water Myth Busted! | Lemon Water | Healthcare Tips | Truth About Body Detox Detox Water Myth ...,
The Science Behind Lemon Water Health Benefits,0vq_qTBk3CY,Path to Well-being,2025-01-05T02:37:40Z,https://www.youtube.com/watch?v=0vq_qTBk3CY,Discover the incredible health benefits of incorporating lemon water into your daily routine! From boosting your immune system to ...,
The Powerful Antioxidant Benefits of Lemon Water You Need to Know,aZvSSCGgxX8,Living Springs Retreat,2025-01-13T16:45:01Z,https://www.youtube.com/watch?v=aZvSSCGgxX8,"Lemon water is more than just a drink; it's a powerful tool for cleansing the body, supporting liver health, and eliminating toxins ...",
Lemon Water क्यों पीना चाहिए? | ABP LIVE | SHORTS,DSPnK-dn4wg,ABPLIVE,2025-02-02T15:30:04Z,https://www.youtube.com/watch?v=DSPnK-dn4wg,abplive #lemonwater #lemonwaterbenefits #lemon #water #hydration #shwetasharma नींबू पानी... बहुत लोगों ...,
🥤 Lemon Water Benefits 👍 #shorts #morning,KLLJ32mn7PE,Sahana's🐰Bunny Healthy Tummy,2025-01-06T08:55:27Z,https://www.youtube.com/watch?v=KLLJ32mn7PE,healthy #lemon.,
LEMON WATER for 14 days #shorts,nPuzUU9ZI28,Abubakar.fitness,2025-01-25T07:00:33Z,https://www.youtube.com/watch?v=nPuzUU9ZI28,,
Sigma Physics.#sigma #physics #lemon #water #saltwater #sigmaphysics #experiment #youtubeshort #funk,o1Edo_XT8dw,JBOX,2025-01-11T09:34:08Z,https://www.youtube.com/watch?v=o1Edo_XT8dw,,
how to make lemon water#shorts #ytahorts #kavithapapireddy,oRC0Vx6qtsk,Kavita Papireddy,2025-03-23T07:04:01Z,https://www.youtube.com/watch?v=oRC0Vx6qtsk,,
Healthy and delicious lemon water 🤤😍😋#shorts #youtubeshorts #fruit #trending #lemon#lemonwater,B86kXy2Nsng,Fruits Food,2025-02-17T13:03:20Z,https://www.youtube.com/watch?v=B86kXy2Nsng,Healthy and delicious lemon water #shorts #youtubeshorts #fruit #trending #lemon#lemonwater.,
Lemon water today for my mushies 🍋🍄🚀,iNcF0xWhiKU,Shally Way,2025-01-25T01:30:35Z,https://www.youtube.com/watch?v=iNcF0xWhiKU,,
Drink lemon water in the morning before coffee 🍋 💧,ZO4eGXxcOs0,Health Will By Janice,2025-01-26T19:42:54Z,https://www.youtube.com/watch?v=ZO4eGXxcOs0,,
Nimbu pani lemon water😍made in india #jkchhachhar #fun #youtubeshorts,bCvZvg7YXT4,JKChhachhar,2025-02-05T05:33:16Z,https://www.youtube.com/watch?v=bCvZvg7YXT4,Nimbu pani lemon water  made in india #shortvideo #youtubeviralshorts.,
Benefits of Drinking Warm Lemon Water Every Morning,5EaMGtMSpWk,Health Guide,2025-02-11T16:16:43Z,https://www.youtube.com/watch?v=5EaMGtMSpWk,"Discover the amazing health benefits of drinking warm lemon water every morning! In this video, we explore 10 incredible ...",
lemon water weight lose 💪#benifits of lemon water #whatsappstatus #shorts,cEAbJNgeAXo,Shivansi_29,2025-01-09T02:39:22Z,https://www.youtube.com/watch?v=cEAbJNgeAXo,,
Lemon water burns fat and helps you lose weight! Truth or Trash Episode 163 #biology,fSjeJsPFNYs,Interactive Biology,2025-03-02T14:00:41Z,https://www.youtube.com/watch?v=fSjeJsPFNYs,Lemon water burns fat and helps you lose weight! But is that true? Find out in this week's episode of Truth or Trash. Bet you didn't ...,
summer effect cool cool lemon water with sabja seeds #viralvideo #wow #chillwater #antioxidantwater,ar82aEY9jYU,BRK Creations ,2025-03-20T10:39:02Z,https://www.youtube.com/watch?v=ar82aEY9jYU,summer effect cool cool lemon water with sabja seeds #viralvideo #wow #chillwater #antioxidantwater.,
Lemon Water Benefits You Didn’t Know! 🍋 | Weight Loss & Health Secrets #facts #shorts,ybGymgB81ic,healthyacharya,2025-02-17T15:30:24Z,https://www.youtube.com/watch?v=ybGymgB81ic,"Lemon Water,Health Benefits, Lemon Detox,Fat Loss, Morning Drink,Healthy Skin, Detox Drink,Lemon for Health, Weight Loss ...",
What are the benefits of drinking Lemon Water in Pregnancy?#lemonwater #lemonwaterbenefits #shorts,IdfUJR1SiDM,Dr. Raisha,2025-02-20T16:00:25Z,https://www.youtube.com/watch?v=IdfUJR1SiDM,,
#science #maths #experiment #lemon #water,pldZnTkiG6M,A1 Achievers,2025-03-12T06:15:06Z,https://www.youtube.com/watch?v=pldZnTkiG6M,,
🍋🍋‍🟩✨ #detoxdrink #lemonwater #healthylifestyle #healthyliving #lime #lemon #water,LKyHJ4i02Sc,Naturally Sage,2025-01-11T07:08:21Z,https://www.youtube.com/watch?v=LKyHJ4i02Sc,,
Coconut Lemon Water #shorts #youtubeshorts,p6VjbF90xdY,Nimisha's Food Channel,2025-03-30T14:08:30Z,https://www.youtube.com/watch?v=p6VjbF90xdY,Coconut Lemon Water #shorts #youtubeshorts #coconut #coconutwater #lemon #lemonjuice #trending #trendingshorts ...,
Drink Warm Lemon Water Every Morning & See What Happens! #shorts #memes,NLltXDNCKwA,Eye Plus Media,2025-03-10T03:23:48Z,https://www.youtube.com/watch?v=NLltXDNCKwA,"Starting your day with warm lemon water is a simple habit with BIG benefits! It helps with digestion, hydration, skin glow, and ...",
"Drink Lemon Water Daily & See the Magic! 🍋✨""",5ZZ80yTWzQ0,Herbal Fitness Whole Foods Weight Loss and Health,2025-03-02T01:35:29Z,https://www.youtube.com/watch?v=5ZZ80yTWzQ0,"Start your day with a glass of lemon water and watch your body transform! From glowing skin to better digestion, the benefits are ...",
Honey Lemon Water के 5 जबरदस्त फायदे जो बदलें आपकी सेहत | Health Tips | Health Live,xZ8p5l6voug,Health LIVE,2025-01-12T09:00:57Z,https://www.youtube.com/watch?v=xZ8p5l6voug,"Start your day right with a powerful combination of honey and lemon water! In this video, we explore the top 5 health benefits of ...",
Lemon Water Hack: Easy Refreshment with Benefits!,AeJl-9pZmYo,Water Filter Guru,2025-03-13T19:00:52Z,https://www.youtube.com/watch?v=AeJl-9pZmYo,"Want to jazz up your daily water routine? Just squeeze some fresh lemon juice into your water! It's a simple, budget-friendly way to ...",
Lemon Water | हिंदी जानकारी | Lemon Water Benefits | Hindi Healthy Food Fact🥑🥝 #healthyfood #lemon,PqFiaqrPrYk,MR Aj Bhai India Fitness,2025-02-11T12:58:12Z,https://www.youtube.com/watch?v=PqFiaqrPrYk,Lemon Water | हिंदी जानकारी | Lemon Water Benefits | Hindi Healthy Food Fact     #healthyfood #lemon Lemon ...,
Drink Lemon Water Every Day & THIS Will Happen! 🍋💧,Hiirkypg3JE,Dr. Mitch Rice,2025-03-24T19:30:32Z,https://www.youtube.com/watch?v=Hiirkypg3JE,Drink Lemon Water Every Day & THIS Will Happen! Could a simple glass of lemon water every day transform your health?,
Infused lemon water #viralvideos #satisfying #reelsvideo #asmrvideo #asmrsounds #lemon #infusedwater,-CI00TfU9To,Aeri dan Queen,2025-03-12T04:34:38Z,https://www.youtube.com/watch?v=-CI00TfU9To,,
Let’s make Chia lemon water🍋 #youtubeshorts #trending,i53AE1QzhkQ,Niyati Pandeyyy,2025-03-23T12:37:45Z,https://www.youtube.com/watch?v=i53AE1QzhkQ,,
What Happens When You Drink Warm Lemon Water Every Day for 2 Weeks?,mDAXiWtvC3U,Herbal Fitness Whole Foods Weight Loss and Health,2025-01-10T01:00:28Z,https://www.youtube.com/watch?v=mDAXiWtvC3U,Day 1: Feeling sluggish? Start your mornings with warm lemon water and notice the difference in how you feel throughout the day.,
5 Body Benefits of Drinking Warm Lemon Water Every Morning,kmzSDjbdd5M,Daily Health,2025-01-23T05:18:20Z,https://www.youtube.com/watch?v=kmzSDjbdd5M,5 Body Benefits of Drinking Warm Lemon Water Every Morning Discover the amazing benefits of starting your day with warm ...,
Drinking Lemon Water Everyday for Weight Loss,YQJo-s3YLWw,BellyProof Body Transformation,2025-02-13T14:30:14Z,https://www.youtube.com/watch?v=YQJo-s3YLWw,"Avoid Drinking Lemon Water Everyday for Weight Loss, contrary to the popular trend! Start Your 5 Week Challenge at ...",
Ramadan special || lemon 🍋 water || #minivlogs #lemon #water #lemonwater,Vw7ZAMcpYQM,Amaira Universe 45,2025-03-03T22:44:13Z,https://www.youtube.com/watch?v=Vw7ZAMcpYQM,,
The Lemon Water Situation🍋 What Does the Science Say? #wellness #lemon,M7O3yfhdDbA,VivaRae_CO,2025-03-07T09:38:11Z,https://www.youtube.com/watch?v=M7O3yfhdDbA,"Lemon water is a wellness trend—but does science back it up? In this video, I break down the real benefits and myths of ...",
Unlock the Power of Lemon Water Every Morning!,_j0cj5KOtlY,Natural Vitality Facts,2025-02-21T04:54:12Z,https://www.youtube.com/watch?v=_j0cj5KOtlY,Are you tired of that coffee crash first thing in the morning? Try drinking warm lemon water instead! Lemon water helps alkalize ...,
रोजाना नींबू पानी पीने के फायदे Benefits of drinking lemon water daily #health #healthydrink #immune,lJxDLyBIjoE,Be Unique,2025-03-17T13:42:16Z,https://www.youtube.com/watch?v=lJxDLyBIjoE,रोजाना नींबू पानी पीने के फायदे Benefits of drinking lemon water daily #health #healthydrink ...,
what happens when you drink lemon water every morning,40cezusKOyE,mobycor,2025-01-05T19:00:01Z,https://www.youtube.com/watch?v=40cezusKOyE,What Happens When You Drink Lemon Water Every Morning? Have you ever wondered what drinking lemon water every ...,
lemon water for glowing healthy body #skincare #healthtips,KH8Pj2FtYDQ,Beauty with Monikaa,2025-03-13T15:28:29Z,https://www.youtube.com/watch?v=KH8Pj2FtYDQ,lemon water for glowing healthy body #skincare #healthtips #detox #detoxwater How to Make Alkaline Water at home #shorts ...,
What Happens When You Drink Lemon Water for 14 Days - Save your health #health #healthy  #funny,TRbiYAu2_jM,OUR HEALTH,2025-01-12T15:00:36Z,https://www.youtube.com/watch?v=TRbiYAu2_jM,"Join us as we explore the world of health and wellness. Discover tips, tricks, and expert advice on nutrition, fitness, mental health, ...",
The truth about lemon water 🍋,8nPKfRasD_0,Dhara Vadhan,2025-03-12T11:56:04Z,https://www.youtube.com/watch?v=8nPKfRasD_0,,
Vegetable Smoothie #shorts #smoothie #lemon #water  #Vegetables #beet,oHmIhD0RGks,Coffee and Cocktail,2025-01-26T03:10:26Z,https://www.youtube.com/watch?v=oHmIhD0RGks,,
Lemon water | Fresh lemonade #lemonwaterbenefits #lemonade #limka #shortsvideos#asmrvideo #asmrsound,2kdwmimopG4,Michelle-z,2025-02-11T14:28:39Z,https://www.youtube.com/watch?v=2kdwmimopG4,,
Starting the day with a glass of lemon water is a game changer!,_4uM02jIwG0,Sudhir Kumar Ayurved Coach,2025-03-08T15:11:56Z,https://www.youtube.com/watch?v=_4uM02jIwG0,"It aids digestion, boosts immunity, and gives a natural glow to the skin. Have you tried this morning ritual yet? Share your thoughts ...",
potassium permanganate(KMnO4) with lemon water||science tribune #shorts #science #experiment,WE5TfaDYkus,Science Tribune,2025-03-28T12:50:05Z,https://www.youtube.com/watch?v=WE5TfaDYkus,potassium permanganate(KMnO4) with lemon water||science tribune #shorts #science #experiment # Sugar vs Potassium ...,
Benefits of lemon water every morning #LemonWater #MorningRoutine #DetoxDrink #HealthyLiving,PHUwGTYT9KQ,Reverse Clinics - by Dr. Manu Bora,2025-03-01T11:55:13Z,https://www.youtube.com/watch?v=PHUwGTYT9KQ,,
#shotrs #lemon #water #honey #viralvideos #ytshorts #trending #yt #healthtips #healthcare #drink,5VB1t6FczuY,Papiya Home Kitchen ,2025-01-03T04:23:11Z,https://www.youtube.com/watch?v=5VB1t6FczuY,shotrs #lemon #water #honey #viralvideos #ytshorts #trending #yt #healthtips #healthcare #drink.,
#youtubeshorts #trendingshorts #motivation #gymtime #apple #badam #lemon #water,I9Svi5SoYS0,Ayaan Malik shorts,2025-01-15T12:36:54Z,https://www.youtube.com/watch?v=I9Svi5SoYS0,,
lemon water with apple and grapes #lemon #lemonwater #grape #love #loveit #water,Ce1-rMR0PSc,Yusuf Aytac,2025-03-30T18:31:54Z,https://www.youtube.com/watch?v=Ce1-rMR0PSc,,
Lemon water for weight loss? #food #foodscience #foodforhealth,4Wnslw5jnwc,Rajat Malik,2025-01-15T11:30:18Z,https://www.youtube.com/watch?v=4Wnslw5jnwc,,
benefits of drinking lemon 🍋 water 💦 || nimbu 🍋 pani 🌊 peene ke fayde #facts #shorts,9xu__-n5AZ0,The amazing 🧬,2025-01-20T09:13:21Z,https://www.youtube.com/watch?v=9xu__-n5AZ0,benefits of drinking lemon water || nimbu pani peene ke fayde #facts #shorts Discover the amazing benefits of drinking ...,
Fish#corry#lemon#water#oh#testy#  short#video😘😘🤪🤪🤪,18nm5wzsEoI,SUVAS-FAST-EATER,2025-02-21T14:48:34Z,https://www.youtube.com/watch?v=18nm5wzsEoI,,
Top 3 Incredible Benefits of Drinking Turmeric and Lemon Water Daily #healthtips #shorts,0LFRVNBXbCc,Health Uplift,2025-01-09T11:03:00Z,https://www.youtube.com/watch?v=0LFRVNBXbCc,Start your day with the powerful combination of turmeric and lemon water! This simple yet effective drink has been celebrated for ...,
What Happens If You Drink Lemon Water Straight For 14 Days,fgOcshU92JY,5.Million,2025-01-16T08:00:28Z,https://www.youtube.com/watch?v=fgOcshU92JY,What Happens If You Drink Lemon Water Straight For 14 Days Transform Your Health in 14 Days! Discover the incredible ...,
Lemon Water Health Benefits You Need to Know! #nutrition,UcFsgwibVgI,LiveWell HealthOasis,2025-02-08T09:34:22Z,https://www.youtube.com/watch?v=UcFsgwibVgI,"Lemon Water: The SECRET Weapon for a Healthier YOU! This simple drink BOOSTS IMMUNITY, IMPROVES DIGESTION, ...",
lemon water with salt 🍋#youtube #shorts,mnDBFJjKR4s,நளினி சமையல்,2025-01-13T15:31:33Z,https://www.youtube.com/watch?v=mnDBFJjKR4s,,
A Lemon 🍋 in a Day #shorts #lemon #water,dODEQHh5SeI,Ahdia,2025-02-08T06:00:21Z,https://www.youtube.com/watch?v=dODEQHh5SeI,,
LEMON WATER CHALLENGE: Can 2 Weeks Change Your Life? #drinks #recipe,l6KbaCULMEw,Chef Ricardo Cooking,2025-01-30T10:05:10Z,https://www.youtube.com/watch?v=l6KbaCULMEw,"LEMON WATER CHALLENGE: Can 2 Weeks Change Your Life?Want to know the secret to glowing skin, boosted energy, and a ...",
#lemon #water #trending #food #yummy #fyp #h20 #bored #play,uzFWLyMhXEg,Crissyann85,2025-01-19T10:24:00Z,https://www.youtube.com/watch?v=uzFWLyMhXEg,,
Lemon water look up the benefits,tdzUK29QQmc,C and T Marble and Ceramics,2025-03-18T13:55:00Z,https://www.youtube.com/watch?v=tdzUK29QQmc,I have been a professional tiler in Australia for 35 years and love what I do. I have tiled everything from train stations to ...,
