Title,Video ID,Channel,Published At,URL,Description,Video Length
5 NIGHT TIME Hacks to SLEEP Better #nightroutine #coldshower #hygiene #ashortaday #ytshorts,Z7Zmwy6vL0E,ANKIT TV,2025-03-31T06:30:11Z,https://www.youtube.com/watch?v=Z7Zmwy6vL0E,,
Why Caffeine Makes Some People Sleepy,NdelIhMBIh4,Doctor Sood,2025-03-22T12:30:33Z,https://www.youtube.com/watch?v=NdelIhMBIh4,Does this happen to you? VC: @haleyybaylee #caffeine #sleep #energydrinks #medicaltips #health.,
🔴 Deep Sleep in a Cozy Winter Hut with Relaxing Blizzard from Insomnia - Live 24/7,FgFVIY99dI0,Rainy Guy,2025-03-28T19:18:33Z,https://www.youtube.com/watch?v=FgFVIY99dI0,"A good night's sleep in a cozy winter hut will help you sleep, relieve insomnia, help you relax and relieve stress. The sounds of a ...",
Why Sleep Quality is More Important Than Sleep Quantity,KOuCMBLoCGk,ElevateVoices,2025-02-01T05:30:12Z,https://www.youtube.com/watch?v=KOuCMBLoCGk,"Why Sleep Quality is More Important Than Sleep Quantity In this video, we're going to dive into the often-overlooked aspect of ...",
"Sleep Hygiene 101: The Best (and Worst) Habits for Better Sleep | Ashley Mason, Ph.D.",jY50iPJsxGY,Peter Attia MD,2025-03-27T16:01:01Z,https://www.youtube.com/watch?v=jY50iPJsxGY,This clip is from episode #341 - Overcoming insomnia: improving sleep hygiene and treating disordered sleep with cognitive ...,
Sleep Hygiene Tips – STOP Insomnia Naturally with These Hacks!,qdGIgYezzjo,Wellness Wave,2025-02-19T08:15:02Z,https://www.youtube.com/watch?v=qdGIgYezzjo,"Tired of staring at the ceiling at 2 AM? In this video, we reveal 12 powerful, science-backed sleep hacks that can transform your ...",
DON’T TAKE THIS MEDICATION FOR SLEEP. Pharmacist reviews #sleep #sleepaid #insomnia,Kuo2wahDl2w,"Dr. Ethan Melillo, PharmD",2025-02-05T22:58:01Z,https://www.youtube.com/watch?v=Kuo2wahDl2w,,
Do it all well sleep hygiene edition ✨ #doitall #sleephygiene #wellness,RQhJe-y8d5k,Shania Shannon,2025-02-12T23:00:31Z,https://www.youtube.com/watch?v=RQhJe-y8d5k,,
Gary Brecka The Importance of Sleep Hygiene #shawnryanshow #podcast,ijt3ajJ5oEg,VistaBytie,2025-02-05T12:01:05Z,https://www.youtube.com/watch?v=ijt3ajJ5oEg,"shawnryanshow #podcast #health #water Thank you, Shawn Ryan Show, for generously allowing the use of your content.",
Sleep hygiene is SO IMPORTANT!👏Watch this👆#sleep #hygiene #dentistry,Fdbc4evaZSI,Spodak Dental Group,2025-03-15T19:05:53Z,https://www.youtube.com/watch?v=Fdbc4evaZSI,,
Sleep Hygiene for Seniors Improving sleep quality and addressing common sleep problems,A8mN7rstseM,Signal Health Group,2025-02-02T20:04:04Z,https://www.youtube.com/watch?v=A8mN7rstseM,Sleep Hygiene for Seniors Improving sleep quality and addressing common sleep problems.,
for the sleep hygiene girls this is so important #doitall #sleephygiene #productivity,9o-0AfUtEB8,Shania Shannon,2025-03-10T22:00:08Z,https://www.youtube.com/watch?v=9o-0AfUtEB8,,
3-2-1 Sleep Method #sleep #sleephygiene #healthtips #nurse #nursepractitioner #fyp,LUWaER5_8Nc,John Kim The Holistic NP,2025-03-15T15:56:56Z,https://www.youtube.com/watch?v=LUWaER5_8Nc,,
NEUROSCIENTIST Warns SLEEP Loss Causes CANCER #shorts,CJWeT8-n4bg,Quest Limitless,2025-01-03T13:30:07Z,https://www.youtube.com/watch?v=CJWeT8-n4bg,NEUROSCIENTIST Warns SLEEP Loss Causes CANCER #shorts Lack of sleep isn't just tiring-it's dangerous. The WHO reveals a ...,
The BEST Tips for Better Sleep!,_Zp1_HFnqNY,Heart & Soil ,2025-01-22T19:59:02Z,https://www.youtube.com/watch?v=_Zp1_HFnqNY,Struggling to fall asleep? Learn simple and effective sleep tips to improve your sleep quality and wake up feeling refreshed! Sleep ...,
Main reason 👉 #ChildSleep #SleepDisorders #ParentingTips #SleepHygiene #ChildDevelopment #ytshorts,tNMQoefkAKc,Yana Jalan Vlogs ,2025-01-13T14:51:17Z,https://www.youtube.com/watch?v=tNMQoefkAKc,,
3 Tips for Better Sleep Tonight! #SleepTips #RestfulNight #SleepHygiene #HealthyHabits,1l9k6uVya4E,Bloomington Wellness Center,2025-01-06T16:00:03Z,https://www.youtube.com/watch?v=1l9k6uVya4E,"Struggling to get a good night's sleep? Try these three simple tips to improve your sleep hygiene: 1️⃣ One hour before bed, put ...",
"Nind Nahi Aane Ka Karan | Astrology, Sleep Hygiene & Remedies for Insomnia | Stress Relief & Tips",xqH3mOya5q0,Make Me Pure,2025-01-09T13:45:05Z,https://www.youtube.com/watch?v=xqH3mOya5q0,"Nind Nahi Aane Ka Karan | Astrology, Sleep Hygiene & Remedies for Insomnia | Stress Relief & Wellness Tips Nind Nahi Aane ...",
Struggling with High Cortisol at Night? Try These Sleep-Boosting Tips by Urvashi Agarwal #ytshorts,kg78miYeLz4,Urvashi Agarwal,2025-01-30T12:45:29Z,https://www.youtube.com/watch?v=kg78miYeLz4,"In this video, Urvashi Agarwal shares simple yet powerful techniques to calm your nervous system and improve sleep quality.",
"Nind Nahi Aane Ka Karan | Astrology, Sleep Hygiene & Remedies for Insomnia | Stress Relief & Tips",ZInZJFmK4qc,Make Me Pure,2025-01-09T08:28:20Z,https://www.youtube.com/watch?v=ZInZJFmK4qc,"Nind Nahi Aane Ka Karan | Astrology, Sleep Hygiene & Remedies for Insomnia | Stress Relief & Wellness Tips Nind Nahi Aane ...",
Do You Really Need Perfect Sleep Hygiene to Sleep Well?,MFKms3mO-J4,The Sleep Coach School,2025-01-03T01:26:20Z,https://www.youtube.com/watch?v=MFKms3mO-J4,Full Episode: Talking insomnia #92 Basilio is seeing the path to peaceful sleep. #sleepaid #sleepwell #sleeptight #sleepless ...,
Sleep hygiene: How to crush your 2025 goals! #newyear2025 #sleephealing #strengthtraining,yffat7GBF6E,Brian Carroll 1306,2025-01-15T19:44:02Z,https://www.youtube.com/watch?v=yffat7GBF6E,,
Iman gives you advice on how to sleep better😴,qgmua5_dZVQ,rychlostsvetlavfx,2025-03-04T20:00:23Z,https://www.youtube.com/watch?v=qgmua5_dZVQ,Credit : @ImanGadzhi In this short video iman gives advice on how to sleep better. #sleep #hygiene #sleephygiene #shower ...,
Why sleep hygiene is critical for restful night of sleep | The Answer,E5n4XAF-53w,CBS News Sacramento,2025-03-20T03:45:19Z,https://www.youtube.com/watch?v=E5n4XAF-53w,Here's what will help those struggling to sleep.,
How to Sleep Like a Baby😴Tips for Better Sleep Quality 💤,-BOBbRX2oHg,Sounds for the Mind,2025-02-17T08:21:24Z,https://www.youtube.com/watch?v=-BOBbRX2oHg,"Tired of feeling tired? Discover simple, science-backed tips to improve your sleep quality—with a dose of humor!",
Do we actually need 8 hours of sleep ? #sleep #hygiene #bodyclock,7xnyzG69fd8,Kevin Davees,2025-03-11T02:30:05Z,https://www.youtube.com/watch?v=7xnyzG69fd8,"Unlock Your Mind's Potential! In this transformative episode of Zero to One, we sit down with an expert psychologist, Arpitha ...",
Sleep Hygiene 😴🛌,W6MyMyttFKI,REHAB KNOWLEDGE,2025-03-05T12:48:33Z,https://www.youtube.com/watch?v=W6MyMyttFKI,Speech By: Dr. M. Venkatesan Consultant neurologist/ Peadiatric Neurologist L. Vishnu Mental Health Occupational Therapist To ...,
please subscribe ❤️ #sleephygiene #insomniarelief #melatoninboost #usa,CjD5QzvgDLw,Teyli,2025-03-30T11:35:43Z,https://www.youtube.com/watch?v=CjD5QzvgDLw,Sleep-Boosting Smoothie Recipe Ingredients:   1 banana – rich in magnesium and potassium for muscle relaxation   1⁄2 cup ...,
Too much energy after weight loss #100poundsdown #sleephygiene #weightloss #weightlossproblems,Qdp9JExTwmQ,Janeé,2025-03-30T18:11:33Z,https://www.youtube.com/watch?v=Qdp9JExTwmQ,,
How Much Sleep Do You ACTUALLY Need (Science Explained),bS-hsh0Hq-k,FactXplorer,2025-02-12T20:11:43Z,https://www.youtube.com/watch?v=bS-hsh0Hq-k,"Ever wondered how much sleep you actually need to function at your best? In this video, we're diving into the science of sleep to ...",
The Science Behind Sleep Paralysis! Explained 💤,kRiZNSMwXiw,The Science Scoop,2025-02-18T05:30:16Z,https://www.youtube.com/watch?v=kRiZNSMwXiw,"Have you ever woken up unable to move, feeling a presence in the room? You might have experienced sleep paralysis. During ...",
Weight struggles are real in PCOS #highproteinfoods #sleephygiene #strenthtraining #dermtips,Q_xZgfpJgMk,Dr. Kolin Bhardwaj,2025-03-18T13:04:14Z,https://www.youtube.com/watch?v=Q_xZgfpJgMk,,
These Foods are Stronger Than Sleeping Pills,CvKA839ZwO4,WELLNESS WONDERS1024,2025-02-13T18:30:11Z,https://www.youtube.com/watch?v=CvKA839ZwO4,These Foods are Stronger Than Sleeping Pills These Foods Are Stronger Than Sleeping Pills – Unlock Better Sleep Naturally!,
Stop making this mistake if you want to lose weight. #sleephygiene #goodsleephabits #shorts,ZzCt387fhoI,Trained By Saurabh,2025-01-26T16:50:41Z,https://www.youtube.com/watch?v=ZzCt387fhoI,,
#drnivedha #psychiatrist #sleepdisorder #sleephygiene #chennai #screentime,16PXX_CLdDI,Dr.Nivedha Psychiatrist ,2025-03-26T02:41:39Z,https://www.youtube.com/watch?v=16PXX_CLdDI,,
You must listen to these three reasons for getting more sleep 😱 #viralvideo #shorts #trending,kcnHRBwqdiQ,Learning Tips ,2025-03-30T02:44:11Z,https://www.youtube.com/watch?v=kcnHRBwqdiQ,"You must listen to these three reasons for getting more sleep #viralvideo #shorts ""Struggling to hit snooze? You might be ...",
This is why you can’t sleep at night 💤😴,t-gRlbCIuUU,Soma Meditation,2025-01-18T17:39:30Z,https://www.youtube.com/watch?v=t-gRlbCIuUU,"This is why you can't sleep at night A lot of people struggle with insomnia and it can lead to chronic fatigue, stress, ...",
Notifications on at night can sabotage your sleep and health #psychology #sleephygiene #healthysleep,0geuevAqMyc,Doctor Jameca,2025-01-11T00:26:01Z,https://www.youtube.com/watch?v=0geuevAqMyc,,
How To Study For Better Sleep,i00Mnk1mjuM,ओम नमस्ते मित्रों ,2025-01-14T02:19:02Z,https://www.youtube.com/watch?v=i00Mnk1mjuM,How To Study For Better Sleep #howtostudy #bettersleep #howto #study #better #sleep keywords:- How to how to study Sleep ...,
Foods That Help You Sleep Better!#facts #sleepsolution #bettersleep #healthylifestyle #sleephygiene,Yd-mGItZ06Q,Dr. Heal,2025-03-20T06:46:28Z,https://www.youtube.com/watch?v=Yd-mGItZ06Q,Best Foods for Better Sleep! ✨ Having trouble sleeping? The right foods can help you relax and drift into a restful night!,
Why Do You Wake Up Tired Even After 8 Hours of Sleep?,lGLpDR6dDlA,Veena Nair,2025-03-02T13:01:04Z,https://www.youtube.com/watch?v=lGLpDR6dDlA,Sleeping 8 hours but still feeling tired? This could be why: 1️⃣ Poor Sleep Quality: Just because you're in bed doesn't mean ...,
6 Things You Should NEVER Do Before Bed #sleephygiene #sleepdeprived #insomnia #sleeptips #shorts,sBBGx8U2LOk,TARIX HealthFit Advice,2025-03-27T21:02:27Z,https://www.youtube.com/watch?v=sBBGx8U2LOk,"6 Things You Should NEVER Do Before Bed! 🛏️ | Sleep Hygiene Tips Struggling with poor sleep, insomnia, or waking up ...",
Are you not sleeping nicely? Follow this sleep hygiene rule! #sleephacks #sleepbetter #nightroutine,T2nk7GJjpGU,Dr. Ishina Choudhary - Insight Alchemy,2025-03-23T04:55:13Z,https://www.youtube.com/watch?v=T2nk7GJjpGU,Struggling with sleep? Follow the 10-3-2-1-0 rule! ⏳   ✓ 10 hours before bed: No caffeine ☕   ✓ 3 hours before bed: No heavy ...,
🌟 Sleep Better Tonight 🕒 | Top Sleep Hygiene Tips for Optimal Rest 🛌 #sleep #hygienetips #shorts,XKbDa6brfv0,National Health Diary,2025-01-15T11:17:54Z,https://www.youtube.com/watch?v=XKbDa6brfv0,Struggling with restless nights? Discover top sleep hygiene tips to improve your sleep quality and wake up feeling refreshed!,
SLEEP predicts LONGEVITY?🌱#sleephealth #sleepscience #sleepresearch #sleephygiene #biohacking,rmUVGCjHTlc,The Bio Bliss,2025-02-05T13:41:04Z,https://www.youtube.com/watch?v=rmUVGCjHTlc,,
#sleeptips #goodsleep #sleephygiene #bettersleep #sleepstrategy #relaxationtechniques #sleeproutine,WFgUEssz9EA,Madhu's Adhigaaram,2025-03-11T14:05:01Z,https://www.youtube.com/watch?v=WFgUEssz9EA,"healthtips #health #healthbenefits #tips #viral #cookingtips #tamil #shorts #homeremedies #foodie #goodsleeptips, #sleepbetter, ...",
so many people can't sleep at night? #facts #healthbenefits#interestingfacts#sleephygiene#sleepright,CnLWLcQn74c, Facts,2025-03-22T16:30:05Z,https://www.youtube.com/watch?v=CnLWLcQn74c,how to sleep better at night?can't sleep?how to fall asleep?can't fall asleep?sleep better at night?rem sleep?lack of sleep?sleep ...,
"""Sleep Hygiene Tips 💤 | Dr. Pallabi Sahu Explains How to Sleep Better! #Shorts""",m-m3PlAwrOI,Dr Pallabi Sahu - Psychiatrist ,2025-02-10T14:27:01Z,https://www.youtube.com/watch?v=m-m3PlAwrOI,"Struggling with sleep? Dr. Pallabi Sahu, a renowned psychiatrist, shares quick and effective Sleep Hygiene Tips to help you ...",
Sleep Position and Brain Waste Removal,SMyuZ3GEHeE,Info Tube,2025-01-25T07:00:17Z,https://www.youtube.com/watch?v=SMyuZ3GEHeE,"Sleep Position and Brain Waste Removal ----------------------------------------------------------- Cold symptoms can be debilitating, but ...",
Having trouble sleeping? #comedy #sleephygiene,6iQGeXbCtyY,The Uncollected Artist,2025-03-25T17:44:54Z,https://www.youtube.com/watch?v=6iQGeXbCtyY,,
#CleanSheetSunday #CleanHomeHappyHome #FreshSheetsFeelGood #CleaningMotivation #SleepHygiene,qSEUnD3prGU,ben6987 ,2025-01-19T07:33:46Z,https://www.youtube.com/watch?v=qSEUnD3prGU,,
Overwhelmed and Can't Sleep? This may Help You!,nwWRLAsRhOg,mikethePA-C,2025-02-22T03:28:45Z,https://www.youtube.com/watch?v=nwWRLAsRhOg,Sleep Stress Cortisol Hormones Sleep routine Sleep hygiene.,
🍔🍫 Avoid Eating Late for Better Sleep 🛏️✨ #sleep #shorts #eating,_tyAC17abqk,National Health Diary,2025-01-18T17:30:04Z,https://www.youtube.com/watch?v=_tyAC17abqk,Did you know that eating late at night can disrupt your sleep? Avoid heavy meals and sweets before bedtime to improve your ...,
Sleep Hygiene,H4RPNZI5Tug,Mindful Counselling Collective,2025-03-07T19:19:53Z,https://www.youtube.com/watch?v=H4RPNZI5Tug,Struggling with sleep? These 3 simple tips will help you improve your sleep hygiene and wake up feeling refreshed! Prioritizing ...,
How Alcohol Ruins Your Sleep Cycle #healthtips #insomnia #sleephack #sleephygiene #sleepbetter,-VLqn7t2QHc,Lindsay Dixon RPh,2025-02-03T08:00:00Z,https://www.youtube.com/watch?v=-VLqn7t2QHc,Sign-up for my Bi-weekly Evidence-based Newsletter: https://mailchi.mp/b0fff5a29e30/1t6mpaybi5 PODCAST INFO: Email: ...,
How Sleep Hygiene Works,6ali1OYlYrc,Dr. Funke Brown,2025-03-12T17:24:44Z,https://www.youtube.com/watch?v=6ali1OYlYrc,Celebrate Sleep Awareness Week with us by prioritizing the quality rest your body deserves! ✨ Good sleep isn't just about ...,
4 tips that will help you to sleep better:,Y8lk1J2xiVI,Rahul Bisht Aesthetics ,2025-02-10T17:15:01Z,https://www.youtube.com/watch?v=Y8lk1J2xiVI,"1.Physical Fatigue: Engage in physical activities like working out, playing a sport, or going for a run. Choose any activity that ...",
Want ALLERGY RELIEF? Try These 3 Simple Sleep Hacks Tonight,-b5WlVnp_Lc,Sounds for the Mind,2025-01-19T22:02:10Z,https://www.youtube.com/watch?v=-b5WlVnp_Lc,"Allergies keeping you up? Sneezing, itching, and coughing don't have to ruin your nights. Check out these funny and effective tips ...",
Affordable sunrise alarm clock for better sleep #ecozy #sleephygiene,1F8W3TRgtXg,Daisy Flores,2025-03-20T23:00:02Z,https://www.youtube.com/watch?v=1F8W3TRgtXg,Affordable sunrise alarm clock for better sleep #ecozy #sleephygiene #sleepquality #fok.,
Why We Love Magnesium #sleephygiene #pregnancytips #magnesium,dwCn08eTZ1Y,WeNatal ,2025-02-26T20:48:25Z,https://www.youtube.com/watch?v=dwCn08eTZ1Y,Science says ⬇️ Sleep isn't just about getting rest—it's when your body does some of its most important work! While you're ...,
5 Sleep Hygiene Hacks for Better Sleep Tonight! #sleephygiene #youtubeshorts #viralshort,eSSvA1Oy0cM,NEXO Stories,2025-02-13T11:57:29Z,https://www.youtube.com/watch?v=eSSvA1Oy0cM,"Welcome to your guide for better sleep! In this video, we dive into the importance of sleep hygiene and share actionable tips to ...",
Sublingual Melatonin Spray: Sleep in 3 Minutes!,GkfUecmoBeU,Dr. Matt Jones,2025-01-27T17:04:31Z,https://www.youtube.com/watch?v=GkfUecmoBeU,"Discover the revolutionary sublingual melatonin spray! Learn how this fast-acting, effective method improves sleep quality ...",
Here’s why you should snack on protein before bedtime 🥩 #sleephygiene #sleephack #sleephacks,3TjtqWoY7y0,"Dr. Jade Guerra, FNP, MSN, DC",2025-03-03T16:10:03Z,https://www.youtube.com/watch?v=3TjtqWoY7y0,Here's why you should snack on protein before bedtime #sleephygiene #sleephack #sleephacks.,
🛌😴💤(SLEEP HYGIENE)  *Subscribe*,iUIXD-9-nxI,*HEALTH (FULL) OF INFO* ,2025-01-21T23:21:31Z,https://www.youtube.com/watch?v=iUIXD-9-nxI,HEALTH.,
Transform Your Sleep Hygiene: Quick Tips for Restful Nights,N-KKGWxChFA,Life Enthusiast,2025-01-11T14:00:32Z,https://www.youtube.com/watch?v=N-KKGWxChFA,https://youtube.com/live/xEg11nKADA8?feature=share #LifeEnthusiast #health #wellness #podcasts #education #homeopathy ...,
SleepFacts #SleepPatterns #Animation #HealthyLiving #Wellness #SleepHygiene,Blujj8u5URw,Food For Thoughts! ,2025-01-17T19:34:31Z,https://www.youtube.com/watch?v=Blujj8u5URw,,
How Your Sleep Cycle Affects Mental Health | Dr Parul Prasad | Janus Medtalks,xlD5E_Ghqz4,Janus Medtalks,2025-02-12T12:30:59Z,https://www.youtube.com/watch?v=xlD5E_Ghqz4,Welcome to our latest video where we uncover the critical relationship between your sleep cycle and mental health! ✨ Sleep is ...,
Tired All Day? Your Sleep is Sabotaging Your Willpower! 😴 |Growth Mastery #SleepHygiene #Willpower,rRJRhf91cX4,Growth Mastery ,2025-01-29T03:45:01Z,https://www.youtube.com/watch?v=rRJRhf91cX4,Tired All Day? Your Sleep is Sabotaging Your Willpower! |Growth Mastery #SleepHygiene #Willpower Tired of feeling ...,
"""Is Your Sleep Hiding Dangerous Secrets? Find Out What’s Really Going On!""#trending #health #sleep",tB4Fd69co1M,Serena Sinclair ,2025-03-06T15:30:15Z,https://www.youtube.com/watch?v=tB4Fd69co1M,"1. ""Unlock the Science of Sleep: What Your Sleep Patterns Are Really Telling You"" 2. ""Sleep Secrets Exposed: How Scientists ...",
What is Sleep Hygiene?,SDs0kJY9_OA,learnstuffdaily,2025-03-22T12:27:12Z,https://www.youtube.com/watch?v=SDs0kJY9_OA,Unlock the secret to a restful night with our quick guide on sleep hygiene! ✨ Discover essential tips for improving your sleep ...,
Improve your sleep quality 💤 #health #sleep,Sm5WcrP25XU,Hstory Hub Eng,2025-03-19T13:30:21Z,https://www.youtube.com/watch?v=Sm5WcrP25XU,Improve your sleep quality related tags: improve sleep sleep quality improve sleep quality sleep improve your sleep quality ...,
Have you ever heard of biphasic sleep? #sleepcare #sleephygiene #shorts,jhkXtlWpqM0,Dr. Napalm,2025-01-02T00:25:35Z,https://www.youtube.com/watch?v=jhkXtlWpqM0,,
Sleep hygiene starts in the morning #sleephygiene #morningroutine #relatable #asthetic #asmr,dOtnQu8CO1Y,Heidi Knight,2025-02-12T17:47:37Z,https://www.youtube.com/watch?v=dOtnQu8CO1Y,"From the foods you eat and movements you make, how you nourish your soul and set yourself up for the day can determine how ...",
Quality Sleep Is Essential For Better Overall Health,IyM1MAG5pCA,Healthy You TV,2025-03-05T13:51:25Z,https://www.youtube.com/watch?v=IyM1MAG5pCA,"Exploring essential insights about sleep hygiene and its crucial impact on health, backed by science-based solutions.",
The Link Between Sleep and Mental Health #mentalhealth #sleep #sleepmusic #psychology,GcR19gx5NNM,Aesthetic Inspiration,2025-01-02T07:41:49Z,https://www.youtube.com/watch?v=GcR19gx5NNM,,
Train Your Brain: Sleep Better Now!,HHxKBfCpkD8,PassionSeekers,2025-03-12T17:59:30Z,https://www.youtube.com/watch?v=HHxKBfCpkD8,Transform your sleep with this guide on establishing healthy brain habits! Learn how to retrain your brain to avoid nighttime ...,
This simple hack will dramatically improve your sleep hygiene and reduce dry eyes #sleephygiene,HiH0SF0qmG4,"Dr. Shelby - See Better, M.D.",2025-03-30T20:47:48Z,https://www.youtube.com/watch?v=HiH0SF0qmG4,,
Magnesium: The Sleep Supplement That Works! Discover the profound sleep benefits of magnesium! Learn,NJ_BS6vIGfE,Dr. Matt Jones,2025-01-25T21:02:42Z,https://www.youtube.com/watch?v=NJ_BS6vIGfE,Magnesium: The Sleep Supplement That Works! Discover the profound sleep benefits of magnesium! Learn how magnesium ...,
How #sleephygiene might be making your #insomnia worse...,jyKBLCWEN-c,Insomnia Recovery & Sleep Coaching,2025-01-14T13:01:05Z,https://www.youtube.com/watch?v=jyKBLCWEN-c,STRUGGLING WITH INSOMNIA? and want some 1:1 help? Message me to book a first complimentary 20 Minute discovery call: ...,
Magnesium: The Sleep Supplement That Works!,erYKTRZRaFc,Dr. Matt Jones,2025-01-25T19:49:47Z,https://www.youtube.com/watch?v=erYKTRZRaFc,"Discover the profound sleep benefits of magnesium! Learn how magnesium improves sleep quality, combined with melatonin for ...",
Sleep Your Way to a Better You! 🛌✨,E5GxhybQ_1g,Gravity Grey,2025-01-20T05:15:01Z,https://www.youtube.com/watch?v=E5GxhybQ_1g,"Unlock the secret to a better you by mastering the art of sleep! In this energetic YouTube Short, we'll dive into the incredible ...",
Sleep Hygiene for Dream Recall,7SVFFwfmSDY,SuenoLabs,2025-02-23T18:26:17Z,https://www.youtube.com/watch?v=7SVFFwfmSDY,Increase your dream recall — visit the Sueño Labs blog to learn more! Follow Sueño Labs for more sleep tips. #dream ...,
Sleep is needed for Muscle Recovery,PjiQskV57VI,Ibrahim Conteh,2025-01-22T16:00:24Z,https://www.youtube.com/watch?v=PjiQskV57VI,Discover the importance of sleep for muscle recovery and overall well-being! This video explores personal sleep struggles and ...,
Sleep hygiene #snoring #mouthbreathing #tamildentist #oralhealth #mydentalworld,pn4Sv3iTjzA,My Dental world,2025-02-14T00:30:28Z,https://www.youtube.com/watch?v=pn4Sv3iTjzA,"Hi guys This is Dr. Bhothini Dr. Sri's Dental clinic 17,first floor, Opposite to Balaji bavan, Murugan koil road, kundrathur ch-69 For ...",
DITCH THOSE SCREENS FOR BETTER SLEEP,TA_2MxEud-I,that_brain_doctor,2025-01-01T08:51:19Z,https://www.youtube.com/watch?v=TA_2MxEud-I,"First and foremost, wishing you all a very happy and prosperous new year! I'm not an ardent believer in new year resolutions, but I ...",
"""Doctor's Best Solution for Sleeplessness! 💤✅"" #thehealthexpert #facts #sleep #fitnesstips #health",vdbiRHgGpOY,The Health Expert,2025-02-06T13:26:04Z,https://www.youtube.com/watch?v=vdbiRHgGpOY,"Are you tired of tossing and turning all night, unable to get the restful sleep you desperately need? In this video, we dive deep into ...",
Sleep hygiene hacks #travelvlog#airport#wellness #adventure #youtubeshorts,WzXHMS2YBI8,The Working Wanderer: Redefining the Shift,2025-02-24T20:48:20Z,https://www.youtube.com/watch?v=WzXHMS2YBI8,"catch a nap on early 6am flights, up at 3 am,using my impromptu purchased pink vest for winter travels as a pup tent. #travelvlog ...",
#omnamahshivayomnamahshivay #prathana #song #sleephygiene #@ashokkumarsingh2237,KXar6pi0pHg,ASHOK KUMAR SINGH,2025-01-27T19:12:40Z,https://www.youtube.com/watch?v=KXar6pi0pHg,"omnamahshivayomnamahshivay @ashokkumarsingh2237 Powerful Mantra Sutati for peaceful life and happiness,",
If You Sleep Only 2 Hours Every Night,lHNTnAEP-xs,Virgo Man,2025-03-15T10:13:18Z,https://www.youtube.com/watch?v=lHNTnAEP-xs,What Happens If You Sleep Only 2 Hours Every Night? Have you ever thought about sleeping only 2 hours a night? Sounds cool ...,
Does Sleep Affect Weight Loss?,dFWI8nhTh5Q,Medicura - Health & Aesthetics,2025-02-11T06:11:32Z,https://www.youtube.com/watch?v=dFWI8nhTh5Q,"GET your FREE Sleep Hygiene Checklist and sleep like a baby, plus all the other added bonuses that come from a good night's ...",
Quick Tips for Better Sleep Hygiene | Improve Your Rest 🌙,yu_xx_clJ-o,GrowthBytesDaily,2025-02-07T17:01:17Z,https://www.youtube.com/watch?v=yu_xx_clJ-o,Discover easy ways to improve your sleep hygiene for better rest and increased productivity. Small changes can make a big ...,
Om namah shivaya #mostpopular #prathana #song #sleephygiene #bhaktibhajan #sort @ashokkumarsingh2237,xIxkjkVFD_8,ASHOK KUMAR SINGH,2025-01-19T23:00:35Z,https://www.youtube.com/watch?v=xIxkjkVFD_8,OM namah shivaya most powerful mantra Sutati for peaceful life and happiness #prathana #song #bhaktibhajan #sorts ...,
The Science Of Sleep Hygiene,i931HgCTv70,newlifeheal,2025-01-20T17:05:42Z,https://www.youtube.com/watch?v=i931HgCTv70,"The Science of Sleep Hygiene: Beyond the Basics When it comes to sleep hygiene, most of us are familiar with common tips like ...",
Optimise your sleep #CircadianRhythms #LightImpact #Dopamine #Wellbeing #SleepHygiene #HealthTips,LdleDm3vcRE,Podcast Clipper,2025-03-29T22:04:25Z,https://www.youtube.com/watch?v=LdleDm3vcRE,,
Sleep Quality: +85% Efficiency Is Ideal w/ @DarshanShahMD,7QWmpdFsH3g,Sleep Diplomat (Matt Walker),2025-02-25T15:37:14Z,https://www.youtube.com/watch?v=7QWmpdFsH3g,"Unlock the secrets to a perfect night's rest! Learn about sleep efficiency, the importance of uninterrupted sleep, and how to ...",
What tricks help you fall asleep better? 👥🛌 #tinnitus #sleephygiene #sleephacks #bettersleep,2T2RrLlva7I,Tinnitalks,2025-02-25T18:21:04Z,https://www.youtube.com/watch?v=2T2RrLlva7I,,
5 Simple Ways to Prevent #Oversleeping and Boost Your Day #DrSameerBhati #SleepHygiene #Sleep,LPS6rxg_l9Y,Dr Sameer Bhati,2025-01-02T12:17:23Z,https://www.youtube.com/watch?v=LPS6rxg_l9Y,,
Napping the Right Way #napping #sleephygiene #sleeptips #wellnesstips,W_KbE05_ckM,SLEEP.BALANCE,2025-03-02T01:35:55Z,https://www.youtube.com/watch?v=W_KbE05_ckM,"Discover the power of restorative sleep with Sleep Balance. Our channel provides tools and resources to help you unwind, ...",
