Title,Video ID,Channel,Published At,URL,Description,Video Length
My Sleep Went From ZERO To HERO  ❤️🌙  What On Earth Is Sleep Hygiene,p7ECJLK_Tso,Living With Dan,2025-03-31T07:26:26Z,https://www.youtube.com/watch?v=p7ECJLK_Tso,"Ever wondered how to turn restless nights into amazing sleep? ‍♂️   Dr. Sleep, our beloved Muppet expert is here to talk all ...",
How to shift sleep #bcba #goodsleep #behavioranalyst #sleephygiene #ceu #bcba #webinar,Wf_W58ReOPE,Gabrielle Carmody | BCBA LBA CBSS,2025-01-03T19:57:34Z,https://www.youtube.com/watch?v=Wf_W58ReOPE,,
How Do You Improve Your Sleep Quality Starting Tonight?,l5c3KYHv73Y,"Dr. Hanz, MD",2025-03-16T20:32:00Z,https://www.youtube.com/watch?v=l5c3KYHv73Y,3 Easy Ways to Sleep Better #shorts #sleep #wellness #sleephygiene #bettersleep #healthyliving #nightsleep #sleepwell ...,
Unlock Your Best Self with Sleep Hygiene,pdNDsBc9oTQ,Random987,2025-01-14T16:00:28Z,https://www.youtube.com/watch?v=pdNDsBc9oTQ,Discover the secret to improving your health and focus by mastering sleep hygiene. Your body and mind will thank you!,
Could exercise mess with your sleep?  #sleep #insomnia #meditation #sleephygiene #mindfulness,FCn-vwN-3p8,The Calm Potential,2025-02-21T02:34:00Z,https://www.youtube.com/watch?v=FCn-vwN-3p8,This is different for everyone and different exercises/sports will have more of an impact. Getting exercise each day earlier in the ...,
Sleep treatment and autistic kiddos- learn more #bcba #sleepquality #ceu #sleephygiene #autism #bcba,SLAmjCtL9WU,Gabrielle Carmody | BCBA LBA CBSS,2025-03-08T17:09:50Z,https://www.youtube.com/watch?v=SLAmjCtL9WU,,
6 Foods Naturally High in Melatonin to Help Improve Your Sleep Hygiene,gINpOuDFQhU,GoodRx,2025-01-29T17:02:12Z,https://www.youtube.com/watch?v=gINpOuDFQhU,Melatonin is a natural hormone that plays an important role in sleep. Are these 6 foods high in melatonin a part of your diet?,
Sleep hygiene could help fight respiratory viruses,6W3XG6SOH58,KPRC 2 Click2Houston,2025-02-27T22:54:36Z,https://www.youtube.com/watch?v=6W3XG6SOH58,A good night's sleep might be your best defense against respiratory viruses.,
No more sleepless nights: Addressing your sleep hygiene,n7hySJue30w,News 19 WLTX,2025-03-17T12:21:19Z,https://www.youtube.com/watch?v=n7hySJue30w,"We're kicking off ""Sleep Week"", a special series where we sit down with experts from across the Midlands to share tips on how you ...",
Escape the Trap! 💤 Take Control of Your Sleep Hygiene for Success,IwGW6JiGYKc,ASHAHLEEKS,2025-03-07T16:00:17Z,https://www.youtube.com/watch?v=IwGW6JiGYKc,Struggling with exhaustion and burnout? Poor sleep hygiene might be holding you back more than you realize. It's time to ...,
Boost Your Energy with Better Sleep Hygiene,yyfmV0bEv84,"Health, Wealth & Happiness Hub",2025-02-24T18:11:00Z,https://www.youtube.com/watch?v=yyfmV0bEv84,Struggling with low energy? Aim for 7-9 hours of sleep and avoid caffeine after 2 PM to wake up refreshed and energized!,
Mastering Sleep Hygiene: Your Sleep's Best Friend,eTJRuAvPHoI,QuickShortys,2025-02-14T12:00:32Z,https://www.youtube.com/watch?v=eTJRuAvPHoI,Unlock the secret to better sleep by mastering sleep hygiene! Learn how simple changes can transform your nights.,
Sleep Hygiene Tips for a Better Night’s Rest 🌙 https://shorturl.at/78UEN,PWMt-_gXOQQ,Smart Home Technology,2025-02-25T07:30:11Z,https://www.youtube.com/watch?v=PWMt-_gXOQQ,Improve Your Sleep Hygiene for a Better Night's Rest Struggling with sleepless nights? Unlock the secrets to a peaceful and ...,
Tips for Better Sleep Hygiene for Your Child! || Kanchi Kamakoti Childs Trust Hospital,gVtEYLUVJGg,Kanchi Kamakoti Childs Trust Hospital ,2025-01-13T12:00:57Z,https://www.youtube.com/watch?v=gVtEYLUVJGg,"Many parents have questions about their child's sleep, nutrition, and growth. In this video, we explore the importance of good ...",
Unlock Your Athletic Edge: Mastering Sleep Hygiene,d87e_8xDeLA,My Longevity Experiment,2025-03-12T09:55:32Z,https://www.youtube.com/watch?v=d87e_8xDeLA,Discover the crucial link between sleep and performance. We explore how a proper sleep routine can enhance your athletic and ...,
Unlock Better Sleep: Top 5 Sleep Hygiene Tips,wnALRZdf064,C3 Victory,2025-02-02T06:00:36Z,https://www.youtube.com/watch?v=wnALRZdf064,Kick-start your Heath in 2025 #motivation #podcast #health #healthyliving #wellness #spirituality.,
Sleep Hygiene: White Light #sleephygiene #sleeptips #sleepaid #bettersleep #sleepoptimization,hepX4MTqUiY,Happy Space Hypnosis,2025-02-20T21:00:36Z,https://www.youtube.com/watch?v=hepX4MTqUiY,Has your sleep been poor lately? It could be the white light you're using at night. VIDEOS TO WATCH NEXT: Hypnosis ...,
"Sleep is More Important Than Diet and Exercise Here’s Why #insomnia, #sleep",MxDXU7H_a7U,Sleep Well Network,2025-03-02T02:00:12Z,https://www.youtube.com/watch?v=MxDXU7H_a7U,"Did you know sleep could be the missing piece to your health and wellness journey? In this video, we dive into why sleep is more ...",
#sleephygiene #stressfree #lowcortisol #stressrelief #discomfort,fXSudccMFZI,Punky&Pudgy Tarot,2025-01-06T09:57:41Z,https://www.youtube.com/watch?v=fXSudccMFZI,,
Master the Art of Good Sleep Hygiene!,Xa8rC40oWRo, Brain Health Chat,2025-03-19T03:00:29Z,https://www.youtube.com/watch?v=Xa8rC40oWRo,"NeurologyDrG Struggling with insomnia? In this video, we explore the best treatments to help you fall asleep faster and stay ...",
Dr Pallabi Sahu Explains SLEEP HYGIENE | Tips for Better Sleep | Psychiatrist in Cuttack/Bhubaneswar,Y5d3aobE0Zc,Dr Pallabi Sahu - Psychiatrist ,2025-02-10T14:21:47Z,https://www.youtube.com/watch?v=Y5d3aobE0Zc,SleepHygiene #MentalHealth #DrPallabiSahu #PsychiatristCuttack #PsychiatristBhubaneswar #BetterSleep #HealthyHabits ...,
The top 5 ways to keep your sleep hygiene top notch ⭐⁠,tybIQZGorpU,Rest,2025-03-13T23:00:20Z,https://www.youtube.com/watch?v=tybIQZGorpU,TheRestIsMagic #Rest #Evercool #coolingcomforter #restcoolingcomforter #restduvet.,
🤗💝🥹 #CuteCheery#playing#with his favourite boll#in anger #sleephygiene,YRd6Cp3oMYg,Krishna🙌,2025-03-06T15:03:18Z,https://www.youtube.com/watch?v=YRd6Cp3oMYg,,
Beat Depression and Sleep Better TONIGHT,brfGz_D0q5k,Empower Your Emotions: The Power of You,2025-02-01T19:43:09Z,https://www.youtube.com/watch?v=brfGz_D0q5k,Beat Depression and Sleep Better TONIGHT! Are you losing sleep over depression? You're not alone. In this impactful YouTube ...,
This might be why you can't sleep #sleephygiene #sleepenvironment #sleepbetter #sleepsolution #sleep,yTJhb9WsSjo,Happy Space Hypnosis,2025-03-12T23:06:49Z,https://www.youtube.com/watch?v=yTJhb9WsSjo,Does it take you a long time to fall asleep? Find out how you can fix it - quickly! VIDEOS TO WATCH NEXT: Hypnosis Meditations ...,
Hababka Hurdada Wanaagsan - Sleep Hygiene  #wellness  #healthyliving #bettersleepquality #duet,cv239X4qTIA,DR MO SHOW,2025-01-13T12:19:30Z,https://www.youtube.com/watch?v=cv239X4qTIA,Tips for a healthy sleep.. Subscribe for more http://www.youtube.com/@UCdjQ-YbVsZ8FC8s9cCMd9uw.,
Sleep: The Secret Skill for Peak Productivity,1hMBRgYiXl4,PassionSeekers,2025-03-04T04:53:25Z,https://www.youtube.com/watch?v=1hMBRgYiXl4,Unlock your productivity potential by mastering the skill of sleep! We explore why quality sleep is fundamental for effective ...,
How To Develop Better SLEEP Hygiene,9HJOu_FiSCA,All About Kids,2025-03-14T01:32:47Z,https://www.youtube.com/watch?v=9HJOu_FiSCA,Gabrielle Carmody discusses how to develop better sleep hygiene. Watch the full episode on The All About Kids Podcast: ...,
Better Sleep with a Simple Adjustment,by5t717RHJ0,Health and Horsepower,2025-03-21T23:00:28Z,https://www.youtube.com/watch?v=by5t717RHJ0,What if I told you that better sleep could start with a simple adjustment? Let's unlock the secrets of a restful night naturally!,
Unlock Your Potential with Sleep Hygiene,BcqKOFNfh88,T_WHAT IF,2025-01-16T14:00:27Z,https://www.youtube.com/watch?v=BcqKOFNfh88,Struggling with productivity? Discover how better sleep hygiene can transform your daily performance and overall well-being.,
#aminuteforsafety #occupationalsafety #sleep #oshassociation,bcJps7SgHx8,OSHAssociation,2025-03-18T14:50:06Z,https://www.youtube.com/watch?v=bcJps7SgHx8,,
sleep hygiene,1uP-n3T0c4w,Dr Nneka Kalu,2025-02-12T14:43:17Z,https://www.youtube.com/watch?v=1uP-n3T0c4w,"You, can't fall asleep? Waking up exhausted? You're not alone—your sleep hygiene might be wrecking your nights!",
"When I win the lottery, I won't tell anyone, but there will be signs. #mouthtape #sleep #fyp",NPKAg90GZYc,Hostage Tape,2025-02-06T14:39:04Z,https://www.youtube.com/watch?v=NPKAg90GZYc,"When I win the lottery, I won't tell anyone, but there will be signs. It will also be quite easy not to tell anyone since my mouth will be ...",
Sleep Hack during the Day - when sleep hygiene isn’t enough! #mentalhealth #sleep #parenting,yQ2WrgQ5LFU,Zen for Men,2025-03-04T22:11:13Z,https://www.youtube.com/watch?v=yQ2WrgQ5LFU,,
Honey and Milk for Sleep,Vk8tNSBW6Lw,Northumberland Honey Co,2025-01-16T16:34:47Z,https://www.youtube.com/watch?v=Vk8tNSBW6Lw,Exhausted? But struggling for a good nights sleep? Have you tried honey and warm milk? When combined into a bedtime routine ...,
Shocking 😱 truths about sleep deprivation 😴 #facts #sleep #viralshorts #sleepbetter,aESzP1jcTTQ,Knowledge hub online ,2025-02-03T10:33:33Z,https://www.youtube.com/watch?v=aESzP1jcTTQ,Shocking truths about sleep deprivation #facts #sleepbetter #viralshorts It is estimated that 30 percent of adults and 66 percent ...,
🌙 Struggling to Sleep? 💤🤔 #BetterSleep #SleepHygiene #InsomniaRelief,79Tp-cs-u-g,Dr. Nirav Sutariya Neurologist,2025-02-06T13:30:05Z,https://www.youtube.com/watch?v=79Tp-cs-u-g,Struggling to Sleep? Did you know that good sleep hygiene can help you fall asleep naturally—without the need for sleeping ...,
Why Sleep Paralysis is a Prison for Your Mind,wPV-HjzRY9I,The Brisk Podcast,2025-01-27T09:30:18Z,https://www.youtube.com/watch?v=wPV-HjzRY9I,Understand Sleep Paralysis: When your dreams becomes your prison #shorts #sleepparalysis Related Queries:- sleep ...,
Dreams Unveiled #UrbanLegend #SleepHygiene #MentalHealth,Y72PBAC50Ng,Legends May Live,2025-03-13T20:15:02Z,https://www.youtube.com/watch?v=Y72PBAC50Ng,"In a quiet town, whispers of a mystical sleep ritual spread. Locals claimed it unlocked the mind's hidden powers. Curious, Emma, a ...",
Can bad sleep give give you DIABETES!,6m-VXzuLPdY,sleepkase,2025-03-21T23:13:26Z,https://www.youtube.com/watch?v=6m-VXzuLPdY,Are you aware that poor sleep habits could be affecting more than just your energy levels? Discover the surprising connection ...,
Exercise: Your Secret Weapon for Better Sleep,74PysVGoFU8,Carlos Zambrano Bowen,2025-03-04T21:55:23Z,https://www.youtube.com/watch?v=74PysVGoFU8,"Discover the connection between exercise and better sleep! Learn how regular physical activity, from yoga to jogging, can ...",
Turn Your Bedroom into a Sleep Haven,HIkCDkTeinc,The Institute for Functional Medicine,2025-03-14T21:02:33Z,https://www.youtube.com/watch?v=HIkCDkTeinc,"Today is World Sleep Day, and the 2025 theme is, ""Make Sleep Health a Priority."" Sleep plays a critical role in health and ...",
Sleep isn’t important. It’s vital.,Nq6EhlkIMfQ,Hostage Tape,2025-02-12T18:00:18Z,https://www.youtube.com/watch?v=Nq6EhlkIMfQ,How important is our sleep? Sleep is critically important for both physical and mental health. Here's why: 1. Physical Health: ...,
Nightmares & Night Terrors | Sleep Hygiene | Adenoid Hypertrophy | Reason for bad dreams,dEgYXPH-XII,REHAB KNOWLEDGE,2025-03-13T03:30:20Z,https://www.youtube.com/watch?v=dEgYXPH-XII,Speech By: 1.Dr. M. Venkatesan Consultant neurologist/ Peadiatric Neurologist 2.L. Vishnu Mental Health Occupational Therapist ...,
Why you should prioritize sleep #health #nursing #sleephygiene,Bs-Elo_iHj0,sticknurse,2025-01-16T20:19:32Z,https://www.youtube.com/watch?v=Bs-Elo_iHj0,,
The Essentials of Sleep Hygiene: Setting Yourself Up for Restful Nights,dqWZmSA-fjw,Eric Casaburi,2025-03-14T18:08:16Z,https://www.youtube.com/watch?v=dqWZmSA-fjw,"The Essentials of Sleep Hygiene: Setting Yourself Up for Restful Nights In this conversation with Dr. Meeta Singh, we explore the ...",
Sleep and mental health #mentalhealth #sleephygiene #sleeproutine #psychology #sleep #wellness,lthuL1K9fhY,Fund Mental Healthcare,2025-03-31T03:20:15Z,https://www.youtube.com/watch?v=lthuL1K9fhY,"According to the CDC, consistent, high-quality sleep significantly impacts mental health by reducing anxiety, improving mood, and ...",
How to Create a Sleep Training Routine #sleephygiene #podcast #selfcare,mJV-_YfOAas,Future Toolbox,2025-02-20T00:00:39Z,https://www.youtube.com/watch?v=mJV-_YfOAas,"MiloSays I'm ready for a nap Did you know that we spend approximately a third of our lives asleep? Turns out, it's actually one ...",
Poor Sleep is Killing You FAST! Do THIS #shorts,bzdtk3C8U_8,Goodeees,2025-01-20T03:03:35Z,https://www.youtube.com/watch?v=bzdtk3C8U_8,Poor Sleep is Killing You Quickly! How to Fix It FAST Did you know that poor sleep could be silently sabotaging your health?,
Understanding Sleep Apnea: Causes & Prevalence 🌙🛌 | Health Insights #sleepapnea #sleep #shorts,K2-ep1FBoAY,National Health Diary,2025-01-22T06:44:53Z,https://www.youtube.com/watch?v=K2-ep1FBoAY,"Sleep apnea is more common than you might think! In this short, we'll explore what sleep apnea is, its causes, and how ...",
Is Screen Time Ruining Your Sleep?,1zWlO6EjkGM,PassionSeekers,2025-03-05T18:57:29Z,https://www.youtube.com/watch?v=1zWlO6EjkGM,Uncover the shocking effects of excessive screen time on sleep! We explore the science of light's impact on our brain's sleep ...,
How Sleep Improves Mental Health #funfacts #sleep #wellness #health #mentalhealth,XSg8ctN9Dtw,Artefakta Dunia,2025-02-18T21:14:50Z,https://www.youtube.com/watch?v=XSg8ctN9Dtw,,
Unlock Better Sleep #SleepHealth #Insomnia #MentalWellness #CBT #Mindfulness #SleepHygiene,M3F_YWuUsDo,Bogyó1966,2025-03-31T18:57:34Z,https://www.youtube.com/watch?v=M3F_YWuUsDo,Struggling with sleep issues? Discover how important seeking help is for improving your sleep quality and overall well-being.,
Unlock Your Potential: Master Sleep Hygiene Now!,s0AKAi4VvV0,Carlos Zambrano Bowen,2025-02-21T21:58:26Z,https://www.youtube.com/watch?v=s0AKAi4VvV0,Unlock your full potential with improved sleep! We explore the consequences of poor sleep and offer practical tips for better sleep ...,
Intersting facts about sleep hygiene #sleep  #hygiene  #lifestyle,RwOcloPud_w,Motivational Quotes & Facts,2025-02-16T10:35:52Z,https://www.youtube.com/watch?v=RwOcloPud_w,"If it takes you fewer than five minutes to fall asleep at night, you're likely sleep-deprived. Ideally, falling asleep should take ...",
Optimize Your Circadian Rhythm  #circadianrhythm  #morningsunlight #sleephygiene,Tl4WIWlNumY,King's Exploits,2025-02-28T06:30:18Z,https://www.youtube.com/watch?v=Tl4WIWlNumY,"Never stay up too long; it really affects our body rhythms, known as circadian rhythms. I make it a point to be in bed before 10 PM ...",
Day 279 Sleep Hygiene   Stretching Before Bed,VHfg3XqnZkw,Comprehensive Healing Solutions & CHS Foundation,2025-01-18T18:00:49Z,https://www.youtube.com/watch?v=VHfg3XqnZkw,Day 279: Sleep Hygiene - Stretching Before Bed Daily Tip: Gentle stretching before bed helps release tension and prepare your ...,
"4 Surprising Sleep Hygiene Facts You Need to Know in 2025!""",J-p-E2AWL-w,Fact Sphere,2025-01-03T13:30:18Z,https://www.youtube.com/watch?v=J-p-E2AWL-w,Want to wake up refreshed and ready to conquer your day? These 4 sleep hygiene facts will transform your nights and boost your ...,
Tips For Good Sleep Hygiene | By Dr T. Ayodele Ajayi.,qNmeixqK2Eo,Tripart Care,2025-03-08T13:39:41Z,https://www.youtube.com/watch?v=qNmeixqK2Eo,"Better nights, brighter days. ✨ Prioritize your sleep hygiene for a healthier mind and body! #sleepwell #relationshipissues ...",
Sleep Your Way to Weight Loss: The Power of Sleep Hygiene,3nsf5NI8ACY,"Jenny Gaston, LPC",2025-02-05T17:00:06Z,https://www.youtube.com/watch?v=3nsf5NI8ACY,"Did you know better sleep can help you lose weight? In this short video, discover how sleep hygiene impacts metabolism, hunger ...",
WVU Medicine Health Report - Sleep Hygiene,nnZFccyi6Rc,WVU Medicine,2025-01-31T13:07:03Z,https://www.youtube.com/watch?v=nnZFccyi6Rc,Are you having trouble falling asleep? Do you struggle with feeling well rested throughout the day? According to the CDC and the ...,
Today is #WorldSleepDay !☁️🌛😴 #health #sleep #healthcare #hacks #GRWM #shorts,A2_c3jMY5SU,"CIS - Clinical Investigation Specialists, Inc.",2025-03-14T18:45:15Z,https://www.youtube.com/watch?v=A2_c3jMY5SU,"Today is #WorldSleepDay !☁️     Sleep is a profoundly important part of our physical and mental health. ""Sleep hygiene"" is the ...",
Sleep hygiene is so important #insomnia #sleep #sleephack #health,1AETdc4sgHY,Doctor Sooj,2025-01-04T08:59:32Z,https://www.youtube.com/watch?v=1AETdc4sgHY,Sleep hygiene is so important #insomnia #sleep #sleephack #health.,
Sleep Hygiene  #body  #feelgood  #diet  #fitness  #healing  #health  #longevity  #naturalbeauty,6s4JMVwZnCE,Who Wants To Live Forever,2025-01-03T15:11:09Z,https://www.youtube.com/watch?v=6s4JMVwZnCE,"""Quick Health Hacks for a Better You! ✨"" Looking for life-changing health tips? From glowing skin to sharper focus, we've ...",
Master Sleep Hygiene: Secrets for Restful Nights #fitness #health #bible #podcast,Zh1S8KkXehY,C3 Victory,2025-02-20T21:00:26Z,https://www.youtube.com/watch?v=Zh1S8KkXehY,,
Unlock Your Potential with Sleep Hygiene,GTth0Kb2AEE,Shanda Tv,2025-01-20T11:15:28Z,https://www.youtube.com/watch?v=GTth0Kb2AEE,Transform your life through better sleep! Discover how sleep hygiene can boost your health and productivity. #SleepHygiene ...,
Sleep Hygiene for Wellness,1ezGr8x1R68,Health Tips ,2025-01-04T01:00:01Z,https://www.youtube.com/watch?v=1ezGr8x1R68,Discover practical tips on maintaining sleep hygiene for everyday wellness and boosting energy. #SleepHygiene ...,
How is your sleep hygiene routine? Listen to my podcast interview on #sleephygiene #sleepwellness,Snml-w3qiPk,Coach Debbie Potts,2025-03-16T16:39:00Z,https://www.youtube.com/watch?v=Snml-w3qiPk,,
Mudras for Improving Sleep Quality Naturally #sleep #shorts #sleep,-xtjg6sMGig,Ancient Tips,2025-03-20T09:22:28Z,https://www.youtube.com/watch?v=-xtjg6sMGig,Mudras for Improving Sleep Quality Naturally #sleep #shorts #sleepbetter Book Name - 15+ Science-Proven Natural Remedies to ...,
SLEEP HYGIENE A PSYCHISCH PODCAST,acGelmBIhfA,rajiv pandarathil,2025-01-10T01:15:03Z,https://www.youtube.com/watch?v=acGelmBIhfA,,
How Lack of Sleep Affects You,wikrRw_TYl0,"Dr. Hanz, MD",2025-03-12T01:00:53Z,https://www.youtube.com/watch?v=wikrRw_TYl0,How Lack of Sleep Affects You #shorts #wellness #sleep #sleephabits #wellbeing #healthylifestyle #productivity #alertness ...,
#pulmonologist#sleep#sleepapnea##snoring#noseblock#sinusitis#rhinitis#cpap#bipap#sleephygiene#heart,v0hcvNYgcfI,Dr Varun Rajpal Pulmonologist ,2025-01-17T06:02:41Z,https://www.youtube.com/watch?v=v0hcvNYgcfI,,
શ્રેષ્ઠ ઉંઘ માટેના ઉપાયો. Sleep hygiene tips. by mental health expert✅ mental health matters ✅,ZxHiLLpFPVU,Manshree Hospital Morbi(Neuropsychiatry &Ayurved),2025-01-29T05:55:55Z,https://www.youtube.com/watch?v=ZxHiLLpFPVU,શ્રેષ્ઠ ઉંઘ માટેના ઉપાયો? Sleep hygiene tips? by mental health expert✓ mental health matters ✓ ડૉ.,
How to Improve Sleep Hygiene,KVLi0RrE39U, Health is Wealth,2025-01-29T14:57:45Z,https://www.youtube.com/watch?v=KVLi0RrE39U,"Hello and welcome to Health is Wealth! Today, we're talking about something that affects your physical and mental well-being: ...",
Sleep Hygiene: Importance and Practical Tips for Better Sleep,XqksJepnLI8,Subhiksha Medic,2025-02-27T14:00:39Z,https://www.youtube.com/watch?v=XqksJepnLI8,Sleep Hygiene: Importance and Practical Tips for Better Sleep Getting 7–9 hours of sleep is essential for good health. Less than 7 ...,
#naturalsleep #sleephygiene #funny #tarot #ytshorts #trendingshorts #viralvideo,dZu1vmj98_k,Nutritional_values_,2025-02-20T16:26:44Z,https://www.youtube.com/watch?v=dZu1vmj98_k,,
What to do for a GOOD SLEEP HYGIENE | Dr. Anusha | Neuropsychiatry #sleephygiene #goodsleephabits,Yde79SYyjSc,The Samvaad Project,2025-01-01T18:09:48Z,https://www.youtube.com/watch?v=Yde79SYyjSc,"Want to wake up feeling refreshed, happy, and ready to take on the day? In this video, we'll share some simple yet powerful tips to ...",
Mastering Sleep Hygiene for Better Rest,RO4X4TVOvLU,Gentle Sir Facts,2025-01-18T08:30:27Z,https://www.youtube.com/watch?v=RO4X4TVOvLU,Unlock the secret to better sleep! Discover the importance of sleep hygiene and how it can transform your nights. #SleepHygiene ...,
What is Sleep Hygiene? (Easy Explanation),ZzIpFvBKjUc,Helpful Professor Explains!,2025-03-10T16:00:46Z,https://www.youtube.com/watch?v=ZzIpFvBKjUc,"Sleep hygiene refers to habits and practices that promote consistent, high-quality sleep. This includes maintaining a regular sleep ...",
Do This ! To Quick Sleep 😴 ?,AghBtUietuQ,Nourish Nation,2025-02-12T00:30:08Z,https://www.youtube.com/watch?v=AghBtUietuQ,"Are you tired of tossing and turning at night? Do you struggle to wake up feeling refreshed and energized? In this video, we'll ...",
I Tried 10 Expert Sleep Tips For Bliss,EKVSJYEMkEU,Health Hero Hub,2025-02-24T08:53:31Z,https://www.youtube.com/watch?v=EKVSJYEMkEU,Looking to improve your sleep hygiene and overcome sleep problems? This comprehensive night routine guide offers ...,
The Booming Sleep Economy in Canada,Bv79gZRzbU4,Maplesoup Canada,2025-03-02T12:39:31Z,https://www.youtube.com/watch?v=Bv79gZRzbU4,"sleep #insomnia #sleep hygiene Explore the booming sleep economy in Canada, where investments in sleep-enhancing ...",
I love sleep,faYxMVOC6Rg,Jamal Salem,2025-03-11T03:23:06Z,https://www.youtube.com/watch?v=faYxMVOC6Rg,How's your sleep hygiene? Better yet: How's your sleep passion? Let's inspire each other to sleep. Share this if you love sleep yet ...,
Enough AND quality sleep really matters #sleepquality #sleephygiene #sleepbetter #dailyhabits,wGHgQH-sRCw,Kuhuverse,2025-02-17T11:30:40Z,https://www.youtube.com/watch?v=wGHgQH-sRCw,,
"Day 55 : ""Sleep Hygiene""",FCjGO0_4kiE,Jeena Girilal,2025-03-08T17:09:55Z,https://www.youtube.com/watch?v=FCjGO0_4kiE,"""Sleep Hygiene"" Prioritize your sleep."" Good sleep is essential for physical and mental health."" ""Create a relaxing bedtime routine, ...",
"""Struggling to Sleep? Fix Your Sleep Hygiene in 60 Seconds! 😴✨"" #relaxation #stressandhealth",w8-cqd6owlo,PsychWell Zone,2025-02-05T11:45:04Z,https://www.youtube.com/watch?v=w8-cqd6owlo,"Tired of sleepless nights? Your sleep hygiene could be the problem! In just 60 seconds, learn 5 proven tips to fall asleep faster, ...",
Sleep Hygiene|Self-Care #Sound sleep 😴 #healthymind&body#shorts #short #viralvideo #trending,Uc0VY7bPzyk,Flavours of My Life,2025-03-06T10:20:30Z,https://www.youtube.com/watch?v=Uc0VY7bPzyk,sound sleep music sound sleep sound sleep music therapy sound sleep asmr sound sleep baby sound sleep meditation sound ...,
The SHOCKING Truth About Sleep! (6 vs 8 hours),pQIxsJZArg4,PassionSeekers,2025-02-15T15:00:24Z,https://www.youtube.com/watch?v=pQIxsJZArg4,Discover your perfect sleep duration! We explore fascinating sleep studies that debunk the 8-hour myth. Learn how to listen to ...,
#BestSleepMedicine: Uncover the Top Sleep Aids for Restful Nights #Shorts #sleepsupport,g8y4slKerWM,Sancta Vita Health,2025-01-08T19:03:19Z,https://www.youtube.com/watch?v=g8y4slKerWM,CHECK OUT** our full blog for in-depth insights on improving your sleep: [Best Sleep ...,
Tips for better sleep hygiene,Gy-pfLw27ZY,Matt Black,2025-01-22T06:04:11Z,https://www.youtube.com/watch?v=Gy-pfLw27ZY,"A good night's sleep starts with a healthy routine. From setting a regular bedtime to creating a peaceful environment, simple ...",
"Dry Begging, NOT Real Love #motivation #sleephygiene #zenfulliving #becomeunstoppable",To8euqlt6go,PsychePulse,2025-01-18T18:08:50Z,https://www.youtube.com/watch?v=To8euqlt6go,"""Are you unknowingly caught in a relationship filled with dry begging? Discover how to recognize subtle emotional manipulation ...",
Quick tips for better sleep tonight#sleeptips #sleephygiene #bettersleep,U45a1RykUWE,Janet Jackson,2025-03-26T16:39:47Z,https://www.youtube.com/watch?v=U45a1RykUWE,Learn how to improve your sleep quality tonight with these simple tips!#sleeptips #sleephygiene #bettersleep #healthylifestyle ...,
Regulate Sleep If You Want Progress,p73_VnBBUw0,Courageous Conversations with Victoria,2025-01-08T17:10:54Z,https://www.youtube.com/watch?v=p73_VnBBUw0,"If you experienced childhood strife or trauma, you likely have sleep issues or a nervous system that is constantly activated. This is ...",
Sleep Hygiene: The Most Underrated Anti-Aging Tool,W7UFafC5_Lc,Nature's Body,2025-03-13T05:39:18Z,https://www.youtube.com/watch?v=W7UFafC5_Lc,"Quality sleep is one of the most powerful anti-aging tools, supporting cell repair, brain detox, and hormone balance. Try these ...",
"Sleep Hygiene DOs Part-1 | Dr.Anusha, MD |Neuropsychiatry  #drshayara #sleepissues #sleeplessnights",HSBS9KQlBZs,The Samvaad Project,2025-01-07T06:13:59Z,https://www.youtube.com/watch?v=HSBS9KQlBZs,Give Yourself Time to Wind Down | Sleep Hygiene Tips for Better Rest Discover the importance of unwinding before bed to ...,
Sleep Hygiene,eQn4YPhktJQ,Anxiety Gone - Topic,2025-03-10T23:04:14Z,https://www.youtube.com/watch?v=eQn4YPhktJQ,Provided to YouTube by eMuzyka Sleep Hygiene · Anxiety Gone Release the Inner Storm ℗ 2025 Silgoa Music Composer: Simon ...,
