Title,Video ID,Channel,Published At,URL,Description,Video Length,Views,Likes,Comments
The Emotional Toll of Diabetes,mSXuyaOLiuk,FreeStyle US,2025-02-04T18:37:55Z,https://www.youtube.com/watch?v=mSXuyaOLiuk,There are millions of people living with diabetes. But did you know that 40% of people with diabetes have skipped or missed a ...,66,,,
#t1d #type1diabetes #diabetes #fashion #sugar #diabetesmanagement #dress #grwm,V2OpzdzzBm8,Khushi Ahuja,2025-03-06T14:30:07Z,https://www.youtube.com/watch?v=V2OpzdzzBm8,,14,,,
Yoga for diabetes / get sugar level in control #yogafordiabetes  #yogamedicine #therapeuticyoga,QC0DVZcjYKM,Yog healing with Urja ,2025-01-20T10:09:35Z,https://www.youtube.com/watch?v=QC0DVZcjYKM,,10,,,
🌾 Diabetes and Rice?,OXebEZzkZWc,Dr. Shilpa Arora,2025-03-29T08:07:46Z,https://www.youtube.com/watch?v=OXebEZzkZWc,"Diabetes and Rice? . Yes, you can enjoy rice with these tips! . Add 1 tbsp of ghee to your rice for three amazing benefits: 1️⃣ No ...",44,,,
2 Tips for Sugar Control in Telugu || Dr. Deepthi Kareti,i7sbWKkuauw,Dr. Deepthi Kareti,2025-01-04T01:30:21Z,https://www.youtube.com/watch?v=i7sbWKkuauw,What is a normal sugar test? Fast blood sugar is below 100 mg/dl Is 200 blood sugar normal after a meal? 200 mg/dl (11.1 mmol/l) ...,29,,,
"Best food for diabetes control, #bloodsugar, #diabetesdiet, #diabetes",4ocvrIpnfpY,Nature Sehat,2025-01-26T05:00:03Z,https://www.youtube.com/watch?v=4ocvrIpnfpY,Best food for diabetes control What foods to avoid with diabetes Type 2 diabetes food list 10 best foods for diabetics Which foods ...,55,,,
தினமும் ஒரு வெற்றிலை செய்யும் அதிசயம் | Sugar control tips in tamil |Diabetes|Doctor interview tamil,VtqByEiLe_4,Doctor Interview,2025-02-15T04:45:31Z,https://www.youtube.com/watch?v=VtqByEiLe_4,bloodsugar #சுகர் #diabetes #doctorinterview #doctorinterviewtamil #drnithyasiddha #diabetesawareness ...,53,,,
"Best breakfast for diabetic patients, #diabetes, #diabetesawareness, #bloodsugar, #diabetes",VNWuZ9PlkGQ,Nature Sehat,2025-03-03T05:00:21Z,https://www.youtube.com/watch?v=VNWuZ9PlkGQ,diabetespatients breakfast Is it okay for a diabetic to skip breakfast? What should diabetics eat first thing in the morning? क्या ...,46,,,
"5 Low-Sugar Foods for Diabetics, 🍏 Healthy Choices for Blood Sugar Control!",j2GKuO5gwDU,Global ASMR,2025-01-31T09:30:19Z,https://www.youtube.com/watch?v=j2GKuO5gwDU,"Looking for low-sugar foods to help manage diabetes? In this video, we'll reveal 5 of the best low-sugar foods that can help ...",,,,
You DON’T need medication or supplements to reverse insulin resistance (diabetes),IjdVMuEtZeY,Kait Malthaner (BSc Nutrition & Exercise),2025-02-13T18:45:00Z,https://www.youtube.com/watch?v=IjdVMuEtZeY,Do you need to take medication or supplements to reverse insulin resistance? Or can it be done naturally?,40,,,
Can Moringa Help Manage Diabetes? in Telugu || Dr. Deepthi Kareti,mCQ6aC-pDBk,Dr. Deepthi Kareti,2025-02-21T01:30:25Z,https://www.youtube.com/watch?v=mCQ6aC-pDBk,Is moringa good for a diabetic? It has been reported that there is a relation between Moringa and decreased blood sugar levels in ...,47,,,
Diabetes Control करने का अचूक उपाय | Best Health Tips | Acharya Manish Ji #shorts #diabetescontrol,YyS7RVU0Ey4,SD Sangam TV Channel,2025-01-16T10:03:27Z,https://www.youtube.com/watch?v=YyS7RVU0Ey4,Diabetes Control करने का अचूक उपाय | Best Health Tips | Acharya Manish Ji #shorts #diabetescontrol ...,35,,,
What is Insulin Resistance | Is Diabetes Reversible | Diabexy,pz9-TPanTY0,Diabexy,2025-02-06T13:01:10Z,https://www.youtube.com/watch?v=pz9-TPanTY0,Book A Free Diet Consultation With Our Diabetes Reversal Coach by Visiting Our Official Website- www.diabexy.com Or Connect ...,122,,,
Walk to reduce blood sugar levels | Exercise to control diabetes | tip no.4,kwc-K8GtMzg,Longlivelives Hindi,2025-01-09T04:30:20Z,https://www.youtube.com/watch?v=kwc-K8GtMzg,"Take a step toward better health! ‍♂️✨ In this video, we're sharing Tip 4 for managing diabetes and controlling blood sugar ...",55,,,
3 Ways to Balanced Blood Sugar Without Changing Your Diet,yAMBfo8FsAw,Kait Malthaner (BSc Nutrition & Exercise),2025-03-09T18:15:03Z,https://www.youtube.com/watch?v=yAMBfo8FsAw,"Think you need to overhaul your diet to balance blood sugar? Think again! In this video, I'm sharing three powerful ways to ...",52,,,
Real-Time Glucose Monitoring For Diabetes Management,PxGoVrbKy24,The Diabetic Shoppe,2025-02-12T17:40:41Z,https://www.youtube.com/watch?v=PxGoVrbKy24,Discover how a continuous glucose monitor can revolutionize your diabetes management—no more finger pricks! Call The ...,57,,,
"Tips for diabetes patients, #diabetes, #diabetesmanagement",ywkd0brXLWw,Nature Sehat,2025-03-24T05:00:53Z,https://www.youtube.com/watch?v=ywkd0brXLWw,"Tips for diabetics. Diabetes is a lifestyle disease and majorly associated with poor food habits, decreased physical activities, ...",47,,,
"""डायबिटीज में सहायक योगासन | Supportive Yoga for Diabetes Management""",jKFIVSqkKXU,Yogi Yogam,2025-03-04T00:30:34Z,https://www.youtube.com/watch?v=jKFIVSqkKXU,"""डायबिटीज में सहायक योगासन | Supportive Yoga for Diabetes Management"". yoga yoga classes near me ...",59,,,
"Protein for diabetes, #diabetes, #diabetesmanagement",s9CcQt1kWtk,Nature Sehat,2025-01-14T03:00:44Z,https://www.youtube.com/watch?v=s9CcQt1kWtk,protein in almond protein in peanuts protein in pista protein rich food protein for diabetes protein for diabetic patients शुगर ...,118,,,
4 Powerful Yoga Mudras to Control Diabetes Naturally | Balance Sugar Levels & Detox Your Body,kdkA3xdkALE,YOGA SHAKTI,2025-03-02T05:16:18Z,https://www.youtube.com/watch?v=kdkA3xdkALE,"Say Goodbye to High Blood Sugar! These 4 powerful yoga mudras help regulate metabolism, reduce stress, eliminate excess ...",45,,,
Can a diabetic patient eat rice? #diabetes #diabetesmanagement #diabetescare #diabetesfood,tYcNt3my7Ng,ZEN HOSPITAL,2025-01-05T00:30:26Z,https://www.youtube.com/watch?v=tYcNt3my7Ng,"ZEN HOSPITAL HYDERABAD Location: Road No.5, KPHB Colony, Hyderabad, Telangana - 500085 Contact Us: ...",56,,,
What is the Ideal Hba1c range? How to reduce Hba1c levels #diabetesmanagement #sugarcontrol #hba1c,-MJggcrVUQc,Longlivelives Hindi,2025-01-18T04:30:00Z,https://www.youtube.com/watch?v=-MJggcrVUQc,"What is the ideal HbA1c range, and how can you reduce it? ✓ Ideal HbA1c Range: Below 5.7% is considered normal, while ...",49,,,
Natural Diabetes Control Drink| Easy Recipe with Insulin Plant Leaves| Manage Blood Sugar Naturally,A8LWZy-bYlA,The Yoga Institute,2025-01-15T12:30:20Z,https://www.youtube.com/watch?v=A8LWZy-bYlA,Control diabetes naturally with this powerful drink! Hansaji shares an easy-to-make recipe that helps regulate blood sugar levels ...,225,,,
"Tips for diabetics & prediabetes patients , #diabetes, #diabetesmanagement, #bloodsugar, #drjunaid",krGmrr9C5fY,Nature Sehat,2025-03-06T05:00:41Z,https://www.youtube.com/watch?v=krGmrr9C5fY,"Tips for diabetics. Diabetes is a lifestyle disease and majorly associated with poor food habits, decreased physical activities, ...",57,,,
Orange Juice is not good for diabetes management #diabetescontrol #sugarcontrol #diabetesmanagement,h5eUK8OolWk,Longlivelives Hindi,2025-01-21T04:30:14Z,https://www.youtube.com/watch?v=h5eUK8OolWk,"Is orange juice good for diabetes management? The answer is no! Here's why: Fiber is removed during juicing, which means ...",36,,,
#diabetes #diabetichealth #diabeticcare #diabetesmanagement #diabetesawareness #shorts #sakshijiva,kw2cjyQS7Bc,Sakshi Jiva,2025-02-26T12:30:45Z,https://www.youtube.com/watch?v=kw2cjyQS7Bc,"Diabetes symptoms | Signs of all types of diabetes | Shorts | Prof. Sridevi | Sakshi Jiva Namaste, Health Warriors! Welcome to ...",53,,,
"Best drinks for diabetic patients. #diabetes, #diabetesmanagement, #bloodsugar",YGmJASlpbA0,Nature Sehat,2025-01-30T05:00:25Z,https://www.youtube.com/watch?v=YGmJASlpbA0,What is the best drink for diabetics? Which juice is good for diabetes? What is the diabetes drink? diabetes drinks list diabetic ...,70,,,
"Tips for diabetics, 2 fasting mistakes, #diabetes, #diabetesmanagement, #bloodsugar, #drjunaid",fxQxAxQl2d0,Nature Sehat,2025-03-07T05:00:43Z,https://www.youtube.com/watch?v=fxQxAxQl2d0,"Tips for diabetics. Diabetes is a lifestyle disease and majorly associated with poor food habits, decreased physical activities, ...",67,,,
#diabetes #diabetesawareness #diabetesmanagement #diabetescare #diabetessymptoms #sakshijiva,khiEgQLZYH4,Sakshi Jiva,2025-03-07T13:06:14Z,https://www.youtube.com/watch?v=khiEgQLZYH4,"Diabetes symptoms | Signs of all types of diabetes | Shorts | Prof. Sridevi | Sakshi Jiva Namaste, Health Warriors! Welcome to ...",53,,,
"Diabetic foot kya hota hai, #diabetes, #diabetesmanagement, #bloodsugar, #shorts, #doctor",TeWmr1GOzIk,Nature Sehat,2025-02-16T05:00:23Z,https://www.youtube.com/watch?v=TeWmr1GOzIk,What are the symptoms of diabetic foot? How to fix diabetes feet? How to check your foot diabetes? What are the 5 stages of ...,57,,,
"Sugar in urine treatment, पेशाब में शुगर का कारण और इलाज,#diabetes, #diabetesmanagement",UxZbDY_qEc0,Nature Sehat,2025-03-28T05:00:21Z,https://www.youtube.com/watch?v=UxZbDY_qEc0,Sugar in urine पेशाब में शुगर का कारण और इलाज sugar in urine sugar in urine means sugar in urine normal ...,57,,,
"Can diabetic patient eat fish? #diabetes, #bloodsugar, #diabetesmanagement, #drjunaid",lgVH6Hpcibg,Nature Sehat,2025-03-14T05:00:42Z,https://www.youtube.com/watch?v=lgVH6Hpcibg,Which fish is good for diabetic patients? Can fish raise blood sugar? Which fish is not allowed for diabetes? मधुमेह ...,43,,,
sugar control ring kahan milegi sugar control ring diabetic blood magnetic https://amzn.in/d/8n77hxw,-ArpxcVhDlc,Choudhary Acupressure,2025-03-11T06:50:20Z,https://www.youtube.com/watch?v=-ArpxcVhDlc,"https://amzn.in/d/44JXg6D https://amzn.in/d/8n77hxw copy link and buy ring, Link in Bio sugar control ring kahan milegi sugar ...",36,,,
Nursing care plan of parents with Diabetes Mellitus ll Diabetes Patients Care plan,TJ27xOA2o_w,Nursing notes by rubby ahlawat 📚📚,2025-01-28T13:16:51Z,https://www.youtube.com/watch?v=TJ27xOA2o_w,Nursing Care Plan Diabetes Mellitus Care Plan Diabetes Nursing Care Plan Diabetes Management Type 2 Diabetes Nursing ...,21,,,
"Sugar level normal, sugar test range, blood sugar levels, #diabetes, #diabetesmanagement",WWxwSCFwZcA,Nature Sehat,2025-01-22T03:00:22Z,https://www.youtube.com/watch?v=WWxwSCFwZcA,Sugar level normal Sugar tests range Blood sugar levels What is the normal test of sugar? What is a normal blood sugar level?,57,,,
#Foods That Help Prevent Diabetes | Best Foods for Blood Sugar Control,TTh1EDMFAgA,Healthy vibes ,2025-03-02T07:00:14Z,https://www.youtube.com/watch?v=TTh1EDMFAgA,Want to keep diabetes away naturally? Discover the best foods that help regulate blood sugar levels and support a healthy ...,6,,,
"Insulin resistance test, #diabetesmanagement, #diabetes, #type2diabetes, #bloodsugar, #drjunaid",0GoB0QMBajs,Nature Sehat,2025-03-10T05:00:00Z,https://www.youtube.com/watch?v=0GoB0QMBajs,test for insulin production test for insulin resistance test for insulin test to check insulin resistance Insulin test Diabetes types ...,63,,,
#t1d #type1diabetes #type1diabetesawareness #diabetes #trendingshorts #diabetesmanagement,PUyZz_5SEEo,Khushi Ahuja,2025-03-13T16:10:51Z,https://www.youtube.com/watch?v=PUyZz_5SEEo,,5,,,
#diabetes #type1diabetes #trending #outfit #diabetesmanagement #t1d #fashion,uhDuWowUiVU,Khushi Ahuja,2025-03-31T12:51:38Z,https://www.youtube.com/watch?v=uhDuWowUiVU,,9,,,
"""Managing Diabetes with Natural Remedies#shorts#movie#subscribe",1Pig2rpemj0,ClipMend,2025-03-26T06:00:01Z,https://www.youtube.com/watch?v=1Pig2rpemj0,,45,,,
"Insulin resistance test, C-peptide, #diabetesmanagement, #diabetes, #bloodsugar, #drjunaid",4LzB3i2kLTI,Nature Sehat,2025-03-09T05:00:04Z,https://www.youtube.com/watch?v=4LzB3i2kLTI,test for insulin production test for insulin resistance test for insulin test to check insulin resistance Insulin test Diabetes types ...,57,,,
3 Reasons FENUGREEK Is A GAMECHANGER For DIABETES Management,0YXa5Aafg5Q,Longlivelives Hindi,2025-03-07T12:30:01Z,https://www.youtube.com/watch?v=0YXa5Aafg5Q,Did you know fenugreek can help manage blood sugar levels? ✨ Discover how this powerful herb benefits people with ...,79,,,
We all go through this!  #t1d #diabetes #type1diabetes #trending #diabetesmanagement #anxiety,uIpmCb84Uzg,Khushi Ahuja,2025-03-19T16:17:55Z,https://www.youtube.com/watch?v=uIpmCb84Uzg,,17,,,
"Stop Sugar Craving, मीठा खाने का सही तरीका , #diabetes , #diabetesmanagement",iQGcr4SkOF8,Nature Sehat,2025-01-11T11:48:05Z,https://www.youtube.com/watch?v=iQGcr4SkOF8,How do I stop sugar cravings? What should I eat if crave sugar? What is the medical reason for sugar cravings? Do type 2 ...,65,,,
Diabetes वाले भूलकर भी न खाएँ ये Fruit #diabetesmanagement #diabetes #diabetesawareness,jteFUqC8Vr8,Kushvvendra Singh Chauhan,2025-03-29T14:11:50Z,https://www.youtube.com/watch?v=jteFUqC8Vr8,This is one of the most misunderstood fruit by people having DIABETES. Please understand Glycemic index to get picture clear in ...,47,,,
#diabetesawareness #diabetesmanagement #food #glycemicindex,PK6_sCQUILs,Ashraf Chaudhry Official,2025-03-22T11:08:43Z,https://www.youtube.com/watch?v=PK6_sCQUILs,,63,,,
Prevent Diabetes Amputation: Foot Care Tips! #diabetesawareness #diabetescare #doctor #shorts,2p-Hs0rrilk,மெய் நலம்,2025-03-09T04:53:32Z,https://www.youtube.com/watch?v=2p-Hs0rrilk,Dr. A.N. Aravind M.D. explains how diabetes can lead to foot ulcers and amputations. Learn key prevention tips for diabetic foot ...,36,,,
Shocking 😯🫣 #diabetes #sugar #diabetesawareness #diabetesmanagement #diabetescare #anxiety #health,Q7pYXxI5PwE,Hello Doctor Talks,2025-03-22T06:27:34Z,https://www.youtube.com/watch?v=Q7pYXxI5PwE,,10,,,
Mindful Eating: Stress Reduction for Diabetes Management,2_KTWHWYxnY,GLUCOSE BALANCED BITES,2025-03-11T00:00:02Z,https://www.youtube.com/watch?v=2_KTWHWYxnY,This script focuses on stress reduction through mindful eating for individuals with diabetes. It highlights techniques like savoring ...,42,,,
Crucial Role of Diet in Diabetes Management #shorts #AddiiMedTalks,frRxPZX4oJ4,Addii Biotech,2025-01-23T10:30:57Z,https://www.youtube.com/watch?v=frRxPZX4oJ4,Crucial Role of Diet in Diabetes Management #BalancedDiet #EatSmartLiveWell #DiabetesManagement.,59,,,
Blood Sugar Control Daily ideas l Cashew nuts For Diabetics l #diabetes #bloodsugardiet #viralshort,PrQm7Vtbf2E,Dr. Sheherbano Official ,2025-01-06T08:28:16Z,https://www.youtube.com/watch?v=PrQm7Vtbf2E,,17,,,
3 days diabetes workshop in bhubaneswar  #diabetes #diabetescare #drguru,2pWVUhkd3Tc, Dr Gurukrushna  (ODIA),2025-03-24T07:06:11Z,https://www.youtube.com/watch?v=2pWVUhkd3Tc,"3 days diabetes workshop in bhubaneswar Contact For More Information: ☎️ 7608819477, 70087 29818. Follow US on social ...",51,,,
Breakfast at Diabetes conference #diabetesmanagement #bloodsugar #tamilhealthtips @DrPal #cgm,kOTc8MT3yqQ,Incredible Insulin,2025-03-24T10:00:56Z,https://www.youtube.com/watch?v=kOTc8MT3yqQ,canadatamil #canadatamilvlog #shortsfeed #tamilshorts #diabetestamil #diabetes #continuousglucosemonitor.,45,,,
Diabetes Management through Yoga | Simple and Effective Poses | Sandhyavandanam yoga,a5Gn2Kakc3M,Sandhyavandanam yoga,2025-01-14T02:06:10Z,https://www.youtube.com/watch?v=a5Gn2Kakc3M,Diabetes Management through Yoga | Simple and Effective Poses | Sandhyavandanam yoga DISCLAIMER: The information ...,231,,,
#diabetesawareness #diabetesmanagement #walk #healthylifestyle,dLpN9hdO75Q,Ashraf Chaudhry Official,2025-01-09T04:01:41Z,https://www.youtube.com/watch?v=dLpN9hdO75Q,,48,,,
Yoga for #diabetes #abdomen #yogaforbeinners #yogafordiabetes #diabetesmanagement @yogatute #yoga,aeImg5-e2Rs,YogaTute Health,2025-03-08T10:30:01Z,https://www.youtube.com/watch?v=aeImg5-e2Rs,Join our upcoming free online yoga sessions—click the link  ‍♂    ‍♂ https://tinyurl.com/yth-online/ #yogatute #meditation ...,59,,,
Sugar nhi ho rhi control | ye Home remedy kro try #diabetes #sugarcontrol #homeremedy #subhashgoyal,WwK_J4h38I8,Subhash Goyal Shorts,2025-02-12T13:30:30Z,https://www.youtube.com/watch?v=WwK_J4h38I8,Expert Tips by Vaidban MD Subhash Goyal Diabetes ka natural ilaj | Blood Sugar Control Tips Vaidban Ayurved Bhawan ke ...,59,,,
Did you know this? 🤷‍♂️ #diabetes #diabetic #t1d #diabetesmanagement #t1 #driving #t1dlife #didyou,JnGpuzgJT2c,Johnny Bailey,2025-03-17T21:14:24Z,https://www.youtube.com/watch?v=JnGpuzgJT2c,,8,,,
#diabetesdiet #healthydiet #diabetesawareness #diabetesmanagement,eX9pd-gjXsk,Ashraf Chaudhry Official,2025-01-06T10:00:41Z,https://www.youtube.com/watch?v=eX9pd-gjXsk,Stay Connected With Us! Website: https://fatehziabeetus.com/ Facebook: ...,50,,,
Danger signs of Diabetes Low sugar - Hypoglycemia #shorts #diabetesmanagement,z3yS8zD5_3E,Dr Ramprasad Kancherla,2025-02-19T12:31:02Z,https://www.youtube.com/watch?v=z3yS8zD5_3E,"Dr Ramprasad Kancherla MS (ORTHO) AIIMS New Delhi, FAOA (Aus) A1 Amar orthopaedic hospital Kothapet Guntur (AP) ...",35,,,
#diabetes #sugarcontrol #diabetesmanagement #sugarfreeliving #homeopathy #drchetangupta,VkYLSeUOAKA,Dr-Chetan gupta,2025-02-26T15:37:16Z,https://www.youtube.com/watch?v=VkYLSeUOAKA,,50,,,
KT Tape CGM Patch: Comfortable and Durable Diabetes Management for Active Lifestyles,dnymE9Fl82Q,KT Tape,2025-01-17T18:00:24Z,https://www.youtube.com/watch?v=dnymE9Fl82Q,"Managing diabetes is a continuous journey, and every step counts. That's why we're proud to offer the KT Tape CGM Patch, ...",10,,,
10 Low-Sugar Foods To Managing Diabetes #healthyeating #food #diabetes,KmyOABB6ais,Stable Health ,2025-01-29T19:08:27Z,https://www.youtube.com/watch?v=KmyOABB6ais,Discover 10 low-sugar foods that help manage diabetes and keep your blood sugar levels in check. These healthy and delicious ...,45,,,
THESE 4 exercises WILL REVERSE your prediabetes. #diabetesmanagement #motivation #diabetes,EFb7-UZ-eZE,Online Metabolic Restoration Coach ,2025-03-13T02:31:50Z,https://www.youtube.com/watch?v=EFb7-UZ-eZE,,15,,,
#diabetes #healthylifestyle #diabetesawareness #diabetesmanagement #90daychallenge,TJZdZpf7mn4,Ashraf Chaudhry Official,2025-01-22T05:16:22Z,https://www.youtube.com/watch?v=TJZdZpf7mn4,,36,,,
Still struggling with blood sugar spikes? #DiabetesManagement #BloodSugarControl,SF5IXq5eHXs,FTF WARRIOR,2025-03-10T19:28:37Z,https://www.youtube.com/watch?v=SF5IXq5eHXs,,60,,,
#diabetesmanagement #ashrafchaudhryofficial #healthylifestyle #sugarcontrol,abaaJdr7MQ8,Ashraf Chaudhry Official,2025-03-23T10:56:43Z,https://www.youtube.com/watch?v=abaaJdr7MQ8,,170,,,
Get to know the systems of diabetes!  #diabetesawareness #diabeteseducation #DiabetesManagement,uJJxZwhq4zc,ANOOP GUPTA- DIABETES REVERSAL COACH,2025-02-04T12:10:02Z,https://www.youtube.com/watch?v=uJJxZwhq4zc,anoopgupta #diabetesreversal #digestivesystem Get to know the systems of diabetes! Learn how to take control of your health ...,47,,,
Right Diet for Diabetes #diabetes #diabetic #diabetesawareness #diabetesmanagement #shorts,uJNHW7BMWag,Threedhealth24,2025-02-19T12:02:00Z,https://www.youtube.com/watch?v=uJNHW7BMWag,,42,,,
Glucose Control and Diabetes Management: Top 10 Tips for 2025,K2RawJxd7X8,Taking Control Of Your Diabetes,2025-01-21T18:24:31Z,https://www.youtube.com/watch?v=K2RawJxd7X8,Did you know that staying proactive with glucose control can help you avoid dangerous highs and lows? Are you monitoring your ...,48,,,
Effective Diabetes Care Yoga Routine,lC5cA32VFsk,Namaste Yoga Classes,2025-01-25T06:30:26Z,https://www.youtube.com/watch?v=lC5cA32VFsk,"Struggling to manage diabetes? You're not alone, but there's a way to take control naturally! This quick 7-Minute Yoga Routine ...",37,,,
80 % aholimizda bu kasallik bor ! #diabetes #diabetesmanagement #diabetic #thyroid #thyroidproblems,of7bEaLKaas,Great channel,2025-03-19T09:56:06Z,https://www.youtube.com/watch?v=of7bEaLKaas,diabetes #diabetesmanagement #diabetic #glucosa #qandlidiabet #thyroid #thyroidproblems #endocrinology.,16,,,
10 Tips for Diabetes Management in 2025: Strength Training,fmGjsWro3_0,Taking Control Of Your Diabetes,2025-01-18T21:14:22Z,https://www.youtube.com/watch?v=fmGjsWro3_0,"Did you know that building muscle can help you lower blood sugars, boost your metabolism, and keep you strong as you age?",59,,,
Sonam Kapoor has been managing type 1 diabetes since 17,NPtnCVkts3Y,Diabesmart,2025-02-06T19:10:39Z,https://www.youtube.com/watch?v=NPtnCVkts3Y,"Her diet choices prove it's all about balance! From oat milk to soaked nuts, these diabetes-friendly meals are packed with nutrients ...",57,,,
Diabetes management: one size does not fit all,9nKsWF8CBe4,Care For Diabetes - Dr Suhail M Marfani,2025-03-10T14:19:05Z,https://www.youtube.com/watch?v=9nKsWF8CBe4,Every diabetic should know what targets in blood glucose is required and safe for himself/herself. #diabeteslifestyle ...,28,,,
HOW TO PREVENT FOOT ULCER IN DIABETES #diabetes #diabetesmanagement #health #foot,T5G3feZnppM,Dr Shivaa Mohan,2025-01-16T10:39:28Z,https://www.youtube.com/watch?v=T5G3feZnppM,,58,,,
#diabetesawareness #diabetesmanagement #ashrafchaudhryofficial #healthylifestyle,ryWzT8RD-MY,Ashraf Chaudhry Official,2025-03-30T11:05:14Z,https://www.youtube.com/watch?v=ryWzT8RD-MY,,100,,,
Managing Blood Pressure: Top 10 Tips for Diabetes Management in 2025,mpFFRomYNuc,Taking Control Of Your Diabetes,2025-01-24T21:36:24Z,https://www.youtube.com/watch?v=mpFFRomYNuc,Did you know that managing your blood pressure can lower your risk of heart disease and stroke? Are you staying proactive about ...,60,,,
Harnessing Prebiotics for Better Diabetes Management,w2G1rhYAzQo,GLUCOSE BALANCED BITES,2025-03-30T00:00:50Z,https://www.youtube.com/watch?v=w2G1rhYAzQo,Discover how prebiotics can play a crucial role in diabetes management and learn some food sources rich in these beneficial ...,44,,,
Is Amla Really a Superfood for Diabetes Management? Let's Find Out @besugarfit,m5Hp-5pnTlA,besugarfit,2025-02-07T02:30:30Z,https://www.youtube.com/watch?v=m5Hp-5pnTlA,BOOK a FREE CONSULTATION to know how you can reverse diabetes with sugarfit: http://bit.ly/3WupQgk Subscribe to besugarfit ...,44,,,
Vestige Diabetes Supplement | Natural Sugar Control & Blood Sugar Regulation |Best Diabetes Products,C3oBvpoqXRg,Shailendra Singh Aanjna,2025-03-27T05:01:02Z,https://www.youtube.com/watch?v=C3oBvpoqXRg,ShailendraSinghAanjna Vestige Diabetes Supplement | Natural Sugar Control & Blood Sugar Regulation | Best Diabetes ...,181,,,
Is Amla Really a Superfood for Diabetes Management? Let's Find Out @besugarfit,m5Hp-5pnTlA,besugarfit,2025-02-07T02:30:30Z,https://www.youtube.com/watch?v=m5Hp-5pnTlA,BOOK a FREE CONSULTATION to know how you can reverse diabetes with sugarfit: http://bit.ly/3WupQgk Subscribe to besugarfit ...,44,,,
Vestige Diabetes Supplement | Natural Sugar Control & Blood Sugar Regulation |Best Diabetes Products,C3oBvpoqXRg,Shailendra Singh Aanjna,2025-03-27T05:01:02Z,https://www.youtube.com/watch?v=C3oBvpoqXRg,ShailendraSinghAanjna Vestige Diabetes Supplement | Natural Sugar Control & Blood Sugar Regulation | Best Diabetes ...,181,,,
Life With Diabetes #diabetes #diabetesmanagement,04oXvRm_KoA,Sonya Jo's Makeup,2025-03-09T13:03:35Z,https://www.youtube.com/watch?v=04oXvRm_KoA,"We are not medical professionals, we simply LIVE WITH DIABETES! This is not a video to shame anyone who takes more ...",52,,,
Diabetes management by Dr Tapan Shah,_TelGWyXLrY,Tapan Shah,2025-02-04T11:05:49Z,https://www.youtube.com/watch?v=_TelGWyXLrY,"22 crore people in India are suffering from Diabetes and we can potentiate our fight against it by lifestyle measures. Recently, we ...",79,,,
It's all abt making the right choices in life #aishwaryasakhuja #diabetesmanagement #type1diabetes,4_ziK7lrJSE,Rohit & Aishwarya Vlogs,2025-01-13T13:18:39Z,https://www.youtube.com/watch?v=4_ziK7lrJSE,,39,,,
Broccoli: A Diabetes Superstar! #superfoods #diabetes #diabetesmanagement #bloodsugar,HLByTP8jJkY,Fit & Nourished Health,2025-03-21T23:35:13Z,https://www.youtube.com/watch?v=HLByTP8jJkY,Watch the complete video here https://youtu.be/PqR_0gwVa3c.,51,,,
Don’t Juice Grapes If You Have Diabetes #diabetescare #diabetesmanagement #grapejuice #healthylife,EE13rg-UqRU,Timmy Daniel,2025-02-17T12:04:58Z,https://www.youtube.com/watch?v=EE13rg-UqRU,,49,,,
Gestational Diabetes: क्या है और कैसे मैनेज करें? #pregnancy #diabetes #pristyncare,_0A_GQiO56E,Pristyn Care Surgeries,2025-02-11T13:30:23Z,https://www.youtube.com/watch?v=_0A_GQiO56E,Gestational Diabetes: क्या है और कैसे मैनेज करें? Call us at 636-6528-306 to schedule your consultation.,60,,,
#managingdiabetesnaturally #diabetesdiet #diabetes #food #diabeteshealth #health #diabetesmanagement,E_YutReitMc,Jothiprakash,2025-02-26T13:54:34Z,https://www.youtube.com/watch?v=E_YutReitMc,,13,,,
Top 9 Superfoods for Diabetes Management!,NWSi_HGcDPU,Fuel of Thought,2025-01-25T10:23:00Z,https://www.youtube.com/watch?v=NWSi_HGcDPU,What are the best foods for diabetics? Here's the top 9 nutrient-packed options that help manage blood sugar and promote overall ...,59,,,
