Title,Video ID,Channel,Published At,URL,Description,Video Length
#bloodpressure #highbloodpressure #bloodpressurecontrol #homeopathy #drchetangupta #viralshorts,58fwULsIBRw,Dr-Chetan gupta,2025-03-29T15:31:02Z,https://www.youtube.com/watch?v=58fwULsIBRw,,
#unwantedhair #unwantedhairremoval #unwantedhairremove #homeopathy #drchetangupta,-wCZ4ElD3AI,Dr-Chetan gupta,2025-01-07T12:29:17Z,https://www.youtube.com/watch?v=-wCZ4ElD3AI,,
Symptoms of Alcoholic Fatty Liver -- Dr P S Tiwari #homeopathy,ZqdMsaB_PqY,Dr P S Tiwari,2025-01-21T13:00:50Z,https://www.youtube.com/watch?v=ZqdMsaB_PqY,Welcome to another video from Dr. P.S Tiwari. Today I'll be talking about Symptoms of Alcoholic Fatty Liver. ▻ Dr P S Tiwari ...,
Severe Period PAIN ? Dr P S Tiwari #homeopathy,ZDKa8PasEAw,Dr P S Tiwari (Shorts),2025-01-05T13:30:15Z,https://www.youtube.com/watch?v=ZDKa8PasEAw,Welcome to another video from Dr. P.S Tiwari. Today's video is about Severe Period pain and its homeopathy medicine.,
Ans to GTR 17 #gtr #materiamedica #funwaytolearn #homeopathy #homeopathicmedicine #bhms #remedies,aih6yXzMS3w,Grace Homeopathy Clinic,2025-03-16T04:30:02Z,https://www.youtube.com/watch?v=aih6yXzMS3w,AAROHAN REGISTRATION LINK https://forms.gle/LtcqxeWsEpMjX75bA Guess the remedy and comment. ✨:HHF:✨ ...,
Skin Complaints - mezereum #homeopathy #medicine #shorts,rPBakzKVgL0,Dr warsi homeopathy,2025-03-17T15:33:39Z,https://www.youtube.com/watch?v=rPBakzKVgL0,Homoeopathic medicine Mezereum Uses l Skin Complaints.,
Asafoetida. 1 minute learning. #bhms #homeopathy #homeopathyeducation #homeopathicmedicine,BqQJjrQD2zw,Dr Priyanka Lathkar,2025-02-06T11:07:13Z,https://www.youtube.com/watch?v=BqQJjrQD2zw,"Asafoetida, we call Hing in Hindi and we know how much it is used and helps in building our health. It's wonderful when it comes ...",
#stretchmarks #stretchmarksremoval #stretchmarktreatment #homeopathy #drchetangupta,1EDl8eIhbCM,Dr-Chetan gupta,2025-01-10T05:55:38Z,https://www.youtube.com/watch?v=1EDl8eIhbCM,,
Insomnia ki best #homeopathy medicine kya hai ? Dr P S Tiwari,bu6cY3a26K8,Dr P S Tiwari (Shorts),2025-03-21T13:30:33Z,https://www.youtube.com/watch?v=bu6cY3a26K8,Welcome to another video from Dr. P.S Tiwari. Today's video is about Insomnia. FOR BOOKING APPOINTMENT ...,
Best #homeopathy medicine for Gastric Problem -- Dr P S Tiwari,Xoj-V6R5Ht4,Dr P S Tiwari (Shorts),2025-03-15T13:30:30Z,https://www.youtube.com/watch?v=Xoj-V6R5Ht4,Welcome to another video from Dr. P.S Tiwari. Today's video is about Gastric Problem. FOR BOOKING APPOINTMENT ...,
Dog skin problems fully cured by homeopathy,TyQghYfPExk,dog and vet,2025-02-11T12:30:33Z,https://www.youtube.com/watch?v=TyQghYfPExk,,
Best #homeopathy medicine for Stress -- Dr P S Tiwari,S57Oy2nRqT0,Dr P S Tiwari (Shorts),2025-03-18T13:30:17Z,https://www.youtube.com/watch?v=S57Oy2nRqT0,Welcome to another video from Dr. P.S Tiwari. Today's video is about Stress. FOR BOOKING APPOINTMENT ...,
#gallstone #gallstones #gallstonetreatment #liverhealth #homeopathy #homeopathydr #drchetangupta,cTaqOlAL1ss,Dr-Chetan gupta,2025-02-27T15:36:16Z,https://www.youtube.com/watch?v=cTaqOlAL1ss,,
Chamomilla 200 benefits | Chamomilla 200 use in hindi #homeopathy,Tv1qs-n3cSw,Hakeem saddam official,2025-01-01T13:33:43Z,https://www.youtube.com/watch?v=Tv1qs-n3cSw,Chamomilla 200 benefits | Chamomilla 200 use in hindi #homeopathy Hi I'm hakeem saddam welcome to my YouTube channel ...,
Homeopathic medicine for Vitamin D,eBXkXeo6ZC0,Dr Asim Raza (Homeopathic Physician),2025-03-04T17:24:13Z,https://www.youtube.com/watch?v=eBXkXeo6ZC0,"""Homeopathic Vitamin D – A natural way to support bone strength, immunity, and overall well-being! It helps in calcium absorption ...",
Homeopathic Remedy for Excessive Perspiration and Nervous Disorders | Reckeweg R32,WLTTt5tGmiA,Sunny Health Capsule,2025-01-02T12:30:27Z,https://www.youtube.com/watch?v=WLTTt5tGmiA,Homeopathic Remedy for Excessive Perspiration and Nervous Disorders | Reckeweg R32 Reckeweg R32 Excessive perspiration ...,
Piper nigrum for gastritis hand flatulence homeopathy mother tincture,eMT5uJiq-Ik,Usha Homeopathy Telugu,2025-03-24T16:40:19Z,https://www.youtube.com/watch?v=eMT5uJiq-Ik,Piper nigrum for gastritis hand flatulence homeopathy mother tincture . https://youtu.be/hrOxQLxm2Mo?si=5tjT_YtP1rf6BuJb YOU ...,
Homeopathic medicine |How to SKIP PERIODS with Homeopathy? Delay #periods #menses -Dr.Surekha Tiwari,pSO5TBBLQF4,Doctors' Circle World's Largest Health Platform,2025-01-12T13:30:34Z,https://www.youtube.com/watch?v=pSO5TBBLQF4,Subscribe to https://www.youtube.com/@doctors-circle - World's Largest Health Platform ...,
Brahm homeopathy healing and research centre | Homeopathy hospital near me | Brahm homeopathy Review,fvkNWD2NxDg,DR PRADEEP KUSHWAHA - BRAHM HOMEOPATHY,2025-02-11T07:32:41Z,https://www.youtube.com/watch?v=fvkNWD2NxDg,,
Ans to GTR16 #gtr #materiamedica #funwaytolearn #homeopathy #homeopathicmedicine #bhms #remedies,fbZiB6fxcyM,Grace Homeopathy Clinic,2025-03-06T17:31:41Z,https://www.youtube.com/watch?v=fbZiB6fxcyM,Guess the remedy and comment. ✨:HHF:✨ APPLICABLE ✓ REPLICABLE ✓ EASY ✓ FUN ✓ HOMEOPATHY ❤❤❤ Dr. JOWIN ...,
Cholesterinum 4 best usaes کولیسٹرینم कोलेस्ट्रीनम Homeopathic uses in urdu /hindi,8uADGYS620A,Infertility Dr. Waqar Bhutta,2025-03-18T11:35:05Z,https://www.youtube.com/watch?v=8uADGYS620A,"Discover the powerful homeopathic uses of Cholesterinum in this in-depth video! Learn how this natural remedy, derived from ...",
Preventive steps for Fatty Liver Disease -- Dr P S Tiwari #homeopathy,YHpQr6I_mnM,Dr P S Tiwari (Shorts),2025-03-24T13:30:22Z,https://www.youtube.com/watch?v=YHpQr6I_mnM,Welcome to another video from Dr. P.S Tiwari. Today's video is about Preventive steps for Fatty Liver Disease. FOR BOOKING ...,
Thuja cream ke fayde in hindi | Thuja Homeopathic Medicine for moles | Thuja ointment | warts cream,dW1SPdzak6k,Dr. Aarti Mishra Health • 100k views • 1 hour ago.,2025-02-23T14:57:40Z,https://www.youtube.com/watch?v=dW1SPdzak6k,Thuja cream ke fayde in hindi | Thuja Homeopathic Medicine for moles | Thuja ointment | warts cream.,
#alcoholaddiction #alcoholawareness #alcoholfree #homeopathy #homeopathydr #drchetangupta,vzHHzSk3z_A,Dr-Chetan gupta,2025-02-21T15:34:20Z,https://www.youtube.com/watch?v=vzHHzSk3z_A,,
PAIN KILLER IN HOMEOPATHY ? दर्द का इलाज क्या हैं ? दर्द निवारक 3 होम्योपैथिक दवाएं,qe99yMNEiEU,Dr. Arpana Samanta,2025-03-07T15:01:10Z,https://www.youtube.com/watch?v=qe99yMNEiEU,"Dr. Arpana Samanta, Homeopathic Doctor (Gold Medalist) from New Delhi, talks about Health And Lifestyle Related Tips, ...",
P Banerjee’s Advance homeopathy centre Rashbehari te Amra gelam || FeesStructure ||Spencer 4thfloor,uIZcC4ONStQ,Rumela & U,2025-02-01T05:18:53Z,https://www.youtube.com/watch?v=uIZcC4ONStQ,,
शीघ्रपतन! Premature Ejaculation Homeopathic Medicine! Selenium 30 Uses #shorts #homeopathy,FWUP491vWtw,DR RATNESH KUMAR SINGH,2025-02-20T14:20:00Z,https://www.youtube.com/watch?v=FWUP491vWtw,शीघ्रपतन! Premature Ejaculation Homeopathic Medicine! Selenium 30 Uses #shorts #homeopathy #youtubeshorts #short ...,
Psoralea corylifolia homeopathic medicine uses & benefits in hindi !!,M4qAjydY0K4,Dr.Shashi Boricha Homeopathy,2025-02-17T06:41:06Z,https://www.youtube.com/watch?v=M4qAjydY0K4,,
Homeopathy doctor just 499₹ knee pain join pain cured without surgery #kavyatheblogger #homeopathy,RSWHH_5Mv98,Kavya the Blogger,2025-03-06T04:29:50Z,https://www.youtube.com/watch?v=RSWHH_5Mv98,kavyatheblogger #homeopathy #doctor Follow @kavyatheblogger @thekavyastories @kavyaproperties23 #homeopathy ...,
Homeopathy may help to avoid surgery for Uterine Fibroids,qT2jZxuS7fc,Life Force Homeopathy,2025-02-28T18:29:22Z,https://www.youtube.com/watch?v=qT2jZxuS7fc,,
Gas ho jaayega Bilkul khatam 😀 #shorts #ytshorts #homeopathy #health #doctor,WESMZqi9Gcc,Tiwari G Talk Show,2025-03-20T13:10:36Z,https://www.youtube.com/watch?v=WESMZqi9Gcc,,
Power gesic syrup | Power gesic syrup homeopathic uses in hindi | Power gesic,PbIJAgGoqy0,Samrat Homeo,2025-01-04T12:29:02Z,https://www.youtube.com/watch?v=PbIJAgGoqy0,Power gesic syrup | Power gesic syrup homeopathic uses in hindi | Power gesic सम्राट होम्यो में आपका ...,
Origanum Majorana Homeopathic Medicine|अत्यधिक हस्तमैथुन के बुरे प्रभावों को ठीक किया जाता हैं,wBrtOzLMOew,Homeo Health : Dr. Jyoti,2025-01-28T12:36:29Z,https://www.youtube.com/watch?v=wBrtOzLMOew,To buy this medicine click here: ...,
Vomiting during journey #drspdeyy #alternativemedicine #homeopathy #siliguri #besthomeopathydoctor,IFOFYy4luvU,"Dr S P Deyy - Health, Healing & Homeopathy",2025-01-07T11:23:28Z,https://www.youtube.com/watch?v=IFOFYy4luvU,,
Ans to GTR15 #gtr #materiamedica #funwaytolearn #homeopathy #homeopathicmedicine #bhms #remedies,ClqxP7g6j7g,Grace Homeopathy Clinic,2025-02-27T06:20:55Z,https://www.youtube.com/watch?v=ClqxP7g6j7g,Guess the remedy and comment. ✨:HHF:✨ APPLICABLE ✓ REPLICABLE ✓ EASY ✓ FUN ✓ HOMEOPATHY ❤❤❤ Dr. JOWIN ...,
Ans to GTR15 #gtr #materiamedica #funwaytolearn #homeopathy #homeopathicmedicine #bhms #remedies,ClqxP7g6j7g,Grace Homeopathy Clinic,2025-02-27T06:20:55Z,https://www.youtube.com/watch?v=ClqxP7g6j7g,Guess the remedy and comment. ✨:HHF:✨ APPLICABLE ✓ REPLICABLE ✓ EASY ✓ FUN ✓ HOMEOPATHY ❤❤❤ Dr. JOWIN ...,
Petroleum 30: ठंड में फटी त्वचा का रामबाण इलाज Best Homeopathic Medicine #winter #dryskin #skincare,T8KDi0Kfqh0,Dr. Leepika's HomeoHealth,2025-01-07T12:22:40Z,https://www.youtube.com/watch?v=T8KDi0Kfqh0,ठंड में त्वचा रोगों का समाधान! Dry aur cracked skin ke liye Dr. Leepika Mehta | Appointment booking ...,
Does massage help varicose veins ? Dr P S Tiwari #homeopathy,QOWVRCgiet0,Dr P S Tiwari (Shorts),2025-01-26T13:30:15Z,https://www.youtube.com/watch?v=QOWVRCgiet0,Welcome to another video from Dr. P.S Tiwari. Today's video is about Does massage help varicose veins ? FOR BOOKING ...,
Best #homeopathy medicine for Dwarfism (बौनापन) -- Dr P S Tiwari,dpeVNTL_bfQ,Dr P S Tiwari (Shorts),2025-01-08T13:30:22Z,https://www.youtube.com/watch?v=dpeVNTL_bfQ,Welcome to another video from Dr. P.S Tiwari. Today's video is about Dwarfism (बौनापन) and its homeopathy medicine.,
STEPS to prevent FATTY Liver ? Dr P S Tiwari #homeopathy,wyGtQGgUKsc,Dr P S Tiwari (Shorts),2025-02-07T13:30:43Z,https://www.youtube.com/watch?v=wyGtQGgUKsc,Welcome to another video from Dr. P.S Tiwari. Today's video is about STEPS to prevent FATTY Liver ? FOR BOOKING ...,
Sign and Symptoms of Fistula -- Dr P S Tiwari #homeopathy,GfPFrJfk190,Dr P S Tiwari,2025-02-11T13:00:19Z,https://www.youtube.com/watch?v=GfPFrJfk190,Welcome to another video from Dr. P.S Tiwari. Today I'll be talking about Sign and Symptoms of Fistula. ▻ Dr P S Tiwari (Shorts) ...,
Can you ignore Fatty Liver? Dr P S Tiwari #homeopathy,mh4nyXTBMqY,Dr P S Tiwari (Shorts),2025-02-13T13:30:37Z,https://www.youtube.com/watch?v=mh4nyXTBMqY,Welcome to another video from Dr. P.S Tiwari. Today's video is about Can you ignore Fatty Liver? FOR BOOKING APPOINTMENT ...,
दस्त की होम्योपैथिक दवा! Diarrhoea Homeopathic Medicine! Podophyllum 30 Uses #shorts #youtubeshorts,p8NR87k8Nn8,VNS HOMEOPATHY ,2025-01-15T12:30:52Z,https://www.youtube.com/watch?v=p8NR87k8Nn8,दस्त की होम्योपैथिक दवा! Diarrhoea Homeopathic Medicine! Podophyllum 30 Uses #shorts #youtubeshorts ...,
AIAPGET #aiapget #aiapget2025 #ayurveda #unani #homeopathy AIAPGET exam date,ZHyMiPSdQNQ,Unani Encyclopaedia: For AIAPGET & Academics,2025-03-06T10:59:09Z,https://www.youtube.com/watch?v=ZHyMiPSdQNQ,AIAPGET #aiapget #aiapget2025 #ayurveda #unani #homeopathy AIAPGET exam date.,
एलर्जिक-अस्थमा का हुआ Advance होम्योपैथी से असरदार इलाज #allergy #allergicrhinitis #homeopathy,fTPA4ocmCdQ,PDM Homeopathy Hospital,2025-03-06T13:45:04Z,https://www.youtube.com/watch?v=fTPA4ocmCdQ,PDM JAIPUR (Group of Advance Homeopathy Hospital) PDM Advance Homeopathy से पाएं स्थायी और ...,
Homeopathy medicine safe क्यों होती हैं। #podcasts #medicine #homeopathy #shorts #homeopathytips,6hLQtP62kTg,You and I Talk show,2025-01-04T23:30:02Z,https://www.youtube.com/watch?v=6hLQtP62kTg,Homeopathy medicine safe क्यों होती हैं। #podcasts #medicine #homeopathy #shorts #homeopathytips ...,
Top medicine for back pain #healthadvice #trendingshorts #homeopathy #viralshorts #topviral,dz8a4k51A6Y,Dr Santosh health tips,2025-03-13T03:41:32Z,https://www.youtube.com/watch?v=dz8a4k51A6Y,,
Can Fatty Liver Cause Cancer? Dr P S Tiwari #homeopathy,24ZjyYZ99VU,Dr P S Tiwari (Shorts),2025-02-10T13:30:00Z,https://www.youtube.com/watch?v=24ZjyYZ99VU,Welcome to another video from Dr. P.S Tiwari. Today's video is about Can Fatty Liver Cause Cancer? FOR BOOKING ...,
Dangerous triangle of face #homeopathy,uIXmYJS6VUI,Dr AMAN PANDEY,2025-01-13T02:39:24Z,https://www.youtube.com/watch?v=uIXmYJS6VUI,,
# #drspdeyy #homeopathy #besthomeopathicdoctor #india #siliguri #aciditymedicine,F-_QsFI9M5o,"Dr S P Deyy - Health, Healing & Homeopathy",2025-03-24T17:04:47Z,https://www.youtube.com/watch?v=F-_QsFI9M5o,,
Can WALKING help Varicose Veins ? Dr P S Tiwari #homeopathy,BqcMKCtqud4,Dr P S Tiwari (Shorts),2025-01-14T13:30:06Z,https://www.youtube.com/watch?v=BqcMKCtqud4,Welcome to another video from Dr. P.S Tiwari. Today's video is about Can walking help varicose veins. FOR BOOKING ...,
Preventive Homeopathic Medicine for Chicken Pox #homeopathy,MUhKBYZoTfI,Dr Ravi Health & Homeopathy ,2025-02-16T04:30:15Z,https://www.youtube.com/watch?v=MUhKBYZoTfI,Preventive Homeopathic Medicine for Chicken Pox #homeopathy 1. Chicken pox 2. Homeopathic medicine 3. Preventive ...,
Are Varicose Veins always painful -- Dr P S Tiwari #homeopathy,Nl0E05ZGvn8,Dr P S Tiwari (Shorts),2025-03-27T13:30:22Z,https://www.youtube.com/watch?v=Nl0E05ZGvn8,Welcome to another video from Dr. P.S Tiwari. Today's video is about Are Varicose Veins always painful ? FOR BOOKING ...,
Hairfall because of Stress? Try this homeopathic medicine! #hairfall #hairfallsolution #homeopathy,UySlbI61bno,Dr.Varun Kanwadia,2025-01-18T14:28:14Z,https://www.youtube.com/watch?v=UySlbI61bno,,
Corallium Rubrum #bhms #homeopathicmedicine #keynotes #homeopathy #coral #coughmedicine #bhmsexams,hmwQRoFv07Q,Dr Priyanka Lathkar,2025-03-26T09:08:07Z,https://www.youtube.com/watch?v=hmwQRoFv07Q,Corallium is beautiful remedy which works in whooping and spasmodic cough bouts. Here is a quick short video on this beautiful ...,
Myths and Facts About Homeopathy Part 3 #doctor#homeopathicmedicine #homeopathy #homoeopathyheals,jdw0VJSwHdI,Ravi Clinic A Centre of Classical Homeopathy,2025-01-17T15:27:05Z,https://www.youtube.com/watch?v=jdw0VJSwHdI,Myths and Facts about homeopathy. Homoeopathic medicines are not atidoted by touch.,
#drspdeyy #homeopathy #homeopathy  #siliguri #besthomeopathicdoctor #india,2FdDFNAGJ-s,"Dr S P Deyy - Health, Healing & Homeopathy",2025-03-05T14:35:06Z,https://www.youtube.com/watch?v=2FdDFNAGJ-s,,
Ginseng homeopathic medicine uses and benefits#youtubeshorts #homeopathy,tISP3_hJVAM,drsurekha jhankar,2025-03-16T11:32:22Z,https://www.youtube.com/watch?v=tISP3_hJVAM,Homeopathic solution by Dr surekha jhankar hi friends in this video I am telling you about homeopathic medicine ginseng uses ...,
Nasal polyps #homeopathy #medicine #shorts,LBP-tddlUOA,Dr warsi homeopathy,2025-01-03T14:48:44Z,https://www.youtube.com/watch?v=LBP-tddlUOA,Homoeopathic medicine for Nasal polyps l Sanguinaria.,
Myths and facts about Homeopathy Part 2 #homeopathicmedicine #alternativemedicine #homeopathics,2LkjYzam2Y8,Ravi Clinic A Centre of Classical Homeopathy,2025-01-10T16:34:11Z,https://www.youtube.com/watch?v=2LkjYzam2Y8,,
Are all Varicose Veins VISIBLE ? Dr P S Tiwari #homeopathy,0I_ywJ5k47A,Dr P S Tiwari (Shorts),2025-01-17T13:30:00Z,https://www.youtube.com/watch?v=0I_ywJ5k47A,Welcome to another video from Dr. P.S Tiwari. Today's video is about Are all Varicose Veins visible. FOR BOOKING ...,
Successful🎉 International Homeopathic Conference 2025 🎤by TN DrMGR University #homeopathy #seminar,zld92bIIIUE,Score in Homoeo,2025-02-16T05:04:48Z,https://www.youtube.com/watch?v=zld92bIIIUE,,
Parkinson's Disease #homeopathy #medicine #shorts,EDDJFPrKLSw,Dr warsi homeopathy,2025-02-07T14:59:12Z,https://www.youtube.com/watch?v=EDDJFPrKLSw,Homoeopathic medicine for Parkinson's Disease l Paralysis Agitans l Manganum Aceticum.,
Homeopathy Medicine For Eardrum Perforation #eardrum #homeopathy #shorts #bestdoctor,zxx2yMZyun0,Dr. Riddhi Pandey,2025-01-29T13:37:42Z,https://www.youtube.com/watch?v=zxx2yMZyun0,"Best Homeopathy Medicine For Eardrum Perforation #eardrum #homeopathy #shorts #bestdoctor For Appointment, ...",
Myths and facts about homeopathy #homeopathicmedicines #homeopathics #doctor #alternativemedicine,Vrwq4-uf1Oo,Ravi Clinic A Centre of Classical Homeopathy,2025-01-10T15:42:05Z,https://www.youtube.com/watch?v=Vrwq4-uf1Oo,,
Wearing Compression Stockings necessary in Varicose Veins ?  Dr P S Tiwari #homeopathy,u7hECh6n2to,Dr P S Tiwari (Shorts),2025-03-03T13:30:42Z,https://www.youtube.com/watch?v=u7hECh6n2to,Welcome to another video from Dr. P.S Tiwari. Today's video is about Wearing Compression Stockings necessary in Varicose ...,
Squilla maritima 30 homeopathic medicine uses & benefits in hindi !!,vfuyUh2TQek,Dr.Shashi Boricha Homeopathy,2025-02-08T14:19:46Z,https://www.youtube.com/watch?v=vfuyUh2TQek,,
Do Varicose Veins go away after Pregnancy ? Dr P S Tiwari #homeopathy,53o0vuCf9PU,Dr P S Tiwari (Shorts),2025-03-09T13:30:02Z,https://www.youtube.com/watch?v=53o0vuCf9PU,Welcome to another video from Dr. P.S Tiwari. Today's video is about Do Varicose Veins go away after Pregnancy?,
Why bulky uterus? #bulky #uterus #fibroids #ovariancyst #cysticfibrosis #femalefitness #homeopathy,PMorCjn2EE8,247Homeopathy,2025-01-29T08:16:50Z,https://www.youtube.com/watch?v=PMorCjn2EE8,,
Homeopathy for Adenoids & Nasal Polyps: Can Surgery Be Avoided? | Dr. Rajesh Shah | Part 3/10,dutNbgUHrC4,Life Force Homeopathy,2025-02-15T16:40:26Z,https://www.youtube.com/watch?v=dutNbgUHrC4,"Welcome to Part 3/10 of our “Homeopathy and Surgery Series.” Today, Dr. Rajesh Shah, M.D. (Hom.), Director of Life Force ...",
Best #homeopathy medicine for DEPRESSION -- Dr P S Tiwari,vBeMvsF6ysA,Dr P S Tiwari (Shorts),2025-01-11T13:30:37Z,https://www.youtube.com/watch?v=vBeMvsF6ysA,Welcome to another video from Dr. P.S Tiwari. Today's video is about Depression and its homeopathy medicine. FOR BOOKING ...,
Vaginitis in Cattle | Rhus Tox 200 Homeopathy Uses in Hindi #shorts #youtubeshorts #vet #veterinary,ZVGPAnDhMrc,VETERINARY HOMEOPATHY,2025-01-22T07:00:30Z,https://www.youtube.com/watch?v=ZVGPAnDhMrc,Vaginitis in Cattle | Rhus Tox 200 Homeopathy Uses in Hindi #shorts #youtubeshorts #vet #veterinary #short #shortvideo ...,
Can Fatty Liver affect Children ? Dr P S Tiwari #homeopathy,fNG0iCiGO08,Dr P S Tiwari (Shorts),2025-02-28T13:30:33Z,https://www.youtube.com/watch?v=fNG0iCiGO08,Welcome to another video from Dr. P.S Tiwari. Today's video is about Can Fatty Liver affect Children? FOR BOOKING ...,
Can Fatty Liver be cured by medicines ? Dr P S Tiwari #homeopathy,UP8bSchDfag,Dr P S Tiwari (Shorts),2025-02-25T13:30:29Z,https://www.youtube.com/watch?v=UP8bSchDfag,Welcome to another video from Dr. P.S Tiwari. Today's video is about Can Fatty Liver be cured by medicines? FOR BOOKING ...,
Anthracinum uses #homeopathy #medicine #shorts,EXCxzz6_ap8,Dr warsi homeopathy,2025-01-29T15:54:15Z,https://www.youtube.com/watch?v=EXCxzz6_ap8,Homoeopathic medicine Anthracinum uses l Boil.,
Burning sensation of palms and soles #healthadvice #homeopathy #trendingshorts #viralvideo,Cnr3JBWfjAI,Dr Santosh health tips,2025-02-18T13:24:41Z,https://www.youtube.com/watch?v=Cnr3JBWfjAI,,
Anemia/خون کی کمی #anemia #health #healthtips #homeopathy #shorts #shortvideo,1D8LCRF5QQg,DrNadeem Ahmad,2025-02-02T16:53:21Z,https://www.youtube.com/watch?v=1D8LCRF5QQg,,
Osteoarthritis and Sciatica#sciatica #osteoarthritis #homeopathy #homeopathictreatment,743rjpZhE3c,Ravi Clinic A Centre of Classical Homeopathy,2025-03-06T16:18:20Z,https://www.youtube.com/watch?v=743rjpZhE3c,Case of Osteoarthritis watch full case at https://raviclinic.com/case-study-detail/?case_id=811.,
best medicine for dry cough #healthadvice #drhealthtips #homeopathy #trending,K-NIV_CyDt0,Dr Santosh health tips,2025-03-21T09:03:44Z,https://www.youtube.com/watch?v=K-NIV_CyDt0,,
Dr reckeweg R191 uses in hindi | R191 homeopathic medicine,Y1UruRyZQ2o,Healthy Subscribers,2025-01-28T03:30:16Z,https://www.youtube.com/watch?v=Y1UruRyZQ2o,Dr reckeweg r191 uses in hindi R191 homeopathic medicine Dr reckeweg r191 in India Dr reckeweg r191 uses Dr reckeweg r191 ...,
Clinic ki har 1 cheez se ishq h❤️#doctor #homeopathy #treatment #love #visitingcard #ex #happiness,moAMdnkrUsQ,Kalpana Homeopathy Dr Amit jain Dr Surabhi jain,2025-01-11T12:38:47Z,https://www.youtube.com/watch?v=moAMdnkrUsQ,,
Does Varicose Veins occurs in Old Age only ? Dr P S Tiwari #homeopathy,1c4RsfA-Urk,Dr P S Tiwari (Shorts),2025-03-06T13:30:01Z,https://www.youtube.com/watch?v=1c4RsfA-Urk,Welcome to another video from Dr. P.S Tiwari. Today's video is about Does Varicose Veins occurs in Old Age only.,
Can Fatty Liver happen to anyone ? Dr P S Tiwari #homeopathy,T-x-5IFeu2w,Dr P S Tiwari (Shorts),2025-03-12T13:30:16Z,https://www.youtube.com/watch?v=T-x-5IFeu2w,Welcome to another video from Dr. P.S Tiwari. Today's video is about Can Fatty Liver happen to anyone? FOR BOOKING ...,
#drspdeyy #homeopathy #besthomeopathicdoctor #india #siliguri,6UevxiT_Yh4,"Dr S P Deyy - Health, Healing & Homeopathy",2025-03-26T09:49:01Z,https://www.youtube.com/watch?v=6UevxiT_Yh4,,
Knee Pain #homeopathy #medicine #shorts,WcpkFmWkwek,Dr warsi homeopathy,2025-01-12T09:34:27Z,https://www.youtube.com/watch?v=WcpkFmWkwek,Homoeopathic medicine for Knee Pain l Rhus tox.,
Itching/خارشpart3 #itching #health #healthtips #homeopathy #shorts #shortvideo,LSpCtYfe334,DrNadeem Ahmad,2025-02-08T16:34:54Z,https://www.youtube.com/watch?v=LSpCtYfe334,,
Dr reckeweg R184 uses in hindi  | R184 homeopathic medicine,Ygl_j7kgLto,Healthy Subscribers,2025-01-26T03:30:17Z,https://www.youtube.com/watch?v=Ygl_j7kgLto,Dr reckeweg r184 uses in hindi R184 homeopathic medicine Dr reckeweg r184 review Dr reckeweg r184 uses Dr reckeweg r184 ...,
Last year is hitting hard🙃🙂‍↔️. #sodelhi #bhms #homeopathy #college #shmc #homeopathicdoctor #fyp,nrRQhVo6SIA,Thrive with Divya,2025-02-19T12:48:41Z,https://www.youtube.com/watch?v=nrRQhVo6SIA,,
Homoeopathic medicine companies #homeopathy #medicine #shorts,IdLB2OFu5Qc,Dr warsi homeopathy,2025-02-25T11:22:26Z,https://www.youtube.com/watch?v=IdLB2OFu5Qc,Different Homoeopathic medicine companies.,
Advanced Treatment For Moles Removal #moles #homeopathy #skincare #skins #shorts,lL4kj_Wxv1A,Dr. Riddhi Pandey,2025-03-15T15:27:04Z,https://www.youtube.com/watch?v=lL4kj_Wxv1A,"Removal of Moles (तिल) by Advanced Safe Therapy - Dr. Riddhi Pandey For Appointment, Homoeopathic Medicine Order and ...",
Dark Neck #homeopathy #medicine #shorts,Wu1sjBS21vk,Dr warsi homeopathy,2025-01-18T13:42:32Z,https://www.youtube.com/watch?v=Wu1sjBS21vk,Homoeopathic medicine for Dark Neck l Acanthosis nigricans l Sulphur.,
4 Best Medicines For Constipation #constipation #homeopathy #homeoapthicmedicine,EcwdY3S4sy0,Dr. Riddhi Pandey,2025-01-23T14:00:13Z,https://www.youtube.com/watch?v=EcwdY3S4sy0,"4 Best Medicines For Constipation #constipation #homeopathy #homeoapthicmedicine For Appointment, Homoeopathic Medicine ...",
Drug Addiction ? #homeopathy remedy -- Dr P S Tiwari,soP3v8w9Kno,Dr P S Tiwari (Shorts),2025-03-30T13:30:34Z,https://www.youtube.com/watch?v=soP3v8w9Kno,Welcome to another video from Dr. P.S Tiwari. Today's video is about Drug addiction and its homeopathy medicine.,
Documentary of Homoeopathy in Netflix/#netflix #homoeopathy #bhms,d7ZFH_ba6TE,Medico life,2025-03-17T18:20:06Z,https://www.youtube.com/watch?v=d7ZFH_ba6TE,Trailer of Documentary on Homoeopathy in Netflix. All about Homoeopathy. BHMS video. #Netflix #homoeopathy #medico #bhms ...,
Can Homeopathic Medicines Be Taken with Allopathy? #short #homeopathy @homeodoctor,JOXfqV4TpCc,Homeo Doctor,2025-02-14T11:25:55Z,https://www.youtube.com/watch?v=JOXfqV4TpCc,"In this YouTube Short, Dr. Vikas Singhal addresses the important question that homeopathic medicines can't taken with allopathic ...",
"""Arsenicum Album 30 for Loose Motion | Best Homeopathic Medicine for Diarrhea & Stomach Issues""",5e7N9Hh-yTI,Homeo Cure Lab,2025-01-29T12:57:17Z,https://www.youtube.com/watch?v=5e7N9Hh-yTI,"Arsenicum Album 30 is one of the most effective homeopathic medicines for loose motion, diarrhea, and food poisoning.",
Centaury bach flower remedy uses #youtubeshorts #homeopathy #drbach,WUGVM4PEAOg,drsurekha jhankar,2025-01-30T11:50:54Z,https://www.youtube.com/watch?v=WUGVM4PEAOg,Homeopathic treatment by Dr surekha jhankar Hi every one thanks for your support and in this video I am telling you about ...,
Do overweight (obese) people have fatty livers only ? Dr P S Tiwari #homeopathy,zCvzwDsQEW8,Dr P S Tiwari (Shorts),2025-01-23T13:30:47Z,https://www.youtube.com/watch?v=zCvzwDsQEW8,Welcome to another video from Dr. P.S Tiwari. Today's video is about Do overweight (obese) people have fatty livers only ?,
