Title,Video ID,Channel,Published At,URL,Description,Video Length,Views,Likes,Comments
#cancer #awareness #videos #mouthcancer #icare #helpthemfoundation #charity,80A8Zl9W1k8,iCare Charity Foundation,2025-03-10T14:27:06Z,https://www.youtube.com/watch?v=80A8Zl9W1k8,,22,45,0,0
We wear pink in October! 🎀 Breast Cancer Awareness,6iEf8ML38tc,NP Travel Journey's Around the Globe,2025-01-29T02:17:06Z,https://www.youtube.com/watch?v=6iEf8ML38tc,October is Breast Cancer Awareness Month.,29,45,5,0
Cancer Awareness Seminar #swaminarayan #health #sanatan #facts,OLucBuoDbSc,LSS VasaiMandir,2025-03-20T14:39:19Z,https://www.youtube.com/watch?v=OLucBuoDbSc,"Register @8856996250 (send your name on whatsapp) address Swaminarayan mandir vasai , 60feet road this seminar will cover ...",49,78,8,0
March is Colorectal Cancer Awareness Month,2hlbsLW_3u4,ProMedica,2025-02-28T21:07:11Z,https://www.youtube.com/watch?v=2hlbsLW_3u4,Up to 90% of colon cancers could be prevent if people were screened at the appropriate times. Don't put it off. Talk to you provider ...,50,47,0,0
#cancer awareness #program 😍 manipal #hospital #police #telugu#good#ideas #youtubeshorts#viralvideo,YXAO5CV1xao,Soul lifestyle ,2025-02-05T19:17:43Z,https://www.youtube.com/watch?v=YXAO5CV1xao,,16,57,4,0
Breast Cancer Awareness,uhFTKHP3JR8,Making a Change,2025-02-15T08:15:05Z,https://www.youtube.com/watch?v=uhFTKHP3JR8,Cancer #breastcancer #breastcancerawareness #breastcancerprevention #breastcancermonth #npo #nonprofit.,23,45,0,0
10th Gulf Week for Cancer Awareness Opening Ceremony,Ok4CMaMCsfo,KTV Foreign News Department,2025-02-03T17:37:59Z,https://www.youtube.com/watch?v=Ok4CMaMCsfo,,127,45,1,0
Let's step up for cancer awareness and early detection!,7FIlf6R21tU,Hi-Tech Diagnostic Centre,2025-02-04T07:53:19Z,https://www.youtube.com/watch?v=7FIlf6R21tU,"Create awareness, spread the message, and encourage everyone to get tested. Early detection saves lives—let's make a ...",45,57,3,0
Breast Cancer Awareness: My Journey from Surviving to Thriving,perljOR4vKo,Breast Cancer Initiative East Africa,2025-01-08T13:08:01Z,https://www.youtube.com/watch?v=perljOR4vKo,,91,51,2,1
Ruby General Hospital | Breast Cancer Awareness,W7aY2Eel6cI,Ruby General Hospital,2025-01-02T10:31:03Z,https://www.youtube.com/watch?v=W7aY2Eel6cI,"Together, let us raise awareness about the early warning signs of Breast Cancer including lumping or thickening, nipple ...",31,75,2,0
Cervical Cancer Awareness Month,bUKJ_SuhAdo,Giostar Stem Cell Therapy Mexico,2025-01-16T18:00:24Z,https://www.youtube.com/watch?v=bUKJ_SuhAdo,"January is Cervical Cancer Awareness Month—If you or a loved one is facing this challenge, know that there are options and ...",34,44,2,0
Cancer Awareness: How to Do Breast Self-Examination at Home | Dr Amit Gupta | Cancer Care Surat,SIrJlJAR6uk,Dr Amit Gupta - Cancer Care Surat,2025-02-20T14:25:30Z,https://www.youtube.com/watch?v=SIrJlJAR6uk,CancerTreatmentInSurat #howtopreventcancer Breast Cancer Awareness: How to Do a Breast Self-Examination at Home | Early ...,59,70,5,0
World cancer day #cancer #awareness #lungscancer #noncommunicablediseases #february #facts #world,aLyR0a15pmw,Mera pehlu,2025-02-04T02:48:12Z,https://www.youtube.com/watch?v=aLyR0a15pmw,,53,43,7,0
Be Aware of Misleading Therapies for Treating Cancer | #Awareness,UaA4C9ryiN8,Kidney Coach,2025-03-01T13:00:47Z,https://www.youtube.com/watch?v=UaA4C9ryiN8,"In this YouTube short, we discuss the unfortunate reality where some groups exploit cancer patients' fear and desperation, ...",39,44,0,0
Breast Cancer Awareness | International Women's Day 2025 | Dr. Ramnath | Indiana | Konkani #iwd2025,misjycVI52M,Indiana Hospital,2025-03-07T12:35:37Z,https://www.youtube.com/watch?v=misjycVI52M,"On the occasion of International Women's Day 2025, Dr. Ramnath K. Shenoy, Consultant Medical Oncologist at Indiana Hospital, ...",175,51,2,0
Cervical Cancer Awareness Month | Expert Insights with Dr. Shailee Bhandari Parikh,LKkTWP-_3cI,EpicHospital,2025-01-19T05:54:08Z,https://www.youtube.com/watch?v=LKkTWP-_3cI,Cervical Cancer Awareness Month | Expert Insights with Dr. Shailee Bhandari Parikh Cervical cancer remains a significant global ...,181,46,2,0
Colorectal Cancer Awareness Month 2025,350rmihJc8M,Borneo Medical Centre (Miri),2025-03-11T00:12:05Z,https://www.youtube.com/watch?v=350rmihJc8M,Part 3 : Colerector Cancer Common Symptoms. #borneomedicalcentremiri #fyp #sarawakmiri #colorectorcancer.,67,45,2,0
Dr. Omalkhair Abualkhair on Hereditary Cancer Awareness | BGICC 2025,tLlZk1JBULE,OncoDaily TV,2025-02-23T16:51:17Z,https://www.youtube.com/watch?v=tLlZk1JBULE,"Dr. Omalkhair Abualkhair, Senior consultant medical oncology / chairman of oncology department at Dr Sulaiman Al Habib ...",92,50,6,0
Breast Cancer Awareness | Symptoms | स्तनाचा कर्करोग लक्षणे | ब्रेस्ट कॅन्सर | Self Breast Exam,rMNjn2QuAJY,Devaki Nursing Classes & Career Guidance,2025-03-07T04:30:23Z,https://www.youtube.com/watch?v=rMNjn2QuAJY,"Hello everyone...! Myself Mr. Sachin Kumbhar, P.B.B.Sc. Nursing Graduate from Institute of Nursing Education, Sir J. J. Hospital, ...",190,52,11,4
Awareness #standup #cancer #awareness,E0UASo-l7fM,Bobby Morgan,2025-02-05T12:11:59Z,https://www.youtube.com/watch?v=E0UASo-l7fM,"Some people love these jokes and, as you'll see, others walk.",49,61,2,0
Giant inflatable colon in Ocean Springs helps promote colorectal cancer awareness,p0CAq5fDvow,WLOX News,2025-03-19T17:07:24Z,https://www.youtube.com/watch?v=p0CAq5fDvow,Colon and rectal cancers are the second-leading cause of cancer-related deaths in Mississippi among both men and women.,61,40,0,0
World Cancer Awareness DAY! Let's unite to fight cancer #2025,2eyoREuIygs,Study and Motivation With K2,2025-02-03T04:20:05Z,https://www.youtube.com/watch?v=2eyoREuIygs,World Cancer Awareness DAY! Let's unite to fight cancer #2025 #shortsvideo #shorts #worldcancerday2025 #cancer On World ...,53,45,0,0
Cancer awareness || #cancer #education #cancerstages #shortsvideo #nursing #medicaleducation,yYjcbPhYP8M,Ajeet education point,2025-02-22T13:12:23Z,https://www.youtube.com/watch?v=yYjcbPhYP8M,Cancer awareness || #cancer #education #cancerstages #shortsvideo #nursing #medicaleducation cancer cancer ka last stage ...,16,45,0,0
🎗️ Ovarian Cancer Awareness Month⁠,AtbXug25G3w,BIOSOTA ORGANICS,2025-02-04T01:55:26Z,https://www.youtube.com/watch?v=AtbXug25G3w,"This month, we wear light blue to shine a light on ovarian cancer, honouring those affected and spreading awareness about early ...",8,44,0,0
🦷 Oral Cancer Awareness: Early Detection Saves Lives 🦷,d-5z9ikI_1Y,SMILE & PROFILE DENTAL TREATMENT CENTRE,2025-03-12T17:22:19Z,https://www.youtube.com/watch?v=d-5z9ikI_1Y,Did you know that early detection of oral cancer can dramatically improve survival rates? If you notice any signs like persistent ...,46,99,2,1
"Oral Cancer Awareness- Causes, Symptoms & Treatments |  Dr. Satish Sharma #oncology #oralcancer",NgR7JhN0Wjw,Medica Superspecialty Hospitals,2025-02-22T05:18:27Z,https://www.youtube.com/watch?v=NgR7JhN0Wjw,"Oral cancer is a serious yet preventable disease primarily caused by tobacco consumption in various forms, including cigarettes, ...",87,46,1,0
Rep. Pablo Hernández Rivera: Colorectal Cancer Awareness Month,AFpmneDRXtc,Prevent Cancer Foundation,2025-03-07T20:14:33Z,https://www.youtube.com/watch?v=AFpmneDRXtc,The Prevent Cancer Foundation Congressional Families Program spoke with Puerto Rico Representative Pablo Hernández ...,59,74,2,0
600 Lives Protected Against Cervical Cancer through Cervical Cancer Awareness & Vaccination Drives,MIpcUOlIdak,Jivika Foundation,2025-01-09T10:37:13Z,https://www.youtube.com/watch?v=MIpcUOlIdak,"Focused on adolescent girls aged 9-14, our Cervical Cancer program provides HPV awareness & vaccinations to protect against ...",130,55,0,0
World Cancer Day | Cancer Awareness #worldcancerday #gunjanivfworld,sd-_9u1db6o,Gunjan IVF World,2025-02-04T04:30:32Z,https://www.youtube.com/watch?v=sd-_9u1db6o,CANCER wins because we often realise and recognise its symptoms late. The fight against CANCER starts with being aware.,185,39,2,0
Even 1$ helps #love #cancer #cancerawareness,Tsjz90U6q10,Give a chance to a child ,2025-03-06T22:30:08Z,https://www.youtube.com/watch?v=Tsjz90U6q10,,14,47,17,0
Breast Cancer awareness,eZ6YLj0nC7k,boxbolton,2025-01-10T15:19:47Z,https://www.youtube.com/watch?v=eZ6YLj0nC7k,A short animation made by the women from Breightmet Butterflies group as part of an ANSWER CANCER awareness project.,49,39,0,0
Highlights from the Cancer Awareness Walk at SSMC,IiPG6WCVSJs,SSMC,2025-02-07T14:00:27Z,https://www.youtube.com/watch?v=IiPG6WCVSJs,,33,41,0,0
Uniting for a Cause: Cancer Awareness in the Digital Age! #youtube #cancer #shorts,Hkc7Z9OJ3Qs,Alluregram,2025-02-04T06:50:36Z,https://www.youtube.com/watch?v=Hkc7Z9OJ3Qs,"Discover our impactful video on cancer awareness, designed to educate and empower viewers about the importance of early ...",46,37,1,0
🦋 Thyroid Cancer Awareness: Don’t Ignore the Signs 🦋,fJUxOWD6Cg0, MedOncoRajeev,2025-01-25T09:35:58Z,https://www.youtube.com/watch?v=fJUxOWD6Cg0,,46,40,2,0
Cervical Cancer Awareness,fhyaWHoV5qY,3Rivers Cancer Centre,2025-01-18T13:55:09Z,https://www.youtube.com/watch?v=fhyaWHoV5qY,Guard Your Crown with 3Rivers Cancer Center! Cervical cancer is preventable and treatable when detected early. ✔️ Get ...,39,66,1,0
Cervical Cancer Awareness,CJk6KnWMdOk,CK Birla Hospitals ,2025-01-20T10:30:51Z,https://www.youtube.com/watch?v=CJk6KnWMdOk,Cervical cancer is the 4th most common cancer in women worldwide. The main cause of cervical cancer is HPV (Human ...,25,47,3,0
Pink Orbit Walkathon: Pi Health & Expo Galaxia Unite for Cancer Awareness! #pinkorbit #pihealth,otzSeU-2Yi0,Pi Health Cancer Hospitals,2025-01-27T13:01:06Z,https://www.youtube.com/watch?v=otzSeU-2Yi0,"Pi Health Cancer Hospital is proud to collaborate with Expo Galaxia for this impactful Walkathon, as part of our Pink Orbit ...",58,61,2,0
Regency Healthcare | Colon Cancer Awareness Day,s9QD7RsJyEg,Regency Health,2025-03-31T04:00:46Z,https://www.youtube.com/watch?v=s9QD7RsJyEg,"Colorectal Cancer: Know the signs, take action! ​​ Colorectal cancer is one of the most common yet preventable cancers.",7,162,1,0
Bowel cancer awareness and test,UDi5NNq7Kgo,boxbolton,2025-01-10T15:59:52Z,https://www.youtube.com/watch?v=UDi5NNq7Kgo,A short animation made by the women from Breightmet Butterflies group as part of an ANSWER CANCER awareness project.,71,35,1,0
The trauma of losing a loved one to cancer #griefandloss #cancerawareness #leukemia,HsOmYXH-yV4,A Place of Yes Podcast,2025-03-29T12:00:31Z,https://www.youtube.com/watch?v=HsOmYXH-yV4,"Losing a sister at 15 changes everything. Sophia Allen opens up about the heartbreak of losing Olivia—her sister, her best friend, ...",27,65,2,0
Colorectal Cancer Awareness: Life-Saving Screening Info in 7 Languages,lhkMQjKWPl8,Maimonides Health,2025-03-26T16:40:17Z,https://www.youtube.com/watch?v=lhkMQjKWPl8,"Colorectal cancer is preventable, and early detection saves lives! Our Maimonides Health experts are spreading this critical ...",216,57,0,0
Cervical cancer awareness #manishamaini #mainihospital #cervicalcancervaccinejagraon #manishamaini,ljqhGLIWkkg,Dr. Manisha Maini ( MAINI HOSPITAL ),2025-02-21T11:04:13Z,https://www.youtube.com/watch?v=ljqhGLIWkkg,,37,276,1,0
🎗️ Cancer Awareness Ribbons: More Than Just Colors!,ZJaFrelhyXY,Shashwat Hospitals,2025-03-17T06:07:44Z,https://www.youtube.com/watch?v=ZJaFrelhyXY,"Each type of cancer is represented by a dedicated ribbon color , symbolizing hope, awareness, and strength . Here are a few: ...",30,82,0,0
🎗️ Reaching Every Community: Multilingual Cancer Awareness | Health Podcast Clip 🎙️,xr6MPALybQ4,Heritage Radio Productions,2025-03-26T14:00:32Z,https://www.youtube.com/watch?v=xr6MPALybQ4,"Cancer doesn't discriminate—awareness shouldn't either. In this episode of The Health Podcast: Empowering Your Well-Being, ...",41,38,0,0
Breast Cancer Awareness Month,rS-9mIuYe3c,Nileena Mariam Jonesh,2025-02-20T11:59:09Z,https://www.youtube.com/watch?v=rS-9mIuYe3c,Pink October 2023 #shjspea #focp.,154,35,2,0
Cervical cancer awareness #cancer #periods #femininehealth,AcenQ0qyQsw,Amanda Lovejoy,2025-01-19T16:21:18Z,https://www.youtube.com/watch?v=AcenQ0qyQsw,,20,36,1,0
Understanding the Rising Diagnoses and Risk Factors. #CancerAwareness #Cancer #CancerinWomen,Y6ZsDvRDTY4,Dr. Sajjan Rajpurohit ,2025-02-18T08:44:14Z,https://www.youtube.com/watch?v=Y6ZsDvRDTY4,Younger Women and Cancer: Understanding the Rising Diagnoses and Risk Factors. #CancerAwareness #Cancer ...,60,1121,63,1
"Cervical Cancer Awareness Month with Sarah Whittington, CNM",IplWMQ399Fs,Lovelace Health System,2025-01-03T15:15:23Z,https://www.youtube.com/watch?v=IplWMQ399Fs,"Lovelace Health Care Center offers tips during January Cervical Cancer Month 2025. Learn more from Sarah Whittington, certified ...",86,36,0,0
2024 Impact | Saving Lives Through Breast Cancer Awareness,OLeti_JCk4s,Eric Cancer Initiative Uganda,2025-01-18T15:01:27Z,https://www.youtube.com/watch?v=OLeti_JCk4s,"In 2024, we reached new heights in our mission to save lives through early recognition of breast cancer having empowered over ...",142,32,8,4
WalkForHer 2025 | Message by Mithali Raj on Breast Cancer Awareness,wshJ1pkeot0,ASHIRVAD FOUNDATION,2025-03-01T09:05:01Z,https://www.youtube.com/watch?v=wshJ1pkeot0,"Mithali Raj – a name that revolutionized Indian women's cricket. A trailblazer, a record-breaker, and an icon of inspiration.",61,48,6,1
EP 20: Skin Cancer Awareness | Dr. Munir Sadiq & Dr. Adnan Jabbar | Part 1,ScZZpDgWU5A,PIMA Karachi CME,2025-01-02T04:00:15Z,https://www.youtube.com/watch?v=ScZZpDgWU5A,Join Dr. Munir Sadiq as he hosts Dr. Adnan Jabbar for an engaging discussion on skin cancer in Part 1 of this two-part series.,194,37,1,0
Mouth Cancer Awareness Walk From Home 2025,b2_nGWOG99A,MouthCancerFoundation,2025-03-26T14:06:10Z,https://www.youtube.com/watch?v=b2_nGWOG99A,Take part in the Mouth Cancer 10 KM Awareness Walk from Home in 2025 and help raise awareness and support patients and ...,79,45,0,0
April is Head and Neck Cancer Awareness Month,UzaLrny-uDM,ProMedica,2025-03-31T14:17:59Z,https://www.youtube.com/watch?v=UzaLrny-uDM,"You could be at risk of developing throat cancer – even if you don't smoke. In fact, throat cancer is now more commonly caused by ...",31,33,1,0
Colorectal Cancer Awareness Month 2025,WTMsN7amTuA,Geisinger College of Health Sciences ,2025-03-28T19:36:44Z,https://www.youtube.com/watch?v=WTMsN7amTuA,"March is Colon and Rectal Cancer Awareness Month, and we're taking action. Learn about the importance of screening, ...",87,43,0,0
Colorectal Cancer Awareness with Dr. Zoccali | Bergen New Bridge Medical Center,ngv3rOT61Bo,Bergen New Bridge Medical Center,2025-03-25T20:25:30Z,https://www.youtube.com/watch?v=ngv3rOT61Bo,"Dr. Marco Zoccali talks about Colorectal Cancer awareness, symptoms, and treatment options. Early detection is key, we are here ...",71,52,0,0
Uterine Cancer Awareness Month | Early Detection Saves Lives with Dr. Divya Sehra,96HaOrIkl_Q,Dr Divya Sehra Best Gynaec Oncologist in Delhi NCR,2025-01-08T10:20:47Z,https://www.youtube.com/watch?v=96HaOrIkl_Q,"June is Uterine Cancer Awareness Month! Join Dr. Divya Sehra, a renowned Gynae & Gynae Onco Surgeon in Delhi, ...",52,65,7,0
It's Colorectal Cancer Awareness Month,F0Vmq0yc_m4,Murfreesboro Medical Clinic,2025-03-12T13:43:31Z,https://www.youtube.com/watch?v=F0Vmq0yc_m4,,31,32,0,0
Bowel Cancer Awareness Month (BBC Politics London 23 March 2025),KMbPfKA5DR8,TeacherPhili,2025-03-25T06:44:12Z,https://www.youtube.com/watch?v=KMbPfKA5DR8,"A short report on Bowel Cancer Awareness Month, which is in April. From BBC Politics London, broadcast on 23 March 2025.",,,,
Cervical Cancer Awareness Month w/ Dr. Julia Johansson #shorts,oLrjSPa012E,Circle of Life Women's Center,2025-01-30T23:06:31Z,https://www.youtube.com/watch?v=oLrjSPa012E,Dr. Julia Johansson talks about the important ways to help prevent cervical cancer. #shorts #obgyndoctor #askonyoutube #fyp ...,60,36,1,0
Ask The Doc Colon Cancer Awareness Month,nRy84B5Piiw,WMBD News,2025-03-19T11:40:52Z,https://www.youtube.com/watch?v=nRy84B5Piiw,Ask The Doc Colon Cancer Awareness Month.,222,28,0,0
Cancer  Awareness #cancer #awareness #ytshots,owIzNX5AxG0,BABooo,2025-02-04T15:32:41Z,https://www.youtube.com/watch?v=owIzNX5AxG0,cancer awareness programme. #cancer #awareness #breastcancer #routine #health #hospital.,43,48,2,0
Cervical Cancer Awareness 🫶 #cervicalcancerawareness #cancer #cancerawareness #stickers #awareness,ysheA1PwCbY,Made with Monday,2025-01-14T18:06:04Z,https://www.youtube.com/watch?v=ysheA1PwCbY,,39,31,3,0
Thursday's Cover Story: Jessica Wozniak share's her story for Colorectal Cancer Awareness Month,Lj--hY3W8S0,MikeLoweReporter,2025-03-25T17:10:55Z,https://www.youtube.com/watch?v=Lj--hY3W8S0,,31,31,0,0
#survivorstrong #inspiration #cancer #cancerawareness,_0jXjG4qNrE,SJT Wellness Centre,2025-01-21T15:59:35Z,https://www.youtube.com/watch?v=_0jXjG4qNrE,,12,28,1,0
#worldcancerday #youtube #ytshorts #cancer #cancerawareness,SknKOFGLf7s,Anushka Chaturvedi,2025-02-04T11:47:59Z,https://www.youtube.com/watch?v=SknKOFGLf7s,,60,34,6,0
Breast cancer awareness,kARK1_g6nH8,Amanda Holly UK,2025-02-06T10:29:11Z,https://www.youtube.com/watch?v=kARK1_g6nH8,My first mammogram experience didn't go quite how I expected it to. #mammogram #breastcancerawareness #healthcare ...,161,30,1,0
Cancer Awareness Month 2024,CMrDE3u8L7Q,JustAStoryTeller,2025-01-11T15:55:42Z,https://www.youtube.com/watch?v=CMrDE3u8L7Q,Make sure you check your “girls” #cancerprevention.,27,26,0,0
cancer control#cancer #cancerawareness #superfood #superfoodsecrets #healthyfood  #facts,7stSK9-wJmA,Rajvi vlogs ,2025-01-06T15:23:03Z,https://www.youtube.com/watch?v=7stSK9-wJmA,how to protect cancer how to control blood sugar how to control blood pressure ? Cinnamon is a powerful spice packed with ...,40,28,1,0
Healthy tips #cancer #awareness #health #education #subscribe,8auoA160-K4,Knowledge Pool,2025-01-21T20:41:47Z,https://www.youtube.com/watch?v=8auoA160-K4,"This video provides an informative and compassionate look at cancer—explaining what it is, how it develops, and the various ...",23,27,0,0
Childhood Cancer Awareness,BhR8L3VUOq4,northsideisd,2025-01-22T20:47:00Z,https://www.youtube.com/watch?v=BhR8L3VUOq4,,127,29,0,0
"March is Colorectal Cancer Awareness Month! Know the signs, get screened, & consult a doctor early.",3p0RVP9HS0k,Wembrace ,2025-03-28T05:59:12Z,https://www.youtube.com/watch?v=3p0RVP9HS0k,March is Colorectal Cancer Awareness Week! It's the 4th most common cause of cancer in men & 5th in women. Watch for ...,57,30,5,0
"Kauvery Cancer Awareness Marathon. #RunForACause #CancerAwareness #KauveryMarathon""",f_XmieRBQ0s,Just Do-it,2025-02-28T12:13:46Z,https://www.youtube.com/watch?v=f_XmieRBQ0s,,31,32,0,0
Breast Cancer Awareness,0nF7P7k2C7s,Dr Abdul Raoof Kamran,2025-02-26T14:32:27Z,https://www.youtube.com/watch?v=0nF7P7k2C7s,,178,23,8,1
January_Cervical Cancer Awareness Month,ScW0p1jpckg,Dr Priya Singh ,2025-01-18T16:12:05Z,https://www.youtube.com/watch?v=ScW0p1jpckg,WHO launched the Cervical Cancer elimination initiative in Nov 2020 with the goal of eliminating cervical cancer as a public ...,16,24,0,0
"Cervical Cancer Awareness with Dr. Divya Sehra | Prevention, Early Detection & Women’s Health",oyrVNeZ1J1I,Dr Divya Sehra Best Gynaec Oncologist in Delhi NCR,2025-01-15T07:21:19Z,https://www.youtube.com/watch?v=oyrVNeZ1J1I,"Together, we can prevent, protect, and empower! Join Dr. Divya Sehra in this impactful session, spreading awareness about ...",49,61,3,0
Ovarian Cancer Awareness Month 2025 | KIMS-Kingsway Hospitals,IrCUFV5A3LQ,KIMS-Kingsway Hospitals,2025-03-07T04:25:23Z,https://www.youtube.com/watch?v=IrCUFV5A3LQ,"Early detection saves lives! Know the symptoms—bloating, pelvic pain & unexplained weight loss. Regular screenings and ...",22,25,0,0
Cancer Awareness Month is making healthier choices together. #BaronMethod  #CancerAwarenessMonth,Q_IwidB1IA8,Baron Method,2025-02-13T09:00:22Z,https://www.youtube.com/watch?v=Q_IwidB1IA8,,54,28,1,0
Lests fight cancer #sad #cancer #cancerawareness,lCM0zqXfvs8,Give a chance to a child ,2025-03-05T21:15:10Z,https://www.youtube.com/watch?v=lCM0zqXfvs8,,15,30,17,0
"Cancer Awareness 🎗️ Causes, Symptoms, Diagnosis & Treatment #CancerAwareness@NurseNavigator-l1i",QIzkCPIYM2c,Nurse Navigator,2025-03-24T15:03:43Z,https://www.youtube.com/watch?v=QIzkCPIYM2c,"Join us in this essential exploration of cancer in our latest video, ""Understanding Cancer: Causes, Symptoms, Diagnosis ...",217,25,7,0
CANCER AWARENESS,XuUxJnLPTxM,Patience Adakpor,2025-02-04T16:31:48Z,https://www.youtube.com/watch?v=XuUxJnLPTxM,,16,21,1,0
Colorectal Cancer Awareness | KIMS Cuddles,LfTQMolFYjM,KIMS Cuddles,2025-03-02T06:00:18Z,https://www.youtube.com/watch?v=LfTQMolFYjM,"Screen today, live healthy tomorrow! 🎗️ Regular screenings can prevent colorectal cancer or catch it early when it's most ...",31,37,0,0
Every Woman Counts Breast Cancer Awareness,nuAkdwBuZdM,California Department of Health Care Services,2025-03-08T22:35:28Z,https://www.youtube.com/watch?v=nuAkdwBuZdM,Did you know that 1 in 8 women will develop breast cancer in their lifetime? Regular mammograms and clinical breast exams are ...,60,30,1,0
"Cancer Awareness: Strength, Hope & Support for Fighters & Survivors | Paras Health",xiNRa8JsnUM,Paras Health,2025-02-05T07:45:32Z,https://www.youtube.com/watch?v=xiNRa8JsnUM,"A cancer diagnosis affects not just the patient but their entire support system. It is a journey of resilience, courage, and unwavering ...",44,46,3,0
Breast Cancer Awareness,lCXm1_Gb7N8,Mount Sinai Health System,2025-03-31T16:08:03Z,https://www.youtube.com/watch?v=lCXm1_Gb7N8,Breast Cancer Awareness Mount Sinai Doctors Medical Group - Dr. Nikam Spotlight.,141,31,0,0
My Radiation Therapy Days (2024) total of 19 Sessions #CancerAwareness #BreastCancer #cancer,6syzyqolpc4,Joy Vee,2025-01-20T00:47:59Z,https://www.youtube.com/watch?v=6syzyqolpc4,,45,20,6,1
Know About Colorectal Cancer Surgery | March Colorectal Cancer Awareness Month #cancerawareness,KX2PCzYs0Po,Dr Swapnil Patel,2025-03-31T02:00:12Z,https://www.youtube.com/watch?v=KX2PCzYs0Po,"March is Colorectal Cancer Awareness Month. On this important occasion, Dr.",234,43,5,0
Trophy Beauty Spa. 💕 In recognition of Breast Cancer Awareness Month,hp8xcq_tsfQ,Trophy Beauty USA,2025-02-18T06:47:46Z,https://www.youtube.com/watch?v=hp8xcq_tsfQ,,57,28,0,0
🧿🧿LIKE& SUBSCRIBE #LADYBOSS#W🌎RLD#HANDMADE#BREAST#CANCER#AWARENESS#BRACELETS,pP9175ITrsE,LADYBOSS W🌎RLD,2025-03-27T07:24:49Z,https://www.youtube.com/watch?v=pP9175ITrsE,,34,22,1,0
"Lung Cancer Awareness, Diagnostic BioSystems, Join Dr. Muralidhar Beeram",QD5F9274ctI,Diagnostic BioSystems,2025-03-18T17:04:32Z,https://www.youtube.com/watch?v=QD5F9274ctI,"Join Doctor Muralidhar Beeram, Medical Oncologist at the Start Cancer Centre in San Antonio, TX, as he shares his valuable ...",49,22,0,0
8 Superfoods that kills cancer cells #cancerdiet #cancer #cancertreatments #cancerawareness,IlokDgw7mRo,Dr Tejas Thorat,2025-02-16T13:02:09Z,https://www.youtube.com/watch?v=IlokDgw7mRo,,25,50,3,0
March is Colorectal Cancer Awareness Month,s79VWd1ejLI,FOX19 NOW | Cincinnati,2025-03-14T14:07:45Z,https://www.youtube.com/watch?v=s79VWd1ejLI,March is Colorectal Cancer Awareness Month For more Local News from WXIX: https://www.fox19.com/ For more YouTube ...,201,22,1,0
Virginia Nature Reserve | Hike for Cancer Awareness | Sunday Hike | Adventure4Sewa #sewasa,KZiYWjAnCKc,Sewa International - South Africa,2025-02-18T07:21:20Z,https://www.youtube.com/watch?v=KZiYWjAnCKc,Virginia Bush Nature Reserve Hike Recap! ‍♀️ What an unforgettable Sunday we had on 16 February 2025! A big ...,43,23,4,0
"Your Health, Your Power! | Cancer Awareness | KIMS-Kingsway Hospitals, Nagpur",2lxEVxGgoUo,KIMS-Kingsway Hospitals,2025-01-29T06:39:14Z,https://www.youtube.com/watch?v=2lxEVxGgoUo,Cervical cancer is preventable and treatable when caught early. Regular screenings and HPV vaccination are your keys to ...,44,43,0,0
Cervical Cancer Awareness Month  | Dr Rajender Kumar,VK9nt1ZMHUQ,Let's Talk Cancer - Dr. Rajender Kumar ,2025-01-06T10:57:24Z,https://www.youtube.com/watch?v=VK9nt1ZMHUQ,January is Cervical Cancer Awareness Month! Cervical cancer is one of the most preventable and treatable cancers.,50,32,3,0
#healthylivingherbalclinic #maureenminto #cancer #nocancer #cancerawareness #prostate,npd4201596c,Healthy Living Herbal,2025-01-15T21:50:11Z,https://www.youtube.com/watch?v=npd4201596c,breastcancerawareness #breastcancer.,53,17,0,0
Cancer awareness 💚🙏,jaYesxQhFJc,Victoria Bramhall,2025-01-30T18:42:55Z,https://www.youtube.com/watch?v=jaYesxQhFJc,,5,22,1,0
"Breast Cancer Awareness, Diagnostic BioSystems, Join Dr. Muralidhar Beeram",iIyJ2Wtea3U,Diagnostic BioSystems,2025-03-18T17:04:37Z,https://www.youtube.com/watch?v=iIyJ2Wtea3U,"Join Doctor Muralidhar Beeram, Medical Oncologist at the Start Cancer Centre in San Antonio, TX, as he shares his valuable ...",32,17,0,0
Prostate Cancer Awareness It's not a young man disease for Black African Males. Kpopca.org #fighter,4LzhMFmab0U,Keeppounding On Prostate Cancer Awareness,2025-01-04T05:33:22Z,https://www.youtube.com/watch?v=4LzhMFmab0U,cancer #cancernation #menshealth #cancersociety #prostatecancer #cancercommunity #kpopca #cancerawareness #inspiration ...,61,17,0,0
cancer awareness series 🎀..#cancerawareness #earlydetection,IE-Zwb_0uIA,Life at jsmu,2025-03-06T18:34:28Z,https://www.youtube.com/watch?v=IE-Zwb_0uIA,,51,16,0,0
