Title,Video ID,Channel,Published At,URL,Description,Video Length,Views,Likes,Comments
Green Detox Smoothie : Weight Loss & Anti Inflammatory #celeryjuice #smoothie #detoxjuice #shorts,p4K1DkCDz-U,GlamMove,2025-03-21T11:37:42Z,https://www.youtube.com/watch?v=p4K1DkCDz-U,,14,,,
6 Surprising Benefits of Celery Juice! #healthyliving #food #naturalhealthandwellness,8-8KR9YSZnA,Roots & Wellness,2025-02-20T18:30:08Z,https://www.youtube.com/watch?v=8-8KR9YSZnA,"Celery juice has gained popularity for its impressive health benefits, but did you know it can do more than just hydrate you?",46,,,
"I swear, I did not finish it in a single go #celeryjuice #skinglow #healthydrink #solivsoul",LOfxfCwHSMA,SolivSoul,2025-02-14T08:13:28Z,https://www.youtube.com/watch?v=LOfxfCwHSMA,,37,,,
Try celery and apple juice #celeryjuice #apples #recipe #fruitjuice,kG9-D7CeBg8,Herbbotany & Me,2025-03-25T01:59:45Z,https://www.youtube.com/watch?v=kG9-D7CeBg8,,20,,,
Cucumber  Celery juice(weight loss juice),CjWlTCGCQeI,yum yum cooking,2025-01-22T15:50:12Z,https://www.youtube.com/watch?v=CjWlTCGCQeI,,33,,,
come make some celery juice with Nesh 🫶🏽 #viralshorts #viralvideo #plusssize #weightloss #healthy,doAbysXRNOI,Get Healthy with Nesh,2025-01-23T12:28:31Z,https://www.youtube.com/watch?v=doAbysXRNOI,,61,,,
The Best Celery Juice For Cleaning Kidney,f-GUtX8loGQ,Hoang Fruitup,2025-02-08T14:46:59Z,https://www.youtube.com/watch?v=f-GUtX8loGQ,,48,,,
Celery ginger juice✨ #juicing #healthy #weightloss,1jYDHbHHgSo,Dolce West (Dolce west),2025-01-29T01:01:33Z,https://www.youtube.com/watch?v=1jYDHbHHgSo,,40,,,
Boost your energy with this Celery Ginger Juice! 🌿💚 #JuiceRecipe #HealthyLiving #CeleryJuice,76mzMGLy2gQ,Adriana Positive Life,2025-02-20T04:11:41Z,https://www.youtube.com/watch?v=76mzMGLy2gQ,Refresh and Revitalize with Celery & Ginger Juice! Looking for a juice that packs a punch? Celery and ginger are the perfect ...,21,,,
"A smoothie made from celery, spinach, and apple  #freshlysqueezed #bagel #Cook",xRJ_Pnbzlyw,Cooking,2025-01-16T16:17:08Z,https://www.youtube.com/watch?v=xRJ_Pnbzlyw,"A smoothie made from celery, spinach, and apple is a healthy and nutritious drink that supports overall health, detoxifies the body, ...",46,,,
Let’s juice some celery with mint! #womenshealth #juicerecipe #health #nutrition #viralshorts,Zn5Q8Wbfxko,Get Healthy with Nesh,2025-03-25T16:10:31Z,https://www.youtube.com/watch?v=Zn5Q8Wbfxko,,59,,,
Celery Juice Pt.2 ASMR #shorts,yiNaLdJJnqc,JConway,2025-03-20T15:18:13Z,https://www.youtube.com/watch?v=yiNaLdJJnqc,,17,,,
9 Juices For Blood Sugar Control #health #bloodsugar #wellness #healthtips,Nvkfyu23_xE,Health Info,2025-02-28T19:14:34Z,https://www.youtube.com/watch?v=Nvkfyu23_xE,,60,,,
"Wellness tips: celery juice first thing in the morning, magnesium at night | #wellness #wellnesstips",U0Xl8IoLvS8,Lauren Solomon Fitness,2025-02-19T04:55:06Z,https://www.youtube.com/watch?v=U0Xl8IoLvS8,,8,,,
Celery Lemon Juice Code KIMBERLY 10 10% OFF @Namawell #weightloss #juicer #juice #detox #healthy,fox0SdMrFpw,Kimberly Karver's Treehouse Garden,2025-01-13T22:30:12Z,https://www.youtube.com/watch?v=fox0SdMrFpw,I drink this every morning on an empty stomach!,53,,,
#path2wellnessbyamandasheppard #celeryjuice #healthylifestyle #selfimprovementjourney #postingmyself,vsSZX0T1rOc,Amanda Sheppard,2025-02-18T12:08:47Z,https://www.youtube.com/watch?v=vsSZX0T1rOc,,60,,,
Probably cus I like celery 🌿 #celeryjuice #celery #selfcare101 #selfimprovementjourney,239-19DqMD0,Alex Abagiants,2025-01-12T12:54:07Z,https://www.youtube.com/watch?v=239-19DqMD0,,23,,,
Have you ever seen a juicer stuffed so full at once,Z8oLNQD3hJQ,Yieach,2025-01-16T06:56:53Z,https://www.youtube.com/watch?v=Z8oLNQD3hJQ,"After I drank it, I stopped drinking milk tea; Carrot orange juice is recommended for everyone to drink.",23,,,
Skinny fat trying to shed some of fat? Try celery juice with strength training & hit those goals!,D7caWvHI0Q0,Vivek_Not_Ramaswamy ,2025-01-31T22:42:20Z,https://www.youtube.com/watch?v=D7caWvHI0Q0,,34,,,
Boost your health with celery juice! #celery,_OmO1S2WXO0,Mufizul Islam,2025-02-23T13:30:19Z,https://www.youtube.com/watch?v=_OmO1S2WXO0,Unlock skin & health benefits with celery juice! #celery #viral #fok.,43,,,
Unbig your back and belly after the holidays #cucumber#celeryjuice #detoxjuice #guthealth #detox,neCpWct5KGE,Sasu Flavas,2025-01-01T17:04:10Z,https://www.youtube.com/watch?v=neCpWct5KGE,,14,,,
#celeryjuice #peachjuicerecipe #healthybeverages #health #music #hiphop #song #artist #motivation,rqzwSJHQOG0,BooYardJr,2025-01-19T16:38:57Z,https://www.youtube.com/watch?v=rqzwSJHQOG0,,21,,,
Celery juice detoxes the liver! & it's exactly what I need w/ #chronicillness #chronicillnesslife,qqPi5oktzzY,Positively Keiley,2025-01-16T22:07:31Z,https://www.youtube.com/watch?v=qqPi5oktzzY,,13,,,
Celery Smoothie For debloating & detoxing #skincare,yMQ2TtuOqrs,GlowWithGrace,2025-02-08T13:50:01Z,https://www.youtube.com/watch?v=yMQ2TtuOqrs,"celerysmoothie #debloating #detoxing #celery #shorts #youtubeshorts #skincare Celery smoothie, Debloating, Skincare, celery ...",10,,,
"Fresh & Healthy: Carrot, Celery & Cucumber Juice! #fypyoutube #carrotjuice #juiceextractor #fypシ゚",Zwr-ATA1zlY,NWA Fishing,2025-01-31T13:41:35Z,https://www.youtube.com/watch?v=Zwr-ATA1zlY,,42,,,
"The magic fitness and wellness formula: 10K steps per day, celery juice first thing in the morning",D7hn7ViiuLI,Lauren Solomon Fitness,2025-03-11T02:04:44Z,https://www.youtube.com/watch?v=D7hn7ViiuLI,,8,,,
Unbig your back and belly detox green juice#greendetox #celeryjuice #foodhub,ykoAckAl7Oc,Sasu Flavas,2025-01-04T02:08:59Z,https://www.youtube.com/watch?v=ykoAckAl7Oc,"Let's Reset Together After the Holidays! The holidays were fun, but let's be real—we probably all overdid it a little. If you're ready ...",21,,,
Detox Your Body with Celery Juice! 🍏#easymorningbreakfast #teluguvlogs #telugushorts,nYZBGGZ1HSc,Bhavani Boppana Vlogs,2025-01-27T15:46:46Z,https://www.youtube.com/watch?v=nYZBGGZ1HSc,shorts #ninja #international #celeryjuice #detoxjuice #viral #youtubecreatorcommunity #youtubecreator Subscribe for more ...,154,,,
Celery Ginger juice #herbalism #juicing #healthy #juicefast #business #herbalmedicine #recipe,cdh9JBZAxCo,Indya May,2025-03-10T12:11:25Z,https://www.youtube.com/watch?v=cdh9JBZAxCo,,26,,,
Detox Juice #health #detox #celeryjuice #celeryApple #greenjuice,b0HTuja4VdM,SoftwareSurekha,2025-02-26T06:04:34Z,https://www.youtube.com/watch?v=b0HTuja4VdM,,36,,,
15 HEALTH BENEFITS OF CELERY JUICE (HEALTHIEST JUICE) detox & benefits #celeryjuice,B7PWue-lxkU,Clarion’s Kitchen ,2025-01-29T08:58:21Z,https://www.youtube.com/watch?v=B7PWue-lxkU,Hey Guy! Welcome back to my channel. Let me introduce you to this healing and the WORLD HEALTHIEST JUICE— CELERY ...,136,,,
Celery #healthy #juice #satyasree #trending #youtubeshorts #youtube #shorts #shortvideo #viralvideo,5M3j1rVk_cE,SatyaSree_Official,2025-03-09T07:25:55Z,https://www.youtube.com/watch?v=5M3j1rVk_cE,Anti-inflammatory Celery contains anti-inflammatory compounds that may help with pain and inflammation from conditions like ...,32,,,
Ginger shots or Celery Juices -  🤔 Are They Really for Everyone?,Z1Kjr7H167k,Chinese Herbal Pantry- Shirley Dr Chinese Medicine,2025-03-06T17:14:01Z,https://www.youtube.com/watch?v=Z1Kjr7H167k,Ginger shots & celery juice—still trending! And honestly? It frustrates me. I've talked about this so many times. If you've been ...,43,,,
1.Carrot Celery juice. Morning juice for your good health #juice#shortvideo#shorts #celeryjuice#asmr,7KKytY43WI4,Life of SP,2025-01-09T08:51:45Z,https://www.youtube.com/watch?v=7KKytY43WI4,1.Carrot Celery juice.. Morning juice for your good health #juice#shortvideo#shorts #celeryjuice#carrotjuice#asmr @LifeofSPR.,50,,,
Celery Juice Blend| So good|Green Juice| Pineapple| #asmr #pour #calming #greenjuice #cleanse #detox,06wJEXUTfuc,GRACIOUSLYCEE,2025-01-06T19:27:43Z,https://www.youtube.com/watch?v=06wJEXUTfuc,Green Juice for glowing skin.,16,466,5,0
one day at a time 💚🍋✨ #weightlossjourney #morningroutine #aesthetic #shortsviral #celeryjuice,54nRYugSl0k,anitakartistry ,2025-03-14T02:32:49Z,https://www.youtube.com/watch?v=54nRYugSl0k,,12,,,
"Beat bloating & boost digestion with this juice! 🥒🍍🍊 Celery, beets, ginger = gut love! 💛✨",MqF7Ufr-msA,Lynn Nessa,2025-02-28T20:30:03Z,https://www.youtube.com/watch?v=MqF7Ufr-msA,"Beat bloating and boost digestion with this refreshing juice! ❤️   Celery reduces bloating, beets detox your liver, and ginger ...",20,,,
Celestial Celery Juice #shorts,SBYDVgczsWY,ChefPratt,2025-01-11T19:24:01Z,https://www.youtube.com/watch?v=SBYDVgczsWY,,40,,,
Celery juice is a natural electrolyte! 💗,ju57VW6Gu7k,Heather Ann Pearl,2025-01-05T18:05:54Z,https://www.youtube.com/watch?v=ju57VW6Gu7k,,15,,,
Celery juice and blueberry smoothie,jaCSIuOipzU,Jessie Jade ,2025-01-25T10:42:21Z,https://www.youtube.com/watch?v=jaCSIuOipzU,,17,,,
Celery juice day 3 #juice #shorts #juicing,P7KF876wg4Q,Micah Althea,2025-03-20T18:33:43Z,https://www.youtube.com/watch?v=P7KF876wg4Q,,14,,,
Why Celery Might Be Your Secret Health Weapon,x6YFbs843Hg,Kennedydigo,2025-03-15T02:00:44Z,https://www.youtube.com/watch?v=x6YFbs843Hg,Unlock the hidden benefits of celery today! Add it to your diet and feel the difference! #CeleryBenefits #HealthySnacks ...,30,,,
How can a celery smoothie burn your belly fat?,yLPxj2WZRZo,Healthy Living,2025-03-09T21:48:53Z,https://www.youtube.com/watch?v=yLPxj2WZRZo,Learn how a celery smoothie can help burn belly fat in this informative video. Discover the benefits of this healthy drink for weight ...,45,,,
Celery Juice for Maximum Health Benefits,2JCKSxRFIgo,WELLNESS LIRA,2025-01-01T00:39:47Z,https://www.youtube.com/watch?v=2JCKSxRFIgo,"""Discover the amazing health benefits of celery juice! From detoxifying your body to boosting digestion and glowing skin, learn ...",55,,,
Day 7 Fruit Detox Carrot Apple Celery Juice,ITO0tHMvXTE,Napps and Nurture,2025-02-14T13:00:47Z,https://www.youtube.com/watch?v=ITO0tHMvXTE,,15,,,
Breakfast mashedpotatoe at sweet potato mixed at celery juice,IlSrGG9CFOE,Carmena Bantulo,2025-02-09T05:43:10Z,https://www.youtube.com/watch?v=IlSrGG9CFOE,,15,,,
Celery & Lemon Juice! A Magic Drink for Detox & Energy! #shorts #celery #lemon #juice #health,J0o45H_2q6U,Fruit & Veggie,2025-03-15T17:28:46Z,https://www.youtube.com/watch?v=J0o45H_2q6U,,37,,,
Celery Juice Hype or Healthy Must-Have? #celeryjuice #celery,3ugBKQoyl08,Bite Sized Health In Plain English,2025-01-23T12:00:04Z,https://www.youtube.com/watch?v=3ugBKQoyl08,Discover the buzz surrounding celery juice! This vibrant green drink is not only refreshing but also loaded with essential nutrients ...,24,,,
Why drink celery juice instead of $5 coffee?,Tob1rpleNKY,Marefat,2025-02-24T03:09:15Z,https://www.youtube.com/watch?v=Tob1rpleNKY,"Oh no, not the celery juice guy again! How is it always about his $5 celery sticks? What about other drinks?",40,,,
"""Celery Juice: 10 Amazing Benefits You Need to Know! 🌿🥤""",os-mDszz1HE,Jyenation,2025-03-12T04:52:29Z,https://www.youtube.com/watch?v=os-mDszz1HE,,47,,,
You Won't Believe The HEALTH Benefits of Celery Juice #Celeryjuice #Healthyjuice #healthybeginnings,cpYhBPeoSb8,Health Now,2025-03-10T12:30:39Z,https://www.youtube.com/watch?v=cpYhBPeoSb8,"Good health is key to a successful life. Health Now channel offers health tips, natural remedies, home remedies to all your health ...",46,,,
New Year Drink #celery #orangejuice #shorts,05SlKixQ638,xila,2025-01-01T21:37:10Z,https://www.youtube.com/watch?v=05SlKixQ638,,27,,,
Celery mixed with carrot and apple is good for you 👍 😋 #fyp #juice #fypyoutube,ZoLPCGSW1dw,Loveth Universe,2025-03-07T18:52:04Z,https://www.youtube.com/watch?v=ZoLPCGSW1dw,,55,,,
Healthy juice #kabayanabroad #dubai #ofw #blender #celeryjuice #yummy #healthy #harabas #indonesia,UUd5xol4MT0, Pandoy Dela Cruz ,2025-03-04T06:08:55Z,https://www.youtube.com/watch?v=UUd5xol4MT0,,33,,,
Starting the morning with celery juice,a8IUpackeD4,AggressiveByNature,2025-01-25T14:20:32Z,https://www.youtube.com/watch?v=a8IUpackeD4,,24,,,
Feeling amazing with natural remedies #juicer #celeryjuice,IaW_kQFN0qY,Friends Forever,2025-02-26T02:00:10Z,https://www.youtube.com/watch?v=IaW_kQFN0qY,Boosting gut health naturally with celery juice #juicer #celeryjuice #guthealth #fok.,14,,,
Boost your day with celery juice,RCgRtZvPSxc,FoodBoost,2025-03-28T02:45:04Z,https://www.youtube.com/watch?v=RCgRtZvPSxc,Discover the benefits of celery juice #fok.,18,,,
Celery Green Apple And Lemon Juice / Savana isla,mJeHy9GzjRw,Savana isla,2025-02-09T06:00:28Z,https://www.youtube.com/watch?v=mJeHy9GzjRw,"Hey everyone! let's make refreshing drink Celery Green Apple And lemon Juice.it's simple,it's delicious, and it gives you that ...",83,,,
5 minutes me Banaye Healthy Lauki Ka juice|Benifits Of Bottle Gurd Juice#shorts#juice@QuickNEasy15,g7EaEGTXfBk,Quick N Easy  • 100k views • 10  days,2025-01-17T08:30:25Z,https://www.youtube.com/watch?v=g7EaEGTXfBk,5 minutes me Banaye Healthy Lauki Ka juice|Benifits Of Bottle Gurd Juice#shorts#juice​⁠@QuickNEasy lauki ke juice ke fayde ...,55,,,
4 Best Juices to Eliminate Bloating & Improve Digestion! #improvedigestion #guthealing #celeryjuice,sVYdFOwLkSQ,Vita Rose Wellness,2025-03-02T22:33:01Z,https://www.youtube.com/watch?v=sVYdFOwLkSQ,,16,,,
#celeryjuice #antiinflammation  #celery #ginger #pepper #turmeric #lemonjuice - 3 min food hack,-BRi3EzXjoY,PlatesBliss ,2025-02-20T18:37:54Z,https://www.youtube.com/watch?v=-BRi3EzXjoY,,11,,,
"Celery, Green Apple, and Cucumber Juice. Delicious!  #juicerecipes",Pe3vYYHJe6s,Losing To Win,2025-01-18T20:19:30Z,https://www.youtube.com/watch?v=Pe3vYYHJe6s,"Try Our Refreshing Celery, Green Apple, and Cucumber Juice Blend. Simply Delicious!",22,,,
Pineapple cucumber celery juice fruit and vegetable juice new way to eat pineapple fruit and veg,ahE-0ed5WnE,Li Hailong,2025-03-25T10:07:07Z,https://www.youtube.com/watch?v=ahE-0ed5WnE,Pineapple cucumber celery juice fruit and vegetable juice new way to eat pineapple fruit and veg.,78,,,
Detox drink No : 2 Healthy homegrown celery and carrot juice#weightloss#gardeningaustralia#viralvide,UEMV9MlRICA,Samnvi Stories ,2025-01-21T06:04:04Z,https://www.youtube.com/watch?v=UEMV9MlRICA,,42,,,
"You asked, we blended it. #Hiblendr #CommentToSmoothie #TikTokMadeMeBlendIt #AppleCelerySmoothie",u2KNhCFch20,HiBlendr Official,2025-03-26T05:00:43Z,https://www.youtube.com/watch?v=u2KNhCFch20,"You asked, we blended it. Tried the apple, celery, lemon, chia smoothie—and it actually slaps. Refreshing, light, and easy with ...",42,,,
Suffering from These Issues? Try These Juices!,cPYBp4dh4vM,Doctor Cures,2025-02-18T14:38:36Z,https://www.youtube.com/watch?v=cPYBp4dh4vM,Suffering from These Issues? Try These Juices! 12 Juices That Fix Your Health Naturally! Stop relying on pills when nature ...,39,,,
Celery juice anyone?,t8ElhEdHXz8,Mental Health Dietitians,2025-02-25T10:00:58Z,https://www.youtube.com/watch?v=t8ElhEdHXz8,,18,,,
Live to 110 - Life force breakfast juice - organic celery lemon cucumber apples parsley carrots,4F7cvLsstNo,Demita Avery,2025-01-07T20:41:44Z,https://www.youtube.com/watch?v=4F7cvLsstNo,Salvestrols research them they build immunity and make cells healthy - they're found on the skin of organic berries fruits and ...,118,,,
INSTANT Morning Detox Juice 🍏 (Doctors Love This!) #shorts  #juicer #celeryjuice #detoxjuice #fiber,Kazh9qnXssA,Bhavani Boppana Vlogs,2025-01-15T13:46:01Z,https://www.youtube.com/watch?v=Kazh9qnXssA,POWERFUL Morning Detox Juice Recipe Green Apple + Celery = Natural Body Reset ✨ Benefits: - Boosts Energy - Supports ...,145,,,
Fresh Pressed Juice!! #freshjuice #freshpressed #freshproducts #freshpressedjuice #celeryjuice,xTAg-EyKk8E,ItsKayMarie,2025-02-27T17:22:58Z,https://www.youtube.com/watch?v=xTAg-EyKk8E,,53,,,
Juice class 102--banana/ beet/ celery juice-Epi4 #health,G_-Xf_bW9hg,1SuccessMindset,2025-03-24T11:44:14Z,https://www.youtube.com/watch?v=G_-Xf_bW9hg,,,,,
Celery juice time!! it’s been a while since we’ve been in our kitchen!,cL3Bv1Bb5zM,Lauren Hefez,2025-03-18T13:00:56Z,https://www.youtube.com/watch?v=cL3Bv1Bb5zM,juice #juicing #celeryjuice #greenjuice.,109,,,
The Amazing Benefits of Eating Celery Every Day!,vnFoP5vGeC8,Todicamp - Health Explained,2025-03-07T21:30:07Z,https://www.youtube.com/watch?v=vnFoP5vGeC8,"Celery isn't just crunchy water—it's a biochemical powerhouse that detoxifies, heals your gut, and even lowers inflammation at the ...",52,,,
Juicing trend: master celery juice with blender,48aK7xun52c,Brandi Baker,2025-03-23T02:19:00Z,https://www.youtube.com/watch?v=48aK7xun52c,Sip to success: celery juice tips #celeryjuice #juicingwithablender #fok.,13,,,
The Truth About Celery Juice and Chronic Illness - Medical Medium,ztL7JH6dC-M,Release & Heal Chronic Illness,2025-02-07T15:17:45Z,https://www.youtube.com/watch?v=ztL7JH6dC-M,"Celery Juice became a worldwide trend and everyone was more or less forced to try this out. If it didn't work for your healing, then ...",81,,,
BATCH JUICING AND MEAL PREPPING #coldpressedjuice #wellnessforlife #kuvingsjuicer,GdYis8ZNuhw,GlowBeautyWellness,2025-03-13T17:34:05Z,https://www.youtube.com/watch?v=GdYis8ZNuhw,"My name is Shakera Leigh Rivers - welcome to my channel when health, wellness, beauty & glamour meet! I create health ...",114,,,
🍋#juicingrecipes #rawdiet #coldpressjuice #celeryjuice #blackvegans #alkalinevegan #shawdy #chitown,5-pIJnCWS_Y,Shawdy Ah’Star,2025-03-10T10:12:12Z,https://www.youtube.com/watch?v=5-pIJnCWS_Y,,8,,,
#celery #apple #juice #organic #ofwlife #shortsvideo #healthiswealth @JackyandFamilysvlog1990,lbqqaYjUcS4,Jacky and Family’s vlog,2025-01-20T13:32:29Z,https://www.youtube.com/watch?v=lbqqaYjUcS4,,12,,,
A morning without celery juice #juicingrecipes #celeryjuice #medicalmedium ￼,Y9t1ZMhhPAY,Stephanie Klotz - Morning Cleanse,2025-03-03T15:42:10Z,https://www.youtube.com/watch?v=Y9t1ZMhhPAY,,39,,,
Benefits of celery Juice #celeryjuice #celery,GYjuZ1YyClI,OpulentEchoess,2025-01-04T22:16:47Z,https://www.youtube.com/watch?v=GYjuZ1YyClI,Benefits of celery juice #celery #celeryjuice #greenjuice.,108,,,
🎤 Mic’d Up – My Unfiltered Thoughts on Celery 🥬💸“ #Cooking  #HomeChef  #CookingFails #besthomecook,cA78qm_CXEY,Errold J Brown,2025-01-29T03:44:33Z,https://www.youtube.com/watch?v=cA78qm_CXEY,,37,,,
Celery Juice & Banana Stem Juice– Ultimate Detox Drinks! 🥒🍌✨ #shorts #detox #guthealth #thejoyfulmix,_UJHvo18L-4,TheJoyfulMix,2025-02-09T10:30:13Z,https://www.youtube.com/watch?v=_UJHvo18L-4,Celery Juice & Banana Stem Juice– Ultimate Detox Drinks! ✨ Boost your health with these refreshing and detoxifying juices!,24,,,
KUVINGS AUTO 10 JUICER CANT EFFECTIVELY JUICE CELERY?,VayBFucGmcw,GlowBeautyWellness,2025-02-24T15:00:03Z,https://www.youtube.com/watch?v=VayBFucGmcw,Www.GlowBeautyWellness.com.,22,,,
#shorts #organic #hydroponics   Refreshing celery juice #healthyfood #healthyharvest,S4HXR1vVtss,Indoor Harvest Farms,2025-02-21T05:28:14Z,https://www.youtube.com/watch?v=S4HXR1vVtss,Shop now from our online store: https://indoorharvestfarms.com/,26,,,
Celery juice #shorts,B8ZQqnfESqo,Bawarchi Connoisseur,2025-01-12T17:00:18Z,https://www.youtube.com/watch?v=B8ZQqnfESqo,,46,,,
Celery juice health benefits #celeryjuice,8fIeLCXj4L4,DXN UK Bitcoin Satoshi,2025-03-29T03:09:52Z,https://www.youtube.com/watch?v=8fIeLCXj4L4,Celery juice health benefits.drink celery juice.detoxify.,48,,,
First-time celery juice attempters react #celeryjuicechallenge,bvJdQwFlOGo,Shakil Liya,2025-03-01T13:00:52Z,https://www.youtube.com/watch?v=bvJdQwFlOGo,Trying celery juice for the first time #celeryjuicechallenge #notinamillionyears #fok.,13,,,
Celery juice benefits 😁😁😁,6bVkU5AEpgw,YATHAVI & Lathu,2025-01-11T21:16:42Z,https://www.youtube.com/watch?v=6bVkU5AEpgw,,28,,,
Celery Cucumber And Lemon Juice |Savana isla,6dlSsn292Eo,Savana isla,2025-03-16T06:00:05Z,https://www.youtube.com/watch?v=6dlSsn292Eo,"Looking for a refreshing drink? Try our cucumber, celery and lemon juice. It's perfect for when you need a little boost or simply ...",69,,,
"celery, ginger, carrot, pineapple juice for my health",n3NKGYDN3DA,Snowvanila,2025-03-11T01:58:16Z,https://www.youtube.com/watch?v=n3NKGYDN3DA,,18,,,
WHAT IS CELERY STICKS & HOW TO CUTTING CELERY #chefraza #food #celeryjuice #celery #ytshort,whe9j884QPM,Chef Ram Chandra Kitchen ,2025-02-28T12:04:00Z,https://www.youtube.com/watch?v=whe9j884QPM,WHAT IS CELERY STICKS & HOW TO CUTTING CELERY #chefraza #food #celeryjuice #celery #ytshort ...,57,,,
Have you had your celery juice today ? #celeryjuicechallenge #celeryjuice #morning #stayhealthy,to2xt7A7pEs,Sylvia,2025-01-19T14:16:41Z,https://www.youtube.com/watch?v=to2xt7A7pEs,Have you had your celery juice this morning?,19,,,
Health Benefits of Celery Juice!,1w7d5behhZQ,Kailey,2025-01-20T01:50:19Z,https://www.youtube.com/watch?v=1w7d5behhZQ,,24,,,
西芹汁在體內的作用 how celery juice  works in the body,E7p4TpKb9AI,Heal To Love 朵媽的健康諮詢,2025-03-02T11:56:21Z,https://www.youtube.com/watch?v=E7p4TpKb9AI,"All the copyright belongs to Anthony William, Medical Medium® 版權屬於醫療靈媒Anthony William, Medical Medium®",106,,,
Start your day the right way Celery juice-gut health. #path2wellnessbyamandasheppard #dailywellness,I81VMn-UI6Y,Amanda Sheppard,2025-02-28T05:14:39Z,https://www.youtube.com/watch?v=I81VMn-UI6Y,,19,,,
Morning Ritual Magic 💚,OL-9HLqWwpU,Lucy K Lifestyle,2025-02-27T14:09:49Z,https://www.youtube.com/watch?v=OL-9HLqWwpU,Drink at least 16 ounces of pure celery juice daily on an empty stomach for maximum benefits. ✓Celery juice is most powerful ...,14,,,
"Boost your skin with celery juice for a clear, healthy glow #clearskin",IYT3Kn5XW_M,Alex Martinez,2025-03-28T16:42:41Z,https://www.youtube.com/watch?v=IYT3Kn5XW_M,Clear skin routine with celery juice #clearskin #acneproneskin #cleanse #fok.,140,,,
"Thank you for making yourself happy and healthy! I appreciate you. 💗 Thank you, @breville! 💗",AtZZWhKwhKc,Heather Ann Pearl,2025-02-10T15:53:53Z,https://www.youtube.com/watch?v=AtZZWhKwhKc,,16,,,
"Carrots,cucumber, and celery juice..try it guys for the good benefits of your body. #video #trend",pXVT9ScO2VI,opinionPHtv,2025-02-22T02:43:59Z,https://www.youtube.com/watch?v=pXVT9ScO2VI,,43,,,
"Carrots,cucumber, and celery juice..try it guys for the good benefits of your body. #video #trend",pXVT9ScO2VI,opinionPHtv,2025-02-22T02:43:59Z,https://www.youtube.com/watch?v=pXVT9ScO2VI,,43,,,
30-day juice fast starts with Celery Juice. #celeryjuice,SPkHc2w_uJE,Elleoventh Hour,2025-02-04T02:49:29Z,https://www.youtube.com/watch?v=SPkHc2w_uJE,,60,,,
Celery Juice,JIlQaTU4E68,Swing stronger,2025-03-12T21:00:13Z,https://www.youtube.com/watch?v=JIlQaTU4E68,"I try to drink celery juice everyday. It's not only a low-calorie, hydrating drink but also a nutrient-packed addition to your diet.",23,,,
"#shorts #cooking #food   Celery, Cucumber,  ginger and orange. Try this Juice for gut cleansing.",OtdnG_JWFHA,Everything Food And Life with JT,2025-03-01T04:39:20Z,https://www.youtube.com/watch?v=OtdnG_JWFHA,"shorts #cooking #food #celeryjuice #cucumber Celery, Cucumber, ginger and orange. Try this Juice for gut cleansing.",59,,,
"Green juice boost: celery, ginger, cucumber, apple #fitness #gym",ewBdwod-DOI,Kai Souza Carvalho,2025-03-02T16:45:02Z,https://www.youtube.com/watch?v=ewBdwod-DOI,"Green juice boost: celery, ginger, cucumber, apple #fitness #gym #juice #juicing #fok.",39,,,
Ginger Pear Carrot Celery Juice,fh7qW3C_PeU,Organixx,2025-01-09T20:18:25Z,https://www.youtube.com/watch?v=fh7qW3C_PeU,"If you love fresh juices, this Ginger Pear Carrot Celery Juice is for you! Add even more vitamins, minerals, and antioxidants with a ...",176,,,
Juice Info in Description  #juicegoals,hSo_gJcwp7Q,Project Wright Juicing,2025-01-21T13:00:57Z,https://www.youtube.com/watch?v=hSo_gJcwp7Q,"Juice 1: ""Carrots, pineapple, and red apples—aka the sweet trio you didn't know you needed! Juice 2: ""Pineapple ...",60,,,
Grew Our Own Preworkout #beets #celeryjuice,xzKgwCDuVbA,Lankford Jackson,2025-03-18T11:16:49Z,https://www.youtube.com/watch?v=xzKgwCDuVbA,,57,,,
Let's Go ☺️💪🥕 Carrot Celery Juice #asmr #yummy#healthy#healthyfood#healthiswealth,fjlxJaSCuAc,smiling face channel 😊,2025-03-29T02:15:33Z,https://www.youtube.com/watch?v=fjlxJaSCuAc,,181,,,
Citrus Celery Amla Detox Juice | Boost Immunity & Glow Naturally #juicerecipes #shortsindia #natural,tMD86NpSNaI,GoodGulps,2025-01-24T01:46:00Z,https://www.youtube.com/watch?v=tMD86NpSNaI,"Looking for the ultimate detox drink? Try this Citrus Celery Amla Juice, a perfect blend of hydration, immunity-boosting Vitamin C, ...",31,,,
Routine #celeryjuice #celerytime #healthyfood #trendingshorts #youtubeshorts #fyp,JfUwy5FvzbQ,Joana Grace Benigno,2025-02-07T10:00:45Z,https://www.youtube.com/watch?v=JfUwy5FvzbQ,,62,,,
Importance of fruits to our body. Did you know this about juices? #youtubeshorts #naturalremedies,2pBLStBe5vs,Thee Nutritionist ,2025-03-26T23:00:02Z,https://www.youtube.com/watch?v=2pBLStBe5vs,Juices to have around the house.,43,,,
10 Amazing Health Benefits of Celery! 🥬💚 #CeleryJuice #HealthTips #Guthealth,x1iqHjPcSfU,Vita Rose Wellness,2025-02-24T04:33:57Z,https://www.youtube.com/watch?v=x1iqHjPcSfU,,14,,,
Celery juice body cleansing,uOV8rlxodJI,QueensJES,2025-02-10T02:29:12Z,https://www.youtube.com/watch?v=uOV8rlxodJI,,4,,,
HOW I MAKE OZEMPIC IN A BOTTLE #viralshorts #celeryjuice #weightloss,PrlR5n6dHwQ,ewuresia,2025-01-20T17:18:42Z,https://www.youtube.com/watch?v=PrlR5n6dHwQ,,35,,,
