Title,Video ID,Channel,Published At,URL,Description,Video Length,Views,Likes,Comments
March for cancer survivors 2025 #cancerawareness #cancer #5k #running,lPXie_xaR3Q,The A And L Squad,2025-03-08T14:56:12Z,https://www.youtube.com/watch?v=lPXie_xaR3Q,,6,382,26,2
Cervical Cancer Awareness Camp | #trending #doctor ₹yt shorts,EgRZ_Bf16ds,Dr.N.R.Swathi Sai,2025-02-03T09:16:22Z,https://www.youtube.com/watch?v=EgRZ_Bf16ds,Cervical cancer is common cancer in women #doctor #education #trending.,55,385,40,3
Cancer Myths vs Facts ⚠️#CancerAwareness #CancerFreeIndia #HealthFirst #StayHealthy #MythVsFacts,tzcxR6wSxTo,Ashish Gupta,2025-02-27T13:32:16Z,https://www.youtube.com/watch?v=tzcxR6wSxTo,,42,349,13,1
Breast Cancer Awareness | Gaanth Pe Dhyan | Tata Trusts,Lk-jzbxSf7U,Tata Trusts,2025-02-05T12:30:20Z,https://www.youtube.com/watch?v=Lk-jzbxSf7U,"Knowledge can save lives, which is why Gaanth Pe Dhyan is more than just a health podcast—it's a conversation about all things ...",64,357,4,1
How to Prepare for Your Marathon Run? | K10K Cancer Awareness Run | 2nd February | Kauvery Hospital,q_9eIkRwtkk,Kauvery Hospital,2025-01-23T08:30:17Z,https://www.youtube.com/watch?v=q_9eIkRwtkk,"www.kauveryhospital.com The countdown is on! ⏳ Get ready for the K10K Cancer Awareness Run happening on February 2nd, ...",54,361,16,0
Cervical Cancer Awareness Video,vx4gcIGRssA,Neuberg Diagnostics,2025-02-04T10:03:47Z,https://www.youtube.com/watch?v=vx4gcIGRssA,"Cervical cancer doesn't have to be a silent threat. Dr. Ramya N. (Senior Consultant Pathologist & HOD of Histopathology, ...",55,413,4,0
Cervical Cancer Awareness #womenshealth #cancerawareness #cervicalcancer,uNy98SjjACI,IBC Mangai,2025-01-29T04:30:32Z,https://www.youtube.com/watch?v=uNy98SjjACI,"Cervical Cancer Awareness #womenshealth #cancerawareness #cervicalcancer --------------------------- IBC MANGAI For Queries, ...",49,343,7,0
Regency Healthcare | Ovarian Cancer Awareness Month,mvHpgNxoIkw,Regency Health,2025-03-15T05:00:40Z,https://www.youtube.com/watch?v=mvHpgNxoIkw,"Running to the washroom more than usual? Feeling bloated for no reason? Bestie, it's not just extra coffee or a heavy lunch—your ...",55,421,10,0
#lungcancer #bladdercancer #cancer #cancerrisk #chemicalexposure #cancerawareness #shorts,uYUvqSITCtw,Sakshi Life,2025-02-14T14:01:14Z,https://www.youtube.com/watch?v=uYUvqSITCtw,Health Risks of Smoking Tobacco | Shorts | Dr. Rajesh | Sakshi Life Asian Institute of Nephrology and Urology (AINU) is a ...,57,326,7,0
Cancer Awareness Run,juEgEaLyzYQ,Thamizhil Naan,2025-02-02T04:09:40Z,https://www.youtube.com/watch?v=juEgEaLyzYQ,besantnagar #cancerawarenessrun #kauveryhospital #health #sunday #vibes #fitness #fitnessmotivation #motivational ...,46,327,6,0
Colorectal Cancer Awareness Month | Tufts Medicine,Vz1RSuE8_c4,Tufts Medical Center,2025-03-18T19:53:33Z,https://www.youtube.com/watch?v=Vz1RSuE8_c4,"Join Dr. Lilian Chen for a walkthrough of a giant, inflatable model of a colon and learn why colonoscopies are a critical tool in ...",40,348,6,0
Cancer Awareness Walkathon with Actress Gautami | Prathima Foundation | World Cancer Day 2025,rGO3Sowk1Ws,Prathima Foundation,2025-02-02T04:34:30Z,https://www.youtube.com/watch?v=rGO3Sowk1Ws,"Join Prathima Foundation on 4th February 2025 for a Cancer Awareness Programme at Kaloji Kalakshetram, Hanumakonda, ...",13,419,23,0
Cancer Awareness,Myb9OfWvDXg,Max Lab ,2025-02-10T10:58:49Z,https://www.youtube.com/watch?v=Myb9OfWvDXg,"We rush for everything, but when was the last time you rushed to get screened? This Cancer Day, make time for timely screenings.",25,57,153,0
Be Breast Aware | Breast Cancer Awareness | Gayatri Bhargavi's NAVARASA Podcast Episode 12 Promo,HzTJ7-SxQl4,Gayatri Bhargavi Podcast,2025-01-15T13:54:43Z,https://www.youtube.com/watch?v=HzTJ7-SxQl4,A stage for an exclusively 'Cancer Awareness' program 'Let women be victorious' Planned & executed by Dr. Geetha Nagasree ...,71,307,7,0
Cervical Cancer Awareness Month 2025: Decoding Cervical Cancer With Dr Poonam Behal,1hh14Kv0Wqk,Medical Dialogues,2025-01-08T12:17:19Z,https://www.youtube.com/watch?v=1hh14Kv0Wqk,"cervicalcancer #cervicalcancerawareness #cervical January is observed as Cervical Cancer Awareness Month, a time dedicated ...",192,301,11,0
Rise in Light x Chioma May Odiakosa | Cervical Cancer Awareness PSA,79wlUlbdf4k,Rise in Light,2025-01-28T23:22:38Z,https://www.youtube.com/watch?v=79wlUlbdf4k,"This powerful PSA featuring Chioma May Odiakosa sheds light on the urgent need for cervical cancer awareness, prevention, and ...",236,280,9,4
#cancer #awareness #goasyoulike #shorts,Sywm2nFMtQw,Bhraman Sangi,2025-02-15T15:05:47Z,https://www.youtube.com/watch?v=Sywm2nFMtQw,,37,320,3,0
Breast Cancer Awareness: What You Need to Know About Symptoms and Risks #breastcancerawareness,CQk7HcMgc2s,Dr. Rajeev Ranjan Gupta : Health Tips,2025-02-18T08:30:05Z,https://www.youtube.com/watch?v=CQk7HcMgc2s,"Breast Cancer Awareness: What You Need to Know About Symptoms and Risks . ·Video Description In this informative video, ...",180,268,19,4
Fire Fighter Cancer Awareness,5uzO-K-VIHg,ALEXIS RAMIREZ,2025-01-22T22:08:38Z,https://www.youtube.com/watch?v=5uzO-K-VIHg,,206,254,4,0
19/31 10k a day for colon cancer awareness 🩵💙 #dayinmylife #colorectalcancer #fightcrc #runner,CH77zE9dcTM,Laura-Jean Bainbridge,2025-03-25T18:12:01Z,https://www.youtube.com/watch?v=CH77zE9dcTM,,36,262,10,3
CANCER AWARENESS CAMP | IWC | NECHRI | L P SCHOOL Nazirakhat | 2025,A8iKibOFE_c,North East Cancer Hospital And Research Institute,2025-02-24T18:40:52Z,https://www.youtube.com/watch?v=A8iKibOFE_c,"""Educate, Empower, Eradicate: Cancer Awareness for Every Generation"". Cancer Awareness & Health Camp at L.P. School, ...",172,264,31,1
Expert Advice from Dr. Nidhi Goyal on Cervical Cancer Awareness Month,i_D5oHpe5vA,FIMS Hospital,2025-01-09T09:27:52Z,https://www.youtube.com/watch?v=i_D5oHpe5vA,"January is Cervical Cancer Awareness Month At FIMS Hospital, we are dedicated to nurturing life and empowering women with ...",194,252,16,0
"Cervical Cancer Awareness: Symptoms, Causes & Prevention | Dr Mamta Tyagi |",90lU1o2tlIA,DR MAMTA TYAGI - PATIENT GUIDANCE,2025-02-21T09:56:45Z,https://www.youtube.com/watch?v=90lU1o2tlIA,"How to Recognize Cervical Cancer Symptoms Early Cervical cancer can be silent, but your body gives warning signs—don't ...",96,5368,83,2
K10K Cancer Awareness Run | Kauvery Hospital | 2nd February 2025 | Registrations Closing Soon,Z7B35p2_er8,Kauvery Hospital,2025-01-05T08:50:58Z,https://www.youtube.com/watch?v=Z7B35p2_er8,"The Clock is Ticking - Registration Closes January 20th Registration for the K10K Cancer Awareness Run, organized by Kauvery ...",30,242,10,0
Cancer Awareness ||Health Tips ||Prof Dr Ghanashyam Biswas ||Tips YT SHORTS ||Shorts ||Health,dxpA9-XbA2Q,SUSTTHA ODISHA,2025-02-06T16:16:18Z,https://www.youtube.com/watch?v=dxpA9-XbA2Q,youtubeshorts #doctor #advice #healthtips #worldcancerday #awareness #message #theme #cancercare #odiahealthtips ...,61,295,5,0
It's for you Women! Men too #cancervaccine #cancerawareness  #cancer,s8r4hrLvWVY,Facts in Tamizh,2025-03-09T04:11:13Z,https://www.youtube.com/watch?v=s8r4hrLvWVY,cancerawareness #cancervaccine #womensday #womenhealth #cervicalcancerawareness #healthywomen #hpvvirus ...,55,239,11,0
Breast cancer awareness fun Run support. #support #togetherwecan #breastcancerawareness,YmY7tyrb2JQ,Wenny & Max Channel,2025-01-22T01:08:34Z,https://www.youtube.com/watch?v=YmY7tyrb2JQ,,39,216,4,0
💙 Cervical Cancer Awareness – Protect Yourself & Your Daughters,7GfM70Slce4,Grameen Koota Jagruti,2025-03-21T14:30:04Z,https://www.youtube.com/watch?v=7GfM70Slce4,"Cervical cancer is one of the leading health risks for women, but early detection and prevention can save lives! Every 7 minutes, a ...",156,243,9,0
Causes Of Cervical Cancer In Odia ||Cancer Awareness ||YT SHORTS ||Short Video ||Awareness ||Tips ||,FCQA2Fubn_s,SUSTTHA ODISHA,2025-02-10T19:22:17Z,https://www.youtube.com/watch?v=FCQA2Fubn_s,cervicalcancer #awareness #healthtips #doctoradvice #awareness #healtheducation #youtubeshorts #shortvideo #shorts ...,60,286,2,0
"This Cervical Cancer Awareness Month, consult your Pediatrician for the HPV vaccine #MSD #HPV",IN8k4_WcE-0,MSD India,2025-01-25T12:45:33Z,https://www.youtube.com/watch?v=IN8k4_WcE-0,"As parents, every little step you take is to protect her. From the moment she takes her first breath to preparing her for life's ...",90,225,10,0
Full video on channel #podcast #motivation #business #cancer #cancerawareness #bonemarrowaspiration,TjNQUjyI44w,ZingPod by Harish Sharma,2025-01-25T11:46:04Z,https://www.youtube.com/watch?v=TjNQUjyI44w,,16,292,18,0
Patient Testimonial — Colon Cancer Awareness Month at Texas Health Huguley Hospital,JS_OfRiuj4A,Texas Health Huguley Hospital Fort Worth South,2025-03-14T13:24:53Z,https://www.youtube.com/watch?v=JS_OfRiuj4A,Learn more at www.texashealthhuguley.org/cancer.,114,209,0,2
Can diet only cure cancer? #shorts #cancer #cancerawareness,ZhviDV7oE0w,BigOHealth,2025-01-14T15:58:28Z,https://www.youtube.com/watch?v=ZhviDV7oE0w,,51,281,11,0
Make Your #2 Your #1 Priority : Colorectal Cancer Awareness Month,ddLOZz_noh8,Colorectal Cancer Canada,2025-03-01T14:00:46Z,https://www.youtube.com/watch?v=ddLOZz_noh8,"The bathroom: It's where we belt out power ballads, doom-scroll until our legs fall asleep, and have epiphanies in the shower.",57,215,3,0
It’s Raffle Time! Part 2! #cancerbae #cancer #awareness #sneakers #raffles #charity #viralshort #yts,TNqPBs7ZUJs,CancerBae,2025-03-02T09:42:53Z,https://www.youtube.com/watch?v=TNqPBs7ZUJs,,55,201,4,0
Colon Cancer Awareness Month-1 of 3.,wyXHVklyeYs,Kenneth Candido,2025-03-22T22:39:59Z,https://www.youtube.com/watch?v=wyXHVklyeYs,,49,198,15,0
Colerectal Cancer Awareness ||DDODIA ||Promo ||Health Tips ||Awareness Video ||Odiahealthtips ||,tG5pUrewSOo,SUSTTHA ODISHA,2025-03-11T05:19:45Z,https://www.youtube.com/watch?v=tG5pUrewSOo,cancer #colerectal #awareness #symptoms #diagnosis #treatment #prevention #treatment #drdillipmohanty #gastroenterologist ...,43,217,3,0
WHAT IT WAS LIKE DEALING WITH CANCER #dayinmylife #oncology #cancerawareness #doctor #workvlog,rEcHsJnaDsY,A Medic Abroad,2025-03-22T18:59:54Z,https://www.youtube.com/watch?v=rEcHsJnaDsY,,,,,
Help this cancer warrior go viral #unstoppable #cancerjourney #fypage #cancerawareness #cancer,mVkuJjNj4Q8,ALICIA P,2025-02-21T21:14:50Z,https://www.youtube.com/watch?v=mVkuJjNj4Q8,This is what I packed in my hospital bag. What did you pack in yours?,60,188,9,0
"MARCH 2025 COLORECTAL CANCER Awareness Month Department of Gastroenterology JPMC,  Karachi.",BIxXKleorVU,Waqas Salahuddin Qureshi Photographer,2025-03-18T15:17:40Z,https://www.youtube.com/watch?v=BIxXKleorVU,,174,182,15,3
The Breast Cancer Awareness Campaign That Went Horribly Wrong,DeJIdhrnF80,SlimGenius,2025-02-10T17:15:11Z,https://www.youtube.com/watch?v=DeJIdhrnF80,"Breast Cancer Awareness 2025: Every 2 Minutes Counts Every 2 minutes, someone is diagnosed with breast cancer.",28,182,3,0
#cancer #awareness #viral video,Cj2fw4B36hU,VK Life changing fighter,2025-01-23T18:42:26Z,https://www.youtube.com/watch?v=Cj2fw4B36hU,,36,182,29,7
Breast cancer awareness  #rap #tattoodesignideas #tattoo #fyp #explore #trending #youtubeshorts ￼￼,P5_Y4TKv7lA,Ace 647,2025-01-22T00:34:05Z,https://www.youtube.com/watch?v=P5_Y4TKv7lA,,26,207,6,0
Saving Lungs Behind The Chair | Lung Cancer Awareness in Barbershops & Salons,66_XzMMXuCw,Lung Cancer Foundation of America,2025-03-21T01:02:27Z,https://www.youtube.com/watch?v=66_XzMMXuCw,Barbershops and salons are more than places for a fresh cut—they're community hubs where real conversations happen.,133,226,1,0
Embracing Life: A Heartfelt Update on Cancer Awareness,4T5ePDW3b_8,The NFA Network,2025-02-11T15:58:27Z,https://www.youtube.com/watch?v=4T5ePDW3b_8,"Join us as we celebrate positive updates in the battle against cancer. We share heartfelt stories, insights, and the importance of ...",41,163,8,1
Colorectal Cancer Awareness: Early Signs to Watch for This Year | Consult Your Doctor,Vj1IZ_xqsgY,Narayana Health,2025-03-31T05:35:30Z,https://www.youtube.com/watch?v=Vj1IZ_xqsgY,"March is observed as Colorectal Cancer Awareness Month worldwide. With over 150000 new cases expected globally this year, ...",48,574,8,0
"That means 2,041,910 families/couples 🎗️😞 #cancerawareness#cancer#medicine#emotional#overwhelmed",PgFE1lbrMnE,AloJourney<3,2025-03-05T03:53:28Z,https://www.youtube.com/watch?v=PgFE1lbrMnE,,48,162,6,0
"🎥 | Studio Flash ,Raising Awareness | Breast Cancer Awareness Campaign",i5pQPQFc_60,Flash Tasveer,2025-03-10T12:55:22Z,https://www.youtube.com/watch?v=i5pQPQFc_60,"At Studio Flash, we are proud to collaborate with the Emirates Health Services (EHS) to create this impactful Breast Cancer ...",127,170,2,0
Community Engagement Program on Lung Cancer Awareness,JOYqnYFkIxY,Gulf Medical University,2025-01-06T07:33:05Z,https://www.youtube.com/watch?v=JOYqnYFkIxY,"Lung cancer remains a significant global health concern, affecting countless individuals. However, through education, prevention, ...",50,258,9,0
Video: Local ice skating rink helps raise money for cancer awareness,g0sZnoax-5U,FOX23 News Tulsa,2025-02-17T05:14:30Z,https://www.youtube.com/watch?v=g0sZnoax-5U,"The WeStreet Ice Center hosted the 'Skate to Eliminate Cancer' Ice Show, featuring the Tulsa Figure Skating Club.",55,161,5,0
Have you ever tested yourself? January is cervical cancer awareness month. Get tested & Vaccinated.,4W25WeC03k4,صحتكم بالدنيا,2025-01-09T00:04:31Z,https://www.youtube.com/watch?v=4W25WeC03k4,,35,158,25,0
Colorectal Cancer Awareness | Dr. Sumit Sanyal Explains,X2ra3VkMKlQ,Narayana Health,2025-03-24T07:42:51Z,https://www.youtube.com/watch?v=X2ra3VkMKlQ,"During Colorectal Cancer Awareness Month, it's crucial to understand the signs your body might be giving you. In this video, Dr.",44,391,8,0
Inauguration of Alappuzha district 'Arogyam Anandam' - Cancer Awareness & Screening Campaign,Fi1UrQhSOGc,Dr. KM Cherian Institute of Medical Sciences,2025-03-01T14:30:08Z,https://www.youtube.com/watch?v=Fi1UrQhSOGc,Inauguration of Alappuzha district 'Arogyam Anandam' - Cancer Awareness & Screening Campaign at Dr. KM Cherian Institute of ...,130,154,2,0
#cancer awareness video-part3,Kcfnto1hYFI,Kannan&sivashankari,2025-01-26T06:40:06Z,https://www.youtube.com/watch?v=Kcfnto1hYFI,,58,151,2,0
Importance Of Early Detection #cancerawareness #cancer #earlydetection #screening #checkup #survivor,6iRgbxLpC40,Ashish Gupta,2025-03-07T13:29:47Z,https://www.youtube.com/watch?v=6iRgbxLpC40,,22,150,0,0
Cervical Cancer Awareness by Dr Najah Abdul Rehman,gAPrJiPFUJA,Fathima Hospital,2025-01-13T08:13:58Z,https://www.youtube.com/watch?v=gAPrJiPFUJA,Cervical Cancer Awareness by Dr Najah Abdul Rehman.,181,160,1,0
Colorectal Cancer Awareness Month: An Urgent Conversation,ywC4sbgzDVc,FOX 17 WXMI,2025-03-25T02:24:11Z,https://www.youtube.com/watch?v=ywC4sbgzDVc,"March is Colorectal Cancer Awareness Month, prompting discussions that could potentially save a life in the face of a critical ...",223,151,7,0
"4th February, World Cancer Day #cancer#cancerawareness #cancerday #trendingshorts #varunbundela#new",gyaoo0YpBC0,Dil se devotee ,2025-02-03T20:26:00Z,https://www.youtube.com/watch?v=gyaoo0YpBC0,"4th February, World Cancer Day #cancer#cancerawareness #cancerday #trendingshorts #varunbundela#new#tricks ...",24,150,37,3
Colorectal Cancer Awareness Mani 💙🩶,HS9n5t32gNA,Britt's Manis,2025-03-08T02:02:57Z,https://www.youtube.com/watch?v=HS9n5t32gNA,March is Colorectal Cancer Awareness Month! Show your support with a bold mani in the signature color of the month — blue.,23,151,6,5
Breast Cancer Awareness | How To Check Your Brest At Home,zcxCCYT--pw,Sevyam HiiMS JAIPUR,2025-03-29T12:30:59Z,https://www.youtube.com/watch?v=zcxCCYT--pw,"Ladies, apni sehat ka dhyaan rakhna sabse zaroori hai! Breast Cancer ek serious bimari hai, lekin agar ise time par detect kiya ...",63,396,5,0
Cervical Cancer Awareness: Early Detection Saves Lives | Dr. Sewanti Limaye,dIq_-aLH9vU,Sir H. N. Reliance Foundation Hospital,2025-01-10T11:11:56Z,https://www.youtube.com/watch?v=dIq_-aLH9vU,"Cervical cancer can be prevented with regular screenings and early detection. Join Dr. Sewanti Limaye, Director - Medical ...",69,153,4,0
The Silent Killer: Ovarian Cancer Awareness || #mbbs #bams #bhms #nursing #nclex #medical #shorts,KnYJgVvzHRc,Med Mastery,2025-03-19T17:04:39Z,https://www.youtube.com/watch?v=KnYJgVvzHRc,"Unlocking the Truth about Ovarian Cancer** Are you a passionate **nursing student**, or someone in the medical ...",21,160,3,0
"4th FebruaryWorldCancerDay2025,“United by Unique”#worldhealthorganization#cancer#awareness#mindset",BEY6qec2AiQ,Dr. LK Transformative Mindset ,2025-02-04T04:33:23Z,https://www.youtube.com/watch?v=BEY6qec2AiQ,"""United by Unique"" for World Cancer Day 2025: #UnitedByUnique #WorldCancerDay2025 #CloseTheCareGap ...",33,161,30,0
Kamineni Hospitals | 200 Drone Show for Cancer Awareness #cancerawareness,CWPFeuKrg4w,HYBIZTV HD,2025-02-01T12:22:49Z,https://www.youtube.com/watch?v=CWPFeuKrg4w,Kamineni Hospitals | 200 Drone Show for Cancer Awareness #cancerawareness #KamineniHospitals #DroneShow ...,142,136,18,13
Support Breast Cancer Awareness: Our Meaningful Fundraiser,irMhHJDNDeU,Kaedyn Jennings ,2025-03-13T03:19:50Z,https://www.youtube.com/watch?v=irMhHJDNDeU,We share our personal connection to breast cancer awareness and the upcoming fundraiser to support research. Join us as we ...,36,133,3,0
11/31 10km a day for colon cancer awareness month #running #coloncancer #vlog,tCINvU8hQoE,Laura-Jean Bainbridge,2025-03-13T03:55:33Z,https://www.youtube.com/watch?v=tCINvU8hQoE,,6,150,0,3
Breast Cancer Awareness documentary interview at Chelsea Film Festival 🩷,WMR5nM5c5yk,CorbettCLAW Productions,2025-02-18T16:02:59Z,https://www.youtube.com/watch?v=WMR5nM5c5yk,,42,138,26,0
Colorectal Cancer Awareness: Early Detection Saves Lives,JGZGHEUK8uk,Meril,2025-02-04T05:10:05Z,https://www.youtube.com/watch?v=JGZGHEUK8uk,"Colorectal cancer is one of the most common and preventable cancers worldwide. On World Cancer Day, let's spread awareness ...",129,142,3,0
Cancer awareness week #cancer #hospital #education #knowledge,62JI_hLjKW0,अपने गुरु जी ,2025-02-06T06:15:37Z,https://www.youtube.com/watch?v=62JI_hLjKW0,,27,140,2,0
RIPS🖐️#rips #@caring soul foundation #seminar#cancer#awareness#like share#subscribe channel #,ryqMLBazPpM,Lovepreet kaur ,2025-01-31T16:10:27Z,https://www.youtube.com/watch?v=ryqMLBazPpM,,57,134,26,0
Trip Se Cancer Awareness🤯#CancerAwareness #OvercomeFear ##HealthMatters #ViralJourney #Inspiration,3mMzZbJOVBg,Ashish Gupta,2025-01-31T14:45:09Z,https://www.youtube.com/watch?v=3mMzZbJOVBg,,46,127,3,1
Cancer Is Killing!#india #trending #cancer #awareness #amitvashist #shorts,zyoNdYSvadU,Beyond Headlines with Amit Vashist ,2025-03-14T13:55:59Z,https://www.youtube.com/watch?v=zyoNdYSvadU,,40,131,2,0
Thyroid Cancer Awareness | Neck Swelling Signs & Treatment,RzXTovAD6MI,Narayana Health,2025-01-22T12:30:25Z,https://www.youtube.com/watch?v=RzXTovAD6MI,"A neck swelling near the thyroid can be an early sign of thyroid cancer, though it occurs in only 10% of cases. This video ...",40,253,2,0
Cervical Cancer Awareness: Stay Protected with Expert Care from Abhay Vasishtha Hospital,veUf-t25PEY,abhay vasishtha,2025-01-23T11:37:11Z,https://www.youtube.com/watch?v=veUf-t25PEY,Did you know cervical cancer can affect women of all ages? Regular screenings and HPV vaccines are your best defence.,30,126,5,0
#lymphomaawareness 🎗️ #cancer #awareness #fyp #shorts #viralvideo #family #braincancer #tumors,2nNLTPpqZRU,Landon “NJ” Siegle,2025-01-26T20:16:47Z,https://www.youtube.com/watch?v=2nNLTPpqZRU,,43,156,11,12
World Cancer Day #cancer #awareness #school #ballia #jaipuriaballia,N5fV2wnJa58,SETH M.R JAIPURIA SCHOOL BALLIA,2025-02-04T07:59:44Z,https://www.youtube.com/watch?v=N5fV2wnJa58,,58,187,12,0
Best 3D video #animation #biology #neet #Cold drink #cancer #awareness #knowledge #shorts,y43BmqtTw1s,Quiz Gyan 18,2025-02-01T18:41:18Z,https://www.youtube.com/watch?v=y43BmqtTw1s,,47,117,5,0
#cancer awareness part-2,v5F_CtI2064,Kannan&sivashankari,2025-01-22T10:14:05Z,https://www.youtube.com/watch?v=v5F_CtI2064,,61,118,2,3
"""Sarcoma:The Silent Threat""? #health#cancer#cancerawareness#mindset #awareness#knowledge#aiimsdelhi",oM5Qw-d8kdc,Dr. LK Transformative Mindset ,2025-01-06T09:56:09Z,https://www.youtube.com/watch?v=oM5Qw-d8kdc,,60,132,46,0
Cervical Cancer Awareness | Manipal Hospital Vijayawada,ddV_Cnzlxq0,Manipal Hospitals,2025-01-23T08:26:41Z,https://www.youtube.com/watch?v=ddV_Cnzlxq0,"January is Cervical Cancer Awareness Month Cervical cancer is the most common gynaecological cancer in women, affecting ...",37,173,8,0
Cancer k khilaf jung mumbai me huwa awareness program. #mumbai #cancer #awareness #vairalvideo #news,KMYplbiBF_8,newswalalive,2025-01-29T19:21:46Z,https://www.youtube.com/watch?v=KMYplbiBF_8,,60,114,2,0
4 Roles Of TUR BT In Treating Bladder Tumors #DrAnupRamani #TURBT #CancerAwareness #HealthMatters,hBGV5Y_0VeU,Dr. Anup Ramani,2025-02-27T06:06:00Z,https://www.youtube.com/watch?v=hBGV5Y_0VeU,Transurethral Resection of Bladder Tumor (TURBT) is a crucial procedure for bladder cancer management. Here's how it helps: ...,50,204,0,0
Colon Cancer Awareness #coloncancerawareness,zm0udDdZWQA,uvahealth,2025-03-20T14:38:53Z,https://www.youtube.com/watch?v=zm0udDdZWQA,Colon cancer is a leading cause of death from cancer in the U.S. But it doesn't have to be. Colon cancer is highly curable when ...,110,181,4,0
HIV VS CANCER AT THE MOLECULAR LEVEL #hivvirus#hivawareness #cancer#cancerawareness,K9NwYz8pNmw,LAB SCIENCE CHRONICLES,2025-02-12T03:58:40Z,https://www.youtube.com/watch?v=K9NwYz8pNmw,,46,112,1,2
3 SMELLS OF CANCER  YOU SHOULDN'T IGNORE...#Smellsofcancer  #cancersmells #cancerawareness  #cancer,3Tp_8UoCy6o,PROLIFIC HEALTHY INSPIRATIONS ,2025-02-25T07:57:49Z,https://www.youtube.com/watch?v=3Tp_8UoCy6o,,54,600,13,6
Regency Healthcare | Cancer Awareness Month,yUreVhC-6hk,Regency Health,2025-02-19T11:07:38Z,https://www.youtube.com/watch?v=yUreVhC-6hk,"Ignoring your manager can be dangerous, but ignoring the hints of cancer can be even more. That's why, Hint Pakad Yaar!",51,152,6,0
Colorectal Cancer Awareness by Dr. Lubna Kamani,jo_7YvApzYs,Liaquat National Hospital ,2025-03-21T07:29:56Z,https://www.youtube.com/watch?v=jo_7YvApzYs,"Colorectal cancer stands as one of the top 5 cancers worldwide. In this Colorectal Awareness Month, we strongly encourage ...",128,204,3,0
Breast Cancer Awareness During Pregnancy & Lactation,U_dMlLMe6IE,Max Healthcare,2025-03-17T08:30:12Z,https://www.youtube.com/watch?v=U_dMlLMe6IE,Did you know breast cancer can develop during pregnancy and lactation? Many women miss detecting lumps while breastfeeding ...,39,174,3,0
March is Colorectal Cancer Awareness Month 💙 #fyp #foryoupage #cancer #cancersurvivors #awareness,j0zgeW1Ft2g,Becka Harris,2025-03-02T07:52:38Z,https://www.youtube.com/watch?v=j0zgeW1Ft2g,,36,106,3,0
Cancer Awareness | Black church leaders and Community Champions in NW London,tfAkwgOTs80,WNTCG COMMUNITY,2025-01-10T14:02:40Z,https://www.youtube.com/watch?v=tfAkwgOTs80,NTCG Willesden have always been interested in the health and wellbeing of our members and friends. So much so that we run an ...,134,118,1,0
"Tiens Bangladesh stands next to the Breast Cancer Awareness Program January 22 , 2025.",yWmQRCIKdXo,Tiens Bangladesh,2025-01-28T05:05:59Z,https://www.youtube.com/watch?v=yWmQRCIKdXo,Connect & stay with Tiens Bangladesh_all official platforms. Find us on: Facebook: ...,113,119,7,0
Cancer awareness programme #bscnursing #medicomeme #mbbs #medicomemes #explore #medicalcollege #snmc,1vrpJLr7RfQ,Khushiwho,2025-02-04T15:14:55Z,https://www.youtube.com/watch?v=1vrpJLr7RfQ,cancer #cervicalcancer #medical #medicos.,23,123,10,0
Go Team! #kickincancer #cancerawareness #cancercommunity #cancer #oregon #support #subscribe #share,d2jMo_gmfjQ,Kickin' Cancer Productions,2025-02-25T04:37:05Z,https://www.youtube.com/watch?v=d2jMo_gmfjQ,,59,102,10,0
Treatment Depends On Cancer Type ||Health Tips Cancer Awareness ||Odia Health Tips ||Advice ||,sKwUX4_ri30,SUSTTHA ODISHA,2025-02-10T19:10:48Z,https://www.youtube.com/watch?v=sKwUX4_ri30,cancerawareness #healthtips #doctoradvice #oncology #cancerspecialist #cancerhospital #odisha #cancercauses #cancercare ...,112,112,3,0
#cervical cancer awareness #viralshort,TvGjrhybXG4,gynae obs,2025-02-09T19:22:28Z,https://www.youtube.com/watch?v=TvGjrhybXG4,,48,111,2,0
Cervical Cancer Awareness | Dr Arjumand Afaq | CARE Hospitals Nampally,HGF-BSGMYbk,CARE Hospitals,2025-02-28T12:55:45Z,https://www.youtube.com/watch?v=HGF-BSGMYbk,"Known about cervical cancer by Dr Arjumand Afaq, Consultant Gynecologist, CARE Hospitals Nampally. She explains the ...",60,152,10,0
Colon vs. Rectum – What’s the Difference? | Colorectal Cancer Awareness Month | Dr. Ritha Belizaire,qN9XXia757g,Ritha Belizaire,2025-03-16T18:29:03Z,https://www.youtube.com/watch?v=qN9XXia757g,Colon vs. Rectum – What's the Difference? March is Colorectal Cancer Awareness Month - Day 15 The Colon (Large ...,58,135,4,0
World Cancer Day | Cancer Awareness | Dr. Aravind’s IVF,ESv_auopSc0,Dr ARAVIND’S IVF,2025-02-04T07:35:02Z,https://www.youtube.com/watch?v=ESv_auopSc0,About us: Dr. Aravind's IVF Fertility & Pregnancy Centre has been dedicated to providing advanced fertility treatments and ...,12,161,5,0
Echoes Of Expression PT 346 National Colorectal Cancer Awareness Month,jZHggxWsqys,Prince Emagine,2025-03-18T03:35:37Z,https://www.youtube.com/watch?v=jZHggxWsqys,Echoes Of Expression PT 346 National Colorectal Cancer Awareness Month Raising Awareness The Right Way #colorectal ...,17,97,1,0
