Title,Video ID,Channel,Published At,URL,Description,Video Length,Views,Likes,Comments
How To Remove kidneys Stones Naturally In Telugu | Kidney Stone Removal |Medi9 Homeopathy & Ayurveda,wKFcPXI9kb0,Medi9 Homeopathy & Ayurveda - IMS,2025-01-18T07:15:04Z,https://www.youtube.com/watch?v=wKFcPXI9kb0,How To Remove kidneys Stones Naturally In Telugu | Kidney Stone Removal | Medi9 Homeopathy & Ayurveda #medi9 ...,58,,,
How to Cure Common Cold Naturally: Best Remedies to Try,nPZE14MtpvA,1% health Daily,2025-03-19T07:00:27Z,https://www.youtube.com/watch?v=nPZE14MtpvA,"CommonCold, #ColdRemedies, #NaturalHealing, #ImmuneBoost, #HerbalRemedies, #ColdPrevention, #FluCures, #ColdRelief, ...",34,,,
"""Discover the Best Siddha Herb to Cure Ulcers and IBS Naturally! 🌿  #UlcerRelief #IBSCure""",wv31ULeWQ-Q,Siddhayur'shealthcare Dr. Gurugokul baskaran,2025-01-06T10:56:58Z,https://www.youtube.com/watch?v=wv31ULeWQ-Q,"""Looking for natural remedies to cure ulcers? In this short, we explore the best Siddha medicines that can help you heal and ...",40,,,
Best foods to heal a peptic ulcer naturally! #PepticUlcer #GutHealth #HealthyEating,PajjTtCEdB0,Wellness on a plate,2025-02-24T06:49:04Z,https://www.youtube.com/watch?v=PajjTtCEdB0,,18,,,
Heal Knee Arthritis Naturally Discover Regenerative Therapy #shorts,riYvFcZBE7w,mPower Physical Therapy,2025-03-07T14:07:37Z,https://www.youtube.com/watch?v=riYvFcZBE7w,"Discover the revolutionary power of regenerative therapy in healing knee arthritis naturally! In this video, we'll explore the ...",52,,,
Ayurvedic Leech Therapy: Detoxify & Heal Naturally! #shorts,TwXG7Z4YhUM,Dr. Vardhan Ayurveda,2025-01-23T00:30:25Z,https://www.youtube.com/watch?v=TwXG7Z4YhUM,"Discover the healing power of Ayurvedic Leech Therapy, a centuries-old practice known as Jalaukavacharana. This natural ...",33,,,
Best Home Remedies to Cure PCOD Naturally | Vedic Upchar | Anil Bansal | #ayurveda #remedies,US2QsYVQUjE,Vedic Upchar,2025-02-19T13:30:28Z,https://www.youtube.com/watch?v=US2QsYVQUjE,Best Home Remedies to Cure PCOD Naturally | Vedic Upchar | Anil Bansal | #ayurveda #remedies Are you struggling with PCOD ...,16,,,
Top Women’s Health Issues and How to Treat Them Naturally #WomensHealth #PCOS #HormonalHealth #Women,J7z3ctWiNsA,"DR SA RAHMAN'S
Bismillah Unani Clinic",2025-01-27T14:08:24Z,https://www.youtube.com/watch?v=J7z3ctWiNsA,"Women's Health Matters: Causes, Symptoms & Natural Treatments Every woman deserves to feel her best, but common health ...",31,,,
"Natural Remedies For Hand, Foot, And Mouth Disease",JeBDyZ9wkts,Shore Holistic Nutrition and Wellness,2025-01-13T16:34:44Z,https://www.youtube.com/watch?v=JeBDyZ9wkts,"This is for informational purposes only. For medical advice or diagnosis, consult a professional. Hand, Foot, and Mouth Disease ...",26,,,
"Celiac Disease: Symptoms, Causes & How to Heal Your Gut Naturally! 🌾🚫",TKX3nYS05xc,Healthy Uprising,2025-02-17T08:35:57Z,https://www.youtube.com/watch?v=TKX3nYS05xc,"Are you experiencing digestive issues, fatigue, brain fog, or skin problems? It could be Celiac Disease, an autoimmune condition ...",68,,,
cure thyroid problem Naturally हिंदी में | Thyroid treatments |  #thyroidawareness #thyroidproblems,P-BA-CCj634,ChanChan EDU,2025-03-28T14:30:14Z,https://www.youtube.com/watch?v=P-BA-CCj634,cure thyroid problem Naturally हिंदी में | Thyroid treatments | #thyroidawareness #thyroidproblems #thyroidproblems ...,56,,,
WRONG! Antacids cannot cure GERD. #gastroesophagealrefluxdisease #gerd  #gerdtreatment #reels,RY631OxfmjU,DoctorRuchi,2025-02-25T09:25:41Z,https://www.youtube.com/watch?v=RY631OxfmjU,"GERD isn't just heartburn. It's your body's way of saying something's wrong. ⚠️ Antacids may offer quick relief, but they only ...",53,,,
watch your thyroid. #natural #ayurveda #herbal #nosideeffect,vAkJvGEKN88,shivajeeva ayurveda ,2025-02-16T07:30:18Z,https://www.youtube.com/watch?v=vAkJvGEKN88,"Shivajeeva Ayurveda – Natural Thyroid Healing Made Simple! Are thyroid issues affecting your energy, weight, or mood?",51,,,
"How to cure a cold quickly? Natural Cold Remedy | Ginger, Cloves, and Lemon",ix4vRS611PM,PRIORITIZE HEALTH,2025-01-12T21:51:58Z,https://www.youtube.com/watch?v=ix4vRS611PM,"Beat the #Cold Naturally with This Easy #Ginger, #Clove, and #Lemon drink Recipe! Looking for a natural cold remedy?",57,,,
How to cure paralysis Naturally,Vpj7AT7phjE,Healthy Life,2025-01-15T13:20:34Z,https://www.youtube.com/watch?v=Vpj7AT7phjE,Discover the POWERFUL Natural Solution that's Changing Lives! Get ready to say GOODBYE to: Paralysis Parkinson's Multiple ...,47,,,
MEDICINAL PLANTS Can Heal You Naturally?,T7Z_QYvqARE,Right Route Academy,2025-03-31T07:00:24Z,https://www.youtube.com/watch?v=T7Z_QYvqARE,Discover the incredible world of medicinal plants and how they can heal you naturally! From ancient civilizations to modern-day ...,53,,,
"How to Cure PCOS Naturally at Home? Causes, Symptoms, and Natural Treatement | Women Health",-YexmD1gxdE,Sparsh Skin Clinic,2025-02-20T12:48:55Z,https://www.youtube.com/watch?v=-YexmD1gxdE,Breaking PCOD Myths & Embracing Holistic Management! Did you know that PCOD affects women of all shapes and sizes—not ...,130,,,
"Heal Naturally, Glow Naturally with Homoeo #skincare #homoeopathyheals #diseasefree #naturalhealing",38RuS7S_fC0,Dr. Ashifa's Homoeopathy Clinic ,2025-01-03T11:36:57Z,https://www.youtube.com/watch?v=38RuS7S_fC0,"Heal Naturally, Glow Naturally – Treat skin diseases from the root with safe and effective homeopathic remedies! . Visit at ...",31,,,
Heal Your Thyroid Naturally with Constitutional Homeopathy Treatment,FfpD8UB4FZo,Homeocare International,2025-03-29T06:19:05Z,https://www.youtube.com/watch?v=FfpD8UB4FZo,"Struggling with Hypothyroidism, Hyperthyroidism, Hashimoto's Thyroiditis, Goiter, or Graves' Disease? Homeocare International's ...",21,,,
🌿Brain Tapeworm Cured Naturally! Ayurvedic Success Story #panchakarmatherapy #healthylifestyle,qJPeN8ebgzw,Yogtirth Ayurved,2025-02-11T12:26:22Z,https://www.youtube.com/watch?v=qJPeN8ebgzw,Brain Tapeworm Cured Naturally! Ayurvedic Success Story #panchakarmatherapy #healthylifestyle Description: Severe ...,48,,,
Effective Home Remedies For kidney stones | How To Remove Kidney Stones Naturally #ytshorts,fnfnriG2XPU,Socialpost Healthcare,2025-03-07T11:00:56Z,https://www.youtube.com/watch?v=fnfnriG2XPU,healthtipsinenglish #socialposthealthcare #socialposthealth Effective Home Remedies For Kidney Stones | How To Remove ...,39,,,
Heal Naturally with Herbal Medicine! Free Masterclass🌿,ToraEK8Po1Q,Selima & Tami of Iwilla Remedy,2025-02-13T17:36:32Z,https://www.youtube.com/watch?v=ToraEK8Po1Q,Struggling with chronic pain or looking for a natural way to heal? You don't have to rely on pharmaceuticals to feel better. Our free ...,16,,,
Control Hypertension Naturally #viralshorts,ZqD1BNb3-RM,Healthybite,2025-03-19T22:30:16Z,https://www.youtube.com/watch?v=ZqD1BNb3-RM,"Lower your blood pressure naturally with these 5 powerful foods for a healthier heart. Watch more videos, to know the power of ...",10,,,
Cure Fibromyalgia and MCAS Naturally,c8LDbEKan3o,Vince Pitstick,2025-02-14T15:44:11Z,https://www.youtube.com/watch?v=c8LDbEKan3o,"Discover Christina Marie's journey battling immunosenescence, a condition she believes underlies MCAS and fibromyalgia.",28,,,
"""How to Use Jatropha Curcas to Treat Toothache Naturally"" #healthy #healthylifestyle #fruit #shorts",-k0LjgifX14,Okoh Chinenye Harriet,2025-02-03T07:00:00Z,https://www.youtube.com/watch?v=-k0LjgifX14,"""Toothache got you down? In this video, we'll explore the natural remedy of Jatropha curcas for toothache treatment. Learn how to ...",48,,,
